날짜,매체명,검색키워드,기사제목,주요기사 요약,URL,sentiment
2026-07-09 18:33,,포스코인터,"한·몽 에너지협력위 신설…포스코인터, 재생e·히트펌프 몽골시장 진출...",정부 간 에너지협력위원회를 신설하는 한편 포스코인터내셔널도 몽골 현지 기업과 손잡고 히트펌프와 풍력 사업에 진출하며 정상외교를 계기로 민관 협력 모델을 확대한다. 기후에너지환경부는 9일 이재명 대통령의 몽골...,https://www.etnews.com/20260709000388,pos
2026-07-09 18:31,,포스코인터내셔널,"기후부, 몽골과 에너지전환 협력…에너지협력위 신설",이번 국빈방문을 계기로 포스코인터내셔널도 현지 기업 뉴컴(Newcom LLC)과 협력을 확대한다. 포스코인터내셔널은 몽골 에너지부와 협력 양해각서를 체결하고 울란바타르 열병합발전소(CHP-4)의 냉각수 폐열을 고효율...,https://www.newsis.com/view/NISX20260709_0003703032,pos
2026-07-09 18:30,뉴스핌,포스코인터내셔널,한-몽골 에너지 협력 강화…재생에너지 확대 지원사격,◆ 민간기업 진출도 물꼬…포스코인터내셔널 히트펌프 진출 정부간 협력과 함께 민간기업 간 협력도 추진됐다. 포스코인터내셔널이 현지 대표기업 뉴컴(Newcom LLC)과 양해각서를 체결했다. 포스코인터내셔널은 몽골...,https://www.newspim.com/news/view/20260709001243,pos
2026-07-09 18:26,,포스코 노조,2026 건설의 날 은탑산업훈장 ●최상대 대도토건㈜ 대표이사,"또 롯데건설, 포스코이앤씨, HS화성, 협성건설 등으로부터 감사패와 우수 파트너사 표창을 받는 등 시공... 대구·경북 철근콘크리트 대표자협의회 회장으로 지역 건설노조와 상생협력 체계를 구축하는 한편...",https://www.koscaj.com/news/articleView.html?idxno=325212,pos
2026-07-09 18:26,,포스코홀딩스,"[사설] 15년 만의 한몽 정상회담, 자원개발 협력 강화를","포스코홀딩스 장인화 회장과 몽골 MCS그룹 오드잘르갈 회장 등 양국 기업인 300여명이 참석하는 '한·몽 비즈니스 포럼'도 열렸는데, 에너지·유통·소비재·디지털 등 다양한 분야의 민간 차원 경제협력도 기대된다. 안보...",http://www.fnnews.com/news/202607091824502389,pos
2026-07-09 18:18,,포스코 노조,"구조적 한파 맞은 철강업, 포스코 노조 쟁의 가결로 '시름' 깊어져",포스코 대표교섭노조인 한국노총 금속노련 포스코노동조합(이하 포스코노조)은 9일 조합원 투표에서 쟁의행위를 가결했다고 밝혔다. 포스코노조가 8∼9일 올해 단체교섭과 관련한 한 쟁의행위 찬반투표에 조합원 97.1%가...,https://www.newsworks.co.kr/news/articleView.html?idxno=846762,neg
2026-07-09 18:14,,포스코 노조,"건설산업연맹, '상생 협력·원청 교섭'으로 건설산업 살리자","가맹 조직인 플랜트건설노조는 포스코·에스오일·고려아연·SK에너지 등 발주사 4곳, SK에코플랜트, 현대엔지니어링, DL이앤씨 등 종합건설사 11곳에 대한 사용자성 인정을 받았다. 현재 건설노조와 플랜트건설노조는...",https://www.laborplus.co.kr/news/articleView.html?idxno=41122,pos
2026-07-09 18:10,,포스코 노조,[이로운 칼럼]'노동 없는 미래'는 없다...포스코의 이중 경영이 마주한...,포스코는 진정성 있는 자세로 노조와 성의 있는 대화와 타협에 나서야 한다. 더 이상 거짓과 이 같은 허상을 앞세우는 협상 태도로는 이번 쟁의행위를 멈출 수 없다. 포스코는 그 동안 ESG 경영을 입버릇 처럼 천명해 왔다....,https://www.eroun.net/news/articleView.html?idxno=85082,neg
2026-07-09 18:07,,포스코 노조,"포스코 노조, 찬성률 92%로 쟁의행위 가결",포스코 노조는 이번 결과가 물적분할 이후 누적된 현장 노동자들의 강력한 경고라고 주장했다. 철강 부문이 그룹 캐시카우 역할을 하고 있으나 현장 노동자에게는 희생만 강요하고 있다고 비판했다. 노조는 경영위기...,https://biz.chosun.com/industry/company/2026/07/09/VWAB3TXD3FFBLFD554LPBVY6X4/?utm_source=naver&utm_medium=original&utm_campaign=biz,neg
2026-07-09 18:04,메디컬투데이,포스코 노조,"포스코, 파업 위기 고조…노조 쟁의행위 92.2% 찬성","포스코 관계자는 ""노조가 집중교섭을 요구한 것은 맞지만, 임금과 성과급, 복리후생 등 요구안에 대한 충분한 검토가 필요하다""며 ""노사 간 소통을 통해 원만하게 문제를 해결하고, 이번 사안이 철강산업 전반에 영향을...",https://www.mdtoday.co.kr/news/articleView.html?idxno=604301,neg
2026-07-09 18:01,,포스코홀딩스,"李대통령 ""한·몽 황금시대 열어가자""...몽골 대통령 ""중요한 전략적 동...","포럼에는 LS홀딩스 구자은 회장, 포스코홀딩스 장인화 회장, SK 이형희 부회장, LG CNS 현신균 사장, GS리테일 허서홍 대표, 이마트 한채양 대표, BGF리테일 홍정국 부회장, 한화투자증권 장병호 대표, 카카오뱅크 윤호영 대표...",http://www.joseilbo.com/news/news_read.php?uid=571625&class=32&grp=,pos
2026-07-09 18:00,,포스코인터,"에너지공단, 호주 재생에너지 무역사절단 파견…해상풍력 시장 진출 시...","사절단에는 ▲사업개발(포스코인터내셔널) ▲해양·지질·지반·단지조사(해양정보기술) ▲해상풍력 하부구조물(삼일C&S, 현대스틸산업) ▲해상풍력 기초구조물(에드벡트, 은성O&C) ▲풍력 O&M(스펙엔지니어링와이엔피)...",https://www.cnbnews.com/news/articleView.html?idxno=1007630,pos
2026-07-09 17:49,,대미 투자 특별법,정부 '1호 대미투자처' 내달 국회 보고 추진,상업적 합리성 검토 곧 마무리 정부가 미국이 제시한 대미투자 프로젝트 중 '상업적 합리성'을 갖췄다고... 지난달 한미전략투자 특별법이 시행되면서 관련 프로젝트 검토에 속도가 붙은 가운데 조만간 구체적인 윤곽이...,https://www.mk.co.kr/article/12094688,pos
2026-07-09 17:46,,포스코 전기로,[K산업 CFO 열전] 그룹분할·자본재편 주도… 'AI 데이터센터 투자' 설계...,"포스코그룹과 현대제철은 미국 전기로 제철소 건설을 추진하고 있고, 세아그룹은 우주항공 소재 투자에 속도를 내고 있다. 반면 동국제강그룹은 아직 대규모 신사업을 본격화하지 않았다. 다만 제철소 유휴부지를...",https://www.asiatoday.co.kr/kn/view.php?key=20260710010003709,pos
2026-07-09 17:46,아주경제,포스코엠텍,"무안군자원봉사센터, 새마을부녀회와 알루미늄 캔 자원순환 활동 전개","'에코프렌즈 캠페인'은 포스코엠텍과 연계해 폐알루미늄 캔을 수거·재활용하고, 이를 통해 마련된 수익금을 지역사회 나눔기금으로 활용하는 자원순환 사회공헌 프로그램이다. 캔 재활용을 통해 자원 낭비를 줄이는...",https://www.ajunews.com/view/20260709173637442,pos
2026-07-09 17:43,,포스코홀딩스,'체결 문건만 21건'…몽골서도 빛난 이재명 대통령 실용외교,"한국에서 구자은 LS홀딩스 회장, 장인화 포스코홀딩스 회장, 이형희 SK 부회장 등이 참석했다. 최근 몽골에서는 한류 열풍이 지속 중이다. 한국 기업들에 다양한 사업 협력 기회를 제공할 수 있는 요소다. 코트라(KOTRA...",https://www.mt.co.kr/politics/2026/07/09/2026070915401567896,pos
2026-07-09 17:40,,광양 LNG,SK이노베이션 ‘3대 메가 프로젝트’ 타고 전력·ESS 날개 편다,"정유·화학 중심이던 SK이노베이션은 2024년 SK E&S와 합병하며 LNG 직도입·발전 사업에 진출했고, 파주·광양·여주 등에 발전소를 보유하고 있다. 2022년에는 미국 SMR 선도기업인 테라파워 지분을 취득하며 원전...",https://www.sedaily.com/article/20065906?ref=naver,pos
2026-07-09 17:40,,포스코 노조,"포스코노조, 쟁의행위 가결…찬성률 92.2%","포스코노조는 지난 8일부터 이틀간 2026년 단체교섭 관련 쟁의행위 찬반투표를 진행한 결과 투표율 97.1%, 투표 조합원 찬성률 92.2%로 쟁의행위가 가결됐다고 9일 밝혔다. 노조는 이번 투표 결과가 물적분할 이후 누적된 현장...",https://www.shinailbo.co.kr/news/articleView.html?idxno=5039433,neg
2026-07-09 17:40,,포스코 노조,"포스코노조, 쟁의행위 '찬성 92.2%'…""회사 바로 세우기""",포스코노동조합(포스코노조)은 올해 임금 및 단체협약(임단협) 교섭과 관련한 쟁의행위 찬반투표가 조합원들의 압도적인 찬성으로 가결됐다고 9일 밝혔다. 노조에 따르면 지난 8일부터 9일까지 실시한 투표에는 전체...,https://www.newsis.com/view/NISX20260709_0003703269,neg
2026-07-09 17:38,,포스코 노조,"포스코노조, 쟁의행위 가결…파업 기로에",포스코노조에 따르면 어제(8일)부터 이틀 동안 벌어진 찬반 투표에 조합원 97.1%가 참여했고 찬성률은 92.2%로 집계됐습니다. 포스코 노사는 지난달(6월) 12일 상견례 이후 세 차례 교섭을 벌였지만 접점을 찾지 못했는데...,https://www.tbc.co.kr/news/view?pno=20260709144037AE02161&id=208242,neg
2026-07-09 17:36,물류신문,광양 LNG,"""공급망 위기에 해운·선원 안보적 가치 재조명""","그는 LNG선과 컨테이너선 등의 신조 발주가 확대되는 상황에서 정책적으로 국적 해기사 육성에 힘쓰지 않을... 여수광양항만공사, 울산항만공사, 한국해양진흥공사 한국해양수산연수원, 해양환경공단, 장금상선, 고려해운...",https://www.klnews.co.kr/news/articleView.html?idxno=321834,pos
2026-07-09 17:34,,포스코 노조,"포스코노조, 조합원 투표서 92% 찬성으로 쟁의행위 가결",포스코 대표교섭노조인 한국노총 금속노련 포스코노동조합(포스코노조)은 9일 조합원 투표에서 쟁의행위를 가결했다고 밝혔다. 포스코노조가 8∼9일 올해 단체교섭과 관련한 한 쟁의행위 찬반투표에 조합원 97.1%가...,https://news.tvchosun.com/site/data/html_dir/2026/07/09/2026070990285.html,neg
2026-07-09 17:30,CEO스코어데일리,포스코 전기로,본업은 ‘적자 늪’인데 美 9조 베팅…현대제철의 위험한 외줄타기,"현대제철은 포스코와 함께 미국 루이지애나주에 전기로 일관제철소를 지을 계획이다. 합작법인 ‘HYUNDAI-POSCO Louisiana Steel LLC(HPLS)’의 지분은 현대제철이 50%, 포스코가 20%, 현대차와 기아가 각각 15%를 보유 중이다. 연산...",https://www.ceoscoredaily.com/page/view/2026070910415429543,neg
2026-07-09 17:26,,포스코인터,"아이 키우기 좋은 기업, 포스코인터·롯데칠성",아이를 낳고 키우기 가장 좋은 기업은 포스코인터내셔널과 롯데칠성음료였다. 9일 인구 전문 민간 싱크탱크 한반도미래인구연구원(한반도연)은 이 같은 내용의 ‘2026 인구 위기대응 우수기업 평가 결과’를...,https://www.hankyung.com/article/2026070961921,pos
2026-07-09 17:13,디지털타임스,포스코스틸리온,"“저품질 수입 자재 막아라”…KCC글라스 등 건자재 업계, 인증 제도 강...","철강 업계의 동국씨엠, KG스틸, 포스코스틸리온, 세아씨엠 등은 올해부터 컬러강판 등 제품 후면에 제조사와 제품명, 원산지(Made in Korea)를 선명히 표기하는 롤마킹 정책을 시행하며 국산 제품의 신뢰도를 높이고 있다....",https://www.dt.co.kr/article/12072127?ref=naver,pos
2026-07-09 17:08,,미얀마 LNG,참세상 인터링크 위클리 (2026.07.09),"액화천연가스(LNG) 운반선이 발사체에 맞아 화재가 발생했으며, 영국 해군 산하 해사무역기구(UKMTO)가... 미얀마 접경 교전 격화…방글라데시, 로힝야 유입 우려tbs news 미얀마 라카인주에서 정부군과 아라칸군(Arakan...",https://newscham.net/articles/116882,neg
2026-07-09 17:06,,포스코홀딩스,"포스코 노조, 쟁의행위 가결… 찬성률 92.2%","특히 사측이 역대급 경영위기를 이유로 고통 분담을 요구하면서도, 지주사인 포스코홀딩스로 상납하는 배당금은 상향하고 그 지급 기준을 공유하지 않는 점을 지적했다. 아울러 사측이 미래 경쟁력을 강조하면서도 인력...",https://www.sisajournal.com/news/articleView.html?idxno=379335,neg
2026-07-09 17:04,,포스코DX,모빌린트 2세대 NPU '레귤러스' 연말 대량 양산 목표,"잠재 고객사로는 LG전자, 포스코DX, 두산로보틱스, 코오롱베니트, 롯데이노베이트, 신세계아이앤씨(I&C), 대동, 인텔리빅스가 꼽힌다. 레귤러스는 17mm×17mm 면적 시스템 온 칩(SoC)이다. 내부는 중앙처리장치(CPU), 비디오...",https://www.thelec.kr/news/articleView.html?idxno=59326,pos
2026-07-09 16:56,뉴스워커,포스코엠텍,"무안군자원봉사센터, '알루미늄 캔 순환활동' 펼쳤다","'에코프렌즈 캠페인'은 포스코엠텍과 연계해 버려지는 알루미늄 캔을 모아 재활용하고, 수거량을 나눔기금으로 조성해 지역사회에 환원하는 자원 선순환형 사회공헌 활동이다. 이번 활동은 단순한 재활용을 넘어 지역...",http://www.newsworker.co.kr/news/articleView.html?idxno=435641,pos
2026-07-09 16:51,이데일리,포스코인터,MSCI 정기 리뷰 한 달 앞으로…편출입 후보에 쏠린 눈,"반면 편출 가능성이 높은 종목으로는 LG디스플레이(034220), 유한양행(000100), 포스코인터내셔널(047050), 삼성에피스홀딩스(0126Z0)가 거론된다. 이들 종목은 이날 기준 시총 및 유동 시총 등 두 조건 중 한 조건 이상에...",https://www.edaily.co.kr/news/newspath.asp?newsid=04874086645512880,pos
2026-07-09 16:44,,포스코 전기로,"포스코 AI 데이터센터용 철강 수요 공략 '고삐', 이희근 고부가제품으로...",앞서 포스코는 △차세대 성장 시장용 스테인레스스틸 △신재생 에너지용 고내식 합금도금강판 'PosMAC' △고망간강 △전기로 고급강판 △고기능성 에너지후판 △전력기기용 무방향성 전기강판 △초고강도 경량강판...,https://www.businesspost.co.kr/BP?command=article_view&num=441972,pos
2026-07-09 16:40,,포스코퓨처엠,"철강도시 광양, 이차전지 품고 첨단산업 도약 노린다","또 포스코퓨처엠을 방문해 포스코필바라리튬솔루션, 포스코리튬솔루션, 포스코HY클린메탈 등 이차전지 소재·원료 기업 관계자들과 만나 산업 현안을 공유했다. 이 자리에서는 원료 확보부터 소재 생산, 폐배터리...",https://www.sentv.co.kr/article/view/sentv202607090190,pos
2026-07-09 16:36,,포스코인터내셔널 대우,[코스피 지수선물 옵션] 반도체 선물 강세…SK하이닉스·삼성전자 선두...,"산업재와 소비재에서는 효성중공업, LS ELECTRIC, LS, GS, 현대건설, 대우건설, HMM, 대한항공, 코웨이, 신세계... 이 밖에 두산, 두산밥캣, 크래프톤, 이수페타시스, 레인보우로보틱스, LG, SK, NC, 포스코인터내셔널, 삼성E&A...",https://www.pinpointnews.co.kr/news/articleView.html?idxno=467151,pos
2026-07-09 16:36,뉴스워커,포스코퓨처엠,"박성현 광양시장, '철강 대전환'... 'K-배터리 거점' 통합특별시 지원 요...","이후 포스코퓨처엠으로 자리를 옮겨 포스코필바라리튬솔루션과 포스코리튬솔루션, 포스코HY클린메탈 등 포스코그룹 이차전지 소재·원료 생산기업 관계자들과 간담회를 갖고 원료 확보와 소재 생산, 재활용으로 이어지는...",http://www.newsworker.co.kr/news/articleView.html?idxno=435638,pos
2026-07-09 16:24,,포스코퓨처엠,"전남광주통합특별시, 광양 이차전지 산업현장 방문 사진 공개","또 민형배 전남광주통합특별시장은 같은 날 포스코퓨처엠을 찾아 이차전지 기업인들과 인사를 나누고, 기업인 및 관계자들과 단체사진을 촬영했다. 이와 함께 포스코퓨처엠 사무동 2층 회의실에서 이차전지 기업인들과...",http://www.newsmaker.or.kr/news/articleView.html?idxno=178902,pos
2026-07-09 16:24,,포스코퓨처엠,"박성현 광양시장 ""철강 대전환·K-배터리 육성""…통합특별시에 집중 지...","이후 포스코퓨처엠으로 이동한 방문단은 포스코필바라리튬솔루션, 포스코리튬솔루션, 포스코HY클린메탈 관계자들과 간담회를 열고 원료 확보부터 소재 생산, 재활용까지 이어지는 공급망 구축 현황과 기업들의 애로사항을...",https://www.ppss.kr/news/articleView.html?idxno=301684,pos
2026-07-09 16:21,,대미투자특별법,美 에너지 인프라 투자 본격화에 건설업계 훈풍…DL그룹 밸류체인 주목,국회의 '대미투자특별법' 통과를 계기로 미국을 중심으로 원전과 발전·송배전 등 에너지 인프라 투자가 확대될 것이라는 전망이 나오면서 관련 기업에 대한 시장의 관심도 높아지고 있다. 특히 대형 원전 시공 실적을...,https://www.mt.co.kr/estate/2026/07/09/2026070717455175424,pos
2026-07-09 16:20,,포스코 직고용,"‘무파업 전통’ 깨지나⋯ 포스코 노조, 역대 최고 찬성률로 파업 가결",포스코 노조가 올해 임금 및 단체협약 교섭과 관련한 파업 등 쟁의행위 찬반투표를 압도적 찬성률로... 대규모 직고용이 기존 조합원의 임금·복지 체계에 미칠 영향 분석과 보완책이 없다는 지적이다. 앞서 노조가 직고용...,https://www.viva100.com/article/20260709501280,neg
2026-07-09 16:04,,포스코퓨처엠,[거래소 외국인] 삼성전자 삼성전기 담고 SK하이닉스 KB금융 팔았다,"이와 함께 현대오토에버, 효성중공업, LG화학, 한화시스템, 포스코퓨처엠, 대우건설, S-Oil 등도 매수 상위에 올랐다. 소비재 업종에서는 한국콜마와 신세계를 순매수하며 내수 소비 회복 가능성에도 관심을 보였다....",https://www.pinpointnews.co.kr/news/articleView.html?idxno=467123,pos
2026-07-09 16:04,,광양 LNG,"SK이노, 유가 변동에도 정제마진 지지...LNG·ESS로 AI·반도체 전력 공급...",◆ 광양·파주 LNG 인프라에 SK온 ESS 연계...2031년 그룹 차원 10GW 확보로 전력 수요 선점 SK이노베이션은 자체 발전 자산과 재생에너지 기술을 결합한 '전력 밸류체인 수직계열화'에 속도를 내고 있다. 특히 SK그룹이...,http://www.lkp.news/news/articleView.html?idxno=81725,pos
2026-07-09 16:01,,포스코,"포스코-KB국민은행, 철강산업 상생 위한 '공급망 금융' 지원 나서",포스코가 KB국민은행과 손잡고 철강 비즈니스 생태계 내 고객사를 위한 '공급망 금융(Supply Chain Finance)... 포스코는 9일 서울 포스코센터에서 KB국민은행과 공급망 금융 업무협약(MOU)을 체결했다. 협약식에는 이희근...,http://www.fnnews.com/news/202607091331132562,pos
2026-07-09 16:01,,포스코 노조,"포스코노조, 쟁의행위 찬반투표 가결…찬성률 92.2%",김성호 포스코노조 위원장은 “이번 높은 투표율과 압도적 찬성은 파업을 위한 선택이 아니라 회사를 바로 세우기 위한 현장의 절박한 목소리”라며 “조합원들은 회사를 떠나고 싶은 것이 아니라 자부심을 갖고 오래...,https://www.mydaily.co.kr/page/view/2026070916001407326,neg
2026-07-09 16:01,,포스코,"KB국민은행, 포스코와 'K-철강 공급망 상생을 위한 업무협약'",KB국민은행이 9일 포스코와 'K-철강 공급망 상생을 위한 업무협약'을 체결했다고 밝혔다. 지난 3월 KB국민은행이 포스코 공급망 협력사 선정 입찰에서 우선협상대상자로 선정됨에 따라 마련됐다. 두 회사는 연내 '포스코...,http://www.fnnews.com/news/202607091344024231,pos
2026-07-09 16:01,,포스코,"포스코, KB국민은행과 공급망 금융 ‘맞손’",포스코(POSCO홀딩스(005490))가 KB국민은행과 함께 철강 비즈니스 생태계 내 고객사들을 위한 ‘공급망 금융’... 포스코는 서울 포스코센터에서 KB국민은행과 공급망 금융 업무협약(MOU)을 체결했다고 9일 밝혔다. 협약식에는...,https://www.sedaily.com/article/20065660?ref=naver,pos
2026-07-09 16:01,,포스코,"포스코·KB국민은행, 철강업 생태계 상생 위한 ‘공급망 금융’ 체계 구...",포스코가 KB국민은행과 손잡고 철강 산업 생태계 내 기업과 상생을 위한 ‘공급망 금융’ 서비스를 도입한다. 포스코는 9일 서울 강남구 포스코센터에서 KB국민은행과 공급망 금융 업무협약(MOU)을 체결했다고 밝혔다....,https://www.khan.co.kr/article/202607091601001,pos
2026-07-09 15:57,,포스코 노조,"포스코노조, 92% 찬성으로 쟁의행위 가결… “지주사 배당 기준 공개”...",투표율 97.1% 역대급 참여 “캐시카우 철강에 희생 강요” “파업 목적은 아냐” 선 그어 포스코노동조합이 92%란 압도적인 찬성률로 쟁의행위를 가결시켰다. 노조측은 철강 불황 속에서 지속적인 고통 분담을 요구받은...,https://www.mk.co.kr/article/12094479,neg
2026-07-09 15:56,,포스코 노조,"포스코노조, 쟁의행위 가결…조합원 투표 92% 찬성",김성호 포스코노조 위원장은 “대화를 통한 문제 해결을 최우선으로 하겠지만 회사가 끝내 현장 목소리를 외면하면 모든 책임을 져야 할 것”이라고 밝혔다. 사측은 “합리적이고 원만한 합의점을 도출할 수 있도록...,https://www.sedaily.com/article/20065833?ref=naver,neg
2026-07-09 15:56,,포스코 노조,"포스코노동조합, 쟁의행위 찬성률 92.2%…파업 위기 달해","포스코노조는 8~9일 실시한 2026년 임금 및 단체협약 관련 쟁의행위 찬반투표에서 투표율 97.1%, 투표 조합원 기준 찬성률 92.2%로 쟁의행위를 가결했다고 9일 밝혔다. 앞서 포스코 노사는 지난달 12일 상견례를 진행한 이후...",http://www.srtimes.kr/news/articleView.html?idxno=207175,neg
2026-07-09 15:54,,포스코인터내셔널,유연근무제 ‘그림의 떡’... 기업 35%는 이용자 ‘0명’,"종합 1위는 82.3점을 받은 포스코인터내셔널이 차지했다. 이어 롯데칠성음료(81.3점), KB증권·롯데웰푸드(79.2점) 등이 상위권에 올랐다. 특히 SK증권(291위→53위), 롯데하이마트(244위→11위), 호텔롯데(226위→5위) 등은...",https://m.skyedaily.com/news_view.html?ID=307566,pos
2026-07-09 15:54,,포스코 노조,포스코노조 쟁의행위 가결…교섭 향배 '현장 신뢰'에 달렸다,포스코노동조합은 9일 노조가 진행한 2026년 단체교섭 관련 쟁의행위 찬반투표에 조합원 97.1%가 참여했으며 92.2%가 찬성하면서 쟁의행위 안건이 가결됐다고 이날 밝혔다. 노조는 이번 결과를 단순한 파업 준비 절차로 보지...,https://www.m-i.kr/news/articleView.html?idxno=1390041,neg
2026-07-09 15:52,,대미 투자 특별법,"대미 투자 1호는 원전? ""120조 미 원전시장 정조준""",합리성 등에 근거해 대미 투자 선정에 속도를 내고 있다. 지난달 한미전략투자법(대미투자 특별법)이 시행된 이후 한미전략투자공사가 출범했고 한미전략투자사업관리위원회에서는 대미 투자 프로젝트를 검토하고 있다.,https://www.mt.co.kr/economy/2026/07/09/2026070915343878549,pos
2026-07-09 15:52,,포스코인터내셔널,"특구재단, 특구기업 글로벌 실증 확대 지원","참여 대기업은 기아, 메르세데스-벤츠, 삼성바이오로직스, 삼성SDS, 오라클, 월트디즈니컴퍼니, 카카오모빌리티, 포스코인터내셔널, 한화시스템, 현대건설, LG AI 연구원, SK이노베이션 등이다. 투자기관은...",https://www.hankyung.com/article/202607094867h,pos
2026-07-09 15:52,,포스코인터내셔널,"에너지공단, 호주 재생에너지 무역사절단 파견","이번 무역사절단에 참여한 국내기업은 △사업개발(포스코인터내셔널) △해양·지질·지반·단지조사(해양정보기술) △해상풍력 하부구조물(삼일C&S, 현대스틸산업) △해상풍력 기초구조물(에드벡트, 은성O&C) △풍력 O&M...",https://www.todayenergy.kr/news/articleView.html?idxno=300172,pos
2026-07-09 15:48,,포스코,폭염 녹이는 상생의 그늘막… 포스코 포항제철소의 선제적 안전 행보,◇ 선제적 물품 지원과 상생 체계 고온의 설비가 밀집해 있어 여름철 철저한 현장 관리가 요구되는 제철소 현장에서 포스코 포항제철소가 선제적인 폭염 대응 체계를 가동해 주목받고 있다. 포항제철소는 본격적인 폭염이...,http://www.enewstoday.co.kr/news/articleView.html?idxno=2447269,pos
2026-07-09 15:48,아시아경제,포스코 노조,"포스코노조, 쟁의행위 찬반 투표 가결…92% 찬성",포스코 대표교섭노조인 한국노총 금속노련 포스코노동조합(포스코노조)이 9일 올해 임금 및 단체협약 교섭과 관련한 쟁의행위 찬반투표를 가결했다. 포스코노조에 따르면 지난 8~9일 실시한 쟁의행위 찬반투표에는...,https://view.asiae.co.kr/article/2026070915483781397,neg
