날짜,매체명,검색키워드,기사제목,주요기사 요약,URL,sentiment
2026-03-11 09:30,,포스코인터내셔널,"인천스타트업파크, 공공·민간 협력파트너와 스타트업 꿈 실현에 앞장",이어 3월 18일부터 모집하는 'TRYOUT 민간 실증사업'에는 셀트리온·기아·포스코인터내셔널·SSG랜더스 등 기존 협력사 외에 호반건설·카카오모빌리티·SK에코플랜트가 새롭게 합류해 총 14개 민간 대기업이 참여한다....,https://www.joongdo.co.kr/web/view.php?key=20260311010003403,pos
2026-03-11 09:26,비즈니스코리아,포스코인터내셔널,인천스타트업파크 TRYOUT 공공·민간 실증사업 기업 모집,"3월 18일부터 모집하는 'TRYOUT 민간 실증 사업'은 셀트리온, 기아, 포스코인터내셔널, SSG랜더스 등 기존 협력사 외 호반건설, 카카오모빌리티, SK에코플랜트가 새로운 협력파트너로 참여, 총 14개 민간대기업과 실증을...",https://www.businesskorea.co.kr/news/articleView.html?idxno=264842,pos
2026-03-11 09:16,,포스코인터내셔널,"희망친구 기아대책-포스코인터내셔널, 참여형 사회공헌 '임팩트 크루' 출...",국내 최초의 국제구호개발 NGO 희망친구 기아대책(회장 최창남)은 포스코인터내셔널과 함께 임직원의 재능과 전문성을 활용한 참여형 사회공헌 프로그램 '포스코인터내셔널 재능봉사단 임팩트 크루(Impact Crew)' 발대식을...,https://www.ngonews.kr/news/articleView.html?idxno=225964,pos
2026-03-11 09:08,,포스코인터내셔널,"경북도, '청년 무역사관학교' 14기 모집...취업률 92.8% 성과","또 포스코인터내셔널 등 국내 유수의 종합상사와 연계한 체험형 견학, 지역 최대 취업박람회 등 취업 프로그램도 연계 지원합니다. 지난 13년간 862명의 수료생을 배출한 이 과정은 누적 취업률 92.8%를 기록하며 지역...",https://news.bbsi.co.kr/news/articleView.html?idxno=4071302,pos
2026-03-11 09:04,연합뉴스,포스코인터내셔널,"경북도, 청년 무역전문가 양성…교육생 72명 선발","또 포스코인터내셔널 등 국내 종합상사와 연계한 체험형 견학, 지역 최대 취업박람회 참가 등 취업 프로그램을 연계 지원한다. 2013년 시작한 청년 무역사관학교는 13년 동안 862명의 수료생을 배출했으며 누적 취업률이...",https://www.yna.co.kr/view/AKR20260311035300053?input=1195m,pos
2026-03-11 09:04,,포스코인터내셔널,"인천스타트업파크, 공공·민간 협력파트너와 제품 실증...인천공항공사...","18일부터 모집하는 'TRYOUT 민간 실증 사업'은 삼성바이오로직스, 셀트리온, 포스코인터내셔널 등 기존 협력사 외에 호반건설, 카카오모빌리티, SK에코플랜트가 새로운 파트너로 참여한다. 실증 사업은 ▶협력파트너의...",https://www.joongboo.com/news/articleView.html?idxno=363719335,pos
2026-03-11 08:52,,포스코인터내셔널,"“취업률 93%”…경북도, 제14기 무역사관학교 교육생 모집","포스코인터내셔널 등 국내 유수의 종합상사와 연계한 체험형 견학, 지역 최대 취업박람회 등 취업 프로그램도 연계 지원한다. 2013년부터 시작한 청년무역사관학교는 지난 13년 동안 총 862명의 수료생을 배출했으며...",https://www.kmib.co.kr/article/view.asp?arcid=0029509249&code=61121111&cp=nv,pos
2026-03-11 08:44,,포스코,"KB증권 ""포스코퓨처엠 매수 유지… 단기 부진 속 실적 회복 기대""","포스코퓨처엠,KB증권 KB증권은 11일 포스코퓨처엠의 목표주가 28만원을 유지했다. 사진=포스코퓨처엠 KB증권은 11일 포스코퓨처엠에 대한 투자의견 '매수(Buy)'를 유지하고, 목표주가 28만원을 제시했다. 이창민...",https://www.newsclaim.co.kr/news/articleView.html?idxno=3057560,pos
2026-03-11 08:43,뉴스핌,포스코,"[모닝 리포트] 포스코퓨처엠 ""음극재가 반등 모멘텀""…목표가 28만원 유...","KB증권은 11일 포스코퓨처엠에 대해 올해 상반기까지는 전방 수요 부진 영향으로 실적 부진이 이어질... 이창민·김연수 KB증권 연구원은 포스코퓨처엠의 단기 실적 흐름에 대해 ""상반기까지는 실적 부진이 불가피하나...",https://www.newspim.com/news/view/20260311000134,pos
2026-03-11 08:40,,포스코인터,질문에 답하는 엄기천 포스코퓨처엠 대표이사,엄기천 포스코퓨처엠 대표이사가 11일 서울 강남구 코엑스 열린 인터배터리 2026에서 도어스테핑을 하고있다. 2026.03.11 jhope@newsis.com,https://www.newsis.com/view/NISI20260311_0021203645,pos
2026-03-11 08:40,,포스코,질문에 답하는 엄기천 포스코퓨처엠 대표이사,엄기천 포스코퓨처엠 대표이사가 11일 서울 강남구 코엑스 열린 인터배터리 2026에서 도어스테핑을 하고있다. 2026.03.11 jhope@newsis.com,https://www.newsis.com/view/NISI20260311_0021203643,pos
2026-03-11 08:40,,포스코인터,질문에 답하는 엄기천 포스코퓨처엠 대표이사,엄기천 포스코퓨처엠 대표이사가 11일 서울 강남구 코엑스 열린 인터배터리 2026에서 도어스테핑을 하고있다. 2026.03.11 jhope@newsis.com,https://www.newsis.com/view/NISI20260311_0021203642,pos
2026-03-11 08:40,,포스코인터,질문에 답하는 엄기천 포스코퓨처엠 대표이사,엄기천 포스코퓨처엠 대표이사가 11일 서울 강남구 코엑스 열린 인터배터리 2026에서 도어스테핑을 하고있다. 2026.03.11 jhope@newsis.com,https://www.newsis.com/view/NISI20260311_0021203644,pos
2026-03-11 08:40,,포스코인터,질문에 답하는 엄기천 포스코퓨처엠 대표이사,엄기천 포스코퓨처엠 대표이사가 11일 서울 강남구 코엑스 열린 인터배터리 2026에서 도어스테핑을 하고있다. 2026.03.11 jhope@newsis.com,https://www.newsis.com/view/NISI20260311_0021203646,pos
2026-03-11 08:38,,포스코인터내셔널,"한국필립모리스, 양산시와 방류수 수질개선 자율협약","포스코인터내셔널 이연종 인사문화실장은 “임팩트 크루는 임직원들이 가진 재능과 관심, 따뜻한 마음이 모여 지역사회에 긍정적인 변화를 만들어가는 새로운 참여형 사회공헌의 첫걸음”이라며 “각자의 전문성과...",https://www.g-enews.com/view.php?ud=202603110836237968a96f092d0c_1,pos
2026-03-11 08:36,,포스코,"희망친구 기아대책, 포스코인터내셔널과 참여형 사회공헌 ‘임팩트 크루...",희망친구 기아대책이 포스코인터내셔널과 함께 임직원의 재능과 전문성을 바탕으로 참여할 수 있는 사회공헌 프로그램인 ‘포스코인터내셔널 재능봉사단 임팩트 크루’의 발대식을 개최했다. 재능봉사단 ‘임팩트 크루’...,https://www.g-enews.com/view.php?ud=202603110833112279a96f092d0c_1,pos
2026-03-11 08:34,,포스코,"""K배터리 음극재 시대 온다""…포스코퓨처엠 해외 생산 확대",이차전지 소재 기업 포스코퓨처엠이 베트남에 인조흑연 생산법인을 설립하며 배터리 음극재 시장 확대에... DS투자증권은 최근 보고서에서 포스코퓨처엠의 음극재 사업이 중장기적으로 성장 잠재력이 크다며 이른바...,https://www.pinpointnews.co.kr/news/articleView.html?idxno=435708,pos
2026-03-11 08:33,,포스코인터내셔널,경북도 창년무역사관학교 학생 모집,"아울러 포스코인터내셔널 등 국내 유수의 종합상사와 연계한 체험형 견학, 지역 최대 취업박람회 등 취업 프로그램도 연계 지원한다. 2013년부터 시작한 청년무역사관학교는 지난 13년 동안 총 862명의 수료생을...",https://www.kpinews.kr/newsView/1065569447200356,pos
2026-03-11 08:33,,포스코인터내셔널,"경북도, 창년무역사관학교 학생 모집","아울러 포스코인터내셔널 등 국내 유수의 종합상사와 연계한 체험형 견학, 지역 최대 취업박람회 등 취업 프로그램도 연계 지원한다. 2013년부터 시작한 청년무역사관학교는 지난 13년 동안 총 862명의 수료생을...",https://www.kpinews.kr/newsView/1065569447200356,pos
2026-03-11 08:32,,포스코,"[건설 생존전략 2026⑦]포스코이앤씨, '안전·내실'로 재도약 시동…에...",출처=포스코이앤씨 건설업계가 장기화된 건설경기 침체 속에서 생존을 위한 체질 개선에 나서고 있다.... <편집자주> 포스코이앤씨 송치영 사장|포스코이앤씨 포스코이앤씨가 창사 이래 최대 위기를 딛고 2026년을 경영...,http://www.biztribune.co.kr/news/articleView.html?idxno=350186,pos
2026-03-11 08:30,,포스코인터내셔널,"경북도, 제14기 청년 무역사관학교 교육생 모집","아울러 포스코인터내셔널 등 국내 유수의 종합상사와 연계한 체험형 견학, 지역 최대 취업박람회 등 취업 프로그램도 연계 지원한다. 지난 2013년부터 시작한 청년 무역사관학교는 지난 13년 동안 총 862명의 수료생을...",https://www.joongdo.co.kr/web/view.php?key=20260311010003366,pos
2026-03-11 08:22,에너지경제,포스코인터내셔널,"[미-이란 전쟁] 에너지 수급 불안…철강업계, LNG 직도입 발전 서두른다",올해 11월부터는 포스코인터내셔널을 통해 15년 동안 연간 37만톤의 미국산 LNG를 도입한다. 포스코인터내셔널의 LNG 공급망과 광양제철소 인근 LNG터미널을 토대로 그룹 차원의 LNG 수급 대응도 가능하다. 국내 양대...,https://www.ekn.kr/web/view.php?key=20260311023146664,pos
2026-03-11 08:20,,포스코인터내셔널,"경북도, 14기 무역사관학교 교육생 모집…취업률 92.8%","포스코인터내셔널 등 국내 유수의 종합상사와 연계한 체험형 견학, 지역 최대 취업박람회 등 취업 프로그램도 연계 지원한다. 2013년부터 시작한 청년무역사관학교는 지난 13년 동안 총 862명의 수료생을 배출했으며...",https://www.newsis.com/view/NISX20260311_0003543069,pos
2026-03-11 08:18,스트레이트뉴스,포스코인터내셔널,"경북, 실무형 청년 무역인재 양성 '제14기 청년 무역사관학교' 교육생 모...",아울러 포스코인터내셔널 등 국내 유수 종합상사와 연계한 체험형 견학과 지역 최대 규모 취업박람회 참가 등 다양한 취업 연계 프로그램도 지원한다. 2013년 시작된 청년 무역사관학교는 13년간 총 862명의 수료생을...,https://www.straightnews.co.kr/news/articleView.html?idxno=297073,pos
2026-03-11 08:14,,포스코,"포스코 포항제철소, Data-AI 기반 인텔리전트 팩토리 고도화",포스코 포항제철소가 설비 데이터를 기반으로 한 설비 상태 분석 체계를 구축하며 인텔리전트 팩토리 고도화에 속도를 내고 있다. 이번 고도화의 중심에는 포스코가 개발한 '예지정비' 시스템 'PIMS(POSCO Intelligent...,http://www.wsobi.com/news/articleView.html?idxno=306740,pos
2026-03-11 07:58,MTN,포스코인터,"K배터리, 전기차 캐즘 딛고 '돌파구' 찾는다…인터배터리 개막 '디데이...","LG에너지솔루션, 삼성SDI, SK온 인터배터리 2026 전시관.소재사들도 차세대 먹거리에 집중한다. 포스코퓨처엠은 전고체용 양극재와 실리콘 음극재 등의 개발현황과 로드맵을 전시한다. 자율주행 전기차의 주행거리와...",https://news.mtn.co.kr/news-detail/2026031016045896179,pos
2026-03-11 07:56,,포스코,"포스코DX, IT서비스 상장기업 브랜드평판 3월 빅데이터 1위...삼성SDS 뒤...","IT서비스 상장기업 브랜드평판 2026년 3월 빅데이터 분석결과, 1위 포스코DX 2위 삼성SDS 3위 카카오페이... IT서비스 상장기업 브랜드평판 2026년 3월 빅데이터 분석 30위 순위는 포스코DX, 삼성SDS, 카카오페이...",http://www.thebigdata.co.kr/view.php?ud=2026031104215391107d270612f_23,pos
2026-03-11 07:51,이데일리,포스코,"포스코퓨처엠, 상반기 실적 부진 불가피…반등 모멘텀 '음극재'-KB","KB증권은 11일 포스코퓨처엠(003670)에 대해 “상반기까지 실적 부진은 불가피하지만 음극재 신규 수주를 기대한다”며 투자의견 ‘매수’, 목표주가 28만원을 유지했다. 포스코퓨처엠 연간 연결실적 추이 및 전망....",http://www.edaily.co.kr/news/newspath.asp?newsid=02627286645382336,pos
2026-03-11 07:30,이넷뉴스,포스코,"[브랜드평판] 포스코DX, IT서비스 상장기업 3월 1위... 삼성SDS, 카카오페...","IT서비스 상장기업 브랜드평판 2026년 3월 빅데이터 분석결과, 1위 포스코DX 2위 삼성SDS 3위 카카오페이... IT서비스 상장기업 브랜드평판 2026년 3월 빅데이터 분석 30위 순위는 포스코DX, 삼성SDS, 카카오페이...",https://www.enetnews.co.kr/news/articleView.html?idxno=47660,pos
2026-03-11 07:24,,포스코,포스코DX 평판지수 143% 급등…삼성SDS·카카오페이 順,"IT서비스 상장기업 브랜드평판 3월 빅데이터 분석 결과, 포스코DX가 1위를 차지했다. 이어 삼성SDS가... 이번 조사에서 1위를 기록한 포스코DX 브랜드는 참여지수 176만5,070, 미디어지수 126만6,255, 소통지수 166만1...",https://www.pinpointnews.co.kr/news/articleView.html?idxno=435671,pos
2026-03-11 07:00,,포스코인터,[인터배터리 '26] 캐즘 극복 K-배터리…코엑스서 'AI·ESS 혁신' 총출동,"국내 최대 규모 배터리 산업 전시회인 '인터배터리 2026'이 11일 서울 코엑스에서 화려한 막을 올렸다. 이번... ◆포스코퓨처엠·에코프로, 전고체 배터리 소재 현황 공개 배터리의 성능을 좌우하는 소재 기업들의 기술...",https://www.ebn.co.kr/news/articleView.html?idxno=1702025,pos
2026-03-11 06:52,이데일리,포스코,"""포스코 시니어 일자리 500명 채용…민간 일자리 넓히겠다""",포스코는 노인인력개발원의 노인 일자리 사업과 연계한 시범사업을 통해 지난해 시니어 인력 40명을 채용한 데 이어 올해는 400~500명 규모로 확대할 계획이다. HD현대(267250)와 LS(006260)일렉트릭과도 협력 방안을 논의하고...,http://www.edaily.co.kr/news/newspath.asp?newsid=02325526645382336,pos
2026-03-11 06:44,,포스코,[포스코퓨처엠이 일하는 법] 현장 불편을 '폭로'하라…'마주이야기'가 ...,작은 대화가 큰 변화를 만드는 포스코퓨처엠 안전 혁신 현장 중심 소통으로 안전과 효율 모두 잡아 헨리... <편집자 주> 엄기천 포스코퓨처엠 대표이사 [사진=포스코퓨처엠 / 편집=뉴스투데이] [뉴스투데이=이가민 기자]...,https://www.news2day.co.kr/article/20260310500177,pos
2026-03-11 06:01,,포스코인터내셔널,북미 LNG 프로젝트 잇따라 연기… 韓 에너지·건설사도 사업 차질 ‘불...,포스코인터내셔널도 지난 2024년 멕시코 사구아로 에네르지아 LNG 터미널 운영사인 멕시코 퍼시픽과 연간 80만t 규모의 LNG를 20년간 도입하는 장기 계약을 체결했다. 당초 목표는 2024년 FID 절차를 마무리하는...,https://biz.chosun.com/industry/company/2026/03/11/LKDSTNF5GNDMDP3GVR5DBQGNN4/?utm_source=naver&utm_medium=original&utm_campaign=biz,pos
2026-03-11 06:00,아시아경제,포스코인터,"K배터리, ESS·로봇·AI로 불황 뚫는다…인터배터리2026 총출동","전시회인 '인터배터리2026'이 11일 개막해 3일간 코엑스에서 열린다. 이번 행사에는 배터리 3사를 비롯해... 포스코퓨처엠은 울트라 하이니켈 및 미드니켈 양극재, 천연·인조흑연 음극재, 모터코어 등 자율주행과 장거리...",https://view.asiae.co.kr/article/2026031100531573796,pos
2026-03-11 06:00,뉴스1,포스코인터,"""배터리 현재와 미래 한눈에""…'인터배터리 2026' 개막",'K-배터리'의 현재와 미래를 조망하는 '인터배터리 2026'이 11일부터 사흘간 서울 코엑스에서 열린다. 이번... 홍영준 포스코퓨처엠 부사장은 전고체 및 LFP 등 변화하는 시장에 대응한 혁신적 양·음극 소재...,https://www.news1.kr/industry/general-industry/6096759,pos
2026-03-11 06:00,뉴스웨이,포스코인터,EV 넘어 '로봇·AI 심장'으로…국내 최대 배터리 전시회 막 올랐다[인터...,"국내 최대 배터리 전시회 '인터배터리 2026'이 오늘(11일) 막을 올린다. 올해 행사는 로봇과 인공지능(AI)... 포스코퓨처엠, 에코프로, LG화학, 엘앤에프 등은 배터리 안전성 강화와 탈(脫)중국 공급망 구축, 제품...",https://www.newsway.co.kr/news/view?ud=2026030919174529418,pos
2026-03-11 05:01,노컷뉴스,포스코,"포스코, 노란봉투법 '모범사례' 될까…주목되는 이유","가운데, 포스코가 하청 노동조합의 단체교섭 요구에 즉각 응답하며 이목이 쏠리고 있다. 대기업 원청이 교섭을 회피하거나 소송전을 벌이는 대신 절차적 수용을 택한 첫 사례 중 하나로, 포스코가 노란봉투법 안착의...",https://www.nocutnews.co.kr/news/6482700?utm_source=naver&utm_medium=article&utm_campaign=20260311064333,pos
2026-03-11 05:01,노컷뉴스,포스코인터내셔널,"입찰시장 편입되는 재생e…""한전 구매의무 법률에 명시해야""","SK이노베이션, 포스코인터내셔널 등 민간발전사업자 21개사로 총 29개사가 있다. 이들 업체의 사업용발전설비 보유량은 최대 3146만kW에서 최소 119만kW까지 격차가 커 기준치가 '150만kW 이상'으로만 조정돼도 5~6곳의...",https://www.nocutnews.co.kr/news/6482718?utm_source=naver&utm_medium=article&utm_campaign=20260311064235,pos
2026-03-11 05:01,노컷뉴스,포스코,"포스코, 노란봉투법 '모범사례' 될까…주목되는 이유","가운데, 포스코가 하청 노동조합의 단체교섭 요구에 즉각 응답하며 이목이 쏠리고 있다. 대기업 원청이 교섭을 회피하거나 소송전을 벌이는 대신 절차적 수용을 택한 첫 사례 중 하나로, 포스코가 노란봉투법 안착의...",https://www.nocutnews.co.kr/news/6482700?utm_source=naver&utm_medium=article&utm_campaign=20260311050035,pos
2026-03-11 05:01,노컷뉴스,포스코인터내셔널,"입찰시장 편입되는 재생e…""한전 구매의무 법률에 명시해야""","SK이노베이션, 포스코인터내셔널 등 민간발전사업자 21개사로 총 29개사가 있다. 이들 업체의 사업용발전설비 보유량은 최대 3146만kW에서 최소 119만kW까지 격차가 커 기준치가 '150만kW 이상'으로만 조정돼도 5~6곳의...",https://www.nocutnews.co.kr/news/6482718?utm_source=naver&utm_medium=article&utm_campaign=20260311050037,pos
2026-03-11 04:34,동아일보,포스코,"노란봉투법 첫날, 포스코 “하청노조와 협상”… 원청교섭 요구 봇물","‘노란봉투법’(개정 노동조합법) 시행 첫날인 10일 포스코와 쿠팡의 물류 계열사인 쿠팡로지스틱스서비스가... ●노란봉투법 첫날, 포스코-쿠팡 원·하청 교섭 돌입 포스코는 10일 사내 곳곳에 한국노총...",https://www.donga.com/news/Economy/article/all/20260311/133504523/2,pos
2026-03-10 21:04,,포스코,"금속노조, ""포스코에 하청 노동자들과 교섭 촉구""",노란봉투법 시행 첫날을 맞아 금속노조가 포스코에 대해 하청 노동자들의 교섭 요구에 응해 줄 것을 강하게 요구했습니다. 전국금속노조는 오늘(10) 포스코센터 앞에서 기자회견을 열고 지나 2022년 부터 대법원에 의해...,https://ysmbc.co.kr/NewsArticle/1508609,pos
2026-03-10 20:42,,포스코,"노란봉투법 시행 첫날, 하청 노동자 교섭 요구 봇물…포스코·쿠팡로지...",봐야 포스코와 쿠팡의 배송 자회사 쿠팡로지스틱스서비스(CLS)가 하청노조의 교섭에 응하면서 노란봉투법... 10일 포스코는 전국금속노동조합연맹(금속노련)으로부터 단체교섭 요구를 접수했다는 공고문을 게시했다....,https://www.khan.co.kr/article/202603102042005,pos
2026-03-10 20:40,,포스코,"하청 노조 ""포스코·쿠팡·현대모비스에 교섭 요구""","한국노동조합총연맹(한국노총)은 이날 산하 전국금속노동조합연맹(포스코 하청사 노조 34곳 대리), 전국택배산업노동조합이 각각 포스코와 쿠팡로지스틱스서비스(CLS)에 단체교섭 요구 공문을 보냈다고 밝혔다....",https://www.imaeil.com/page/view/2026031019094438678,pos
2026-03-10 20:28,동아일보,포스코,"포스코-쿠팡-현대차…노란봉투법 첫날, 하청노조 원청교섭 요구 봇물","‘노란봉투법’(개정 노동조합법) 시행 첫날인 10일 포스코와 쿠팡의 물류 계열사인 쿠팡로지스틱스서비스가... ● 노란봉투법 첫날, 포스코-쿠팡 원·하청 교섭 돌입 포스코는 10일 사내 곳곳에 한국노총...",https://www.donga.com/news/Society/article/all/20260310/133502426/1,pos
2026-03-10 20:22,KBS,포스코,"‘노란봉투법’ 첫날, 하청노조들 원청에 교섭 요구…쿠팡CLS·포스코, ...","한국노동조합총연맹(한국노총)은 오늘(10일) 산하 전국금속노동조합연맹(포스코 하청사 노조 34곳 대리), 전국택배산업노동조합이 각 포스코와 쿠팡로지스틱스서비스(CLS)에 단체교섭 요구 공문을 보냈다고 밝혔습니다....",https://news.kbs.co.kr/news/pc/view/view.do?ncd=8504640&ref=A,pos
2026-03-10 19:30,,포스코,'현대모비스·포스코' 사용자 책임 강조한 금속노조,"이날 노조는 포스코 본사 앞에서도 기자회견을 열고 교섭을 요구했다. 노조는 ""2022년 7월 대법원 판결부터 지난 1월까지 수많은 판결에서 포스코 사내하청 노동자는 위장 하도급에 불과한 불법파견·불법고용이라는 사실이...",https://www.labortoday.co.kr/news/articleView.html?idxno=233131,neg
2026-03-10 19:30,,포스코,"[개정 노조법 시행 첫날] 포스코·쿠팡CLS·한화오션, 하청노조 '교섭요...",▲ 포스코 개정 노동조합 및 노동관계조정법(노조법) 시행 첫날인 10일 포스코와 쿠팡로지스틱스서비스(CLS)가 하청노조의 교섭요구를 받았다. 한화오션도 교섭요구 사실을 공고했다. 이날 포스코 노사에 따르면 포스코는...,https://www.labortoday.co.kr/news/articleView.html?idxno=233113,pos
2026-03-10 19:12,경인매일,포스코인터내셔널,"인천TP,포스코인터-법무법인 디엘지 미국 진출 맞손",인천테크노파크(인천TP)는 지역 내 유망 디지털 기업의 성공적인 북미 시장 진출을 위해 포스코인터내셔널 미국무역법인 및 법무법인 디엘지(DLG)와 함께 '인천 혁신 기업의 미국 시장 진출 지원을 위한 업무협약'을...,https://www.kmaeil.com/news/articleView.html?idxno=632491,pos
2026-03-10 19:08,경북일보,구동모터코어,"에코프로·포스코퓨처엠, 전고체 배터리 소재로 전기차 캐즘 돌파 나선...",이와 함께 포스코그룹은 직접리튬추출법(DLE·Direct Lithium Extraction) 공정기술과 고체전해질·리튬메탈음극재 등 전고체전지 핵심 소재 개발 현황을 비롯 △포스코인터내셔널의 구동모터코어 및 희토류 영구자석...,https://www.kyongbuk.co.kr/news/articleView.html?idxno=4066519,pos
2026-03-10 18:52,,포스코인터내셔널,"SG, 아스콘 비수기 뚫는 '재건+환경' 쌍끌이 호재에 실적 반등","종합 상사로서 재건 사업의 주축으로 꼽히는 포스코인터내셔널은 최근 주가 급등에 따른 피로감으로 1.04% 하락했다. 아스팔트 플랜트 전문 스페코와 비료 및 농자재 전문 누보, 방산 및 항공 부품사 퍼스텍은 단기 테마성...",https://www.pinpointnews.co.kr/news/articleView.html?idxno=435643,neg
2026-03-10 18:50,뉴스1,포스코,포스코·쿠팡·현대차까지…노란봉투법 첫날 원청 교섭 요구 '봇물'(종합...,"이번 법 시행으로 원청의 사용자 책임 범위가 확대되면서, 포스코·현대자동차·쿠팡·인천공항공사 등 주요... 전국금속노동조합연맹은 포스코 대표이사 앞으로 단체교섭 요구 공문을 보내 원청과의 교섭을 공식...",https://www.news1.kr/economy/employment-labor/6096782,pos
2026-03-10 18:32,,포스코,"금속노조 광주전남지부 ""포스코, 하청노동자 차별 철폐해야""","전국금속노동조합 광주전남지부가 포스코를 향해 하청 노동자에 대한 차별적 처우를 중단하고 단체교섭에 나설 것을 촉구했다. 10일 금속노조 광주전남지부는 서울 강남구 포스코센터 앞에서 기자회견을 열고 ""포스코는...",https://www.namdonews.com/news/articleView.html?idxno=903590,neg
2026-03-10 18:20,,포스코인터,"통신장비 관련주, '봄꽃만개' 빛과전자·옵티코어·쏠리드·오이솔루션...","빛과전자는 광통신 모듈 제조업체로 이동 통신용 광모듈(SFP, QSFP), 초고속 인터넷용 광부품, RF 등을... 피노는 CNGR과 포스코퓨처엠의 합작법인인 'C&P 신소재'의 CNGR 측 지분 29%를 취득하며 전구체 생산 능력을...",http://www.finomy.com/news/articleView.html?idxno=251106,pos
