날짜,매체명,검색키워드,기사제목,주요기사 요약,URL,sentiment
2026-07-20 16:27,뉴스1,포스코,"포스코청암재단, 해외유학 장학생 2명 선발…최대 5년 지원","포스코청암재단은 20일 서울 포스코센터에서 '2026 포스코해외유학장학 증서수여식'을 개최하고, 해외 명문대 박사과정에 진학하는 장학생 2명에게 장학증서를 수여했다고 밝혔다. 포스코해외유학장학은 우수한...",https://www.news1.kr/industry/general-industry/6233108,pos
2026-07-20 16:26,,포스코,"전주 포스코 '더샵 라비온드', 2226세대 승강식 피난기 적용","전주시 기자촌구역 주택재개발정비사업으로 조성되는 포스코(POSCO) '더샵 라비온드'가 총 2,226세대 규모의 공동주택에 승강식 피난기를 설계에 반영해 설치를 진행하면서 초고령사회에 대응한 피난약자 중심의 공동주택...",https://www.datanet.co.kr/news/articleView.html?idxno=213170,pos
2026-07-20 16:24,,포스코퓨처엠,"코스피, 4% 하락 6500선 마감...반도체주 약세","2차전지주 중 삼성SDI(-7.71%), 포스코퓨처엠(-7.32%) 등이 급락했다. 반면 호르무즈 해협 봉쇄 우려가 증폭되며 해운·사료 관련주는 급등했다. STX그린로지스와 고려산업은 상한가로 거래를 마쳤다. 이날...",http://www.issuenbiz.com/news/articleView.html?idxno=77964,neg
2026-07-20 16:24,,포스코이앤씨,LG전자의 건설 B2B 확대…'AI홈 동맹' GS건설 '반사이익'도 커진다,앞서 LG전자는 지난해부터 포스코이앤씨 '더샵'에 씽큐온을 공급해 누적 적용 가구 수 1만 가구를 넘어섰다. 아파트 특화 서비스인 '우리 단지 연결' 적용 가구도 올해 1분기 기준 30만 가구를 돌파했다. 지난 19일에는...,https://www.asiatoday.co.kr/kn/view.php?key=20260720010006947,pos
2026-07-20 16:24,,포스코,"전주 포스코 '더샵 라비온드', 승강식 피난기 적용","전북 전주시 기자촌구역 주택재개발정비사업으로 조성되고 포스코이앤씨가 시공하는 '더샵 라비온드'가... 시공사 포스코이앤씨와 기자촌구역 주택재개발정비사업조합, 설계진이 협의를 거쳐 세대별 피난 동선과 설치...",http://www.koreastocknews.com/news/articleView.html?idxno=119902,pos
2026-07-20 16:22,,포스코,"‘5년간 최대 15만달러 지원’⋯ 포스코청암재단, 첫 해외유학 장학생 ...",포스코청암재단이 해외 명문대 박사과정에 진학하는 국내 인재에게 5년간 최대 15만달러를 지원하는 첫 해외유학 장학생을 배출했다. 재단은 20일 서울 포스코센터에서 ‘2026 포스코해외유학장학 증서수여식’을 개최하고...,https://www.viva100.com/article/20260720501165,pos
2026-07-20 16:14,,포스코퓨처엠,"반도체 쇼크, 코스피 '또 털썩'...삼전닉스 & 조선주 '뚝'","2차전지주 중 LG에너지솔루션(-4.94%), 삼성SDI(-7.71%), 포스코퓨처엠(-7.32%) 등이 급락했다. 자동차주에선 현대차가 6.12%, 기아가 6.48% 각각 급락했다. 조선주에선 삼성중공업(-6.05%), 한화오션(-4.04%), HD현대중공업(-7....",http://www.choicenews.co.kr/news/articleView.html?idxno=168420,pos
2026-07-20 16:08,,광양 LNG,"해수부, 항만 인프라 확충…21조4,000억 원 투자","부산항과 평택당진항, 울산항에는 수소·암모니아 수입·생산·저장시설을 확충하고, 광양항과 포항항에는 LNG 터미널과 부두를 확대한다. 부산·광양·포항·인천 등 주요 항만에는 LNG 벙커링 인프라도 구축할...",http://www.dailylog.co.kr/news/articleView.html?idxno=26637,pos
2026-07-20 16:08,,광양 LNG,"해수부, 항만 인프라 확충·해양수도권 조성 본격화…21조4,000억 원 투자","부산항과 평택당진항, 울산항에는 수소·암모니아 수입·생산·저장시설을 확충하고, 광양항과 포항항에는 LNG 터미널과 부두를 확대한다. 부산·광양·포항·인천 등 주요 항만에는 LNG 벙커링 인프라도 구축할...",http://www.dailylog.co.kr/news/articleView.html?idxno=26637,pos
2026-07-20 16:08,,포스코이앤씨,정비사업부터 LNG·베트남까지···대우건설 '균형 성장' 전략 통했다,"삼성물산, 현대건설, GS건설, DL이앤씨, 포스코이앤씨, IPARK현대산업개발 등 대형 건설사들이 총출동한 만큼 서울 정비사업 시장의 경쟁은 더욱 치열해질 것으로 예상된다. 대우건설의 사업 확장은 국내 주택시장에만...",https://www.smartbizn.com/news/articleView.html?idxno=148906,pos
2026-07-20 16:04,,포스코,"포스코청암재단, 산업·정책 잇는 해외 연구인재 키운다",2026 포스코해외유학장학 장학생 단체사진. 사진=포스코청암재단 제공 매일일보 = 이강민 기자 | 포스코청암재단이 해외 연구 경험을 국내 산업과 정책 현장으로 연결할 차세대 연구자 육성에 나섰다. 포스코청암재단은...,https://www.m-i.kr/news/articleView.html?idxno=1393150,pos
2026-07-20 16:03,,포스코,"포스코청암재단, 첫 해외유학장학생 2명 선발",포스코청암재단이 20일 서울 포스코센터에서 스탠퍼드대학교 박사과정 노이준 학생과 프랑스 파리경제대학교 박사과정 서동웅 학생 등 최종 2명에게 포스코해외유학장학증서를 수여했다고 밝혔다. 포스코해외유학장학은...,https://www.sedaily.com/article/20069536?ref=naver,pos
2026-07-20 15:58,,포스코,"포스코청암재단, 해외 박사과정 장학생 선발…글로벌 인재 육성 본격화",포스코청암재단이 ‘포스코해외유학장학’ 사업을 통해 장학생을 선발하며 미래 국가경쟁력을 이끌 핵심 인재 육성을 본격화했다. 포스코청암재단(이사장 장인화)은 20일 서울 포스코센터에서 ‘2026 포스코해외유학장학...,https://www.kbmaeil.com/article/20260720500619,pos
2026-07-20 15:58,컨슈머타임스,포스코,"포스코청암재단, '2026 해외유학장학' 증서수여식 개최…글로벌 연구인...",2026 포스코해외유학장학 장학생 단체사진. 컨슈머타임스=정용규 기자 | 포스코청암재단이 해외 명문대 박사과정 진학생 2명을 선발하고 최대 5년간 장학금 지원에 나섰다. 포스코청암재단은 20일 서울 포스코센터에서...,https://www.cstimes.com/news/articleView.html?idxno=713975,pos
2026-07-20 15:57,이데일리,포스코,"포스코청암재단, 해외 박사 장학생 2명 선발…최대 5년간 지원",(사진=포스코) 포스코청암재단은 20일 서울 포스코센터에서 ‘2026 포스코해외유학장학 증서수여식’을 열고 해외 명문대 박사과정에 진학하는 장학생 2명에게 장학증서를 수여했다고 밝혔다. 포스코해외유학장학은 우수한...,https://www.edaily.co.kr/news/newspath.asp?newsid=03004486645516488,pos
2026-07-20 15:56,경북일보,포스코,"[사설] 포스코 협력사 상생, 성과공유 모범 모델 되길","포스코그룹이 공정거래위원회와 손잡고 2·3차 협력사까지 포괄하는 상생협력 체계를 구축하기로 했다.... 포스코그룹은 협력사에 대금을 평균 10일 이내 전액 현금성으로 지급하고, 1·2차 협력사도 하위 협력사에 각각 30일...",https://www.kyongbuk.co.kr/news/articleView.html?idxno=4078722,pos
2026-07-20 15:55,,포스코,"포스코청암재단, 2026 포스코해외유학장학 증서수여식 열어",포스코청암재단은 20일 서울 포스코센터에서 '2026 포스코해외유학장학 증서수여식'을 열고 해외 명문대 박사과정에 진학하는 장학생 2명에게 장학증서를 수여했다. 포스코해외유학장학은 우수한 국내 인재들이 경제적...,http://www.fnnews.com/news/202607201551130036,pos
2026-07-20 15:54,,포스코 노조,포스코퓨처엠 광양 양극재 공장 노조 출범…이차전지 현장 조직화 신호...,"포스코퓨처엠 광양 양극재 공장에 노동조합이 설립됐습니다. 한국노총 광양지역지부를 중심으로 출범한 노조는 근로조건 개선과 조합원 권익 보호, 현장 소통 강화를 주요 과제로 제시했습니다. 광양지역 노동계는 이번...",https://news.bbsi.co.kr/news/articleView.html?idxno=4095955,pos
2026-07-20 15:48,아주경제,포스코,"포스코청암재단, 해외 박사과정 지원해 글로벌 인재 키운다","2026 포스코해외유학장학 증서수여식 개최 최종 2명 선정...연간 최대 3만달러씩 5년간 지원 ""앞으로도 우수 인재 위한 환경 조성해 나갈 계획"" 아주경제=신지아 기자 fromjia@ajunews.com 2026 포스코해외유학장학 장학생...",https://www.ajunews.com/view/20260720153359035,pos
2026-07-20 15:47,,포스코,"포스코청암재단, 해외유학장학 증서 수여식…최대 5년 지원",포스코청암재단은 20일 서울 포스코센터에서 '2026 포스코해외유학장학 증서수여식'을 열고 해외 명문대 박사과정에 진학하는 장학생 2명에게 장학증서를 수여했다고 밝혔다. 포스코해외유학장학은 우수한 국내 인재들이...,https://www.mt.co.kr/industry/2026/07/20/2026072015182093761,pos
2026-07-20 15:46,,포스코인터내셔널,"포스코그룹, 핵심 계열사 지분까지 매각…장인화 회장 연임 위해 소액주...",지난 3월 기준 포스코홀딩스의 상장 자회사는 △포스코퓨처엠(보유 지분 58.2%) △포스코스틸리온(56.87%) △포스코인터내셔널(70.71%) △포스코디엑스(65.38%) 등이다. 해당 상장 자회사 보유 지분 중 경영권 확보에 필요한 50...,http://www.fieldnews.kr/news/articleView.html?idxno=30062,pos
2026-07-20 15:46,,포스코,"포스코청암재단, 해외유학장학 증서 수여식…2명 선발",포스코청암재단이 20일 서울 포스코센터에서 '2026 포스코해외유학장학 증서수여식'을 개최하고 해외 명문대 박사과정에 진학하는 장학생 2명에게 장학증서를 수여했다고 밝혔다. 포스코해외유학장학은 우수한...,https://www.etnews.com/20260720000331,pos
2026-07-20 15:44,,포스코,"포스코청암재단, '포스코해외유학장학' 증서 수여식 열어",포스코청암재단(이사장 장인화)이 20일 서울 포스코센터에서 '2026 포스코해외유학장학 증서수여식'을 열었다고 이날 밝혔다. '포스코해외유학장학'은 우수한 국내인재들이 경제적 부담을 덜고 해외유수 대학에서 연구에...,https://www.cnbizm.com/news/articleView.html?idxno=309000,pos
2026-07-20 15:43,아시아경제,포스코,"포스코청암재단, 해외유학장학 출범…첫 장학생 2명 선발",포스코청암재단은 미래 국가경쟁력을 이끌 글로벌 연구인재 육성을 위해 올해 처음 '포스코해외유학장학' 사업을 시작했다. 재단은 20일 서울 포스코센터에서 '2026 포스코해외유학장학 증서수여식'을 열고 해외 명문대...,https://view.asiae.co.kr/article/2026072015431038186,pos
2026-07-20 15:42,데일리한국,포스코,"포스코청암재단, 해외유학장학생 2명 선발","2026 포스코해외유학장학 장학생 단체사진(왼쪽 세번째부터) 스탠포드대학교 박사과정 노이준 장학생, 파리경제대학교 박사과정 서동웅 장학생. 사진=포스코청암재단 제공 포스코청암재단이 서울 포스코센터에서 '2026...",https://daily.hankooki.com/news/articleView.html?idxno=1387267,pos
2026-07-20 15:40,,포스코플로우,"KIFFA, 국제물류기업 경영진 대상 AI 포럼 개최",8일 열린 2주차 포럼에서는 포스코플로우 김기형 그룹장이 ‘AI Native 기반 물류혁신’을 주제로 발표했다. 연세대학교 이경배 미래융합연구원 겸임교수는 ‘Smarter AI for AI’를 주제로 AI 기술과 기업 활용 방향을...,https://www.ksg.co.kr/news/main_newsView.jsp?pNum=147651,pos
2026-07-20 15:40,연합뉴스,POSCO INTERNATIONAL,KOSPI 200 Closing Price List-1,"96,500 DN 3,100 Daewoong 16,010 DN 830 ORION Holdings 25,350 DN 700 SamyangFood 1,053,000 DN 16,000 POSCO INTERNATIONAL 50,600 DN 300 CJ CheilJedang 184,200 DN 600 TaekwangInd 821,000 DN 45,000 (MORE)",https://en.yna.co.kr/view/AEN20260720007700320?input=2106m,pos
2026-07-20 15:38,,포스코,"포스코청암재단, 해외 박사 인재 육성 본격화…유학장학사업 첫 장학생...",사진=포스코청암재단 글로벌 기술 경쟁과 연구 인재 확보 경쟁이 치열해지면서 국내 기업과 재단들이 해외... 포스코청암재단은 20일 서울 포스코센터에서 '2026 포스코해외유학장학 증서수여식'을 열고 해외 명문대...,http://www.thefirstmedia.net/news/articleView.html?idxno=204166,pos
2026-07-20 15:32,,포스코,"포스코청암재단, 해외유학 장학증서 수여...스탠퍼드·파리경제대 진학...",포스코청암재단은 20일 서울 포스코센터에서 '2026 포스코해외유학장학 증서수여식'을 열고 해외 명문 대학 박사과정에 진학 예정인 장학생 2명에게 장학증서를 전달했다고 밝혔다. 이번에 전달된 '포스코해외유학장학'은...,https://www.pointe.co.kr/news/articleView.html?idxno=81997,pos
2026-07-20 15:32,연합뉴스,포스코,"[게시판] 포스코청암재단, 해외 명문대 박사과정 입학생 2명에 장학금",▲ 포스코청암재단은 20일 서울 포스코센터에서 '2026 포스코해외유학장학 증서 수여식'을 열고 해외 명문대 박사과정 입학생 2명에게 장학증서를 수여했다고 밝혔다. '포스코해외유학장학'은 우수한 국내 인재들이...,https://www.yna.co.kr/view/AKR20260720117300003?input=1195m,pos
2026-07-20 15:30,,알래스카 LNG,"260척에 추가⋯ 미·카타르, LNG 발주 랠리에 K-조선 ‘술렁’","미국은 알래스카 LNG 프로젝트와 골든패스, 플라크민, 리오그란데 등 연간 생산능력 9000만톤을 웃도는 대형 LNG 프로젝트를 추진 중이다. 카타르도 노스필드 프로젝트를 통해 생산능력을 2030년까지 연간 1억4200만톤으로...",https://www.viva100.com/article/20260720500797,pos
2026-07-20 15:30,,포스코,"포스코청암재단, '2026 포스코해외유학장학' 장학생 2명 선발",포스코청암재단은 20일 서울 포스코센터에서 '2026 포스코해외유학장학 증서수여식'을 열고 해외 명문대 박사과정에 진학하는 장학생 2명에게 장학증서를 수여했다. 재단은 올해 신설한 해외유학장학사업을 통해 미래...,https://www.dailian.co.kr/news/view/1668818/?sc=Naver,pos
2026-07-20 15:28,,포스코,"포스코청암재단, 해외유학장학사업 본격 시작...장학생 2명 선발","2026 포스코해외유학장학 장학생 단체사진(왼쪽 세번째부터 스탠포드대학교 박사과정 노이준 장학생, 파리경제대학교 박사과정 서동웅 장학생) 포스코청암재단이 해외 명문대 박사과정에 진학하는 우수 인재를 지원하는...",https://www.pinpointnews.co.kr/news/articleView.html?idxno=469776,pos
2026-07-20 15:27,헤럴드경제,포스코,"포스코청암재단, ‘포스코해외유학장학 증서수여식’ 개최…“최대 5년...",포스코청암재단이 서울 포스코센터에서 ‘2026 포스코해외유학장학 증서수여식’을 개최하고 해외 명문대 박사과정에 진학하는 장학생 2명에게 장학증서를 수여했다고 20일 밝혔다. ‘포스코해외유학장학’은 우수한...,https://biz.heraldcorp.com/article/10813907?ref=naver,pos
2026-07-20 15:26,디지털데일리,포스코홀딩스,"철강3사, 불황에도 2분기 실적 '선방' 전망…하반기 회복 기대감",국내 철강 3사(포스코홀딩스·현대제철·동국제강)가 건설 경기 침체와 원가 부담이 이어지는 악조건 속에서도 올해 2분기 실적을 비교적 안정적으로 방어한 것으로 전망된다. 철강 수요 부진이 지속되는 가운데 제품...,https://www.ddaily.co.kr/page/view/2026072015220854684,pos
2026-07-20 15:24,,포스코퓨처엠,'꿈의 배터리' 상용화 성큼…지역 소재·장비기업 개발 속도,포스코퓨처엠도 전고체용 양극재 시장 선점에 나섰다. 일본 완성차 업체와 전고체 배터리용 양극재를 공동 개발하는 한편 미국 팩토리얼을 비롯한 복수의 고객사와 성능 검증을 진행하고 있는 것으로 전해졌다. 또 대구에...,https://www.imaeil.com/page/view/2026072015224735116,pos
2026-07-20 15:24,더페어뉴스,포스코,"미래 국가경쟁력 이끌 글로벌 학자 키운다…포스코청암재단, 해외유학장...",포스코청암재단은 서울 포스코센터에서 2026 포스코해외유학장학 증서수여식을 개최하고 해외 명문 대학 박사과정에 진학하는 장학생들에게 장학증서를 전달했다고 20일 밝혔다. 이번에 첫발을 뗀 포스코해외유학장학은...,https://www.thefairnews.co.kr/news/articleView.html?idxno=82641,pos
2026-07-20 15:18,,포스코,"포스코청암재단, '2026 포스코해외유학장학' 증서수여식 개최···차세대...","포스코청암재단이 '2026 포스코해외유학장학 증서수여식'을 개최하고, 해외 명문대 박사과정에 진학하는 장학생 2명에게 장학 증서를 수여했다고 20일 밝혔다. 올해 새롭게 신설된 '포스코해외유학장학'은 우수한 국내...",http://www.enewstoday.co.kr/news/articleView.html?idxno=2450241,pos
2026-07-20 15:18,,포스코,"여수광양항만공사, 북극항로 대응 위해 포스코플로우·지자체와 협력체...","여수광양항만공사가 북극항로 시대에 대응하고 여수광양항의 에너지 물류 경쟁력 강화를 위해 포스코플로우, 전남광주통합특별시, 광양시와 협력에 나선다. 여수광양항만공사는 16일 YGPA 사옥에서 포스코플로우...",http://www.newsmaker.or.kr/news/articleView.html?idxno=179306,pos
2026-07-20 15:18,,포스코,"전남광주통합특별시·광양시·YGPA·포스코플로우, 북극항로 시대 맞손","전남광주통합특별시는 16일 광양시, 여수광양항만공사, 포스코플로우㈜와 북극항로 활성화와 여수·광양항... 포스코플로우는 포스코그룹의 물류를 전담하는 글로벌 종합물류기업으로 철강과 원료, 제품 운송은 물론...",http://www.newsmaker.or.kr/news/articleView.html?idxno=179288,pos
2026-07-20 14:58,,포스코,"화재에도 안심…포스코이앤씨, 전주 ‘더샵 라비온드’에 승강식 피난기...",포스코이앤씨가 전북 전주시 기자촌구역을 재개발해서 짓는 ‘더샵 라비온드’에 고령자/어린이 등 피난... 시공사 포스코이앤씨와 기자촌구역 주택재개발정비사업조합은 이 단지 설계에 승강식 피난기를 반영하기로...,https://realty.chosun.com/site/data/html_dir/2026/07/20/2026072002065.html,pos
2026-07-20 14:58,,포스코DX,AI 인프라주 숨고르기… 클라우드주 옥석 가리기 시작,"SGA솔루션즈, 포스코DX, DB, 엠로도 약세를 이어간다. 스마트팩토리와 디지털 전환 관련 기대는 유지되고 있지만 단기적으로는 수급 부담이 우세하다. 낙폭이 큰 종목에서는 엑셈, 나무기술, 삼성에스디에스가 투자심리...",https://www.pinpointnews.co.kr/news/articleView.html?idxno=469747,pos
2026-07-20 14:48,,포스코,"전주 POSCO '더샵 라비온드', 2천226세대 승강식 피난기 적용","시공사 포스코이앤씨와 기자촌구역 주택재개발정비사업조합, 설계진이 협의를 거쳐 단지의 피난 동선과... 시공을 맡은 포스코이앤씨는 대규모 공동주택에 해당 피난설비가 안정적으로 적용될 수 있도록 설계 및 시공...",http://www.ikld.kr/news/articleView.html?idxno=337791,pos
2026-07-20 14:40,,포스코 노조,"포스코노조, 광양지역 상생기금 6500만원 지원","포스코노동조합이 전남광주 광양시와의 상생과 취약계층을 돕기 위해 상생기금 6500만원을 전달했다. 포스코노동조합 광양지부는 광양시, 포스코노동조합 광양지부, 초록우산 전남지역본부, 광양시사랑나눔복지재단...",https://www.newsis.com/view/NISX20260720_0003715364,pos
2026-07-20 14:38,,포스코 노조,성과급 늪에 빠진 산업계…'N% 성과급' 위험한 도미노,"포스코, SK에너지 등 대기업 발주처를 상대로 한 플랜트노조, 한화오션의 웰리브노조 등도 파업을 예고하고 있다. 재계 관계자는 ""그간 협상 때마다 노사 갈등은 이어졌지만 올해처럼 산업 전체적으로 성과급 분배...",http://www.metroseoul.co.kr/article/20260720500309,neg
2026-07-20 14:34,,포스코홀딩스,"“유럽 인재를 한국으로”…과기정통부, 우수인재 유치 행사 개최","삼성전자와 HD한국조선해양, 포스코홀딩스 등 기업 6곳은 별도 상담 부스를 운영한다. 참가자는 연구 분야와 경력에 맞춰 국내 취업과 복귀, 공동연구 기회를 상담받을 수 있다. 현장에서는 대학 교수와...",https://www.sentv.co.kr/article/view/sentv202607200136,pos
2026-07-20 14:34,,포스코홀딩스,"KAIST·ETRI, 유럽 인재 유치 나선다…프랑스서 홍보행사","이 밖에 한국연구재단과 국가과학기술연구회 등 유관기관 5곳, GIST와 포항공과대학교 등 대학, 삼성전자와 HD한국조선해양, 포스코홀딩스 등 기업 6곳도 함께합니다. 참여 기관들은 별도의 상담 부스를 운영해...",https://www.tjb.co.kr/news05/bodo/view/id/101173,pos
2026-07-20 14:34,,포스코홀딩스,"KAIST·ETRI, 유럽 인재 유치 나선다…프랑스서 홍보행사","이 밖에 한국연구재단과 국가과학기술연구회 등 유관기관 5곳, GIST와 포항공과대학교 등 대학, 삼성전자와 HD한국조선해양, 포스코홀딩스 등 기업 6곳도 함께합니다. 참여 기관들은 별도의 상담 부스를 운영해...",http://www.tjb.co.kr/sub0301/bodo/view/id/101173,pos
2026-07-20 14:34,,포스코 노조,"포스코 노조, 지역사회 상생기금 6,500만원 전달","포스코노동조합이 지역사회 상생 기금으로 6,500만원을 전달했습니다. 포스코노동조합은 초록우산 전남지역본부, 광양시 사랑나눔복지재단과 만나 지역 사회와 철강 산업의 지속 가능한 발전과 지역 취약 계층의 지원을...",https://ysmbc.co.kr/NewsArticle/1528230,pos
2026-07-20 14:33,,포스코홀딩스,한-유럽 과기학술대회 개막…韓 우주 정책·인재 유치 경쟁력 알린다,"한국연구재단과 국가과학기술연구회(NST), 한국과학기술원(KAIST), 광주과학기술원(GIST)·포항공과대(포스텍), KIST, 한국전자통신연구원(ETRI), 삼성전자, HD한국조선해양, 포스코홀딩스 등이 행사에서 상담 부스를...",https://www.etnews.com/20260720000287,pos
2026-07-20 14:30,아시아경제,포스코 노조,"포스코노조, ""지역 취약계층 지원"" 상생 기금 6천5백만원 전달","포스코노동조합(위원장 김성호)은 지난 16일 포스코노동조합 광양지부에서 광양시(시장 박성현), 포스코노동조합 광양지부(신재호), 김유성 초록우산 전남지역본부(김유성), 사랑나눔복지재단(김재경) 등이 참석한 가운데...",https://view.asiae.co.kr/article/2026072014040234692,pos
2026-07-20 14:22,,대미 투자 특별법,"구윤철 ""국익 최우선으로 대미 통상관계 안정적 관리""","지난해 관세협상에 따른 총 3500억달러 규모의 대미 투자 약속과 관련해선 ""본격 이행을 위해 추진체계를... 정부는 지난 6월 한미전략투자 특별법 시행이후 한미전략투자공사, 사업관리위원회, 운영위원회를 잇따라...",http://www.seouleconews.com/news/articleView.html?idxno=92493,pos
2026-07-20 14:21,헤럴드경제,포스코,"‘더블생활권’ 갖춘 포스코이앤씨 ‘더샵 트리센트’, 부산 대연·문현...",이러한 시장 흐름 속에서 포스코이앤씨가 부산시 남구 문현동 일원에 선보이는 ‘더샵 트리센트’가 대연동과 문현동의 더블 생활권 인프라와 우수한 교육 여건을 동시에 갖춘 핵심 요충지로 꼽히며 수요자들의 이목을...,https://biz.heraldcorp.com/article/10813774?ref=naver,pos
2026-07-20 14:20,,포스코홀딩스,'첨단농업' 드라이브…애그테크 시장 확대 기대감,"대동그룹 AI로봇 계열사인 대동로보틱스는 최근 GS건설과 포스코홀딩스 계열 기업형 벤처캐피털(CVC) 등으로부터 50억원 규모의 시리즈A 투자를 유치하며 농업 현장에서 검증한 자율주행과 공간인지, 비전 AI 기술을 기반...",https://www.m-i.kr/news/articleView.html?idxno=1392970,pos
2026-07-20 14:10,,포스코,"한진, '철강 물류' 리스크…포스코와 마찰",포스코모빌리티솔루션이 한진 물류창고에 맡겼던 철강 코일의 침수 피해 발생 이후 양사는 배상 책임을 다투는 중입니다. 앞서 포스코향 입찰 담합 제재에 이어 양측의 오랜 파트너십 관계가 흔들리는 모습입니다. 20일...,http://www.newstomato.com/ReadNews.aspx?no=1307574&inflow=N,neg
