날짜,매체명,검색키워드,기사제목,주요기사 요약,URL
2025-11-22 09:18,,포스코,POSCO홀딩스 최근 5거래일 32만원대 등락 후 하락,"포스코홀딩스 CI 이는 전 거래일 종가 321,500원 대비 3.4% 하락한 수치이다. 이날 POSCO홀딩스는 311,000원에 시가를 형성한 뒤 장중 한때 313,500원까지 고가를 기록했으나, 308,000원까지 떨어지며 주간...",https://www.joongangenews.com/news/articleView.html?idxno=468076
2025-11-22 09:13,노컷뉴스,포스코인터내셔널,"韓 탁구, 'WTT' 남자 복식 우승… 준결승에서 세계 1위 꺾어","한편 여자복식 결승에 올랐던 주천희(삼성생명)·김나영(포스코인터내셔널) 조는 일본의 오도 사쓰기·요코이 사쿠라 조에 2-3(11-9, 5-11, 11-5, 4-11, 6-11)으로 역전패해 준우승을 달성했다. ※CBS노컷뉴스는 여러분의...",https://www.nocutnews.co.kr/news/6432396?utm_source=naver&utm_medium=article&utm_campaign=20251122091205
2025-11-22 09:11,뉴스1,포스코인터내셔널,"탁구 남자복식 임종훈-오준성, WTT 스타 컨텐더 무스카트 우승",한편 주천희(삼성생명)-김나영(포스코인터내셔널) 조는 같은 대회 여자복식 결승에서 오도 사쓰기-요코이 사쿠라 조(일본)에 2-3(11-9 5-11 11-5 4-11 6-11)으로 패해 준우승을 기록했다.,https://www.news1.kr/sports/general-sport/5984657
2025-11-22 09:04,,포스코인터내셔널,"탁구 임종훈-오준성, WTT 무스카트 우승… 주천희-김나영 2위",여자복식 결승에 올랐던 주천희(삼성생명)-김나영(포스코인터내셔널) 조는 일본의 오도 사쓰기-요코이 사쿠라 조에 2-3(11-9 5-11 11-5 4-11 6-11)으로 역전패했다. 주천희와 김나영은 여자 단식 준결승에서 만나...,http://www.hansbiz.co.kr/news/articleView.html?idxno=793882
2025-11-22 08:43,뉴스핌,포스코인터내셔널,"남자복식 '황금 콤비' 탄생… 임종훈-오준성, WTT 무스카트 우승",[사진=WTT] 여자복식 결승에 오른 주천희(삼성생명)-김나영(포스코인터내셔널) 조는 일본의 오도 사쓰기-요코이 사쿠라 조에 2-3(11-9 5-11 11-5 4-11 6-11)으로 역전패해 아쉽게 준우승에 머물렀다. 여자단식에서는...,https://www.newspim.com/news/view/20251122000019
2025-11-22 08:26,,포스코인터내셔널,"탁구 임종훈-오준성, WTT 무스카트 정상…女복식 주천희-김나영은 준우...",여자복식 결승에 올랐던 주천희(삼성생명)-김나영(포스코인터내셔널) 조는 일본의 오도 사쓰기-요코이 사쿠라 조에 2대3(11대9 5대11 11대5 4대11 6대11)으로 역전패해 준우승에 만족해야 했다. 여자 단식 8강에 나선...,https://www.sedaily.com/NewsView/2H0JXCB8JZ
2025-11-22 07:01,KBS,포스코,포스코 잇단 인명사고…‘재발방지’ 약속 불구하고 반복,"그제(20일) 포스코 포항제철소에서 원인을 알 수 없는 가스 누출 사고가 일어나 작업자 3명이 중태에 빠졌습니다. 포스코그룹은 올해 인명사고가 잇따르면서, 회장이 사과하고 재발 방지 대책까지 내놨지만, 사고는...",https://news.kbs.co.kr/news/pc/view/view.do?ncd=8414406&ref=A
2025-11-22 06:39,연합뉴스,포스코인터내셔널,"탁구 임종훈-오준성, WTT 대회 우승…임종훈은 최고 '결혼' 선물","하지만 여자복식 결승에 올랐던 주천희(삼성생명)-김나영(포스코인터내셔널) 조는 일본의 오도 사쓰기-요코이 사쿠라 조에 2-3(11-9 5-11 11-5 4-11 6-11)으로 역전패, 아쉬운 준우승에 그쳤다. 주천희-김나영 조는 첫...",https://www.yna.co.kr/view/AKR20251122010300007?input=1195m
2025-11-22 01:47,,포스코,포스코 ‘안전사고 재발’ 포항제철소장 해임,포스코가 잇따른 안전사고의 책임을 물어 포항제철소장을 해임했다. 최근 포항제철소에서 연이어 발생한 근로자 인명 피해 사고에 따른 조치다. 아울러 포스코홀딩스의 안전 전문 자회사 대표를 회장 직속...,https://www.joongang.co.kr/article/25384144
2025-11-21 23:46,,포스코,"포스코, 포항제철소장 보직 해임…이희근 사장이 소장 겸임",또한 포스코홀딩스의 안전 전문 자회사 포스코세이프티솔루션의 유인종 대표를 회장 직속 그룹안전특별진단TF 팀장에 임명하는 등 현장 안전 관리 강화에 나서고 있다. 21일 포스코에 따르면 전날 포항제철소에서 발생한...,https://ilyo.co.kr/?ac=article_view&entry_id=503641
2025-11-21 22:46,뉴스락,포스코,"포스코, 잇단 안전사고에 포항제철소장 해임…그룹 TF 가동","포스코가 현장 책임자 교체와 함께 그룹 차원의 안전 비상체제에 돌입했다. 21일 업계에 따르면, 포스코는 전날 포항제철소에서 발생한 유해가스 중독 사고의 책임을 물어 이동렬 포항제철소장을 보직 해임했다. 후임은...",http://www.newslock.co.kr/news/articleView.html?idxno=119939
2025-11-21 22:14,,포스코,"“죽을 차례 기다려야 하나”… 노동계, 포스코 경영자 구속 촉구","[사진=포스코 홈페이지 캡처] 지난 20일 발생한 포스코 인명피해 사고 여파가 확산되고 있다. 포스코는 인명 사고 책임을 물어 포항제철소장 경질했고, 노동계는 경영자 구속을 촉구하고 나섰다. 21일 포스코·노동계에...",https://m.skyedaily.com/news_view.html?ID=291250
2025-11-21 21:45,,포스코,'포항제철 가스 중독' 수사 착수...포스코 공식 사과,"포스코 포항제철소에서 배관 청소 작업을 하다가 가스를 들이마신 노동자들이 위중한 상태로 병원 치료를 받고 있습니다. 포스코는 잇따른 중대재해에 공식적으로 사과하고, 근본적인 대책을 마련하겠다고 밝혔습니다....",https://www.ytn.co.kr/_ln/0115_202511212145407950
2025-11-21 21:34,,포스코인터내셔널,"임종훈-오준성, 세계 1위 르브렁 형제 격파! WTT 무스카트 결승 진출","여자복식에 출전한 주천희(삼성생명)-김나영(포스코인터내셔널) 조 역시 준결승에서 러시아계 개인중립선수(AIN) 듀오인 블라다 보로니나-엘리자벳 아브라미안 조를 3-1(11-5, 7-11, 11-8, 11-5)로 물리치고 결승에 올랐다....",https://www.dailysportshankook.co.kr/news/articleView.html?idxno=418829
2025-11-21 21:18,KBS,포스코,포스코 잇단 인명사고…‘재발방지’ 약속 불구하고 반복,"어제(20일) 포스코 포항제철소에선 가스 누출로 작업자 3명이 중태에 빠지는 사고가 있었죠. 포스코그룹 사업장에서 올해만 7명의 노동자가 숨지면서, 회장이 사과하고 재발 방지 대책까지 내놨지만, 사고는 반복되고...",https://news.kbs.co.kr/news/pc/view/view.do?ncd=8414143&ref=A
2025-11-21 21:08,,포스코,"반복되는 중대재해, 반복되지 않는 변화…포스코가 직면한 신뢰의 균열","더피알=김영순 기자 ｜포스코의 중대재해는 이제 특정 현장의 관리 부실로는 설명될 수 없다. 사고가 발생할... 포스코가 해결해야 할 것은 사고가 아니라, 사고를 반복시키는 구조 그 자체다. 포항제철소장 보직 해임...",https://www.the-pr.co.kr/news/articleView.html?idxno=54613
2025-11-21 21:01,헤럴드경제,포스코,"포스코, 잇따른 인명사고에 포항제철소장 보직해임…경찰, 포항제철소 ...",포스코가 잇단 인명 사고에 포항제철소장을 보직 해임했다. 21일 업계에 따르면 포스코는 전날 포항제철소에서 발생한 안전사고와 관련해 이동렬 포항제철소장을 이날 보직 해임했다. 포스코는 후임 포항제철소장은...,https://biz.heraldcorp.com/article/10621351?ref=naver
2025-11-21 20:56,문화일보,포스코,"포스코에 무슨 일이?···사장이 직접 제철소장까지 맡은 포스코, 올해...",연합뉴스 포스코가 잇단 안전사고로 근로자 인명 피해가 연이어 발생한 포항제철소 소장을 전격 경질했다. 21일 업계에 따르면 포스코는 전날 포항제철소에서 발생한 안전사고와 관련해 이동렬 포항제철소장을 이날 보직...,https://www.munhwa.com/article/11548708?ref=naver
2025-11-21 20:52,,포스코,"포스코 포항제철소, 이희근 사장 직할 전환… '안전 시스템 대폭 강화'","포스코가 최근 잇따른 현장 사고 이후 포항제철소 운영 체제를 이희근 사장 직할 체제로 전환했다. 21일 업계에 따르면 포스코는 이동렬 포항제철소장을 해임 후 별도로 소장을 선임하지 않고, 이희근 사장이 직접 제철소장...",https://www.dkilbo.com/news/articleView.html?idxno=523203
2025-11-21 20:40,,포스코,"포스코, 잇단 인명사고에 포항제철소장 보","포스코는 잇단 안전사고로 근로자 인명 피해가 연이어 발생한 책임을 물어 이동렬 포항제철소장을 보직 해임했습니다. 포스코는 후임 포항제철소장은 새로 선임하지 않고, 이희근 사장이 직접 제철소장을 겸임하면서 최근...",http://www.phmbc.co.kr/www/news/desk_news?idx=198682&mode=view
2025-11-21 20:23,동아일보,포스코,"포스코, 연이은 사고에 포항제철소장 전격 보직 해임",포스코가 올해 초 취임했던 이동렬 포항제철소장을 21일 보직에서 해임했다. 전날(20일) 포항제철소 스테인리스(STS) 4제강공장에서 슬러지 청소 작업 중 유해가스 누출로 추정되는 사고가 발생하면서다. 포스코는 당분간...,https://www.donga.com/news/Society/article/all/20251121/132817439/1
2025-11-21 19:17,이데일리,포스코,"포스코, 포항제철소장 보직 해임…이근희 사장, 소장 겸임",포스코가 잇단 안전사고로 근로자 인명 피해가 연이어 발생한 포항제철소 소장을 결국 경질했다. 포스코홀딩스의 안전 전문 자회사 포스코세이프티솔루션의 유인종 대표를 회장 직속 그룹안전특별진단TF 팀장에...,http://www.edaily.co.kr/news/newspath.asp?newsid=04372246642368016
2025-11-21 19:16,,포스코,"포스코 잇단 사고에 포항제철소장 해임…이희근 사장, 소장 겸임",이동렬 포스코 포항제철소장.[연합뉴스 자료사진] 포스코가 잇단 안전사고로 근로자 인명 피해가 연이어 발생한 포항제철소 소장을 전격 경질했다. 아울러 포스코홀딩스의 안전 전문 자회사 대표를 회장 직속...,http://www.namdonews.com/news/articleView.html?idxno=839988
2025-11-21 19:07,KBS,포스코,포스코 잇단 인명사고…‘재발방지’ 약속 불구하고 반복,"어제(20일) 포스코 포항제철소에서 원인을 알 수 없는 가스 누출 사고가 일어나 작업자 3명이 중태에 빠졌습니다. 포스코그룹은 올해 인명사고가 잇따르면서, 회장이 사과하고 재발 방지 대책까지 내놨지만, 사고는...",https://news.kbs.co.kr/news/pc/view/view.do?ncd=8414029&ref=A
2025-11-21 19:03,,포스코,"포스코, '중대 재해' 포항제철소장 경질…이희근 사장 겸임",포스코가 산업 재해가 발생한 포항제철소장에 대한 인사 조치를 단행했다. 이희근 사장이 포항제철소장을 겸임하며 후속 조치를 챙기겠다는 계획이다. 21일 업계에 따르면 포스코는 이날 이동렬 포항제철소장을 보직...,https://www.newsis.com/view/NISX20251121_0003412724
2025-11-21 19:02,,포스코,"전북대학교 이태훈 교수, 포스코사이언스 신규 펠로우 선정",이태훈 교수 [사진출처=전북대학교] 전북대학교(총장 양오봉)는 이태훈 교수(공대 신소재공학부 전자재료공학전공)가 포스코청암재단이 주관하는 '2026 포스코사이언스펠로우십' 신규 펠로우에 선정됐다고...,https://www.lecturernews.com/news/articleView.html?idxno=191233
2025-11-21 19:02,,포스코,"포스코 잇단 사고에 포항제철소장 해임…이희근 사장, 소장 겸임","포스코가 잇단 안전사고로 근로자 인명 피해가 연이어 발생한 포항제철소 소장을 보직 해임하고, 이희근 포스코 사장이 제철소장을 겸임하면서 원인 규명과 재발 방지를 위한 근본적인 대책 마련을 지휘할 것으로...",http://mbn.mk.co.kr/pages/news/newsView.php?category=mbn00003&news_seq_no=5156360
2025-11-21 18:38,,포스코,잇단 사고에 포스코 포항제철소장 해임…사장 “책임 통감” 사과,"이동렬 포스코 포항제철소장. 연합뉴스 포스코가 포항제철소에서 잇따라 발생한 중대 안전사고 책임을 물어 제철소장을 전격 보직 해임하고, 그룹 차원의 특별 진단 체제를 가동했다. 최근 수개월 새 현장에서 인명...",https://www.yeongnam.com/web/view.php?key=20251121020319778
2025-11-21 18:37,,포스코,"포스코, '인명사고' 잇따르자 포항제철소장 보직해임",포스코가 잇따른 안전사고로 근로자 인명 피해가 발생하자 포항제철소 소장을 경질했습니다. 오늘(21일) 포스코에 따르면 이동렬 포항제철소장은 보직에서 해임됐습니다. 일반적인 정기 인사 시기가 아니고 그에 준하는...,http://www.yonhapnewstv.co.kr/MYH20251121183632wkX
2025-11-21 18:30,더퍼블릭,포스코,"포스코, 연이은 인명사고에 포항제철소장 전격 해임…이희근 사장 직접...","포스코가 포항제철소에서 올해만 세 차례 인명사고가 발생하자 제철소장을 전격 교체하고, 그룹 차원의 안전 관리 체계를 재정비한다. 포스코는 21일 이동렬 포항제철소장을 보직 해임하고, 이희근 포스코 사장이...",https://www.thepublic.kr/news/articleView.html?idxno=284559
2025-11-21 18:20,,포스코,"포스코, 포항제철소장 해임…인명 사고 책임",포스코가 포항제철소에서 잇따라 인명사고가 발생하자 포항제철소장을 경질했다. 21일 포스코는 전날(20일) 포항제철소에서 발생한 안전사고에 대한 책임을 물어 이동렬 포항제철소장을 보직 해임했다. 포스코는 후임...,https://www.newsway.co.kr/news/view?ud=2025112117573393208
2025-11-21 18:12,노컷뉴스,포스코,"포스코, 인명피해 사고 잇따른 포항제철소장 보직해임",포스코가 잇단 안전사고로 인명 피해가 연이어 발생한 포항제철소 소장을 경질했다. 포스코는 지난 20일 작업자 3명이 가스를 흡입해 쓰러진 안전사고와 관련해 이동렬 포항제철소장을 보직 해임했다. 후임...,https://www.nocutnews.co.kr/news/6432337?utm_source=naver&utm_medium=article&utm_campaign=20251121061100
2025-11-21 18:08,,포스코,"포스코, 포항제철소 가스흡입 사고 공식 사과…“근본 대책 마련하겠다...","""올해 잇단 사고에 무거운 책임…중태 직원 회복 지원 총력"" 강남 포스코센터에 게양된 회사 깃발./포스코 포스코가 포항제철소에서 슬러지(찌꺼기) 청소 작업을 하던 작업자들이 유해가스를 흡입한 사고와 관련해 21일...",http://www.metroseoul.co.kr/article/20251121500273
2025-11-21 18:08,,포스코,"포스코, 잇단 중대재해에 포항제철소장 전격 해임…이희근 사장 직접 수...",포스코가 포항제철소에서 잇따라 발생한 중대 산업재해의 책임을 묻고 이동렬 포항제철소장을 전격 해임했다. 반복되는 인명 피해에 대한 내부·외부의 비판이 거세지자 포스코 경영진이 최고 책임자 문책과 함께 안전...,https://www.seoultimes.news/news/article.html?no=2000085848
2025-11-21 18:02,,포스코,"[기자수첩] 총대 멘 포항제철소장…포스코, '진짜 책임'은 어디에","포스코가 이동렬 포항제철소장을 해임했다. 최근 잇따라 발생한 인명 피해의 책임을 묻는 차원으로... 포스코 노조 등에 따르면 사내 소방대원은 의식을 찾았으나, 하청 노동자 2명은 여전히 의식불명 상태다. 불과 2주 사이...",https://www.1conomynews.co.kr/news/articleView.html?idxno=45005
2025-11-21 18:00,,포스코,"포스코, 잇단 사고에 포항제철소장 해임",이동렬 포스코 포항제철소장. 사진=연합뉴스 포스코가 포항제철소 소장을 전격 경질했다. 잇단 안전사고로 근로자 인명 피해가 연이어 발생한 것에 대한 문책성 인사로 풀이된다. 21일 업계에 따르면 포스코는 전날...,http://www.kdfnews.com/news/articleView.html?idxno=171406
2025-11-21 17:59,,포스코,"포스코, 잇단 안전사고로 포항제철소 소장 보직 해임...이희근 사장, 소...",포스코가 잇단 안전사고로 인명 피해가 이어지자 이동렬 포항제철소장을 전격 해임했습니다. 포스코홀딩스 안전 전문 자회사 대표는 회장 직속 그룹안전특별진단TF 팀장에 임명돼 현장 안전 관리 강화에 나섰습니다....,https://news.jtbc.co.kr/article/NB12271961?influxDiv=NAVER
2025-11-21 17:50,,포스코,"포스코, 포항제철소장 전격 경질…사장 직무대행 체제 전환",포스코 포항제철소 1고로(오른쪽)와 2고로. 사진=연합뉴스 제공. 포스코가 잇단 안전사고로 근로자 인명 피해가 연이어 발생한 포항제철소 소장을 전격 경질했다. 21일 업계에 따르면 포스코는 전날 포항제철소에서 발생한...,https://www.pinpointnews.co.kr/news/articleView.html?idxno=398321
2025-11-21 17:50,,포스코,"포스코, 잇따른 사고에 포항제철소장 보직 해임",포스코가 잇단 사고로 인명 피해가 발생하자 이동렬 포항제철소장을 보직 해임했습니다. 이희근 포스코 사장은 후임 제철소장을 새로 선임하지 않고 직접 겸임하면서 최근 인명사고에 대한 원인 규명과 재발 방지를...,https://dgmbc.com/NewsArticle/637706
2025-11-21 17:46,,포스코,"포스코, 포항제철소장 경질",잇단 안전 사고에 사과문 발표 이희근 사장이 겸직 안전 챙겨 포스코가 잇단 안전사고로 근로자 인명 피해가 연이어 발생한 포항제철소 소장을 전격 경질했다. 21일 업계에 따르면 포스코는 전날 포항제철소에서 발생한...,https://www.mk.co.kr/article/11474285
2025-11-21 17:40,,포스코,연이은 중대재해에 무너진 '안전경영'…이희근 포스코 사장 고개 숙여,"포스코가 현장 안전을 최우선 과제로 강조해온 가운데 최근 잇따라 발생한 산업재해에 대해 결국 공식... 21일 이희근 포스코 사장은 사과문을 통해 ""포스코를 대표해 사고를 당하신 분들과 가족분들께 머리 숙여 깊이...",http://www.popcornnews.net/news/articleView.html?idxno=102778
2025-11-21 17:38,,포스코,'포항제철 가스 중독' 수사 착수...포스코 공식 사과,"포스코 포항제철소에서 배관 청소 작업을 하다가 가스를 들이마신 노동자들이 위중한 상태로 병원 치료를 받고 있습니다. 포스코는 잇따른 중대재해에 공식적으로 사과하고, 근본적인 대책을 마련하겠다고 밝혔습니다....",https://www.ytn.co.kr/_ln/0115_202511211738177595
2025-11-21 17:37,,포스코,안전 강화 구호 속 연이은 사고…포스코 포항제철소장 경질,포스코 포항제철소장이 전격 경질됐다. 장인화 포스코그룹 회장이 줄곧 안전 강화를 외쳤지만 연이어 인명사고가 발생한 탓이다. 21일 관련 업계에 따르면 포스코는 전날 포항제철소에서 발생한 안전사고와 관련해...,https://www.etnews.com/20251121000325
2025-11-21 17:36,,포스코인터내셔널,[그룹주기상도]HD현대‘맑음’… 롯데지주 ‘흐림’ 속 업종별 명암 갈...,한편 포스코인터내셔널은 인도네시아 대형 팜 기업 삼푸르나 아그로 인수(약 1조3000억 투자) 및 연 50만t 규모 팜유 정제공장 준공으로 글로벌 팜 밸류체인 확장에 나섰지만 그룹 전체 분위기는 연속된 인명피해...,https://www.nspna.com/news/?mode=view&newsid=788590
2025-11-21 17:36,,포스코,"포스코, 연이은 사고에 포항제철소장 보직해임",포스코가 포항제철소에서 발생한 연이은 안전사고에 책임을 물어 포항제철소장을 21일 경질했다. 이희근 포스코 사장이 당분간 포항제철소장을 겸임하면서 오는 12월 말 정기인사에서 신임 소장을 선임할 계획이다....,https://it.chosun.com/news/articleView.html?idxno=2023092151502
2025-11-21 17:34,,포스코,"포스코, 연이은 인명사고에 포항제철소장 전격 해임",인더스트리뉴스 문기수 기자 포스코에서 안전사고가 연이어 발생해 인명피해가 발생한 가운데 포항제철소 소장이 전격 해임됐다. 포스코는 20일 포항제철소에서 발생한 안전사고와 관련해 이동렬 포항제철소장을 21일...,https://www.industrynews.co.kr/news/articleView.html?idxno=74642
2025-11-21 17:31,,포스코,"경찰, 포스코 유해가스 사고 조사... 심정지 3명 중 2명은 맥박 돌아와",경찰이 포스코 포항제철소 STS 4 제강공장의 유해가스 흡입사고에 대해 정확한 사고 경위와 안전조치 여부... 송내동 포스코 포항제철소 STS 4 제강공장에서 작업하던 협력업체 및 포스코 직원들의 동선과 작업 절차...,https://www.hankookilbo.com/News/Read/A2025112114530000679?did=NA
2025-11-21 17:28,,포스코,포스코 잇단 사망사고에 포항제철소장 보직 해임,포스코가 잇단 안전사고로 인명 피해가 발생한 포항제철소 소장을 전격 경질했다. 포스코는 포항제철소에서 발생한 안전사고와 관련해 이동렬 포항제철소장을 21일 보직 해임했다고 밝혔다. 후임 소장은 이희근 포스코...,https://www.hankyung.com/article/2025112186081
2025-11-21 17:20,,포스코,"한국예탁결제원, 벤처넷 시스템 본격 가동…포스코기술투자 참여","예탁원은 벤처넷 시스템에 대형 벤처캐피탈 운용사인 포스코기술투자가 참여하면서 이달 11월부터 업무를 개시했다고 20일 밝혔다. 포스코기술투자는 기업형 벤처캐피탈(CVC)로, 운용자산 1조 원 규모 투자전문 회사다....",http://www.fntimes.com/html/view.php?ud=2025112116503179020f4390e77d_18
2025-11-21 17:19,,포스코,"포스코, 포항제철소장 보직해임…이희근 사장, 소장 겸직","경질성 인사 단행…""사고 재발방지에 역량 집중할 것"" 포스코가 잇단 안전사고로 근로자 인명 피해가 발생한... 21일 업계에 따르면 포스코는 이날 이동렬 포항제철소장을 보직 해임했다. 후임 소장은 새로 선임하지 않고...",https://www.topdaily.kr/articles/106883
2025-11-21 17:16,한국일보,포스코,"포스코, 연이은 안전사고에 포항제철소 소장 경질",경북 포스코 포항제철소 전경. 사진=포스코 포스코가 포항제철소 소장을 전격 경질한 것으로 알려졌다. 사업장 내 연이은 인명 사고 발생으로 문책성 인사 조치를 단행한 것으로 풀이된다. 21일 관련 업계에 따르면...,https://weekly.hankooki.com/news/articleView.html?idxno=7138123
2025-11-21 17:14,,포스코,"중대사고 계속되는 포스코, 포항제철소장 전격 해임",뉴스저널리즘 신용준 기자 = 포스코가 연이은 중대사고로 인명 피해가 발생한 포항제철소의 책임을 물어... 21일 업계에 따르면 포스코는 전날 발생한 유해가스 흡입 사고와 관련해 이동렬 포항제철소장을 보직 해임했다....,https://www.ngetnews.com/news/articleView.html?idxno=541532
2025-11-21 17:14,,포스코,"포스코, 반복된 안전사고에 '포항제철소장 경질'",포스코가 포항제철소 소장을 전격 경질했다. 잇단 안전사고로 근로자 인명 피해가 연이어 발생한 데 따른 책임을 물은 것이다. 21일 포스코에 따르면 회사는 전날 포항제철소에서 발생한 안전사고와 관련해 이동렬...,http://www.srtimes.kr/news/articleView.html?idxno=190452
2025-11-21 17:12,,포스코,"포스코 잇단 인명 사고에 포항제철소장 전격 해임…이희근 사장, 소장도...",포스코가 연이은 제철소 현장 노동자 사망·상해 사고에 포항제철소 소장을 전격 경질했다. 아울러 포스코홀딩스의 안전 전문 자회사 대표를 회장 직속 그룹안전특별진단TF 팀장에 임명하고 현장 안전 관리 강화에...,https://www.financialpost.co.kr/news/articleView.html?idxno=238829
2025-11-21 17:00,연합뉴스,POSCO INTERNATIONAL,Yonhap News Summary,"section=national/national ----------------- ■ POSCO dismisses head of Pohang Steelworks... new international airport in South Korea's southeastern port city of Busan, the transport ministry...",https://en.yna.co.kr/view/AEN20251121008500315?input=2106m
2025-11-21 16:56,,포스코,"포스코, 잇단 사고에 포항제철소장 경질…이희근 사장 겸임",민주신문=조환흠 기자｜포스코가 최근 잇따른 안전사고로 인명 피해가 발생한 책임을 물어 포항제철소장을 경질했다. 21일 포스코에 따르면 이동렬 포항제철소장은 오늘자로 보직 해임됐으며 후임 없이 이희근 사장이...,http://www.iminju.net/news/articleView.html?idxno=149143
