날짜,매체명,검색키워드,기사제목,주요기사 요약,URL
2025-12-31 09:56,,포스코인터,"NC AI 정예팀, 韓산업 특화 AI '배키' 오픈소스 공개","이를 위해 NC AI는 롯데이노베이트, 포스코DX, MBC, 카이스트(KAIST), ETRI, 고려대 등 산·학·연 14개 기관 및... 스마트 인더스트리 분야에서는 컨소시엄 참여사인 인터엑스와 협력해 자동차 부품 기업의 공정 데이터를...",https://www.newsis.com/view/NISX20251231_0003460650
2025-12-31 09:54,,포스코인터,"NC AI, 독자 AI 파운데이션 모델 'VAETKI' 오픈소스 공개","이를 위해 NC AI는 롯데이노베이트, 포스코DX, MBC, 카이스트(KAIST), ETRI, 고려대 등 산·학·연 14개 기관 및... NC AI 컨소시엄은 스마트 인더스트리 분야에서는 컨소시엄 참여사인 인터엑스와 협력해 자동차 부품...",http://www.4th.kr/news/articleView.html?idxno=2104081
2025-12-31 09:52,,포스코인터,"NC AI 컨소시엄, 산업 특화 독자 모델 'VAETKI(배키)' 오픈소스 공개","이를 위해 NC AI는 롯데이노베이트, 포스코DX, MBC, 카이스트(KAIST), ETRI, 고려대 등 산·학·연 14개 기관 및... 스마트 인더스트리 분야에서는 컨소시엄 참여사인 인터엑스와 협력해 자동차 부품 기업의 공정...",http://www.worktoday.co.kr/news/articleView.html?idxno=79330
2025-12-31 09:48,,포스코인터,"NC AI 컨소시엄, 대한민국 산업 특화 독자 AI 파운데이션 모델 VAETKI 공개","이를 위해 NC AI는 롯데이노베이트, 포스코DX, MBC, 카이스트(KAIST), ETRI, 고려대 등 산·학·연 14개 기관 및... 스마트 인더스트리 분야에서는 컨소시엄 참여사인 인터엑스와 협력해 자동차 부품 기업의 공정...",https://kbench.com/?q=node/274820
2025-12-31 09:44,이투데이,포스코인터,"NC AI, 韓 산업 특화 AI 파운데이션 ‘배키’ 오픈소스 공개","NC AI는 이를 위해 롯데이노베이트, 포스코DX, 카이스트(KAIST), 한국전자통신연구원(ETRI) 등 산·학·연... 스마트 인더스트리 분야에서는 인터엑스와 협력해 공정 데이터를 분석하고 라인을 최적화하고 있으며...",https://www.etoday.co.kr/news/view/2541118
2025-12-31 09:44,,포스코인터내셔널,"스페이스X 효과 기대감… 세아베스틸지주, 고평가 구간 단정 어려워","LG생활건강 포스코인터내셔널 ISC HD현대미포 HD한국조선해양 태광 HD현대일렉트릭 HD현대건설기계 HD현대중공업도 있다. 세아베스틸지주는 지주사로서 각 계열사의 성장 전략을 조율하고, 지속 가능한 성장을 위한...",https://www.pinpointnews.co.kr/news/articleView.html?idxno=412195
2025-12-31 09:40,,포스코인터,범용 경쟁 대신 실용 택했다… NC AI가 제조 국방에 심은 특화 두뇌,롯데이노베이트 포스코DX 등 14개 기관과 40개 수요처가 참여하는 그랜드 컨소시엄이 생태계를 뒷받침한다. 인터엑스와 협력해 자동차 부품 공정 라인을 최적화하고 있으며 한국콘텐츠진흥원과는 역사적 문헌을...,https://www.econovill.com/news/articleView.html?idxno=723877
2025-12-31 09:36,,포스코인터,"NC AI 컨소시엄, 대한민국 산업 특화 독자 AI 파운데이션 모델 VAETKI 공개","이를 위해 NC AI는 롯데이노베이트, 포스코DX, MBC, 카이스트(KAIST), ETRI, 고려대 등 산·학·연 14개 기관 및... 스마트 인더스트리 분야에서는 컨소시엄 참여사인 인터엑스와 협력해 자동차 부품 기업의 공정...",https://www.thisisgame.com/articles/410538
2025-12-31 09:32,이데일리,포스코인터,"NC AI 컨소시엄, 독자 AI 모델 ‘배키’ 오픈소스 공개","이번 모델 공개를 위해 NC AI는 롯데이노베이트, 포스코DX, MBC, 카이스트(KAIST), 한국전자통신연구원(ETRI)... 스마트 인더스트리 분야에서는 인터엑스와 협력해 자동차 부품 기업의 공정 데이터를 분석하고 라인...",http://www.edaily.co.kr/news/newspath.asp?newsid=02650246642404096
2025-12-31 09:28,비즈니스코리아,POSCO INTERNATIONAL,KOSPI Posts World's Highest Growth Rate of 75.6% in 2025,"and international policy uncertainties, won weakness, and low growth. After falling to 2,293.70... surpassing POSCO and Celltrion. Lim Jung-eun, a researcher at KB Securities, said, ""As we...",https://www.businesskorea.co.kr/news/articleView.html?idxno=259939
2025-12-31 09:26,,포스코인터,"NC AI, 독자 AI 모델 '배키' 공개…제조·국방 산업 AX 이끈다",이를 위해 NC AI는 롯데이노베이트와 포스코DX 등 산·학·연 14개 기관과 40개 수요처가 참여하는 '그랜드... 스마트 인더스트리 분야에서는 컨소시엄 참여사인 인터엑스와 협력해 자동차 부품 기업의 공정...,https://www.ebn.co.kr/news/articleView.html?idxno=1693282
2025-12-31 09:24,,포스코인터,"NC AI, 100B급 AI ‘배키’ 공개…국방・제조 특화 한국형 AI 모델","이를 위해 NC AI는 롯데이노베이트, 포스코DX, MBC, 카이스트(KAIST), ETRI, 고려대 등 산·학·연 14개 기관 및... 스마트 인더스트리 분야에서는 컨소시엄 참여사인 인터엑스와 협력해 자동차 부품 기업의 공정 데이터를...",http://www.fntimes.com/html/view.php?ud=2025123109203880847fd637f543_18
2025-12-31 09:20,AI타임스,포스코인터,"NC AI 컨소시엄, 산업 특화 독자 AI 파운데이션 모델 'VAETKI(배키)' 오픈...","이를 위해 NC AI는 롯데이노베이트, 포스코DX, MBC, 카이스트(KAIST), ETRI, 고려대 등 산·학·연 14개 기관 및... 스마트 인더스트리 분야에서는 컨소시엄 참여사인 인터엑스와 협력해 자동차 부품 기업의 공정...",https://www.aitimes.kr/news/articleView.html?idxno=37944
2025-12-31 09:19,아시아경제,포스코인터,"NC AI, 산업 특화 AI 모델 '배키' 오픈소스 공개…글로벌 나선다","NC AI는 산업 특화 AI 모델의 개발을 위해 롯데이노베이트, 포스코DX 등 산·학·연 14개 기관과 40개... 스마트 인더스트리 분야에서는 컨소시엄 참여사인 인터엑스와 자동차 부품 기업의 라인 최적화를 수행 중이고...",https://view.asiae.co.kr/article/2025123109035985387
2025-12-31 09:18,데일리한국,포스코인터,"NC AI 컨소시엄, AI 파운데이션 모델 '배키' 오픈소스로 공개","이를 위해 NC AI는 롯데이노베이트, 포스코DX, MBC, 카이스트(KAIST), ETRI, 고려대 등 산·학·연 14개 기관 및... 스마트 인더스트리 분야에서는 컨소시엄 참여사인 인터엑스와 협력해 자동차 부품 기업의 공정 데이터를...",https://daily.hankooki.com/news/articleView.html?idxno=1316475
2025-12-31 09:18,,포스코인터,"NC AI 컨소시엄, 韓 산업 특화 독자 AI 파운데이션 모델 ‘VAETKI’ 오픈소...","이를 위해 NC AI는 롯데이노베이트, 포스코DX, MBC, 카이스트(KAIST), ETRI, 고려대 등 산·학·연 14개 기관 및... 스마트 인더스트리 분야에서는 컨소시엄 참여사인 인터엑스와 협력해 자동차 부품 기업의 공정 데이터를...",https://www.viva100.com/article/20251231500076
2025-12-31 09:16,,포스코인터,"NC AI 컨소시엄, 산업 특화 독자 AI 파운데이션 모델 '배키' 오픈소스 공...","이를 위해 NC AI는 롯데이노베이트, 포스코DX, MBC, 카이스트(KAIST), ETRI, 고려대 등 산·학·연 14개 기관 및... 스마트 인더스트리 분야에서는 컨소시엄 참여사인 인터엑스와 협력해 자동차 부품 기업의 공정...",https://www.epnc.co.kr/news/articleView.html?idxno=326768
2025-12-31 09:11,뉴스핌,포스코인터내셔널,"김나영·유예린, 세계랭킹으로 태극마크…여자 탁구 세대교체 신호탄",김나영(20)과 유예린(17·이상 포스코인터내셔널)은 국제탁구연맹(ITTF) 세계랭킹 기준을 충족하며 내년 국제대회에 나설 태극마크를 달았다. 대한탁구협회는 31일 ITTF가 발표한 2026년 첫 주차 세계랭킹을 기준으로...,https://www.newspim.com/news/view/20251231000119
2025-12-31 09:08,,포스코인터,"엔씨AI, 국내 산업특화 독자 AI 파운데이션 모델 '배키' 오픈소스 공개","롯데이노베이트, 포스코DX, MBC, 카이스트, ETRI, 고려대 등 산·학·연 14개 기관 및 40개 수요처가 참여하는... 엔씨AI 컨소시엄은 이미 인터엑스, 육군본부, 롯데이노베이트 등 28개 이상의 산업 현장에서 배키를...",https://www.businesspost.co.kr/BP?command=article_view&num=425378
2025-12-31 09:06,,포스코인터,"NC AI 컨소, 독자 AI 파운데이션 모델 '배키' 오픈소스 공개","앞서 NC AI는 배키 개발을 위해 롯데이노베이트, 포스코DX, MBC, 카이스트, ETRI, 고려대 등 14개 기관과 40개... 먼저 스마트 인더스트리 분야에서는 컨소시엄 참여사인 인터엑스와 협력해 자동차 부품 기업의 공정...",http://www.shinailbo.co.kr/news/articleView.html?idxno=2171295
2025-12-31 08:56,,포스코인터,"NC AI 컨소시엄, 산업 특화 독자 AI 파운데이션 모델 오픈소스 공개","이를 위해 NC AI는 롯데이노베이트, 포스코DX, MBC, 카이스트(KAIST), ETRI, 고려대 등 산·학·연 14개 기관 및... 스마트 인더스트리 분야에서는 컨소시엄 참여사인 인터엑스와 협력해 자동차 부품 기업 공정 데이터를...",https://www.asiaa.co.kr/news/articleView.html?idxno=235821
2025-12-31 08:48,,포스코,"포스코, 'My POSCO' 오픈...사이트 하나로 토털 서비스 제공",최근 포스코는 기존 제품 홍보 페이지와 온라인 주문·출하 채널(e-Sales)을 하나로 통합한 'My POSCO'를 공식... 이를 바탕으로 고객사들은 포스코의 기술력과 품질 경쟁력을 한눈에 확인할 수 있게 됐다. 고객사의 경우...,https://www.wolyo.co.kr/news/articleView.html?idxno=306615
2025-12-31 08:46,,포스코인터,"NC AI 컨소시엄, 산업특화 100B급 모델 ‘배키’ 오픈소스 공개",이를 위해 NC AI는 롯데이노베이트와 포스코DX 등 산·학·연 14개 기관과 40개 수요처가 참여하는 ‘그랜드... 스마트 인더스트리 분야에서는 컨소시엄 참여사인 인터엑스와 협력해 자동차 부품 기업의 공정...,https://biz.newdaily.co.kr/site/data/html/2025/12/31/2025123100024.html
2025-12-31 08:22,,포스코,"포스코퓨처엠, 누적 300회 헌혈 영웅 배출…연말연시 따뜻한 온기 전해",포스코퓨처엠이 전국 사업장에서 다양한 봉사활동을 펼치며 연말연시 따뜻한 나눔을 실천하고 있다. 특히 누적 300회 헌혈자를 배출하는 등 임직원들의 자발적인 사회공헌 활동이 이어지고 있다. 포스코퓨처엠...,http://www.snmnews.com/news/articleView.html?idxno=563143
2025-12-31 08:14,,포스코인터,"NC AI, 100B급 ‘배키’ 공개…국방·제조 겨냥 한국형 파운데이션 모델","이를 위해 NC AI는 롯데이노베이트, 포스코DX, MBC, 카이스트(KAIST), ETRI, 고려대 등 산·학·연 14개 기관 및... 스마트 인더스트리 분야에서는 컨소시엄 참여사인 인터엑스와 협력해 자동차 부품 기업의 공정...",https://www.dailian.co.kr/news/view/1592644/?sc=Naver
2025-12-31 08:04,연합뉴스,포스코인터내셔널,"탁구 대들보 최효주, 새 둥지 대한항공서 부활의 날개 펼까","대한항공은 지난 2015년 대회 때 국내 최고 권위를 자랑하는 종합선수권 단체전 정상에 오른 뒤 삼성생명, 미래에셋증권, 포스코인터내셔널, 한국마사회와 경쟁에서 밀려 우승과 인연이 없었다. 하지만 최효주의 가세로...",https://www.yna.co.kr/view/AKR20251230113700007?input=1195m
2025-12-31 08:02,,포스코인터내셔널,"'세계 78위' 유예린, 탁구 국가대표 선발…신유빈·주천희·김나영과 호...",▲ [SWTV 스포츠W 임재훈 기자] 한국 여자 탁구의 미래 유예린(포스코인터내셔널)이 성인 국가대표 유니폼을 입는다. (사진: ITTF 홈페이지) 한국 여자 탁구의 미래 유예린(포스코인터내셔널)이 성인 국가대표...,https://swtvnews.com/news/newsview.php?ncode=1065566668979972
2025-12-31 07:49,,포스코인터내셔널,"탁구 김나영·유예린, 국가대표로 자동 선발",한국 여자 탁구의 차세대 에이스 김나영(20)과 기대주 유예린(17·이상 포스코인터내셔널)이 내년 국제대회에 뛸 국가대표로 뽑혔다. 31일 대한탁구협회에 따르면 김나영은 전날 발표된 국제탁구연맹(ITTF)의 2026년...,https://isplus.com/article/view/isp202512310003
2025-12-31 07:48,,포스코,"[더벨]포스코이앤씨, 고급 시니어 주택 운영 이끈다",포스코이앤씨가 고급 시니어 레지던스 '소요한남' 사업 시공권에 이어 운영권까지 확보할 전망이다. 조만호 무신사 의장이 출자한 법인이 시행하는 사업이다. 포스코이앤씨는 내년 상반기 소요한남 운영법인에 지분을...,https://www.thebell.co.kr/free/content/ArticleView.asp?key=202512291409276600101387
2025-12-31 07:48,헤럴드경제,포스코,"포스코DX, 멀티 LLM 탑재한 기업용 업무 플랫폼 ‘P-GPT 2.1’ 출시",추진 포스코DX 직원들이 최신 생성형 AI로 업그레이드한 P-GPT를 활용해 업무를 수행하고 있다. [포스코DX 제공] [헤럴드경제=박혜림 기자] 포스코DX가 보안성과 업무 자동화를 동시에 잡은 ‘에이전틱 AI’ 기반...,https://biz.heraldcorp.com/article/10646372?ref=naver
2025-12-31 07:43,KBS,포스코,‘신안산선 사망’ 포스코이앤씨 압수수색…올해만 5명 사망,"포스코이앤씨가 시공한 공사 현장에서, 올해만 다섯 차례 사망 사고가 발생한 건데요. 수사 당국이 어제(30일) 포스코이앤씨 본사 등에 대한 강제 수사에 착수했습니다. 민정희 기자가 보도합니다. [리포트] 서울 여의도...",https://news.kbs.co.kr/news/pc/view/view.do?ncd=8446983&ref=A
2025-12-31 07:38,KBS,포스코,‘신안산선 사망’ 포스코이앤씨 압수수색…올해만 5명 사망,,https://news.kbs.co.kr/news/pc/view/view.do?ncd=8446969&ref=A
2025-12-31 07:10,,포스코,"포스코, 美 철강 지분투자…장인화 회장의 '노림수'",이끄는 포스코그룹이 미국 내 철강 생산시설 투자에 속도를 내고 있다. 전면적인 직진출보다는 신규... 시장에서는 포스코가 재무적 리스크를 최소화하는 동시에 북미 중심의 철강시장 재편 흐름에 편승하기...,https://dealsite.co.kr/articles/154174
2025-12-31 07:02,철강금속신문,포스코,"포스코퓨처엠, 300회 헌혈자 배출…연말연시 나눔 실천",포스코퓨처엠 광양양극재생산부 강병진 사원이 지난 13일 헌혈의집 순천센터에서 300번째 헌혈에 동참하고 '최고명예대장' 헌혈 유공장을 받았다. 포스코퓨처엠이 누적 300회 헌혈자를 배출하는 등 전국 사업장에서...,http://www.ferrotimes.com/news/articleView.html?idxno=45494
2025-12-31 07:02,철강금속신문,포스코,"포스코 광양제철소, 신입사원 '나눔버스' 타고 지역사회 동행","포스코 광양제철소는 지난 27일 생산기술직 신입사원 115명과 함께 지역사회에 희망을 전파하기 위한 테마형 봉사활동 행사인 '나눔버스' 행사를 진행했다고 밝혔다. '나눔버스'는 신입 교육과정 중 하나로, 광양제철소...",http://www.ferrotimes.com/news/articleView.html?idxno=45488
2025-12-31 07:02,철강금속신문,포스코인터,"페로타임즈 독자가 함께 만든 ""2025년 한국의 철강시계(視界)""","없다"" 포스코인터, 알래스카 LNG 프로젝트 HOA 체결…포스코 강재 공급 K스틸 수출, 2840만 톤 전망 '제3국 부상'…전기강판 열연↑ 철근 '3배' 현대제철, 슈레더 설비 도입…고급 철스크랩 확보에 1700억 투자 단행 철근...",http://www.ferrotimes.com/news/articleView.html?idxno=45454
2025-12-31 07:01,,포스코인터내셔널,"탁구 김나영·유예린, 국가대표 자동 선발…신유빈도 포함",▲ WTT 시리즈에 나선 김나영의 경기 장면 한국 여자 탁구의 차세대 에이스 김나영(20)과 기대주 유예린(17·이상 포스코인터내셔널) 선수가 국제탁구연맹(ITTF) 세계랭킹에 따라 내년 국제대회에 뛸 국가대표로...,https://news.sbs.co.kr/news/endPage.do?news_id=N1008387357&plink=ORI&cooper=NAVER
2025-12-31 06:42,연합뉴스,포스코인터내셔널,"탁구 김나영·유예린, 국가대표로 자동 선발…신유빈도 포함",주천희·박가현도 발탁…남자는 안재현·장우진·오준성 자동 선발 한국 여자 탁구의 차세대 에이스 김나영(20)과 기대주 유예린(17·이상 포스코인터내셔널)이 국제탁구연맹(ITTF) 세계랭킹에 따라 내년 국제대회에...,https://www.yna.co.kr/view/AKR20251230114300007?input=1195m
2025-12-31 06:36,이넷뉴스,포스코인터내셔널,"[이넷뉴스 브랜드평판] 포스코인터내셔널, 자원개발 상장기업 12월 1위·...","발표에 따르면, 1위 포스코인터내셔널 2위 삼성물산 3위 SK이노베이션 순으로 분석됐다. 이넷뉴스와 한국기업평판연구소는 자원개발 상장기업 14개 브랜드에 대해서 빅데이터 분석을 활용한 브랜드...",https://www.enetnews.co.kr/news/articleView.html?idxno=45628
2025-12-31 06:36,이넷뉴스,포스코인터내셔널,"[이넷뉴스 브랜드평판] 포스코인터내셔널, 자원개발 상장기업 12월 1위....","발표에 따르면, 1위 포스코인터내셔널 2위 삼성물산 3위 SK이노베이션 순으로 분석됐다. 이넷뉴스와 한국기업평판연구소는 자원개발 상장기업 14개 브랜드에 대해서 빅데이터 분석을 활용한 브랜드...",https://www.enetnews.co.kr/news/articleView.html?idxno=45628
2025-12-31 06:02,세계일보,포스코,‘신안산선 사망사고’ 포스코이앤씨 압색,"시공사인 포스코이앤씨에 대한 압수수색에 나섰다. 포스코이앤씨 송도사옥. 포스코이앤씨 제공 서울남부지검과 서울경찰청 형사기동대, 서울지방고용노동청은 30일 인천 송도에 위치한 포스코이앤씨 본사와 현장...",https://www.segye.com/newsView/20251230514579?OutUrl=naver
2025-12-31 00:58,,포스코,포스코이앤씨 압수수색...금호건설은 중대재해처벌법 적용 여부 검토,"시공사인 포스코이앤씨 등을 압수수색 했습니다. 또 서울 제기동 동북선 공사 현장 사망 사고와 관련해서는... 서울경찰청과 검찰, 노동부가 사망 사고가 발생한 신안산선 공사 시공사인 포스코이앤씨 본사와 공사 현장 등...",https://www.ytn.co.kr/_ln/0103_202512310058090640
2025-12-31 00:47,,포스코,올해만 5명 사망… 포스코이앤씨 압수 수색,"시공사인 포스코이앤씨와 하청 업체를 압수수색했다. 압수수색에는 서울경찰청, 서울지방고용노동청도... 수사 당국은 포스코이앤씨가 공사 과정에서 붕괴 위험을 예방하기 위해 필요한 안전 조치를 제대로 했는지 등을...",https://www.chosun.com/national/national_general/2025/12/31/5W55QNBE5ZFR7O6O7J6SAI7C7I/?utm_source=naver&utm_medium=referral&utm_campaign=naver-news
2025-12-31 00:00,,구동모터코어,[송년특집 ③] 오토타임즈 선정 2025 아쉬운 차 5,81.4㎾h NCM 배터리와 160㎾ 전륜 모터 조합으로 1회 충전 주행거리 460㎞를 달릴 수 있고 10%-80% 급속 충전은 약... 트림 전반에 사륜구동 시스템 콰트로와 7단 S 트로닉을 기본으로 묶어 안정감 있는 주행 기반을 마련했고...,http://autotimes.co.kr/detail.php?number=686112&thread=27
2025-12-30 23:51,,포스코,"""안전하고 쾌적한 환경에서 편히 지내세요""… 포스코1%나눔재단, '미등...",포스코1%나눔재단은 제도적 지원에서 소외돼 있던 미등록 경로당(양학동 사장골경로당)을 대상으로 시설... 해당 경로당은 그동안 각종 공적 지원에서 제외돼 시설 관리에 어려움을 겪어왔는데 포스코1%나눔재단의 이번...,https://www.polinews.co.kr/news/articleView.html?idxno=718364
2025-12-30 22:58,,포스코,"[포인트뉴스] '사망 사고' 포스코이앤씨 압수수색…""중대재해 검토"" 外","▶ '사망 사고' 포스코이앤씨 압수수색…""중대재해 검토"" 얼마전 서울 여의도역 신안산선 공사 현장에서 붕괴사고가 발생해 작업자 1명이 숨졌는데요. 검찰과 경찰, 노동부가 함께 시공사인 포스코이앤씨를...",http://www.yonhapnewstv.co.kr/MYH20251230225754vaF
2025-12-30 22:35,,포스코,포스코이앤씨 압수수색...금호건설은 중대재해처벌법 적용 여부 검토,"시공사인 포스코이앤씨 등을 압수수색 했습니다. 또 서울 제기동 동북선 공사 현장 사망 사고와 관련해서는... 서울경찰청과 검찰, 노동부가 사망 사고가 발생한 신안산선 공사 시공사인 포스코이앤씨 본사와 공사 현장 등...",https://www.ytn.co.kr/_ln/0103_202512302235152980
2025-12-30 22:01,KBS,포스코,‘의령 천공기 끼임 사망’ 포스코이앤씨 현장소장 구속,"경찰이 포스코이앤씨 현장소장을 구속했습니다. 경찰은 천공기 덮개 미설치 등 안전 조치를 지키지 않은 혐의로 현장소장을 구속하고, 공사팀장 등 2명을 불구속 입건했습니다. 고용노동부는 포스코이앤씨 대표이사에...",https://news.kbs.co.kr/news/pc/view/view.do?ncd=8446769&ref=A
2025-12-30 21:49,KBS,포스코,‘신안산선 사망’ 포스코이앤씨 압수수색…올해만 5명 사망,"얼마 전 서울 여의도역 신안산선 공사 현장에서 난 사고를 포함해, 포스코이앤씨가 맡은 현장에서 올해만... 검찰과 경찰, 노동청 등 수사 당국이 시공사인 포스코이앤씨 본사, 하청업체와 현장 사무실 등을 압수수색...",https://news.kbs.co.kr/news/pc/view/view.do?ncd=8446709&ref=A
2025-12-30 21:44,KBS,포스코,‘신안산선 사망’ 포스코이앤씨 압수수색…올해만 5명 사망,,https://news.kbs.co.kr/news/pc/view/view.do?ncd=8446684&ref=A
2025-12-30 21:04,,포스코인터,"4개월, 5개 모델, 그리고 다음 단계","인터엑스와 중소기업 스마트 팩토리 전환, 현대오토에버와 산업용 AX, 포스코·롯데와 물류 AX 프로젝트를 진행하고 있다. 국방 분야에서는 육군 인공지능 센터와 협업 중이다. 5개사 중 유일한 스타트업인...",https://platum.kr/archives/278357
2025-12-30 21:00,,포스코,"검경·노동청, '신안산선 사망' 포스코이앤씨·하청 압수수색","연합뉴스에 따르면 서울남부지검과 서울경찰청, 서울지방고용노동청은 30일 신인산선 시공사인 포스코이앤씨와 하청업체를 대상으로 수사관과 근로감독관 약 50명을 투입해 압수수색을 실시했다. 검경과 노동청은 이번에...",http://www.srtimes.kr/news/articleView.html?idxno=193226
2025-12-30 20:58,,포스코,"여의도 신안산선 공사 노동자 사망사고… 수사 당국, 포스코이앤씨·하...",포스코이앤씨 송도사옥 | 연합뉴스 수사 당국이 서울 여의도역 신안산선 공사 현장에서 발생한 노동자 사망 사고와 관련해 시공사인 포스코이앤씨와 하청업체를 대상으로 강제수사에 착수했다. 서울남부지검은...,http://www.biztribune.co.kr/news/articleView.html?idxno=346416
2025-12-30 20:28,,포스코,25년간 300회…포스코퓨처엠의 ‘헌혈영웅’,포스코퓨처엠이 누적 300회 헌혈자를 배출하는 등 전국 사업장에서 다양한 봉사활동을 펼치며 연말연시 따듯한 나눔을 실천하고 있다.포스코퓨처엠 광양양극재생산부 강병진 사원은 지난 13일 헌혈의집 순천센터에서...,https://www.ksmnews.co.kr/news/view.php?idx=583689
2025-12-30 20:14,동아일보,포스코인터,"국민 앞에 선 ‘국가대표 AI’, 중간 발표로 확인한 K-AI의 현주소","대표적으로 제조업 AX(AI 전환) 전문 기업 인터엑스와 함께 우리나라 중소기업 제조 기업의 스마트 팩토리 전환을 지원하며, 현대오토에버와도 산업용 AX로 협력한다. 또 포스코, 롯데와 글로벌 유통사의 물류 AX...",https://www.donga.com/news/It/article/all/20251230/133066523/1
2025-12-30 19:33,KBS,포스코,‘신안산선 사망’ 포스코이앤씨 압수수색…올해만 5명 사망,"포스코이앤씨가 시공한 공사 현장에서, 올해만 다섯 차례 사망 사고가 발생한 건데요. 수사 당국이 오늘(30일) 포스코이앤씨 본사 등에 대한 강제 수사에 착수했습니다. 민정희 기자가 보도합니다. [리포트] 서울 여의도...",https://news.kbs.co.kr/news/pc/view/view.do?ncd=8446528&ref=A
2025-12-30 19:02,,포스코,'25년간 헌혈 300회' 포스코퓨처엠 직원 최고명예대장,포스코그룹의 이차전지 소재 계열사인 포스코퓨처엠 직원이 고등학생 때부터 25년간 헌혈을 300회 동참해 대한적십자사로부터 헌혈 유공장 '최고명예대장'을 받았다. 30일 포스코퓨처엠에 따르면 강병진...,http://www.fnnews.com/news/202512301901148938
