날짜,매체명,검색키워드,기사제목,주요기사 요약,URL
2025-12-30 08:40,,포스코,"포스코퓨처엠, 25년간 300회 헌혈 영웅 탄생",포스코퓨처엠이 누적 300회 헌혈자를 배출하는 등 전국 사업장에서 다양한 봉사활동을 펼치며 연말연시 따듯한 나눔을 실천하고 있다. 30일 포스코퓨처엠에 따르면 강병진 광양양극재생산부 사원은 지난 13일 헌혈의집...,https://www.insightkorea.co.kr/news/articleView.html?idxno=238255
2025-12-30 08:39,,포스코,"포스코퓨처엠, 25년간 300회 헌혈 ‘영웅’ 탄생…""최고명예대장 수여""",포스코그룹의 이차전지 소재 계열사인 포스코퓨처엠 직원이 고등학생 때부터 25년간 헌혈을 300회 동참해 대한적십자사로부터 헌혈 유공장 '최고명예대장'을 받았다. 30일 포스코퓨처엠에 따르면 강병진...,http://www.fnnews.com/news/202512300820091873
2025-12-30 08:36,메디컬투데이,포스코,"30대 노동자 추락 사망…포스코이앤씨, 안전관리 소홀로 벌금 1000만원 선...",▲ 2021년 인천의 한 재개발 공사 현장에서 30대 노동자가 추락해 숨진 사고와 관련해 포스코이앤씨와 하청업체들이 안전관리 소홀 책임으로 벌금형을 선고받았다. (사진=포스코이앤씨) 지난 2021년 인천의 한 재개발 공사...,https://mdtoday.co.kr/news/view/1065597143371051
2025-12-30 08:34,헤럴드경제,포스코,"포스코퓨처엠, 25년간 300회 헌혈 ‘영웅’ 배출…“나눔 실천 앞장”",7시간 강병진 포스코퓨처엠 광양양극재생산부 사원이 지난 13일 전남 순천시 헌혈의집 순천센터에서 300번째 헌혈에 동참하고 ‘최고명예대장’ 헌혈 유공장을 받고 있다. [포스코퓨처엠 제공] [헤럴드경제=정경수 기자]...,https://biz.heraldcorp.com/article/10645614?ref=naver
2025-12-30 08:34,스마트투데이,포스코,"포스코퓨처엠, '25년간 300회' 헌혈 영웅 탄생",포스코퓨처엠 광양양극재생산부 강병진 사원이 13일 헌혈의집 순천센터에서 300번째 헌혈에 동참하고 '최고명예대장' 헌혈 유공장을 받았다. 포스코퓨처엠이 누적 300회 헌혈자를 배출하는 등 전국 사업장에서 다양한...,https://www.smarttoday.co.kr/ko-kr/articles/100029
2025-12-30 08:32,,포스코,"포스코퓨처엠, 누적 300회 헌혈자 탄생...'최고명예대장' 유공장 받아",|중앙이코노미뉴스 송태원 기자|포스코퓨처엠 광양양극재생산부 강병진 사원 최고명예대장 헌혈 유공장 수상[사진=포스코퓨처엠] 포스코퓨처엠이 누적 300회 헌혈자를 배출하는 등 전국 사업장에서 다양한 봉사활동을...,https://www.joongangenews.com/news/articleView.html?idxno=481150
2025-12-30 08:32,,포스코,"포스코퓨처엠, 25년간 300회 헌혈 영웅 탄생…나눔 실천 앞장",포스코퓨처엠이 누적 300회 헌혈자를 배출하는 등 전국 사업장에서 다양한 봉사활동을 펼치며 연말연시 따듯한 나눔을 실천하고 있다. 포스코퓨처엠 광양양극재생산부 강병진 사원은 지난 13일 헌혈의집 순천센터에서...,https://www.ebn.co.kr/news/articleView.html?idxno=1693069
2025-12-30 08:30,철강금속신문,포스코플로우,페로타임즈 손바닥뉴스 12월 30일(화),"신청 포스코플로우, 화물 기사 위한 방한복 전달…안전 '방점' KCC글라스, '희망 2026 나눔 캠페인' 동참...이웃사랑 성금 1억원 기탁 삼미금속, 두산에너빌리티와 원전용 터빈 블레이드 공급계약 KBI건설, 2026년 무재해...",http://www.ferrotimes.com/news/articleView.html?idxno=45484
2025-12-30 08:30,연합뉴스,포스코,25년간 헌혈 300회… 포스코퓨처엠 강병진 사원 '최고명예대장',포스코그룹의 이차전지 소재 계열사인 포스코퓨처엠 직원이 고등학생 때부터 25년간 헌혈을 300회 해 대한적십자사로부터 헌혈 유공장 '최고명예대장'을 받았다. 30일 포스코퓨처엠에 따르면 광양양극재생산부 강병진...,https://www.yna.co.kr/view/AKR20251230020400003?input=1195m
2025-12-30 08:30,철강금속신문,포스코플로우,"포스코플로우, 화물 기사 위한 방한복 전달…안전 '방점'",포스코플로우는 지난 23일부터 24일까지 양일간 광양과 포항에서 화물 운송 기사들의 겨울철 안전 운행을 지원하기 위한 방한복을 전달했다고 29일 밝혔다. 이번 행사는 겨울철 야외 작업이 잦은 철강제품 운송 기사들의...,http://www.ferrotimes.com/news/articleView.html?idxno=45477
2025-12-30 08:28,,포스코,"포스코이앤씨, 'A+' 유지했지만…신용도 점검대 오른 이유는",포스코이앤씨 송도 사옥. (사진=포스코이앤씨) | 한스경제=한나연 기자 | 포스코이앤씨의 신용도에 대한 시장의 시선이 다시 한 번 모이고 있다. 한국신용평가는 최근 포스코이앤씨의 무보증사채 신용등급을 A+로...,http://www.hansbiz.co.kr/news/articleView.html?idxno=804319
2025-12-30 08:25,뉴스1,포스코,'의령 60대 노동자 끼임 사망' 포스코이앤씨 현장소장 구속,지난 7월 포스코이앤씨가 시공을 맡은 경남 의령군 함양울산고속도로 공사 현장에서 60대 노동자가... 경남경찰청과 고용노동부 창원지청은 최근 업무상과실치사 및 산업안전보건법 위반 혐의로 포스코이앤씨 현장소장 A...,https://www.news1.kr/local/busan-gyeongnam/6023188
2025-12-30 08:22,이데일리,포스코,"포스코퓨처엠, 올해 1인당 봉사활동 평균 18.7시간","포스코퓨처엠이 누적 300회 헌혈자를 배출하는 등 전국 사업장에서 다양한 봉사활동을 펼치고 있다. 올 한해 전국 사업장에서 다양한 봉사활동을 펼쳐 1인당 평균 18.7시간, 누적 5만 830시간을 달성했다. 포스코퓨처엠...",http://www.edaily.co.kr/news/newspath.asp?newsid=02601046642403768
2025-12-30 08:21,,포스코,'중대재해 사망' 관련 포스코이앤씨 의령 현장소장 구속,ⓒ 윤성효 지난 7월 28일 함양울산고속도로 의령나들목 공사 현장에서 발생한 노동자 사망 중대재해와 관련해 시공사 포스코이앤씨 현장소장이 산업안전보건법 등 위반 혐의로 구속되었다. 고용노동부 창원지청(지청장...,https://www.ohmynews.com/NWS_Web/View/at_pg.aspx?CNTN_CD=A0003194791&CMPT_CD=P0010&utm_source=naver&utm_medium=newsearch&utm_campaign=naver_news
2025-12-30 08:18,중소기업신문,포스코,"포스코퓨처엠 강병진 사원, 누적 헌혈 300회 '최고명예대장'",포스코퓨처엠 광양양극재생산부 강병진 사원은 지난 13일 헌혈의집 순천센터에서 300번째 헌혈에 동참하고... 사진/포스코퓨처엠 포스코퓨처엠이 누적 300회 헌혈자를 배출하는 등 전국 사업장에서 다양한 봉사활동을...,http://www.smedaily.co.kr/news/articleView.html?idxno=347970
2025-12-30 08:16,,포스코,'중대재해' 포스코이앤씨 함양울산고속도 현장소장 구속,경찰과 고용노동부가 포스코이앤씨가 시공하는 함양울산고속도로 의령나들목 공사 현장소장을 구속했다.... 올해 7월 28일 포스코이앤씨가 시공하는 함양울산고속도로 합천~창녕 10공구 공사현장에서 경사면 보강작업을...,https://www.idomin.com/news/articleView.html?idxno=953442
2025-12-30 07:48,,포스코,"[더벨][유동성 풍향계]포스코퓨처엠, 유증부터 회사채 발행까지…재무...",포스코퓨처엠이 올 하반기부터 재무 전략을 바꿨다. 지난해부터 시작된 예상치 못한 전기차 시장 캐즘... 포스코퓨처엠이 공격적인 재무 전략을 택하자 시장이 바라본 시선이다. 재무 개선에 이어 실적도 반등하면서...,https://www.thebell.co.kr/free/content/ArticleView.asp?key=202512261105113560108796
2025-12-30 07:00,,포스코인터,"[3대축 성장 포스코인터①] 팜·곡물 투트랙, '식량 가치망' 진화","포스코인터내셔널은 에너지, 소재, 식량 3대 핵심사업의 경쟁력 강화 전략을 지속적으로 추진하고 있다. 액화천연가스(LNG)·팜 밸류체인을 완성하고 구동모터코아 해외생산기지를 구축하는 등 포스코인터내셔널의...",http://www.seoulwire.com/news/articleView.html?idxno=687670
2025-12-30 07:00,연합뉴스,포스코인터,[우분투칼럼] 축구로 여는 아프리카 진출의 새로운 해법,FC 바르셀로나와 인터 밀란에서 활약했다. 유럽축구연맹(UEFA) 챔피언스리그 우승을 이끌며 아프리카 축구를... 포스코와 LG는 직접적인 경기후원은 하지 않았다. 대신 지역사회를 지원했다. 2025년 8월 말라위의 말라위...,https://www.yna.co.kr/view/AKR20251215087800898?input=1195m
2025-12-29 23:28,,포스코플로우,"포스코플로우, 겨울철 화물기사 안전운행 응원...방한복 전달",지난 23일 화물 기사 안전용품 기증식에 참여한 포스코플로우 직원들이 기념 촬영을 하고 있다./포스코플로우 | 한스경제=임준혁 기자 | 포스코플로우는 지난 23일부터 24일까지 양일간 광양과 포항에서 화물 운송 기사들의...,http://www.hansbiz.co.kr/news/articleView.html?idxno=804536
2025-12-29 18:54,,포스코,"中, 수소환원제철 '세계 첫 100만t' 상용화 vs 포스코 '30년 목표",국내 수소환원제철 상황은 지난 2024년 1월 26일 포스코 수소환원제철개발센터 개소식에서 참석자들이 기념사진을 촬영하고 있다. 사진=포스코 뉴스룸 한국은 2026~2030년 '한국형 수소환원제철 실증기술 개발사업...,https://www.esgeconomy.com/news/articleView.html?idxno=13952
2025-12-29 18:22,,포스코플로우,"포스코플로우, 화물기사 안전운행 지원 앞장",포스코플로우 관계자가 현장에서 일하는 화물 운송 기사들에게 안전용품(방한복)을 전달하며 기념촬영을 하고 있다. 사진=포스코플로우 제공 포스코플로우(사장 반돈호)가 지난 23~24일까지 양일간 광양과 포항에서 화물...,http://www.hidomin.com/news/articleView.html?idxno=603673
2025-12-29 18:06,,포스코,"[인천지법 판결]안전관리 소홀로 노동자 추락사…포스코이앤씨, '벌금 ...",관련해 포스코이앤씨와 하청 업체들에게 안전관리 소홀로 벌금형을 선고했다. 인천지법 형사9단독 (정제민 판사)는 산업안전보건법 위반 혐의로 기소된 포스코이앤씨와 이 회사 소속 현장소장 A(60)씨에게 벌금...,http://www.lawissue.co.kr/view.php?ud=202512291727154944b50722e900_12
2025-12-29 18:02,,포스코인터내셔널,"포스코, 국가유공자·군인 위해 로봇의족·휠체어","포스코인터내셔널은 인천 지역 국가유공자 가정에 여름나기 물품 꾸러미를 전달하고, 중국 다롄·항저우 등 독립운동 사적지의 노후 안내판을 컬러강판 '포스아트'로 교체했다. 포스코는 서호주 한국전쟁 참전용사...",https://www.mk.co.kr/article/11916709
2025-12-29 18:02,,포스코인터내셔널,일회성 기부 넘어 … 현장으로 더 가까이,"포스코인터내셔널은 인천 국가유공자 가정을 지원하고, 중국 다롄·항저우 일대 독립운동 사적지 안내판을 자사 컬러강판 '포스아트'로 교체했다. 포스코는 서호주 한국전 참전용사 추모비 주변 환경을 정비했고...",https://www.mk.co.kr/article/11916712
2025-12-29 17:52,,포스코플로우,"포스코플로우, 혹한기 대비 화물기사에 방한복 지원",광양·포항서 전달식…3억 투입해 현장 안전 강화 포스코플로우는 지난 23일부터 24일까지 이틀간 광양과 포항에서 철강제품 화물 운송 기사들의 겨울철 안전 운행을 지원하고자 방한복을 전달했다고 밝혔다....,https://www.ksg.co.kr/news/main_newsView.jsp?pNum=146222
2025-12-29 17:30,,포스코,"[AI건설시대 열린다] ⑨포스코이앤씨, 특화 AI 스마트기술로 품질 경쟁...",[편집자주] 포스코이앤씨가 건설업에 최적화된 혁신 AI 기술을 기반으로 품질을 높이고 현장 경쟁력을... 29일 포스코이앤씨에 따르면 현장에 AI를 도입해 공사 품질을 높이고 있다. 앞서 포스코이앤씨는 2018년 스마트건설...,https://www.goodkyung.com/news/articleView.html?idxno=279690
2025-12-29 17:28,뉴스락,포스코,"포스코이앤씨, 인천 재개발 현장 추락사고로 벌금형",포스코이앤씨와 협력업체들이 4년 전 인천 재개발 현장에서 발생한 노동자 추락 사망 사고와 관련해... 인천지법 형사9단독(정제민 판사)는 29일 산업안전보건법 위반 혐의로 기소된 포스코이앤씨 법인과 이 회사 소속...,http://www.newslock.co.kr/news/articleView.html?idxno=122215
2025-12-29 17:26,,포스코,'타워크레인 추락 사망' 포스코이앤씨 1심 벌금형,원청인 포스코이앤씨와 하청업체들에게 1심에서 벌금형이 선고됐습니다. 인천지방법원은 산업안전보건법 위반 등의 혐의로 재판에 넘겨진 포스코이앤씨 법인과 소속 직원인 현장소장에게 각각 벌금 1천만 원을...,https://www.ytn.co.kr/_ln/0103_202512291726377625
2025-12-29 17:24,,포스코인터내셔널,'삼성·LG·SK의 새판짜기 돕는다'…떠오르는 M&A 변호사는[시그널 선정...,△졸리비·엘리베이션PE의 컴포즈커피 지분 매각 △SK에코플랜트의 신주 발행 및 주식교환 △SKS PE의 SK에코플랜트 소유 미국 폐배터리 재활용기업인 어센드 엘리먼츠 주식 매수 △포스코인터내셔널과 엔이에이치 합병...,https://www.sedaily.com/NewsView/2H1WNIZGBM
