날짜,매체명,검색키워드,기사제목,주요기사 요약,URL,sentiment
2026-03-12 14:50,,포스코인터,"[인터배터리 2026] 포스코퓨처엠 ""관건은 가격""…소재·공정 혁신전략 공...","홍영준 포스코퓨처엠 기술연구소장은 12일 강남구 코엑스에서 열린 ‘인터배터리 2026’ 부대 행사 ‘더배터리컨퍼런스 2026’에서 ‘무한한 에너지, 지속가능한 미래, 변화를 이끄는 포스코퓨처엠’을 주제로...",https://www.dailian.co.kr/news/view/1620106/?sc=Naver,pos
2026-03-12 14:48,중소기업신문,포스코인터,[인터배터리 2026] 첫날 2만3000여 명 참관…전년 대비 5% 늘,한국배터리산업협회와 코엑스는 인터배터리 2026 개막 첫날 약 2만3000여 명이 전시장을 방문해 역대 최고... 포스코퓨처엠은 고성능 양극재와 음극재 기술을 통해 고에너지밀도 배터리 구현 전략을 소개하며 차세대...,http://www.smedaily.co.kr/news/articleView.html?idxno=353459,pos
2026-03-12 14:40,,포스코인터,"홍영준 포스코퓨처엠 부사장 ""양극재 24%, 흑연 40% 비용 절감""",홍영준 포스코퓨처엠 부사장은 12일 서울 코엑스에서 진행된 '인터배터리 2026 더 배터리 콘퍼런스'를 통해 양극재 생산을 위한 전용 열처리 장비인 RHK(Roller Hearth Kiln) 소성로를 연장(기존 75m)하는 기술 등을 개발하는...,https://www.mt.co.kr/industry/2026/03/12/2026031214355991948,pos
2026-03-12 14:16,,포스코,"옹진복지재단·포스코A&C, 도서지역 '푸른 리본 마을' 조성",'푸른 리본(Re:Born) 마을' 업무협약식 / 옹진군 옹진복지재단과 포스코A&C가 도서지역 활성화를 위한 사회공헌... 위한 포스코A&C의 사회공헌 프로그램이다. 협약에 따라 양 기관은 지역 특성을 반영한 맞춤형 지원 사업을...,http://www.newstown.co.kr/news/articleView.html?idxno=696746,pos
2026-03-12 14:14,,포스코,"호반건설-포스코이앤씨, '층간소음 통합기술 공동개발' 업무협약 체결","포스코이앤씨는 지난 11일 서울 서초구 본사에서 '공동주택 주거환경 개선을 위한 층간소음 통합기술 공동개발' 업무협약(MOU)을 체결했다고 12일 밝혔다. 이날 협약식에는 문갑 호반그룹 경영부문대표, 최종문 포스코이앤...",http://www.lkp.news/news/articleView.html?idxno=77591,pos
2026-03-12 14:13,,포스코,"""층간소음 줄인다""...호반건설-포스코이앤씨 맞손","호반건설과 포스코이앤씨는 지난 11일 서울 서초구 호반건설 본사에서 ‘공동주택 주거환경 개선을 위한... 이날 협약식에는 문갑 호반그룹 경영부문대표, 최종문 포스코이앤씨 연구개발(R&D) 센터장 등 양 사 주요...",http://www.fnnews.com/news/202603121339333626,pos
2026-03-12 14:12,,포스코,"부안군·부안해경·포스코이엔씨·월드비전, 갯벌 생태계 복원 염생식물...","부안군은 부안해양경찰서, 포스코이엔씨·월드비전 등과 함께 12일 부안 줄포만 갯벌에서 갯벌 생태계 복원을 위한 염생식물 종자 파종과 해양정화활동을 실시했다. 부안군은 부안해양경찰서, 포스코이엔씨·월드비전...",http://www.domin.co.kr/news/articleView.html?idxno=1548281,pos
2026-03-12 14:06,,포스코인터내셔널,"아모그린텍, 고효율 자성소재로 글로벌 테크 기업 '러브콜' 봇물",12일 한국거래소에 따르면 포스코인터내셔널은 리비안향 구동모터코아 공급 물량 확대와 자원 개발 가치가 동시에 주목받으며 현재 5.50% 급등한 8만 600원에 거래되고 있다. 고효율 자성 소재 리치 분말을 공급하는...,https://www.pinpointnews.co.kr/news/articleView.html?idxno=436210,pos
2026-03-12 13:56,,포스코,"""층간소음 잡는다""⋯호반건설, 포스코이앤씨와 기술 개발 '맞손'",최종문 포스코이앤씨 R&D센터장이 지난 11일 서울 서초구 본사에서 ‘층간소음 통합기술 공동개발’ 업무협약을 체결한 후 기념촬영을 하고 있다.(사진=호반건설) 12일 호반건설에 따르면 포스코이앤씨와 '공동주택...,https://www.asiatime.co.kr/article/20260312500076,pos
2026-03-12 13:52,시민일보,포스코인터내셔널,"경북청년 무역전문가 양성, 제14기 교육생 모집","아울러 포스코인터내셔널 등 국내 유수의 종합상사와 연계한 체험형 견학, 지역 최대 취업박람회 등 취업 프로그램도 연계 지원한다. 2013년부터 시작한 청년무역사관학교는 지난 13년 동안 총 862명의 수료생을...",https://www.siminilbo.co.kr/news/newsview.php?ncode=1160281223460829,pos
2026-03-12 13:32,아시아경제,포스코인터,"'온실가스' 메탄서 배터리 음극재 생산…포스코퓨처엠, 청사진 공개","홍영준 포스코퓨처엠 기술연구소장은 12일 서울 코엑스에서 열린 '인터배터리2026'의 더배터리컨퍼런스에 참석해 '무한한 에너지, 지속가능한 미래, 변화를 이끄는 포스코퓨처엠'을 주제로 연설했다. 홍 부사장은...",https://view.asiae.co.kr/article/2026031213320994196,pos
2026-03-12 13:15,뉴스핌,포스코인터,"""배터리도 결국 쇳물 노하우""…포스코퓨처엠, 철강 기술로 원가 24% 낮춘...","홍 부사장은 이날 서울 강남구 코엑스에서 열린 '인터배터리 2026' 부대행사 '더 배터리 콘퍼런스'에서 '무한한 에너지, 지속가능한 미래, 변화를 이끄는 포스코퓨처엠'을 주제로 기조연설을 진행하며 이같이 말했다....",https://www.newspim.com/news/view/20260312000624,pos
2026-03-12 13:12,,포스코플로우,광양항 항만배후단지에 물류센터 준공…플로우케이 본격 운영,"12일 여수광양항만공사(이하 YGPA)에 따르면 플로우케이는 포스코플로우와 대우로지스틱스의 합작으로 설립된 법인으로 이차전지, 석유화학 소재 등 포스코그룹을 포함한 고객사의 최적 물류 솔루션을 제공하는...",https://www.namdonews.com/news/articleView.html?idxno=903772,pos
2026-03-12 13:04,,포스코,"옹진복지재단·포스코A&C, 지역사회 공동체 지원 위한 업무협약 체결",(재)옹진복지재단과 포스코A&C는 12일 농어촌 지역과 기업의 상생 협력을 통한 지역공동체 활성화를 위해... 도모하는 포스코A&C의 사회공헌 브랜드다. 양 기관은 지난해에 이어 올해에도 지역 특성을 고려한 맞춤형 지원...,https://www.joongdo.co.kr/web/view.php?key=20260312010004029,pos
2026-03-12 13:02,,포스코인터내셔널,"포스코인터내셔널, 전날 이어 4% 상승…8만원선 재돌파 눈앞",포스코인터내셔널이 가파른 상승세다. 포스코인터내셔널은 12일 코스피 시장에서 오후 1시1분 현재 전 거래일보다 4.32%(3300원) 상승한 7만9700원에 거래되고 있다. 이 회사는 10일을 제외하고 5일부터 11일까지...,http://www.econonews.co.kr/news/articleView.html?idxno=430742,pos
2026-03-12 13:02,,포스코인터내셔널,"설비 고도화로 승부수… 대양금속, 스테인리스 정밀 가공 시장 선도",자원 개발 대장주인 포스코인터내셔널 역시 니켈을 포함한 핵심 광물 밸류체인 구축 모멘텀에 힘입어 4.71% 상승한 8만 원을 기록하며 테마 전반의 기세를 올리고 있다. 이들 기업은 단순 중개를 넘어 생산 단계부터...,https://www.pinpointnews.co.kr/news/articleView.html?idxno=436184,pos
2026-03-12 12:52,잡포스트,포스코인터내셔널,"경북청년 무역전문가 양성, 제14기 교육생 모집","아울러 포스코인터내셔널 등 국내 유수의 종합상사와 연계한 체험형 견학, 지역 최대 취업박람회 등 취업 프로그램도 연계 지원한다. 2013년부터 시작한 청년무역사관학교는 지난 13년 동안 총 862명의 수료생을...",https://www.job-post.co.kr/news/articleView.html?idxno=210039,pos
2026-03-12 12:22,,포스코,"포스코, 실적 감소세에도 장인화 회장 연봉은 70% 증가",장인화 포스코그룹 회장의 지난해 연봉이 전년(2024년)보다 70% 이상 증가한 것으로 나타났다. 12일 포스코홀딩스(포스코)의 사업보고서에 따르면 장 회장은 지난해 20억 8200만 원의 보수를 받았다. 전년 12억 2300만...,https://www.busan.com/view/busan/view.php?code=2026031212053573027,pos
2026-03-12 12:06,,포스코플로우,광양항 배후단지 '플로우케이 광양물류센터' 준공…첨단 물류 거점 본격...,"플로우케이는 포스코플로우와 대우로지스틱스의 합작으로 설립된 물류기업으로, 이차전지와 석유화학 소재 등 포스코그룹을 포함한 고객사에 최적의 물류 솔루션을 제공하고 있다. 이날 준공식에는 플로우케이...",https://www.shinailbo.co.kr/news/articleView.html?idxno=5000423,pos
2026-03-12 11:59,,포스코인터,"[인터배터리 2026] 포스코퓨처엠, 소재 혁신으로 '가격경쟁력↑' 전력 투...","12일 홍영준 포스코퓨처엠 연구소장이 인터배터리2026 현장에서 기술발표를 하고 있다 (사진=김지윤 기자) 홍영준 포스코퓨처엠 연구소장은 12일 서울 코엑스에서 열린 '인터배터리 2026' 기술발표에서 ""배터리 산업의 가장...",https://www.greened.kr/news/articleView.html?idxno=337923,pos
2026-03-12 11:56,,포스코,"이명구 관세청장, 포스코 포항제철소 방문···불공정 무역 엄단, 기업...",이명구 관세청장(왼쪽 다섯 번째)이 12일 포스코 포항제철소를 방문해 업체 관계자들과 간담회를 가지고 기념 촬영하고 있다. [사진: 관세청] 이명구 관세청장은 12일 포항시 동촌동에 소재한 포스코 포항제철소를 방문하여...,https://www.sejungilbo.com/news/articleView.html?idxno=57498,pos
2026-03-12 11:54,,포스코플로우,"플로우케이(주), 광양항 항만배후단지에 물류센터 준공","플로우케이는 포스코플로우와 대우로지스틱스의 합작으로 설립된 법인으로 이차전지, 석유화학 소재 등 포스코그룹을 포함한 고객사의 최적 물류 솔루션을 제공하는 물류기업이다. 이날 준공식에는 플로우케이...",http://www.netongs.com/news/articleView.html?idxno=331493,pos
2026-03-12 11:41,,포스코인터내셔널,외국인은 팔고 개인은 사고…코스피 5600선 두고 엎치락뒤치락,"포스코인터내셔널이 4% 급등하는 가운데, S-oil(2.18%), SK이노베이션(0.67%) 등이 강세다. 뉴욕상업거래소(NYMEX)에 따르면 4월물 서부텍사스산 원유(WTI) 선물은 7% 넘게 뛴 94달러 선에서 거래되고 있다. 10일(현지 시각) 11...",https://biz.chosun.com/stock/stock_general/2026/03/12/NZQZWP2FWJBRHHSY6IWHU6SQMM/?utm_source=naver&utm_medium=original&utm_campaign=biz,neg
2026-03-12 11:41,헤럴드경제,구동모터코아,"포스코인터, 인터배터리에서 신사업 모색",포스코인터내셔널은 시장 선점을 위해 전기차 핵심 부품인 구동모터코아를 생산하고 있다. 구동모터코아는 전기차 심장인 구동모터의 효율을 좌우하는 전기강판 적층 부품이다. 구동모터코아 생산능력을 2030년까지 연...,https://biz.heraldcorp.com/article/10692778?ref=naver,pos
2026-03-12 11:40,헤럴드경제,포스코인터,"포스코퓨처엠 “전고체 양극재 개발 연내 양산, 내년 전기차 탑재 테스...",지난 11일 서울 강남구 코엑스에서 열린 ‘인터배터리 2026’ 포스코퓨처엠 전시장에서 만난 남상철 양극재센터장은 전고체 배터리용 양극재 개발 현황과 관련해 “양극재는 이미 개발이 거의 끝났다”며 “파일럿...,https://biz.heraldcorp.com/article/10692773?ref=naver,pos
2026-03-12 11:06,,미얀마 LNG,"중동 전쟁 경제 파장…유럽·걸프 타격, 중·러 반사익","특히 파키스탄, 대만이 LNG 수급 차질을 빚을 전망이다. 일부 국가는 공급 불안에 대비해 에너지 절약 조치를 시행하고 있으며, 한국과 태국은 연료 가격 상한제를 도입했다. 미얀마는 개인 차량 연료 배급제를...",https://www.newsis.com/view/NISX20260312_0003544866,pos
2026-03-12 10:58,메가경제,포스코인터,"[현장] 배터리 판이 바뀌었다…AI·로봇·우주 등, '인터배터리 2026' 미...","글로벌 배터리 행사인 ‘인터배터리 2026’이 서울 삼성동 코엑스에서 11일부터 사흘간의 일정이 막이... 에코프로, 포스코퓨처엠, LG화학 엘엔에프 등 주요 배터리 소재 기업들이 총출동하해 ‘K-배터리 밸류체인’...",https://www.megaeconomy.co.kr/news/newsview.php?ncode=1065575371020554,pos
2026-03-12 10:56,,포스코,"호반건설·포스코이앤씨, 층간소음 통합기술 공동개발",문갑 호반건설 경영부문대표(왼쪽)와 최종문 포스코이앤씨 R&D센터장이 지난 11일 서울 서초구 본사에서 '층간소음 통합기술 공동개발' 업무협약을 체결한 후 기념촬영을 하고 있다. /호반건설 호반건설과 포스코이앤씨는...,http://www.metroseoul.co.kr/article/20260312500190,pos
2026-03-12 10:52,,포스코,포스코 국내 조강 생산능력 11년 만에 4000만t 아래로 떨어져,"포스코의 국내 조강 생산량이 11년 만에 4000만t 아래로 줄었다. 포스코는 세계 상위 10위권 철강사 중에서 외부 업체를 인수·합병(M&A) 하지 않고 자력으로 생산능력을 키워온 유일한 업체이자, 국내 양대 제철소인...",http://www.thebigdata.co.kr/view.php?ud=202603121044375352570d99e4c8_23,pos
2026-03-12 10:46,파이낸셜포스트,포스코,"호반건설, 포스코이앤씨와 '층간소음 통합기술 공동개발' MOU 체결","본사에서 포스코이앤씨와 '공동주택 주거환경 개선을 위한 층간소음 통합기술 공동개발' 업무협약(MOU)을 체결했다고 12일 밝혔다. 이날 협약식에는 문갑 호반그룹 경영부문대표, 최종문 포스코이앤씨 R&D센터장 등 양사...",https://www.financialpost.co.kr/news/articleView.html?idxno=251060,pos
2026-03-12 10:42,,포스코인터,"파나소닉, 위닝 전략 새로 짜고 승승장구 … K-배터리, 中 따라잡기 급...","배터리3사는 ESS용 LFP 생산라인을 확보했고, 소재사 가운데선 엘앤에프와 포스코퓨처엠이 LFP 양극재 전용 신규 공장을 짓는다. 에코프로비엠은 LFP 대규모 투자 계획을 아직 구체화하지 않았다. 이날 인터배터리 현장을...",https://biz.newdaily.co.kr/site/data/html/2026/03/12/2026031200109.html,pos
2026-03-12 10:36,,포스코,[굿모닝! 12일 건설업계 소식] 포스코이앤씨·반도건설·호반건설,"포스코이앤씨는 헬스케어 전문기업 아크(ARK)와 업무협약을 맺고 공동주택 단지 내 AI(인공지능) 헬스케어... 포스코이앤씨 관계자는 ""집이 단순히 머무는 공간을 넘어 건강과 삶의 질을 관리하는 생활 플랫폼으로 발전하고...",https://www.goodkyung.com/news/articleView.html?idxno=284380,pos
2026-03-12 10:36,,포스코,"호반건설-포스코이앤씨, 층간소음 통합기술 공동개발에 '맞손'","포스코이앤씨는 지난 11일 서울 서초구 본사에서 ‘공동주택 주거환경 개선을 위한 층간소음 통합기술 공동개발’ 업무협약(MOU)을 체결했다고 12일 밝혔다. 이날 협약식에는 문갑 호반그룹 경영부문대표, 최종문 포스코이...",http://www.fntimes.com/html/view.php?ud=202603121024097192b372994c95_18,pos
2026-03-12 10:36,,포스코,"포스코이앤씨, 공동주택에 'AI 헬스케어' 서비스 도입",포스코이앤씨는 지난 11일 헬스케어 전문기업 아크와 업무협약을 맺고 시공을 맡은 공동주택 단지 내 AI(인공지능) 헬스케어 서비스를 도입한다고 12일 밝혔다. ▲포스코이앤씨가 지난 11일 전문적인 건강관리 서비스를...,http://www.consumernews.co.kr/news/articleView.html?idxno=751748,pos
2026-03-12 10:36,,포스코,"호반건설-포스코이앤씨, '층간소음 통합기술 공동개발' 업무협약 체결","포스코이앤씨는 지난 11일 서울 서초구 본사에서 '공동주택 주거환경 개선을 위한 층간소음 통합기술 공동개발' 업무협약(MOU)을 체결했다고 12일 밝혔다. 이날 협약식에는 문갑 호반그룹 경영부문대표, 최종문 포스코이앤...",https://www.econovill.com/news/articleView.html?idxno=732868,pos
2026-03-12 10:34,데일리한국,포스코플로우,"여수광양항만공사, 플로우케이 물류센터 준공","플로우케이는 포스코플로우와 대우로지스틱스의 합작으로 설립된 법인으로 이차전지, 석유화학 소재 등 포스코그룹을 포함한 고객사의 최적 물류 솔루션을 제공하는 물류기업이다. 이날 준공식에는 플로우케이...",https://daily.hankooki.com/news/articleView.html?idxno=1345903,pos
2026-03-12 10:32,,포스코플로우,"플로우케이(주), 광양항에 최첨단 물류센터 준공","플로우케이는 포스코플로우와 대우로지스틱스의 합작으로 설립된 법인으로, 이차전지와 석유화학 소재 등 포스코그룹을 포함한 고객사에 최적의 물류 솔루션을 제공하는 기업이다. 이날 준공식에는 플로우케이...",https://www.viva100.com/article/20260312500531,pos
2026-03-12 10:30,,포스코인터내셔널,"포스코인터내셔널 주가, 3월 12일 장중 79,100원 3.53% 상승","12일 오전 10시 27분 기준, 네이버페이 증권에 따르면 포스코인터내셔널 주가는 현재 79,100원을 기록하며 지난 종가 76,400원 대비 2,700원 상승한 3.53%의 오름세를 보이고 있다. 주가는 79,500원으로 장을 시작한...",https://www.topstarnews.net/news/articleView.html?idxno=16001485,pos
2026-03-12 10:14,,포스코인터내셔널,"포스코인터내셔널·SNT에너지, 시추 및 냉각 설비 수요 폭증에 주가 방...",한국거래소에 따르면 포스코인터내셔널은 미국 현지 셰일가스 광구 개발 참여 경험과 더불어 에너지 트레이딩 역량이 부각되며 이날 오전 10시9분 현재 5.89% 상승한 8만 900원에 거래 중이다. 셰일가스 추출 및 액화...,https://www.pinpointnews.co.kr/news/articleView.html?idxno=436130,pos
2026-03-12 10:11,뉴스1,포스코플로우,"플로우케이, 광양항 배후단지에 물류센터 준공","플로우케이는 포스코플로우와 대우로지스틱스 합작으로 설립된 법인이다. 이차전지, 석유화학 소재 등 포스코그룹을 포함한 고객사의 최적 물류 솔루션을 제공하는 물류기업이다. 준공된 광양물류센터는 총 부지 면적...",https://www.news1.kr/local/gwangju-jeonnam/6098671,pos
2026-03-12 10:08,,포스코인터,"[현장에서] ""중국보다 싸다"" 퓨처엠 자신감에 거는 기대","굉장히 빠른 시간 안에 만들 수 있습니다."" 11일 '인터배터리 2026'에서 만난 남상철 포스코퓨처엠[003670] 양극재연구센터장의 말에는 강한 자신감이 묻어났다. 이날 10분 남짓 진행된 짧은 기자 간담회에서는 LFP 시장에서...",https://news.einfomax.co.kr/news/articleView.html?idxno=4403264,pos
2026-03-12 10:00,,포스코인터,"포스코퓨처엠, ‘BoT 시대’ 선언…“모든 사물은 배터리로”","포스코퓨처엠이 서울 코엑스(COEX)에서 11일부터 13일까지 개최하는 ‘인터배터리 2026(InterBattery 2026)’에 참가해 모든 사물이 배터리로 움직이는 ‘BoT(Battery of Things)’ 시대를 천명하고, 혁신 기술과 솔루션을 대거...",https://kidd.co.kr/news/245227,pos
2026-03-12 09:40,,포스코인터내셔널,인도네시아 니켈 확보한 LX인터내셔널… 글로벌 공급망 '키플레이어' 부...,12일 한국거래소에 따르면 포스코인터내셔널은 미얀마 가스전 등 해외 자원 개발 성공 경험을 바탕으로 에너지 밸류체인을 확장하며 이날 오전 9시 32분 현재 4.45% 상승한 7만 9800원에 거래 중이다. 단순 중개를 넘어...,https://www.pinpointnews.co.kr/news/articleView.html?idxno=436112,pos
2026-03-12 09:28,,포스코플로우,"플로우케이, 광양항 배후단지 물류센터 준공","플로우케이는 포스코플로우와 대우로지스틱스가 합작 설립한 물류기업으로, 이차전지와 석유화학 소재 등 포스코그룹을 포함한 고객사의 물류 서비스를 수행하고 있다. 이날 준공식에는 플로우케이 경영진을 비롯해...",https://www.ksg.co.kr/news/main_newsView.jsp?pNum=146748,pos
2026-03-12 09:23,,포스코인터내셔널,[서울데이터랩]유니온머티리얼 22.51% 폭등…실시간 상승률 1위,"71% 상승 중이다. 이밖에도 삼화전자(011230) ▲7.10%, 한국ANKOR유전(152550) ▲6.44%, 포스코인터내셔널(047050) ▲6.15%, 한양증권우(001755) ▲5.78% 등을 기록하며 시장에서 활발히 거래되고 있다.",https://www.seoul.co.kr/news/economy/securities/2026/03/12/20260312500032?wlog_tag3=naver,pos
2026-03-12 09:14,,포스코인터,"포항시, ‘인터배터리 2026’ 참가…글로벌 배터리 허브도시 홍보","에코프로와 포스코퓨처엠, KRST대한동방, 뉴테크에너지, 프렘투 등 지역 기업 부스를 방문해 이차전지 기술과 제품 동향을 살폈다. 장상길 포항시장 권한대행은 ""이번 인터배터리 2026 참가를 통해 포항 이차전지 산업...",http://www.metroseoul.co.kr/article/20260312500054,pos
2026-03-12 09:11,,포스코인터내셔널,"[아침밥] 다올 ""아르헨티나 염호 본격 가동으로 리튬 사업 회복 가시화...","밸류에이션과 관련해서는 SOTP(부문별 합산가치) 방식을 적용했으며, 철강 부문 영업가치 20조6,230억원에 포스코인터내셔널·포스코퓨처엠·포스코DX 등 상장자회사 지분가치를 50% 할인 반영해 적정주가 48만원을...",https://www.sidae.com/article/2026031209082953879,pos
2026-03-12 09:10,,포스코인터내셔널,"경북도, 제14기 청년무역사관학교 교육생 모집",또 포스코인터내셔널 등 국내 종합상사와 연계한 체험형 기업 견학과 지역 취업박람회 참여 등 취업 연계 프로그램도 함께 운영한다. 청년무역사관학교는 2013년 시작된 이후 13년 동안 총 862명의 수료생을 배출했으며...,http://www.metroseoul.co.kr/article/20260312500070,pos
2026-03-12 08:54,,포스코인터,'보이지 않는 손'..배터리 소재 기업들의 전략은?,"-원료 확보·재활용·열폭주 대응 등 솔루션 내놔 -고려아연·포스코·에코프로 소재 기술 과시 -LG화학... 11일 코엑스에서 개막한 '2026 인터배터리'에서는 주요 소재 기업들이 원료 확보부터 소재 개발, 재활용, 안전...",http://autotimes.co.kr/detail.php?number=686920&thread=27,pos
2026-03-12 08:42,에너지경제,포스코인터,"[현장] 배터리 빅3, 전기차에서 ESS·로봇으로 ‘갈아타기’","한편, 인터배터리 2026은 이날부터 오는 13일까지 3일간 서울 코엑스에서 열린다. 이번 행사는 배터리 빅3를 비롯해 포스코퓨처엠, LS일렉트릭, 엘엔에프, 고려아연 등 배터리 전 밸류체인에 걸친 667개 국내외...",https://www.ekn.kr/web/view.php?key=20260312026387011,pos
2026-03-12 08:28,에너지경제,포스코인터,"[E-로컬뉴스] 경주시, 포항시, 경주시의회, 달서구, 계명대, 대구보건대...","에코프로와 포스코퓨처엠, KRST대한동방·뉴테크에너지·프렘투 등 지역 기업 부스를 방문해 이차전지 기술과 제품 동향을 살폈다. 장 권한대행은 “이번 인터배터리 2026 참가를 통해 포항의 이차전지 산업 경쟁력과...",https://www.ekn.kr/web/view.php?key=20260312020097104,pos
2026-03-12 08:26,,포스코,"[단독] 포스코, 수재슬래그 '시멘트 의존' 벗는다…농업·레저·생태복원...",포스코가 철강 생산 과정에서 발생하는 수재슬래그 활용 영역을 시멘트 원료 중심 구조에서 농업·레저... 포스코에 따르면 회사는 수재슬래그 활용 방향을 시멘트 원료 중심 구조에서 벗어나 농업·레저·생태계 복원 및...,http://www.snmnews.com/news/articleView.html?idxno=566308,pos
2026-03-12 08:18,,포스코,"[마켓PRO] Today's pick : ""포스코, 올 하반기부터 리튬 흑자 전환""","= 2025년 실적 부진의 주요 원인이었던 포스코이앤씨, 장가항 STS 등 연결 자회사들의 적자가 낮은 기저로 작용해 2026년에는 수익성 정상화가 기대됨. = 2026년 연결 영업이익은 전년 대비 74% 급증한 3조2000억원...",https://www.hankyung.com/article/202603125274i,pos
2026-03-12 08:14,헤럴드경제,구동모터코어,"포스코인터 사장, 인터배터리 3년 연속 찾아…전기차 등 신사업 구상",이계인 포스코인터내셔널 사장이 서명한 폴란드 공장의 첫 구동모터코어 시제품. [포스코인터내셔널 제공] 포스코인터내셔널은 시장 선점을 위해 전기차 핵심 부품인 구동모터코아를 생산하고 있다. 구동모터코아는...,https://biz.heraldcorp.com/article/10692377?ref=naver,pos
