날짜,매체명,검색키워드,기사제목,주요기사 요약,URL,sentiment
2026-01-30 11:13,,포스코,"포스코이앤씨, 광명 고속도로서 또 오염수 무단 방류","포스코이앤씨가 시공하는 고속도로 건설 현장에서 폐수처리시설을 거치지 않고 오염수를 몰래 내보낸... 이는 '물환경보전법' 제38조 제1항 제1호 위반 사항으로, 경기도는 포스코이앤씨 하청업체를 경찰에 고발하고...",https://www.sidae.com/article/2026013011015668796,neg
2026-01-30 11:13,,포스코,포스코이앤씨 또 ‘기준치 15배 초과 폐수’ 방류…박승원 시장 “환경...,포스코이앤씨가 시행한 광명~서울 고속도로 건설공사 현장에서 폐수처리시설을 부적정하게 운영한 행위가... 점검 결과 포스코이앤씨는 신고 폐수처리시설을 거치지 않고 오염수를 우회 유출하는 비정상 고압호스를...,http://www.inews24.com/view/1933840,pos
2026-01-30 11:11,,포스코,"장인화 포스코그룹 회장, 올해 경영 핵심은 '압도적 실행력'과 '성과창...",포스코그룹 장인화 회장은 올해 '압도적 실행력'과 '성과창출'을 통한 과감한 체질개선 실현을 예고했다. 철강산업과 2차전지 소재사업의 위기를 정면 돌파하겠다는 의미다. 30일 포스코그룹에 따르면 장 회장은 전날 올해...,https://www.imaeil.com/page/view/2026013011035308830,pos
2026-01-30 11:07,디지털타임스,포스코,포스코이앤씨 공사 현장 ‘오염물질 15배 초과 방류’ 또 적발,것” 포스코이앤씨가 시행한 광명~서울 고속도로 건설공사 현장에서 폐수처리시설을 부적정하게 운영한... 결과 포스코이앤씨는 신고 폐수처리시설을 거치지 않고 오염수를 우회 유출하는 비정상 고압호스를 설치...,https://www.dt.co.kr/article/12043839?ref=naver,neg
2026-01-30 11:06,경인매일,포스코,"포스코이앤씨, 광명~서울고속도로 공사장 폐수 불법 배출 재차 적발","결과, 포스코이앤씨가 신고된 폐수처리시설을 거치지 않고 오염수를 우회 배출한 사실을 확인했다고 30일 밝혔다. 점검 결과 포스코이앤씨는 폐수를 정상 처리하지 않고 비정상 고압호스를 설치해 오염수를 외부로...",https://www.kmaeil.com/news/articleView.html?idxno=628255,neg
2026-01-30 11:06,,포스코,"장인화 포스코 회장, ""압도적 실행력으로 시장 신뢰 회복""","장인화 포스코그룹 회장이 올해 경영 키워드로 '압도적 실행력'과 '성과 창출'을 내세우며, 복합 위기 속에서도 과감한 체질 개선을 통해 미래 투자에 대한 가시적 결실을 입증하겠다는 의지를 밝혔다. 포스코그룹은 장...",http://www.newsroad.co.kr/news/articleView.html?idxno=53535,pos
2026-01-30 11:05,,포스코,"포스코, 해외 거점 재편 속도…""미국·인도 확장 본격화""",포스코홀딩스가 해외 생산 거점을 과감히 재편해 미국 관세 대응과 신성장 동력 확보를 동시에 노린다. 중국... 30일 업계에 따르면 포스코홀딩스는 올해 1분기 중국 스테인리스 제철소 장가항포항불수강과...,https://www.newsis.com/view/NISX20260130_0003496439,pos
2026-01-30 11:02,,포스코,"포스코그룹 장인화 회장 ""압도적 실행력으로 미래 성장 투자..'수치'로 ...",인더스트리뉴스 문기수 기자 포스코그룹 장인화 회장이 올해 복합 위기 속 과감한 체질 개선을 통해 미래 투자에 대한 가시적 결실을 '수치'로 입증하겠다고 강조했다. 포스코그룹은 지난 29일 장인화 회장 주재로 올해...,https://www.industrynews.co.kr/news/articleView.html?idxno=77480,pos
2026-01-30 11:00,글로벌이코노믹,포스코인터내셔널,"장인화 회장 ‘압도적 실행력’ 주문했는데... 포스코, 올해는 반등할까","포스코인터내셔널이 호주 세넥스에너지의 LNG 증산과 인도네시아 팜오일 기업 인수 등 밸류체인 확장 효과로 영업이익 1,165억 원을 기록해 전년 1,117억 원 대비 소폭 증가했다. 포스코는 올해는 반드시 실적 반등을...",http://www.globalepic.co.kr/view.php?ud=20260130105636434948439a4874_29,pos
2026-01-30 10:46,메디컬투데이,포스코인터내셔널,"포스코, 22년 만에 '2조 클럽' 붕괴...장인화 체제 흔들",인프라 부문에서는 포스코인터내셔널이 호주 세넥스 에너지의 LNG 증산과 인도네시아 팜오일 기업 인수 등 밸류체인 확장 효과로 영업이익을 전년 대비 소폭 증가한 1165억 원으로 기록했다. 그러나 실적 부진의 핵심...,https://mdtoday.co.kr/news/view/1065576364768983,pos
2026-01-30 10:14,글로벌이코노믹,포스코인터내셔널,"포스코홀딩스, 철강 반등, 건설 추락, 2차전지 고전","포스코인터내셔널은 호주 세넥스에너지 LNG 증산과 인도네시아 팜 기업 인수 등 밸류체인 확장으로 견조한 이익을 유지했다. 매출액 32조3740억원, 영업이익 1조1650억원을 기록했다. 반면 포스코이앤씨는 심각한...",http://www.globalepic.co.kr/view.php?ud=20260130101114965748439a4874_29,pos
2026-01-30 10:04,,포스코인터내셔널,"포스코인터내셔널, 2025년 4분기 컨센서스 초과 실적과 주가 상향",포스코인터내셔널이 2025년 4분기 실적에서 컨센서스를 상회하는 양호한 성과를 기록했다. 최근 3년간 영업이익이 정체 상태였으나 2026년부터 영업이익 성장 사이클에 진입했다. 포스코인터내셔널은 팜사업 확장과...,http://www.ttlnews.com/news/articleView.html?idxno=3074449,pos
2026-01-30 09:38,뉴스락,포스코인터내셔널,"[뉴스락 주식네비 1월 30일] POSCO홀딩스(005490), 리튬 붐은 온다",해외 철강 및 건설 부문이 흑자 전환하고 포스코인터내셔널 등 주요 자회사의 실적 개선이 더해지며 뚜렷한 회복세를 보일 것이라는 전망이다. 특히 김 연구원은 2차전지 소재 사업의 가치 상승에 주목했다. 중국의...,http://www.newslock.co.kr/news/articleView.html?idxno=124209,pos
2026-01-30 09:18,,포스코인터내셔널,"""POSCO홀딩스, 전 부문 실적 개선 전망…목표가↑""-DB","이어 ""친환경 인프라의 경우 포스코인터내셔널 인도네시아 팜 농장을 인수한 효과가 나타날 것""이라고 말했다. 아울러 ""올해 리튬 판매량을 5만톤(t) 대로 추정한다""며 ""포스코필바라리튬솔루션(PPLS) 등이 정상...",https://www.hankyung.com/article/2026013027386,pos
2026-01-30 09:00,,포스코,"포스코그룹 장인화 회장, “미래 투자 성과 가시화…‘수치’로 입증할...",장인화 포스코그룹 회장이 올해 그룹 경영 키워드로 ‘압도적 실행력’과 ‘성과 창출’을 제시했다. 복합 위기 속 과감한 체질 개선을 통해 미래 투자에 대한 가시적 결실을 수치로 입증하겠다는 의지다. 포스코그룹은...,https://www.sedaily.com/article/20002656?ref=naver,pos
2026-01-30 09:00,KPE,포스코,CTX 대안 노선 공개..오창 ‘포스코 더샵’이 다시 언급되는 이유,이 같은 교통 인프라 변화 속에서 오창 중심에 위치한 ‘포스코 더샵’ 공동주택이 다시 언급되고 있다.... 포스코에서 시공하는 ‘더샵 오창 프레스티지’는 이러한 입지적 배경 위에 조성된 브랜드 아파트 단지다. 최근...,http://kpenews.com/View.aspx?No=3958889,pos
2026-01-30 08:58,,포스코,포스코 장인화 회장 “압도적 실행력으로 투자 성과 수치로 증명할 것”,포스코그룹이 올해 경영 기조로 ‘압도적 실행력’과 ‘성과 창출’을 내세우며 미래 성장 투자의 가시적 성과를 수치로 입증하겠다는 방침을 밝혔다. 장인화 포스코그룹 회장은 29일 올해 첫 그룹 경영회의를 주재하고...,https://www.kbmaeil.com/article/20260130500044,pos
2026-01-30 08:58,컨슈머타임스,포스코,"장인화 포스코그룹 회장, 올해 경영 키워드 '압도적 실행력·성과 창출...",포스코그룹 장인화 회장이 지난해 3월 열린 그룹기술전략회의를 주재하고 있다. 컨슈머타임스=최문정 기자 | 장인화 포스코그룹 회장이 올해 그룹 경영 키워드로 '압도적 실행력'과 '성과 창출'을 제시했다. 복합 위기...,https://www.cstimes.com/news/articleView.html?idxno=691029,pos
2026-01-30 08:57,,포스코,"장인화 ""수익성 중심 체질 전환""…포스코, 비상경영 체제 강화",포스코그룹 장인화 회장이 올해 그룹 경영 키워드로 ‘압도적 실행력’과 ‘성과 창출’을 제시했다. 복합 위기 속 과감한 체질 개선을 통해 미래 투자에 대한 가시적 결실을 ‘수치’로 입증하겠다는 의지다. 포스코그룹...,https://zdnet.co.kr/view/?no=20260130084610,pos
2026-01-30 08:56,뉴스1,포스코,"장인화 포스코 회장 ""압도적 실행으로 성과 내야…결실 수치로 입증""",장인화 포스코그룹 회장이 '압도적 실행력'과 '성과 창출'을 올해 그룹 경영 키워드로 제시했다. 복합 위기 속 과감한 체질 개선으로 미래 투자에 대한 결실을 수치로 입증하겠다는 것이다. 포스코그룹은 지난 29일 장 회장...,https://www.news1.kr/industry/company/6056256,pos
2026-01-30 08:54,이투데이,포스코,"포스코 장인화 회장, 올해 첫 경영회의 주재…“수치로 입증할 것”",장인화 포스코그룹 회장이 올해 그룹 경영 키워드로 ‘압도적 실행력’과 ‘성과 창출’을 제시했다. 복합 위기 속 과감한 체질 개선을 통해 미래 투자에 대한 가시적 결실을 수치로 입증하겠다는 의지다. 30일 포스코...,https://www.etoday.co.kr/news/view/2551156,pos
2026-01-30 08:52,KPE,포스코,"포스코 장인화 회장, ‘압도적 실행력’ 주문..올해 첫 경영회의 주재",기자] 포스코그룹 장인화 회장이 올해 그룹 경영 키워드로 ‘압도적 실행력’과 ‘성과 창출’을 제시했다. 복합 위기 속 과감한 체질 개선을 통해 미래 투자에 대한 가시적 결실을 수치로 입증하겠다는 의지다.포스코그...,http://kpenews.com/View.aspx?No=3958922,pos
2026-01-30 08:52,이코노미톡뉴스,포스코,"""압도적 실행력으로 성과를 수치로 증명한다"" 포스코, 2026 첫 경영회의...",포스코그룹이 장인화 회장 주재로 올해 첫 그룹 경영회의를 열고 글로벌 무역장벽 심화와 저성장 장기화... 이차전지소재와 인프라 사업은 고환율·리튬 가격 강세 등 우호적 환경을 기회로 삼아 포스코아르헨티나 리튬...,http://www.economytalk.kr/news/articleView.html?idxno=417113,pos
2026-01-30 08:52,,포스코,"""POSCO홀딩스, 올해 1분기 영업익 큰폭 개선 전망"" -iM증권","또한 신안산선 손실 반영 등에 따른 포스코 E&C 대규모 적자 지속, 2차 전지 소재 부문 자회사 적자 폭 확대... 김 연구원은 ""해외 철강 부문 및 E&C 부문 흑자 전환, 포스코 인터내셔널 실적 개선 등에 기인한다""며...",http://www.biztribune.co.kr/news/articleView.html?idxno=348157,pos
2026-01-30 08:52,스마트투데이,포스코,"POSCO홀딩스, 리튬 실적 가시성 높아져..목표가 45.5만원 상향-KB","|스마트투데이=김세형 기자| KB증권은 30일 포스코홀딩스(POSCO홀딩스)가 4분기 실적은 컨센서스를 하회했으나 리튬 실적 가시성은 높아졌다며 목표주가를 45만5000원으로 9.6% 상향조정했다. KB증권은 ""POSCO홀딩스는...",https://www.smarttoday.co.kr/ko-kr/articles/102465,pos
2026-01-30 08:52,,포스코,"KB證 “포스코퓨처엠, ESS향 LFP 수주가 관건… 목표가 28만원”",KB증권은 포스코퓨처엠에 대해 에너지저장장치(ESS)향 리튬인산철(LFP) 수주 및 양산 경쟁력 확보 여부에... 전날 포스코퓨처엠의 종가는 23만5000원이다. 포스코퓨처엠은 지난해 4분기(10~12월) 매출액 5576억원...,https://biz.chosun.com/stock/stock_general/2026/01/30/UNB6VCBYCJAJZI4KIES4MOE3WM/?utm_source=naver&utm_medium=original&utm_campaign=biz,pos
2026-01-30 08:52,,포스코,"장인화 포스코그룹 회장 ""압도적 실행력으로 미래 투자 결실""… 성과 창...","포스코의 경쟁력을 숫자로 증명하자."" 포스코그룹은 장인화 회장이 올해 그룹 경영 키워드로 '압도적 실행력'과 '성과 창출'을 제시하며, 복합 위기 속에서도 과감한 체질 개선과 실질적 실적 반등에 대한 강한 의지를...",http://www.seoulwire.com/news/articleView.html?idxno=704188,pos
2026-01-30 08:51,,포스코,"장인화 포스코그룹 회장 ""미래 투자 결실, 올해 '수치'로 입증""",장인화 포스코그룹 회장이 올해 그룹 경영 키워드로 '압도적 실행력'과 '성과 창출'을 제시했다. 복합 위기 속 과감한 체질 개선을 통해 미래 투자에 대한 가시적 결실을 '수치'로 입증하겠다는 의지다. 포스코그룹은 전날...,https://www.sidae.com/article/2026013008435150079,pos
2026-01-30 08:50,더팩트,포스코,"장인화 포스코그룹 회장 ""올해 압도적 실행력·성과 창출""…경영회의 개...","""위기 속에서도 기회 찾는 것이 포스코 저력"" 장인화 포스코그룹 회장이 올해 그룹 경영 키워드로 '압도적 실행력'과 '성과 창출'을 제시했다. 복합 위기 속 과감한 체질 개선으로 미래 투자에 가시적 결실을 '수치'로...",https://news.tf.co.kr/read/economy/2287690.htm,pos
2026-01-30 08:48,,포스코인터내셔널,"KB증권, 포스코인터내셔널 올해 영업익 1.3조 추정...목표가 7만3000원 상...",KB증권은 30일 포스코인터내셔널에 대해 투자의견 '매수'를 유지하고 목표주가를 7만3000원으로 상향 조정했다. 목표주가 상향은 우호적 원자재 가격 흐름을 반영해 올해 영업이익률(OP)이 올라갈 것으로...,https://www.goodkyung.com/news/articleView.html?idxno=281813,pos
2026-01-30 08:48,,포스코인터내셔널,1월 29일 주식시장 주요공시,"2029-01-26) ▶포스코인터내셔널, 2025년 연결기준 매출액 32.37조원(전년대비 +0.10%), 영업이익 1.16조원(전년대비 +4.33%), 순이익 6,368.02억원(전년대비 +26.49%) ▶SNT모티브, 2025년 연결기준 매출액 1조원...",https://www.catchnews.kr/news/articleView.html?idxno=120070,pos
2026-01-30 08:48,아시아경제,포스코,"장인화 포스코그룹 회장 ""압도적 성과로 시장 신뢰 회복""",장인화 포스코그룹 회장이 29일 올해 첫 그룹 경영회의를 열고 그룹 경영 계획과 주요 현안을 점검했다. 포스코그룹 경영회의는 그룹 중장기 전략과 주요 현안을 점검하는 자리다. 30일 포스코그룹에 따르면 장 회장은...,https://view.asiae.co.kr/article/2026013008480657894,pos
2026-01-30 08:47,뉴스핌,포스코인터내셔널,"""포스코인터내셔널, 배당 성장 매력 부각"" [모닝 리포트]","키움증권 조재원 애널리스트는 30일 보고서에서 포스코인터내셔널과 관련 ""유가 둔화 국면에도 불구하고 사업 다각화와 투자 성과 누적으로 안정적인 실적 성장이 가능하다""며 ""탄탄한 이익 체력과 주주환원...",https://www.newspim.com/news/view/20260130000128,pos
2026-01-30 08:47,,포스코,"장인화 포스코 회장 ""압도적 실행력의 해…수치로 입증할 것""",장인화 포스코그룹 회장이 올해 그룹 경영 키워드로 ‘압도적 실행력’과 ‘성과 창출’을 제시했다. 복합 위기 속 과감한 체질 개선을 통해 미래 투자에 대한 가시적 결실을 수치로 입증하겠다는 의지다. 포스코그룹은...,https://www.dailian.co.kr/news/view/1604418/?sc=Naver,pos
2026-01-30 08:46,,포스코,"포스코그룹, 첫 경영회의 실시…장인화 회장 “압도적 실행력 바탕 미래...","포스코그룹이 지난 29일 장인화 회장 주재로 올해 첫 그룹 경영회의를 열고, 그룹 경영 계획과 주요 현안을... 분기별로 열리는 포스코그룹 경영회의는 그룹의 중장기 전략과 주요 현안을 점검하는 자리로 이날 회의에는...",https://www.fetv.co.kr/news/article.html?no=211314,pos
