날짜,매체명,검색키워드,기사제목,주요기사 요약,URL
2025-12-17 09:16,,포스코,현대차그룹-포스코 미국 철강공장 투자 구체화…58억 달러 중 29억 달러...,"현대제철 로고 현대제철과 포스코가 2029년 가동을 목표로 추진하는 미국 루이지애나주 제철소와 관련해... (14억6천만달러), 포스코 20%(5억8천만달러), 현대자동차 15%(4억4천만달러), 기아 15%(4억4천만달러)라고 밝혔다....",http://www.smedaily.co.kr/news/articleView.html?idxno=346943
2025-12-17 09:14,,포스코플로우,"포스코그룹, '나눔의 가치'에 100억…연말 이웃돕기 성금 전달",올해에는 △포스코홀딩스 △포스코 △포스코인터내셔널 △포스코이앤씨 △포스코퓨처엠 △포스코DX △포스코플로우 △포스코스틸리온 △포스코엠텍 등 총 9개 그룹사가 참여했다. 장인화 포스코그룹 회장....,http://www.snmnews.com/news/articleView.html?idxno=562615
2025-12-17 09:12,노컷뉴스,포스코,"현대제철·포스코, '58억 달러' 美제철소 합작",현대제철과 포스코가 2029년 상업 생산을 목표로 한 미국 루이지애나주 제철소 건설 프로젝트를 본격화한다. 현대제철과 포스코는 16일 미국 루이지애나주 전기로 일관 제철소 지분 투자를 위한 출자를 단행한다고...,https://www.nocutnews.co.kr/news/6444206?utm_source=naver&utm_medium=article&utm_campaign=20251217091100
2025-12-17 09:12,,포스코인터내셔널,"""나눔 가치 더한다"" 포스코그룹, 연말 이웃돕기 성금 100억 기탁",올해에는 ▲포스코홀딩스 ▲포스코 ▲포스코인터내셔널 ▲포스코이앤씨 ▲포스코퓨처엠 ▲포스코DX ▲포스코플로 ▲포스코스틸리온 ▲포스코엠텍 등 총 9개 그룹사가 참여했다. 사회복지공동모금회에 전달된 성금은...,https://www.financialpost.co.kr/news/articleView.html?idxno=241469
2025-12-17 09:08,이투데이,포스코,"포스코그룹, 연말 이웃돕기 성금 100억 기탁","이투데이=손민지 기자 | 사회복지공동모금회에 성금 전달 누적 출연금 2120억 원 포스코그룹이... 17일 서울 중구 사회복지공동모금회 회관에서 열린 성금 전달식에는 김병준 사회복지공동모금회 회장, 신건철 포스코홀...",https://www.etoday.co.kr/news/view/2536807
2025-12-17 09:06,,포스코인터내셔널,"포스코그룹, 사회복지공동모금회에 연말 성금 100억원 기탁","올해 기탁에는 포스코홀딩스, 포스코, 포스코인터내셔널, 포스코이앤씨, 포스코퓨처엠, 포스코DX, 포스코플로우, 포스코스틸리온, 포스코엠텍 등 9개 그룹사가 참여했다. 사회복지공동모금회에 전달된 성금은 미래세대...",https://www.viva100.com/article/20251217500168
2025-12-17 09:06,,포스코,"포스코, 북미 친환경 철강 승부수…미국 전기로 제철소 참여","포스코홀딩스가 미국 전기로 일관제철소 건설을 위한 현지 투자에 나선다. 16일 포스코홀딩스는 100% 지분을 출자해 미국 델라웨어주에 특수목적법인(SPC) 'POS-Louisiana(가칭)'를 설립하고, 해당 SPC를 통해...",http://www.kdfnews.com/news/articleView.html?idxno=173468
2025-12-17 09:05,뉴스핌,포스코플로우,"포스코그룹, 이웃돕기성금 100억원 기탁...나눔의 가치 더해","올해는 포스코홀딩스, 포스코, 포스코인터내셔널, 포스코이앤씨, 포스코퓨처엠, 포스코DX, 포스코플로우, 포스코스틸리온, 포스코엠텍 등 총 9개 그룹사가 참여했다. 사회복지공동모금회에 전달된 성금은 미래세대...",https://www.newspim.com/news/view/20251217000117
2025-12-17 09:04,,포스코,"포스코그룹, 이웃돕기 성금 100억 기탁…9개 그룹사 참여",장인화 포스코그룹 회장. 사진=포스코그룹 제공 매일일보 = 정경화 기자 | 포스코그룹은 사회복지공동모금회에 연말 이웃돕기 성금 100억원을 기탁했다고 이날 밝혔다. 불확실한 경영환경 속에서도 나눔으로 세상에...,http://www.m-i.kr/news/articleView.html?idxno=1316004
2025-12-17 09:02,,포스코,"포스코PHP봉사단, 지역상권 활성 '착한 선결제' 활동","""최근 철강경기의 심각한 침체로 큰 어려움을 겪고 있는데 시장 활성화에 도움을 준 포스코PHP봉사단에 감사하다."" '포스코PHP봉사단'이 중마 전통시장에서 '착한 선결제' 활동을 펼쳤다. ⓒ 광양제철소 지난 15일 포스코와...",https://www.gukjenews.com/news/articleView.html?idxno=3458977
2025-12-17 09:00,,포스코플로우,"""나눔의 가치 더해요""…포스코그룹, 이웃돕기 성금 100억 기탁","올해에는 포스코홀딩스, 포스코, 포스코인터내셔널, 포스코이앤씨, 포스코퓨처엠, 포스코DX, 포스코플로우, 포스코스틸리온, 포스코엠텍 등 총 9개 그룹사가 참여했다. 성금 전달식에는 김병준 사회복지공동모금회...",https://www.sentv.co.kr/article/view/sentv202512170015
2025-12-17 09:00,,포스코플로우,"포스코그룹, 이웃돕기 성금 100억원 기탁",올해에는 △포스코홀딩스 △포스코 △포스코인터내셔널 △포스코이앤씨 △포스코퓨처엠 △포스코DX △포스코플로우 △포스코스틸리온 △포스코엠텍 등 총 9개 그룹사가 참여했다. 사회복지공동모금회에 전달된...,https://www.ebn.co.kr/news/articleView.html?idxno=1691450
2025-12-17 08:58,,포스코,"포스코그룹, 이웃돕기 성금 100억 기탁...누적 2120억원",포스코그룹이 불확실한 경영환경 속에서도 나눔으로 세상에 가치를 더하기 위해 지난해와 같은 규모의 성금을 출연했다. 포스코그룹은 17일 서울 중구 사회복지공동모금회회관에서 연말 이웃돕기 성금 100억 원을...,https://www.bizwork.co.kr/news/articleView.html?idxno=410361
2025-12-17 08:58,CEO스코어데일리,포스코,"포스코·에코프로·엘앤에프, ESS 확산에 LFP 카드 꺼냈다","포스코퓨처엠, 에코프로비엠, 엘앤에프 등 국내 양극재 3사가 LFP(리튬·인산·철) 양극재 양산을 위한... 3사 중에서 비교적 LFP 시장 진출에 늦은 포스코퓨처엠은 중국 업체와 협력해 추격에 나선다. 에코프로비엠은...",https://www.ceoscoredaily.com/page/view/2025121616154599840
2025-12-17 08:56,,포스코플로우,"포스코그룹, 이웃돕기성금 100억 기탁… 누적 기부액 2120억원","올해에는 포스코홀딩스, 포스코, 포스코인터내셔널, 포스코이앤씨, 포스코퓨처엠, 포스코DX, 포스코플로우, 포스코스틸리온, 포스코엠텍 등 총 9개 그룹사가 참여했다. 사회복지공동모금회에 전달된 성금은 미래세대...",https://www.newscj.com/news/articleView.html?idxno=3352767
2025-12-17 08:56,,포스코,"포스코그룹, 이웃돕기 성금 100억 기탁","포스코그룹이 사회복지공동모금회에 연말 이웃돕기 성금 100억원을 기탁했다고 17일 밝혔다. 17일 서울 중구 사회복지공동모금회 회관에서 열린 성금 전달식에는 사회복지공동모금회 김병준 회장, 포스코홀딩스...",https://www.fetv.co.kr/news/article.html?no=207930
2025-12-17 08:54,,포스코플로우,"포스코그룹, 연말 이웃돕기 성금에 100억원 기탁","올해는 포스코홀딩스, 포스코, 포스코인터내셔널, 포스코이앤씨, 포스코퓨처엠, 포스코DX, 포스코플로우, 포스코스틸리온, 포스코엠텍 등 총 9개 그룹사가 참여했다.사회복지공동모금회에 전달된 성금은 미래세대...",https://www.asiatoday.co.kr/view.php?key=20251217010009055
2025-12-17 08:54,KPE,포스코플로우,"“나눔 가치 실천” 포스코그룹, 이웃돕기 성금 100억 기탁",올해에는 ▲포스코홀딩스 ▲포스코 ▲포스코인터내셔널 ▲포스코이앤씨 ▲포스코퓨처엠 ▲포스코DX ▲포스코플로우 ▲포스코스틸리온 ▲포스코엠텍 등 총 9개 그룹사가 참여했다. 사회복지공동모금회에 전달된...,http://kpenews.com/View.aspx?No=3895299
2025-12-17 08:54,뉴스락,포스코인터내셔널,"[함께가자 우리ESG] 포스코그룹, 연말 이웃사랑 성금 100억 기탁…9개 계...","이번 성금 마련에는 포스코홀딩스를 필두로 포스코, 포스코인터내셔널, 포스코이앤씨, 포스코퓨처엠, 포스코DX, 포스코플로우, 포스코스틸리온, 포스코엠텍 등 총 9개 그룹사가 십시일반 참여해 그룹 차원의 상생...",http://www.newslock.co.kr/news/articleView.html?idxno=121483
2025-12-17 08:52,,포스코인터내셔널,"""연말에도 100억 원 나눔"" 포스코그룹, 26년째 이웃돕기 성금 기탁","올해 기부에는 포스코홀딩스, 포스코, 포스코인터내셔널, 포스코이앤씨, 포스코퓨처엠 등 9개 그룹사가 참여했다. 전달된 성금은 미래세대 교육지원, 취약계층 자립, 지역사회 복지 향상 등 다양한 사회공헌 사업에...",http://www.economytalk.kr/news/articleView.html?idxno=415433
2025-12-17 08:52,,포스코인터내셔널,"포스코그룹, 연말 이웃돕기 성금 100억 기탁",올해에는 △포스코홀딩스 △포스코 △포스코인터내셔널 △포스코이앤씨 △포스코퓨처엠 △포스코DX △포스코플로우 △포스코스틸리온 △포스코엠텍 등 총 9개 그룹사가 참여했다. 올해 성금은 미래세대 교육지원...,https://www.mt.co.kr/industry/2025/12/17/2025121708302614311
2025-12-17 08:52,,포스코인터내셔널,"포스코그룹, 이웃돕기 성금 100억 기탁",올해에는 △포스코홀딩스 △포스코 △포스코인터내셔널 △포스코이앤씨 △포스코퓨처엠 △포스코DX △포스코플로우 △포스코스틸리온 △포스코엠텍 등 총 9개 그룹사가 참여했다. 사회복지공동모금회에 전달된...,http://thetracker.co.kr/View.aspx?No=3895302
2025-12-17 08:51,,포스코인터내셔널,"포스코그룹, 이웃돕기 성금 100억원 기탁",올해에는 ▲포스코홀딩스 ▲포스코 ▲포스코인터내셔널 ▲포스코이앤씨 ▲포스코퓨처엠 ▲포스코DX ▲포스코플로우 ▲포스코스틸리온 ▲포스코엠텍 등 총 9개 그룹사가 참여했다. 사회복지공동모금회에 전달된...,https://www.moneys.co.kr/article/2025121708403985865
2025-12-17 08:50,,포스코플로우,포스코그룹 어려워도 나눔 가치 실현…연말 이웃돕기 성금 100억 전달,올해에는 △포스코홀딩스 △포스코 △포스코인터내셔널 △포스코이앤씨 △포스코퓨처엠 △포스코DX △포스코플로우 △포스코스틸리온 △포스코엠텍 등 총 9개 그룹사가 참여했다. 사회복지공동모금회에 전달된...,http://www.smedaily.co.kr/news/articleView.html?idxno=346937
2025-12-17 08:50,,포스코플로우,"포스코그룹, 이웃돕기 성금 100억 기탁…누적 출연금 2120억원",올해에는 △포스코홀딩스 △포스코 △포스코인터내셔널 △포스코이앤씨 △포스코퓨처엠 △포스코DX △포스코플로우 △포스코스틸리온 △포스코엠텍 등 총 9개 그룹사가 참여했다. 사회복지공동모금회에 전달된...,https://www.businessplus.kr/news/articleView.html?idxno=104280
2025-12-17 08:49,이데일리,포스코플로우,"“나눔가치 실천”…포스코그룹, 이웃돕기 성금 100억 기탁",올해에는 △포스코홀딩스 △포스코 △포스코인터내셔널 △포스코이앤씨 △포스코퓨처엠 △포스코DX △포스코플로우 △포스코스틸리온 △포스코엠텍 등 총 9개 그룹사가 참여했다. 사회복지공동모금회에 전달된...,http://www.edaily.co.kr/news/newspath.asp?newsid=02597766642399504
2025-12-17 08:48,,포스코인터내셔널,"포스코그룹, 연말 이웃돕기 성금 100억 기탁",올해는 ▲포스코홀딩스 ▲포스코 ▲포스코인터내셔널 ▲포스코이앤씨 ▲포스코퓨처엠 ▲포스코DX ▲포스코플로우 ▲포스코스틸리온 ▲포스코엠텍 등 총 9개 그룹사가 참여했다. 강남 포스코 사옥...,https://zdnet.co.kr/view/?no=20251217084721
2025-12-17 08:46,뉴스핌,포스코,"""포스코퓨처엠, 미국 EV 둔화에 실적 가시성 제한"" [모닝 리포트]","흥국증권이 포스코퓨처엠에 대해 투자의견 'HOLD'를 유지하고 목표주가를 기존보다 낮춘 21만원으로... 포스코퓨처엠 포항 양극재 공장 전경 [사진=포스코퓨처엠] 정 연구원은 4분기 실적으로 매출액 7032억원, 영업손실...",https://www.newspim.com/news/view/20251217000087
2025-12-17 08:44,딜사이트TV,포스코,"현대제철, 美 루이지애나 제철소 박차…포스코 공동투자","현대제철은 현대차, 기아, 포스코와 함께 탄소저감 강판에 특화된 친환경 공장을 미국... 남은 지분 20%는 포스코로 구성된다. 현대차그룹과 포스코 투자를 통해 조성하는 자기자본은 총 29억달러...",https://news.dealsitetv.com/articles/162854
2025-12-17 08:42,아주경제,포스코,"흥국증권 ""포스코퓨처엠, 美 전기차 수요 회복 제한적… 목표가↓""",아주경제=홍승우 기자 hongscoop@ajunews.com 포스코퓨처엠. [사진=연합뉴스] 흥국증권은 17일 포스코퓨처엠에 대해 미국 전기차(EV) 수요 회복 경로에 대한 가시성이 제한적이라며 목표주가를 기존 22만원에서 21만원으로...,https://www.ajunews.com/view/20251217083921530
2025-12-17 08:41,,포스코,"[아침밥] 삼성증권 ""포스코퓨처엠 목표가 28만, 포트폴리오 다양성 강점...",삼성증권이 포스코퓨처엠의 목표주가를 28만원을 제시하고 투자의견은 매수를 유지했다. 합작 투자를... 17일 삼성증권에 따르면 포스코퓨처엠은 경북 포항에 LFP 양극재 전용 공장을 짓는 안건을 승인했다고 전날...,https://www.moneys.co.kr/article/2025121708392556289
2025-12-17 08:40,,포스코플로우,"포스코그룹, 이웃돕기 성금 100억 기탁..나눔의 가치 더해",올해에는 △포스코홀딩스 △포스코 △포스코인터내셔널 △포스코이앤씨 △포스코퓨처엠 △포스코DX △포스코플로우 △포스코스틸리온 △포스코엠텍 등 총 9개 그룹사가 참여했다. 사회복지공동모금회에 전달된...,http://www.fnnews.com/news/202512170835079087
2025-12-17 08:37,헤럴드경제,포스코플로우,"포스코그룹, 이웃돕기 성금 100억원 기탁…“나눔 가치 실현”",올해에는 ▷포스코홀딩스 ▷포스코 ▷포스코인터내셔널 ▷포스코이앤씨 ▷포스코퓨처엠 ▷포스코DX ▷포스코플로우 ▷포스코스틸리온 ▷포스코엠텍 등 총 9개 그룹사가 참여했다. 사회복지공동모금회에 전달된...,https://biz.heraldcorp.com/article/10637976?ref=naver
2025-12-17 08:36,이투데이,포스코,"흥국증권 “포스코퓨처엠, 단기 실적 가시성 제한적⋯미국 EV 수요 회복...",이투데이=정수천 기자 | 흥국증권은 포스코퓨처엠에 대해 투자의견 ‘중립(Hold)’을 유지하고 목표주가를... 포스코퓨처엠의 LFP 사업은 기존 삼원계 생산 라인 일부를 LFP로 전환해 자체적으로 생산하는 것과...,https://www.etoday.co.kr/news/view/2536774
2025-12-17 08:30,연합뉴스,포스코인터내셔널,"탁구 신유빈, 내년 1월 WTT 시리즈 출격…주천희와 복식 호흡","우리나라 선수로는 세계 12위 신유빈 외에 16위 주천희(삼성생명), 28위 김나영(포스코인터내셔널), 39위 이은혜(대한항공)가 초청받았다. 지난 1월 세계랭킹 9위까지 올랐던 신유빈은 올해 WTT 시리즈 중국 스매시와...",https://www.yna.co.kr/view/AKR20251216147900007?input=1195m
2025-12-17 08:22,철강금속신문,포스코,"현대제철 美 전기로 지분 50%…포스코 20% ""인도 등 글로벌 보폭 넓혀""",포스코그룹과 현대차그룹은 올해 4 21일 현대차 강남대로 사옥에서 '철강 및 이차전자 분야의 상호 협력을... (왼쪽부터)현대차그룹 기획조정본부장 한석원 부사장과 포스코홀딩스 미래전략본부장 이주태 사장. / 제공...,http://www.ferrotimes.com/news/articleView.html?idxno=45251
2025-12-17 08:10,,포스코,"현대제철·포스코, 미국 루이지애나 전기로 제철소 투자 속도",현대제철과 포스코가 2029년 가동을 목표로 추진 중인 미국 루이지애나주 제철소 건설 프로젝트에 속도를 내고 있다. 17일 철강업계에 따르면 현대제철과 포스코는 지난 16일 미국 루이지애나주 전기로 일관 제철소...,http://www.seoulwire.com/news/articleView.html?idxno=686164
2025-12-17 08:02,,포스코,"현대제철·포스코, 美 루이지애나 전기로 제철소 건설에 본격 투자","현대자동차그룹-포스코그룹 '철강, 이차전지 협력 양해각서 체결식'. 사진=포스코그룹 제공. 현대제철과 포스코가 미국 루이지애나주에 연산 270만t 규모의 전기로 일관 제철소 건설 프로젝트에 속도를 낸다....",https://www.pinpointnews.co.kr/news/articleView.html?idxno=407186
2025-12-17 06:48,,포스코,"포스코퓨처엠, LFP 포트폴리오 확장…""북미 ESS 공략 본격화""","삼성증권은 17일 포스코퓨처엠(003670)에 대해 북미 에너지저장장치(ESS) 시장을 겨냥한 리튬인산철(LFP)... 포스코퓨처엠은 포스코그룹의 이차전지 소재 계열사로, 양극재·음극재를 중심으로 전기차(EV)와 ESS용 핵심...",http://www.newsprime.co.kr/news/article.html?no=716540
2025-12-17 06:22,,포스코,[2025 대한경제 건설대상] 건설기술대상 - 포스코이앤씨,콘크리트 통합 품질관리 인텔리전스 플랫폼 ‘포스아이콘(POS-Icon)’ 눈길 포스코이앤씨(사장 송치영)는... 특히 포스코이앤씨는 영속가능한 성장동력 확보를 위해 스마트 건설기술의 연구개발에 더욱 적극적이다. 이...,https://www.dnews.co.kr/uhtml/view.jsp?idxno=202512121325122120472
2025-12-17 06:14,,포스코,"코스피·코스닥 전 거래일(16일) 주요공시는...포스코, 미국 계열사에 8...","▲ 크라우드웍스[355390], 50억원 유상증자…엑스알피1호조합에 제3자배정 ▲ 포스코, 미국 계열사에 8천586억원 출자 ▲ 현대제철[004020] ""미국 계열사에 2조1천522억원 출자"" ▲ 네이버 ""스페인 계열사...",https://www.pinpointnews.co.kr/news/articleView.html?idxno=407155
2025-12-17 06:06,세계일보,포스코,"포스코퓨처엠, LFP 양극재 공장 신설",포항 영일만 산단에 2026년 착공 ESS 수요 대응 年 5만t 생산 포스코퓨처엠이 리튬인산철(LFP) 양극재 공장을 새로 지어 에너지저장장치(ESS) 시장 경쟁력을 강화한다. 포스코퓨처엠은 최근 이사회에서 포항 영일만 4...,https://www.segye.com/newsView/20251216515652?OutUrl=naver
2025-12-17 06:05,세계일보,포스코,"현대제철·포스코, 美에 제철소 합작","루이지애나주 58억弗 지분투자 年 270만t 생산, 철강 안정공급 현대제철과 포스코가 2029년 상업 생산을 목표로 한 미국 루이지애나주 제철소 건설 프로젝트를 본격화한다. 현대제철과 포스코는 16일 미국 루이지애나주...",https://www.segye.com/newsView/20251216518247?OutUrl=naver
2025-12-17 05:32,,포스코,"현대제철·포스코, 미 제철소 건설 '속도'…투자 확정",현대제철과 포스코가 어제(16일) 2029년 가동을 목표로 추진 중인 미국 루이지애나주 제철소의 지분 투자를... 이어 포스코홀딩스도 지분 투자로 참여하겠다며 현지 투자를 공식화했습니다. 총 투자비는 58억달러 규모로...,http://www.yonhapnewstv.co.kr/MYH20251217053144WBQ
2025-12-17 05:03,,포스코,"포스코퓨처엠, 포항에 LFP 양극재 공장 짓는다",포스코퓨처엠이 급성장하는 에너지저장장치(ESS) 시장에 대응하기 위해 국내에 리튬인산철(LFP) 양극재 공장을 건설한다. 포스코퓨처엠은 경북 포항 영일만4일반산업단지에 LFP 양극재 전용 공장을 짓는 안건을...,https://www.seoul.co.kr/news/economy/industry/2025/12/17/20251217017004?wlog_tag3=naver
2025-12-17 05:03,,포스코,"현대차·포스코, 美제철소 투자 [경제 브리핑]","현대제철과 포스코가 16일 미국 루이지애나주에 건설을 추진하는 ‘전기로 일관제철소’ 투자 규모를 확정했다. 현대제철, 현대자동차, 기아 등 현대차그룹이 지분의 80%를, 나머지 20%를 포스코가 확보한다....",https://www.seoul.co.kr/news/economy/industry/2025/12/17/20251217018004?wlog_tag3=naver
2025-12-17 04:30,,포스코,'ESS 총력전' 나선 K배터리…포스코퓨처엠도 LFP 양극재 공장 짓는다,배터리 소재 기업 포스코퓨처엠이 에너지저장장치(ESS)용 리튬인산철(LFP) 양극재 공장을 국내에 짓는다.... 포스코퓨처엠은 전날 이사회를 열어 경북 포항시 영일만4일반산업단지에 LFP 양극재 전용 공장을 짓기로...,https://www.hankookilbo.com/News/Read/A2025121614550000083?did=NA
2025-12-17 03:04,동아일보,포스코,"포스코퓨처엠, 포항에 LFP 양극재 공장… ‘ESS’ 대응",포스코퓨처엠이 에너지저장장치(ESS) 시장 수요에 대응하고자 리튬인산철(LFP) 배터리 양극재 전용 공장을 건설한다. 포스코퓨처엠은 15일 이사회를 열어 경북 포항시 북구 흥해읍 영일만 4일반산업단지에 이 같은...,https://www.donga.com/news/Economy/article/all/20251216/132979720/2
2025-12-17 01:31,,포스코인터내셔널,"[오피셜] 韓축구 2부 우승 사령탑, 31년 전통의 명가 지휘봉 잡았다... 박...","송 신임 대표이사는 1992년 포스코에 입사해 포스코 경영전략실 팀장, 포스코러시아 법인장, 포스코 홍보기획그룹장, 포스코인터내셔널 커뮤니케이션실장, 포스코홀딩스 정책지원실장 등 주요보직을 역임한...",https://www.besteleven.com/news/articleView.html?idxno=302720
2025-12-17 01:04,,포스코,"포스코퓨처엠, ESS 시장 대응 위해 LFP 양극재 공장 건설",포스코퓨처엠이 급증하는 ESS 시장에 대응하기 위해 리튬인산철(LFP) 양극재 공장을 건설한다. 포스코퓨처엠은 15일 이사회를 열고 포항 영일만4일반산업단지에 LFP 양극재 전용 공장을 짓는 안건을 승인했다. 2026년...,https://www.electimes.com/news/articleView.html?idxno=363048
2025-12-17 00:12,,삼척블루파워,삼척블루파워 강규봉 신임 대표이사 취임,강규봉 삼척블루파워(주) 신임 대표이사가 16일 취임했다. 강 대표이사는 이날 별도의 취임식 대신 출근길 임직원들과 안전의식 제고 및 안전수칙 준수 캠페인을 실시하며 첫 공식 일정을 시작했다. 강 대표이사는 지난해...,https://www.kwnews.co.kr/page/view/2025121619140710360
2025-12-17 00:09,,포스코인터내셔널,대한탁구협회 내년 국대 선발 돌입…장우진 발탁 여부 '주목',"여자 선수로는 12위 신유빈(대한항공)과 18위 주천희(삼성생명), 28위 김나영(포스코인터내셔널)이 유력하다. 다만 대한체육회 인정 국가대표로 발탁되더라도 세계선수권대회와 아시안게임 출전을 위해서는 추가...",https://www.kado.net/news/articleView.html?idxno=2023137
2025-12-17 00:01,,포스코,"[Biz & Now] 포스코퓨처엠, 포항 양극재 공장 신설",포스코퓨처엠이 급증하는 에너지저장장치(ESS) 시장에 대응하기 위해 리튬인산철(LFP) 양극재 공장을... 포스코퓨처엠 관계자는 “이 공장에서 생산되는 LFP 양극재는 전량 ESS용으로 공급할 예정”이라며 “최대...,https://www.joongang.co.kr/article/25390553
2025-12-16 23:54,,포스코,미국 루이지애나 현대제철·포스코 제철소 건설 위한 출자 진행,현대제철과 포스코가 2029년 가동을 목표로 추진하는 미국 루이지애나주 제철소 건설 프로젝트에 속도를 내기로 했습니다. 현대제철과 포스코는 미국 루이지애나주 전기로 일관 제철소 지분 투자를 위한 출자를...,https://www.ytn.co.kr/_ln/0104_202512162354309245
2025-12-16 23:14,,포스코,"현대제철·포스코, 미국 합작제철소 건설···투자 지분 확정",[현대제철] 포스코와 현대제철이 미국 현지에서 신규 제철소 건설에 58억달러(약 8조5591억원)를 함께 투자하는 방안을 확정지었다. 16일 현대제철과 포스코는 미국 루이지애나주 전기로 일관 제철소 지분 투자를...,https://www.ziksir.com/news/articleView.html?idxno=116593
2025-12-16 23:14,,구동모터코어,"딥시크·유니트리 배출한 항저우, 10년 전부터 준비했다",매니코어(群核科技)도 항저우 기반이다. '6마리 작은 용(六小)'으로 불리는 이들의 등장으로 항저우는... 왕싱싱은 유압 구동 대신 전기 모터 직접 구동 방식을 채택해 비용을 80% 절감했다. 모터·제어보드·센서를...,https://platum.kr/archives/277410
