날짜,매체명,검색키워드,기사제목,주요기사 요약,URL
2025-12-26 15:40,연합뉴스,POSCO INTERNATIONAL,KOSPI 200 Closing Price List-1,"81,500 DN 1,300 SeAH Steel Holdings 127,000 DN 2,800 Daewoong 22,500 DN 550 SamyangFood 1,233,000 DN 33,000 POSCO INTERNATIONAL 50,100 DN 1,200 CJ CheilJedang 210,500 DN 500 DWS 25,650 DN 300...",https://en.yna.co.kr/view/AEN20251226006400320?input=2106m
2025-12-26 15:20,,포스코,[브리프] 포스코홀딩스 현대건설 한화시스템 HD건설기계 S-OIL 外,"■ 포스코홀딩스, 포스코미술관서 '한지 스펙트럼'전 개최 전통한지를 현대적으로 재해석한 '한지 스펙트럼' 전시 포스터 | 포스코홀딩스 포스코미술관이 내년 2월 1일까지 특별전 '한지 스펙트럼(Hanji Spectrum)'을...",http://www.biztribune.co.kr/news/articleView.html?idxno=346203
2025-12-26 14:54,,포스코,"포스코퓨처엠, LFP 추가…ESS 양극재 핵심축으로 부상",포스코퓨처엠이 급성장하는 에너지저장장치(ESS) 시장을 겨냥해 리튬인산철(LFP) 양극재 사업에 본격적으로... 26일 배터리 업계에 따르면 포스코퓨처엠은 최근 이사회를 열고 경북 포항 영일만4일반산업단지에 LFP 양극재...,http://www.popcornnews.net/news/articleView.html?idxno=106898
2025-12-26 14:54,,포스코,"포스코퓨처엠, LFP로 방향 튼다…ESS 시대 대비 '포트폴리오 재편'",포스코퓨처엠이 급성장하는 에너지저장장치(ESS) 시장을 겨냥해 리튬인산철(LFP) 양극재 사업에 본격적으로... 26일 배터리 업계에 따르면 포스코퓨처엠은 최근 이사회를 열고 경북 포항 영일만4일반산업단지에 LFP 양극재...,http://www.popcornnews.net/news/articleView.html?idxno=106898
2025-12-26 14:54,,포스코,"현대 예술이 된 한지…포스코, ‘한지 스펙트럼’ 전시회 개최",포스코미술관이 전통 한지를 제작하는 국가무형유산 안치용 한지장과 청년 작가들이 협업한 ‘한지 스펙트럼’ 특별전을 내년 2월1일까지 선보인다. 포스코미술관은 26일 박제된 전통으로서의 한지가 아닌 살아있는...,https://www.khan.co.kr/article/202512261454001
2025-12-26 14:44,,포스코,"포스코미술관, '한지 스펙트럼'전 2월 1일까지 개최",안치용 한지장 전시 전경 ⓒ포스코미술관 포스코미술관이 장인 및 현대적인 감각의 작가가 참여한 특별전 '한지 스펙트럼'을 내년 2월 1일까지 선보인다고 26일 밝혔다. 이번 전시는 박제된 전통으로서의 한지가 아닌...,http://www.sisafocus.co.kr/news/articleView.html?idxno=352592
2025-12-26 14:22,,포스코,"포스코미술관, '한지 스펙트럼' 특별전... 내년 2월 1일까지",사진=포스코홀딩스 포스코미술관이 국가무형유산 한지장 안치용과 박송희·소동호 작가가 참여한 특별전 '한지 스펙트럼'을 내년 2월 1일까지 개최한다. 이번 전시는 국내에 단 4명뿐인 국가무형유산 한지장 가운데 한 명인...,https://www.meconomynews.com/news/articleView.html?idxno=125416
2025-12-26 14:16,,포스코,포스코미술관 ‘한지 스펙트럼’전 개최,"포스코미술관이 국내에 단 4명뿐인 국가무형유산 한지장 중 한 명인 안치용을 필두로, 현대적인 감각의... 특히 이번 전시는 포스코 철강제품을 활용해 전통문화의 맥을 이어가기 위한 실질적 해결책을 제시함으로써...",https://www.viva100.com/article/20251226500559
2025-12-26 14:12,,삼척블루파워,"삼척시, 성탄절 '희망산타' 행사 … '아동·청소년 108명' 선물 전달","이번 행사는 한국가스기술공사 삼척기지지사, 국방과학연구소 삼척해양연구센터, 삼척블루파워, 한전KPS 삼척사업소, 국민건강보험공단 삼척지사, 삼표시멘트 자원봉사단 등 지역 기관과 개인의 후원으로 총 1,060만 원...",https://www.gukjenews.com/news/articleView.html?idxno=3467315
2025-12-26 13:58,,포스코,"[위클리오늘] 포스코노동조합, 아동 쉼터 기부금 전달 ... 지역사회와 상...",포스코노동조합 김성호 위원장이 '광양시마음나누리쉼터'에 기부금을 전달하고 기념찰영을 하고 있다 포스코노동조합(위원장 김성호)은 지난 22일 '광양시마음나누리쉼터'에 기부금을 전달하며 지역사회와 상생을 위한...,http://www.weeklytoday.com/news/articleView.html?idxno=748154
2025-12-26 13:58,,포스코,"포스코미술관, 한지 스펙트럼전 개최",민주신문=김혜인 기자｜포스코미술관은 한지를 주제로 한 특별전 한지 스펙트럼을 내년 2월 1일까지 연다고... 관람객이 구매한 도록과 기념품 수익금은 포스코1%나눔재단에 기부됐다. 재단은 포스코 스테인리스 강재로...,http://www.iminju.net/news/articleView.html?idxno=153039
2025-12-26 13:58,,포스코,"포스코미술관, 전통과 현대 잇는 '한지 스펙트럼'전 개최",포스코미술관 '한지 스펙트럼' 특별전 포스터. / 포스코홀딩스 제공 내년 2월 1일까지 국가무형유산 안치용 한지장과 청년 작가 협업 전시 포스코 철강 기술 활용한 '맞춤형 한지 건조기' 제작·기증 포스코미술관이...,http://www.mhj21.com/171278
2025-12-26 13:56,,포스코,"포스코노조, 광양시 마음나누리쉼터에 500만원 기부",신재호 포스코노동조합 광양지부장(왼쪽)이 지난 22일 광양시마음나누리쉼터를 방문해 기부금을 전달하고 있다./포스코노동조합 | 한스경제=임준혁 기자 | 포스코노동조합은 지난 22일 광양 지역 아동 보호와 심리 회복을...,http://www.hansbiz.co.kr/news/articleView.html?idxno=803939
2025-12-26 13:53,,포스코,"한지와 현대예술의 만남..포스코미술관, ‘한지 스펙트럼’ 특별전 개막",안치용 한지장·박송희·소동호 작가 참여 전통 한지에서 현대 예술로 확장 가능성 제시 굿즈 수익으로 스테인리스 ‘한지 건조기’ 제작 내년 2월 1일까지 포스코센터서 무료 관람 포스코미술관이 국가무형유산 한지장...,https://www.mk.co.kr/article/11575743
2025-12-26 13:52,,포스코인터내셔널,"풍력에서 방산까지… 우림피티에스, 산업 심장부를 잡다",셰일가스 관련주 한국가스공사 한국전력 한국가스공사 SNT에너지 두산에너빌리티 비에이치아이 SK가스 SH에너지화학 포스코인터내셔널 E1 우림피티에스 한국카본도 시장의 주목을 받고 있다. 증권 관계자는...,https://www.pinpointnews.co.kr/news/articleView.html?idxno=410690
2025-12-26 13:42,,포스코,"포스코미술관, 한지 장인 안치용과 젊은 작가 초대 '한지 스펙트럼'전 ...",포스코미술관이 내년 2월 1일까지 국내에 단 4명뿐인 국가무형유산 한지장(韓紙匠/전통한지를 제작하는 장인)... 특히 이번 전시는 포스코 철강제품을 활용해 전통문화의 맥을 이어가기 위한 실질적 해결책을 제시함으로써...,http://www.techholic.co.kr/news/articleView.html?idxno=219424
2025-12-26 13:36,,포스코,"포스코노조, '광양시마음나누리쉼터'에 기부금 500만원 전달","|중앙이코노미뉴스 송태원 기자|포스코노조, '광양시마음나누리쉼터'에 기부금 500만원 전달[사진=포스코노조] 포스코노동조합은 지난 22일, 광양 지역 아동 보호와 심리 회복을 위해 운영되는 '광양시마음나누리쉼터'에...",https://www.joongangenews.com/news/articleView.html?idxno=479941
2025-12-26 13:30,,포스코,"포스코미술관, '한지 스펙트럼'전 개최… 안치용 한지장 참여",포스코홀딩스는 서울 강남구 포스코센터 내 포스코미술관에서 내년 2월 1일까지 특별전 '한지 스펙트럼'이 열린다고 26일 밝혔다. 이번 특별전에는 국내에 단 4명뿐인 국가무형유산 한지장인 안치용을 필두로 현대적인...,https://www.newscj.com/news/articleView.html?idxno=3356261
2025-12-26 12:18,,포스코,"한경국립대-포스코1%나눔재단, 장애학생 장학금 전달식 개최",한경국립대(총장직무대리 김태완)는 포스코1%나눔재단 장학금 전달식이 지난 24일 평택캠퍼스 미래관에서... 한경국립대는 2022년 국내 1호 자회사형 장애인 표준사업장인 포스코휴먼스와 '고등교육 기반 장애인 교육활동...,http://www.veritas-a.com/news/articleView.html?idxno=591838
2025-12-26 12:12,,포스코,"포스코미술관, '한지 스펙트럼'전 개최…안치용 한지장 참여",포스코미술관은 국내에 단 4명뿐인 국가무형유산 한지장(전통한지를 제작하는 장인) 중 한 명인 안치용을... 특히 이번 전시는 포스코 철강제품을 활용해 전통문화의 맥을 이어가기 위한 실질적 해결책을 제시함으로써...,https://www.newspost.kr/news/articleView.html?idxno=219806
2025-12-26 12:04,,포스코,"한경국립대·포스코1%나눔재단, 장애학생 장학금 전달식 개최",한경국립대학교(총장직무대리 김태완)는 지난 24일 평택캠퍼스 미래관에서 포스코1%나눔재단 장학금... 한경국립대학교는 2022년 국내 1호 자회사형 장애인 표준사업장인 포스코휴먼스와 '고등교육 기반 장애인 교육활동...,http://www.enewstoday.co.kr/news/articleView.html?idxno=2374375
2025-12-26 11:58,,포스코,"[나눔뉴스] 초록우산, 포스코지곡·동촌어린이집 플리마켓 후원금 전달...","포스코동촌어린이집 아이들과 함께 후원금 전달하는 사진. ⓒ초록우산 초록우산 경북지역본부(본부장 박정숙)은 포스코지곡어린이집(원장 김금순)과 포스코동촌어린이집(원장 최원실)으로부터 후원금 1,529,500원을...",https://www.ibabynews.com/news/articleView.html?idxno=145806
2025-12-26 11:44,비즈니스코리아,POSCO INTERNATIONAL,Vietnam Emerges as Key R&D Hub for Korean Tech Giants,"and Posco DX under Posco Group have been strengthening development centers in Vietnam in recent... In the International Collegiate Programming Contest (ICPC), the world's largest university...",https://www.businesskorea.co.kr/news/articleView.html?idxno=259674
2025-12-26 11:36,파이낸셜포스트,포스코,"전통과 현대의 만남…포스코미술관, '한지 스펙트럼'전 개최",포스코홀딩스는 서울 강남구 포스코센터 내 포스코미술관에서 내년 2월 1일까지 특별전 '한지 스펙트럼'을 개최한다고 26일 밝혔다. 이번 전시에는 국내에 단 4명뿐인 국가무형유산 한지장(韓紙匠) 중 한 명인 안치용을...,https://www.financialpost.co.kr/news/articleView.html?idxno=242498
2025-12-26 11:28,,포스코,"포스코, 통합 플랫폼 'My POSCO' 공식 오픈…AI 기반 고객 서비스 강화","포스코가 제품 홍보 페이지와 온라인 주문·출하 채널(e-Sales)을 하나로 통합한 'My POSCO'를 공식 오픈했다.... 포스코 마케팅 관계자는 ""My POSCO를 통해 고객 가치를 높이고, 포스코와 고객사가 상호 신뢰를 기반으로 지속...",http://www.ftoday.co.kr/news/articleView.html?idxno=352604
2025-12-26 11:27,헤럴드경제,포스코,포스코미술관 ‘한지 스펙트럼’ 특별전 개최,"국가무형유산 한지장·청년 협업 포스코, 맞춤형 한지 건조기 제작 포스코미술관이 안치용 한지장을 필두로 현대적인 감각의 박송희·소동호 작가가 참여한 특별전 ‘한지 스펙트럼’(사진)을 선보인다고 26일 밝혔다. 이번...",https://biz.heraldcorp.com/article/10644089?ref=naver
2025-12-26 11:24,,포스코,"포스코미술관, 한지장인 안치용과 함께 '한지 스펙트럼' 개최","화이트페이퍼, WHITEPAPER포스코미술관 '한지 스펙트럼' 특별전 포스터 (사진=포스코미술관) 포스코홀딩스가 전통 한지의 아름다움과 현대적 감각을 조명하는 특별전을 연다. 포스코홀딩스는 서울 강남구 포스코센터 내...",http://www.whitepaper.co.kr/news/articleView.html?idxno=256240
2025-12-26 11:18,,포스코,"포스코미술관, '한지 스펙트럼전' 개최",포스코미술관은 국내 단 4명뿐인 국가무형유산 한지장 중 한 명인 안치용을 시작으로 현대적인 감각의... 특히 이번 전시는 포스코 철강 제품을 활용해 전통문화의 맥을 이어가기 위한 실질적 해결책을 제시해 예술을 통해...,http://www.newscape.co.kr/news/articleView.html?idxno=118896
2025-12-26 11:09,,포스코,"포스코노조, 지역사회 아동 쉼터 기부 ""K-노사문화 실천""","포스코노동조합은 22일 광양 지역 아동 보호와 심리 회복을 위해 운영되는 ‘광양시마음나누리쉼터’에... 포스코노동조합은 노동자의 일상 안전뿐 아니라 지역 아동의 보호와 회복, 환경에까지 관심을 확장함으로써, K...",http://www.fnnews.com/news/202512261009043737
2025-12-26 11:00,KPE,포스코인터내셔널,"'나눔의 가치 더하다' 포스코그룹, 이웃돕기 성금 100억 기탁..누적 2120...",올해에는 ▲포스코홀딩스 ▲포스코 ▲포스코인터내셔널 ▲포스코이앤씨 ▲포스코퓨처엠 ▲포스코DX ▲포스코플로우 ▲포스코스틸리온 ▲포스코엠텍 등 총 9개 그룹사가 참여했다. 사회복지공동모금회에 전달된...,http://kpenews.com/View.aspx?No=3905766
2025-12-26 10:52,컨슈머타임스,포스코,"포스코미술관, 특별전 '한지 스펙트럼' 개최",컨슈머타임스=김동역 기자 | 포스코미술관이 국내에 단 4명뿐인 국가무형유산 한지장 중 한 명인 안치용을... 특히 이번 전시는 포스코 철강제품을 활용해 전통문화의 맥을 이어가기 위한 실질적 해결책을 제시함으로써...,https://www.cstimes.com/news/articleView.html?idxno=685872
2025-12-26 10:36,,포스코,"포스코미술관, '한지 스펙트럼'전 개최...전통 한지에 현대 예술 입혀","|중앙이코노미뉴스 송태원 기자|포스코미술관 한지스펙트럼 포스터[사진=포스코] 포스코미술관이 국내에 단 4명뿐인 국가무형유산 한지장 중 한 명인 안치용을 필두로, 현대적인 감각의 박송희·소동호 작가가 참여한...",https://www.joongangenews.com/news/articleView.html?idxno=479880
2025-12-26 10:31,,포스코,"포스코미술관, '한지 스펙트럼' 전시 개최",포스코미술관은 국내에 단 4명뿐인 국가무형유산 한지장(전통한지를 제작하는 장인) 중 한 명인 안치용을... 특히 이번 전시는 포스코 철강제품을 활용해 전통문화의 맥을 이어가기 위한 실질적 해결책을 제시함으로써...,https://www.etnews.com/20251226000093
