날짜,매체명,검색키워드,기사제목,주요기사 요약,URL,sentiment
2026-01-30 16:52,,포스코인터내셔널,[코스피 지수선물 옵션] 선물시장이 먼저 흔들렸다… 대형주 심리 변화...,"LG에너지솔루션과 LG화학, 포스코홀딩스, 포스코퓨처엠, 포스코인터내셔널, 포스코DX 선물은 조정 국면을 보였고, 에코프로와 에코프로비엠 역시 힘이 빠진 모습이었다. 반면 효성중공업과 LS, LS ELECTRIC, 대한전선...",https://www.pinpointnews.co.kr/news/articleView.html?idxno=423823,pos
2026-01-30 16:50,스마트경제,포스코,"포스코이앤씨, 아파트 전력관리 자동화 확대···25개 단지 1.4만 가구 ...","| 스마트에프엔 = 최형호 기자 | 포스코이앤씨가 공동주택 전기요금 절감과 에너지 효율 개선을 위해 '자동형... 30일 포스코이앤씨에 따르면 의정부 더샵 리듬시티를 시작으로 현재까지 전국 25개 단지, 약 1만4000가구에...",https://www.smartfn.co.kr/news/articleView.html?idxno=134503,pos
2026-01-30 16:50,,포스코,[건설 브리핑] 포스코이앤씨·롯데건설,"◇ 포스코이앤씨, 아파트 '자동형 전력 수요관리' 서비스 확대 적용 포스코이앤씨는 '자동형 전력 수요관리 서비스'를 더샵 전 단지로 확대 적용하겠다고 30일 밝혔다. '자동형 전력 수요관리 서비스'는 전력수급...",http://www.niceeconomy.co.kr/news/articleView.html?idxno=88962,pos
2026-01-30 16:48,,포스코,"포스코이앤씨, 지난해 영업손실 4520억원으로 '적자전환'",포스코이앤씨(대표 송치영)가 작년 신안산선 사고 손실 처리 및 공사 중단 등 여파로 지난 한 해 영업손실 4520억원을 내며 적자로 돌아섰다. 지난 29일 포스코홀딩스에 따르면 포스코이앤씨는 매출이 전년보다 27.1...,http://www.koreastocknews.com/news/articleView.html?idxno=116512,neg
2026-01-30 16:46,,포스코,"포스코 노사, '사회적 책임' 다하는 K-노사문화 구축 '맞손'",사진=포스코 | 뉴스워치= 송호길 기자 | 포스코 노사가 불확실성이 가중되고 있는 경영환경 속에서도 지속가능한 포스코형 노사문화 표준을 만들기 위해 손을 맞잡았다. 포스코는 30일 포항 포스코노동조합 사무실에서...,http://www.newswatch.kr/news/articleView.html?idxno=77237,pos
2026-01-30 16:38,동아일보,포스코,"포스코 노사, ‘K-노사문화’ 표준 만든다… 공동연구 킥오프",확보 포스코 노사가 급변하는 경영환경과 불확실성 속에서 지속가능한 발전을 도모하기 위해 ‘포스코형 노사문화’의 표준 모델 수립에 나섰다. 포스코는 30일 포항 포스코노동조합 사무실에서 ‘가치창출형...,https://sports.donga.com/region/article/all/20260130/133266563/1,pos
2026-01-30 16:34,,포스코,"포스코이앤씨, 공동주택 '자동형 전력 수요'관리 확대…에너지 절감·요...","포스코이앤씨가 공동주택을 중심으로 '자동형 전력 수요관리' 서비스를 확대 적용한다. 포스코이앤씨는 의정부 더샵 리듬시티를 시작으로 현재까지 전국 25개 단지, 약 1만4천 세대에 자동형 전력 수요관리 서비스를...",https://www.100ssd.co.kr/news/articleView.html?idxno=205563,pos
2026-01-30 16:32,,포스코,포스코·현대제철 매출 감소에도 영업이익 개선 '한숨 돌렸다',"포스코홀딩스와 현대제철이 연이어 발표한 지난해 경영실적 자료에 따르면, 양 사 모두 매출 규모가... 포스코홀딩스는 29일 영업 실적 발표에서 매출액이 전년 대비 4.9% 감소한 69조 950억 원에 머물렀다. 현대제철도 30일...",https://www.bizhankook.com/bk/article/31349,pos
2026-01-30 16:30,,포스코,"포스코 노사, 철강처럼 단단한 협력...지역과 함께",기자 포스코와 포스코노동조합은 어려운 경제 상황 속에서도 서로 협력해 새로운 노사문화를 만들기로 했다고 30일 밝혔다. 포스코는 이날 포항 포스코노동조합 사무실에서 김성호 노동조합 위원장과 김동희 포스코...,https://www.eroun.net/news/articleView.html?idxno=72212,pos
2026-01-30 16:24,,포스코,"포스코 장인화, '압도적 실행력' 강조…""성과 '수치' 입증""","장인화 포스코그룹 회장이 올해 그룹 경영 키워드로 ‘압도적 실행력’과 ‘성과 창출’을 제시, 미래 투자에 대한 가시적 결실 입증에 나섰다. 포스코그룹은 지난 29일 장인화 회장 주재로 올해 첫 그룹 경영회의를 열고...",http://www.shinailbo.co.kr/news/articleView.html?idxno=2185152,pos
2026-01-30 16:24,,포스코,포스코홀딩스 지난해 영업이익 15.9% 감소,"포스코홀딩스는 지난해(2025년) 매출 69조 948억 원, 영업이익 1조 8,270억 원의 실적을 기록했다고 공시했습니다. 전년 대비 매출은 4.9%, 영업이익은 15.9% 각각 감소했는데 포스코홀딩스는 건설 부문 손실과...",https://www.tbc.co.kr/news/view?pno=20260129162037AE05440&id=203052,neg
2026-01-30 16:24,잡포스트,포스코,"포스코dx 주가, 1월 30일 38,650원 3.97% 하락 마감","30일 KRX 마감 기준, 네이버페이 증권에 따르면 포스코dx가 지난 종가 대비 3.97% 하락한 38,650원에 코스피 시장을 마감했다. 이는 지난 종가 40,250원보다 1,600원 하락한 수치이다. 포스코dx는 시가 40,700원으로...",https://www.job-post.co.kr/news/articleView.html?idxno=204923,neg
2026-01-30 16:24,이코노미톡뉴스,포스코,"""공동주택 에너지 절감 선도"" 포스코이앤씨, 자동형 전력 수요관리 서비...",포스코이앤씨가 공동주택을 중심으로 '자동형 전력 수요관리' 서비스를 확대 적용하며 에너지 절감과... 자동형 전력 수요관리 서비스는 전력수급이 악화될 경우 포스코이앤씨 스마트홈 시스템 'AiQ'를 통해 가입 세대의...,http://www.economytalk.kr/news/articleView.html?idxno=417162,pos
2026-01-30 16:22,,포스코,"포스코 노사, '사회적 책임' 다하는 K-노사문화 구축",30일 포항 포스코노동조합 사무실에서 열린 '가치창출형 노사문화 공동연구 킥오프(Kick-Off)' 행사에서 포스코 노사 주요 관계자들이 기념 촬영을 하고 있다. 사진=포스코 제공 매일일보 = 김채은 기자 | 포스코 노사가...,http://www.m-i.kr/news/articleView.html?idxno=1331818,pos
2026-01-30 16:22,,포스코,"장인화 포스코 회장 ""강도 높은 비상경영 통해 '수치'로 입증하는 성과...",장인화 포스코그룹 회장이 지난해 3월 열린 '그룹기술전략회의'에서 발언하고 있다. 사진=포스코 제공 매일일보 = 김채은 기자 | 장인화 포스코그룹 회장이 '압도적 실행력'을 통해 수치로 드러나는 '성과'를...,http://www.m-i.kr/news/articleView.html?idxno=1331586,pos
2026-01-30 16:19,,포스코,"""오, 전기요금 줄었네""…포스코이앤씨, 아파트 전력관리 서비스 확대","포스코이앤씨가 공동주택 전기요금 부담을 낮추기 위해 '자동형 전력 수요관리' 서비스를 확대 적용한다.... 30일 포스코이앤씨에 따르면 의정부 더샵 리듬시티를 시작으로 현재까지 전국 25개 단지, 약 1만4000세대에...",https://www.mt.co.kr/estate/2026/01/30/2026013015424575354,pos
2026-01-30 16:18,,포스코,"[더벨][냉각기 진입 2차전지 산업] 저가형 LFP+고부가 전고체, 포스코퓨...","포스코퓨처엠이 주력 사업인 양극재의 부진을 타개하기 위해 ‘투트랙’으로 변화를 모색하고 있다.... LFP 양극재는 그간 중국 업체들이 생산하던 제품이었지만, 올해부터 포스코퓨처엠도 양산에 나선다는...",https://www.thebell.co.kr/free/content/ArticleView.asp?key=202601281747350000108486,pos
2026-01-30 16:18,,포스코,"포스코 노사, '사회적 책임' 다하는 K-노사문화 구축 위해 맞손","포스코 노사가 불확실성이 가중되고 있는 경영환경 속에서도 지속가능한 포스코형 노사문화 표준을 만들기 위해 손을 맞잡았다. 포스코는 30일, 포항 포스코노동조합 사무실에서 김성호 포스코노동조합 위원장...",https://news.einfomax.co.kr/news/articleView.html?idxno=4396499,pos
2026-01-30 16:18,,포스코,"포스코이앤씨, ‘자동형 전력 수요관리’ 확대","빅터뉴스 김동욱 기자 포스코이앤씨는 공동주택을 중심으로 ‘자동형 전력 수요관리’ 서비스를 확대한다고 30일 밝혔다. 포스코이앤씨는 의정부 더샵 리듬시티를 시작으로 현재까지 전국 25개 단지, 약 1만4000세대에...",https://www.bigtanews.co.kr/article/view/big202601300013,pos
2026-01-30 16:14,포인트데일리,포스코,"포스코 노사, 가치창출형 노사문화 공동연구 착수…K-노사 모델 구축 나...",사진=포스코 포스코 노사가 철강산업을 둘러싼 불확실한 경영 환경 속에서 사회적 책임을 강화한 새로운 노사관계 모델 구축에 나섰다. 포스코는 30일 포항 포스코노동조합 사무실에서 김성호 포스코노동조합 위원장과...,https://www.pointdaily.co.kr/news/articleView.html?idxno=290988,pos
2026-01-30 16:14,,포스코,"포스코이앤씨, 신축 아파트에 ‘자동형 전력 수요관리’ 확대 적용",포스코이앤씨는 공동주택을 중심으로 자동형 전력 수요관리 서비스를 확대 적용한다고30일 밝혔다.... 포스코이앤씨는 이를 국내 공동주택 자동형 전력 수요관리 적용 사례 가운데 최대 규모라고 설명했다. 실제...,https://www.viva100.com/article/20260130500770,pos
2026-01-30 16:12,,포스코인터내셔널,"포스코홀딩스, 지난해 매출 69조…“올해 반등”","인프라부문에서는 포스코인터내셔널이 호주 세넥스에너지 LNG 증산, 인니 팜 기업 인수 등 밸류체인 확장으로 견조한 이익을 유지했다. 포스코이앤씨는 플랜트 등 수주 확대에도 공사 중단에 따른 일회성 손실 비용이...",https://weekly.cnbnews.com/news/article.html?no=204515,neg
2026-01-30 16:12,,포스코,"포스코그룹 장인화 회장, ""압도적 실행력으로 미래 성장 투자 성과 가시...",사진은 포스코그룹 장인화 회장. (사진 = 포스코) 포스코그룹 장인화 회장이 올해 그룹 경영 키워드로 '압도적 실행력'과 '성과 창출'을 제시했다. 이는 장 회장이 복합 위기 속 과감한 체질 개선을 통해 미래 투자에 대한...,https://www.gukjenews.com/news/articleView.html?idxno=3494003,pos
2026-01-30 16:10,아주경제,포스코,"포스코 노사, '사회적 책임' 다하는 K-노사문화 구축 위해 '맞손'",com 포스코 노사 가치창출형 노사문화 공동연구 Kick-Off 단체 기념 촬영 장면. [사진=포항제철소] 포스코 노사가 사회적 책임을 다하는 K-노사문화 구축을 위해 손을 잡았다. 포스코는 30일 포항 포스코노동조합 사무실에서...,https://www.ajunews.com/view/20260130160055466,pos
2026-01-30 16:10,,포스코,"장인화 포스코그룹 회장 ""수익성 중심으로 그룹체질 개선할 것""",장인화 포스코그룹 회장이 올해 그룹 경영 키워드로 '압도적 실행력'과 '성과 창출'을 제시했다. 복합 위기 속 과감한 체질 개선을 통해 미래 투자에 대한 가시적 결실을 '수치'로 입증하겠다고 강조했다. 포스코그룹은...,http://www.smarttimes.co.kr/news/articleView.html?idxno=42240,pos
2026-01-30 16:10,,포스코,포스코그룹 올해 경영키워드는 '압도적 실행력·성과 창출'...장인화 회...,"포스코그룹이 올해 경영 키워드로 '압도적 실행력'과 '성과 창출'을 제시했다. 포스코그룹은 지난 29일 장인화 회장 주재로 올해 첫 그룹 경영회의를 열고, 2026년 경영 계획과 주요 현안을 점검했다고 30일 밝혔다....",http://www.updownnews.co.kr/news/articleView.html?idxno=316027,pos
2026-01-30 16:09,,포스코,"""전기요금 한달치 절감"" 포스코이앤씨, 아파트 '자동형 전력관리' 확대",인천 송도 소재 포스코이앤씨 사옥 전경. [사진 포스코이앤씨] 포스코이앤씨가 공동주택을 중심으로 '자동형 전력 수요관리' 서비스를 확대 적용한다고 30일 밝혔다. 포스코이앤씨는 의정부 더샵 리듬시티를 시작으로...,https://www.catchnews.kr/news/articleView.html?idxno=120120,pos
2026-01-30 16:08,,포스코인터내셔널,"포스코홀딩스, '잠재 부실 털어내기' 끝...북미 철강 투자와 리튬 가격...","권 연구원은 ""중국 장가항 제철소 매각 관련 위로금 등 약 1320억 원, 포스코이앤씨의 공사 중단 손실 등 약 1900억 원, 포스코인터내셔널 자회사 구조조정 비용 약 570억 원, 포스코퓨처엠 재고평가손실 약 400억 원이 실적에...",http://www.lkp.news/news/articleView.html?idxno=75714,neg
2026-01-30 16:08,,포스코,"포스코 노사, '사회적 책임' 다하는 K-노사문화 구축 위해 '맞손'","포스코 노사가 불확실성이 가중되고 있는 경영환경 속에서도 지속가능한 포스코형 노사문화 표준을 만들기 위해 손을 맞잡았다. 포스코는 30일, 포항 포스코노동조합 사무실에서 김성호 포스코노동조합 위원장, 김동희...",https://www.ilyoseoul.co.kr/news/articleView.html?idxno=512490,pos
2026-01-30 16:08,한국일보,포스코,"광명시, 포스코이앤씨 공사 현장 '오염물질 15배 초과 방류' 또 적발",사진=광명시 광명시는 포스코이앤씨가 시행한 광명~서울 고속도로 건설공사 현장에서 폐수처리시설을... 점검 결과 포스코이앤씨는 신고 폐수처리시설을 거치지 않고 오염수를 우회 유출하는 비정상 고압호스를 설치...,https://weekly.hankooki.com/news/articleView.html?idxno=7147414,neg
2026-01-30 16:05,,포스코인터내셔널,"""한국 차세대 주자, 실패는 약이 된다""… 中 시선 받는 21세 김나영, 국...",한국 여자탁구 간판으로 성장해가는 김나영(포스코인터내셔널)이 국제무대에서 어떤 존재감을 드러낼까. 30일 중국 스포츠 매체 '텐센트스포츠'는 한국 여자탁구의 차세대 주자로 김나영을 집중 조명했다. 매체는 그가...,https://www.mhnse.com/news/articleView.html?idxno=505248,pos
2026-01-30 15:50,,포스코인터내셔널,[더벨][본궤도 오른 K-방산 '원팀 프로젝트'] 잠수함 수주 '겨냥'...캐나...,"다만 그룹 주요 경영진이 별도로 참여한 것으로 알려졌다. 한편, 이날 포스코인터내셔널도 캐나다 광물 개발 기업인 톤갯 메탈(Torngat Metals)과 희토류 개발 협력을 위한 MOU를 체결했다.",https://www.thebell.co.kr/free/content/ArticleView.asp?key=202601271025217080106275,pos
2026-01-30 15:50,,구동모터코아,"[더벨][IR Briefing] 포스코인터, 역대 최대 실적…’에너지·팜·모빌리...","모빌리티 부문에서는 구동모터코아 사업이 흑자 전환했다. 매출은 324억원에서 340억원으로 증가했고, 영업이익은 –2억원에서 19억원으로 개선됐다. 하이브리드 중심의 세일즈 믹스 변화와 원가 개선 효과가...",https://www.thebell.co.kr/free/content/ArticleView.asp?key=202601291425153320104186,pos
2026-01-30 15:40,연합뉴스,POSCO INTERNATIONAL,KOSPI 200 Closing Price List-1,"91,700 DN 700 SamyangFood 1,180,000 DN 36,000 POSCO INTERNATIONAL 62,400 DN 100 CJ CheilJedang 213,500 DN 2,000 Daewoong 24,000 UP 100 TaekwangInd 873,000 UP 50,000 Youngpoong 64,900 DN 1,400 SK...",https://en.yna.co.kr/view/AEN20260130008300320?input=2106m,pos
2026-01-30 15:22,,포스코,"포스코그룹 장인화 회장 ""압도적 실행력으로 미래 성장 투자...수치로 입...",▲장인화 포스코그룹 회장 포스코그룹 장인화 회장이 올해 그룹 경영 키워드로 '압도적 실행력'과 '성과 창출'을 제시했다. 복합 위기 속 과감한 체질 개선을 통해 미래 투자에 대한 가시적 결실을 '수치'로...,http://www.thefirstmedia.net/news/articleView.html?idxno=192383,pos
2026-01-30 15:14,CEO스코어데일리,포스코,"포스코 노사, 사회적 책임 다하는 ‘K-노사문화’ 구축 맞손","포스코 노사가 불확실성이 가중되고 있는 경영환경 속에서도 지속가능한 포스코형 노사문화 표준을 만들기 위해 손을 맞잡았다. 포스코는 30일 포항 포스코노동조합 사무실에서 김성호 포스코노동조합 위원장, 김동희...",https://www.ceoscoredaily.com/page/view/2026013012110889886,pos
2026-01-30 15:14,이데일리,포스코,"“전기료 한달치 아낀다”…포스코이앤씨, 아파트 전력관리 확대",포스코이앤씨가 공동주택에서 전기 사용을 자동으로 줄여 전기요금을 절감하고 보상까지 받을 수 있는 ‘자동형 전력 수요관리’ 서비스를 확대 적용한다. 포스코이앤씨 인천 송도 사옥 전경.(사진=포스코이앤씨)...,http://www.edaily.co.kr/news/newspath.asp?newsid=04159046645322968,pos
2026-01-30 15:14,,포스코,"포스코이앤씨, 공동주택 ‘자동형 전력 수요관리’ 서비스 확대 적용","기자] 포스코이앤씨가 공동주택을 중심으로 ‘자동형 전력 수요관리’ 서비스를 확대 적용하며 공동주택... 자동형 전력 수요관리 서비스는 전력수급 상황이 악화될 경우, 포스코이앤씨의 스마트홈 시스템 AiQ를 통해...",https://www.seoultimes.news/news/article.html?no=2000090673,pos
2026-01-30 15:12,,포스코,"인천시회, 포스코이앤씨 본사 방문···지역업체 하도급 참여 확대 건의","포스코이앤씨 본사를 방문해 지역 전문건설업체 하도급 참여 확대를 요청했다. 이날 시회 조흥수 회장, 지문철 명예회장, 김대중 상생발전위원장을 비롯해 인천시 건설심사과 건설관리팀장 및 담당자와 포스코이앤씨...",https://www.koscaj.com/news/articleView.html?idxno=322064,pos
2026-01-30 15:08,,포스코,"광명시, '오염물질 15배 초과 방류' 포스코이앤씨 현장 또 적발","경기 광명시는 포스코이앤씨(대표 송치영)가 시공 중인 '광명~서울 고속도로 건설공사' 현장에서... 경기도는 물환경보전법 위반 혐의로 포스코이앤씨 하청업체를 경찰에 고발하고, 조업정지 10일의 행정처분을 내릴...",http://www.koreastocknews.com/news/articleView.html?idxno=116506,neg
2026-01-30 15:06,,포스코,"포스코DX 주가, 1월 30일 장중 38,900원 3.35% 하락","따르면 포스코DX 주가는 지난 종가 40,250원보다 1,350원 하락한 38,900원에 거래되고 있다. 이는 3.35... 포스코DX의 시가총액은 5조 9,065억 원으로 코스피 시장에서 100위를 차지한다. 주가수익비율(PER)은 80....",https://www.joongangenews.com/news/articleView.html?idxno=491540,pos
2026-01-30 15:02,,포스코,"포스코그룹 장인화 회장, “압도적 실행력·투자 성과 가시화”",포스코그룹 장인화 회장이 올해 그룹 경영 키워드로 ‘압도적 실행력’과 ‘성과 창출’을 제시했다. 복합 위기 속 과감한 체질 개선을 통해 미래 투자에 대한 가시적 결실을 ‘수치’로 입증하겠다는 의지다. 포스코...,http://www.lawissue.co.kr/view.php?ud=20260130150105132367191f6c6e_12,pos
2026-01-30 14:57,,포스코,"포스코 장인화號 성과 창출 자신했지만, 뒷걸음 친 실적·안전 성적표",장인화 포스코그룹 회장이 올해 첫 그룹 경영회의에서 ‘압도적 실행력을 통한 성과 창출’을 주문했다.... 포스코이앤씨와 포스코 광양제철소 등에서 연이서 발생한 근로자 사망 사고 후 발표한 그룹 차원의...,https://www.mydaily.co.kr/page/view/2026013011420885200,pos
2026-01-30 14:56,미디어펜,포스코,"포스코 노사, ‘K-노사문화’ 공동 설계 착수…불확실성 속 상생 모델 실...",가운데 포스코 노사가 새로운 노사관계 패러다임 구축을 위해 공동 연구에 착수했다. 단기 현안 대응을 넘어 중장기 경영 환경 변화에 대응할 ‘포스코형 노사문화 표준’을 정립하겠다는 구상이다. 가치창출형 노사문화...,https://www.mediapen.com/news/view/1078442,pos
2026-01-30 14:54,,포스코,"포스코 노사, K-노사문화 구축 위해 '맞손'… 공동연구 킥오프",포스코는 포항 포스코노동조합 사무실에서 '가치창출형 노사문화 수립을 위한 노사 공동연구 킥오프(Kick-Off)' 행사를 개최했다고 30일 밝혔다. 이번 공동연구의 핵심은 노동조합이 직원 권익 증진의 본원적 역할과 함께...,https://www.newsquest.co.kr/news/articleView.html?idxno=261084,pos
2026-01-30 14:54,,포스코,"포스코 노사, ‘사회적 책임’ K-노사문화 구축 위해 ‘맞손’","포스코 노사가 지속가능한 포스코형 노사문화 표준을 만들기 위해 손을 맞잡았다. 포스코는 30일 포항 포스코노동조합 사무실에서 김성호 포스코노동조합 위원장, 김동희 포스코 경영지원본부장, 연구 총괄을 맡은...",https://www.viva100.com/article/20260130500674,pos
2026-01-30 14:52,,포스코,"포스코 노사, K-노사문화 구축 협력",포스코 노사가 지속가능한 포스코형 노사문화 표준을 만들기 위해 손을 잡았다. 포스코는 30일 포항 포스코노동조합 사무실에서 '가치창출형 노사문화 수립을 위한 노사 공동연구 킥오프(Kick-Off)' 행사를 개최했다고...,http://www.srtimes.kr/news/articleView.html?idxno=195637,pos
2026-01-30 14:31,,포스코,"장인화 포스코 회장 ""그룹 체질 개선… 올해 숫자로 말하겠다""",장인화 포스코그룹 회장이 강도 높은 비상경영으로 시장의 신뢰를 회복하겠다고 선언했다. 에너지를 철강과 이차전지 소재를 잇는 차기 핵심 사업 분야로 찍어 투자를 이어가겠다는 뜻도 밝혔다. 30일 포스코그룹에...,https://www.hankookilbo.com/news/article/A2026013011150000117?did=NA,pos
2026-01-30 14:26,,포스코,"포스코 노사, 'K-노사문화' 구축 맞손",민주신문=승동엽 기자｜포스코 노사가 불확실성이 가중되고 있는 경영환경 속에서도 지속가능한 포스코형 노사문화 표준을 만들기 위해 손을 맞잡았다. 포스코는 30일 포항 포스코노동조합 사무실에서 김성호...,http://www.iminju.net/news/articleView.html?idxno=156743,pos
2026-01-30 14:24,,포스코,"장인화 포스코 회장 ""수치로 입증할 것""",포스코그룹 장인화 회장이 올해 그룹 경영 키워드로 ‘압도적 실행력’과 ‘성과 창출’을 제시했다. 복합 위기 속 과감한 체질 개선을 통해 미래 투자에 대한 가시적 결실을 ‘수치’로 입증하겠다는 의지다. 포스코...,https://futurechosun.com/?p=143102,pos
2026-01-30 14:22,,포스코,"포스코 노사, 사회적 책임 전면에…'가치창출형 K-노사문화' 시동",포스코 노사가 불확실성이 가중되고 있는 경영환경 속에서도 지속가능한 포스코형 노사문화 표준을 만들기 위해 손을 맞잡았다. 포스코는 1월 30일 포항 포스코노동조합 사무실에서 김성호 포스코노동조합 위원장...,http://www.snmnews.com/news/articleView.html?idxno=564646,pos
2026-01-30 14:20,,포스코,"포스코 노사, 사회적 책임 다하는 문화 조성 위해 맞손",포스코가 30일 포항 포스코노동조합 사무실에서 '가치창출형 노사문화 수립을 위한 노사 공동연구 킥오프' 행사를 개최했다. 이번 공동연구의 핵심은 노동조합이 직원 권익 증진의 본원적 역할과 함께 지역사회와 산업...,https://www.etnews.com/20260130000212,pos
2026-01-30 14:18,,포스코,지난해 매출·이익 후퇴 맛봤던 포스코그룹의 올해 첫 경영회의 : 장인...,"장인화 포스코그룹 회장이 신년 포부를 밝혔다. 포스코홀딩스의 수익성·외형이 전년에 비해 모두 후퇴한 상황에서, 장 회장은 '수익성 개선'을 제 1의 과제로 설정했다. 포스코그룹 장인화 회장이 지난해 3월 열린...",https://www.huffingtonpost.kr/news/articleView.html?idxno=242075,pos
2026-01-30 14:10,,포스코,"포스코, 해외 거점 수익성 개선…원가 절감 노력 성과","포스코의 글로벌 생산 거점들의 수익성이 개선됐다. 30일 포스코에 따르면 지난해 내수 부진과 미국의 50% 고율 관세, 중국산 저가 철강재 공세 등 어려움 속에서도 철강사업 호실적을 거뒀다. 포스코 별도 기준 지난해...",https://www.ebn.co.kr/news/articleView.html?idxno=1697650,pos
2026-01-30 14:10,,포스코,"[기업] 포스코 장인화 ""압도적 실행력으로 성과 창출해야""",장인화 포스코그룹 회장이 올해 사업에서 압도적 실행력으로 가시적 성과를 창출해야 한다고 강조했습니다.... 장 회장은 위기 속에서도 기회의 실마리를 찾아 도약하는 것이 포스코의 저력이라면서 그룹의 경쟁력을...,https://www.ytn.co.kr/_ln/0102_202601301410065183,pos
