날짜,매체명,검색키워드,기사제목,주요기사 요약,URL,sentiment
2026-03-26 17:24,,포스코,"포스코퓨처엠, 제55기 정기주주총회 개최…""음극재 투자·포트폴리오 다...",포스코퓨처엠이 26일 포항 본사에서 제55기 정기주주총회를 열어 이사 선임 및 정관변경 등 안건을 의결했다.... /포스코퓨처엠 제공 포스코퓨처엠이 26일 제55기 정기주주총회를 열고 이사 선임과 정관 변경 등 주요...,http://www.snmnews.com/news/articleView.html?idxno=567085,pos
2026-03-26 17:06,,포스코인터내셔널,"포스코인터내셔널, 정기주총서 재무제표 승인·정관변경·이사 선임 가...","종합 상사 기업 포스코인터내셔널(047050)은 정기주주총회에서 제26기 재무제표 승인과 정관 변경, 이사 선임 등 안건을 모두 가결했다고 26일 공시했다. 주주총회는 2026년 3월 26일 열렸고, 의결권 행사 기준일은...",https://www.digitaltoday.co.kr/news/articleView.html?idxno=646355,pos
2026-03-26 17:00,,포스코,"엄기천 포스코퓨처엠 대표이사 재선임…""베트남 음극재 공장 신설""",엄기천 포스코퓨처엠 사장이 26일 개최된 '제55기 정기주주총회'에서 발언하고 있다. 사진=포스코퓨처엠 제공 매일일보 = 김채은 기자 | 포스코퓨처엠은 26일 '제55기 정기주주총회'를 열어 엄기천 사장의 대표이사 재선임...,https://www.m-i.kr/news/articleView.html?idxno=1358545,pos
2026-03-26 17:00,,포스코,"포스코퓨처엠, 엄기천 대표 재선임…“음극재·베트남 투자 확대”",개선 포스코퓨처엠이 26일 포항 본사에서 제55기 정기주주총회를 연 가운데 대표이사로 재선임된 엄기천 사장이 주주들에게 인사말을 하고 있다. [사진=포스코퓨처엠] [뉴스투데이=박상미 기자] 포스코퓨처엠이 엄기천...,https://www.news2day.co.kr/article/20260326500280,pos
2026-03-26 16:54,,포스코,"포스코청암재단, '청암히어로즈' 첫 수상자에 김종원 원장 선정",포스코청암재단은 지난 25일 서울 포스코센터에서 시상식을 열고 올해 새롭게 제정한 '청암히어로즈'의 첫 번째 수상자로 강원도 인제고려병원 김종원 원장(60세)을 선정했다고 26일 밝혔다. '청암히어로즈'는 우리 사회의...,http://www.seoulwire.com/news/articleView.html?idxno=713338,pos
2026-03-26 16:52,문화일보,포스코,엄기천 포스코퓨처엠 사장 “선제적 투자와 포트폴리오 다변화로 실적 ...,26일 경북 포항시 포스코퓨처엠 본사에서 열린 제55기 정기주주총회에서 엄기천 포스코퓨처엠 사장이 참석한 주주들에게 인사말을 하고 있다. 포스코퓨처엠 제공 엄기천 포스코퓨처엠 사장이 “배터리 소재 분야에서...,https://www.munhwa.com/article/11577625?ref=naver,pos
2026-03-26 16:52,포인트데일리,포스코,"포스코청암재단, 제1호 청암히어로즈에 김종원 인제고려병원 원장 선정","사진=포스코청암재단 포스코청암재단이 25일 서울 포스코센터에서 시상식을 열고, 올해 새롭게 제정한 '청암히어로즈'의 첫 번째 수상자로 강원도 인제고려병원의 김종원 원장(60세)을 선정했다고 26일 밝혔다....",https://www.pointdaily.co.kr/news/articleView.html?idxno=298301,pos
2026-03-26 16:40,,포스코,"포스코퓨처엠, 엄기천 대표이사 재선임…""선제적 투자 추진""",포스코퓨처엠은 26일 제55기 정기주주총회를 열고 이사 선임 및 정관변경 등 안건을 의결했다고 밝혔다.... 기타비상무이사에는 정석모 포스코홀딩스 사업시너지본부장을 신규 선임하고 윤태화·이복실 사외이사를...,https://www.sidae.com/article/2026032615371180849,pos
2026-03-26 16:40,,포스코인터내셔널,[코스피 지수선물ㆍ옵션] 선물시장 흔든 외국인…삼성전자·SK하이닉스...,"KT, LG, DB손해보험, 포스코인터내셔널에서는 혼조세가 지속됐다. 보험과 종합상사 역시 뚜렷한 방향성 없이 움직였다. 하이브, S-Oil, 삼성SDS, 에이피알은 전반적으로 하락 압력이 우세했다. 콘텐츠와 소비 관련 종목도...",https://www.pinpointnews.co.kr/news/articleView.html?idxno=440308,neg
2026-03-26 16:38,,포스코,"엄기천 포스코퓨처엠 대표, 공급계약 성과 강조","화이트페이퍼, WHITEPAPER엄기천 포스코퓨처엠 사장이 26일 경북 포항 본사에서 열린 제55기 정기주주총회에서 참석 주주들에게 인사말을 하고 있다 (사진=포스코퓨처엠) 포스코퓨처엠이 엄기천 대표이사를 재선임하고...",http://www.whitepaper.co.kr/news/articleView.html?idxno=260140,pos
2026-03-26 16:37,,포스코,"""사라진 두꺼비 돌아왔다""…포스코, 광양 섬진강 산란지 복원","포스코 광양제철소는 26일 지역사회와 함께 섬진강 일대 두꺼비 산란지를 복원해 생물 다양성 회복에 성과를 거뒀다고 밝혔습니다. 이번 사업은 포스코 광양제철소 지원금 1,500만 원과 시민 성금 3,000만 원 등 총 4,500만...",https://www.ikbc.co.kr/article/view/kbc202603260049,pos
2026-03-26 16:36,뉴스웨이,포스코,"포스코퓨처엠, 엄기천 사장 재연임…""실적 개선에 최선""",엄기천 포스코퓨처엠 사장이 대표이사로 재선임됐다. 포스코퓨처엠은 26일 제55기 정기주주총회에서 이사 선임 및 정관변경 등 안건을 의결했다고 밝혔다. 엄 사장은 주총 및 이사회를 통해 대표이사로 재선임됐으며...,https://www.newsway.co.kr/news/view?ud=2026032614511095936,pos
2026-03-26 16:34,,포스코,"포스코퓨처엠, 정기주총…엄기천 대표이사 재선임","포스코퓨처엠이 제55기 정기주주총회를 열고 재무제표, 상법 개정에 따른 정관 일부 변경, 감사위원회 위원 선임, 이사 보수한도 등 총 6건의 안건을 승인했다. 포스코퓨처엠은 26일 주총 및 이사회를 통해 엄기천 사장을...",https://www.100ssd.co.kr/news/articleView.html?idxno=207416,pos
2026-03-26 16:34,,포스코,"포스코퓨처엠, ESG위원회 신설로 지배구조 고도화",포스코퓨처엠 주총 및 이사회를 통해 대표이사로 재선임된 엄기천 사장이 주총에서 참석 주주들에게 인사말을 하고 있다. [사진: 포스코퓨처엠] 포스코퓨처엠이 대외 불확실성 속에서도 음극재 수주와 사업 다변화로...,https://www.digitaltoday.co.kr/news/articleView.html?idxno=646176,pos
2026-03-26 16:32,,포스코,"고(故) 박태준 포스코 명예회장 '맏사위' 윤영각 회장, 문충운 포항시장...",고(故) 박태준 포스코 명예회장의 '맏사위'인 윤영각 회장(파빌리온인베스트먼트)이 26일 문충운 국민의힘 포항시장 예비후보의 선거 사무소를 전격 방문해 격려했다. 문충운 예비후보 제공 고(故) 박태준 포스코...,http://www.hidomin.com/news/articleView.html?idxno=614034,pos
2026-03-26 16:31,뉴스핌,포스코,"포스코, 4월 광양 희귀가스 공장 준공...'산업가스'로 미래 성장 가속",포스코는 이러한 변화에 선제적으로 대응해 산업가스 사업을 미래 성장 축으로 육성해 왔다. 오는 4월... 이번 준공은 포스코가 철강을 넘어 첨단산업의 '숨은 동맥' 역할을 본격화하는 신호탄이 될 전망이다. 26일...,https://www.newspim.com/news/view/20260326001094,pos
2026-03-26 16:15,,POSCO International,Posco International aims to offer 50% of earnings for shareholder returns - marketscreener.com,"<a href=""https://news.google.com/rss/articles/CBMiwwFBVV95cUxOeFkyR1o3SjUwbEQ3aGdocmd5enhaRl9LMktpZmx3NGZ4aHRoYmNLSWxFaFp1YXdMaGtvRE1tWUZYN3kxOFlRUDZKcEZGSUpzRE0tanZRWEFTRUhzQWR2WHVWSUpFWS03OF9qX3ZjMFpDbGtZam8tNHA0Yk1CU2Nsam14Q1hoTlpjRm1aRWRzbmhaanY2VVVoT1dlVDdzYzBlNGxaUDZhZ2ZYNm1RVXlDU3NybnRXZ0VfUF8zT2dTT1dNZUE?oc=5"" target=""_blank"">Posco International aims to offer 50% of earnings for shareholder returns</a> <font color=""#6f6f6f"">marketscreener.com</font>",https://news.google.com/rss/articles/CBMiwwFBVV95cUxOeFkyR1o3SjUwbEQ3aGdocmd5enhaRl9LMktpZmx3NGZ4aHRoYmNLSWxFaFp1YXdMaGtvRE1tWUZYN3kxOFlRUDZKcEZGSUpzRE0tanZRWEFTRUhzQWR2WHVWSUpFWS03OF9qX3ZjMFpDbGtZam8tNHA0Yk1CU2Nsam14Q1hoTlpjRm1aRWRzbmhaanY2VVVoT1dlVDdzYzBlNGxaUDZhZ2ZYNm1RVXlDU3NybnRXZ0VfUF8zT2dTT1dNZUE?oc=5,pos
2026-03-26 16:12,이투데이,포스코인터내셔널,"3월 배당주, 배당금 받으려면 언제까지 사야 할까? [그래픽 스토리]",*출처: 한국거래소 ◇3월 배당주 정리 *배당기준일: 3월 31일 LIG넥스원 주가(25일 종가): 73만4000원 배당금(1주당): 2950원 LG 주가(25일 종가): 8만8800원 배당금(1주당): 2100원 포스코인터내셔널 주가(25일 종가)...,https://www.etoday.co.kr/news/view/2569753,pos
2026-03-26 15:54,,포스코인터내셔널,반도체 무한질주…10대그룹 1분기 실적 ‘온도차’,"정상화, 포스코인터내셔널 증익, 장가항 적자 해소 등이 연결 실적을 방어할 것”이라고 했습니다. 이 밖에 신세계는 11% 오른 1469억원의 영업이익을 달성할 것으로 추정됐으며 GS의 영업이익은 작년 1분기보다 7.7...",http://www.newstomato.com/ReadNews.aspx?no=1295693&inflow=N,pos
2026-03-26 15:50,,포스코,"엄기천 포스코퓨처엠 대표 ""음극재 투자 확대로 실적 개선·주주가치 제...","엄기천 포스코퓨처엠 사장은 올해 경영 방향에 대해 ""선제적 투자와 포트폴리오 다변화를 통해 실적 개선과 주주가치 제고에 나서겠다""는 의지를 내비쳤다. 포스코퓨처엠은 26일 제55기 정기주주총회를 열고 이사 선임과...",https://www.newsquest.co.kr/news/articleView.html?idxno=263800,pos
2026-03-26 15:49,디지털데일리,포스코,"""베트남 음극재 공장 신설""…엄기천 포스코퓨처엠 배터리 소재 투자 가...",""" 엄기천 포스코퓨처엠 대표이사가 26일 열린 제55기 정기주주총회에서 이같이 밝히며 차세대 배터리 소재 시장 선점을 위한 공격적인 사업 확장 의지를 드러냈다. 단순한 안건 의결을 넘어 향후 포스코퓨처엠이 글로벌...",https://www.ddaily.co.kr/page/view/2026032615135211496,pos
2026-03-26 15:46,,포스코,"포스코퓨처엠, 엄기천 대표 재선임 ""선제적 투자 나설 것""",포스코퓨처엠이 26일 정기주주총회를 열고 엄기천 대표이사를 재선임했다. 회사는 글로벌 자동차사와의... 포스코퓨처엠은 26일 제55기 정기주주총회를 열어 이사 선임 및 정관변경 등 안건을 의결했다. 이날 엄기천...,https://www.dailian.co.kr/news/view/1626028/?sc=Naver,pos
2026-03-26 15:46,,포스코,"포스코퓨처엠, 실적개선·주주가치 제고 위한 인프라 투자·포트폴리오...",엄기천 포스코퓨처엠 사장이 주총에서 참석 주주들에게 인사말을 하고 있다. [포스코퓨처엠] 포스코퓨처엠이 실적 개선과 주주가치 제고를 위해 인프라 신설을 포함한 선제적 투자와 포트폴리오 다변화를 적극...,https://www.ziksir.com/news/articleView.html?idxno=128645,pos
2026-03-26 15:41,연합뉴스,POSCO INTERNATIONAL,KOSPI 200 Closing Price List-1,"28,000 POSCO INTERNATIONAL 78,200 UP 2,400 CJ CheilJedang 216,500 DN 2,500 TaekwangInd 1,179,000 DN 32,000 POSCO FUTURE M 200,000 DN 2,500 KAL 24,950 DN 450 LG Corp. 87,500 DN 1,300 LOTTE Fine...",https://en.yna.co.kr/view/AEN20260326008200320?input=2106m,pos
2026-03-26 15:37,,포스코,엄기천 포스코퓨처엠 대표 “올해 베트남 음극재 공장 신설 등 선제적 ...,"엄기천 포스코퓨처엠 대표이사는 “올해도 베트남 음극재 공장 신설 등 선제적 투자와 고객 및 제품... 기타비상무이사에는 정석모 포스코홀딩스 사업시너지본부장을 신규 선임하고, 윤태화·이복실 사외이사를...",https://biz.chosun.com/industry/company/2026/03/26/RTOSCJFDXRHWVGCAKYWNGRT4BM/?utm_source=naver&utm_medium=original&utm_campaign=biz,pos
2026-03-26 15:34,,포스코,"[주총핫이슈] 포스코퓨처엠, 엄기천 대표 재선임…음극재 투자 확대·ES...",포스코퓨처엠이 26일 포항 본사에서 제55기 정기주주총회를 열어 이사 선임 및 정관변경 등 안건을 의결했다.... [사진=포스코퓨처엠] 포스코퓨처엠이 26일 제55기 정기주주총회를 열어 이사 선임 및 정관변경 등 안건을...,http://www.paxetv.com/news/articleView.html?idxno=267000,pos
2026-03-26 15:34,,포스코,"[중화학 ON] 포스코퓨처엠, 엄기천 대표 재선임 外","포스코퓨처엠이 정기 주주총회를 열고 엄기천 대표이사를 재선임했다. 이사회는 사외이사 이상영 교수... ◆포스코청암재단, 청암히어로즈 1호 김종원 원장 선정 포스코청암재단이 '청암히어로즈' 첫 수상자로 강원...",https://dealsite.co.kr/articles/159162,pos
2026-03-26 15:30,,포스코인터내셔널,"포스코홀딩스, 1분기 철강 원가 부담에도 자회사 증익 및 정상화에 따른...","권지우 한화투자증권 연구원은 ""철강 부문은 전분기 원가 상승 부담이 반영된 가운데, 가격 전가는 시차를 두고 지연돼 부진한 것""이라며 ""반면 포스코이앤씨 정상화, 포스코인터내셔널 증익 등이 연결 실적을 방어했다...",http://www.lkp.news/news/articleView.html?idxno=78296,pos
2026-03-26 15:26,,포스코,"포스코스틸리온, 제38기 재무제표 승인·현금배당 주당 1085원 결의","철강·에너지 기업 포스코스틸리온(058430)이 정기주주총회에서 제38기 재무제표를 승인하고 보통주... 종목 시세 정보에 따르면 포스코스틸리온의 주가는 3월 26일 15시 09분 기준 4만5750원이며, 전일 대비...",https://www.digitaltoday.co.kr/news/articleView.html?idxno=646209,pos
2026-03-26 15:24,,포스코,"[주총 포커스] 포스코퓨처엠, '엄기천號' 2기 출범···글로벌 영토 확...",포스코퓨처엠이 엄기천 대표이사 체제를 공고히 하며 이차전지 소재 시장에서 글로벌 리더십을 확보하는데... 포스코퓨처엠은 26일 포항 본사에서 제55기 정기 주주총회를 열고 엄기천 대표의 사내이사 재선임을 확정했다....,https://www.bloter.net/news/articleView.html?idxno=657828,pos
2026-03-26 15:24,,포스코,"포스코퓨처엠, 엄기천 대표 재선임 및 ESG·평가보상위원회 설치","포스코퓨처엠이 26일 정기 주주총회·이사회를 열어 엄기천 사장을 대표이사로 재선임하고, 김성진... 기타비상무이사에는 포스코홀딩스 정석모 사업시너지본부장을 신규 선임하고, 윤태화·이복실 사외이사를...",https://www.etnews.com/20260326000370,pos
2026-03-26 15:24,,포스코,"엄기천 포스코퓨처엠 사장, 주총서 대표이사 재선임","포스코퓨처엠이 26일 제55기 정기주주총회를 열었다고 밝혔다. 이사 선임, 전문위원회 신설, 제55기 재무제표... 엄기천 포스코퓨처엠 사장은 주총 및 이사회를 통해 대표이사로 재선임됐다. 김성진 기획지원본부장은...",http://www.seoulwire.com/news/articleView.html?idxno=713498,pos
2026-03-26 15:23,,포스코,"포스코퓨처엠, 엄기천 대표이사 재선임 ""실적 개선 및 주주가치 제고 나...","포스코퓨처엠은 정기주주총회 및 이사회에서 엄기천 대표이사가 재선임됐다고 26일 밝혔다. 엄 대표이사는... 기타비상무이사에는 정석모 포스코홀딩스 사업시너지본부장을 신규 선임하고, 윤태화·이복실 사외이사를...",http://www.fnnews.com/news/202603261445152192,pos
2026-03-26 15:22,,포스코,"포스코퓨처엠, 음극재 공급 확대·전고체 투자 강화",포스코퓨처엠이 음극재 공급 확대와 전고체 배터리 투자를 중심으로 사업 경쟁력을 강화한다. 포스코퓨처엠은 26일 제55기 정기 주주총회를 열고 이사 선임과 정관 변경 등 안건을 의결했다고 밝혔다. 회사는 글로벌...,https://www.thelec.kr/news/articleView.html?idxno=54155,pos
2026-03-26 15:17,동아일보,포스코,"포스코퓨처엠, 제55기 주주총회서 미래 성장 청사진 공개…엄기천 대표...",완비 포스코퓨처엠이 26일 제55기 정기주주총회를 열고 이사 선임과 정관 변경 등 핵심 안건을 처리하며... 인정받아 포스코퓨처엠 이사회에 합류했다. 또한 포스코홀딩스 정석모 사업시너지본부장이 기타비상무이사로...,https://sports.donga.com/region/article/all/20260326/133614763/1,pos
2026-03-26 15:14,딜사이트TV,포스코,"포스코퓨처엠, 엄기천 대표 재선임…선제적 투자 박차","베트남 음극재 공장 신설·새만금 구형흑연 투자 결정…음극재 자립 공급망 확보 포스코퓨처엠이 엄기천 대표이사를 재선임하고, 선제적 투자와 포트폴리오 다변화를 적극 추진해 나가겠다고 밝혔다. 포스코퓨처엠은...",https://news.dealsitetv.com/articles/167589,pos
2026-03-26 15:10,연합뉴스,포스코,"포스코퓨처엠, 엄기천 대표이사 재선임 ""올해도 선제적 투자""","포스코퓨처엠은 26일 정기주주총회 및 이사회에서 엄기천 대표이사가 재선임됐다고 밝혔다. 엄 대표이사는... 기타비상무이사에는 정석모 포스코홀딩스 사업시너지본부장을 신규 선임하고, 윤태화·이복실 사외이사를...",https://www.yna.co.kr/view/AKR20260326137500003?input=1195m,pos
2026-03-26 14:50,,포스코인터내셔널,"""POSCO홀딩스 험난한 길, 철강의 아쉬움…이차전지의 적자지속""","반면 포스코이앤씨 정상화, 포스코인터내셔널 증익, 장가항 적자 해소 등이 연결 실적을 방어했다. 철강 부문 영업이익은 3528억 원을 기록하며 전분기 대비 역성장이 예상된다. 원재료 가격 상승분이 반영된 가운데...",https://www.newsquest.co.kr/news/articleView.html?idxno=263794,pos
2026-03-26 14:39,,포스코,"포스코 포항제철소, '참여형 건강 특강' 개최",포스코 포항제철소가 만성질환 예방을 위한 데이터 기반 '참여형 건강 특강'을 열어 호응을 얻고 있다. 포항제철소 산업보건센터는 지난 25일 효자아트홀에서 '내 몸속 실시간 혈당 그래프'를 주제로 특강을 개최했다. 이번...,https://www.newsis.com/view/NISX20260326_0003565348,pos
2026-03-26 14:26,,포스코,의료 소외지역 25년 지킨 김종원 원장…포스코 1호 청암히어로,포스코청암재단 25일 첫 시상식 현장형 실천가에 3000만원·상패 수여 포스코청암재단이 일상 속 영웅을 발굴하는 ‘청암히어로즈’ 첫 수상자로 25년간 강원도 인제를 지킨 김종원 인제고려병원장(60·사진)을 선정했다....,https://www.mk.co.kr/article/11999078,pos
2026-03-26 14:24,철강금속신문,포스코인터내셔널,"포스코홀딩스, 1분기 철강 부진 vs 인프라 방어…실적은 선방","포스코이앤씨는 전분기 대규모 손실 이후 빠른 회복세를 보이며 2000억 원 이상의 이익 개선이 예상됐고 포스코인터내셔널은 팜 M&A 효과와 호주 세넥스 증산, 미얀마 가스전 유가 연동 수혜 등이 작용했다. 또 매년 손실을...",http://www.ferrotimes.com/news/articleView.html?idxno=47096,pos
2026-03-26 14:24,철강금속신문,포스코,"포스코청암재단, '청암히어로즈' 첫 수상자 선정…김종원 인제고려병원...",제1호 청암히어로즈 인제고려병원 김종원 원장 포스코청암재단이 사회의 숨은 공로자를 발굴하기 위한 시상사업 '청암히어로즈'를 출범하고 첫 수상자로 김종원 인제고려병원 원장을 선정했다. 포스코청암재단은 지난...,http://www.ferrotimes.com/news/articleView.html?idxno=47090,pos
2026-03-26 14:17,,포스코,"포스코청암재단, 1호 '청암히어로즈'에 김종원 인제고려병원장","포스코청암재단이 전날 서울 강남구 포스코센터에서 '청암히어로즈' 첫 수상자로 선정한 김종원(60) 인제고려병원장을 시상했다고 26일 밝혔다. 김 원장은 상금 3,000만 원과 상패를 받았다. 김 원장은 고려대 의대를 졸업한...",https://www.hankookilbo.com/news/article/A2026032610520002704?did=NA,pos
2026-03-26 14:12,,포스코,"동아대, 하나은행·포스코 등 12개 기업 채용설명회 개최","또한 부산지방법원, 한국항공우주산업과 같은 공공기관은 물론 삼성중공업, 포스코, 한미그룹 등 대기업 및... ◆ 현장 중심 소통으로 취업 자신감 고취 포스코 설명회에 참여한 한재철(신소재공학과 4) 학생은 ""인사...",https://www.joongdo.co.kr/web/view.php?key=20260326010009014,pos
2026-03-26 13:58,,포스코,"포스코청암재단, 1호 '청암히어로즈'에 김종원 인제고려병원 원장 선정","포스코청암재단은 25일 서울 포스코센터에서 시상식을 열고, 올해 새롭게 제정한 '청암히어로즈'의 첫 번째 수상자로 강원도 인제고려병원 김종원 원장을 선정했다고 26일 밝혔다. '청암히어로즈'는 우리 사회의...",https://www.etnews.com/20260326000246,pos
2026-03-26 13:02,,포스코,"포스코청암재단, 첫 ‘청암히어로즈’ 수상자에 김종원 원장 선정","인제고려병원 김종원 원장 선정…강원 인제서 25년간 지역의료 헌신 제1호 청암히어로즈 인제고려병원 김종원 원장./포스코홀딩스 포스코청암재단은 지난 25일 서울 포스코센터에서 시상식을 열고, 올해 새롭게 제정한...",http://www.metroseoul.co.kr/article/20260326500265,pos
2026-03-26 13:01,연합뉴스,포스코,포스코센터 방문한 이호현 2차관,이호현 기후에너지환경부 2차관이 26일 서울 강남구 포스코센터에 방문해 차량 5부제 관련 주차관리시스템을 점검하고 있다. 2026.3.26,https://www.yna.co.kr/view/PYH20260326121600013?input=1196m,pos
2026-03-26 12:34,,포스코,"포스코청암재단, 제1호 청암히어로즈에 김종원 원장 선정","민주신문=김혜인 기자｜포스코청암재단은 제1호 청암히어로즈 수상자로 인제고려병원 김종원 원장을... 발굴하는 시상 제도다. 포스코청암재단 관계자는 ""공동체 가치를 실천한 인물을 지속 발굴하겠다""고 말했다.",http://www.iminju.net/news/articleView.html?idxno=161471,pos
2026-03-26 12:30,,포스코,"포스코청암재단, ‘청암히어로즈’ 첫 수상자에 김종원 원장 선정",포스코청암재단이 우리 사회의 숨은 공로자를 발굴하기 위한 새로운 시상사업을 출범시키고 첫 수상자를 발표했다. 포스코청암재단은 25일 서울 포스코센터에서...,http://www.breaknews.com/1195215,pos
2026-03-26 11:58,,포스코,"포스코청암재단, 제1호 청암히어로즈에 김종원 인제고려병원장 선정",포스코청암재단이 25일 서울 포스코센터에서 시상식을 열고 올해 새롭게 제정한 '청암히어로즈'의 첫 번째 수상자로 강원도 인제고려병원 김종원 원장을 선정했다. 청암히어로즈는 우리 사회의 사각지대에서 헌신하며...,https://www.newsworks.co.kr/news/articleView.html?idxno=835571,pos
2026-03-26 11:48,,포스코,"김종원 인제고려병원장, 포스코청암재단 첫 ‘청암히어로즈’ 선정",24시간 응급의료 등을 25년째 책임져온 이 병원 김종원(60) 원장이 포스코청암재단(이사장 장인화)이 올해 제정한 ‘청암히어로즈’ 첫 번째 수상자로 선정됐다. 재단은 “안정된 대도시의 삶 대신 인구 3만여명의 의료...,https://www.hani.co.kr/arti/economy/economy_general/1251193.html,pos
2026-03-26 11:48,,포스코,"포스코 포항제철소, '체험형'건강 특강 개최",포스코 포항제철소(소장 박남식)가 지난 25일 경북 포항시 효자아트홀에서 '내 몸속 실시간 혈당 그래프'를 주제로 건강 특강을 개최했다고 26일 밝혔다. 특강은 포스코 임직원을 비롯해 그룹사·파트너사 직원과 가족...,https://www.mt.co.kr/policy/2026/03/26/2026032610522187286,pos
2026-03-26 11:36,,포스코,"포스코청암재단, 김종원 원장에 청암히어로즈 시상","화이트페이퍼, WHITEPAPER포스코청암재단 제1호 청암히어로즈에 선정된 김종원 인제고려병원 원장 (사진=포스코청암재단) 포스코청암재단이 의료 취약지에서 장기간 헌신해온 김종원 인제고려병원 원장을 '청암히어로즈...",http://www.whitepaper.co.kr/news/articleView.html?idxno=260093,pos
2026-03-26 11:31,,포스코,"[중동사태 한달]'차량 5부제' 강화, 경차·하이브리드 포함…포스코 등...",포스코 등 민간의 자율참여 캠페인 또한 전국 단위로 확산하는 양상이다. 기후에너지환경부는 공공기관... 특히 포스코는 직원 차량 등록 시스템과 연동해 5부제를 자율 운영하는 민간 모범 사례를 제시했다. 위반 차량에...,https://www.etnews.com/20260326000088,pos
