날짜,매체명,검색키워드,기사제목,주요기사 요약,URL
2025-12-15 17:39,디지털타임스,포스코,포스코 포항제철소 ‘가스중독’ 1명 끝내 사망…본사 등 압수수색,"지난달 20일 포스코 포항제철소에서 발생한 가스중독사고가 끝내 사망 사고로 이어졌다. 경북경찰청 중대재해수사팀과 고용노동부 포항지청은 포스코 본사와 포항제철소 내 공장, 용역업체 사무실 등을 압수수색하고...",https://www.dt.co.kr/article/12035280?ref=naver
2025-12-15 17:38,,포스코,"포스코 쇳물 10% 담당, 3파이넥스 시설 복구",포스코는 지난해 폭발·화재 사고가 난 포항제철소 3파이넥스공장 수리를 끝내고 가동에 들어갔다고 14일... 파이넥스(FINEX)는 포스코가 자체 연구개발을 통해 개발한 제철 공법으로 고로(용광로) 방식과 달리 원료의...,https://www.safetimes.co.kr/news/articleView.html?idxno=237443
2025-12-15 17:37,,포스코,"포스코 가스중독사고 피해자 1명 끝내 사망…경찰·노동청, 본사 등 압수...",지난달 포스코 포항제철소에서 발생한 가스중독사고로 중태에 빠진 피해자 3명 중 1명이 숨졌다. 15일... 40대 포스코 직원 1명이 유해가스를 마셔 중태에 빠졌고 출동한 포스코 소방대 방재팀원 3명도 구조 작업 중...,https://www.busan.com/view/busan/view.php?code=2025121517274710266
2025-12-15 17:36,,포스코,포스코 포항제철소 '가스 중독사고' 피해자 1명 치료 25일만 사망,"포스코 포항제철소에서 발생한 가스 중독사고로 치료 받던 피해자 1명이 끝내 숨졌습니다. 경북경찰청에... 40대 포스코 직원 1명이 유해가스를 마시고 심정지 상태로 병원에 이송됐으나 중태에 빠졌고, 현장에 출동한...",http://www.yonhapnewstv.co.kr/AKR20251215173605LcI
2025-12-15 17:29,,포스코,포스코 포항제철소 가스중독 피해자 치료 중 사망,지난달 20일 포스코 포항제철소에서 발생한 가스중독사고 피해자 1명이 치료를 받다 끝내 숨진 것으로... 40대 포스코 직원 1명이 유해가스를 마셔 중태에 빠졌고 출동한 포스코 소방대 방재팀원 3명도 구조 작업 중...,https://www.kmib.co.kr/article/view.asp?arcid=0029117439&code=61121211&cp=nv
2025-12-15 17:21,,포스코,[속보]포스코 포항제철소 ‘가스흡입’ 노동자 2명 중 1명 끝내 숨져,포스코 포항제철소에서 지난달 발생한 가스중독사고로 중태에 빠진 하청 노동자 2명 중 1명이 숨졌다. 15일... 사고 직후 수습을 위해 현장으로 간 포스코 직원 1명과 포스코 자체 소방대 방재직원 3명도 의식불명 상태에...,https://www.khan.co.kr/article/202512151721001
2025-12-15 17:21,,포스코,포스코 포항제철소 '가스중독사고' 피해자 1명 끝내 숨져,지난달 20일 포스코 포항제철소에서 일어난 가스중독 사고로 중태에 빠진 피해자 3명 중 1명이 숨졌다. 15일... 40대 포스코 직원 1명이 유해가스를 마셔 중태에 빠졌다. 사고 현장에 출동한 포스코 소방대 방재팀원...,http://www.kookje.co.kr/news2011/asp/newsbody.asp?code=0300&key=20251215.99099005538
2025-12-15 17:20,,포스코,"노동부, 포항 포스코 가스 중독 사고 압수수색",고용노동부와 경찰이 포스코 사업장에서 발생한 가스 중독 사고와 관련해 본사 등에 대한 압수수색에 착수했다. 15일 노동부에 따르면 대구지방고용노동청과 경상북도경찰청은 지난달 20일 경북 포항 소재 포스코 사업장...,https://www.viva100.com/article/20251215501610
2025-12-15 17:18,,포스코,"포스코 포항제철소, 겨울맞이 나눔 활동 이어져",포스코 포항제철소가 다가오는 겨울을 맞아 지역 사회 이웃들을 위한 온정 나누기에 나서고 있다. 여러... 지난 6일에는 포스코 클린오션 봉사단이 포항 북구 청하면 앞바다에서 약 6시간에 걸쳐 환경정화 활동을 실시했다....,https://www.newsworks.co.kr/news/articleView.html?idxno=823175
2025-12-15 17:15,,포스코,포스코 포항제철소 가스중독 피해자 1명 끝내 사망,지난달 20일 포스코 포항제철소에서 발생한 가스중독사고가 사망 사고로 이어졌다. 15일 경북경찰청 등에... 40대 포스코 직원 1명이 유해가스를 마셔 중태에 빠졌다. 구조 작업을 펼치던 포스코 소방대 방재팀원 3명도...,https://www.hankyung.com/article/2025121549017
2025-12-15 16:54,,포스코인터내셔널,[코스피 지수선물·옵션] 삼성전자·SK하이닉스 흔들…개별주식선물 변...,"2차전지 및 소재주에서는 LG화학, 삼성SDI, 포스코퓨처엠, 에코프로, 에코프로비엠, 엘앤에프, 포스코홀딩스, 포스코인터내셔널이 혼조세를 보였다. 단기 반등을 시도한 종목도 있었으나, 전체적으로는 추가 상승에 대한...",https://www.pinpointnews.co.kr/news/articleView.html?idxno=406619
2025-12-15 16:46,경북일보,포스코,포항제철소 가스중독 사고 수사 확대…포스코 본사 압수수색,관련해 포스코 본사에 대한 압수수색에 나섰다. 15일 대구지방고용노동청과 경북경찰청은 근로감독관과 경찰 등 약 40명을 투입해 원청인 포스코 본사 등을 대상으로 압수수색을 진행하고 있다. 이번 사고는 지난달 20일...,https://www.kyongbuk.co.kr/news/articleView.html?idxno=4059454
2025-12-15 16:42,,포스코,"포스코 포항제철소, 겨울철 지역 나눔 활동 전개",포스코 포항제철소가 겨울을 맞아 지역 사회를 위한 다채로운 나눔 활동을 지속하고 있다. 클린오션 봉사단... 지난 6일 포스코 클린오션 봉사단은 포항 북구 청하면 앞바다에서 약 6시간 동안 수중 해양 생물 채취와...,https://www.getnews.co.kr/news/articleView.html?idxno=853572
2025-12-15 16:32,스트레이트뉴스,포스코,"포스코 포항제철소, 겨울 맞이 나눔 활동 이어져",포스코 클린오션 봉사단이 포항 청하면 바닷가에서 환경정화 활동을 하고 있다.(사진=포스코) 포스코 포항제철소가 다가오는 겨울을 맞아 지역 사회 이웃들을 위한 온정 나누기에 나서고 있다. 여러 봉사단이 참여한...,https://www.straightnews.co.kr/news/articleView.html?idxno=289341
2025-12-15 16:30,,포스코,"포스코 포항제철소 안전사고, 경찰과 노동 당국의 압수수색으로 전면 조...","경찰과 노동 당국이 포스코 포항제철소에서 발생한 안전사고와 관련하여 본격적인 조사에 착수했다. 경북경찰청 중대재해수사팀과 고용노동부 포항지청은 지난 9일부터 포스코 본사와 포항제철소, 관련 외주업체 사무실...",https://www.gokorea.kr/news/articleView.html?idxno=850506
2025-12-15 16:28,,미얀마 LNG,"베트남·中법인 정리한 포스코이앤씨, '홍콩법인'도 청산 돌입","해당 법인을 청산할 경우 중국 다롄IT법인, 미얀마법인, 베트남법인에 이어 홍콩법인까지 정리하게 된다.... 포스코이앤씨 관계자는 ""플랜트 시장의 경우 태국 걸프 MTP 액화천연가스(LNG) 터미널 프로젝트를 수주한 것을...",https://www.asiatoday.co.kr/view.php?key=20251215010008001
2025-12-15 16:26,,포스코,[상대강도과열 종목] 로보티즈·SIMPAC·포스코DX까지…시장 전반 과열 ...,"화천기계, 포스코DX 등은 완만한 상승 흐름 속에서도 상대강도 기준을 충족하며 단기 과열군에 포함됐다. 이와 함께 오이솔루션, 일월지엠엘, 대한제당, 와이제이링크, 코아스템켐온, 에스티팜, 코람코더원리츠, 네오오토...",https://www.pinpointnews.co.kr/news/articleView.html?idxno=406587
2025-12-15 16:20,,포스코,"노동부, 지난달 가스중독 사고 포스코 본사 압수수색",고용노동부는 15일 포스코 가스 중독 사고와 관련해 경북 포항 포스코 본사 등에 대한 압수수색 했다고 밝혔다. 노동부에 따르면 앞서 지난달 20일 포스코 사업장 내 집수정에서 슬러지 청소 작업 중이던 근로자 3명이...,https://www.etnews.com/20251215000382
2025-12-15 16:20,,포스코,"경찰·노동청, '가스중독 사고' 포스코 본사 등 압수수색","지난달 발생한 포스코 포항제철소 가스중독 사고와 관련해 경찰과 노동 당국이 15일 합동 압수수색에... 투입해 포스코 포항 본사와 포항제철소 내 관련 공장, 외주 청소업체 사무실 등을 대상으로 동시다발적으로...",https://www.ikbc.co.kr/article/view/kbc202512150043
2025-12-15 16:17,,포스코,"영하권 추위에도 이웃 사랑은 계속...포스코 포항제철소, 겨울 맞이 나눔...",해양 정화부터 재능봉사·주거 환경 개선 영하권 추위가 이어지는 가운데 포스코 포항제철소가 지역사회... 지난 6일에는 포스코 클린오션 봉사단이 포항 북구 청하면 앞바다에서 약 6시간 동안 해양 환경정화 활동을...,https://www.pressian.com/pages/articles/2025121514315739911?utm_source=naver&utm_medium=search
2025-12-15 16:16,,포스코,'포철 가스 중독' 포스코 본사 압수수색…중대재해법 위반 조사,포쓰저널 김지훈 기자 포스코 포항제철소 전경./사진=연합뉴스 지난달 포스코 포항제철소에서 발생한 가스중독 사고와 관련해 고용노동부와 경찰이 합동 압수수색에 나섰다. 원·하청 안전관리 책임과 중대재해처벌법...,http://www.4th.kr/news/articleView.html?idxno=2102915
2025-12-15 15:57,,포스코,"포스코, '그라운드 광양' 지역 창업 생태계 중심으로","포스코그룹은 전남 광양에 세운 창업 플랫폼 ‘그라운드 광양’을 중심으로 지역 벤처 생태계 육성을 지원하고 있다. 배터리 소재, 수소 등 포스코그룹의 혁신 사업 분야에 뛰어난 잠재력을 지닌 스타트업을 조기에...",https://www.hankyung.com/article/2025121535421
2025-12-15 15:53,,포스코,"경찰·노동청, 포스코 본사 합동 압수수색… 가스중독 사고 관련",포스코 포항제철소 가스 중독 사고와 관련해 경찰과 노동 당국이 합동 압수 수색에 착수했다. 경북경찰청 중대재해수사팀과 고용노동부 포항지청은 15일 오전 9시 10분부터 수사관과 근로감독관 40여 명을 투입해 포스코...,https://www.chosun.com/national/2025/12/15/G74MSTYWXZF5NANK2IMWEWQ2GA/?utm_source=naver&utm_medium=referral&utm_campaign=naver-news
2025-12-15 15:53,,포스코,"노동부·경찰, ‘가스 중독 사고’ 포스코 본사 압수수색",고용노동부와 경찰이 지난달 경북 포항에 있는 포스코 사업장에서 발생한 유해 가스 중독 사고와 관련해 포스코 본사 압수수색에 나섰다. 노동부는 대구지방고용노동청과 대구경찰청이 포스코 본사 등에 근로감독관과...,https://www.mydaily.co.kr/page/view/2025121515492457924
2025-12-15 15:52,,포스코,"노동부·경찰, '유해가스 누출' 포스코 본사 압수수색","고용노동부와 경찰이 포항제철소 가스 누출 사고와 관련해 원청사인 포스코 본사를 압수수색했다. 노동부는 15일 대구지방고용노동청과 경북경찰청 소속 근로감독관, 경찰관 약 40명을 투입해 경북 포항시 포스코 본사...",https://news.cpbc.co.kr/article/1169090?division=NAVER
2025-12-15 15:45,,포스코,"영하권 추위도 마음의 온기로 녹였다!… 포스코 포항제철소, 겨울철 맞...",포스코 포항제철소가 본격 겨울철을 맞아 지역사회의 이웃들을 위한 온정 나눔에 나서고 있다. 포항제철소의... 지난 6일에는 포스코 클린오션 봉사단이 포항시 북구 청하면 앞바다에서 약 6시간에 걸친 환경정화 활동을...,https://www.polinews.co.kr/news/articleView.html?idxno=716869
2025-12-15 15:42,,포스코,'가스 중독 사고' 포스코 본사·제철소 등 압수수색,"지난달 6명이 다친 포스코 포항제철소 가스 중독 사고와 관련해 경찰과 노동 당국이 강제 수사에 착수했다. 경북경찰청과 대구고용노동청은 15일 40여 명을 투입해 포스코 포항 본사와 포항제철소 관련 공장, 외주업체...",https://news.tvchosun.com/site/data/html_dir/2025/12/15/2025121590231.html
2025-12-15 15:40,,포스코,"노동부·경찰, 가스중독 관련 포스코 본사 압수수색",뉴스토마토 = 박창욱 기자 | 지난달 포스코 포항제철소에서 발생한 가스 중독 사고와 관련해 고용노동부와 경찰이 포스코 본사와 포항제철소 등을 압수수색했습니다. 포스코 본사 전경. (사진=포스코) 15일 노동당국과...,http://www.newstomato.com/ReadNews.aspx?no=1284903&inflow=N
2025-12-15 15:40,연합뉴스,POSCO INTERNATIONAL,KOSPI 200 Closing Price List-2,"43,000 POSCO INTERNATIONAL 54,400 UP 500 CJ CheilJedang 208,500 DN 500 TaekwangInd 834,000 DN 7,000 KAL 22,400 DN 200 SGBC 66,700 DN 700 Nongshim 430,500 UP 500 LOTTE 28,100 DN 350 DWS 27,400 DN...",https://en.yna.co.kr/view/AEN20251215007800320?input=2106m
2025-12-15 15:38,,포스코,"노동부, '가스중독' 포스코 본사 압수수색",관련해 포스코 본사에 대한 압수수색에 나섰다. 고용노동부는 15일 대구지방고용노동청과 경상북도경찰청이 근로감독관과 경찰 약 40명을 투입해 원청인 포스코 본사 등을 압수수색 중이라고 밝혔다. 앞서 지난달 20일...,http://www.wowtv.co.kr/NewsCenter/News/Read?articleId=A202512150229&t=NN
2025-12-15 15:24,,포스코,"한화·포스코가 선택한 슈퍼브에이아이, 140억원 투자 유치…내년 상장...","슈퍼브에이아이는 이번 투자에 한화자산운용의 벤처 펀드, 포스코기술투자 등이 참여했다고 15일 밝혔다.... 아울러 주요 투자자로 참여한 포스코기술투자 관계자는 ""슈퍼브에이아이의 고객사로 시작해 솔루션의...",https://zdnet.co.kr/view/?no=20251215151838
2025-12-15 15:24,문화일보,포스코,"경찰·노동당국, 포스코 포항 본사 등 압수수색…가스중독 사고 경위 파...","연합뉴스 포항=박천학 기자 지난달 발생한 경북 포항 포스코 포항제철소 가스중독 사고와 관련, 경찰과 노동당국이 15일 포스코 포항 본사를 상대로 합동 압수수색에 착수했다. 경북경찰청 중대재해수사팀과 고용노동부...",https://www.munhwa.com/article/11554249?ref=naver
2025-12-15 15:20,,포스코,포스코 포항제철소 가스중독 사고 관련 압수수색 실시,포스코 포항제철소 안전사고와 관련해 경찰과 노동 당국이 오늘(15일) 합동 압수수색을 실시했습니다. 압수수색에는 경북경찰청 중대재해수사팀과 고용노동부 포항지청에서 수사관과 근로감독관 40여명이 투입돼 포스코...,https://news.bbsi.co.kr/news/articleView.html?idxno=4058386
2025-12-15 15:19,,포스코,"경북 경찰 ·노동청, '질식 사고' 포스코 본사 등 압수수색",당국이 포스코 본사 등에 대한 압수수색에 나섰습니다. 대구지방고용노동청과 경북경찰청 중대재해수사팀은 12월 15일 오전 9시 10분부터 근로감독관과 수사관 등 40여 명을 투입해 경북 포항 포스코 본사와 포항제철소...,https://dgmbc.com/NewsArticle/814233
2025-12-15 15:16,,포스코,'가스흡입 중독 사고' 포스코 본사·제철소 등 압수수색,"경북경찰청과 노동청은 오늘(15일) 지난달 포스코 포항제철소에서 발생한 가스 누출사고와 관련해 포항 본사 등을 압수수색했습니다. 경찰 수사관과 근로감독관 40여 명은 포스코 포항 본사와 제철소 내 관련 공장, 외주...",http://www.yonhapnewstv.co.kr/AKR20251215151515sS5
2025-12-15 15:07,,포스코,"경찰·고용부, 포스코 본사 압수수색…가스 중독 사고 관련","동해안로 포스코 본사 등에 대해 압수수색을 했다. 경북경찰청 중대재해수사팀과 고용노동부 포항지청은 이날 오전 9시10분부터 수사관과 근로 감독관 40여명이 포스코 포항 본사와 포항제철소 사고 공정, 외주 청소...",https://www.newsis.com/view/NISX20251215_0003441516
2025-12-15 15:05,,포스코,"경찰·노동당국, 포스코 포항 본사 등 압수수색···‘가스흡입’ 노동...","포스코 포항제철소에서 최근 청소 노동자 등 6명이 쓰러진 사고와 관련해 경찰과 노동당국이 압수수색에 나섰다. 15일 경북경찰청·포스코 등의 설명을 종합하면, 이번 사고를 수사 중인 경북청 중대재해수사팀은 이날...",https://www.khan.co.kr/article/202512151505001
2025-12-15 15:03,,포스코인터내셔널,포스코 자회사 청산 수순... 해고 통보에 책임 논란 불붙다,포스코인터내셔널의 100% 자회사인 연료전지 제조업체 한국퓨얼셀이 경영난 끝에 청산 절차에 들어가면서 대규모 고용 불안과 모회사 책임론이 불거지고 있다. 12일 업계에 따르면 한국퓨얼셀은 최근 수년간 누적된 재무...,https://www.ppss.kr/news/articleView.html?idxno=278686
2025-12-15 15:02,,포스코인터내셔널,DOOR·안전벨트 부품 확대...우신시스템 글로벌 경쟁력 강화,리비안 관련주 포스코인터내셔널 삼성SDI 우리산업 알멕 에코캡 TCC스틸 에코스넥 상신이디피 우신시스템 씨아이에스 HL만도 디와이 삼진엘앤디 폴라리스세원 모베이스전자 대원화성 대유에이텍 동국알앤에스...,https://www.pinpointnews.co.kr/news/articleView.html?idxno=406522
2025-12-15 15:00,,포스코,"노동부, 가스 중독 사고 관련 포스코 본사 압수수색",노동당국과 경찰이 지난달 경북 포항에서 가스 중독으로 근로자 3명이 중독된 사고와 관련해 포스코 본사 등에 대한 압수수색에 나섰다. 15일 대구지방고용노동청과 대구경찰청은 이날 포스코 본사 등에 대한 압수수색에...,https://www.hani.co.kr/arti/society/labor/1234637.html
2025-12-15 14:58,,포스코,"노동부·경찰, ‘유해가스 중독 3명 중상’ 포스코 본사 압수수색",포스코 포항제철소에서 청소 작업 중 근로자 3명이 유해가스에 중독돼 중상을 입은 사고와 관련해 고용노동부와 경찰이 포스코 본사에 대한 강제수사에 나섰다. 15일 고용노동청과 경북경찰청에 따르면 양 기관은...,https://www.sedaily.com/NewsView/2H1QOHQW11
2025-12-15 14:56,,포스코,"경찰·노동부, '유해가스 중독 사고' 포스코 압수수색",포스코 포항제철소 3고로./연합뉴스 경북경찰청은 15일 대구지방고용노동청과 함께 포항 포스코 사업장 집수정에서 발생한 가스 중독 사고와 관련해 포스코 본사 등을 압수수색 했다고 밝혔다. 원청의 안전관리 책임...,http://www.seouleconews.com/news/articleView.html?idxno=88194
2025-12-15 14:56,,포스코,포스코 가스 중독 사고…고용부·경찰 15일 압수수색,지난 11월 20일 포스코 포항제철소에서 발생한 가스 중독 사고와 관련해 고용노동부와 경찰이 경북 포항의 포스코 본사 등에 대한 강제수사에 나섰다. 15일 노동부에 따르면 대구지방고용노동청과 경상북도경찰청은...,https://ilyo.co.kr/?ac=article_view&entry_id=504895
2025-12-15 14:53,,포스코,"경찰, 노동당국 안전사고 발생 포스코 압수수색","지난달 발생한 포스코 포항제철소 안전사고를 수사 중인 경북경찰청 중대재해수사팀과 고용노동부 포항지청은 15일 포스코 포항 본사와 포항제철소 내 관련 공장, 외주 청소업체 사무실 등을 대상으로 압수수색을...",https://www.kmib.co.kr/article/view.asp?arcid=0029116452&code=61121211&cp=nv
2025-12-15 14:52,헤럴드경제,포스코,"노동부, ‘가스 중독 사고’ 포스코 본사 압수수색",근로감독관·경찰 약 40명 투입…안전조치 이행 여부 등 확인 경북 포항시 포스코 본사 전경 고용노동부는 대구지방고용노동청과 대구경찰청이 포스코 본사 등에 압수수색을 진행하고 있다고 15일 밝혔다. 이번 압수수색은...,https://biz.heraldcorp.com/article/10636737?ref=naver
2025-12-15 14:50,,포스코,"경찰·노동청, 포스코 본사·제철소 압수수색…가스 사고 경위 확인",경찰과 노동 당국이 15일 오전 포스코 포항제철소 합동 압수수색에 착수했다. 경북경찰청 중대재해수사팀과 고용노동부 포항지청은 이날 오전 9시 10분부터 수사관과 근로감독관 40여명을 투입해 포스코 포항 본사와...,https://www.hankyung.com/article/2025121544367
2025-12-15 14:40,뉴스1,포스코,"경찰·노동부, '가스 중독 사고' 포스코 포항제철소 압수수색","앞서 지난 11월20일 오후 1시 20분쯤 경북 포항시 남구 제철동 포스코 포항제철소 STS 4 제강공장에서 청소 작업을 하던 협력업체 직원 등 6명이 화학물질을 흡입했다. 이 사고로 3명이 중상을, 3명은 어지러움을 호소해...",https://www.news1.kr/local/daegu-gyeongbuk/6008910
2025-12-15 14:40,연합뉴스,포스코,"경찰·노동청, 포스코 본사 등 압수수색…가스중독 사고 관련(종합)","발생한 포스코 포항제철소 안전사고와 관련해 경찰과 노동 당국이 15일 오전 합동 압수수색에 착수했다.... 투입해 포스코 포항 본사와 포항제철소 내 관련 공장, 외주 청소업체 사무실 등을 대상으로 동시다발적으로...",https://www.yna.co.kr/view/AKR20251215100300053?input=1195m
2025-12-15 14:38,,포스코,'3명 가스 중독 사고' 포스코 본사 압수수색,원청사인 포스코 본사를 15일 압수수색했다. 노동부는 이날 대구지방고용노동청과 경북경찰청 소속 근로감독관 및 경찰관 약 40명을 투입해 경북 포항시 포스코 본사 등을 압수수색했다고 밝혔다. 작업일보 등 작업 관련...,https://www.hankookilbo.com/News/Read/A2025121513410001880?did=NA
2025-12-15 14:36,,포스코,포스코 안전사고 수사…경찰·노동청 합동 압수수색 진행,"포스코본사 전경. 영남일보 DB 포스코 안전사고와 관련해 경북경찰청과 고용노동청이 15일 오전 9시 10분부터 합동 압수수색에 들어갔다. 압수수색 대상은 경북 포항의 포스코 본사와 포항제철소 공장, 관련 청소업체...",https://www.yeongnam.com/web/view.php?key=20251215029094709
2025-12-15 14:32,,포스코,"노동부, ‘가스 중독 사고’ 포스코 압수수색…중대재해법 적용 여부 확...",포스코 사업장에서 발생한 가스 중독 사고와 관련해 고용노동부와 경찰이 본사 압수수색에 나섰다. 원청의... 대구지방고용노동청과 경상북도경찰청은 경북 포항 포스코 사업장 집수정에서 발생한 가스 중독 사고와...,https://www.dailian.co.kr/news/view/1586200/?sc=Naver
2025-12-15 14:32,뉴스1,포스코,"노동부·경찰, '가스 중독 사고' 관련 포스코 본사 압수수색",고용노동부와 경찰이 15일 포스코 가스 중독 사고와 관련해 경북 포항 포스코 본사 등에 대한 압수수색에 나섰다. 노동부에 따르면 앞서 지난달 20일 포스코 사업장 내 집수정에서 슬러지 청소 작업 중이던 근로자 3명이...,https://www.news1.kr/economy/employment-labor/6008889
2025-12-15 14:32,,포스코,"노동부·경찰, '유해가스 3명 중상' 포스코 본사 압수수색",관련해 포스코 본사 압수수색에 나섰습니다. 오늘(15일) 고용노동부는 대구지방고용노동청과 경상북도경찰청이 이날 근로감독관과 경찰 약 40명을 투입해 원청인 포스코 본사 등을 압수수색하고 있다고 밝혔습니다. 앞서...,https://biz.sbs.co.kr/article_hub/20000278537?division=NAVER
2025-12-15 14:31,뉴스핌,포스코,"노동부, 포스코 가스중독 사고 관련 본사 압수수색",고용노동부가 지난달 발생한 포스코 가스 중독 사고 관련 본사 압수수색에 나섰다. 노동부는 15일 대구지방고용노동청과 경상북도경찰청에서 근로감독관·경찰 약 40명을 투입해 포스코 본사 등을 대상으로 압수수색에...,https://www.newspim.com/news/view/20251215000709
2025-12-15 14:25,,포스코,"노동청·경찰, '질식사고' 포스코 본사 압수수색",지난달 20일 포스코 포항제철소에서 노동자 3명이 가스를 마셔 중태에 빠진 사건과 관련해 노동 당국과 경찰이 강제 수사에 나섰습니다. 대구지방고용노동청은 경찰과 근로감독관 40여 명을 투입해 포스코 본사와 청소...,https://www.ytn.co.kr/_ln/0115_202512151425170399
2025-12-15 14:24,연합뉴스,포스코,"고용노동부·경찰, 가스 중독사고 관련 포스코 본사 압수수색",대구지방고용노동청과 경북경찰청은 15일 경북 포항의 포스코 본사 등에 대해 압수수색에 들어갔다. 고용노동청과 경북경찰청은 지난달 20일 포스코 포항제철소에서 청소작업 중 부생가스에 근로자 3명이 중독된...,https://www.yna.co.kr/view/AKR20251215099000053?input=1195m
