날짜,매체명,검색키워드,기사제목,주요기사 요약,URL,sentiment
2026-04-01 10:06,,구동모터코어,"볼보, 순수 전기 SUV EX90 국내 출시…1억 620만 원부터","사륜구동 기반 트윈 모터 및 트윈 모터 퍼포먼스로 출시된다. 트윈 모터 모델은 최대 456마력(335kW)의 모터... EX90에는 볼보가 자체 개발한 휴긴 코어가 적용됐다. 휴긴 코어는 전기 아키텍처, 코어 컴퓨터, 존...",https://www.sedaily.com/article/20026832?ref=naver,pos
2026-04-01 10:04,,구동모터코어,"볼보차, 전기 SUV EX90 공식 출시… “안전 新기술 적용”",트윈 모터를 결합한 사륜구동(AWD) 기반 트윈 모터 및 트윈 모터 퍼포먼스로 출시된다. 트윈 모터 모델은... EX90에는 볼보의 안전과 차량의 핵심 기능을 소프트웨어 중심으로 통합한 모델 ‘휴긴 코어’가...,https://biz.chosun.com/industry/car/2026/04/01/4RY6Q4LG7RBEHMKF323RRD4ENA/?utm_source=naver&utm_medium=original&utm_campaign=biz,pos
2026-04-01 09:28,뉴스프리존,포스코인터내셔널,"美 70년 만의 우라늄 공장···한수원·포스코인터, '원전 연료' 영토 넓...","이에 발맞춰 한국수력원자력(KHNP, 이하 한수원)과 포스코인터내셔널도 미국 내 우라늄 농축 시설 투자와 공급망 확보 등에 나서며 연료 영토 확장에 속도를 내는 모습이다. 1일 산업계 등에 따르면, 플럭스포인트...",https://www.newsfreezone.co.kr/news/articleView.html?idxno=682787,pos
2026-04-01 09:23,연합뉴스,구동모터코어,"볼보자동차코리아, 전기 SUV 'EX90'출시…첨단 센서로 안전 강조","파워트레인은 106kWh(킬로와트시) 니켈·코발트·망간(NCM) 배터리와 차세대 트윈 모터를 결합한 사륜구동... EX90에는 볼보자동차가 자체 개발한 첨단 시스템 '휴긴 코어'가 적용된다. 전기 아키텍처, 코어 컴퓨터, 존...",https://www.yna.co.kr/view/AKR20260401047800003?input=1195m,pos
2026-04-01 09:05,뉴스1,구동모터코어,"볼보자동차, 전기 SUV 'EX90' 국내 공식 출시⋯1억620만원부터",트윈 모터를 결합한 사륜구동(AWD) 기반 트윈 모터 및 트윈 모터 퍼포먼스로 출시된다. 트윈 모터 모델은... 해당 차량에는 볼보가 자체 개발한 핵심 시스템인 '휴긴 코어'가 적용된다. 차량 내 다양한 시스템을...,https://www.news1.kr/industry/general-industry/6121157,pos
2026-04-01 09:03,,구동모터코어,"볼보코리아, 전기 플래그십 SUV EX90 출시…탈수록 진화하는 SDV",EX90의 핵심은 볼보가 자체 개발한 차세대 시스템 ‘휴긴 코어(Hugin Core)’다. 전기 아키텍처와 코어 컴퓨터... 국내에는 106kWh NCM 배터리와 차세대 트윈 모터를 조합한 사륜구동 기반의 ‘트윈 모터’와 ‘트윈 모터...,https://www.sportsworldi.com/newsView/20260401504508,pos
2026-04-01 08:48,,구동모터코어,"볼보자동차, 순수 전기 플래그십 SUV 'EX90' 국내 출시",EX90에는 볼보자동차가 자체 개발한 핵심 시스템인 '휴긴 코어(Hugin Core)'가 적용된다. 전기 아키텍처... 트윈 모터를 결합한 사륜구동(AWD) 기반 트윈 모터(Twin Motor) 및 트윈 모터 퍼포먼스(Twin Motor Performance)로...,http://www.press9.kr/news/articleView.html?idxno=74344,pos
2026-04-01 08:44,,포스코인터,[단독] 포스코인터 세넥스 '약 80% 인력' 사라진다…시추·생산 중심으로...,"10억 호주달러 규모 퀸즐랜드 가스전 확장공사 마무리 건설 인력 900명서 운영 인력 200명으로 슬림화 포스코인터내셔널 자회사인 호주 천연가스 기업 세넥스 에너지(SENEX ENERGY, 이하 세넥스)가 10억 호주달러 규모의...",https://www.theguru.co.kr/news/article.html?no=99963,pos
2026-04-01 08:44,,포스코인터내셔널,"[단독] 포스코인터 세넥스, 대규모 구조조정 돌입 '약 80% 인력' 사라진...","10억 호주달러 규모 퀸즐랜드 가스전 확장공사 마무리 건설 인력 900명서 운영 인력 200명으로 슬림화 포스코인터내셔널 자회사인 호주 천연가스 기업 세넥스 에너지(SENEX ENERGY, 이하 세넥스)가 10억 호주달러 규모의...",https://www.theguru.co.kr/news/article.html?no=99963,pos
2026-04-01 08:36,,포스코,글로벌 철강사 탈탄소 성적 '전원 낙제점'… 韓 포스코·현대제철 밑바...,"국내 양대 철강사인 포스코와 현대제철이 글로벌 철강사들을 대상으로 한 '탈탄소 전환 준비도' 평가에서... 포스코는 21.9점으로 15위, 현대제철은 21.2점으로 16위를 기록해 일본제철(16.8점), 중국 HBIS(8.3점) 등과 함께...",http://www.newsroad.co.kr/news/articleView.html?idxno=57075,pos
2026-04-01 08:34,,포스코,"포스코홀딩스, 美 클리블랜드-클리프스와 MOU 체결… 북미 철강 시장 공...",한국 최대 철강 기업인 포스코홀딩스(POSCO Holdings)가 미국 철강 기업 클리블랜드-클리프스(Cleveland-Cliffs)와 양해각서(MOU)를 체결하며 세계 최대 철강 소비 시장인 미국 내 입지 강화에 나섰다. 이번 파트너십은 포스코의...,https://www.g-enews.com/view.php?ud=2026040108265777120c8c1c064d_1,pos
2026-04-01 08:32,헤럴드경제,구동모터코어,"“안전은 기본, 탈수록 똑똑”…볼보, 하브보다 가격 낮춘 ‘EX90’ 출시...",XC90 T8보다 저렴한 1억620만원부터 휴긴 코어·OTA로 바퀴 달린 스마트폰 구현 볼보 카 UX 탑재…첨단 센서... 트윈 모터를 결합한 사륜구동(AWD) 기반 트윈 모터 및 트윈 모터 퍼포먼스로 출시된다. 트윈 모터 모델은...,https://biz.heraldcorp.com/article/10707140?ref=naver,pos
2026-04-01 08:30,,포스코,[포스코특집] 포스코 58년…8대 전략제품 중심 사업 경쟁력 강화③,포스코가 창립 58주년을 맞았다. 1968년 포항 바닷가에서 시작된 제철소 건설은 한국 산업화의 출발점이 됐고... 포스코의 58년은 단순한 기업 성장사를 넘어 한국 제조업 발전의 궤적과 함께한 산업사로 평가된다. 국가...,http://www.snmnews.com/news/articleView.html?idxno=567260,pos
2026-04-01 08:28,,구동모터코어,K-전기차 시장 뛰어드는 ‘볼보 EX90’…“플래그십 전기 SUV로 붙자”,"코어 컴퓨터, 존 컨트롤러 등을 통합했고, 무선 업데이트(OTA)를 통해 기능·성능·안전 기술을 지속 개선하는 구조로 설계했다. 볼보 EX90은 106kWh 니켈·코발트·망간(NCM) 배터리와 사륜구동(AWD) 기반 트윈 모터를...",https://www.mk.co.kr/article/12004516,pos
2026-04-01 08:16,,포스코,"광명시장, 신안산선 붕괴 사고 수습 압박…포스코이앤씨 '전면 재시공'...",박승원 경기 광명시장이 신안산선 붕괴 사고 수습과 관련해 시공사 포스코이앤씨로부터 주요 시설물 전면 보강과 공공 손실 보상에 대한 합의를 이끌어냈다. 광명시에 따르면 박 시장은 31일 인천 송도 포스코이앤씨 본사를...,https://www.shinailbo.co.kr/news/articleView.html?idxno=5006765,neg
2026-04-01 08:12,,구동모터코어,"볼보자동차, 대형 전기 SUV ‘EX90’ 국내 공식 출시⋯ 1억620만원부터",EX90에는 볼보자동차가 자체 개발한 핵심 시스템인 ‘휴긴 코어’가 적용된다. 휴긴 코어는 전기... EX90의 국내 출시 파워트레인은 106kWh 니켈·코발트·망간(NCM) 배터리와 차세대 트윈 모터를 결합한 사륜구동(AWD)...,https://www.viva100.com/article/20260401500092,pos
2026-04-01 08:11,,구동모터코어,"볼보코리아, 'EX90' 국내 출시…1억620만원부터",볼보자동차 EX90 (사진=볼보자동차코리아) EX90에는 볼보가 자체 개발한 '휴긴 코어(Hugin Core)'가... 파워트레인은 106kWh 배터리와 트윈 모터 기반 사륜구동(AWD)으로 구성된다. 800V 시스템을 적용해 급속 충전 시 약...,https://zdnet.co.kr/view/?no=20260401081007,pos
2026-04-01 08:11,,구동모터코어,"볼보코리아, 'EX90' 국내 출시…1억1620만원부터",볼보자동차 EX90 (사진=볼보자동차코리아) EX90에는 볼보가 자체 개발한 '휴긴 코어(Hugin Core)'가... 파워트레인은 106kWh 배터리와 트윈 모터 기반 사륜구동(AWD)으로 구성된다. 800V 시스템을 적용해 급속 충전 시 약...,https://zdnet.co.kr/view/?no=20260401081007,pos
2026-04-01 08:06,오토데일리,구동모터코어,"볼보자동차코리아, 전기 플래그십 SUV EX90 국내 출시",휴긴 코어 시스템으로 무선 업데이트 지원 EX90은 스칸디나비아 디자인과 볼보자동차의 안전 헤리티지... 트윈 모터를 결합한 사륜구동(AWD) 기반 트윈 모터(Twin Motor) 및 트윈 모터 퍼포먼스(Twin Motor Performance)로...,https://www.autodaily.co.kr/news/articleView.html?idxno=542838,pos
2026-04-01 08:06,오토데일리,구동모터코어,"볼보, 1억2천만원대 프리미엄 전기 SUV EX90 국내 출시",휴긴 코어 시스템으로 무선 업데이트 지원 EX90은 스칸디나비아 디자인과 볼보자동차의 안전 헤리티지... 트윈 모터를 결합한 사륜구동(AWD) 기반 트윈 모터(Twin Motor) 및 트윈 모터 퍼포먼스(Twin Motor Performance)로...,https://www.autodaily.co.kr/news/articleView.html?idxno=542838,pos
2026-04-01 07:38,,삼척블루파워,노동위원회 일정,"(부당정직) 삼척시(부당해고) 에스제이엔 주식회사(부당해고) 오후 3시30분... 주식회사 블루어드 및 주식회사 미래에코산업(부당해고) 주식회사 휴먼밸런스(부당해고) 주식회사 한빛파워(부당보직해임, 부당전보) 오전...",https://www.labortoday.co.kr/news/articleView.html?idxno=233525,neg
2026-04-01 01:27,,포스코,장인화 포스코 회장 “철강 넘어 ‘넥스트 코어’ 사업 육성”,포스코그룹이 창립 58주년을 맞아 철강을 넘어 미래 산업 변화를 주도할 수 있는 ‘넥스트 코어(Next Core)’ 사업을 육성해 글로벌 공급망의 중심축으로 도약하겠다는 의지를 밝혔다. 장인화(사진) 포스코그룹 회장은 31일...,https://www.kmib.co.kr/article/view.asp?arcid=1774942757&code=11151100&cp=nv,pos
2026-04-01 00:56,,포스코,"박승원 시장, 포스코이앤씨 확답받았다는데...이번엔 약속 지킬까?",시공사인 포스코이앤씨로부터 사고 현장 인근 주요 시설물의 전면 보강과 피해 보상에 대한 확답을 받았다고 밝혔다. 박 시장은 31일 오후 광명을 국회의원실 백현석 수석보좌관 등과 함께 인천 송도 포스코이앤씨 본사를...,http://www.joygm.com/news/articleView.html?idxno=215092,neg
2026-04-01 00:32,동아일보,포스코,‘포스코 58주년’ 장인화 회장 “미래사업 육성 절실”,장인화 포스코그룹 회장이 창립 58주년(4월 1일)을 맞아 미래 성장 기반을 강화해야 한다고 강조했다. 장... 제철보국은 ‘국가 산업의 쌀로 불리는 철을 생산해 국가에 기여하겠다’는 뜻의 포스코그룹 창립 정신이다. 장...,https://www.donga.com/news/Economy/article/all/20260331/133648482/2,pos
2026-04-01 00:02,,포스코,장인화 포스코 회장 “철강 경쟁력 세계최고로”,장인화 포스코그룹 회장은 1일 창립 58주년을 하루 앞둔 31일 기념사를 통해 “불가능을 가능으로 만든 선배 세대의 불굴의 의지를 본받아 혁신과 실행력을 바탕으로 당면한 위기를 돌파하자”고 강조했다. “시대적...,https://www.joongang.co.kr/article/25416511,pos
2026-03-31 23:30,,포스코,"포스코그룹, 전사적 에너지 절약 캠페인 'S.A.V.E 챌린지' 전개…계단·...",포스코그룹은 19개 국내 그룹사가 참여하는 그룹 차원의 실천 캠페인 'S.A.V.E 챌린지'를 추진한다고 31일 밝혔다. 포스코그룹에 따르면 챌린지는 ▲엘리베이터 대신 계단 이용(Step Up) ▲출퇴근 시 대중교통 이용...,http://www.econonews.co.kr/news/articleView.html?idxno=433596,pos
2026-03-31 23:20,,포스코,"장인화 회장 ""포스코정신으로 더 나은 미래 도약""",장인화 포스코그룹 회장이 지난 24일 서울 포스코센터에서 열린 제58기 포스코홀딩스 정기주주총회를 진행하고 있다./포스코홀딩스 | 서울=한스경제 임준혁 기자 | 장인화 포스코그룹 회장이 31일 임직원들에게 그동안...,http://www.hansbiz.co.kr/news/articleView.html?idxno=829220,pos
2026-03-31 22:02,세계일보,포스코,“신안산선 시설물 전면 재시공”…광명시·포스코이앤씨 합의,"31일 포스코이앤씨 인천 본사서 담판…사고 보상 확답 박승원 시장, 이견 딛고 주요 시설물 ‘전면 재시공’... 연합뉴스 31일 경기 광명시에 따르면 박승원 시장은 이날 시공사인 포스코이앤씨의 인천 송도 본사에서 송치영...",https://www.segye.com/newsView/20260331522333?OutUrl=naver,neg
2026-03-31 21:44,이데일리,포스코,"박승원의 담판, 포스코이앤씨 '신안산선 피해 복구' 약속 끌어내",박승원 광명시장이 지난해 신안산선 붕괴 사고 이후 아직도 고쳐지지 않은 현장 인근 주요 시설물의 전면 보강과 신속한 피해 보상 약속을 포스코이앤씨로부터 받아냈다. 31일 인천 송도 포스코이앤씨 본사를 방문한 박승원...,http://www.edaily.co.kr/news/newspath.asp?newsid=06884726645388896,neg
2026-03-31 21:26,,포스코,"포스코그룹 배터리 소재 4사, 율촌산단 환경정화 활동 진행","포스코퓨처엠은 지난 28일 포스코필바라리튬솔루션, 포스코리튬솔루션, 포스코HY클린메탈, 지역 주민들과 함께 환경정화 활동을 진행했다고 31일 밝혔다. 전남 광양 율촌제1산업단지 내 포스코그룹 이차전지소재 사업장...",http://www.seoulwire.com/news/articleView.html?idxno=714365,pos
2026-03-31 21:26,,포스코,"포스코 장인화, 창립 58주년 메시지…“글로벌 공급망 핵심축 도약” 강...",장인화 포스코그룹 회장이 창립 58주년을 맞아 글로벌 공급망 핵심축으로 도약하겠다는 비전을 제시하며... 장 회장은 “제철보국이라는 창업 정신이 회사 성장의 원동력이었다”며 포스코 정체성과 경쟁력의 근간을...,https://www.g-enews.com/view.php?ud=202603312124478565112616b072_1,pos
2026-03-31 21:24,,포스코,포스코 수소환원제철소 매립 승인…포항 환경단체 반발,포스코 수소환원제철소 건립을 위한 경북 포항 앞바다 매립 허가를 두고 환경단체가 반발하고 나섰다. 31일... 앞서 국토교통부는 지난 27일 포스코 수소환원제철소 조성을 위해 바다 135만여㎡를 매립하는 내용을 담은...,https://www.g-enews.com/view.php?ud=202603312119262702112616b072_1,neg
2026-03-31 20:42,,포스코,"민주당 경북도당, 포스코 수소환원제철 산단 변경 승인 ""환영""",더불어민주당 경북도당은 포스코 수소환원제철 부지 조성을 위한 정부의 산업단지 계획 변경 승인을 환영한다고 밝혔습니다. 경북도당은 논평을 통해 이번 승인은 이재명 정부가 산업 전환과 기후위기 대응을 국가 핵심...,http://www.phmbc.co.kr/www/news/desk_news?idx=201522&mode=view,pos
2026-03-31 19:56,대경일보,포스코,"장인화 포스코 회장, ""글로벌 공급망 핵심축으로서 역할 다하겠다""","장인화<사진> 포스코그룹 회장이 31일 포스코 창립 58주년을 맞아 ""이제 철강과 에너지 소재, 에너지 사업을 통해 글로벌 공급망 핵심축으로서 역할을 다하겠다""고 밝혔다. 장 회장은 이날 임직원들을 대상으로 보낸 창립...",https://www.dkilbo.com/news/articleView.html?idxno=539274,pos
2026-03-31 18:42,,포스코,장인화 포스코 회장 '그룹 가치 퀀텀점프' 선언,""" 장인화 포스코그룹 회장(사진)은 1일 창립 58주년을 맞아 기념사를 내고 ""전례 없는 격변과 혼돈의 터널을 지나고 있지만 창업 세대부터 전 임직원이 자발적으로 빚어온 위대한 포스코정신을 지금의 시대가 요구하는...",http://www.fnnews.com/news/202603311840444547,pos
2026-03-31 18:17,,포스코,"포스코 송도 본사 찾아간 광명시장, 신안산선 피해 보상·재시공 ‘확답...","시공사인 포스코이앤씨 본사를 방문, 사고 현장 주요 시설물의 ‘전면 재시공’과 신속한 피해 보상 약속을 받아냈다. 31일 시에 따르면 박 시장은 이날 오후 인천 송도 포스코이앤씨 본사에서 송치영 사장과 면담을 가졌다....",https://www.kyeonggi.com/article/20260331580621,neg
2026-03-31 18:14,,포스코,"박승원 광명시장, 신안산선 사고 '전면 재시공' 포스코이앤씨와 합의","박승원 경기 광명시장이 신안산선 지반 침하 사고와 관련해 시공사인 포스코이앤씨로부터 사고 현장 인근... 박 시장은 31일 오후 인천 송도 포스코이앤씨 본사를 방문, 송치영 사장과 면담을 가졌다. 이번 만남은 지난해...",http://www.fnnews.com/news/202603311805378923,neg
2026-03-31 18:10,뉴스1,포스코,"""신안산선 공사 전면 재시공""…광명시-포스코이앤씨 합의",송치영 포스코이앤씨 사장과 면담을 통해 공공손실 보상 이행 및 주민 보상과 공사 재시공 약속을 이끌어냈다. 31일 광명시에 따르면 박 시장은 이날 광명을 국회의원실 백현석 수석보좌관과 함께 인천 송도 소재 포스코이...,https://www.news1.kr/local/gyeonggi/6120715,neg
2026-03-31 18:07,,포스코,"창립 58주년 맞은 포스코그룹, 장인화 회장 ""자랑스러운 역사 함께 만들...","◎ 창립 58주년 기념사 ◎ 사랑하는 포스코그룹 가족 여러분! 58년 전 오늘, 우리의 자랑스러운 창업세대는 황량한 영일만 벌판에서 영광스러운 포스코그룹 역사의 첫발을 내디뎠습니다. 자본도, 기술도, 경험도, 자원도...",https://www.polinews.co.kr/news/articleView.html?idxno=727109,pos
2026-03-31 18:05,,포스코,"10년간 57명 사망… 포스코, 억대 과태료에도 산재 계속",포스코가 지난해 발생한 사업장 내 중대재해 사건과 관련해 벌금형을 선고받은 것으로 확인됐다. 최근... 31일 포스코가 최근 공시한 사업보고서에 따르면 대구지법 포항지원은 지난 1월 말 포스코 법인과 전...,https://www.busan.com/view/busan/view.php?code=2026033118030733186,neg
2026-03-31 18:04,,포스코,"신안산선 붕괴 1년…박승원 광명시장, 포스코 '전면 재시공' 합의 도출",박승원 광명시장은 31일 인천 송도 포스코이앤씨 본사를 찾아 송치영 사장과 면담을 갖고 사고 현장 안전 대책과 보상 문제를 논의했다. 이번 면담은 사고 이후 지지부진했던 보강 방식과 보상 협의를 둘러싼 갈등을 정면...,https://www.mt.co.kr/policy/2026/03/31/2026033117440051828,neg
2026-03-31 17:54,아시아경제,포스코,"박승원 시장, 포스코이앤씨와 ‘담판’…신안산선 사고 구간 “사실상 ...",박승원 광명시장이 신안산선 붕괴 사고 수습과 관련해 시공사인 포스코이앤씨를 상대로 강력한 행정력을 발휘하며 실질적인 안전 대책과 보상안을 이끌어냈다. 박승원 광명시장은 31일 인천 송도 포스코이앤씨 본사를...,https://view.asiae.co.kr/article/2026033117540363887,neg
2026-03-31 17:46,,포스코,"포스코, 거래사 금융지원 나선다…관세·고환율 뚫고 철강업계 수출 공...","포스코가 철강 거래사의 수출 경쟁력을 높이기 위한 금융지원에 본격적으로 나서면서 국내 철강 산업의... 이번 금융지원 프로그램은 올해 1월부터 가동된 협력 모델로, 포스코와 IBK기업은행이 공동 재원을 조성하고...",https://www.polinews.co.kr/news/articleView.html?idxno=727108,pos
2026-03-31 17:41,,포스코인터내셔널,중동 쇼크 한 달…목표가 상향 리포트 3분의 1로 ‘뚝’,"최근 1개월 기준 목표가 상향 리포트가 가장 많이 나왔던 종목은 삼성전기(14개), 삼성전자(10개), 에이피알(8개), SK(7개), 포스코인터내셔널(7개) 등이다. 반면 목표가 하향 리포트가 가장 많이 나온 종목 3개 중 농심...",https://www.sedaily.com/article/20026574?ref=naver,pos
2026-03-31 17:36,,포스코,창립일 맞아 '영일만 정신' 소환한 포스코 | 'Next Core 산업 육성' 주문,포스코가 창립 58주년을 맞았다. 포스코(과거 포항종합제철)은 경공업 국가였던 대한민국을 본격적인 중공업 국가로 거듭나기 위한 박정희 정부의 경제개발계획에 따라 설립된 회사다. 창립 58주년 기념사에서 장인화...,http://monthly.chosun.com/client/mdaily/daily_view.asp?idx=24063&Newsnumb=20260324063,pos
2026-03-31 17:32,,포스코,"포스코그룹 창립 58주년… 장인화 회장 ""글로벌 공급망 핵심축으로 도약...","장인화 포스코그룹 회장이 '창립 58주년'을 맞아 글로벌 공급망 변화 속에서 그룹의 역할 확대와 사업 구조... 장 회장은 포스코의 성장 배경으로 '제철보국' 정신을 언급하며 ""숭고한 다짐은 회사가 이룩한 놀라운 성공의...",https://www.newscj.com/news/articleView.html?idxno=3390257,pos
2026-03-31 17:32,뉴스락,포스코,"포스코 창립 58주년... 장인화 회장 ""초격차 본원 경쟁력으로 한계 돌파...",국내 철강 산업을 이끌어온 포스코가 창립 기념일을 맞이해 흔들림 없는 성장을 위한 미래 비전을 임직원들과 공유했다. 포스코홀딩스는 장인화 회장이 창립 58주년을 맞아 임직원들에게 불확실한 경영 환경을 극복하고...,http://www.newslock.co.kr/news/articleView.html?idxno=127844,pos
2026-03-31 17:32,연합뉴스,포스코,신안산선 사고 구간 '재시공' 보강…광명시·포스코이앤씨 합의,경기 광명시는 31일 인천 송도 포스코이앤씨 본사에서 진행된 시공사 측과의 면담을 통해 사고 현장 인근... 박승원 시장이 광명을 국회의원실 백현석 수석보좌관 등과 함께 포스코이앤씨 송치영 사장과 만나 이런 확답을...,https://www.yna.co.kr/view/AKR20260331178500061?input=1195m,neg
2026-03-31 17:28,연합뉴스,포스코,"포항 환경단체, 포스코 확장 위한 바다 매립 승인 반발",포스코 수소환원제철소 건립을 위한 경북 포항 앞바다 매립 허가와 관련해 환경단체가 반발하고 나섰다.... 국토교통부는 지난 27일 포스코의 수소환원제철소 조성을 위해 바다 135만여㎡를 매립하는 안을 담은...,https://www.yna.co.kr/view/AKR20260331178300053?input=1195m,neg
2026-03-31 17:20,,포스코,"[Steel & Now] ""황량한 영일만서 58년""…장인화 포스코 회장, '창업 정신...","◆""황량한 영일만서 58년""…장인화 포스코 회장, '창업 정신' 위기 돌파 선언 장인화 포스코홀딩스 회장이 회사 창립 58주년을 맞아 포스코 정신을 강조하며 글로벌 공급망의 핵심축으로 도약하겠다고 선언했다. 오는 4월...",https://www.ebn.co.kr/news/articleView.html?idxno=1704052,pos
2026-03-31 17:14,,포스코인터내셔널,"한-캐, 에너지·잠수함 등 전략사업 협력 강화…'60조' 잠수함 수주 동시...","한국 측에서는 포스코인터내셔널, SK에너지, 삼성중공업, 한국가스공사, 한국수력원자력 등이 자리를 함께했으며, 캐나다 측에서는 캔두에너지, 알타가스, 시더 LNG, 프레리 리튬, 펨비나 파이프라인 등이 참석해 실질적인...",https://www.electimes.com/news/articleView.html?idxno=366597,pos
2026-03-31 17:12,딜사이트TV,포스코,포스코홀딩스 58주년…장인화 “집요한 실행력으로 위기 돌파”,"철강 불모지서 일관제철소 건립…불확실성 시대, 노사화합 당부 장인화 포스코홀딩스 회장이 창립 58주년을... 그는 포스코의 출발점을 언급하며 조직의 근간인 ‘포스코 정신’을 재차 강조했다. 장 회장은 “58년 전...",https://news.dealsitetv.com/articles/167818,pos
2026-03-31 16:58,,포스코인터내셔널,"한·캐, 에너지안보 협력 강화…잠수함 사업도 전략 공조 부각","한국 측에서는 포스코인터내셔널, SK에너지, 삼성중공업, 한국가스공사, 한국수력원자력 등이 함께했고, 캐나다 측에서는 캔두에너지, 알타가스, 시더 LNG, 프레리 리튬, 펨비나 파이프라인 등이 자리해 실질적인 협력...",https://www.m-i.kr/news/articleView.html?idxno=1360300,pos
2026-03-31 16:56,이투데이,포스코인터내셔널,"창립 58주년 포스코, 장인화 회장 ""혁신·실행력으로 경영 목표 반드시...","포스코인터내셔널은 호주 세넥스에너지 증산 완료와 인도네시아 팜 기업 인수 효과로 영업이익 1조1653억원을 기록하며 창사 이래 최대 실적을 냈다. 반면 포스코이앤씨는 일회성 손실이 반영됐고, 이차전지소재...",https://www.etoday.co.kr/news/view/2571200,pos
