날짜,매체명,검색키워드,기사제목,주요기사 요약,URL,sentiment
2026-03-30 14:50,,포스코,"포스코그룹, 에너지 위기 극복 위한 'S.A.V.E. 챌린지' 전개",포스코그룹이 에너지 절약 캠페인을 실시한다. [사진=포스코] 포스코그룹(회장 장인화)이 국가적 에너지 위기 대응에 발맞춰 전사적인 에너지 절약 캠페인을 펼친다. 포스코그룹은 정부 에너지 절감 정책에 적극...,http://www.paxetv.com/news/articleView.html?idxno=267356,pos
2026-03-30 14:46,,포스코,"포스코그룹, 에너지 절약 캠페인 'S.A.V.E. 챌린지' 실시",포스코그룹이 국가적 에너지 위기 대응에 발맞춰 전사적인 에너지 절약 캠페인을 펼친다. 포스코그룹은 정부 에너지 절감 정책에 적극 동참하기 위해 30일부터 그룹 차원의 실천 캠페인 'S.A.V.E. 챌린지'를...,https://www.econovill.com/news/articleView.html?idxno=735315,pos
2026-03-30 14:42,,포스코,"민주당 경북도당,“포스코 수소환원제철 승인 환영…포항, 산업대전환 ...",국토교통부는 지난 27일 ‘포스코 수소환원제철 부지조성 산업단지계획 변경’... 포스코의 수소환원제철(하이렉스) 사업은 기존 석탄 기반 고로 중심의 철강 생산...,http://www.breaknews.com/1196140,pos
2026-03-30 14:26,,포스코,"포스코홀딩스, '호주-한국 비즈니스 어워즈' 올해의 기업 선정","포스코홀딩스가 호주 자원 산업 투자와 미래 공급망 협력 성과를 인정받아 '호주-한국 비즈니스 어워즈'에서 올해의 기업으로 선정됐다. 포스코홀딩스는 핵심 광물, 배터리 소재, 친환경 에너지 분야에서 양국 협력...",https://www.ezyeconomy.com/news/articleView.html?idxno=234084,pos
2026-03-30 14:24,,포스코,"포스코홀딩스, '호주-한국 비즈니스 어워즈' 올해의 기업 선정","포스코홀딩스는 지난 27일 서울 용산구 그랜드 하얏트 호텔에서 열린 '2026 호주-한국 비즈니스 어워즈'(AKBA)... 포스코홀딩스는 호주 자원 산업에 대한 지속적인 투자와 핵심 광물, 배터리 소재, 친환경 에너지 공급망 등...",https://www.ngonews.kr/news/articleView.html?idxno=227260,pos
2026-03-30 14:18,,포스코,"포스코퓨처엠 주가, 3월 30일 장중 216,500원 3.59% 상승","따르면 포스코퓨처엠의 주가가 지난 종가 대비 상승 흐름을 보이며 21만 원대 중반 가격에서 거래되고 있다. 현재 포스코퓨처엠의 주가는 216,500원을 기록하며, 지난 종가 209,000원 대비 7,500원(3.59...",https://www.joongangenews.com/news/articleView.html?idxno=507136,pos
2026-03-30 14:08,,구동모터코어,[기업家] BMW ㅣ 유럽 車산업 지각변동 속…전기차 시대 가속·중국 변수...,"BMW코리아가 수입한 520i, 320i, X4 등 32개 차종 6만7천878대는 스타터 모터 내부 부품의 단락으로 화재가... 게임 구동 등 다양한 기능을 지원한다. 삼성전자는 2019년과 2021년 아우디, 폭스바겐 등에도 해당 칩을 공급한...",https://www.cbci.co.kr/news/articleView.html?idxno=564142,pos
2026-03-30 13:36,,구동모터코어,"[A 전자·IT 소식] 삼성전자 서비스센터, '예약 서비스' 전국 확대 外","이번 공급을 기반으로 글로벌 모터스포츠 활동을 한층 강화하고, 전 세계 모터스포츠 팬들과의 접점을... 독립 구동, 발목 회전, 고관절 상승 등 다양한 움직임을 구현해 전신 스트레칭과 코어 근육까지 깊숙하게 케어...",https://www.asiaa.co.kr/news/articleView.html?idxno=244807,pos
2026-03-30 12:58,,구동모터코아,[2026 전문대 프레지던트 서밋 Prism ②] 동유럽으로 향하는 국내 산업계...,"포스코인터내셔널은 지난해 10월, 폴란드 오폴레(Opole) 주 브제크(Brzeg) 시에 연간 전기차 120만 대 분량의 구동모터코아 생산 능력을 갖춘 공장을 준공했다. 구동모터코아는 전기차 등 모터 내 전기 에너지를 회전...",https://news.unn.net/news/articleView.html?idxno=591132,pos
2026-03-30 12:34,디지털데일리,포스코,"포스코홀딩스, 호주상공회의소 ‘올해의 기업’ 선정",포스코홀딩스가 호주 자원 산업 투자와 핵심 광물 공급망 협력 성과를 인정받아 주한 호주상공회의소가 주관한 ‘2026 호주-한국 비즈니스 어워즈’에서 올해의 기업으로 선정됐다. 주한 호주상공회의소는 포스코홀딩...,https://www.ddaily.co.kr/page/view/2026033012331446149,pos
2026-03-30 12:20,,포스코,"포스코그룹, 정부 에너지 절감 정책에 적극 동참···'S.A.V.E. 챌린지' ...",| 스마트비즈 = 최승연 기자 | 포스코그룹이 국가적 에너지 위기 대응에 발맞춰 전사적인 에너지 절약 캠페인을 펼친다. 포스코그룹은 정부 에너지 절감 정책에 적극 동참하기 위해 30일부터 그룹 차원의 실천...,https://www.smartbizn.com/news/articleView.html?idxno=140724,pos
2026-03-30 12:16,,포스코,"포스코이앤씨, 全구성원 참여하는 ‘AI 챌린지’ 열어","▲ 포스코이앤씨,AI 챌린지,AX,건설업,업무 자동화 포스코이앤씨의 AI 기반 레미콘 현황 대시보드 활용 사례. 사진=포스코이앤씨 포스코이앤씨가 인공지능(AI)을 활용해 구성원들의 업무 방식을 바꾸기 위한 ‘전사 AI...",https://weekly.cnbnews.com/news/article.html?no=210374,pos
2026-03-30 12:06,,포스코,"포스코그룹, 전사적 에너지 절약 ‘S.A.V.E. 챌린지’ 추진",포스코그룹이 국가적 에너지 위기 대응에 발맞춰 전사적 에너지 절약 실천에 나선다. 포스코그룹(회장 장인화)은 정부의 에너지 절감 정책에 적극 동참하기 위해...,http://www.breaknews.com/1196025,pos
2026-03-30 11:54,,포스코,"포스코그룹, ‘S.A.V.E. 챌린지’로 에너지 절약 전사 확산…“일상 실...",정착 포스코센터 근무 직원들이 엘리베이터 대신 계단을 이용하고 있다. [사진=포스코] [포항(경북)/뉴스투데이=박정한 기자] 포스코홀딩스를 중심으로 한 포스코그룹이 국가적 에너지 위기 대응에 발맞춰 전사적인...,https://www.news2day.co.kr/article/20260330500144,pos
2026-03-30 11:54,,포스코,"박희정 민주당 포항시장 후보,“포스코 수소환원제철 부지 승인 환영…...",더불어민주당 박희정 포항시장 예비후보가 포스코 수소환원제철 설비 전용부지... 왔다”며 “포스코는 안전과 환경을 최우선으로 두고 투명한 정보 공개와 상시...,http://www.breaknews.com/1196051,pos
2026-03-30 11:52,글로벌이코노믹,포스코,"포스코이앤씨, 전 구성원 참여 ‘AI 챌린지’ 경진대회 개최",포스코이앤씨가 인공지능(AI)을 활용해 구성원들의 실제 업무 방식을 바꾸기 위한 ‘전사 AI 챌린지’ 경진대회를 개최한다. 이번 챌린지는 포스코그룹이 추진 중인 AX 전략과 맞닿아 있다. 포스코그룹은 AI를 미래...,http://www.globalepic.co.kr/view.php?ud=20260330114933104148439a4874_29,pos
2026-03-30 11:50,,포스코,"포스코퓨처엠 주가, 3월 30일 장중 218,500원 4.55% 상승","30일 오전 11시 39분 기준, 네이버페이 증권에 따르면 포스코퓨처엠은 현재 218,500원에 거래되며 지난... 포스코퓨처엠의 시가총액은 19조 4,347억 원으로 코스피 시장에서 40위이다. 주가수익비율(PER)은 566....",https://www.topstarnews.net/news/articleView.html?idxno=16020036,pos
2026-03-30 11:48,문화일보,포스코,"포스코그룹, ‘이란 사태’발 에너지 극복 위기 나서",포스코그룹은 30일부터 그룹 차원의 에너지 절약 실천 캠페인 ‘세이브(S.A.V.E.) 챌린지’를 시작한다고 밝혔다. 사진은 서울 강남구 포스코센터에서 근무하는 직원들이 엘리베이터 대신 계단을 이용하고 있는 모습....,https://www.munhwa.com/article/11578326?ref=naver,pos
2026-03-30 11:42,,포스코,"민주당 경북도당, ‘포스코 수소환원제철 승인 환영’","핵심은 포스코가 추진하는 수소환원제철 공정, 이른바 ‘하이렉스(HyREX)’다. 기존 석탄 기반 고로 방식을 대체하는 이 기술은 탄소 배출을 기존 대비 약 20분의 1 수준까지 줄일 수 있는 친환경 공정으로 평가된다. 글로벌...",https://www.news2day.co.kr/article/20260330500139,pos
2026-03-30 11:42,,포스코,"포스코그룹, 에너지 절감 'SAVE 챌린지'… ""임직원 실천 확대""",포스코그룹은 전사적 에너지 절약 캠페인 'S.A.V.E. 챌린지'를 시작한다고 30일 밝혔다. 국가적 에너지 위기... 포스코센터 근무 직원들이 엘리베이터 대신 계단을 이용하고 있는 모습. 참여는 그룹사 임직원을 대상으로...,http://www.kdfnews.com/news/articleView.html?idxno=181145,pos
2026-03-30 11:36,,포스코,"포스코, 'S.A.V.E.'로 에너지 위기 뚫는다...전사적 실천 캠페인 돌입",국가적 에너지 위기 극복을 위해 대한민국 대표 기업 포스코그룹이 팔을 걷어붙였다. 포스코그룹(회장 장인화)은 30일부터 전 임직원이 참여하는 전사적 에너지 절약 캠페인 'S.A.V.E. 챌린지'를 전격 가동한다고...,https://www.pointe.co.kr/news/articleView.html?idxno=76935,pos
2026-03-30 11:34,뉴스1,포스코,"포스코그룹 2차전지 4개사, 지역 주민과 봄맞이 환경정화",포스코그룹의 2차전지 소재 기업 4곳이 지역 주민들과 함께 대규모 환경정화 활동을 펼쳤다. 30일 포스코 측에 따르면 지난 28일 진행된 봉사활동에는 전남 광양 율촌제1산업단지에 위치한 포스코퓨처엠...,https://www.news1.kr/local/gwangju-jeonnam/6118363,pos
2026-03-30 11:26,헤럴드경제,포스코,"포스코이앤씨, 전사적 ‘AI챌린지’ 경진 대회",1000만원 포스코이앤씨가 지난 24일부터 진행하는 ‘전사 인공지능(AI) 홈페이지’의 모습이다. 구성원들은 이곳에서 참가신청과 AI 활용 온라인 교육 프로그램을 수강할 수 있다. [포스코이앤씨 제공] 포스코이앤씨는...,https://biz.heraldcorp.com/article/10705489?ref=naver,pos
2026-03-30 11:26,이코노미톡뉴스,포스코,"""전 그룹사로 확산되는 에너지 절약""… 포스코·현대차·SK·롯데·CJ·오...","포스코그룹은 30일부터 'S.A.V.E. 챌린지'를 시작해 계단 이용, 대중교통·카풀 장려, 전원 차단 등 임직원 실천형 캠페인을 운영하며, 참여 실적에 따라 최대 5만 원 포인트를 지급한다. 상미당홀딩스는 전 계열사에 차량...",http://www.economytalk.kr/news/articleView.html?idxno=419722,pos
2026-03-30 11:20,,포스코,"포스코그룹, 에너지 절약 캠페인… 출퇴근 카풀·계단 이용","포스코그룹이 정부의 에너지 절감 정책에 동참하기 위해 30일부터 그룹 차원의 실천 캠페인 'S.A.V.E.... 포스코그룹은 에너지 위기 상황이 완화될 때까지 챌린지를 계속 운영하고, 임직원의 참여를 독려하기 위해...",https://www.newscj.com/news/articleView.html?idxno=3389656,pos
2026-03-30 11:20,,포스코,"포스코그룹, 'S.A.V.E. 챌린지' 본격 추진","화이트페이퍼, WHITEPAPER포스코센터 근무 직원들이 엘리베이터 대신 계단을 이용하고 있는 모습 (사진=포스코홀딩스) 포스코그룹이 정부의 에너지 절감 정책에 발맞춰 전 임직원이 참여하는 절약 캠페인을 전개한다....",http://www.whitepaper.co.kr/news/articleView.html?idxno=260239,pos
2026-03-30 11:18,,포스코,"포스코홀딩스, 한-호주 경제 협력에 기여한 기업으로 꼽혀",김정식 포스코홀딩스 국제협력사무국장(왼쪽)이 지난 27일 서울 용산구 그랜드 하얏트 호텔에서 열린 '2026... 사진=포스코홀딩스 제공 매일일보 = 김채은 기자 | 포스코홀딩스는 지난 27일 서울 용산구 그랜드 하얏트...,https://www.m-i.kr/news/articleView.html?idxno=1359533,pos
2026-03-30 11:17,,포스코,"포스코이앤씨, 'AI 챌린지' 경진대회 개최",포스코이앤씨는 '전사 AI 챌린지' 경진대회를 개최한다고 30일 밝혔다. 대회는 약 두 달간 진행된다. 참가자들은 사전 교육을 통해 AI 활용 방법을 익힌 뒤 본격적인 경연에 참여하게 된다. 경진대회 참가 부문은 △회사...,https://www.seoulfn.com/news/articleView.html?idxno=624954,pos
2026-03-30 10:44,,포스코인터내셔널,알멕·포스코인터내셔널 주가 방긋… 리비안 생산량 확대 수혜 기대감,"글로벌 종합 사업 회사인 포스코인터내셔널은 구동모터코아 등 핵심 부품 공급망을 앞세워 상승세를 보이며, 배터리 정밀 부품 기업인 유진테크놀로지도 동반 오름세를 나타낸다. 리비안의 핵심 배터리 파트너인...",https://www.pinpointnews.co.kr/news/articleView.html?idxno=441083,pos
2026-03-30 09:38,,삼척블루파워,사우디 암모니아 표류에 흔들린 삼척 그린파워사업,데일리 환경 이정윤(assh1010@dailyt.co.kr) [데일리환경=천지은기자] 한국남부발전이 추진 중인 삼척그린파워... ‘SAN-6 블루암모니아’ 사업은 아직 최종투자결정(FID)에 이르지 못한 상태다. 판매처 확보와 경제성 문제로...,https://www.dailyt.co.kr/newsView/dlt202603300008,pos
2026-03-30 09:34,철강금속신문,포스코인터,페로타임즈 손바닥뉴스 3월 30일(월),"견인 포스코인터, 유가 상승에 에너지 수혜…희토류·LNG 성장 두각 한국특강, 주식병합·자사주 소각 동시 추진…유통주식수 축소 포스코인터, 250億 규모 CVC 펀드 조성…희토류 밸류체인 강화 TCC스틸, 손봉락 회장...",http://www.ferrotimes.com/news/articleView.html?idxno=47143,pos
2026-03-30 09:01,,포스코,"포스코, '에너지 절약 생활화' 챌린지…""정부 정책에 적극 동참""",포스코그룹은 정부 에너지 절감 정책에 적극 동참하기 위해 그룹 차원의 실천 캠페인 'S.A.V.E. 챌린지'를... 포스코그룹은 에너지 위기 상황이 완화될 때까지 챌린지를 지속 운영하며 임직원의 자발적인 참여를...,https://www.mt.co.kr/industry/2026/03/30/2026033008561320837,pos
2026-03-30 09:00,,포스코,"포스코이앤씨, 전 직원 참여 'AI 챌린지' 개최",포스코이앤씨는 인공지능(AI)을 활용해 구성원들의 업무 방식을 바꾸기 위한 전 직원이 참여하는 'AI 챌린지' 경진대회를 개최한다고 30일 밝혔다. 해당 대회는 포스코그룹이 추진 중인 AI 전환(AX) 전략의 하나로 마련됐다....,http://www.seoulwire.com/news/articleView.html?idxno=713913,pos
2026-03-30 09:00,MTN,포스코,"포스코그룹, 에너지 절약 캠페인 진행…'ESG 전용앱' 활용",포스코그룹 본사 외경/제공=포스코홀딩스 포스코그룹이 전사적인 에너지 절약 캠페인 'S.A.V.E. 챌린지'를 실시한다고 30일 밝혔다. 이번 캠페인은 ▲Step Up(엘리베이터 대신 계단 이용) ▲Active Transit(출퇴근 시...,https://news.mtn.co.kr/news-detail/2026033008574473142,pos
2026-03-30 08:54,헤럴드경제,포스코,"“일하는 방식 바꾼다” 포스코이앤씨, 전 구성원 참여 ‘AI 챌린지’ 경...","제공 포스코이앤씨가 지난 24일부터 진행하는 ‘전사 인공지능(AI) 홈페이지’의 모습으로, 구성원들은 이곳에서 참가신청과 AI 활용 온라인 교육 프로그램을 수강할 수 있다.[포스코이앤씨 제공] [헤럴드경제=홍승희...",https://biz.heraldcorp.com/article/10705168?ref=naver,pos
2026-03-30 08:51,,포스코,"포스코그룹, 에너지 절감 캠페인 전개···전 계열사 참여",포스코그룹이 국가적 에너지 대응에 동참하기 위해 전사 차원의 에너지 절약 캠페인을 추진한다. 포스코그룹은 30일부터 임직원 참여형 에너지 절감 활동인 'S.A.V.E. 챌린지'를 시작한다고 밝혔다. 이번 캠페인은...,https://www.seoulfn.com/news/articleView.html?idxno=624906,pos
2026-03-30 08:48,,포스코,"포스코, 내달 6일 'S.A.V.E. 챌린지' 시작...정부 에너지 절감 정책 적극...",포스코그룹이 정부 에너지 절감 정책에 적극 동참하기 위해 30일부터 그룹 차원의 실천 캠페인 'S.A.V.E.... 포스코그룹은 에너지 위기 상황이 완화될 때까지 챌린지를 지속 운영하며 임직원의 자발적인 참여를...,https://www.pinpointnews.co.kr/news/articleView.html?idxno=440995,pos
2026-03-30 08:46,,포스코,"포스코그룹, 에너지절약 동참…출퇴근 카풀·엘베 대신 계단","2008년부터 차량 5부체·적정 실내온도 준수·점심 소등 등 실천 포스코그룹은 정부의 에너지 절감... 포스코그룹은 ""에너지 위기 상황이 완화될 때까지 챌린지를 계속 운영하고, 임직원의 참여를 독려하기 위해...",https://www.tfmedia.co.kr/news/article.html?no=203161,pos
2026-03-30 08:42,,포스코,"포스코그룹, 에너지 절약 동참…""S.A.V.E. 챌린지""","포스코그룹은 정부의 에너지 절감 정책에 동참하기 위해 오늘(30일)부터 국내 19개 그룹사 임직원이 실천... 포스코그룹은 에너지 위기 상황이 완화될 때까지 챌린지를 계속 운영하고, 임직원의 참여를 독려하기...",http://www.yonhapnewstv.co.kr/AKR20260330084142tz6,pos
2026-03-30 08:41,,포스코,"포스코그룹, 전사 차원 ‘에너지 절약 챌린지’ 돌입",포스코그룹이 국가적 에너지 위기 대응에 발맞춰 전 임직원이 참여하는 에너지 절약 캠페인에 나선다. 포스코그룹은 정부의 에너지 절감 정책에 적극 동참하기 위해 그룹 차원의 실천 캠페인 ‘S.A.V.E. 챌린지’를...,http://www.fnnews.com/news/202603300829027349,pos
2026-03-30 08:41,,포스코,"포스코그룹, 'S.A.V.E 챌린지' 전개…""전사적 에너지 절약 캠페인""",포스코그룹이 국가적 에너지 위기 대응에 발맞춰 전사적인 에너지 절약 캠페인에 나선다. 포스코그룹은 19개 국내 그룹사가 참여하는 그룹 차원의 실천 캠페인 'S.A.V.E 챌린지'를 추진한다고 30일 밝혔다. 챌린지는...,https://www.newsis.com/view/NISX20260330_0003568695,pos
2026-03-30 08:39,뉴스1,포스코,"포스코그룹, 에너지 절약 캠페인 실시…출퇴근 카풀·계단 이용",포스코그룹은 정부 에너지 절감 정책에 동참하기 위해 그룹 차원의 실천 캠페인 'S.A.V.E. 챌린지'를... 포스코그룹은 이날부터 일주일간 참여 신청을 받은 뒤 다음달 6일부터 본격적인 실천에 들어간다. 캠페인은...,https://www.news1.kr/industry/general-industry/6117918,pos
2026-03-30 08:38,이투데이,포스코,"포스코그룹, 에너지 절감 동참…계단 이용하고 출퇴근 시 도보·카풀","챌린지’ 시작 포스코그룹은 국가적 에너지 위기 대응을 위해 전사적인 에너지 절약 캠페인 ‘S.A.V.E.... 포스코그룹은 2008년부터 차량 5부제를 시행하고 적정 실내 온도 준수, 점심·퇴근 후 조명 소등 등 생활...",https://www.etoday.co.kr/news/view/2570478,pos
2026-03-30 08:30,연합뉴스,포스코,"포스코그룹, 에너지절약 동참…출퇴근 카풀·엘베 대신 계단","2008년부터 차량 5부체·적정 실내온도 준수·점심 소등 등 실천 포스코그룹은 정부의 에너지 절감 정책에... 포스코그룹은 에너지 위기 상황이 완화될 때까지 챌린지를 계속 운영하고, 임직원의 참여를 독려하기...",https://www.yna.co.kr/view/AKR20260330020600003?input=1195m,pos
2026-03-30 08:26,,포스코,"포스코그룹, 'S.A.V.E 챌린지' 시작… 전사 에너지 절약 캠페인",포스코그룹이 국가적 에너지 위기 대응에 발맞춰 전사적인 에너지 절약 캠페인에 나선다. 포스코그룹은 정부 에너지 절감 정책에 적극 동참하기 위해 그룹 차원의 실천 캠페인 'S.A.V.E. 챌린지'를 시작한다고 30일...,http://www.seoulwire.com/news/articleView.html?idxno=713899,pos
2026-03-30 08:24,,포스코,"건설업도 AI… 포스코이앤씨, 전 직원 경진대회 가동","포스코이앤씨 제공 건설업계 전반에 AI가 부상하고 있다. 포스코DX는 사무·제조현장에 적용 가능한 AI 에이전트와 로봇 기반 '피지컬 AI'를 앞세워 'AI 네이티브 컴퍼니' 전환을 추진 중이고, GS건설도 사내 AI 플랫폼과...",https://www.newsclaim.co.kr/news/articleView.html?idxno=3059287,pos
2026-03-30 08:19,이데일리,포스코,"포스코, 에너지 절감 정책 동참…SAVE 챌린지 전개",포스코그룹이 국가적 에너지 위기 대응에 발맞춰 전사적인 에너지 절약 캠페인을 펼친다. 포스코그룹은 정부 에너지 절감 정책에 적극 동참하기 위해 30일부터 그룹 차원의 실천 캠페인 ‘S.A.V.E. 챌린지’를...,http://www.edaily.co.kr/news/newspath.asp?newsid=01997526645388568,pos
2026-03-30 08:16,헤럴드경제,포스코,"포스코그룹, 정부 에너지 절감 정책 동참…‘S.A.V.E 챌린지’ 가동",사례로 포스코 꼽아 이호현 기후에너지환경부 2차관이 26일 서울 강남구 포스코센터 주차장을 찾아 민간 자율 5부제 시행 현장을 살펴보고 있다. [기후부 제공] [헤럴드경제=정경수 기자] 포스코그룹이 국가적 에너지...,https://biz.heraldcorp.com/article/10705117?ref=naver,pos
2026-03-30 06:01,,포스코인터내셔널,[이달의 책] 글로벌 공급망은 상시적 위기 상태다,"핵심 제조업으로는 삼성전자·SK하이닉스· LG에너지솔루션·현대자동차 등을 선정했으며, 미래 성장동력으로는 셀트리온·SK바이오팜·유한양행·대한항공·한화에어로스페이스를, 기타 산업으로는 포스코인터내셔널...",https://www.hankyung.com/article/202603101640i,pos
2026-03-30 05:02,이투데이,포스코,"생명의 경이로움, 예술로…포스코미술관 ‘물의 정령들’·‘자연의 기...","제공 ""포스코미술관, 모두를 위한 예술 나눔 공간 제공 노력"" 포스코미술관은 사라져가는 한반도 자연 생태의 가치를 예술의 기록으로 조망하는 '물의 정령들'과 '자연의 기록자들' 전(展)을 5월 3일까지 연다고 29일 밝혔다....",https://www.etoday.co.kr/news/view/2569956,pos
2026-03-30 00:14,,포스코,"안승대 포항시장 예비후보, 포스코 수소환원제철소 부지 조성 승인 적극...",| 스마트비즈 = 최승연 기자 | 안승대 포항시장 예비후보가 29일 보도자료를 통해 포스코의 수소환원제철소... 특히 포스코가 추진 중인 HyREX 공법은 포항이 세계 철강산업 전환의 중심에 설 수 있는 든든한 기술적 기반이...,https://www.smartbizn.com/news/articleView.html?idxno=140655,pos
2026-03-29 23:16,,포스코,"AI로 체질 바꾼다…포스코이앤씨, 전사 혁신 프로그램 가동","이어가겠습니다"" (포스코이앤씨 관계자) 포스코이앤씨가 인공지능(AI) 기반 업무 전환을 목표로 '전사 AI 챌린지'를 개최한다. 이번 대회는 포스코그룹의 AX 전략과 연계된다. 그룹은 AI를 핵심 기술로 규정하고 업무...",https://www.thedailypost.kr/news/articleView.html?idxno=113672,pos
2026-03-29 20:46,,포스코,포스코 ‘수소제철’ 승인…철강 산업 대전환 신호탄,"포스코의 숙원 사업이자 대한민국 철강 산업의 미래가 걸린 ‘수소환원제철소’ 건립 사업이 정부의 최종... ▲ 국토부 산단계획 변경 승인…2041년 완공 목표27일 국토교통부와 철강업계에 따르면, 정부는 포스코의...",https://www.ksmnews.co.kr/news/view.php?idx=597438,pos
2026-03-29 20:46,,포스코,“포스코 수소환원제철 본격 추진 환영”,"포스코의 수소환원제철소 건립 사업이 정부 승인을 받으면서 사업 추진의 발판이 마련됐다.28일 국토교통부는... 정부의 이같은 조치로 포스코 수소환원제철사업이 탄력을 받자, 지역 정치권이 일제히 환영의 뜻을 밝혔다....",https://www.ksmnews.co.kr/news/view.php?idx=597426,pos
2026-03-29 20:46,,포스코,건설업도 AI 바람…포스코이앤씨 ‘전사 챌린지’,포스코이앤씨가 인공지능(AI)을 활용해 구성원들의 실제 업무 방식을 바꾸기 위한 ‘전사 AI 챌린지’ 경진대회를 개최한다.이번 챌린지는 포스코그룹이 추진 중인 AX 전략과 맞닿아 있다. 포스코그룹은 AI를 미래...,https://www.ksmnews.co.kr/news/view.php?idx=597478,pos
2026-03-29 20:44,,포스코,차세대 배터리 승부수 던진 포스코퓨처엠,"포스코퓨처엠이 금호석유화학, BEI(비이아이)와 무음극 리튬메탈 배터리 기술 공동개발을 위한 업무협약(MOU)을 체결했다.25일 서울 포스코센터에서 체결된 협약식에서 포스코퓨처엠은 금호석유화학, 비이아이와 함께...",https://www.ksmnews.co.kr/news/view.php?idx=597498,pos
2026-03-29 20:38,,포스코인터,"[창간 22주년] 포스코, 최첨단 고급철강으로 글로벌 시장 누빈다",인터배터리 2026'에서 포스맥을 소개하며 극한 환경에서도 견딜 수 있는 소재이자 친환경 강재임을 입증했다. 정부는 오는 2030년까지 해상풍력 발전 설비를 약 14기가와트(GW) 규모로 확대할 계획이다. 특히 포스코...,http://www.hidomin.com/news/articleView.html?idxno=614411,pos
