날짜,매체명,검색키워드,기사제목,주요기사 요약,URL,sentiment
2026-03-13 07:30,,포스코인터,K배터리 분위기 반전 카드는?...인터배터리 현장 가보니,"인터배터리 2026 행사 내 LG에너지솔루션 부스 [사진: LG에너지솔루션] 14개국 667개사가 역대 최대 규모로 집결한 인터배터리 2026 현장. 엄기천 포스코퓨처엠 대표는 ""예전엔 3사 합쳐 글로벌 점유율이 50%가 넘었는데...",https://www.digitaltoday.co.kr/news/articleView.html?idxno=640250,pos
2026-03-13 07:26,,포스코,“전통 제조보다 기술기업”…Z세대가 본 한화·HD현대·포스코 채용 이...,"HD현대, 포스코에 대한 인식을 AI 기반으로 시각화했다고 밝혔다. 이번 조사는 응답자가 선택한 기업 이미지... 포스코는 ‘기술주도’ 44%, ‘현장근무 중심’ 43%, ‘업무강도 높음’ 32%로 조사됐다. 철강 생산 공정 중심의...",https://www.gosiweek.com/article/1065565414688718,pos
2026-03-13 07:12,,포스코,"Z세대 선정 '한화·HD현대·포스코' 이미지...""기술주도""","이번 조사는 한화, HD현대, 포스코에 대해 구직자들이 선택한 이미지 키워드를 AI 모델 '제미나이'를 활용해... 마지막으로 포스코는 '기술주도(44%)', '현장근무 중심(43%)', '업무강도 높음(32%)' 키워드가 상위로 나타났다....",https://www.slist.kr/news/articleView.html?idxno=723368,pos
2026-03-13 07:05,뉴스1,포스코인터,"""中 배터리 안돼""…美·EU 견제에 K-배터리 '반등 기회' 커진다","엄기천 한국배터리산업협회 회장(포스코퓨처엠 사장)은 최근 인터배터리 행사에서 ""유럽연합에서 산업 가속화법이 발표되면서 K-배터리에 새로운 기회가 열리고 있다""며 ""기술 개발과 공정 혁신, 차세대 전지 개발에...",https://www.news1.kr/industry/general-industry/6099568,pos
2026-03-13 07:00,에너지경제,포스코,포스코그룹 “고품위 리튬이 경쟁력…직접추출 기반 공정도 확보할것”,포스코그룹이 아르헨티나와 호주에서 고품위 리튬 자원을 확보한 성과를 넘어 직접리튬추출(DLE) 기술을 기반으로 저품위 리튬까지 활용 범위를 넓히는데 주력한다. 성진서 포스코홀딩스 이차전지소재전략부장은 지난...,https://www.ekn.kr/web/view.php?key=20260312026187042,pos
2026-03-13 07:00,오토데일리,구동모터코어,"프리미엄에 가격 메리트까지 더했더니, 볼보 'EX30', 2주 만에 2천대 훌...","그 결과 엔트리 트림인 EX30 코어(Core) 트림의 경우 3,000만원대의 파격적인 가격으로 책정되며 많은... 사륜구동(AWD)의 트윈 모터 퍼포먼스(Twin Motor Performance) 단일 파워트레인으로 구성되며, 428마력의 모터...",https://www.autodaily.co.kr/news/articleView.html?idxno=542287,pos
2026-03-13 06:54,,포스코,오창 생활권 확대… 산업·연구 인프라 성장 속 '포스코 더샵' 주목,이 같은 변화 속에서 오창 중심 생활권에 위치한 '포스코 더샵' 주거 단지도 함께 언급되고 있다. 해당 단지는 오창 핵심 입지의 위치로 대규모 아파트와 아파텔이 함께 조성되는 복합 주거 단지로 계획됐다. 특히 아파트와...,https://www.getnews.co.kr/news/articleView.html?idxno=864258,pos
2026-03-13 06:31,,포스코인터내셔널,진작 담아두길 잘했네…'이 와중에 10% 넘게 뛰었다' 환호 [분석+],미얀마 가스전을 운영 중인 포스코인터내셔널(10.11%)은 중동 전쟁으로 국제 유가 급등 수혜로 상승했다. 한국카본(14.08%)과 우리기술(28%)도 국제 유가 급등의 수혜 기대가 상승세에 힘을 보탰다고 볼 여지가 있다....,https://www.hankyung.com/article/2026031269866,pos
2026-03-13 06:31,,포스코인터내셔널,"진작 담아두길 잘했네…""이 와중에 10% 넘게 뛰었다"" 환호 [분석+]",미얀마 가스전을 운영 중인 포스코인터내셔널(10.11%)은 중동 전쟁으로 국제 유가 급등 수혜로 상승했다. 한국카본(14.08%)과 우리기술(28%)도 국제 유가 급등의 수혜 기대가 상승세에 힘을 보탰다고 볼 여지가 있다....,https://www.hankyung.com/article/2026031269866,pos
2026-03-13 06:10,,포스코,포스코인터내셔널 주가 뜨거워진다…에너지 사업 기대감 부각,POSCO홀딩스를 중심으로 한 포스코 그룹 계열사들이 비교적 안정적인 흐름을 보이며 투자자들의 관심을 받고... 12일 국내 증시에서 포스코 그룹 계열사 가운데 상승폭이 가장 컸던 종목은 포스코인터내셔널이었다. 주가는 4...,https://www.pinpointnews.co.kr/news/articleView.html?idxno=436337,pos
2026-03-13 06:06,뉴스저널리즘,포스코,포스코 '안전' 문구 하나 넣고 장인화 회장 연봉 늘렸다,뉴스저널리즘 장하민 기자 = 포스코 사업장에서 산업재해 사망사고가 이어진 가운데 장인화 포스코홀딩스 회장의 보수가 크게 증가한 것으로 나타났다. 특히 경영진 성과급 평가 항목에 '안전'이 새롭게 포함된 사실이...,https://www.ngetnews.com/news/articleView.html?idxno=549077,pos
2026-03-13 06:02,,포스코인터,메트로신문 3월 13일자 한줄뉴스,"<산업부> ▲ 홍영준 포스코퓨처엠 기술연구소장은 12일 서울 강남구 코엑스에서 열린 '인터배터리 2026 더 배터리 컨퍼런스'에서 ""현재 배터리 산업에서 가장 중요한 과제는 배터리 가격을 킬로와트시(kWh)당 100달러 이하로...",http://www.metroseoul.co.kr/article/20260312500712,pos
2026-03-13 05:05,,포스코,호반건설·포스코이앤씨 ‘맞손’…층간소음 저감 통합기술 개발,호반건설과 포스코이앤씨가 아파트 층간소음 문제를 줄이기 위해 공동 대응 체계 구축에 나선다. 호반건설과 포스코이앤씨는 지난 11일 서울 서초구 호반그룹 본사에서 ‘공동주택 주거환경 개선을 위한 층간소음...,https://www.seoul.co.kr/news/economy/industry/2026/03/13/20260313030004?wlog_tag3=naver,pos
2026-03-13 04:18,,포스코인터,K배터리 소재 '첨단 기술력' 충전,"실제 포스코그룹은 올해 인터배터리에서 '지속가능 공급망' 존을 마련하고 비전을 소개했다. 현장에선 아르헨티나 리튬 염호, 호주 리튬 광산, 아프리카 흑연 광산 등 글로벌 우량자원에 대한 투자계획을 한눈에 확인할...",https://www.mt.co.kr/industry/2026/03/13/2026031220160339285,pos
2026-03-13 01:00,,삼척블루파워,[DCM] CJ·KCC 3%대 발행…이랜드·중앙 6~7%대 [2월 리뷰②],"포스코 계열 삼척블루파워(6.402%), 이랜드월드(6.700%), 중앙그룹(JTBC·중앙일보, 7.750%)은 이달 발행사 가운데 가장 높은 금리를 부담했다. 삼척블루파워의 경쟁률은 1.52배에 그쳤고, 중앙그룹은 1.01배로 수요예측에서...",http://www.fntimes.com/html/view.php?ud=202603121650259968141825007d_18,pos
2026-03-13 01:00,,삼척블루파워,[DCM] 이랜드·중앙 6~7%대…신용도 따라 엇갈린 회사채 금리 [2월 리뷰②...,"포스코 계열 삼척블루파워(6.402%), 이랜드월드(6.700%), 중앙그룹(JTBC·중앙일보, 7.750%)은 이달 발행사 가운데 가장 높은 금리를 부담했다. 삼척블루파워의 경쟁률은 1.52배에 그쳤고, 중앙그룹은 1.01배로 수요예측에서...",http://www.fntimes.com/html/view.php?ud=202603121650259968141825007d_18,pos
2026-03-13 00:06,,구동모터코어,"전기차 관련주, '룰루랄라 콧노래' 명신산업·LS머트리얼즈·폴라리스세...",삼화전자는 페라이트 코어를 비롯한 전자기기 부품을 제조·판매하며 국내외 시장에서 활발히 사업을... 전기차용 구동모터 생산에도 나서고 있다. 또한 급발진 사고 예방을 위한 '페달 오조작 방지 장치' 기술을...,http://www.finomy.com/news/articleView.html?idxno=251324,neg
2026-03-13 00:06,,포스코인터,"통신장비 관련주, '함박웃음' 옵티코어·빛과전자·머큐리·이노인스트...","빛과전자는 광통신 모듈 제조업체로 이동 통신용 광모듈(SFP, QSFP), 초고속 인터넷용 광부품, RF 등을... 피노는 CNGR과 포스코퓨처엠의 합작법인인 'C&P 신소재'의 CNGR 측 지분 29%를 취득하며 전구체 생산 능력을...",http://www.finomy.com/news/articleView.html?idxno=251321,pos
2026-03-12 23:50,물류신문,포스코플로우,"플로우케이, 광양항 항만배후단지에 물류센터 준공","이날 준공식에는 플로우케이와 포스코홀딩스, 포스코플로우 등 포스코그룹사, 여수광양항만공사와 여수지방해양수산청, 광양만권자유구역청, 광양소방서, 광양상공회의소 등 관련 기업과 기관 인사들이 참석했다....",https://www.klnews.co.kr/news/articleView.html?idxno=320327,pos
2026-03-12 23:36,,포스코,"포스코청암재단, '제22회 한국유학장학' 수여식 개최",현대경제신문 박명섭 기자 | 포스코청암재단(이사장 장인화)은 12일 서울 포스코센터에서 '제22회 한국유학장학 증서수여식 및 졸업 환송식'을 개최했다고 밝혔다. 이번 행사는 새롭게 선발된 포스코한국유학장학생...,http://www.finomy.com/news/articleView.html?idxno=251327,pos
2026-03-12 23:10,,포스코인터,"[리포트] ""미래 시장 선점""···포스코퓨처엠·에코프로, 차세대 배터리...",인터배터리에 전시된 포스코퓨처엠의 전고체 배터리용 양극재입니다. 포스코퓨처엠은 LFP(리튬인산철) 양극재를 중심으로 전고체용 양극재와 실리콘 음극재 등 신규 소재 개발에 박차를 가하고 있습니다 . 특히...,http://www.paxetv.com/news/articleView.html?idxno=265052,pos
2026-03-12 22:13,,포스코,"포스코청암재단, 제22회 한국유학장학 증서 수여식 및 졸업 환송식 개최...",포스코청암재단(이사장 장인화)은 3월 12일 포스코센터에서 제 22회 한국유학장학 증서 수여식 및 졸업 환송식을 개최하고 신규 선발된 장학생들에게 장학증서를 수여하는 한편 학업을 마친 졸업 장학생들의 새로운...,https://www.polinews.co.kr/news/articleView.html?idxno=725317,pos
2026-03-12 21:26,,포스코인터,"[가보니] ""전기차만 바라볼 수 있나요? 첨단산업 새로운 기회로""","인터배터리2026 포스코퓨처엠 부스 (사진 / 강민 기자) 포스코퓨처엠은 'Together, Drawing BoT Future'를 주제로 차세대 배터리 소재 기술과 지속가능한 공급망을 활용해 자율주행 전기차, 데이터센터 ESS, 휴머노이드...",http://www.sisafocus.co.kr/news/articleView.html?idxno=356968,pos
2026-03-12 20:50,,구동모터코어,"포스코퓨처엠, 미래 BoT 시대 이끌 소재 솔루션 선보인다","이 밖에도, 포스코인터내셔널의 전기차용 구동모터코어, 희토류 영구자석과 포스코의 배터리팩, 각형·원통형 배터리셀 제조용 캔 등 포스코그룹의 전기차용 철강 제품과 솔루션도 소개한다.◈ 데이터센터 ESS...",https://www.ksmnews.co.kr/news/view.php?idx=594575,pos
2026-03-12 20:41,,포스코,"포스코청암재단, 글로벌 장학사업 성장","포스코청암재단(이사장 장인화)은 3월 12일 포스코센터에서 제 22회 한국유학장학 증서수여식 및 졸업 환송식을 개최하고, 신규 선발된 장학생들에게 장학증서를 수여하는 한편 학업을 마친 졸업 장학생들의 새로운...",https://www.ksmnews.co.kr/news/view.php?idx=594737,pos
2026-03-12 20:24,데일리한국,포스코,"포스코청암재단, 제22회 한국유학장학생 19명 신규 선발",2026 포스코한국유학장학 신입생 증서수여식 및 졸업 환송식 단체사진. 사진=포항시 제공 포스코청암재단은 올해 제22회 포스코한국유학장학생 19명을 새롭게 선발했다고 12일 밝혔다. 포스코청암재단은 이날 서울...,https://daily.hankooki.com/news/articleView.html?idxno=1346273,pos
2026-03-12 20:04,경북일보,포스코,노란봉투법 시행 첫 사례…포스코에 하청노조 집단 교섭 요구,"지난 10일 개정 노동조합 및 노동관계조정법(노란봉투법·이하 노동조합법)이 시행된 가운데 포스코노동조합이 포스코하청사 33개 노동조합의 위임을 받아 단체교섭을 요구, 관심이 쏠리고 있다. 개정된 노동조합법은 기존...",https://www.kyongbuk.co.kr/news/articleView.html?idxno=4066797,pos
2026-03-12 19:30,대경일보,포스코,"포스코청암재단, 제22회 한국유학장학 증서수여식 및 졸업 환송식 개최",▲ 포스코청암재단이 개최한 2026 포스코한국유학장학 신입생 증서수여식 및 졸업 환송식 참석자들이 기념촬영을 하고 있다. 포스코청암재단 제공 포스코청암재단은 12일 포스코센터에서 제22회 한국유학장학 증서수여식...,https://www.dkilbo.com/news/articleView.html?idxno=536864,pos
2026-03-12 19:22,경북일보,포스코,"포스코청암재단, 제22회 한국유학장학 증서수여식·졸업 환송식","포스코청암재단(이사장 장인화)은 12일 포스코센터에서 '제22회 한국유학장학 증서수여식 및 졸업 환송식'을 개최했다. 신규 선발된 포스코한국유학장학생 19명에게 장학증서를 수여하고, 학업을 마친 졸업 장학생들의...",https://www.kyongbuk.co.kr/news/articleView.html?idxno=4066769,pos
2026-03-12 19:16,,포스코인터,"고체산화물 연료전지(SOFC) 관련주, '봄꽃만개' 한선엔지니어링·SK이터...","데이터센터 전력 부족과 탄소중립 목표로 민간 투자(한화, 포스코 등)가 몰리며, 2030년 국내 시장 규모... LS머트리얼즈는수명을 늘린 인공지능(AI) 데이터센터용 울트라캐패시터(UC) 시스템을 '인터배터리 2026'에서...",http://www.finomy.com/news/articleView.html?idxno=251318,pos
2026-03-12 19:14,,포스코,"호반건설·포스코이앤씨, 층간소음 저감 기술 공동개발","포스코이앤씨는 '공동주택 주거환경 개선을 위한 층간소음 통합기술 공동개발' 업무협약(MOU)을 체결했다고 12일 밝혔다. 서울 서초구 호반 본사에서 전날 열린 협약식에는 문갑 호반그룹 경영부문대표, 최종문 포스코이앤...",http://www.wikileaks-kr.org/news/articleView.html?idxno=184690,pos
2026-03-12 19:10,동아일보,포스코,"포스코청암재단, 한국유학장학증서 수여식 및 졸업 환송식 개최… 올해...",포스코청암재단은 12일 서울 강남구 포스코센터에서 제22회 한국유학장학증서 수여식 및 졸업 환송식을 개최했다. 새롭게 선발된 장학생들에게 장학증서를 수여하고 학업을 마친 졸업 장학생들의 새로운 출발을...,https://www.donga.com/news/Economy/article/all/20260312/133520379/1,pos
2026-03-12 19:08,,포스코플로우,"플로우케이(주), 광양항 항만배후단지에 물류센터 준공","특히 플로우케이는 포스코플로우와 대우로지스틱스의 합작으로 설립된 법인으로 이차전지, 석유화학 소재 등 포스코그룹을 포함한 고객사의 최적 물류 솔루션을...",http://www.breaknews.com/1191409,pos
2026-03-12 18:52,,포스코인터,"[인터배터리 2026] ""강판·양·음극재, 없는 게 없네""... 포스코퓨처엠,...","사진=연합뉴스 ""강판부터 양·음극재까지, 소재 라인업이 비어 있는 곳이 없다."" 11일 서울 코엑스 '인터배터리 2026' 포스코퓨처엠 부스를 찾은 관람객들 사이에서 나오는 공통된 반응이다. 포스코퓨처엠은 이번 전시를...",https://www.meconomynews.com/news/articleView.html?idxno=128920,pos
2026-03-12 18:24,,포스코,"포스코청암재단 ""한국서 꿈·열정 펼치세요""",12일 2026 포스코한국유학장학 신입생 증서수여식 및 졸업 환송식을 마친 뒤 단체 기념촬영을 하고 있다. 포스코 제공 포스코청암재단은 12일 포스코센터에서 제 22회 한국유학장학 증서수여식 및 졸업 환송식을 개최하고...,http://www.hidomin.com/news/articleView.html?idxno=612139,pos
2026-03-12 18:16,,포스코인터,"[인터배터리] [2026] K-배터리, '안보 방패' 장착…에너지 주권 시대 '게...","결국 배터리가 이 모든 노후 기술을 대체하고 있습니다."" (포스코퓨처엠 현장 관계자) 12일 서울 코엑스에서 열린 '인터배터리 2026' 현장은 더 이상 전기차(EV)만의 잔치가 아니었다. 캐즘(수요 정체)을 뚫기 위한 K...",https://dealsite.co.kr/articles/158361,pos
2026-03-12 18:06,,포스코인터,[르포] “현장 목소리 듣자”…배터리 잡페어에 취준생 발길,12일 서울 강남구 코엑스에서 열리고 있는 국내 최대 배터리 전시회 ‘인터배터리 2026’의 부대 행사인... 11일부터 13일까지 열리는 이번 잡페어에서는 △LG에너지솔루션 △삼성SDI △SK온 △포스코퓨처엠 △엘앤에프...,https://www.g-enews.com/view.php?ud=20260312152006620424debea800_1,pos
2026-03-12 17:58,,포스코,[밸류업 인더스트리] 포스코의 근본 '철강' 키운다… R&D투자 확 늘린 장...,"확보 포스코그룹의 미래 성장 동력으로는 '이차전지' 소재가 먼저 거론된다. 하지만 실제 투자 흐름을... 이는 포스코그룹이 기술 경쟁력 강화에 다시 무게를 두는 배경으로, 장인화 회장의 전략이 반영된 결과로도...",https://www.asiatoday.co.kr/view.php?key=20260313010003844,pos
2026-03-12 17:54,,포스코인터,"[현장] ‘배터리 올림픽’ 막 올랐다…인터배터리 2026, 차세대 배터리...",열린 ‘인터배터리 2026’ 전시장 전경. 배터리 기업과 소재·장비 업체 부스에 관람객들이 몰리며... 포스코퓨처엠은 고성능 양극재와 음극재 기술을 중심으로 고에너지밀도 배터리 구현 전략을 펼쳤다. 이에 따라 이...,https://www.news2day.co.kr/article/20260312500153,pos
2026-03-12 17:54,,포스코인터,"K-배터리 전시회 '인터배터리 2026', ""전기차 넘어 ESS·AI·로봇으로 확...",인터배터리 2026 전시관 입구 모습 (사진=황병우 기자) 코엑스와 한국배터리산업협회는 지난 11일에 개막한... 포스코퓨처엠은 고성능 앙극재와 음극재 기술을 통해 고에너지밀도 배터리 구현 전략을 소개하며 차세대...,http://www.efnews.co.kr/news/articleView.html?idxno=128158,pos
2026-03-12 17:54,MTN,포스코인터,"소재사들도 미래 먹거리 '정조준'…""전고체 양극재·LFP 양산""[인터배터...","'인터배터리 2026' 가 2일차를 맞이했습니다. 전기차 수요 둔화에 배터리 제조사들이 전고체 배터리 상용화에 속도를 내면서, 소재사들도 '미래 먹거리'에 집중하는 모습입니다. 김현정 기자입니다. [기사내용]포스코퓨처...",https://news.mtn.co.kr/news-detail/2026031216412547806,pos
2026-03-12 17:52,,포스코,"포스코청암재단, 한국유학장학 증서수여식 및 졸업식 개최",포스코청암재단은 포스코센터에서 열린 제 22회 한국유학장학 증서수여식 및 졸업 환송식을 개최했다고 12일 밝혔다. 이 자리에서 포스코청암재단은 신규 선발된 장학생들에게 장학증서를 수여하는 한편 학업을 마친...,http://www.popcornnews.net/news/articleView.html?idxno=115000,pos
2026-03-12 17:44,,포스코,"해외 덤핑공세 맞서 K-철강산업 보호…관세청, 포스코 감사패 받아",이명구 관세청장은 12일 포항에 소재한 포스코 포항제철소를 찾아 세계 최초의 스마트 고로인 제2고로공장 등... 포스코측은 간담회에서 “우리 철강산업의 보호와 수출 확대를 위해 관세청이 앞으로도 불공정 무역과...,https://www.taxtimes.co.kr/news/article.html?no=274280,pos
2026-03-12 17:40,,포스코인터내셔널,"[정치家] 김정관 산업통상부 장관 ④ ∣ ""신에게는 12척이 있습니다""…...","간담회에는 CJ, 현대자동차, 포스코인터내셔널, LG전자, 롯데면세점, 셀트리온 등 식품·유통, 자동차, 바이오 등 다양한 분야에서 싱가포르에 진출한 국내 기업 9곳의 관계자들이 참석해 현지 경영 현안과 애로 사항을...",https://www.cbci.co.kr/news/articleView.html?idxno=560600,pos
2026-03-12 17:36,,포스코,[브리프] CJ 한화시스템 HS효성 한국앤컴퍼니 포스코 유진 CJ올리브네트...,"■ 포스코청암재단, 제22회 한국유학장학 증서수여식 개최 2026 포스코한국유학장학 신입생 증서수여식 및 졸업생 환송식 단체사진ㅣ포스코그룹 포스코청암재단은 12일 포스코센터에서 제 22회 한국유학장학...",http://www.biztribune.co.kr/news/articleView.html?idxno=350347,pos
2026-03-12 17:35,,포스코인터내셔널,"포스코인터 ""종합상사 옛말"" … 에너지·식량회사 무한 변신","신사업으로 체질개선 광양에 국내 최대 LNG허브 구축 印尼 팜기업 인수해 영농·착유 갖춰 포스코인터내셔널이 에너지, 소재, 식량으로 이어지는 자산 기반의 '3대 핵심 사업' 체제 구축에 속도를 내고 있다. 주요 투자...",https://www.mk.co.kr/article/11986503,pos
2026-03-12 17:35,,포스코인터,"포스코인터 ""무역상사 옛말""…에너지·식량회사 무한 변신","신사업으로 체질개선 광양에 국내 최대 LNG허브 구축 印尼 팜기업 인수해 영농·착유 갖춰 포스코인터내셔널이 에너지, 소재, 식량으로 이어지는 자산 기반의 '3대 핵심 사업' 체제 구축에 속도를 내고 있다. 주요 투자...",https://www.mk.co.kr/article/11986503,pos
2026-03-12 17:34,,포스코,"[ESG] 포스코청암재단, 한국유학장학 19명 신규 선발...22년간 562명 지원",|중앙이코노미뉴스 송태원 기자|포스코한국유학장학 신입생 증서수여식 및 졸업생 환송식.[사진=포스코청암재단] 포스코청암재단(이사장 장인화)은 12일 포스코센터에서 제 22회 한국유학장학 증서수여식 및 졸업...,https://www.joongangenews.com/news/articleView.html?idxno=501909,pos
2026-03-12 17:33,,POSCO International,"POSCO International's ""Old Word of General Trading Company""… Energy and food companies are transformed indefinitely - 매일경제","<a href=""https://news.google.com/rss/articles/CBMiU0FVX3lxTE1ET3h5RXRrckl3d19JdzhDWmFVTHYzamE3clhibFZ4RWhCc2pIcnY3YW5WM1VjQk5iX25wLXotclpiUFV2NlkwQklFT1N0RjhUWGVV?oc=5"" target=""_blank"">POSCO International's ""Old Word of General Trading Company""… Energy and food companies are transformed indefinitely</a> <font color=""#6f6f6f"">매일경제</font>",https://news.google.com/rss/articles/CBMiU0FVX3lxTE1ET3h5RXRrckl3d19JdzhDWmFVTHYzamE3clhibFZ4RWhCc2pIcnY3YW5WM1VjQk5iX25wLXotclpiUFV2NlkwQklFT1N0RjhUWGVV?oc=5,pos
2026-03-12 17:30,,포스코,"포스코청암재단, 한국유학장학 증서수여식·졸업 환송식 개최",포스코청암재단은 12일 포스코센터에서 제 22회 한국유학장학 증서수여식 및 졸업 환송식을 개최했다고 밝혔다. 포스코청암재단은 신규 선발된 장학생들에게 장학증서를 수여하는 한편 학업을 마친 졸업 장학생들의...,http://www.srtimes.kr/news/articleView.html?idxno=198561,pos
2026-03-12 17:26,,포스코,"포스코청암재단, 한국유학장학생 19명 장학증서 수여",포스코청암재단(이사장 장인화)은 12일 포스코센터에서 제22회 한국유학장학 증서수여식 및 졸업 환송식을 개최하고 신규 선발된 장학생들에게 장학증서를 수여했다. 포스코청암재단은 올해 포스코한국유학장학생...,https://www.joongdo.co.kr/web/view.php?key=20260312010004202,pos
2026-03-12 17:24,디지털데일리,포스코인터,"[DD퇴근길] 새 판 짠다는 엔씨…""2030년 5조원 매출 목표""","여기에 한국인터넷진흥원(KISA), 정보통신산업진흥원(NIPA), 한국전파진흥협회(RAPA) 등 관련 기관의 일부 사업... 홍영준 포스코퓨처엠 ""배터리 핵심은 가격 인하, 공정·개발 혁신이 답"" [고성현기자] 홍영준 포스코퓨처엠...",https://www.ddaily.co.kr/page/view/2026031217152154804,pos
2026-03-12 17:18,,포스코인터내셔널,코스피 이틀 상승 뒤 숨고르기…외국인 2조 매도에도 개인 매수로 낙폭...,"원유 관련주에서는 포스코인터내셔널과 GS 등이 강세를 보였다. 코스닥 시장은 상승세를 이어갔다. 코스닥 지수는 전 거래일보다 11.57포인트(1.02%) 오른 1148.4에 마감했다. 개인과 기관이 각각 5074억원, 2524억원을...",https://www.goodkyung.com/news/articleView.html?idxno=284415,pos
2026-03-12 17:15,,포스코인터,"장인화와 이동채 ""시간 내달라"" 포옹…'아흔 회장님'도 배터리 열공","장인화 포스코그룹 회장, 이동채 에코프로 창업주, 김재철 동원그룹 명예회장이 12일 이틀째를 맞이한 '인터배터리 2026' 현장을 찾았다. 장 회장은 이날 오후 3시30분쯤 '인터배터리 2026'이 열리고 있는 서울 코엑스를...",https://www.mt.co.kr/industry/2026/03/12/2026031217051873839,pos
