날짜,매체명,검색키워드,기사제목,주요기사 요약,URL,sentiment
2026-03-27 13:26,,포스코,"포스코 포항제철소, 수소환원제철 사업 본궤도…“국토부 승인”",포스코 수소환원제철소 건립을 위한 용지조성안이 정부 승인을 받아 사업이 본궤도에 올랐다. 27일 포스코 등에 따르면 국토부는 이날 포스코의 수소환원제철소 조성을 위한 경북 포항국가산업단지 산단계획 변경안을...,https://www.seoul.co.kr/news/economy/industry/2026/03/27/20260327500157?wlog_tag3=naver,pos
2026-03-27 11:54,이투데이,포스코인터내셔널,"비료·포장재·온실필름까지 점검…농식품부, 중동전쟁 대응 총력","당시 농식품부는 한국스마트팜산업협회, 삼양식품, 포스코인터내셔널, 한국비료협회 등과 함께 중동 상황이 농업 및 연관산업에 미치는 영향을 점검했고, 업계는 물류와 원료구입자금 지원, 비료 원료 수급 선제 대응, 가격...",https://www.etoday.co.kr/news/view/2569996,pos
2026-03-27 11:14,,포스코인터내셔널,"[데이터 뉴스룸] 유통상사 업계, 재계 출신과 50대를 사외이사로 다수 ...",1969년생 신규 선임 사외이사에는 ▲이은주 현(現)EQT Korea 산업고문·학교법인 정의학원 교육이사(포스코인터내셔널 사외이사) ▲변광윤 현(現) 뉴웨이브커머스 대표이사(롯데하이마트) ▲최진회 전(前) 신한은행...,https://www.greened.kr/news/articleView.html?idxno=338579,pos
2026-03-27 11:14,연합뉴스,포스코,"포스코 수소환원제철소 용지조성 정부 승인…""포항 앞바다 매립""",포스코 수소환원제철소 건립을 위한 용지조성안이 정부 승인을 받아 사업 추진에 탄력이 붙었다. 27일 국토교통부 등에 따르면 국토부는 이날 포스코의 수소환원제철소 조성을 위한 경북 포항국가산업단지 산단계획...,https://www.yna.co.kr/view/AKR20260327068900053?input=1195m,pos
2026-03-27 10:50,,포스코,"포스코, 거래사 금융지원 나선다… 관세·고환율 뚫고 철강업계 수출 공...","▲ 포스코와 기업은행, 한국무역보험공사의 철강업계 금융지원 프로그램에 참여한 티지에스파이프 공장에 해외 출하를 앞둔 제품들이 쌓여 있다. 포스코가 철강 거래사의 수출 경쟁력을 높이기 위한 금융지원에 본격...",https://www.ilyoseoul.co.kr/news/articleView.html?idxno=514837,pos
2026-03-27 10:48,,포스코,거래사 금융지원 나선 포스코… 관세·고환율 뚫고 철강업계 수출 공급...,포스코가 철강 거래사의 수출 경쟁력을 높이기 위한 금융지원에 본격 나서며 철강 공급망 안정화에 힘을... 올해 1월부터 시행 중인 해당 프로그램은 포스코와 기업은행이 총 200억원을 한국무역보험공사에 출연하고...,https://www.wolyo.co.kr/news/articleView.html?idxno=310319,pos
2026-03-27 10:38,,구동모터코어,18년 몸에 뱄다…정부 박수 받은 포스코 車 5부제,CCU(탄소 포집 및 활용) 기술 혁신을 병행하고 전기차 핵심인 구동모터코어 생산 체제를 확충한다. 포스코는 세계철강협회로부터 4년째 지속가능성 최우수 멤버로 선정됐다. 더불어 WSD가 선정하는 '세계에서 가장...,https://news.einfomax.co.kr/news/articleView.html?idxno=4406311,pos
2026-03-27 10:32,,미얀마 LNG,[더벨][thebell note] 장인화의 선택,LNG는 장기 계약으로 물량과 가격이 묶인다. 터미널과 발전으로 이어지는 구조에서는 계약 물량이 수익으로... 미얀마 곡물 법인 ‘GOLDEN LACE POSCO INTERNATIONAL’ 지분 매각도 같은 흐름이다. 문제는 속도다. 철강은 가격이...,https://www.thebell.co.kr/free/content/ArticleView.asp?key=202603240857366240107218,pos
2026-03-27 09:30,,POSCO INTERNATIONAL,"포스코, 첨단산업 숨은 동맥 ‘산업가스’로 미래 성장 가속","It is assumed that there may be errors in the English translation.> POSCO Accelerates Future Growth with... and international semiconductor companies. Furthermore, in collaboration with the Pohang Institute of...",http://www.breaknews.com/1195576,pos
2026-03-27 08:38,,포스코,"[주간 기업동향] 장인화 포스코그룹 회장, 철강·이차전지 성과 창출 강...","장인화 포스코그룹 회장,철강·이차전지 성과 창출 강조 장인화 포스코그룹 회장이 올해를 철강과 이차전지 소재 '2코어' 사업의 실질적 성과 창출 원년으로 만들겠다고 밝혔다. 글로벌 경기 둔화 속에서도 북미·인도...",https://www.banronbodo.com/news/articleView.html?idxno=31997,pos
2026-03-27 08:22,,포스코,"“돈줄 막힌 거래사 숨통 틔운다” … 포스코, 4000억 보증 금융지원 가...",뉴데일리 김서연 기자 = 포스코가 철강 거래사의 수출 경쟁력 강화를 위해 금융지원에 나섰다. 관세 장벽과 고환율 등 복합 리스크 속에서 공급망 안정화에 기여하겠다는 취지다. 포스코는 27일 기업은행...,https://biz.newdaily.co.kr/site/data/html/2026/03/27/2026032700039.html,pos
2026-03-27 08:18,,포스코인터내셔널,"[더벨][주주총회 프리뷰] 뜨거운 감자 이사 수 변경, 한국앤컴퍼니 결말...","이와 동시에 현 이사회가 추천한 이행희 포스코인터내셔널 사외이사의 사외이사 선임과 여치경 여치경 종합법률사무소 대표의 사외이사 선임, 이사의 수 변경 등 안건에 반대를 권고하고 있다. 특히 이사 수 변경 안건의...",https://www.thebell.co.kr/free/content/ArticleView.asp?key=202603241532534920106891,pos
2026-03-27 08:10,철강금속신문,포스코,"포스코퓨처엠, 엄기천 대표이사 재선임…ESG·평가보상위 신설",포스코퓨처엠은 26일 제55기 정기주주총회를 열고 이사 선임 및 정관 변경 등 주요 안건을 의결했다고... 기타비상무이사에는 정석모 포스코홀딩스 사업시너지본부장이 신규 선임됐다. 아울러 윤태화·이복실 사외이사도...,http://www.ferrotimes.com/news/articleView.html?idxno=47102,pos
2026-03-27 08:10,철강금속신문,구동모터코아,페로타임즈 손바닥뉴스 3월 27일(금),"확대…구동모터코아 1000만 체제 [분석] 中 철강 수급 '엇박자'…감산에도 재고 급증 ""수요 부진 심화"" 세아제강, 2026년 실적은 '해상풍력, 라인파이프'가 견인 美 상무부, 한국산 OCTG 반덤핑 예비판정…넥스틸...",http://www.ferrotimes.com/news/articleView.html?idxno=47112,pos
2026-03-27 08:06,,포스코,"포스코엠텍, 사외이사 김성준 재선임",철강포장·비철금속 기업 포스코엠텍(009520)이 사외이사 김성준을 재선임했다고 26일 공시했다. 사외이사 변경 발생일은 2026년 3월 26일이다. 포스코엠텍은 사외이사 선임·재선임 인원수가 1명이라고 밝혔다....,https://www.digitaltoday.co.kr/news/articleView.html?idxno=646848,pos
2026-03-27 08:00,,포스코,"포스코홀딩스 제58기 정기주주총회 개최...장인화 회장, ""철강·이차전지...",▲ 장인화 포스코그룹 회장이 제58기 포스코홀딩스 정기주주총회를 진행하고 있다. 포스코홀딩스가 24일 서울 포스코센터에서 제58기 정기주주총회와 이사회를 열고 주요 안건을 의결했다. 장인화 포스코그룹 회장은...,https://www.ilyoseoul.co.kr/news/articleView.html?idxno=514814,pos
2026-03-27 07:10,,포스코,"포스코엠텍, 제52기 재무제표 승인·현금배당 1주당 10원 결의",기업 포스코엠텍(009520)은 정기주주총회에서 제52기 재무제표를 승인하고 보통주 1주당 10원의 현금배당을 결의했다고 26일 공시했다. 이번 재무제표 승인 안건에는 현금배당 내용이 포함됐다. 포스코엠텍의...,https://www.digitaltoday.co.kr/news/articleView.html?idxno=646773,pos
2026-03-27 07:10,,포스코인터내셔널,"포스코인터내셔널, 기업 및 주주가치 제고 계획과 고배당기업 해당 여부...",종합 상사 기업 포스코인터내셔널(047050)은 기업 및 주주가치 제고 계획과 조세특례제한법 제104조의27에 따른 고배당기업 해당 여부를 포함한 내용을라고 26일 공시했다. 포스코인터내셔널은...,https://www.digitaltoday.co.kr/news/articleView.html?idxno=646763,pos
2026-03-27 07:00,,포스코,"포스코퓨처엠 엄기천 대표 재선임…""베트남 공장 신설 등 선제 투자로 ...",포스코퓨처엠이 엄기천 대표이사를 다시 선임하며 선제적 투자를 앞세운 성장 전략에 힘을 싣는다. 포스코퓨처엠은 26일 경북 포항 본사에서 열린 제55기 정기주주총회와 이사회에서 엄기천 대표이사의 연임을 의결했다고...,http://www.newsroad.co.kr/news/articleView.html?idxno=56805,pos
2026-03-27 07:00,,구동모터코어,"볼보 EX30, 가격 전략 적중…2주간 2000대 돌파","EX30 코어 트림은 기존 4752만원에서 3991만원으로, 최상위 트림 울트라는 4479만원으로 조정됐다. EX30CC... 듀얼 모터 기반 사륜구동(AWD) 시스템을 적용해 최고출력 428마력, 최대토크 55.4kg·m를 내뿜는다. 정지 상태에서...",http://www.hansbiz.co.kr/news/articleView.html?idxno=827336,pos
2026-03-27 06:30,,포스코인터,"특정 고객사 의존도 줄인다…K양극재 4사, 매출처 다변화 '사활'","27일 금융감독원 전자공시시스템에 게재된 2025년 사업보고서에 따르면 LG화학, 포스코퓨처엠... 에코프로비엠의 모회사 에코프로는 이달 중순 서울 코엑스에서 열린 '인터배터리 2026'에서 OEM, 셀 제조사 등 잠재...",https://www.goodkyung.com/news/articleView.html?idxno=285018,pos
2026-03-27 06:02,,포스코인터내셔널,JP모건은 이미 활용 중… 유럽·日서도 정착 속도 [예금토큰 도입 ②],"독일의 기술 기업 지멘스를 비롯, 국내에서는 최초로 포스코인터내셔널이 주 사용 고객이다. 예를 들어 포스코인터내셔널은 한국의 JP모건은행에 예치금을 두고 JPM 코인으로 전환해 미국 JP모건체이스로 전송한다....",https://it.chosun.com/news/articleView.html?idxno=2023092159100,pos
2026-03-27 05:00,,구동모터코어,[찐검승부⑯] 세라젬 '마스터V 컬렉션' vs 바디프랜드 '라클라우드',또한 헬스모션에 적용된 '세이프 패브릭'으로 모션 구동 시 발생할 수 있는 빈 공간을 특수 패브릭으로 감싸 끼임 사고를 방지한다. 아우러 독일 오킨(OKIN)사의 모터를 적용해 작동 소음을 최소화했다. 바디프랜드는...,https://www.shinailbo.co.kr/news/articleView.html?idxno=5004965,neg
2026-03-27 04:34,동아일보,포스코,[인사]포스코 청암히어로즈상 김종원 원장,포스코청암재단이 ‘청암히어로즈’ 첫 수상자로 25년간 강원도 인제를 지킨 김종원 인제고려병원장(60·사진)을 선정했다. 재단은 25일 서울 강남구 포스코센터에서 열린 청암히어로즈 시상식에서 첫 수상자인 김...,https://www.donga.com/news/People/article/all/20260327/133618840/2,pos
2026-03-27 01:31,,포스코,"포스코청암재단, 제1호 '청암히어로즈'에 인제고려병원 김종원 원장 선...",포스코청암재단(이사장 장인화)이 25일 서울 포스코센터에서 시상식을 열고 올해 새롭게 제정한 '청암히어로즈'의 첫 번째 수상자로 강원도 인제고려병원 김종원 원장(60세)을 선정했다. '청암히어로즈'는 우리 사회의...,https://www.polinews.co.kr/news/articleView.html?idxno=726700,pos
2026-03-26 22:26,,포스코,"포스코홀딩스 미술관, 물·자연 생태예술전 개최…조광현 작가, 바다 향...",포스코그룹(지주사 포스코홀딩스) 산하의 포스코미술관은 오는 5월 3일까지 한반도 자연 생태의 가치를 예술의 기록으로 조망하는 '물의 정령들'과 '자연의 기록자들'전(展)을 진행한다고 26일 밝혔다. '물의 정령들'은 직접...,http://www.econonews.co.kr/news/articleView.html?idxno=432788,pos
2026-03-26 21:10,,포스코,"“엄기천 사장 대표이사 재선임”..포스코퓨처엠, 음극재 자립·전고체...",포스코퓨처엠이 26일 제55기 정기 주주총회를 열고 엄기천 사장의 대표이사 재선임과 함께 미래 모빌리티 및... 포스코퓨처엠은 최근 글로벌 자동차사와 체결한 총 1.7조 원 규모의 음극재 공급 계약을 바탕으로 베트남...,https://www.dailycar.co.kr/content/news.html?type=view&autoId=61108,pos
2026-03-26 20:56,,포스코,"포항시 우창동, 자매부서 포스코 선재부와 협력 강화",우창동행정복지센터는 지난 26일 자매부서인 포스코 선재부의 초청에 응해 포스코 방문 행사를 가졌다고 밝혔다.이번 방문은 지역사회의 든든한 버팀목이자 큰 힘이 되어주는 포스코 선재부와의 우호적인 협력 관계를...,https://www.ksmnews.co.kr/news/view.php?idx=597053,pos
2026-03-26 20:54,,포스코,"포스코청암재단, 제1호 ‘청암히어로즈’ 김종원 인제고려병원 원장","포스코청암재단(이사장 장인화)이 25일 서울 포스코센터에서 시상식을 열고, 올해 새롭게 제정한 ‘청암히어로즈’의 첫 번째 수상자로 강원도 인제고려병원 김종원 원장(60세)을 선정했다.‘청암히어로즈’는 우리 사회의...",https://www.ksmnews.co.kr/news/view.php?idx=597092,pos
2026-03-26 20:46,,포스코,"포스코청암재단, 제1호 청암히어로즈에 인제고려병원 김종원 원장 선정",포스코청암재단이 25일 서울 포스코센터에서 시상식을 열고 올해 새롭게 제정한 '청암히어로즈'의 첫 번째 수상자로 강원도 인제고려병원 김종원 원장(60세)을 선정했다고 26일 밝혔다. 청암히어로즈는 우리 사회의...,https://www.econovill.com/news/articleView.html?idxno=735013,pos
2026-03-26 20:08,디지털데일리,포스코,"<취재>삼성SDI, 피노 지분 투자…'포스코퓨처엠 JV' LFP 양극재 공급권 ...",피노가 포스코퓨처엠과 함께 합작한 '씨앤피신소재테크놀로지'의 리튬인산철(LFP) 양극재를 우선... 이를 통해 조달한 자금은 포스코퓨처엠과 합작한 씨앤피신소재테크놀로지의 증권 취득에 활용된다. 삼성SDI가...,https://www.ddaily.co.kr/page/view/2026032620042574655,pos
2026-03-26 19:56,대경일보,포스코,"포스코퓨처엠, 엄기천 대표 재선임…ESG·평가보상위원회 신설",포스코퓨처엠이 26일 포항 본사에서 제55기 정기주주총회를 열어 이사 선임 및 정관변경 등 안건을 의결했다.... 포스코퓨처엠 제공 포스코퓨처엠이 26일 제55기 정기주주총회를 열고 대표이사 재선임과 이사회 전문위원회...,https://www.dkilbo.com/news/articleView.html?idxno=538742,pos
2026-03-26 19:56,대경일보,포스코,초고유가 우려에 포스코·포항 산업계 긴장,▲ 포스코 전경. 포스코 제공 국제 유가 급등세가 이어지면서 포스코를 중심으로 한 포항 지역 산업계도 긴장감이 높아지고 있다. 유가 상승이 장기화할 경우 철강을 비롯한 지역 주력 산업 전반에 비용 상승 압박이...,https://www.dkilbo.com/news/articleView.html?idxno=538744,pos
