날짜,매체명,검색키워드,기사제목,주요기사 요약,URL,sentiment
2026-03-12 08:14,헤럴드경제,포스코인터내셔널,"이계인 포스코인터 사장, 인터배터리 3년 연속 찾아…전기차 등 신사업...","포스코 부스 방문 후 SK온 등 둘러봐 포스코인터, 전기차 사업 역량 꾸준히 강화 구동모터코아 2030년까지 연 750만대 양산 계획 흑연 등 전기차 소재 확보에도 속도 이계인(오른쪽) 포스코인터내셔널 사장이 11일...",https://biz.heraldcorp.com/article/10692377?ref=naver,pos
2026-03-12 08:06,,포스코인터,[인터배터리] [2026] 화려한 'AI 주권' 선언 뒤 텅 빈 주연석…반쪽짜리...,""" (현장 관람객) 11일 서울 삼성동 코엑스에서 막을 올린 '인터배터리 2026'은 개막 첫날 사전 등록 인원만... 이날 개막식 현장을 유일하게 지킨 엄기천 배터리산업협회장(포스코퓨처엠 사장)은 위기 속에서도...",https://dealsite.co.kr/articles/158283,pos
2026-03-12 07:56,,포스코,"포스코 ""하청노조와 교섭""..노란봉투법 시대 도래","지역 사내하청노조들도 잇따라 원청사와의 교섭 요구에 나선 가운데 가장 먼저 포스코가 노조의 교섭 요구에... ""진짜 사장인 포스코가 나와야 한다."" 하청 노동자들과의 교섭에 포스코가 직접 나서야 한다는 것이 그동안...",https://mpmbc.co.kr/NewsArticle/1508827,pos
2026-03-12 07:45,,포스코,"포스코""하청노조와 교섭할 것""..노란봉투법 시대 도래","법 시행 첫날, 포스코가 사내 하청 노조의 교섭 요구를 공고하며 전국적인 주목을 받고 있습니다. 이재명... (기자) ""진짜 사장인 포스코가 나와야 한다."" 하청 노동자들과의 교섭에 포스코가 직접 나서야 한다는 것이 그동안...",https://kjmbc.co.kr/NewsArticle/1508855,pos
2026-03-12 07:30,철강금속신문,포스코인터,페로타임즈 손바닥뉴스 3월 12일(목),"병행 포스코퓨처엠, 인터배터리서 'BoT 시대' 소재 솔루션 제시 포스코 포항제철소, 중앙수리섹션 가공공장 혁신 고려아연, ""글래스루이스, 회사 측 제안 손들어줘…영풍 후보 반대"" 영풍, 글래스루이스, 고려아연...",http://www.ferrotimes.com/news/articleView.html?idxno=46795,pos
2026-03-12 07:29,,포스코인터,"포스코 ""우량 자원 확보가 리튬 사업 핵심 경쟁력""","성진서 포스코홀딩스 에너지소재투자실 부장은 11일 ""우량 자원을 확보하고 있는지 여부가 리튬 사업 핵심 경쟁력을 판단하는 기준""이라고 강조했다. 성 부장은 이날 서울 코엑스에서 열린 '인터배터리-더 배터리...",http://www.inews24.com/view/1947967,pos
2026-03-12 07:00,,포스코인터내셔널,"""글로벌 무역 전사 키운다""…경북도, 청년 무역전문가 72명 선발","또한 포스코인터내셔널 등 국내 유수의 종합상사 견학은 물론, 지역 최대 취업박람회와 연계한 취업 지원 프로그램도 더욱 강화했다. 지난 2013년 첫발을 뗀 청년 무역사관학교는 지난 13년간 총 862명의 수료생을...",https://www.gukjenews.com/news/articleView.html?idxno=3526830,pos
2026-03-12 06:04,세계일보,포스코인터,휴머노이드용 전고체·ESS… K배터리 ‘기술력·안전성’ 뽐낸다,"막오른 ‘인터배터리 2026’ 총 14개국 667개 업체들 참가 LG에너지솔루션·삼성SDI 등 화재 예방 전고체... 소재와 부품, 장비를 제작하는 LS그룹과 포스코퓨처엠도 대규모 전시 부스를 꾸렸다. LS그룹은 LS일렉트릭을...",https://www.segye.com/newsView/20260311516580?OutUrl=naver,pos
2026-03-12 06:01,,포스코인터,모습 드러낸 K전고체 배터리…로봇·ESS 글로벌 초격차 위용 [biz-플러스...,배터리 소재 기업인 포스코퓨처엠(003670)은 포스코그룹이 개발한 사족보행 로봇을 전시했다. 인터배터리 자체적으로도 ‘휴머노이드 로봇 특별관’을 마련해 로보틱스와 배터리 산업의 시너지 효과와 잠재력을...,https://www.sedaily.com/article/20018225?ref=naver,pos
2026-03-12 06:00,뉴스1,포스코,'노란봉투법' 1호 교섭 사업장 어디…포스코·쿠팡 등 5곳 절차 착수,"포스코와 한화오션, 쿠팡CLS 등 주요 기업들은 교섭 요구 사실을 공고하며 관련 절차에 들어갔다. 원청이 교섭... 포스코·쿠팡·한화오션·부산교통공사·화성시 등 5곳 즉각 교섭 요구에 응답 12일 노동계 등에 따르면...",https://www.news1.kr/economy/employment-labor/6098245,pos
2026-03-12 05:01,노컷뉴스,포스코,노란봉투법 첫날 221곳 교섭요구…포스코·한화오션 '시험대',사업장인 포스코와 한화오션의 향후 행보에 촉각을 곤두세우고 있다. 경영계 우려와 달리 찻잔 속 태풍?... 첫발 뗀 포스코·한화오션…교섭 모델 만들어질까 노사 주목 이번 교섭 국면에서 가장 이목이 쏠리는 곳은 단연...,https://www.nocutnews.co.kr/news/6483327?utm_source=naver&utm_medium=article&utm_campaign=20260312050047,neg
2026-03-12 05:01,노컷뉴스,포스코,노란봉투법 첫날 221곳 교섭요구…포스코·한화오션 '시험대',사업장인 포스코와 한화오션의 향후 행보에 촉각을 곤두세우고 있다. 경영계 우려와 달리 찻잔 속 태풍?... 첫발 뗀 포스코·한화오션…교섭 모델 만들어질까 노사 주목 이번 교섭 국면에서 가장 이목이 쏠리는 곳은 단연...,https://www.nocutnews.co.kr/news/6483327?utm_source=naver&utm_medium=article&utm_campaign=20260312073346,neg
2026-03-12 04:32,동아일보,포스코인터내셔널,해외무역 실무 배울 대구경북 청년 모여라,"이와 함께 포스코인터내셔널 등 국내 종합상사와 연계한 체험형 견학, 지역 최대 취업박람회 등의 프로그램도 참가한다. 신청 및 자세한 내용은 한국무역협회 대구경북지역본부 홈페이지에서 확인할 수 있다....",https://www.donga.com/news/Society/article/all/20260312/133511213/2,pos
2026-03-12 04:04,,포스코인터,AI·로봇 심장으로… K배터리 '미래 충전',"엄기천 한국배터리산업협회장 겸 포스코퓨처엠 사장은 11일 서울 강남구 코엑스에서 열린 국내 최대 배터리 전시회 '인터배터리 2026'에서 ""우리 배터리산업은 거센 변화의 한 가운데에 서 있다""며 ""글로벌 시장에서...",https://www.mt.co.kr/industry/2026/03/12/2026031119574598369,pos
2026-03-12 02:00,데일리스포츠한국,포스코인터내셔널,"김나영, 중국 천이에 1-3 탈락…충칭서 '중국의 벽' 실감, 신유빈은 8강...",세계랭킹 26위 김나영(포스코인터내셔널)은 11일 중국 충칭에서 열린 2026 WTT 챔피언스 충칭 여자 단식 32강에서 천이(중국·7위)에게 게임 점수 1-3(4-11 14-12 5-11 6-11)으로 패하며 대회를 마쳤다. WTT 그랜드 스매시...,https://www.dailysportshankook.co.kr/news/articleView.html?idxno=425547,pos
2026-03-12 00:34,,포스코인터,“ESS·로봇으로 전기차 캐즘 극복”… ‘인터배터리 2026’ 막 올라,"전시회 ‘인터배터리 2026’이 11일 서울 강남구 코엑스에서 사흘 일정으로 개막했다. 전기차 캐즘(일시적... SK온은 현대위아의 산업용 자율이동로봇(AMR)을, 포스코퓨처엠은 포스코그룹이 제철소에 투입 중인 사족...",https://www.chosun.com/economy/industry-company/2026/03/12/LXT5PWMKA5FL7OPYYADG63NEMQ/?utm_source=naver&utm_medium=referral&utm_campaign=naver-news,pos
2026-03-12 00:30,,포스코인터,"포항시, ‘인터배터리 2026’서 글로벌 배터리 허브도시 포항 홍보 나서","에코프로와 포스코퓨처엠, KRST대한동방·뉴테크에너지·프렘투 등 지역기업 홍보관을 찾아 이차전지 기술과 제품 동향을 살폈다. 장상길 포항시장 권한대행은 “이번 인터배터리 2026 참가를 통해 포항의 이차전지 산업...",https://www.sentv.co.kr/article/view/sentv202603110235,pos
2026-03-12 00:23,,포스코인터,전기차 너머를 보는 K배터리… “로봇·드론·모빌리티로 영역 확장”,이날 개막한 국내 최대 배터리 전시회 ‘인터배터리 2026’에서는 업황 부진을 타개하기 위해 새로운 성장... 엄기천 한국배터리산업협회 회장(포스코퓨처엠 사장)은 “글로벌 공급망 재편과 보호무역주의 확산 등...,https://www.kmib.co.kr/article/view.asp?arcid=1773218654&code=11151400&cp=nv,pos
2026-03-12 00:20,,포스코인터내셔널,"풍력에너지 관련주, '봄날의 햇살' 우리기술·씨엔플러스·LS머트리얼즈...","포스코인터내셔널·두산에너빌리티 등 업계가 간담회에 참여하며 조선·해양 산업 시너지를 모색하고, 부유식 해상풍력 국산화가 글로벌 경쟁력 확보 열쇠로 부상한다. 글로벌 해상풍력 시장은 2025년 556억 달러에서...",http://www.finomy.com/news/articleView.html?idxno=251231,pos
2026-03-12 00:10,,포스코인터,"방위산업·전쟁·테러 관련주, '봄꽃만개' 대한광통신·기산텔레콤·RFH...","고주파 RF 및 인터커넥트 전문기업 센서뷰는 과학기술정보통신부가 소관하는 양자 플래그십 과제의... 플랜트 기자재, 선박엔진 구조재, 구조물 구조재, 풍력 기자재를 생산해 포스코이앤씨, 두산에너빌리티...",http://www.finomy.com/news/articleView.html?idxno=251228,pos
2026-03-12 00:06,데일리한국,포스코인터,"포항시, '인터배터리 2026' 참가…글로벌 배터리 허브도시 홍보",열리는 '인터배터리 2026'에 참가해 11일 기념촬영을 하고 있다. 사진=포항시 제공 경북 포항시는 경상북도와... 또 포항 이차전지 산업을 이끌고 있는 에코프로와 포스코퓨처엠도 대규모 단독 부스로 참가해 차세대...,https://daily.hankooki.com/news/articleView.html?idxno=1345676,pos
2026-03-12 00:06,데일리한국,포스코인터,"포항시, '인터배터리 2026' 참가… 글로벌 배터리 허브도시 홍보",열리는 '인터배터리 2026'에 참가해 11일 기념촬영을 하고 있다. 사진=포항시 제공 경북 포항시는 경상북도와... 또한 포항 이차전지 산업을 이끌고 있는 에코프로와 포스코퓨처엠도 대규모 단독 부스로 참가해 차세대...,https://daily.hankooki.com/news/articleView.html?idxno=1345676,pos
2026-03-12 00:06,경인매일,포스코인터내셔널,"인천스타트업파크, 공공·민간 실증사업 2026년 참여기업 모집","3월 18일부터 모집하는 'TRYOUT 민간 실증 사업'은 셀트리온, 기아, 포스코인터내셔널, SSG랜더스 등 기존 협력사 외 호반건설, 카카오모빌리티, SK에코플랜트가 새로운 협력파트너로 참여, 총 14개 민간대기업과 실증을...",https://www.kmaeil.com/news/articleView.html?idxno=632686,pos
2026-03-12 00:02,,포스코인터,"K배터리가 뛴다, 휴머노이드 심장으로","11일 서울 강남구 코엑스에서 개막한 ‘인터배터리 2026’의 화두는 ‘새 먹거리’였다. 전기차 캐즘(수요... SK온은 현대위아와 함께 자율 이동로봇을, 포스코퓨처엠은 포스코그룹이 개발한 제철소 위험작업용...",https://www.joongang.co.kr/article/25411084,pos
2026-03-11 23:26,,포스코,"포스코 포항제철소, 중앙수리섹션 혁신공장 완료로 가공공장 준공",포스코 포항제철소가 중앙수리섹션 혁신공장 활동을 성공적으로 마무리하며 가공공장 준공식을 개최했다.... 혁신공장은 포스코 포항제철소가 매년 4~5개 공장을 선정해 추진하는 개선 프로그램이다. 안전·환경 시설물과...,https://www.pointe.co.kr/news/articleView.html?idxno=74741,pos
2026-03-11 23:26,,포스코,"포스코 포항제철소, 중앙수리섹션 혁신공장 QSS활동 성공리에 마무리…...","포스코 포항제철소가 중앙수리섹션 혁신공장 활동을 성공적으로 마무리, 가공공장 준공식을 개최했다.... 혁신공장은 포스코 포항제철소가 매년 4~5개 공장을 선정해 추진하는 개선 프로그램이다. 안전·환경 시설물과...",https://www.polinews.co.kr/news/articleView.html?idxno=725179,pos
2026-03-11 23:08,,포스코인터,Bot 시대 이끌 차세대 배터리 양·음극재 소재 공개한 포스코퓨처엠..특...,"포스코퓨처엠은 11일부터 개막된 ‘인터배터리 2026’에서 미래 BoT(Battery of Things, 사물배터리) 시대를 이끌 혁신적인 양·음극재 기술력을 공개했다. 포스코퓨처엠은 자율주행 전기차(EV), 에너지저장장치(ESS)...",https://www.dailycar.co.kr/content/news.html?type=view&autoId=60913,pos
2026-03-11 22:52,비즈니스코리아,POSCO INTERNATIONAL,407 Subcontractor Unions Demand Bargaining on First Day Under New Law,"including POSCO, Coupang CLS, Seoul Metro, Korea Railroad Corporation, and Incheon International Airport Corporation. By industry, bargaining demands continued across various sectors including...",https://www.businesskorea.co.kr/news/articleView.html?idxno=264943,pos
2026-03-11 22:28,,포스코인터,"[포토] LS 7개사, 인터배터리 2026 참가",LSMnM 등 LS그룹 주요 계열사 7개가 '인터배터리 2026'에 참가해 미래 전략 사업 역량을 선보인다. 사진은 11일 오전 서울 강남구 코엑스에서 열린 '인터배터리 2026' 행사장에 마련된 포스코퓨처엠 LS 부스 모습.,http://www.enewstoday.co.kr/news/articleView.html?idxno=2404514,pos
2026-03-11 22:24,,포스코인터,"LG·SK·삼성·포스코·LS, 전기차에 AI·로봇·방산 아이템 들고 '인터배...",LG에너지솔루션·SK온·삼성SDI를 비롯 포스코퓨처엠·LS·엘엔에프 등 국내외 기업들이 서울 코엑스에서 열리는 '인터배터리 2026'에 총출동해 글로벌 시장 내 주도권 확보를 위해 전기차는 물론 인공지능(AI) 기반...,https://www.getnews.co.kr/news/articleView.html?idxno=864023,pos
2026-03-11 22:16,,포스코플로우,"플로우케이, 광양물류센터 준공… 연간 2만6000TEU 처리",플로우케이는 포스코플로우와 대우로지스틱스 합작으로 설립한 물류법인으로 이차전지와 석유화학 소재 등 포스코홀딩스 계열 고객사에 최적 물류 솔루션을 제공한다. 이번 준공식에는 플로우케이 경영진과...,http://www.hansbiz.co.kr/news/articleView.html?idxno=823429,pos
2026-03-11 21:34,,포스코인터,"포스코퓨처엠, 미래 배터리 솔루션 선봬","서울 코엑스에서 열린 인터배터리 포스코퓨처엠 부스 전경. 포스코퓨처엠이 11일부터 서울 코엑스에서 열리는 '인터배터리 2026'에 참가해 자율주행 전기차와 로봇, 에너지저장장치(ESS) 등 미래 산업을 겨냥한...",https://www.idaegu.co.kr/news/articleView.html?idxno=541407,pos
2026-03-11 21:34,,포스코플로우,[위클리오늘] 여수광양항만공사 소식,"플로우케이는 포스코플로우와 대우로지스틱스의 합작으로 설립된 법인으로 이차전지, 석유화학 소재 등 포스코그룹을 포함한 고객사의 최적 물류 솔루션을 제공하는 물류기업이다. 이날 준공식에는 플로우케이...",http://www.weeklytoday.com/news/articleView.html?idxno=764606,pos
2026-03-11 21:14,,포스코,"포스코""하청노조와 교섭할 것""..노란봉투법 시대 도래","지역 사내하청노조들도 잇따라 원청사와의 교섭 요구에 나선 가운데 가장 먼저 포스코가 노조의 교섭 요구에... ""진짜 사장인 포스코가 나와야 한다."" 하청 노동자들과의 교섭에 포스코가 직접 나서야 한다는 것이 그동안...",https://ysmbc.co.kr/NewsArticle/1508809,pos
2026-03-11 21:00,,포스코,삼성물산vs포스코이앤씨 2년 만 리턴매치 성사…래미안 타운-오티에르 ...,사진=삼성물산 건설부문 한국금융경제신문=정진아 기자 | 삼성물산과 포스코이앤씨가 서울 서초구 잠원동... 당시 포스코이앤씨가 부산 최초 하이엔드 브랜드 '오티에르'를 앞세워 조합원 297명 중 171표(57.5%)를...,https://www.kfenews.co.kr/news/articleView.html?idxno=655488,pos
2026-03-11 20:52,,포스코인터,[포토] 포스코퓨처엠 기술 적용된 ESS 배터리팩,11일 오전 서울 강남구 코엑스에서 열린 '인터배터리 2026' 포스코퓨처엠 부스에 ESS 배터리팩 외함이 전시돼 있다.,http://www.enewstoday.co.kr/news/articleView.html?idxno=2404496,pos
2026-03-11 20:44,,포스코인터,[포토] 포스코퓨처엠의 배터리팩,11일 오전 서울 강남구 코엑스에서 열린 '인터배터리 2026' 포스코퓨처엠 부스에 배터리팩이 전시돼 있다.,http://www.enewstoday.co.kr/news/articleView.html?idxno=2404494,pos
2026-03-11 20:44,,포스코인터내셔널,"경북도, 청년 무역사관학교 14기 교육생 72명 선발","올해는 해외 무역 탐방 인원을 대폭 확대(12명→24명)한다.포스코인터내셔널 등 국내 유수의 종합상사와 연계한 체험형 견학, 지역 최대 취업박람회 등 취업 프로그램도 연계 지원한다.2013년부터 시작한...",https://www.ksmnews.co.kr/news/view.php?idx=594367,pos
