날짜,매체명,검색키워드,기사제목,주요기사 요약,URL
2025-12-12 17:14,,포스코,'포항제철소 창립멤버' 황경노 전 포스코 회장 별세,포항제철소 창립 멤버인 황경노(사진) 전 포스코 회장이 향년 96세로 12일 별세했다. 황 전 회장은... 등 포스코 기틀을 닦는 데 힘을 보탰다. 그의 경영철학은 '최소 비용으로 최고의 회사'와 '선공후사' 정신이었으며...,https://www.sedaily.com/NewsView/2H1PA8BUTK
2025-12-12 17:14,,포스코,'포항제철 창립멤버' 황경노 포스코 2대 회장 별세,"포스코 2대 회장을 지낸 황경노 전 회장이 12일 별세했다. 향년 96세. 황 전 회장은 포항제철소 창립멤버이자... 그의 경영철학은 '최소 비용으로 최고의 회사'와 '선공후사' 정신이었으며, 포스코 성공을 국가경제 기여와...",https://www.s-journal.co.kr/news/articleView.html?idxno=36664
2025-12-12 17:14,,포스코,'포항제철 창립 멤버' 황경노 전 포스코 회장 별세,포항제철소 창립 멤버인 황경노 전 포스코 회장이 12일 별세했다. 향년 96세. 포스코홀딩스에 따르면 황 전 회장은 포항제철소 초대 기획관리부장을 맡아 경영 전반의 기틀을 마련했다. 1972년 상무이사 승진 후 1977년에는...,https://www.hankookilbo.com/News/Read/A2025121216420001091?did=NA
2025-12-12 17:12,,포스코,[부고] '포항제철 창립 멤버' 황경노 전 포스코회장 별세,황경노 포스코 2대 회장. 사진=포스코 한국금융경제신문=정진아 기자 | 포스코 2대 회장을 지낸 황경노 전 회장이 향년 96세로 12일 별세했다. 황경노 전 회장은 포항제철소 창립멤버이자 초대 기획관리부장으로서 회사...,https://www.kfenews.co.kr/news/articleView.html?idxno=651014
2025-12-12 17:12,,포스코,황경노 포스코홀딩스 전 회장 별세···향년 96세,황경노 포스코 2대 회장. [포스코] 포스코 2대 회장을 지낸 황경노 前회장(향년 96세)이 12일 별세했다. 황경노 포스코 前회장은 포항제철소 창립멤버이자 초대 기획관리부장으로서 회사 경영관리 전반에 대한 기틀을...,https://www.ziksir.com/news/articleView.html?idxno=116171
2025-12-12 17:12,,포스코,"'박태준 최측근' 황경로 포항제철 2대 회장 별세, 포스코 회사장으로 예...","포항제철(현 포스코그룹)의 창립요원이자 2대 회장을 지낸 황경로 전 회장이 별세했다. 포스코홀딩스는 ""향년 96세로 12일 별세한 황 전 회장의 장례를 회사장으로 치를 예정""이라고 12일 밝혔다. 황경로 포항제철 전...",https://www.businesspost.co.kr/BP?command=article_view&num=423483
2025-12-12 17:11,뉴스핌,포스코,황경노 前 포스코 회장 별세...포항제철소 창립멤버,포스코 2대 회장을 지낸 황경노 전 회장이 12일 별세했다. 향년 96세. 포스코그룹에 따르면 황경노 전 회장은 포항제철소 창립멤버이자 초대 기획관리부장으로서 회사 경영관리 전반에 대한 기틀을 마련했다. 1972년...,https://www.newspim.com/news/view/20251212001005
2025-12-12 17:10,,포스코,포스코 2대 회장 황경노 별세… 철강산업 기초 다진 '창립 설계자',황경노 포스코 2대 회장. (사진=포스코) 포스코 2대 회장을 지낸 황경노 전 회장이 12일 별세했다. 향년 96세. 황 전 회장은 포항제철소 창립멤버이자 초대 기획관리부장으로서 회사의 경영관리 체계를 구축한 '초기 포스코...,http://www.biztribune.co.kr/news/articleView.html?idxno=345410
2025-12-12 17:10,,포스코,황경노 전 포스코 회장 별세…포항제철 창립 멤버·2대 회장,포스코 제2대 회장을 지낸 황경노 전 회장이 12일 별세했다. 향년 96세다. 황 전 회장은 포항제철소 창립 멤버로 초대 기획관리부장을 맡아 포스코 경영관리 체계의 기초를 세운 인물이다. 한국 철강 산업이 걸음마를...,http://www.shinailbo.co.kr/news/articleView.html?idxno=2162069
2025-12-12 17:10,,포스코,'포항제철 창립 멤버' 황경노 포스코 2대 회장 별세,포스코 2대 회장을 지낸 황경노 전 회장이 12일 향년 96세의 나이로 별세했다 . 포스코홀딩스에 따르면 황 전 회장은 포항제철소 창립멤버이자 초대 기획관리부장으로서 회사 경영관리 전반에 대한 기틀을 마련했다....,https://www.moneys.co.kr/article/2025121216413285619
2025-12-12 17:10,,포스코,황경노 前 포스코회장 별세...'선공후사’ 정신 남겨,포스코 2대 회장을 지낸 황경노 前회장(향년 96세)이 12일 별세했다. 황경노 前 포스코 회장. [사진=포스코홀딩스] 황경노 회장은 포항제철소 창립멤버이자 초대 기획관리부장으로서 회사 경영관리 전반에 대한 기틀을...,http://www.thevaluenews.co.kr/news/view.php?idx=194928
2025-12-12 17:08,,포스코인터,포스코인터 자회사 한국퓨얼셀 청산 진행,뉴스저널리즘 김문수 기자 = 포스코인터내셔널의 자회사인 한국퓨얼셀이 경영난 끝에 청산 절차에 들어갔다. 12일 한국퓨얼셀에 따르면 경북 포항에 본사와 사업장을 둔 이 회사는 최근 경영 악화가 이어지면서 현재...,https://www.ngetnews.com/news/articleView.html?idxno=543280
2025-12-12 17:08,,포스코,'포스코 창립 주역' 황경노 前 회장 별세…향년 96세,"황경노 전 포스코 회장이 12일 향년 96세 일기로 별세했다.포스코홀딩스에 따르면 황 전 회장은 포항제철소 창립 멤버이자 초대 기획관리부장으로, 경영 관리 전반에 관한 기틀을 마련했다.황 전 회장은 1972년...",https://www.asiatoday.co.kr/view.php?key=20251212010007059
2025-12-12 17:04,,포스코인터,포스코인터 자회사 한국퓨얼셀 청산 진행,서울경제티브이 이지영 기자 [서울경제TV=이지영기자] 포스코인터내셔널 자회사인 연료전지 전문 기업 한국퓨얼셀이 문을 닫는다. 12일 한국퓨얼셀에 따르면 경북 포항에 본사와 사업장을 둔 이 회사는 경영난이...,https://www.sentv.co.kr/article/view/sentv202512120150
2025-12-12 16:58,뉴스락,포스코인터,"'500억 적자' 포스코인터 자회사 한국퓨얼셀, 청산 절차 돌입…고용 승...",포스코인터내셔널의 연료전지 제조 자회사인 한국퓨얼셀이 지속된 경영난 끝에 사업을 정리하고 법인 청산 절차에 들어갔다. 12일 업계에 따르면. 경북 포항에 본사를 둔 한국퓨얼셀은 최근 누적된 적자를 해소하지...,http://www.newslock.co.kr/news/articleView.html?idxno=121286
2025-12-12 16:52,,포스코,‘포스코 2대’ 황경노 前 회장 별세,포스코 2대 회장을 지낸 황경노 전 회장이 12일 향년 96세로 별세했다. 황 전 회장은 포항제철소 창립... 복귀해 부회장을 거쳐 1992년 제2대 회장으로 취임했다. 고인의 장례는 포스코 회사장으로 치러질 예정이다.,https://www.chosun.com/economy/industry-company/2025/12/12/VLNHPNJ2QBD7ZMT2JAMRSQGBGM/?utm_source=naver&utm_medium=referral&utm_campaign=naver-news
2025-12-12 16:50,,포스코,황경노 포스코 2대 회장 별세…향년 96세,"포항제철소 2대 회장을 지낸 황경노 전 포스코 회장이 오늘(12일) 별세했습니다. 향년 96세입니다. 포스코홀딩스에 따르면 황 전 회장은 포항제철소 창립 멤버로, 초대 기획관리부장을 맡아 회사 경영 관리 전반에 관한...",http://www.yonhapnewstv.co.kr/AKR20251212164930uf1
2025-12-12 16:50,,포스코,황경노 포스코 전 회장 별세…향년 96세,서울경제티브이 이지영 기자 [서울경제TV=이지영기자] 포항제철소 창립 멤버인 황경노 전 포스코 회장이 향년 96세로 12일 별세했다. 포스코홀딩스에 따르면 황 전 회장은 포항제철소 창립 멤머이자 초대 기획관리부장을...,https://www.sentv.co.kr/article/view/sentv202512120149
2025-12-12 16:50,헤럴드경제,포스코,‘포항제철소 창립멤버’ 황경노 전 포스코 회장 별세,1992년 제2대 회장 취임 포스코 회사 경영관리 전반 기틀 마련 황경노 전 포스코 회장 [포스코홀딩스 제공] [헤럴드경제=서재근 기자] 포스코 2대 회장을 지낸 황경노 전(前) 회장이 12일 별세했다. 향년 96세....,https://biz.heraldcorp.com/article/10635621?ref=naver
2025-12-12 16:48,연합뉴스,포스코,황경노 포스코홀딩스 전 회장 별세,포항제철소 창립 멤버인 황경노 전 포스코 회장이 12일 별세했다. 향년 96세. 고인의 장례는 포스코 회사장으로 치러질 예정이다. 사진은 황경노 포스코 전 회장. 2025.12.12 [포스코홀딩스 제공. 재판매 및 DB 금지],https://www.yna.co.kr/view/PYH20251212126700003?input=1196m
2025-12-12 16:46,,포스코인터내셔널,"포스코인터내셔널 자회사 한국퓨얼셀, 경영난으로 청산","화이트페이퍼, WHITEPAPER한국퓨얼셀 웹사이트 (사진=한국퓨얼셀) 포스코인터내셔널의 자회사 한국퓨얼셀이 경영난으로 문을 닫는다. 한국퓨얼셀은 최근 수년간 이어진 적자 누적으로 청산 절차를 진행 중이라고 12일...",http://www.whitepaper.co.kr/news/articleView.html?idxno=255706
2025-12-12 16:46,,포스코,황경노 포스코 2대 회장 별세…향년 96세,"황경노 포스코 2대 회장이 12일 별세했다. 향년 96세. 황 전 회장은 포항제철소 창립멤버이자 초대... 그의 경영철학은 '최소 비용으로 최고의 회사'와 '선공후사' 정신이었으며, 포스코의 성공을 국가경제 기여와...",http://www.inews24.com/view/1917165
2025-12-12 16:46,대경일보,포스코,황경노 전 포스코 회장 별세… 경영 뼈대 세운 '포항제철 창립 멤버',황경노 전 포스코 회장. 포스코 제공 포항제철 창립 멤버로 경영 관리 체계를 세운 황경노 전 포스코 회장이 12일 별세했다. 향년 96세. 고인은 포항제철 초창기 경영 관리의 기본 틀을 마련한 인물로 평가된다....,https://www.dkilbo.com/news/articleView.html?idxno=526236
2025-12-12 16:44,이투데이,포스코,포항제철소 창립 멤버 황경노 2대 포스코 회장 별세,"이투데이=김민서 기자 | 포스코 2대 회장을 지낸 황경노 전 회장이 12일 별세했다. 향년 96세. 고(故) 황경노... 그의 경영 철학은 ‘최소 비용으로 최고의 회사’와 ‘선공후사’ 정신이었으며, 포스코의 성공을 국가경제...",https://www.etoday.co.kr/news/view/2535570
2025-12-12 16:44,,포스코,황경노 전 포스코 2대 회장 별세,포스코 2대 회장을 지낸 황경노 전 회장(향년 96세)이 12일 별세했다 황경노 전 회장은 포항제철소... 그의 경영철학은 '최소 비용으로 최고의 회'와 '선공후사' 정신이었으며 포스코 성공을 국가경제 기여와 후배들의...,https://www.ddaily.co.kr/page/view/2025121216421528352
2025-12-12 16:44,,포스코,"황경노 前 포스코 회장 별세···""회사 경영관리 전반 기틀 마련""",현대경제신문 민성준 기자 | 포스코 2대 회장을 지낸 황경노 前회장이 12일 별세했다. 향년 96세. 12일 포스코홀딩스에 따르면 황경노 前회장은 포항제철소 창립멤버이자 초대 기획관리부장으로서 회사 경영관리...,http://www.finomy.com/news/articleView.html?idxno=245327
2025-12-12 16:44,,포스코,황경노 전 포스코회장 별세…장례는 회사장으로,사진=포스코 포스코 2대 회장을 지낸 황경노 전 회장이 12일 별세했다. 황 전회장은 포항제철소 창립멤버이자 초대 기획관리부장으로서 회사 경영관리 전반에 대한 기틀을 마련했다 1972년 상무이사 승진 후 1977년 회사를...,https://www.businessplus.kr/news/articleView.html?idxno=104045
2025-12-12 16:44,뉴스웨이,포스코,황경노 전 포스코 회장 별세,"포스코 2대 회장을 지낸 황경노 전(前) 회장(향년 96세)이 12일 별세했다. 황 전 회장은 포항제철소... 그의 경영철학은 '최소 비용으로 최고의 회사'와 '선공후사' 정신이었으며, 포스코의 성공을 국가경제 기여와...",https://www.newsway.co.kr/news/view?ud=2025121216373928462
2025-12-12 16:44,한국일보,포스코,황경노 전 포스코그룹 회장 별세,고(故) 황경노 전 포스코그룹 회장. 사진=포스코그룹 황경노 전 포스코그룹 회장이 12일 별세했다. 향년 96세. 황경노 전 회장은 포항제철소 창립멤버이자 초대 기획관리부장으로 회사 경영관리 전반에 대한 기틀을...,https://weekly.hankooki.com/news/articleView.html?idxno=7141230
2025-12-12 16:43,더팩트,포스코,'포항제철소 창립 멤버' 황경노 전 포스코 회장 별세…향년 96세,포스코 성공을 국가 경제 기여·후배 발전으로 연결 황경노 전 포스코 회장이 12일 별세했다. 향년 96세. 포스코그룹에 따르면 이날 2대 회장을 지낸 황 전 회장이 별세했다. 황 전 회장은 포항제철소 창립 멤버이자 초대...,https://news.tf.co.kr/read/economy/2272113.htm
2025-12-12 16:42,,포스코,황경노 前 포스코 회장 별세…‘제철보국’ 기틀 닦은 창립 주역,포스코 창립 멤버·2대 회장…향년 96세 초대 기획관리부장으로 경영 기틀 마련 ‘선공후사’ 철학 실천…포스코 회사장 엄수 포스코(옛 포항제철)의 창립 멤버로서 초기 경영 기틀을 닦고 제2대 회장을 지낸 황경노 전...,https://www.mk.co.kr/article/11490860
2025-12-12 16:42,,포스코,"""포스코 성장의 기틀 세운 산업계 원로"" 황경노 前 포스코 회장 별세","포스코 2대 회장을 지낸 황경노 전 회장이 향년 96세로 별세했다. 그는 포항제철소 창립멤버이자 초대... 그의 경영철학인 '최소 비용으로 최고의 회사', '선공후사' 정신은 포스코의 성장과 국가경제 발전에 큰 영향을...",http://www.economytalk.kr/news/articleView.html?idxno=415298
2025-12-12 16:41,,포스코,황경노 포스코 전 회장 별세.. 회사장 치른다,포스코는 자사 2대 회장을 지낸 황경노 전 회장(향년 96세)이 12일 별세했다고 밝혔다. 황 전 회장은... 그의 경영철학은 ‘최소 비용으로 최고의 회사’와 ‘선공후사’ 정신이었으며 포스코의 성공을 국가경제 기여와...,http://www.fnnews.com/news/202512121633488365
2025-12-12 16:40,아시아경제,포스코,황경노 전 포스코 2대 회장 별세,"포스코 2대 회장을 지낸 황경노 전 회장(향년 96세)이 12일 별세했다. 황 전 회장은 포항제철소... 그의 경영철학은 '최소 비용으로 최고의 회사'와 '선공후사' 정신이었으며, 포스코의 성공을 국가 경제 기여와 후배들의...",https://view.asiae.co.kr/article/2025121216401859443
2025-12-12 16:40,,포스코,황경노 前 포스코 회장 별세...향년 96세,포스코 2대 회장을 지낸 황경노 전 회장(사진)이 12일 향년 96세 일기로 별세했다. 고(故) 황 전 회장은... 그의 경영철학은 '최소 비용으로 최고의 회사'와 '선공후사' 정신이었으며 포스코의 성공을 국가경제 기여와...,https://www.mt.co.kr/industry/2025/12/12/2025121216361222521
2025-12-12 16:40,스마트경제,포스코,포스코 2대 회장 황경노 별세···포항제철 경영관리 기틀 세운 원로,"| 스마트에프엔 = 이장혁 기자 | 포스코 2대 회장을 지낸 황경노 전 회장(향년 96세)이 12일 별세했다. 황 전... '최소 비용으로 최고의 회사', '선공후사'를 경영철학으로 삼아 포스코의 성공을 국가 경제 기여와 후배들의...",https://www.smartfn.co.kr/news/articleView.html?idxno=129387
2025-12-12 16:37,,포스코,황경노 전 포스코 회장 별세…향년 96세,포스코 2대 회장을 지낸 황경노 전 회장이 12일 별세했다. 향년 96세. 황 전 회장은 포항제철소 창립... 1990년 포항제철 상임고문으로 복귀한 그는 부회장을 거쳐 1992년 제2대 포스코 회장에 취임했다. 창립 초기 자금...,https://www.mydaily.co.kr/page/view/2025121216353812216
2025-12-12 16:36,,포스코,황경노 前 포스코 회장 별세,故 황경노 前 포스코 회장 포스코 2대 회장을 지낸 황경노 前회장(향년 96세)이 12일 별세했다 황경노 前회장은 포항제철소 창립멤버이자 초대 기획관리부장으로서 회사 경영관리 전반에 대한 기틀을 마련했다...,http://www.financialreview.co.kr/news/articleView.html?idxno=38962
2025-12-12 16:36,,포스코,황경노 전 포스코회장 별세,"포스코 2대 회장을 지낸 황경노 전(前) 회장이 12일 별세했다. 향년 96세다. 황경노 전 회장은 포항제철소... 그의 경영철학은 '최소 비용으로 최고의 회사'와 '선공후사' 정신이었으며, 포스코의 성공을 국가경제 기여와...",https://www.getnews.co.kr/news/articleView.html?idxno=853338
2025-12-12 16:34,,포스코,황경노 前 포스코 2대 회장 별세,|중앙이코노미뉴스 송태원 기자|황경노 前 포스코 2대 회장[사진=포스코] 포스코 2대 회장을 지낸 황경노 前회장(향년 96세)이 12일 별세했다 황경노 前회장은 포항제철소 창립멤버이자 초대 기획관리부장으로서 회사...,https://www.joongangenews.com/news/articleView.html?idxno=475171
2025-12-12 16:34,,포스코,"[12일 특징주] 비에이치아이, 포스코이앤씨와 HRSG 공급계약에 21%↑",비에이치아이가 포스코이앤씨와 LNG(액화천연가스) HRSG(배열회수보일러) 공급계약 체결 소식에 강세를... 이날 비에이치아이는 포스코이앤씨와 LNG 복합화력발전 HRSG 공급 계약을 맺었다고 밝혔다. 이번 계약으로...,https://www.newsworks.co.kr/news/articleView.html?idxno=822900
2025-12-12 16:29,노컷뉴스,포스코,"포스코미술관 광양, 2025년 특별전 개최",포스코 광양제철소가 내년 2월 28일까지 포스코미술관 광양에서 포스코미술관 순회전 'The Hidden Chapter- 오백 년 만에 돌아온 조선서화'를 개최한다. 이번 전시는 일본의 저명한 한국미술 소장처인 '유현재 컬렉션'의...,https://www.nocutnews.co.kr/news/6442527?utm_source=naver&utm_medium=article&utm_campaign=20251212042803
2025-12-12 16:26,,포스코인터내셔널,"포스코인터 자회사 한국퓨얼셀, 청산 절차 돌입","사진=한국퓨얼셀 홈페이지 포스코인터내셔널의 연료전지 제조 자회사 한국퓨얼셀이 경영난 끝에 사업을 정리한다. 12일 관련업계에 따르면, 경북 포항에 본사와 사업장을 한국퓨얼셀은 최근 2년간 약 500억원의 적자로...",https://www.pinpointnews.co.kr/news/articleView.html?idxno=405721
2025-12-12 16:26,,포스코인터내셔널,"포스코인터내셔널, 자회사 한국퓨얼셀 청산...70여명 직원 해고 통보",|중앙이코노미뉴스 송태원 기자|한국퓨얼셀 웹사이트 캡쳐[사진=한국퓨얼셀 웹사이트] 포스코인터내셔널 자회사인 한국퓨얼셀을 청산한다. 12일 한국퓨얼에 따르면 경북 포항에 본사와 사업장을 둔 한국퓨어셀은...,https://www.joongangenews.com/news/articleView.html?idxno=475164
2025-12-12 16:22,,포스코,"광명시, '신안산선 붕괴사고' 복구 소극적 포스코이앤씨 법적 대응 예고","경기 광명시가 신안산선 붕괴 사고와 관련해 포스코이앤씨에 사고 복구에 소극적 태도를 보이고 있다는 이유로 피해보상 소송 등 강력 대응을 예고했다. 박승원 광명시장은 지난 10일 신안산선 사고 현장을 찾아 ""포스코이...",http://www.ttlnews.com/news/articleView.html?idxno=3059883
2025-12-12 16:22,,포스코인터내셔널,"포스코그룹, 조직개편·임원인사 단행 ""안전·해외투자·DX로 체질 바꾼...","안전 전문 자회사 '포스코세이프티솔루션' 설립에 이어, 포스코는 '안전보건환경본부', 포스코인터내셔널은 '안전기획실'을 각각 신설해 전사적 안전 관리 기능을 강화했다. 포스코는 글로벌 안전 컨설팅 경험을 갖춘...",http://www.finomy.com/news/articleView.html?idxno=245313
2025-12-12 16:18,,포스코,"포스코미술관 광양, 2025년 특별전 ‘The Hidden Chapter’ 500년 만에 돌...",서울에 이은 두번째 포스코미술관 광양 순회전…일본에서 고국으로 돌아온 조선서화 38건 공개 우리의... 고재윤)가 포스코미술관 광양에서 12일부터 내년 2월 28일까지 포스코미술관 순회전 ‘The Hidden Chapter’-오백 년...,https://www.nspna.com/news/?mode=view&newsid=792298
2025-12-12 16:16,,포스코플로우,"경북도, 영일만항 북극항로 전략거점 육성 '올인'","아울러, 김인현 고려대학교 법학전문대학교 명예교수를 좌장으로 이희용 영남대학교 교수, 김경태 포스텍 교수, 권래형 포스코플로우 리더 등이 참석해 북극도시 협력의 지속가능성과 포항영일만항의 전략에 관한...",https://www.dongponews.net/news/articleView.html?idxno=55181
2025-12-12 16:10,뉴스웨이,포스코인터내셔널,포스코인터 자회사 한국퓨어셀 청산…잇단 적자 여파,포스코인터내셔널 자회사인 한국퓨얼셀이 문을 닫는다. 12일 관련 업계에 따르면 포스코인터내셔널 자회사인 한국퓨얼셀이 청산 절차를 밟고 있다. 이 회사는 경북 포항에 본사와 사업장을 두고 있다. 연료전지...,https://www.newsway.co.kr/news/view?ud=2025121214531881158
2025-12-12 16:08,,포스코,[訃告] 황경로 前 포스코 회장 별세,"포항제철(현 포스코) 창립요원이자 2대 회장을 지낸 황경로 전 회장이 12일 노환으로 작고했다. 1930년 생인... 건설본부장, 부사장, 사장 등을 거쳐 박태준 명예회장의 뒤를 이어 1992년 10월에 2대 포스코 회장을 역임했다....",http://www.snmnews.com/news/articleView.html?idxno=562424
2025-12-12 16:08,,포스코,500년 만의 귀환…포스코미술관 광양서 '조선서화의 숨은 장' 펼쳐진다,포스코 광양제철소(소장 고재윤)가 포스코미술관 광양에서 2025년 12월 12일부터 2026년 2월 28일까지 포스코미술관 순회전 'The Hidden Chapter- 오백 년 만에 돌아온 조선서화'를 개최해 지역 사회에 수준 높은 예술 작품...,http://www.snmnews.com/news/articleView.html?idxno=562423
2025-12-12 16:08,에너지경제,포스코,"[산업 분석] 철광석 가격 폭락의 역설…포스코홀딩스, 내년 ‘원가 절감...","국내외 철강업계가 혹한기에 처해 있는 가운데 포스코홀딩스가 아이러니하게도 체질 개선의 기회를 맞고... 여기에 정부의 반덤핑 관세 장벽과 리튬 사업의 바닥권 탈출 신호가 더해지며, 내년에 포스코홀딩스가...",https://www.ekn.kr/web/view.php?key=20251212026096857
2025-12-12 16:00,연합뉴스,포스코인터내셔널,"포스코인터 자회사 한국퓨얼셀 청산 진행…""2년간 500억 적자""(종합)",포스코인터내셔널 자회사인 한국퓨얼셀이 문을 닫는다. 12일 한국퓨얼셀에 따르면 경북 포항에 본사와 사업장을 둔 이 회사는 경영난이 이어지면서 청산 절차를 밟고 있다. 연료전지 제조업체인 한국퓨얼셀은 최근 2년간...,https://www.yna.co.kr/view/AKR20251212091251053?input=1195m
2025-12-12 15:52,,포스코,"500년 만에 돌아온 조선서화, 포스코미술관 광양에서 만나다",포스코미술관 광양은 12일부터 2026년 2월 28일까지 ‘The Hidden Chapter- 오백 년 만에 돌아온 조선서화’ 전시를... 이번 전시는 500여 년 전 조선시대 당시 일본으로 유출된 작품들이 고국으로 돌아온 후 서울 포스코미술관...,https://www.viva100.com/article/20251212500753
2025-12-12 15:50,MBN,포스코인터,"포스코인터 자회사 한국퓨얼셀 청산 진행…""2년간 500억 적자""",포스코인터내셔널 자회사인 한국퓨얼셀이 문을 닫습니다. 12일 한국퓨얼셀에 따르면 경북 포항에 본사와 사업장을 둔 이 회사는 경영난이 이어지면서 청산 절차를 밟고 있습니다. 연료전지 제조업체인 한국퓨얼셀은...,http://mbnmoney.mbn.co.kr/news/view?news_no=MM1005732598
2025-12-12 15:40,연합뉴스,POSCO INTERNATIONAL,KOSPI 200 Closing Price List-5,"510 POSCO INTERNATIONAL 53,900 UP 300 SamyangFood 1,273,000 DN 3,000 CJ CheilJedang 209,000 UP 3,500 HANMISemi 120,200 DN 800 KEPCO KPS 54,600 UP 800 Hanwha Ocean 114,100 UP 1,000 DWEC 3,890 UP...",https://en.yna.co.kr/view/AEN20251212008000320?input=2106m
2025-12-12 15:34,안전신문,포스코,"포스코미술관 광양, '2025년 특별전' 개최",포스코미술관 광양 특별전 포스터/사진=광양제철소 제공 광양제철소(소장 고재윤)가 포스코미술관 광양에서 2025년 12월 12일부터 2026년 2월 28일까지 포스코미술관 순회전 'The Hidden Chapter-오백년 만에 돌아온 조선서화'를...,https://www.safetynews.co.kr/news/articleView.html?idxno=244503
