날짜,매체명,검색키워드,기사제목,주요기사 요약,URL
2025-12-07 13:56,,포스코,"포스코이앤씨, AI 통해 콘크리트 품질관리 혁신 선도",현대경제신문 임이랑 기자 | 포스코이앤씨가 균일한 품질의 레미콘을 생산하는 'AI 기반 레미콘 품질예측 및... 포스코이앤씨는 ㈜SHLab과 함께 AI 분석으로 품질 변화를 실시간으로 확인하고 자동으로 조정하는 기술을...,http://www.finomy.com/news/articleView.html?idxno=244782
2025-12-07 13:52,,포스코,"포스코이앤씨, '레미콘 품질 균일성 확보' AI 기술 개발",포스코이앤씨가 균일한 품질의 레미콘을 생산하는 'AI(인공지능) 기반 레미콘 품질 예측 및 생산 자동화 기술... 포스코이앤씨는 이러한 문제를 해결하기 위해 제조업 AI 전문기업 에스에이치엘에이비(SHLab)와 함께 AI...,https://www.newsinside.kr/news/articleView.html?idxno=4238036
2025-12-07 13:48,,포스코인터내셔널,"한국 탁구, 중국에 3-8로 져 혼성단체 월드컵 결승행 좌절","무릎이 불편한 에이스 신유빈(대한항공)을 대신해 여자단식에 출격한 김나영(포스코인터내셔널)은 세계랭킹 4위 콰이만을 상대로 1게임을 가져왔지만, 이어진 2, 3게임을 내리 내주면서 1-2(11-8 8-11 6-11)로...",https://www.newsis.com/view/NISX20251207_0003431369
2025-12-07 13:48,,포스코,"“콘크리트 품질관리 혁신 선도”…포스코이앤씨, AI 기반 ‘레미콘 품...","완성 포스코이앤씨는 SHLab과 균일한 품질의 레미콘을 생산하는 ‘인공지능(AI) 기반 레미콘 품질예측 및... 포스코이앤씨에 따르면 이번에 개발한 기술은 AI가 혼합 중인 레미콘의 영상을 분석해 반죽 상태를 판별하고, KS...",https://www.mk.co.kr/article/11485948
2025-12-07 13:40,,포스코,"포스코이앤씨, AI 기반 레미콘 품질예측 기술개발",빅터뉴스 김동욱 기자 포스코이앤씨는 균일한 품질의 레미콘을 생산하는 ‘AI 기반 레미콘 품질예측 및... 포스코이앤씨는 ㈜SHLab과 함께 AI 분석으로 품질 변화를 실시간으로 확인하고 자동으로 조정하는 기술을 개발해...,https://www.bigtanews.co.kr/article/view/big202512070005
2025-12-07 13:35,,포스코,"숙련도·기온에 민감한 레미콘 품질 균일하게 잡는다…포스코이앤씨, A...",포스코이앤씨가 ‘AI 기반 레미콘 품질 예측 및 생산 자동화 기술’을 개발했다. 7일 포스코이앤씨는 ㈜SHLab과 함께 AI 분석으로 레미콘 품질 변화를 실시간으로 확인하고 자동으로 조정하는 기술을 개발했다고 밝혔다....,https://news.tvchosun.com/site/data/html_dir/2025/12/07/2025120790081.html
2025-12-07 13:02,,포스코,"포스코이앤씨, AI 기반 레미콘 생산 자동화기술 개발",포스코이앤씨는 인공지능(AI) 기반 레미콘 품질 예측 및 생산 자동화 기술을 개발했다고 7일 밝혔다. 시멘트... 포스코이앤씨는 AI로 레미콘의 품질 변화를 실시간으로 살펴 자동으로 조정하는 기술을 에스에이치랩(SHLab)과...,https://www.khan.co.kr/article/202512071302001
2025-12-07 13:00,,포스코,"포스코이앤씨, AI로 레미콘 품질 잡았다… '생산 자동화' 기술 개발",포스코이앤씨 AI기반 콘크리트 품질예측 및 생산자동화 기술 적용 모니터링 화면 [사진-포스코이앤씨 제공] 라이센스뉴스 = 박창배 기자 | 포스코이앤씨가 ㈜SHLab과 협업해 레미콘의 품질 편차 문제 해결을 위해서 AI...,https://www.lcnews.co.kr/news/articleView.html?idxno=118171
2025-12-07 12:54,,포스코,포스코이앤씨 'AI 기반 레미콘 품질예측 및 생산자동화' 기술 개발,포스코이앤씨가 균일한 품질의 레미콘을 생산하는 'AI 기반 레미콘 품질예측 및 생산자동화 기술'을... 포스코이앤씨는 ㈜SHLab과 함께 AI 분석으로 품질 변화를 실시간으로 확인하고 자동으로 조정하는 기술을 개발해...,http://www.wsobi.com/news/articleView.html?idxno=298255
2025-12-07 12:52,,포스코,"포스코이앤씨, AI로 레미콘 품질 예측·자동 생산…국토부 최우수상",포스코이앤씨가 'AI 기반 레미콘 품질예측 및 생산자동화 기술'을 개발해 국토교통부 '2025 스마트건설챌린지... 포스코이앤씨는 ㈜SHLab과 함께 AI 분석으로 품질 변화를 실시간 확인하고 자동 조정하는 기술을 개발했다....,http://www.ftoday.co.kr/news/articleView.html?idxno=351719
2025-12-07 12:50,,포스코,"광주시-포스코이앤씨, 8일 SRF 중재심리 재개",대표사인 포스코이앤씨간 중재심리가 5개월 만에 재개된다. 7일 광주시에 따르면 양 측은 8일 오후 3시... 지난 7차 심리 이후 지난 8월4일 강기정 시장이 포스코이앤씨 대표를 서울본시에서 만나 실무 협상을 통해...,http://www.namdonews.com/news/articleView.html?idxno=841569
2025-12-07 12:16,,포스코,"포스코이앤씨, AI기반 레미콘 품질예측 및 생산자동화 기술 개발","기호일보, KIHOILBO 포스코이앤씨가 균일한 품질의 레미콘을 생산하는 'AI 기반 레미콘 품질예측 및... 포스코이앤씨는 ㈜SHLab와 AI 분석으로 품질 변화를 실시간으로 확인하고 자동으로 조정하는 기술을 개발해 이러한...",https://www.kihoilbo.co.kr/news/articleView.html?idxno=3006047
2025-12-07 12:15,,포스코,"포스코이앤씨, AI로 레미콘 강도 예측하는 기술 개발","포스코이앤씨가 AI(인공지능)로 레미콘의 강도를 사전에 예측해 품질을 균일하게 유지하는 기술을 개발했다고 7일 밝혔다. 포스코이앤씨 측은 “이번 기술 개발로 레미콘의 생산, 운송, 반입·검사, 시공·양생 등 전...",https://www.chosun.com/economy/real_estate/2025/12/07/JYI3N5KFHFEU3BS2EWSGIPUCKA/?utm_source=naver&utm_medium=referral&utm_campaign=naver-news
2025-12-07 12:14,,포스코,"""AI가 레미콘 반죽"" 포스코이앤씨, AI 생산 자동화로 품질 관리 '새 지평...",포스코이앤씨가 균일한 품질의 레미콘을 생산하는 'AI 기반 레미콘 품질 예측 및 생산 자동화 기술'을... 포스코이앤씨는 SHLab과 함께 AI 분석으로 품질 변화를 실시간으로 확인하고 자동으로 조정하는 기술을 개발해 이런...,https://www.financialpost.co.kr/news/articleView.html?idxno=240388
2025-12-07 12:02,,포스코,"포스코이앤씨, ‘AI 기반 레미콘 기술’ 개발",포스코이앤씨가 균일한 품질의 레미콘을 생산하는 ‘AI 기반 레미콘 품질예측·생산자동화 기술’을 개발했다고 7일 밝혔다. 포스코이앤씨는 ㈜SHLab과 AI 분석으로 품질 변화를 실시간으로 확인하고 자동으로 조정하는...,http://www.thebigdata.co.kr/view.php?ud=20251207115914708802251a9c03_23
2025-12-07 11:54,,포스코인터내셔널,"포스코그룹, 2026년 정기 조직개편·임원인사 단행","포스코그룹은 안전경영 체계 고도화를 위해 지난 9월 그룹 내 안전조직 강화·개편에 착수한 이래 안전전문 자회사인 ‘포스코세이프티솔루션’을 설립했고, 포스코의 ‘안전보건환경본부’, 포스코인터내셔널의...",http://www.thebigdata.co.kr/view.php?ud=20251207114713297002251a9c03_23
2025-12-07 11:47,세계일보,포스코,"포스코이앤씨, AI 기반 래미콘 품질 관리 기술 개발",포스코이앤씨는 균일한 품질의 레미콘을 생산하는 ‘AI(인공지능) 기반 레미콘 품질 예측 및 생산자동화... 포스코이앤씨는 이러한 문제를 해결하기 위해 제조업 AI 전문기업 SHLab와 함께 AI 분석으로 품질 변화를 실시간...,https://www.segye.com/newsView/20251207504308?OutUrl=naver
2025-12-07 11:42,,포스코인터내셔널,"포스코그룹, 조직개편·임원인사 단행…안전·투자·DX 강화","포스코에는 '안전보건환경본부', 포스코인터내셔널에는 '안전기획실'을 각각 신설해 전사 차원의 안전혁신 체계를 구축했다. 포스코 안전기획실장은 글로벌 안전 컨설팅사 출신 외부 전문가를 영입할 계획이며...",http://www.ftoday.co.kr/news/articleView.html?idxno=351711
2025-12-07 11:32,더팩트,포스코,"포스코이앤씨, AI 기반 레미콘 품질예측 기술개발",생산부터 강도 예측까지 '일관된 품질 확보' 포스코이앤씨는 균일한 품질의 레미콘을 생산하는 'AI 기반... 포스코이앤씨는 SHLab과 함께 AI 분석으로 품질 변화를 실시간으로 확인하고 자동으로 조정하는 기술을 개발했다....,https://news.tf.co.kr/read/economy/2269850.htm
2025-12-07 11:30,,포스코,"포스코이앤씨, 'AI 기반 레미콘 품질 예측 기술' 개발",포스코이앤씨가 레미콘 품질을 자동으로 예측·조정하는 AI 기반 생산자동화 기술을 개발했다고 7일 밝혔다.... 포스코이앤씨와 SHLab이 개발한 기술은 AI가 혼합 과정 영상을 분석해 반죽 상태를 판별하고 KS 기준에 따라...,https://it.chosun.com/news/articleView.html?idxno=2023092152386
2025-12-07 11:28,디지털타임스,포스코,"포스코이앤씨, AI 기반 레미콘 품질예측 및 자동화 기술 개발",포스코이앤씨가 균일한 품질의 레미콘을 생산하는 ‘인공지능(AI) 기반 레미콘 품질예측 및 생산자동화... 포스코이앤씨는 이를 해결하기 위해 제조업 AI 전문기업 SHLab과 AI 분석으로 레미콘 품질 변화를 실시간 확인하고...,https://www.dt.co.kr/article/12033645?ref=naver
2025-12-07 11:24,,포스코,"포스코이앤씨, 인공지능 기반 '레미콘 품질 예측 기술' 개발",포스코이앤씨는 균일 품질 레미콘을 생산하는 'AI(인공지능) 기반 레미콘 품질 예측 및 생산 자동화 기술'을... 포스코이앤씨는 이런 문제를 해결하고자 '㈜SHLab'과 함께 AI 분석으로 품질 변화를 실시간으로 확인하고...,http://www.shinailbo.co.kr/news/articleView.html?idxno=2158372
2025-12-07 11:18,,포스코,"포스코이앤씨, AI 기반 레미콘 품질예측·생산자동화 기술 개발","포스코이앤씨는 균일한 품질의 레미콘을 생산하는 'AI 기반 레미콘 품질예측 및 생산자동화 기술'을 개발했다고 7일 밝혔다. 기술 개발을 통해 포스코이앤씨는 생산자의 숙련도, 재료 특성, 기온 등 다양한 요인의 영향을...",https://www.startuptoday.co.kr/news/articleView.html?idxno=554480
2025-12-07 11:16,,포스코플로우,'제1회 광양항의 날' 성료… 미래 항만 비전 시민과 공유,"본식에서는 지난해 컨테이너 물동량 증가에 기여한 유공자에게 표창을 수여해 현장 종사자들의 자긍심을 높였으며, 이어 포스코플로우가 4,500만 원 상당의 보건·안전용품을 기탁해 항만물류기업의 지역 상생을...",https://www.jeonmae.co.kr/news/articleView.html?idxno=1209448
2025-12-07 11:14,,포스코,"포스코이앤씨, AI 활용해 레미콘 품질 편차 잡는다···스마트 품질관...","포스코이앤씨가 인공지능(AI)을 활용해 레미콘 품질 편차를 줄이는 ‘AI 기반 레미콘 품질예측 및... 포스코이앤씨는 SHLab과 공동으로 AI 영상 분석을 활용해 혼합 중 레미콘의 반죽 상태를 판별하고, KS 기준 범위 안에서...",https://www.kbmaeil.com/article/20251207500166
2025-12-07 11:10,이데일리,포스코,"포스코이앤씨, AI 활용해 레미콘 품질관리 혁신 나섰다",포스코이앤씨가 ‘인공지능(AI) 기반 레미콘 품질예측 및 생산자동화 기술’을 개발하며 콘크리트 품질관리 혁신에 나선다고 7일 밝혔다. 포스코이앤씨의 ‘AI(인공지능) 기반 레미콘 품질 예측 및 생산자동화 기술’...,http://www.edaily.co.kr/news/newspath.asp?newsid=01407126642396224
2025-12-07 11:06,,포스코,"포스코이앤씨 ""AI 기반 레미콘 품질예측 및 생산자동화 기술개발 성공""",포스코이앤씨가 균일한 품질의 레미콘을 생산하는 ‘AI 기반 레미콘 품질예측 및 생산자동화 기술’을... 포스코이앤씨는 ㈜SHLab과 함께 AI 분석으로 품질 변화를 실시간으로 확인하고 자동으로 조정하는 기술을 개발해...,https://www.socialvalue.kr/news/view/1065578134609799
2025-12-07 10:55,헤럴드경제,포스코인터내셔널,"광양제철, 무장애 도시환경 조성에 앞장서",광양제철소와 포스코인터내셔널이 함께 참여한 ‘무장애 경사로 설치 사업’은 거동이 불편한 시민들이 식당을 비롯한 시설물과 편의시설에 보다 자유롭게 접근할 수 있도록 돕기 위해 경사로를 설치하는 사업이다....,https://biz.heraldcorp.com/article/10631138?ref=naver
2025-12-07 10:52,,POSCO INTERNATIONAL,"포스코그룹, 2026년도 조직개편·임원인사 단행…안전·해외투자·DX 중...","It also established the ""Safety, Health, and Environment Headquarters"" at POSCO and the ""Safety Planning Office"" at POSCO International, reorganizing its company-wide safety innovation system. POSCO also established...",http://www.breaknews.com/1167226
2025-12-07 10:48,,포스코플로우,제1회 ‘광양항의 날’ 기념식 성료…미래 항만 비전 시민과 공유,"본식에서는 지난해 컨테이너 물동량 증가에 기여한 유공자에게 표창을 수여해 현장 종사자들의 자긍심을 높였으며, 이어 포스코플로우가 4,500만 원 상당의 보건·안전용품을 기탁해 항만물류기업의 지역 상생을...",http://www.shinailbo.co.kr/news/articleView.html?idxno=2158421
2025-12-07 10:42,,포스코,"포스코이앤씨, AI로 레미콘 품질 균일화 성공… 스마트건설혁신 '최우수...",포스코이앤씨는 ㈜SHLab과 함께 AI분석으로 레미콘 품질 변화를 실시간을 확인하고 자동으로 조정해 균일한... 포스코이앤씨는 이러한 기술력을 인정받아 국토교통부 '2025 스마트건설챌린지'에서 최우수 혁신상을...,https://www.smarttoday.co.kr/news/articleView.html?idxno=98337
2025-12-07 10:42,,포스코,"포스코이앤씨, 'AI 기반 레미콘 품질예측 및 생산자동화' 기술개발로 콘...",포스코이앤씨가 균일한 품질의 레미콘을 생산하는 'AI 기반 레미콘 품질예측 및 생산자동화 기술'을... 포스코이앤씨는 ㈜SHLab과 함께 AI 분석으로 품질 변화를 실시간으로 확인하고 자동으로 조정하는 기술을 개발해...,https://www.gokorea.kr/news/articleView.html?idxno=849434
2025-12-07 10:42,아주경제,포스코,"포스코이앤씨, AI 기반 레미콘 품질 관리 체계 '선도'",레미콘 품질 관리부터 생산 자동화까지 AI로 전 과정 스마트 품질관리 체계 완성 아주경제=하주언 기자 zoo@ajunews.com 'AI기반 콘크리트 품질예측 및 생산자동화' 기술 적용한 모니터링 화면 [사진=포스코이앤씨] 포스코이...,https://www.ajunews.com/view/20251207103222281
2025-12-07 10:39,뉴스핌,포스코,"포스코이앤씨, AI 기반 레미콘 품질예측·생산자동화 기술 개발",포스코이앤씨는 균일한 품질의 레미콘을 생산하는 '인공지능(AI) 기반 레미콘 품질예측 및 생산자동화 기술... 이에 포스코이앤씨는 SHLab과 함께 AI 분석으로 품질 변화를 실시간으로 확인하고 자동으로 조정하는 기술을...,https://www.newspim.com/news/view/20251207000039
2025-12-07 10:28,,포스코,"포스코이앤씨, AI로 래미콘 품질 관리한다",포스코이앤씨는 7일 균일한 품질의 레미콘을 생산하는 ‘AI(인공지능) 기반 레미콘 품질 예측 및 생산... 이를 해결하기 위해 포스코이앤씨는 제조업 AI 전문기업 에스에이치엘에이비(SHLab)와 함께 AI 분석으로 레미콘 품질...,https://biz.chosun.com/real_estate/real_estate_general/2025/12/07/FWL6VFOCVZDQVLLSDWDPSYJTSY/?utm_source=naver&utm_medium=original&utm_campaign=biz
2025-12-07 10:20,,포스코플로우,"광양시, 제1회 광양항의 날 기념식 개최","본식에서는 지난해 컨테이너 물동량 증가에 기여한 유공자 표창이 진행돼 현장 종사자들의 자긍심을 높였으며, 포스코플로우가 4,500만 원 상당의 보건·안전용품을 기탁해 기업의 지역 상생을 보여줬다. 특강 연사로...",http://www.m-i.kr/news/articleView.html?idxno=1312029
2025-12-07 10:18,이투데이,포스코,"포스코이앤씨, AI 기반 레미콘 품질예측·생산기술 개발",이투데이=정유정 기자 | 포스코이앤씨는 균일한 품질의 레미콘을 생산하는 'AI 기반 레미콘 품질 예측 및... 포스코이앤씨는 ㈜SHLab과 함께 AI 분석으로 품질 변화를 실시간으로 확인하고 자동으로 조정하는 기술을 통해...,https://www.etoday.co.kr/news/view/2533438
2025-12-07 10:16,노컷뉴스,포스코인터내셔널,"'제2의 신유빈 맹활약' 韓 탁구, 크로아티아 제압…그러나 4강전 상대는...","한국은 크로아티아를 상대로 남자팀 장우진, 박강현(미래에셋증권), 안재현, 오준성(이상 한국거래소)과 여자팀 이은혜(대한항공), 김나영(포스코인터내셔널), 최효주(한국마사회)가 나섰다. 첫 경기 혼합 복식에...",https://www.nocutnews.co.kr/news/6439379?utm_source=naver&utm_medium=article&utm_campaign=20251207101502
2025-12-07 10:15,뉴스1,포스코,"""28일 기다리지 않는다""…레미콘 강도 미리 보는 포스코이앤씨 AI","포스코이앤씨가 레미콘 생산에 인공지능(AI)을 접목해 품질 편차를 줄이고 전 공정을 자동화하는 기술을... 레미콘 반죽 상태까지 보는 AI, 포스코이앤씨 품질 편차 잡는다 포스코이앤씨는 ‘AI 기반 레미콘 품질예측 및...",https://www.news1.kr/realestate/general/6000432
2025-12-07 10:14,,포스코,"포스코이앤씨, ‘AI기반 레미콘 품질예측 및 생산자동화’ 기술개발",압축강도 사전 예측·잔수 자동 확인 [서울타임즈뉴스 = 서연옥 기자] 포스코이앤씨은 레미콘 품질 편차... 포스코이앤씨는 이같은 ‘AI 기반 레미콘 품질예측 및 생산자동화 기술’ 개발을 통해 이같은 문제점을 해결한...,https://www.seoultimes.news/news/article.html?no=2000087001
2025-12-07 10:08,G경제,포스코인터내셔널,"광양제철소, ‘경사로 설치 사업’으로 무장애 도시환경 구축 앞장","이번 사업은 광양제철소와 포스코인터내셔널이 공동으로 추진했다. 두 기관이 각각 5000만 원씩을 지원해 올해 3월부터 11월까지 지역 식당, 미용실, 약국, 카페, 마트 등 57곳의 편의시설에 경사로를 설치했다. 이동이...",https://www.geconomy.co.kr/news/article.html?no=311689
2025-12-07 10:06,,포스코,"포스코이앤씨, 'AI 기반 레미콘 품질예측 및 생산자동화' 기술 개발","포스코이앤씨 'AI기반 콘크리트 품질예측 및 생산자동화' 기술 적용 모니터링 화면. [포스코이앤씨] 포스코이앤씨, 'AI 기반 레미콘 품질예측 및 생산자동화' 기술 개발 포스코이앤씨가 균일한 품질의 레미콘을 생산하는...",https://www.ziksir.com/news/articleView.html?idxno=115356
2025-12-07 10:04,,포스코,"포스코이앤씨, '레미콘 품질 균일성 확보' AI 기술 개발",포스코이앤씨는 균일한 품질의 레미콘을 생산하는 '인공지능(AI) 기반 레미콘 품질 예측 및 생산 자동화 기술... 포스코이앤씨는 이를 해결하고자 제조업 AI 전문기업 에스에이치엘에이비(SHLab)와 함께 AI 분석으로 레미콘...,https://www.sedaily.com/NewsView/2H1MYRUPGT
2025-12-07 10:01,,포스코,"포스코이앤씨, 'AI 기반 레미콘 품질 예측 기술' 개발…""일관된 품질 확...",포스코이앤씨는 균일한 품질의 레미콘을 생산하는 '인공지능(AI) 기반 레미콘 품질예측 및 생산자동화... 이에 포스코이앤씨는 SHLab과 함께 AI 분석으로 품질 변화를 실시간으로 확인하고 자동으로 조정하는 기술을...,https://www.newsis.com/view/NISX20251207_0003431268
2025-12-07 10:00,,포스코,"""AI로 레미콘 품질 편차 잡는다""…포스코이앤씨, '스마트 생산·예측' 기...",포스코이앤씨는 레미콘의 품질 편차 문제를 줄이는 '인공지능(AI) 기반 레미콘 품질예측 및 생산자동화... 게 포스코이앤씨의 설명이다. 이를 위해 포스코이앤씨는 SHLab과 함께 혼합 중 레미콘 영상을 분석해 반죽...,https://www.asiatoday.co.kr/view.php?key=20251207010003493
2025-12-07 10:00,뉴스워커,포스코인터내셔널,"광양제철소, '경사로 설치 사업'으로 무장애 도시환경 조성 앞장",광양제철소와 포스코인터내셔널이 함께 참여한 '무장애 경사로 설치 사업'은 거동이 불편한 시민들이 식당을 비롯한 시설물과 편의시설에 보다 자유롭게 접근할 수 있도록 돕기 위해 경사로를 설치하는 사업이다....,http://www.newsworker.co.kr/news/articleView.html?idxno=405804
2025-12-07 09:56,,포스코,"포스코이앤씨, 'AI 기반 레미콘 품질예측 및 생산자동화' 기술 개발",포스코이앤씨가 균일한 품질의 레미콘을 생산하는 'AI 기반 레미콘 품질예측 및 생산자동화 기술'을... 이에 포스코이앤씨는 ㈜SHLab과 함께 AI 분석으로 품질 변화를 실시간으로 확인하고 자동으로 조정하는 기술을 개발해...,http://www.newsbrite.net/news/articleView.html?idxno=195178
2025-12-07 09:50,연합뉴스,포스코,"포스코이앤씨, '레미콘 품질 균일성 확보' AI 기술 개발",포스코이앤씨는 균일한 품질의 레미콘을 생산하는 'AI(인공지능) 기반 레미콘 품질 예측 및 생산 자동화 기술... 포스코이앤씨는 이를 해결하고자 제조업 AI 전문기업 에스에이치엘에이비(SHLab)와 함께 AI 분석으로 레미콘...,https://www.yna.co.kr/view/AKR20251207013700003?input=1195m
2025-12-07 09:45,,포스코인터내셔널,"광양제철소, '경사로 설치 사업' 무장애 도시환경 조성 앞장",광양제철소와 포스코인터내셔널이 함께 참여한 '무장애 경사로 설치 사업'은 거동이 불편한 시민들이 식당을 비롯한 시설물과 편의시설에 보다 자유롭게 접근할 수 있도록 돕기 위해 경사로를 설치하는 사업이다....,http://www.enewstoday.co.kr/news/articleView.html?idxno=2365613
2025-12-07 09:43,,포스코,"포스코이앤씨, AI로 레미콘 품질 관리 '전면 혁신'",포스코이앤씨가 인공지능을 활용한 레미콘 품질 예측 및 생산 자동화 기술을 개발하며 콘크리트 품질관리... 포스코이앤씨는 이러한 구조적 문제를 해결하기 위해 SHLab과 공동으로 AI 기반 품질관리 기술을 개발했다. 7일...,https://www.mt.co.kr/estate/2025/12/07/2025120709223499086
2025-12-07 09:42,,포스코인터내셔널,"""안전·글로벌 투자·DX 중심 재편"" 포스코그룹, '26년 정기 조직·임원...","조직개편에서는 안전문화 재건을 위해 포스코세이프티솔루션 설립, 포스코 안전보건환경본부·포스코인터내셔널 안전기획실 신설 등 안전조직을 전면 정비했다. 또한 포스코는 해외 투자사업을 총괄하는...",http://www.economytalk.kr/news/articleView.html?idxno=415038
2025-12-07 09:40,,포스코,"포스코이앤씨, 레미콘 생산에 AI 도입…콘크리트 품질 ‘초격차’ 낸다",포스코이앤씨가 인공지능(AI)을 활용해 레미콘 품질 편차를 줄이고 생산을 자동화하는 기술을 개발하며 콘크리트 품질 관리의 새로운 장을 열었다. 포스코이앤씨는 SHLab과 공동으로 ‘AI 기반 레미콘 품질예측 및...,https://www.viva100.com/article/20251207500185
2025-12-07 09:36,,포스코,"포스코이앤씨, 'AI 기반 레미콘 품질예측 및 생산자동화 기술' 개발",포스코이앤씨 'AI기반 콘크리트 품질예측 및 생산자동화' 기술 적용 모니터링 화면. /사진=포스코이앤씨 포스코이앤씨가 균일한 품질의 레미콘을 생산하는 'AI 기반 레미콘 품질예측 및 생산자동화 기술'을 개발했다고 7일...,https://www.businessplus.kr/news/articleView.html?idxno=103653
2025-12-07 09:28,,포스코,"포스코이앤씨, AI 기반 레미콘 품질예측 및 생산자동화 기술개발",-레미콘 품질 편차 문제를 AI로 해소 -전 과정 스마트 품질관리 체계 포스코이앤씨가 개발한 'AI기반 콘크리트 품질예측 및 생산자동화' 기술을 적용한 모니터링 화면. /포스코이앤씨 포스코이앤씨는 균일한 품질의...,http://www.metroseoul.co.kr/article/20251207500029
2025-12-07 09:24,,포스코,"포스코이앤씨, 'AI 기반 레미콘 품질예측 및 생산자동화' 기술 개발","|중앙이코노미뉴스 송태원 기자|포스코이앤씨, 'AI 기반 레미콘 품질예측 및 생산자동화' 기술 개발[사진=포스코이앤씨] 포스코이앤씨가 균일한 품질의 레미콘을 생산하는 'AI 기반 레미콘 품질예측 및 생산자동화 기술'을...",https://www.joongangenews.com/news/articleView.html?idxno=472855
