날짜,매체명,검색키워드,기사제목,주요기사 요약,URL
2025-11-21 15:37,,포스코,"송치영 대표, 포스코이앤씨 유동성 관리 시험대…현금고갈·차입부담 심...","송치영 대표의 포스코이앤씨가 매출채권 회수 지연과 반복된 안전사고, 신용등급 하락 우려까지 겹치면서 중장기 유동성 관리 능력이 본격 시험대에 올랐다. 포스코이앤씨는 현금 유동성 압박과 차입 부담 증가라는...",https://www.upkoreanews.kr/news/articleView.html?idxno=96002
2025-11-21 15:36,,포스코,"포스코, 가스흡입 사고에 사과...진보당 “위험의 외주화 끝내야”","진보 “사고 때마다 재발 방지 약속한 포스코, 현장을 바꾸지 못해” 올해만 포항제철소에서 세 번째, 포스코그룹 전체로는 일곱 번째 인명사고 포스코가 포항제철소에서 발생한 가스를 흡입한 사고와 관련해 21일 공식...",https://www.m-economynews.com/news/article.html?no=62001
2025-11-21 15:22,,포스코,"포스코, 장인화 회장 직속 TF에도 사고 반복…“안전불감증 심각”","포스코 포항제철소에서 20일, 50대 용역 직원 2명과 40대 포스코 직원 1명이 슬러지 청소 작업 중 유해가스를 흡입해 쓰러지는 사고가 발생했다. 사고는 STS 4제강공장에서 일어났으며, 일부 설비가 여전히 가동 중인...",https://wemakenews.co.kr/news/view.php?no=23784
2025-11-21 15:16,,포스코,"'가스 흡입 사고' 포스코 ""머리 숙여 사과""","포스코가 어제 포항제철소에서 노동자 6명이 유독가스를 마시고 쓰러진 사고에 대해 공식사과하고 재발방지 대책을 마련하겠다고 밝혔습니다. 이희근 포스코 대표이사는 입장문을 통해 ""사고를 당하신 분들과...",https://imnews.imbc.com/replay/2025/nw1400/article/6777923_36776.html
2025-11-21 15:16,,포스코,장인화號 포스코그룹 또 중대재해… “죽음의 외주화 결과”,"스카이데일리 김진강기자 = ▲ 장인화 포스코그룹 회장. 연합뉴스 포스코에서 또 중대재해 사고가 발생했다. 지난 7월 장인화 회장이 ‘안전진단 특별TF’까지 만들었지만, 포스코 그룹 전체로 보면 올해 사망자만 7명에...",https://m.skyedaily.com/news_view.html?ID=291248
2025-11-21 15:10,,포스코,"포스코 사장, 가스 흡입 사고 사과... ""철저한 반성과 재발방지책 마련...","포스코가 경북 포항제철소에서 슬러지(찌꺼기) 청소 작업자들의 가스 흡입 사고와 관련해 사과문을 내고 재발 방지 대책을 마련하겠다고 밝혔다. 포스코는 21일 이희근 사장 명의로 낸 사과문에서 ""포항제철소 현장에서...",https://www.hankookilbo.com/News/Read/A2025112114540000103?did=NA
2025-11-21 15:08,,포스코,"이희근 포스코 사장 ""머리 숙여 사과⋯재발 방지 대책 마련""","이희근 포스코 사장은 지난 20일 발생한 포항제철소 가스 누출 사고와 관련해 ""포스코 임직원을 대표해 사고를 당하신 분들과 가족분들에게 머리 숙여 깊이 사과드린다""고 21일 밝혔다. 이 사장은 이날 입장문을 통해 ""어제...",http://www.inews24.com/view/1909750
2025-11-21 14:50,,포스코,포스코 연이은 중대재해 ...경영 책임자를 구속하라,"포스코 경영 책임자를 구속하라! 연이은 중대재해, 노동자는 죽을 차례나 기다리고 있으란 말인가 포스코에서 연이어 중대재해가 일어나고 있다. 올해 들어서만 3월 21일 자회사 노동자 한 명이 수리 작업 중 설비에 끼여...",https://www.pn.or.kr/news/articleView.html?idxno=32894
2025-11-21 14:50,,포스코,'포항제철 가스 중독' 3명 중태...포스코 공식 사과,어제(20일) 포스코 포항제철소에서 배관 찌꺼기를 청소하다가 가스를 들이마신 노동자들이 이틀째 중태에 빠져 치료받고 있습니다. 올해만 7명이 숨지는 등 잇따르는 중대재해에 포스코는 사과문을 내고 근본적인 재발...,https://www.ytn.co.kr/_ln/0115_202511211450405752
2025-11-21 14:44,KBS,포스코인터내셔널,"임종훈-오준성, 세계 1위 복식조 꺾고 WTT 대회 결승 진출",여자 복식에 나선 주천희(삼성생명)-김나영(포스코인터내셔널) 조도 4강에서 러시아계 개인중립선수(AIN) 듀오인 블라다 보로니나-엘리자벳 아브라미안 조를 3 대 1(11-5 7-11 11-8 11-5)로 꺾었습니다. 주천희-김나영 조는...,https://news.kbs.co.kr/news/pc/view/view.do?ncd=8413900&ref=A
2025-11-21 14:38,스마트경제,포스코,"포스코 이희근 사장, 유해가스 사고에 ""깊은 사과""···재발방지책 마...",| 스마트에프엔 = 김종훈 기자 | 포스코는 포항제철소에서 슬러지 청소 작업 중 발생한 가스 흡입 사고와 관련해 21일 공식 사과하며 재발 방지 대책을 마련하겠다고 밝혔다. 이날 포스코는 이희근 사장 명의의 사과문에서...,https://www.smartfn.co.kr/news/articleView.html?idxno=126864
2025-11-21 14:37,,포스코,"포스코, 청소작업자 가스흡입 사고에 사과…""재발방지 대책 마련""","포스코가 포항제철소에서 슬러지(찌꺼기) 청소 작업을 하던 작업자들이 가스를 흡입한 사고와 관련해 21일 공식 사과했다. 포스코는 이날 이희근 사장 명의로 사과문을 내고 ""어제 포항제철소 현장에서 청소작업 중...",https://news.tvchosun.com/site/data/html_dir/2025/11/21/2025112190138.html
2025-11-21 14:32,,포스코,포스코 “가스흡입사고 깊이 사과…재발방지책 마련할 것”,뉴스토마토 = 박혜정 기자 | 포스코가 포항제철소에서 슬러지(찌꺼기) 청소 작업을 하던 작업자들이 가스를 흡입한 사고와 관련해 21일 공식 사과하고 재발 방지 대책을 마련하겠다고 밝혔습니다. 포스코 포항제철소 전경....,http://www.newstomato.com/ReadNews.aspx?no=1282474&inflow=N
2025-11-21 14:30,,포스코,"'가스 흡입 사고' 포스코, 공식 사과","포스코가 포항제철소에서 슬러지(찌꺼기) 청소 작업을 하던 작업자들이 가스를 흡입한 사고와 관련해 공식 사과하고 재발 방지 대책을 마련하겠다는 입장을 밝혔다. 포스코는 21일 이희근 사장 명의로 사과문을 내고 ""어제...",http://www.newsprime.co.kr/news/article.html?no=712974
2025-11-21 14:28,,포스코,"이희근 포스코 사장 ""가스 질식 사고 사과""…당국, 안전 조치 미비 수사",이희근 포스코 대표이사 사장은 21일 전날 포항제철소에서 발생한 가스 흡입 사고와 관련해 사과했다. 사진... 이희근 포스코 사장이 사과했다. 관계 당국은 안전 조치 미비 등 관련 수사를 이어가고 있다. 이 사장은 21일...,http://www.opinionnews.co.kr/news/articleView.html?idxno=128100
2025-11-21 14:26,,포스코,"포스코 포항제철소, 작업자 가스흡입 사고에 깊이 사과",포스코 포항제철소 본사 사옥. 사진=포스코 제공 포스코가 포항제철소에서 슬러지(찌꺼기) 청소 작업을 하던 작업자들이 가스를 흡입한 사고와 관련해 21일 공식 사과하고 재발 방지와 사고수습에 최선을 다하겠다고...,http://www.hidomin.com/news/articleView.html?idxno=599350
2025-11-21 14:25,,포스코,포항제철소 질식 사고로 중태 빠졌던 1명 회복···포스코 사장 사과,11월 20일 포스코 포항제철소에서 청소 작업 중 노동자 등 6명이 쓰러진 사고와 관련해 중태에 빠진 3명 중 1명이 의식을 회복했습니다. 소방과 경찰 등에 따르면 사고 뒤 심정지 상태로 병원에 이송됐던 포스코 사내...,https://dgmbc.com/NewsArticle/637656
2025-11-21 14:24,,포스코,"포스코, 청소작업자 가스흡입 사고에 사과…""재발방지책 마련""",포스코 포항제철소. (사진=연합뉴스) 포스코가 포항제철소에서 슬러지(찌꺼기) 청소 작업을 하던 작업자들이 가스를 흡입한 사고와 관련해 21일 공식 사과하고 재발 방지 대책을 마련하겠다는 입장을 밝혔다. 포스코는...,https://www.delighti.co.kr/news/articleView.html?idxno=106281
2025-11-21 14:24,,포스코,"포스코 이희근 대표이사, 포항제철소 사고 관련 공식 사과...“재발 방지...",포스코 이희근 대표이사가 포항제철소에서 발생한 가스 흡입 사고와 관련해 공식 사과문을 발표했다. 이... 이 대표는 “포항제철소 현장에서 청소작업 중 불의의 사고로 포스코와 관계사 직원분들에게 안타까운 일이...,https://www.pressian.com/pages/articles/2025112113373127565?utm_source=naver&utm_medium=search
2025-11-21 14:23,,포스코,"이희근 포스코 사장, 청소작업자 가스흡입 사고에 사과…“재발방지책...",포스코 포항제철소에서 슬러지(찌꺼기) 청소 중이던 작업자들이 가스를 흡입한 사고와 관련해 포스코는 이희근 사장 명의로 공식 사과문을 내고 재발 방지 대책을 마련하겠다는 입장을 밝혔다. 이 사장은 사과문에서...,https://www.womennews.co.kr/news/articleView.html?idxno=269971
2025-11-21 14:18,,포스코,"포스코, 청소근로자 가스흡입 사고에 ""머리 숙여 깊이 사과""","포스코가 포항제철소에서 슬러지(찌꺼기) 청소 작업을 하던 근로자들이 가스를 흡입해 사망한 사고와 관련해 21일 사과문을 내고 고개를 숙였다. 포스코는 이날 이희근 사장 명의의 사과문을 내고 ""어제 포항제철소...",https://it.chosun.com/news/articleView.html?idxno=2023092151469
2025-11-21 14:18,,포스코,"포스코, 포항제철소 유해가스 사고 공식 사과…""재발 방지에 전사적 대...","뉴스저널리즘 장하민 기자 = 포스코가 포항제철소에서 발생한 유해가스 흡입 사고와 관련해 21일 공식 사과하고, 사고 재발 방지를 위한 전사적 대책 마련에 나서겠다는 입장을 밝혔다. 이희근 포스코 사장은 이날...",https://www.ngetnews.com/news/articleView.html?idxno=541516
2025-11-21 14:15,,포스코,"이희근 포스코 사장 “연이은 사고, 책임 통감…근본적 재발 방지책 마...",이희근 포스코 사장이 가스 누출 사고와 관련해 책임을 통감한다며 고개를 숙였다. 이 사장은 21을 사과문을 통해 “포스코 임직원을 대표해 사고를 당하신 분들과 가족분들에게 머리 숙여 깊이 사과 드린다”라면서...,https://www.etnews.com/20251121000227
2025-11-21 14:14,,포스코,"이희근 포스코 사장 ""연이은 사고, 머리숙여 사과… 회복 지원""","포스코가 포항제철소에서 슬러지(찌꺼기) 청소 작업을 하던 작업자들이 가스를 흡입한 사고와 관련해 21일 공식 사과했다. 포스코는 이날 이희근 사장 명의로 사과문을 내고 ""어제 포항제철소 현장에서 청소 작업 중...",https://www.newscj.com/news/articleView.html?idxno=3342820
2025-11-21 14:14,,포스코,"포스코, 유해가스 질식 6명 사상 … 이희근 사장 고개숙여",포스코 포항제철소에서 유해가스 흡입으로 6명의 사상자가 발생하는 중대재해가 또다시 발생했다. 이는... 추진하는 포스코그룹 차원의 안전 혁신 노력에도 불구하고 현장의 안전 관리 시스템이 여전히 미흡하다는...,https://www.safetimes.co.kr/news/articleView.html?idxno=236639
2025-11-21 14:12,,포스코,"포스코 20일 발생한 유해가스 흡입사고에 사과, ""사고대책반 가동 중""","포스코는 21일 이희근 대표이사 사장 명의의 사과문을 통해 ""지난 20일 포항제철소 현장에서 청소작업 중 불의의 사고로 포스코와 관계사 직원들에게 안타까운 일이 발생했다""며 ""임직원을 대표해 사고 피해자와 그...",https://www.businesspost.co.kr/BP?command=article_view&num=420908
2025-11-21 14:07,헤럴드경제,포스코,"포스코, 청소작업자 가스흡입 사고 공식 사과…“철저한 반성·재발방지...",포항제철소 전경 [포스코 제공] 포스코가 포항제철소에서 슬러지(찌꺼기) 청소 작업을 하던 작업자들이 가스를 흡입한 사고와 관련해 21일 공식 사과하고 재발 방지 대책을 마련하겠다는 입장을 밝혔다. 포스코는 이날...,https://biz.heraldcorp.com/article/10621111?ref=naver
2025-11-21 14:07,,포스코,‘가스 흡입’ 쓰러진 근로자들…연이은 사고 포스코 “두 번 다시 없게...,포스코가 포항제철소에서 슬러지(찌꺼기) 청소 작업을 하던 작업자들이 가스를 흡입한 사고와 관련해 21일 공식 사과하고 재발 방지 대책을 마련하겠다고 밝혔다. 포스코는 이날 이희근 사장 명의로 사과문을 내고 “어제...,https://www.mk.co.kr/article/11473996
