날짜,매체명,검색키워드,기사제목,주요기사 요약,URL,sentiment
2026-02-13 11:46,,포스코인터내셔널,"조비, 인도네시아 초등학교에 교육물품 기증… ESG 경영 실천","이날 행사에는 조비 이승연 대표이사를 비롯해 PT.BIA 공병선 법인장, 포스코인터내셔널 산업소재사업실 이성수 실장 등 주요 관계자들이 참석했다. 조비는 필기구 등 기본적인 학용품부터 체육용품에 이르기까지...",http://www.nongup.net/news/articleView.html?idxno=32469,pos
2026-02-13 11:40,,포스코인터내셔널,"이화여대 전임교원 21명, 정년퇴임 맞아","한국회계학회장을 역임하고, 한국내부통제학회장, ㈜LG 및 포스코인터내셔널 감사위원장으로 활발한 활동을 펼치고 있다. 조미숙 교수는 2006년부터 이화여대 식품영양학과에 재직하며 한국인의 식생활과 음식문화를...",http://www.kyosu.net/news/articleView.html?idxno=157994,pos
2026-02-13 11:40,동아일보,포스코인터내셔널,"이화여대 전임교원 21명, 정년퇴임 맞아","한국회계학회장을 역임하고, 한국내부통제학회장, ㈜LG 및 포스코인터내셔널 감사위원장으로 활발한 활동을 펼치고 있다. 조미숙 교수는 2006년부터 이화여대 식품영양학과에 재직하며 한국인의 식생활과 음식문화를...",https://edu.donga.com/news/articleView.html?idxno=103423,pos
2026-02-13 10:44,,포스코인터내셔널,"포스코인터내셔널 주가, 2월 13일 장중 66,200원 4.06% 하락","|중앙이코노미뉴스 이영선 기자|출처=네이버페이 증권 13일 오전 9시 45분 기준, 네이버페이 증권에 따르면 포스코인터내셔널 주가는 현재 66,200원을 기록하며 지난 종가 69,000원 대비 2,800원 하락한 4.06...",https://www.joongangenews.com/news/articleView.html?idxno=495967,neg
2026-02-13 10:08,,포스코,"포스코, 함정용 고연성강·방탄강 국내 첫 선급 인증…차세대 함정 소재...",포스코는 함정용 고연성강과 방탄강을 국내 최초로 개발하고 선급 인증을 획득했다. [사진=포스코] [뉴스투데이=박상미 기자] 포스코가 함정용 고연성강과 방탄강을 국내 최초로 개발하고 선급 인증을 획득해 차세대 해군...,https://www.news2day.co.kr/article/20260213500082,pos
2026-02-13 10:08,이데일리,포스코,"트릴리온랩스, 포스코·GS 등과 '국가대표 AI' 컨소시엄 맺고 도전장","GS그룹 AX조직·포스코홀딩스 등 참여 우선 에너지·발전, 제조, 공공 등 국가 인프라 산업을 선도하는... 포스코홀딩스는 금속·이차전지 소재 도메인 지식을 내재화한 특화 모델 개발에 참여한다. 특히 목표 물성...",http://www.edaily.co.kr/news/newspath.asp?newsid=03801526645350192,pos
2026-02-13 10:02,아주경제,포스코,"트릴리온랩스, '국가대표 AI' 추가 공모 지원…포스코·GS 합류","컨소시엄에는 포스코홀딩스, GS그룹, 엑셈 등 주요 기업이 참여한다. GS그룹 AX 조직 ‘52g’는 발전·에너지·유통·건설 등 현장 사례를 기반으로 AI 전환(AX) 모델을 확산하는 실행 파트너 역할을 맡는다. 포스코홀딩...",https://www.ajunews.com/view/20260213095455359,pos
2026-02-13 09:51,,포스코,"트릴리온랩스, '국대 AI' 패자부활전 참가…포스코·GS 합류","재계 순위 10위권 포스코·GS, 트릴리온랩스와 산업 전반 AI 전환 실증 이 스타트업이 이끄는 컨소시엄은... 이 컨소시엄에 GS그룹, 포스코홀딩스가 참여했다. GS그룹이 운영하는 AI 전환(AX) 조직 '52g'는 산업 현장에서...",https://www.newsis.com/view/NISX20260213_0003514702,pos
2026-02-13 09:48,,포스코,"트릴리온랩스, '독파모' 추가 공모 지원… GS·포스코 등과 산업 AI 내재...","GS그룹 52g, 포스코홀딩스 등 대기업과 KAIST·서울대 등 주요 대학, 다수의 스타트업이 참여하는 '초격차 AI... 포스코홀딩스는 금속·이차전지 소재 도메인 특화 모델 개발에 참여해 목표 물성 기반 소재 설계...",https://platum.kr/archives/281945,pos
2026-02-13 09:30,,포스코,"[현장스케치] 이끼로 표현하는 인간의 인정과 수용 과정, 포스코 더샵갤...",《이끼: 공존의 시대》展 /김서진 기자 포스코이앤씨 더샵갤러리는 일상 속에서 자연과 공존하는 삶을 이야기하는 양종용 작가의 개인전 《이끼: 공존의 시대》 3월 29일까지 진행한다. 양종용 작가는 지난 15년 동안...,https://www.handmk.com/news/articleView.html?idxno=35956,pos
2026-02-13 08:30,,구동모터코어,"[시승기] '제로백 3.4초' GV60 마그마, 전기차 한계 넘다",달하는 모터 회전수를 견딜 수 있도록 로터 코어와 베어링을 보강했다. 후륜에는 2스테이지 인버터를... 고속도로 주행 보조 2(HDA 2)를 가동한 정속 주행에서는 후륜 모터 위주로 구동하며 효율을 챙기는 영민함도...,https://www.sidae.com/article/2026021214414557584,pos
2026-02-13 08:26,,포스코,"포스코, 영업이익 개선…열연 판가 인상으로 반등 모색","포스코가 원가 절감을 통해 영업이익을 개선하며 수익성 방어에 나섰다. 13일 데이터뉴스가 포스코홀딩스의 실적발표를 분석한 결과, 포스코(국내 철강 부문)의 2025년 영업이익은 1조7800억 원으로 전년(1조4730억...",http://www.datanews.co.kr/news/article.html?no=143338,pos
2026-02-13 08:17,,포스코,"[단독] 포스코·GS, ‘독파모’ 프로젝트 출사표 던졌다",재계 순위 6위인 포스코그룹과 재계 순위 10위 GS(078930)그룹이 정부의 ‘독자 인공지능(AI) 파운데이션 모델... 컨소시엄에 포스코홀딩스(POSCO홀딩스(005490))와 GS그룹의 52g(오이지)가 참여하는 것으로 파악됐다. 두 기업...,https://www.sedaily.com/article/20008826?ref=naver,pos
2026-02-13 08:00,,포스코,"[Biz&Law] 포스코, 아르헨 리튬광산 2년째 '환경 제동'에도 인수 강행","포스코가 아르헨티나 카타마르카주 법원의 인허가 중단 가처분이 2년째 해소되지 않은 상황에서, 규제... 이곳은 포스코의 '살 데 오로(Sal de Oro)' 리튬 프로젝트 현장인 만큼, 향후 환경 규제 완화 및 인허가 재개...",http://www.seoulwire.com/news/articleView.html?idxno=706733,neg
2026-02-13 07:50,철강금속신문,포스코,"포스코 현대, 3월 열연 인상 확정…수입산 2년만에 80만 원대",따르면 포스코는 3월 유통용 열연 공급 가격을 톤당 3만 원 인상하기로 했다. 현대제철도 이와 같은 내용으로 인상을 추진할 것으로 관측된다. 철강원료 전문데이터센터인 스틸웨어 자료에 따르면 현재 포스코...,http://www.ferrotimes.com/news/articleView.html?idxno=46312,pos
2026-02-13 07:46,철강금속신문,포스코,"포스코, 차세대 함정 핵심 소재 국산화…선급 인증",신(新) 방산 소재를 적용한 차세대 함정 가상 이미지.(제공 : 포스코) 포스코가 함정용 신소재 기술 개발로 대한민국 방위산업에 새로운 이정표를 세웠다. 포스코는 국내 최초로 개발한 함정용 고연성강과 방탄강이 올해...,http://www.ferrotimes.com/news/articleView.html?idxno=46366,pos
2026-02-13 07:30,,포스코모빌리티솔루션,[Who Is ?] 심민석 포스코DX 대표이사 사장,△일본 야스카와와 손잡고 산업용 로봇 현장 확산 추진 포스코그룹이 글로벌 3대 산업용 로봇 제조사인 일본 야스카와전기와 손을 맞잡고 포스코모빌리티솔루션의 주력 제품인 구동모터코어 생산현장에 로봇...,https://www.businesspost.co.kr/BP?command=article_view&num=430248,pos
2026-02-13 06:42,MTN,포스코인터내셔널,"[투자원정대 동행] 포스코인터내셔널 vs 티엠씨 vs 서진시스템, 공략법...",▶ 진행 - 김은성 앵커▶ 출연 - 송필호 MTNW 어드바이저 명성욱 MTNW 어드바이저 최태훈 MTNW 어드바이저▶▶▶ 사랑과 쩐쟁송필호 공략주 - 포스코인터내셔널- 매출· 수익성 성장… 불황에도 견조한 실적- 지난해...,https://news.mtn.co.kr/news-detail/2026021306295673322,pos
2026-02-13 06:31,,포스코,"포스코, 함정용 신소재 개발…“방호력·경량화로 성능 레벨업” [biz-플...",포스코가 국내 최초로 함정용 고(高)연성강과 방탄강을 개발하고 선급 인증까지 획득했다. 해당 소재들은 우리 해군의 차세대 함정 성능을 한 단계 높이는 역할을 할 것으로 기대된다. 12일 포스코에 따르면 한국선급(KR)은...,https://www.sedaily.com/article/20008775?ref=naver,pos
2026-02-13 05:30,,포스코,리튬 가격 상승에 뜨는 포스코…올해 수익화 단계로,포스코그룹이 2018년부터 투자해온 리튬 사업이 올해 본격적인 수익화 단계에 접어들 전망이다. 최근 리튬... 13일 관련업계에 따르면 포스코홀딩스는 올해 이차전지소재 사업에 약 2조6000억원을 쓸 계획이다. 이는...,https://www.mt.co.kr/industry/2026/02/13/2026021213593142775,pos
2026-02-13 05:06,,포스코,"“포스코 회장님, 광양 청년 채용해 주세요”",장인화 포스코 그룹 회장에게 지역 청년들을 적극적으로 채용해달라고 호소하고 나서자 지역사회도 호응하고 있다. 12일 광양시의회에 따르면 최 의장은 지난 9일 장 회장에게 보낸 서한문에서 포스코 그룹의 대규모 채용...,https://www.seoul.co.kr/news/publicnews/local_govern/news_local/2026/02/13/20260213019007?wlog_tag3=naver,pos
2026-02-13 05:02,세계일보,포스코,"[경제 단신] 포스코, 함정용 고연성강·방탄강 첫 개발 외","포스코의 신 방산 소재를 적용한 차세대 함정 가상 이미지. 포스코 제공 포스코, 함정용 고연성강·방탄강 첫 개발 포스코가 함정용 고(高)연성강과 방탄강을 국내 최초로 개발하고, 지난달 한국선급(KR)으로부터 선급...",https://www.segye.com/newsView/20260212513477?OutUrl=naver,pos
2026-02-13 00:16,,포스코,"피지컬 AI·휴머노이드 로봇 관련주, '웃음' 아이엘·포스코DX·케이엔에...","11일 한국거래소에 따르면 아이엘, 포스코DX, 케이엔에스, 삼성전자, 기아, 한라캐스트는 상승했다. 아이엘과 포스코DX와 케이엔에스는 전 거래일 대비 각각각 855원, 3550원, 1060원 오른 5360원과 4만1150원 그리고...",http://www.finomy.com/news/articleView.html?idxno=249706,pos
2026-02-12 21:38,,포스코,포스코 차세대 소재로 제작된 '함정' 오대양 누빌 날 머지않았다!… 방...,포스코가 함정용 소재 기술 개발을 통해 대한민국 방위산업에 새로운 이정표를 세웠다. 포스코는 함정용 고(高)연성강과 방탄강을 국내 최초로 개발하고 지난 1월 한국선급(KR)으로부터 선급 인증을 획득했다. 이번...,https://www.polinews.co.kr/news/articleView.html?idxno=722939,pos
2026-02-12 21:38,,포스코,포스코 의 차세대 소재로 제작된 '함정' 오대양 누빌 날 머지않았다!…...,포스코가 함정용 소재 기술 개발을 통해 대한민국 방위산업에 새로운 이정표를 세웠다. 포스코는 함정용 고(高)연성강과 방탄강을 국내 최초로 개발하고 지난 1월 한국선급(KR)으로부터 선급 인증을 획득했다. 이번...,https://www.polinews.co.kr/news/articleView.html?idxno=722939,pos
2026-02-12 20:46,뉴스웨이,포스코,"광양제철소, 포스코그룹 첫 신입사원으로 구성된 재능봉사단 발대",포스코 광양제철소(소장 고재윤)가 지난 11일 포스코인재창조원 광양캠퍼스에서 포스코그룹 최초로 신입사원들로만 구성된 'Art in 또래 재능봉사단'을 창단하며 MZ세대가 주축이 된 나눔활동의 첫 시작을 알렸다. 또래...,https://www.newsway.co.kr/news/view?ud=2026021220061492304,pos
2026-02-12 20:35,,포스코,"포스코, 차세대 함정용 신소재 ‘선급 인증’…“K-방산 새 이정표”","포스코가 함정용 소재 기술 개발을 통해 대한민국 방위산업에 새로운 이정표를 세웠다.포스코는 함정용 고(高)연성강과 방탄강을 국내 최초로 개발하고, 지난 1월 한국선급(KR)으로부터 선급 인증을 획득했다. 이번 인증은...",https://www.ksmnews.co.kr/news/view.php?idx=590768,pos
2026-02-12 20:20,대경일보,포스코,포스코 국가유공자 지원사업 칭찬 받을 만하다,포스코1%나눔재단이 11일 국가보훈부와 국가와 국민을 위해 일하다 부상을 입은 국가유공자의 신체 재활과 사회복귀 지원을 위한 업무협약(MOU)을 체결했다. 포스코그룹은 임직원들의 매월 급여의 1% 기부로 운영되는...,https://www.dkilbo.com/news/articleView.html?idxno=533984,pos
2026-02-12 20:16,대경일보,포스코,"포스코, 차세대 함정 소재 기술 새 기준 제시","포스코 제공 포스코가 함정용 소재 기술 개발을 통해 대한민국 방위산업에 새로운 이정표를 세웠다. 포스코는 함정용 고(高)연성강과 방탄강을 국내 최초로 개발하고, 지난 1월 한국선급(KR)으로부터 선급 인증을...",https://www.dkilbo.com/news/articleView.html?idxno=533943,pos
2026-02-12 19:48,비즈니스코리아,POSCO INTERNATIONAL,POSCO International Begins US Rare Earth Production Next Year,POSCO International will begin its first rare earth production in the United States next year through a joint venture established with a U.S. company. The company has also decided to acquire an...,https://www.businesskorea.co.kr/news/articleView.html?idxno=263224,pos
2026-02-12 19:47,,POSCO International,POSCO International Begins US Rare Earth Production Next Year - Businesskorea,"<a href=""https://news.google.com/rss/articles/CBMidEFVX3lxTFBrQWRMRUJEc3diUDJqdnQxS0JnVV90QVFMREpQdFdLa2lEQXpaWnhZYWdOZTRrV3NCNEZPNWFtZmY0YzVpMU1QSmRCQTVzSlNZTGV3M2YzLVdOZzRsUnBldVV0cllnUFp0SzBiaHNZQnRFV0Fv?oc=5"" target=""_blank"">POSCO International Begins US Rare Earth Production Next Year</a> <font color=""#6f6f6f"">Businesskorea</font>",https://news.google.com/rss/articles/CBMidEFVX3lxTFBrQWRMRUJEc3diUDJqdnQxS0JnVV90QVFMREpQdFdLa2lEQXpaWnhZYWdOZTRrV3NCNEZPNWFtZmY0YzVpMU1QSmRCQTVzSlNZTGV3M2YzLVdOZzRsUnBldVV0cllnUFp0SzBiaHNZQnRFV0Fv?oc=5,pos
2026-02-12 19:20,,포스코,"""쇠 깎는 현장에 AI 심었다""… 포스코DX, 'K-제조업'의 디지털 뇌가 되다",스마트팩토리와 산업용 로봇 자동화를 주도하는 포스코DX는 그룹사의 ESS 엔지니어링 역량 강화 소식에 전 거래일 대비 9.44% 급등한 4만 1150원에 장을 마쳤다. 30여 년간 포스코 그룹의 ICT를 전담해온 포스코DX가 이제는...,https://www.pinpointnews.co.kr/news/articleView.html?idxno=429267,pos
2026-02-12 18:32,,구동모터코어,"AI로 차량 센서 덜고 고장 예측까지... ST, AI 품은 차량 MCU 공개","기존 MCU 코어 대비 최대 30배 효율이 높다고 ST는 설명했다. 물리 센서를 대체하는 가상 센서, 고장을... 인버터는 배터리의 직류(DC) 전력을 모터 구동용 교류(AC)로 바꾼다. 온보드충전기(OBC:On-Board Charger)는...",https://www.thelec.kr/news/articleView.html?idxno=52417,pos
2026-02-12 18:29,,포스코,포스코 '함정용 신소재' 선급 인증 획득,포스코가 함정용 고연성강과 방탄강을 국내 최초로 개발하고 지난달 한국선급(KR)으로부터 선급 인증을... 포스코는 지난해 5월 열린 '국제해양방산전시회 MADEX'와 함정기술·무기체계 세미나에서 해당 기술 개발 현황을...,http://www.fnnews.com/news/202602121828530244,pos
2026-02-12 18:24,경북일보,포스코,"포스코, 함정용 고연성강·방탄강 한국선급 인증 획득","포스코가 국내 최초로 개발한 함정용 고연성강과 방탄강이 한국선급(KR)으로부터 선급 인증을 획득, 대한민국 방위산업에 새로운 이정표를 세웠다. 포스코는 12일 국내 최초 개발한 함정용 고연성과과 방탄강에 대해...",https://www.kyongbuk.co.kr/news/articleView.html?idxno=4064526,pos
2026-02-12 18:22,이코노미톡뉴스,포스코,"포스코, 글로벌 톱티어 방탄·고연성강 개발…함정 기술 선도","포스코가 함정용 소재 기술 개발을 통해 대한민국 방위산업에 새로운 이정표를 세웠다. 포스코는 함정용 고(高)연성강과 방탄강을 국내 최초로 개발하고, 지난 1월 한국선급(KR)으로부터 선급 인증을 획득했다고 12일...",http://www.economytalk.kr/news/articleView.html?idxno=417826,pos
2026-02-12 18:20,,구동모터코어,"전기차 관련주, '봄바람 살랑살랑' 뉴인텍·화신·아진전자부품·금호에...",삼화전자는 페라이트 코어를 비롯한 전자기기 부품을 제조·판매하며 국내외 시장에서 활발히 사업을... 전기차용 구동모터 생산에도 나서고 있다. 또한 급발진 사고 예방을 위한 '페달 오조작 방지 장치' 기술을...,http://www.finomy.com/news/articleView.html?idxno=249699,pos
2026-02-12 18:10,,구동모터코어,"희귀금속·희토류 관련주, '봄꽃만개' 현대비앤지스틸·그린리소스·POS...",전기차 구동모터와 휴머노이드 로봇 관절 모터에 필수적으로 사용되는 희토류 네오디뮴 가격이 1년 새 두... 삼화전자는 페라이트 코어를 비롯한 전자기기 부품을 제조·판매하며 국내외 시장에서 활발히 사업을...,http://www.finomy.com/news/articleView.html?idxno=249697,pos
2026-02-12 17:50,잡포스트,포스코,"포스코엠텍 주가, 2월 12일 20,200원 3.80% 상승 마감","12일 KRX 마감 기준, 네이버페이 증권에 따르면 포스코엠텍의 주가는 지난 종가 19,460원 대비 상승하여 20,200원으로 장을 마쳤다. 이는 740원 오른 것으로, 3.80%의 상승률을 기록했다. 포스코엠텍은 시가 19...",https://www.job-post.co.kr/news/articleView.html?idxno=207437,pos
2026-02-12 17:44,,포스코,"[들어보니]포스코“차세대 함정, 소재가 생존성 결정…스펙 업으로 표준...",포스코가 함정용 고연성강과 방탄강 선급 인증에 성공하면서 향후 해상 방위산업 경쟁이 단순한 국산화... 포스코가 개발한 고연성강은 기존 대비 연신율을 35% 향상해 충격 흡수율을 약 58% 끌어올렸고 방탄강은 두께를 30...,https://www.nspna.com/news/?mode=view&newsid=802860,pos
2026-02-12 17:44,,포스코,[2월 12일 고용24 채용정보] 포스코휴먼스·인천동구청·메가엔에스아이...,"■ (주)포스코휴먼스, 클리닝 장애인 체험형 인턴(포항·광양) 채용 ▷지원자격 : 신입 / 학력무관... 15-1, 포스코휴먼스 (동촌동) ▷근무시간 : (오전) 7시 30분 ~ (오전) 11시 30분 외 지역별, 오전·오후 협의 후 결정...",https://www.news2day.co.kr/article/20260212500366,pos
2026-02-12 17:42,미디어펜,포스코,"포스코, 차세대 함정 소재 개발…‘국내 첫 선급 인증’","포스코가 함정용 소재 기술 개발을 통해 K-방산에 새로운 이정표를 세웠다. 포스코는 함정용 고연성강과 방탄강을 국내 최초로 개발하고, 지난 1월 한국선급(KR)으로부터 선급 인증을 획득했다고 12일 밝혔다. 이번 인증은...",https://www.mediapen.com/news/view/1081476,pos
2026-02-12 17:38,,포스코,"포스코, 국내 최초 함정용 고연성강·방탄강 개발…한국선급 인증",기자 포스코가 함정용 소재 기술 개발을 통해 대한민국 방위산업에 새로운 이정표를 세웠다. 포스코는 함정용 고연성강과 방탄강을 국내 최초로 개발하고 지난 1월 한국선급(KR)으로부터 선급 인증을 획득했다고 12일...,https://www.eroun.net/news/articleView.html?idxno=73381,pos
2026-02-12 17:22,,포스코,포스코이앤씨와 함께 '따뜻한 마음잇기'로 설 명절 온정 나눔,12일 포스코이앤씨 송도사옥에서 열린 포스코이앤씨 임직원과 함께하는 따뜻한 마음잇기 봉사활동에서 포스코이앤씨 임직원들이 수제청을 만들고 있다. 사진=포스코이앤씨 포스코이앤씨는 12일 인천시사회복지협의회와...,https://www.joongboo.com/news/articleView.html?idxno=363717256,pos
2026-02-12 17:16,,포스코인터,"[단독] 포스코, 미국서 희토류 생산…공급망 첫 합류",포스코인터내셔널이 내년 미국에서 합작사를 통해 희토류와 영구자석을 처음으로 생산하는 것으로 한국경제TV 취재 결과 확인됐습니다. 글로벌 광물전쟁이 격화되는 가운데 핵심 자원인 희토류 공급망에 우리 기업이...,https://www.wowtv.co.kr/NewsCenter/News/Read?articleId=A202602120391&t=NNv,pos
2026-02-12 17:06,,포스코,"포스코, 함정용 고(高)연성강·방탄강 국내 최초 개발…KR 인증 획득",포스코가 개발한 신(新) 방산 소재를 적용한 차세대 함정 가상 이미지. 사진=포스코 제공 매일일보 = 정경화 기자 | 포스코가 함정용 소재 기술 개발을 통해 대한민국 방위산업에 새로운 이정표를 세웠다. 함정 안전성과...,https://www.m-i.kr/news/articleView.html?idxno=1337163,pos
2026-02-12 17:00,,포스코,"포스코이앤씨, 사람 죽어도 '시정명령'뿐?...중대재해법 칼날 앞 '장인화...","포스코그룹이 장인화 회장 체제 아래 '안전 경영'과 'ESG 강화'를 전면에 내세웠음에도 불구하고, 핵심 계열사인 포스코이앤씨의 현장 안전 관리 체계는 여전히 '낙제점' 수준인 것으로 드러났다. 지난해 4월 수도권...",https://www.upkoreanews.kr/news/articleView.html?idxno=97100,pos
2026-02-12 16:58,,포스코,포스코 차세대 함정강 개발…국내 첫 선급 인증,포스코가 차세대 함정용 고연성강과 방탄강을 국내 최초로 개발해 한국선급(KR) 인증을 획득하며 해군 전력과 방산 소재 기술 경쟁력 강화에 나섰다. 포스코는 함정용 고연성강과 방탄강을 개발하고 지난 1월 한국선급...,https://www.g-enews.com/view.php?ud=202602121654501226112616b072_1,pos
2026-02-12 16:50,,포스코,"포스코, '자체 개발' 함정용 방탄강 선급 인증…""흔들려도 이상무""","첨단 무기체계 구역에 적용 ""더 두껍고 가볍게"" 안정성↑ 2025 MADEX서 국내외 호평 포스코가 국내 최초로... 12일 포스코는 함정용 고(高)연성강과 방탄강을 국내 최초로 개발하고, 지난 1월 한국선급(KR)으로부터 선급...",https://www.asiatoday.co.kr/view.php?key=20260212010004691,pos
2026-02-12 16:40,,포스코,"포스코광양제철소 에너지부, 용장마을 어르신들께 설 맞이 따뜻한 나눔",26년째 이어온 상생 실천으로 지역사회에 온정과 희망 전해 광양시 골약동은 포스코광양제철소 에너지부... 골약동 관계자는 “오랜 기간 한결같이 지역과 동행해 온 포스코광양제철소 에너지부에 깊이 감사드린다”며...,https://www.nspna.com/news/?mode=view&newsid=802785,pos
2026-02-12 16:38,,포스코,"포스코, 함정용 특수강 개발…K-방산 수출 확대 기반 마련","(사진=포스코) 포스코가 함정 생존성과 방호 성능을 동시에 끌어올릴 수 있는 특수 강재를 국내 최초로 개발했다. 단순한 소재 개선을 넘어, 차세대 해군 전력의 기반을 다지는 기술적 성과라는 평가다. 포스코는 함정용...",http://www.biztribune.co.kr/news/articleView.html?idxno=348930,pos
2026-02-12 16:34,,포스코,"[철강 레이더] 포스코, 함정용 고연성강·방탄강 국내 최초 개발…K-방산...","◆ 포스코, 차세대 함정용 강재 개발…K-방산 수출 기대감 포스코가 함정용 고연성강과 방탄강을 국내 최초로 개발하고, 지난 1월 한국선급(KR) 인증을 획득했다. 이미지는 신(新) 방산 소재를 적용한 차세대 함정 가상...",http://www.thevaluenews.co.kr/news/view.php?idx=196997,pos
2026-02-12 16:30,,포스코,"광양제철소, 신입사원 재능봉사단 출범…포스코 그룹 최초","MZ 직원들, 자발적 봉사단 구성 포스코 광양제철소(소장 고재윤)는 포스코그룹 최초로 신입사원들로만 구성된 'Art in 또래 재능봉사단'이 출범했다고 12일 밝혔다. 전날 포스코인재창조원 광양캠퍼스에서 발대식을 열고...",https://www.pressian.com/pages/articles/2026021216283774850?utm_source=naver&utm_medium=search,pos
2026-02-12 16:20,,포스코,"포스코, 함정용 고연성강·방탄강 국내 첫 선급 인증…글로벌 톱티어 성...","포스코가 함정용 고연성강과 방탄강을 국내 최초로 개발했다. 포스코는 지난 1월 국내 최초로 개발한 함정용 고연성강과 방탄강에 대해 한국선급(KR) 선급 인증을 획득했다고 12일 밝혔다. 강재 설계부터 생산, 용접성 검증...",http://www.updownnews.co.kr/news/articleView.html?idxno=316240,pos
2026-02-12 16:20,세계일보,포스코,"포스코, 차세대 함정 소재 기술의 새 기준 제시","기대 포스코가 함정용 소재 기술 개발을 통해 대한민국 방위산업에 새로운 이정표를 세웠다. 포스코는 함정용 고(高)연성강과 방탄강을 국내 최초로 개발하고, 지난 1월 한국선급(KR)으로부터 선급 인증을 획득했다고...",https://www.segye.com/newsView/20260212517058?OutUrl=naver,pos
