날짜,매체명,검색키워드,기사제목,주요기사 요약,URL,sentiment
2026-01-22 10:54,뉴스웨이,포스코,"[단독]'강북 알짜' 중림동 재개발, 포스코이앤씨 단독 응찰 유력",이에 따라 내부적으로 입찰 참여를 확정한 포스코이앤씨의 단독 입찰 가능성이 커지고 있다. 22일... 앞선 지난달 시공사 현장 설명회에는 롯데건설과 포스코이앤씨 외에도 대우건설·GS건설·SK에코플랜트·한화건설부문...,https://www.newsway.co.kr/news/view?ud=2026012210275529390,pos
2026-01-22 10:54,,포스코,"포스코퓨처엠 주가, 1월 22일 장중 214,000원 6.73% 상승","따르면 포스코퓨처엠 주가가 강한 상승 흐름 속에서 거래되고 있다. 현재가는 214,000원으로, 지난 종가 200,500원 대비 13,500원, 즉 6.73%의 뚜렷한 상승폭을 기록하고 있다. 포스코퓨처엠의 주가는 201,500원의...",https://www.joongangenews.com/news/articleView.html?idxno=488712,pos
2026-01-22 10:52,,삼척블루파워,"삼척블루파워, 발전소 환경정화활동 실시",삼척블루파워는 최근 깨끗하고 안전한 사업장 조성을 위해 발전소 전역에서 ‘발전소 환경정화 캠페인’을 실시했다고 22일 밝혔다. 이번 캠페인에는 강규봉 사장을 비롯한 임직원들이 자율적으로 참여해 주요 설비와...,http://www.shinailbo.co.kr/news/articleView.html?idxno=2181276,pos
2026-01-22 10:46,파이낸셜포스트,구동모터코어,"볼보자동차, 새로운 순수 전기 SUV 'EX60' 세계 최초 공개","시스템, '휴긴코어(HuginCore)'로 구동된다. 여기에는 ▲셀-투-보디(Cell-to-Body) 기술 ▲차세대 자체 개발 전기 모터 ▲새로운 배터리 셀 설계 ▲메가 캐스팅(Mega casting) 기술 등 에너지 효율과 주행거리를 향상할 수...",https://www.financialpost.co.kr/news/articleView.html?idxno=245119,pos
2026-01-22 10:46,,구동모터코어,"볼보, 순수 전기 SUV ‘EX60’ 첫 공개...10분 충전에 340km","EX60은 차세대 전기차 플랫폼 SPA3를 기반으로 하며, 볼보의 새로운 핵심 시스템인 ‘휴긴코어(HuginCore)’로 구동된다. 셀-투-바디 구조, 차세대 전기 모터, 신규 배터리 셀 설계, 메가 캐스팅 기술 등을 적용해...",https://www.sportsseoul.com/news/read/1580335?ref=naver,pos
2026-01-22 10:43,,포스코,"인천글로벌시티·포스코이앤씨, 1천억대 공사비 소송 종결…250억 증액",인천글로벌시티와 포스코이앤씨의 1천억대 공사비 청구 소송이 250억원 증액으로 마무리했다. 22일 인천글로벌시티에 따르면 최근 법원의 화해조정을 받아들이고 오는 23일 포스코이앤씨와 합의 금액 250억원을 최종...,https://www.kyeonggi.com/article/20260122580072,pos
2026-01-22 10:33,,구동모터코어,"볼보, 전기 SUV 'EX60' 공개…구글 제미나이 탑재","EX60은 차세대 전기차 아키텍처 SPA3를 기반으로 하며, 볼보자동차의 새로운 핵심 시스템 ‘휴긴코어’로 구동된다. 여기에는 ▲셀-투-바디 기술 ▲차세대 자체 개발 전기 모터 ▲새로운 배터리 셀 설계 ▲메가 캐스팅...",https://zdnet.co.kr/view/?no=20260122101744,pos
2026-01-22 10:32,,구동모터코어,"볼보, 810km 달리는 중형 전기 SUV ‘EX60’ 최초 공개","차량은 볼보의 차세대 전기차 아키텍처인 SPA3를 기반으로 하며, 신규 핵심 시스템 ‘휴긴코어(HuginCore)’를 통해 구동된다. 셀-투-바디, 메가 캐스팅, 차세대 셀·모터 등 효율 중심 기술을 집약해 에너지 효율과...",https://www.mk.co.kr/article/11939993,pos
2026-01-22 10:28,,포스코,인천글로벌시티-포스코 공사비 소송 종결 250억 증액 합의,상대로 포스코이앤씨가 제기한 대규모 공사비 청구소송이 마무리됐다. 양측은 법원의 화해 조정을 받아들이고 내일(23일) 합의금액을 최종 정산한다. ㆍ[단독] 포스코이앤씨 송도 공사비 1026억 증액 요구 소송 일단락...,https://www.incheontoday.com/news/articleView.html?idxno=314295,pos
2026-01-22 10:26,,포스코,송도재외동포타운 분쟁 종결…포스코이앤씨-인천글로벌시티 합의로 3단...,포스코이앤씨와 인천시 출자사인 인천글로벌시티 간의 공사비 증가를 둘러싼 소송이 법원의 조정으로 합의됐다. 포스코이앤씨는 인천글로벌시티를 상대로 송도재외동포타운 2단계 공사에 대해 추가 공사비 지급을...,https://www.gokorea.kr/news/articleView.html?idxno=855047,pos
2026-01-22 10:16,,구동모터코어,"볼보, EX60 세계 최초 공개···'브랜드 첫 순수 전기 중형 SUV'",EX60은 볼보의 차세대 전기차 아키텍처 SPA3을 기반으로 새로운 핵심 시스템이 '휴긴코어'로 구동된다. 여기에는 △셀-투-바디 기술 △차세대 자체 개발 전기 모터 △새로운 배터리 셀 설계 △메가 캐스팅(Mega casting)...,https://www.seoulfn.com/news/articleView.html?idxno=619111,pos
2026-01-22 10:14,,구동모터코어,"볼보, 전기 SUV ‘EX60’ 세계 최초 공개⋯ 주행거리 최대 810㎞","EX60은 차세대 전기차 아키텍처 SPA3를 기반으로 하며, 볼보의 새로운 핵심 시스템, ‘휴긴코어’로 구동된다. 여기에는 △셀-투-바디 기술 △차세대 자체 개발 전기 모터 △새로운 배터리 셀 설계 △메가 캐스팅...",https://www.viva100.com/article/20260122500357,pos
2026-01-22 10:14,데일리한국,구동모터코어,"볼보자동차, 신형 전기 SUV 'EX60' 최초 공개",사진=볼보자동차코리아 제공 새 차는 볼보자동차의 새로운 핵심 시스템인 '휴긴코어'(HuginCore)로 구동된... 또 △셀-투-바디(Cell-to-Body) 기술 △차세대 자체 개발 전기 모터 △새로운 배터리 셀 설계 △메가 캐스팅...,https://daily.hankooki.com/news/articleView.html?idxno=1325693,pos
2026-01-22 10:10,,포스코인터내셔널,"포스코인터내셔널 주가, 1월 22일 장중 62,500원 0.16% 상승","|중앙이코노미뉴스 이상민 기자|출처=네이버페이 증권 22일 오전 9시 45분 기준, 네이버페이 증권에 따르면 포스코인터내셔널이 현재 62,500원을 기록하며 지난 종가 대비 소폭 상승했다. 코스피 시장에서...",https://www.joongangenews.com/news/articleView.html?idxno=488652,pos
2026-01-22 10:09,아시아경제,구동모터코어,"볼보, 순수 전기 SUV 'EX60' 세계 최초 공개 ""게임체인저""","차세대 전기차 아키텍처 SPA3를 기반으로, 새로운 핵심 시스템 '휴긴코어(HuginCore)'로 구동된다. ▲셀-투-바디 기술 ▲차세대 자체 개발 전기 모터 ▲새로운 배터리 셀 설계 ▲메가 캐스팅 기술 등 에너지 효율과...",https://view.asiae.co.kr/article/2026012210091231020,pos
2026-01-22 10:09,,구동모터코어,"볼보, 새로운 순수 전기 SUV 'EX60' 세계 최초 공개","차세대 전기차 아키텍처 SPA3를 기반으로 하며, 볼보자동차의 새로운 핵심 시스템, '휴긴코어(HuginCore)'로 구동된다. 여기에는 △셀-투-바디(Cell-to-Body) 기술 △차세대 자체 개발 전기 모터 △새로운 배터리 셀 설계...",http://www.inews24.com/view/1930608,pos
2026-01-22 10:06,,POSCO International,Is It Time To Consider Buying Posco International Corporation (KRX:047050)? - simplywall.st,"<a href=""https://news.google.com/rss/articles/CBMi6AFBVV95cUxPelhSTEF1elprdTN0aUc1N2NudF90U1FvaHlDRVY0bXZMdG5UZ0xYQlFZcGk5Tk9ZbkFVR283b2Z1VXRTLUhnUW44c0NhUVRZUlhYSERsQ3psdVQ5c3V6d29NTjhsOVNDU280amJOQmV1WEhPRXg0Y2daZENqZkxSXzlsaHFlazRoc2pIaVQ0OUhiQ2U0aDBiRXZzVFlqSWEzVmlrQVNGQ3JwZmJ6LW04cUgxdVFSN002VXJTcGlHb3FURXEyZy1NV1QyZXlwSlQ3TGlzTXZncGNjNm9DTGJrb1FiRUdZalBM0gHuAUFVX3lxTE1HdlBZQklja0tNZXFGRTFjcUltSUdVR25qenQybjJoY3I1dTVUbkZtU2VjUmtZbWFkWmQwVlFyUDdZMnRhM2Z0SFVsTWcxdFVyQl95M2tkTXR5V2l6MjNFc244SEdOMklWYWppS1czVHhqc0JoSTNMWmhVQndRRlpCTEx4cHg4YllNMzRfZVB2OHBPaDhfOGlHaUxBUnh1OXJ3R3VxeE83WFQ4ZXpMNXotanF6QkRSbG5uNktBRUtBQ294NkNTUURyNmtRZEJVRTVSd25EWGxyR1UyNEJoMDBUM2thY3NQcjV1bUZST0E?oc=5"" target=""_blank"">Is It Time To Consider Buying Posco International Corporation (KRX:047050)?</a> <font color=""#6f6f6f"">simplywall.st</font>",https://news.google.com/rss/articles/CBMi6AFBVV95cUxPelhSTEF1elprdTN0aUc1N2NudF90U1FvaHlDRVY0bXZMdG5UZ0xYQlFZcGk5Tk9ZbkFVR283b2Z1VXRTLUhnUW44c0NhUVRZUlhYSERsQ3psdVQ5c3V6d29NTjhsOVNDU280amJOQmV1WEhPRXg0Y2daZENqZkxSXzlsaHFlazRoc2pIaVQ0OUhiQ2U0aDBiRXZzVFlqSWEzVmlrQVNGQ3JwZmJ6LW04cUgxdVFSN002VXJTcGlHb3FURXEyZy1NV1QyZXlwSlQ3TGlzTXZncGNjNm9DTGJrb1FiRUdZalBM0gHuAUFVX3lxTE1HdlBZQklja0tNZXFGRTFjcUltSUdVR25qenQybjJoY3I1dTVUbkZtU2VjUmtZbWFkWmQwVlFyUDdZMnRhM2Z0SFVsTWcxdFVyQl95M2tkTXR5V2l6MjNFc244SEdOMklWYWppS1czVHhqc0JoSTNMWmhVQndRRlpCTEx4cHg4YllNMzRfZVB2OHBPaDhfOGlHaUxBUnh1OXJ3R3VxeE83WFQ4ZXpMNXotanF6QkRSbG5uNktBRUtBQ294NkNTUURyNmtRZEJVRTVSd25EWGxyR1UyNEJoMDBUM2thY3NQcjV1bUZST0E?oc=5,pos
2026-01-22 10:02,,구동모터코어,볼보 'EX60' 드디어 공개됐다…주행거리 810km '동급 최고',‘휴긴코어’로 구동된다. 여기에는 ▲셀-투-바디 기술 ▲차세대 자체 개발 전기 모터 ▲새로운 배터리 셀 설계 ▲메가 캐스팅 기술 등 에너지 효율과 주행거리를 향상시킬 수 있는 기술들이 포함된다. 디자인...,https://www.dailian.co.kr/news/view/1601270/?sc=Naver,pos
2026-01-22 10:01,,구동모터코어,"볼보자동차, 순수 전기 SUV ‘EX60’ 글로벌 최초 공개","EX60은 차세대 전기차 아키텍처 SPA3를 기반으로 하며, 볼보자동차의 새로운 핵심 시스템, ‘휴긴코어(HuginCore)’로 구동된다. 여기에는 △셀-투-바디(Cell-to-Body) 기술 △차세대 자체 개발 전기 모터 △새로운...",http://www.fnnews.com/news/202601220952375810,pos
2026-01-22 10:00,컨슈머타임스,구동모터코어,"볼보자동차, 순수 전기 SUV 'Volvo EX60' 세계 최초 공개","시스템, '휴긴코어(HuginCore)'로 구동된다. 여기에는 △셀-투-바디(Cell-to-Body) 기술 △차세대 자체 개발 전기 모터 △새로운 배터리 셀 설계 △메가 캐스팅(Mega casting) 기술 등 에너지 효율과 주행거리를 향상시킬 수...",https://www.cstimes.com/news/articleView.html?idxno=689625,pos
2026-01-22 09:56,,구동모터코어,"볼보자동차, 새 순수 전기 SUV 'EX60' 공개…주행거리 810㎞",시스템 '휴긴코어(HuginCore)'로 구동된다. 여기에는 ▲셀-투-바디 기술 ▲차세대 자체 개발 전기 모터 ▲새로운 배터리 셀 설계 ▲메가 캐스팅 기술 등 에너지 효율과 주행거리를 향상시킬 수 있는 기술들이 포함된다....,https://www.goodkyung.com/news/articleView.html?idxno=281239,pos
2026-01-22 09:46,,구동모터코어,"볼보차, 중형급 전기 SUV 'EX60' 글로벌 공개","시스템, '휴긴코어'로 구동된다. 또한, ▲셀-투-바디 기술 ▲차세대 자체 개발 전기 모터 ▲새로운 배터리 셀 설계 ▲메가 캐스팅 기술 등 에너지 효율과 주행거리를 향상시킬 수 있는 기술이 대거 적용됐다. 하칸...",https://www.lcnews.co.kr/news/articleView.html?idxno=121885,pos
2026-01-22 09:38,뉴스핌,구동모터코어,"볼보차, 순수 전기 SUV 'Volvo EX60' 세계 최초 공개","시스템, '휴긴코어(HuginCore)'로 구동된다. 여기에는 ▲셀-투-바디(Cell-to-Body) 기술 ▲차세대 자체 개발 전기 모터 ▲새로운 배터리 셀 설계 ▲메가 캐스팅(Mega casting) 기술 등 에너지 효율과 주행거리를 향상시킬 수...",https://www.newspim.com/news/view/20260122000213,pos
2026-01-22 09:36,,구동모터코어,"""제미나이 탑재·10분 충전에 340km""…볼보, 'EX60' 전기차 최초 공개","EX60은 볼보자동차의 새로운 핵심 시스템 '휴긴코어'로 구동된다. 이 시스템에는 셀-투-보디(Cell-to-Body) 기술, 차세대 자체 개발 전기 모터, 새로운 배터리 셀 설계, 메가 캐스팅(Mega casting) 기술 등 에너지 효율 및...",http://www.m-i.kr/news/articleView.html?idxno=1328245,pos
2026-01-22 09:30,,구동모터코어,"안전의 볼보, 구글 AI와 만났다, 'EX60·EX60 크로스 컨트리' 글로벌 공개","볼보 후긴코어(HuginCore) 최신 버전이 탑재된 EX60은 볼보 내부 개발진과 구글, 엔비디아, 퀄컴 등 역량이... ■ 동급 최장 주행 거리 810km 제공…10분 충전만에 최대 340km 주행 가능EX60은 후륜 전기 모터를 탑재한 P6...",https://www.cnet.co.kr/view/?no=20260121235011,pos
2026-01-22 09:28,,구동모터코어,'1회 충전 810㎞'..볼보 중형 전기차 EX60 공개,EX60은 휴긴코어를 기반으로 차가 스스로 사고하고 처리하며 반응할 수 있도록 설계됐다. 자체 기술 역량과... 후륜구동 방식의 P6 일렉트릭(최대 620㎞) 중 선택할 수 있다. 또한 모두 10년 배터리 보증을 제공한다. EX60은...,http://autotimes.co.kr/detail.php?number=686367&thread=27,neg
2026-01-22 09:27,이데일리,구동모터코어,"볼보자동차, 새로운 순수 전기 SUV 'Volvo EX60' 글로벌 첫 공개",‘휴긴코어(HuginCore)’로 구동된다. 여기에는 △셀-투-바디(Cell-to-Body) 기술 △차세대 자체 개발 전기 모터 △새로운 배터리 셀 설계 △메가 캐스팅(Mega casting) 기술 등 에너지 효율과 주행거리를 향상시킬 수 있는...,http://www.edaily.co.kr/news/newspath.asp?newsid=02745366645320344,pos
2026-01-22 09:08,,포스코인터내셔널,"포스코인터, 인니 팜오일 기업 잔여 주식 공개매수 착수",지분 34% 대상…인수액 최대 4300억원 지난해 지분 66% 인수하며 경영권 확보 포스코인터내셔널이 인도네시아 팜 기업 '삼푸르나 아그로'의 잔여 지분 공개매수에 나섰다. 22일 인니 증권거래소(IDX)에 따르면...,https://www.theguru.co.kr/news/article.html?no=97184,pos
2026-01-22 09:07,,포스코인터내셔널,"한국 탁구, 세계 최강 중국 주춤할 때 도약 노린다",이와 함께 혼합복식에서 새롭게 호흡을 맞춘 박강현(미래에셋증권)-김나영(포스코인터내셔널) 조도 값진 준우승을 수확했다. 중국의 실력을 검증할 수 있는 무대는 다음 달 19일부터 3월 1일까지 열리는 싱가포르...,https://www.jnilbo.com/news/articleView.html?idxno=90000020602,pos
2026-01-22 09:00,헤럴드경제,구동모터코어,"“모델 Y 한판 붙자”…볼보, 중형 전기 SUV ‘EX60’ 공개…WLTP 기준 최...","[볼보자동차 제공] EX60은 차세대 전기차 아키텍처 SPA3를 기반으로 하며, 볼보자동차의 새로운 핵심 시스템, ‘휴긴코어’로 구동된다. 여기에는 ▷셀-투-바디 기술 ▷차세대 자체 개발 전기 모터 ▷새로운 배터리 셀...",https://biz.heraldcorp.com/article/10660342?ref=naver,pos
2026-01-22 08:33,연합뉴스,포스코인터내셔널,"한국 탁구, 세계 최강 중국 '최악 부진' 속 도약 기회 살릴까",이와 함께 혼합복식에서 새롭게 호흡을 맞춘 박강현(미래에셋증권)-김나영(포스코인터내셔널) 조도 값진 준우승을 수확했다. 중국의 진짜 실력을 검증할 수 있는 무대는 다음 달 19일부터 3월 1일까지 열리는 싱가포르...,https://www.yna.co.kr/view/AKR20260122002200007?input=1195m,pos
2026-01-22 08:32,오토데일리,구동모터코어,"""전기 SUV 판 바꾼다"" 볼보 EX60 세계 최초 공개, 가장 현실적 SUV 될듯","최상위 P12 AWD 일렉트릭은 810km 주행거리를 제공하며, P10 AWD는 최대 660km, 후륜구동 P6 일렉트릭은 최대... 휴긴코어(HuginCore)를 중심으로 설계됐다. 메가 캐스팅 공법, 차세대 자체 개발 전기모터, 새로운 배터리 셀...",https://www.autodaily.co.kr/news/articleView.html?idxno=540950,pos
2026-01-22 07:56,철강금속신문,포스코인터,페로타임즈 손바닥뉴스 1월 22일(목),"본격화 포스코인터, LNG·희토류 성장 가속…밸류에이션 리레이팅 [핫토픽] 철근 수출 10년만에 최고 기록 ""미국향 폭증""…내수가 회복 지렛대 [인터뷰] ""7.01mm까지 갖췄다""… 대현특수강이 불황을 넘는 '한 끗 차이...",http://www.ferrotimes.com/news/articleView.html?idxno=45916,pos
2026-01-22 07:00,,포스코인터내셔널,"정부, 상생금융 1조7000억원 공급…기술탈취 기업 제재 대폭 강화",현대·기아차와 우리·국민은행이 출연하고 신보·기보·무보 등이 보증 지원하는 상생금융 프로그램은 1조3000억원으로 확대되며 포스코인터내셔널이 출연하고 신보가 보증하는 협력사 상생 프로그램도 150억원 규모로...,https://www.itbiznews.com/news/articleView.html?idxno=202184,pos
2026-01-22 00:16,,포스코인터,"방위산업·전쟁·테러 관련주, '룰루랄라 콧노래' 파이버프로·그린광학...","고주파 RF 및 인터커넥트 전문기업 센서뷰는 과학기술정보통신부가 소관하는 양자 플래그십 과제의... 플랜트 기자재, 선박엔진 구조재, 구조물 구조재, 풍력 기자재를 생산해 포스코이앤씨, 두산에너빌리티...",http://www.finomy.com/news/articleView.html?idxno=248148,pos
2026-01-22 00:10,,구동모터코어,"전기차 관련주, '봄날의 햇살' 삼화전기·우신시스템·HL만도·파워로직...",삼화전자는 페라이트 코어를 비롯한 전자기기 부품을 제조·판매하며 국내외 시장에서 활발히 사업을... 전기차용 구동모터 생산에도 나서고 있다. 또한 급발진 사고 예방을 위한 '페달 오조작 방지 장치' 기술을...,http://www.finomy.com/news/articleView.html?idxno=248147,pos
2026-01-21 21:34,,포스코,"포스코, 철강 물류 디지털 전환 가속","포스코 포항제철소가 제강 슬라브 야드에 스마트 자동화 시스템을 본격 도입해 작업 안전성과 운영 효율을... 이번 스마트 기술 개발은 포스코DX와 협업으로 추진됐다. 제강부 조재성 대리는 ""현장에서 반복되던 불필요한...",https://www.idaegu.co.kr/news/articleView.html?idxno=536545,pos
2026-01-21 20:52,,포스코인터내셔널,정기선·장인화·최윤범 다보스포럼 활동 본격화… 트럼프도 만날까,"포스코인터내셔널은 2025년 12월 국내 기업 중 처음으로 알래스카 LNG 개발 프로젝트 참여를 확정하고, 알래스카 LNG를 20년간 장기 구매하기로 했다. 포스코는 LNG 파이프라인 건설에 필요한 강재를 대량 공급할...",https://it.chosun.com/news/articleView.html?idxno=2023092155366,pos
2026-01-21 20:43,,포스코,"포스코퓨처엠 포항양극재공장, 사랑의 쌀 후원",㈜포스코퓨처엠 포항양극재공장 임직원들이 21일 동절기를 맞아 지역 내 취약계층을 돕기 위해 백미 10kg 80포(약 200만원 상당)를 흥해읍행정복지센터에 기부했다. 이번에 기부된 백미는 겨울철 생활에 어려움을 겪고 있는...,https://www.ksmnews.co.kr/news/view.php?idx=586769,pos
2026-01-21 20:10,,포스코인터내셔널,"정부, 대·중소기업 ‘모두의 성장’ 전략 가동",포스코인터내셔널 출연(10억원)과 신용보증기금 보증을 연계한 150억원 규모 협력사 지원 프로그램도 신설된다. 포스코(50억원)와 기업은행(150억원)이 출연하고 무역보험공사가 보증하는 4000억원 규모 철강산업...,https://www.kbmaeil.com/article/20260121500737,pos
2026-01-21 19:54,,포스코인터,1월 4주차 국내 ESG 핫클립,"포스코인터, 인니 팜유 사업 확대…RSPO 인증 농장 15만ha 확보 포스코인터내셔널이 인도네시아 팜유 사업을 대폭 확대했다. 인수한 현지 기업의 사명을 변경하고 이사회 체제를 개편했다. 확보한 농장 면적은 총 15만...",http://www.impacton.net/news/articleView.html?idxno=17692,pos
2026-01-21 19:42,,포스코,"장인화 포스코그룹 회장, 오늘 스위스 '다보스포럼' 참석",장인화 포스코그룹 회장이 22일 스위스 다보스에서 열리는 세계경제포럼(WEF·다보스포럼)에 참석한다. 장 회장은 지난해에 이어 올해 다보스포럼에 2년 연속 참석하는 것이다. 21일 포스코그룹에 따르면 장인화 회장은...,http://www.hidomin.com/news/articleView.html?idxno=605983,pos
2026-01-21 19:40,금강일보,포스코인터내셔널,[주식마감기사] 현대차 질주에 로봇주 '불기둥' 휴림에이텍 상한가... 에...,"포스코인터내셔널도 150억원 규모의 상생 프로그램을 별도로 운영한다. 상생협력에 참여하는 대기업에 대한 세제 인센티브도 강화된다. 대기업이 협력사 지원을 위해 무역보험기금에 출연할 경우, 출연금의 5~10%를...",https://www.ggilbo.com/news/articleView.html?idxno=1137336,pos
2026-01-21 19:40,대경일보,포스코,"포스코퓨처엠 포항양극재공장, 취약계층에 백미 80포 기탁",▲ 포스코퓨처엠 포항양극재공장 임직원들이 21일 동절기를 맞아 지역 내 취약계층을 돕기 위해 나섰다. 포항시 제공 포스코퓨처엠 포항양극재공장 임직원들이 21일 백미 10kg 80포(약 200만원 상당)를...,https://www.dkilbo.com/news/articleView.html?idxno=531071,pos
2026-01-21 19:36,비즈니스코리아,POSCO INTERNATIONAL,IFEZA Signs MOU for Cheongna I-CON City Project,"Cheongna International City. The MOU was concluded to establish a cooperative framework among... will participate as a financial investor and POSCO E&C Co., Ltd. will participate as the...",https://www.businesskorea.co.kr/news/articleView.html?idxno=261413,pos
2026-01-21 19:36,비즈니스코리아,POSCO INTERNATIONAL,IFEZ Signs MOU for Cheongna I-CON City Project,"Cheongna International City. The MOU was concluded to establish a cooperative framework among... will participate as a financial investor and POSCO E&C Co., Ltd. will participate as the...",https://www.businesskorea.co.kr/news/articleView.html?idxno=261413,pos
2026-01-21 18:20,,구동모터코어,"수소차 관련주, '함박웃음' 에스에너지·아진산업·SJG세종... '한숨' 폴...","반면 폴라리스세원, 아이에이, 한화솔루션, 두산퓨얼셀, 삼보모터스, 유일에너테크, DYP는 하락했다.... 타기구동장치 등 방산 장비의 국산화를 위한 연구개발에도 속도를 내고 있다. SOFC는 600~1,000℃의 고온에서 작동해...",http://www.finomy.com/news/articleView.html?idxno=248143,pos
2026-01-21 18:16,,구동모터코어,"자동차부품 관련주, '봄꽃만개' 티피씨글로벌·휴림에이텍·SJG세종·아진...","현대자동차, HD현대인프라코어 등 글로벌 OEM 및 1차 제조사에 자동차 엔진 부품을 공급하며 주요 고객과... 전기차용 구동모터 생산에도 나서고 있다. 또한 급발진 사고 예방을 위한 '페달 오조작 방지 장치' 기술을...",http://www.finomy.com/news/articleView.html?idxno=248142,neg
2026-01-21 18:08,,포스코,"'개관 1주년' 포스코미술관 광양, 미술체험·특강 진행",다채로운 프로그램으로 지역 문화예술 저변 확대 광양제철소(소장 고재윤)가 '포스코미술관 광양' 개장... 먼저 '요모조모 미술체험'은 임직원 가족을 대상으로 하는 미술 체험 프로그램으로서 '포스아트(포스코...,https://www.pressian.com/pages/articles/2026012117171562981?utm_source=naver&utm_medium=search,pos
2026-01-21 18:01,,포스코인터내셔널,"'신유빈 참가' 제79회 대한항공 전국남녀종합탁구선수권, 21일 제천에서...","주천희(삼성생명), 김나영(포스코인터내셔널), 최효주(대한항공), 박가현(대한항공), 양하은(화성도시공사), 이다은1, 2(한국마사회/미래에셋증권) 등 우승 후보들이 넘친다. 강원 삼척에서 치러진 지난해 대회...",https://www.starnewskorea.com/sports/2026/01/21/2026012116313425121,pos
2026-01-21 17:56,,포스코,"충주시, 서충주신도시 포스코 유휴부지 활용 정주여건 개선 방안 모색","특히, 지난해 9월 포스코이앤씨로부터 매입한 중앙탑면 용전리 703번지 일원(87,481... 한다”며 “포스코 유휴부지를 시민들이 원하는 시설로 채워 지역 내 완결형...",http://www.breaknews.com/1178523,pos
2026-01-21 17:55,중앙일보,POSCO INTERNATIONAL,"Incheon inks agreement with Kessler Collection, state land corporation on...","Cheongna International City. The agreement, signed at Incheon City Hall, is aimed at... and Posco E&C as the construction partner. Galaxy Corporation plans to directly operate several core...",https://koreajoongangdaily.joins.com/news/2026-01-21/business/industry/Incheon-inks-agreement-with-Kessler-Collection-state-land-corporation-on-Cheongna-ICON-City-complex/2505540,pos
2026-01-21 17:42,동아일보,포스코인터내셔널,"전국남녀종합탁구선수권, 제천서 개막…男女 단식 우승자엔 올해 국가대...","여자부 역시 이은혜(대한항공)가 2연패에 도전하는 가운데 주천희(삼성생명), 김나영(포스코인터내셔널), 박가현(대한항공), 양하은(화성도시공사) 등이 도전장을 내민다. 이밖에 주니어 유망주들 역시 종별 구분없이...",https://sports.donga.com/sports/article/all/20260121/133203870/1,pos
