날짜,매체명,검색키워드,기사제목,주요기사 요약,URL,sentiment
2026-04-01 15:18,,포스코인터,"포스코그룹, 철강 '원톱' 시대 저무나···그룹 내 2인자에 포스코인터...",철강 업황 둔화로 기존 핵심 계열사인 포스코의 배당 기여도가 낮아진 반면 포스코인터내셔널이 빠르게 공백을 메우며 그룹 내 위상이 높아지는 모습이다. ◇철강 배당 급감 두드러져 1일 금융감독원 전자공시시스템...,https://www.sisajournal-e.com/news/articleView.html?idxno=420194,pos
2026-04-01 15:16,,구동모터코어,"[현장] ""역사상 가장 안전한 차""…볼보, EX90로 전기차 개념 재정립",시스템 '휴긴 코어(Hugin Core)'를 적용한 첫 SDV다. 휴긴 코어는 향후 국내에 출시될 볼보 전기차의 기반이... 트윈 모터를 결합한 사륜구동(AWD) 기반 트윈 모터(Twin Motor) 및 트윈 모터 퍼포먼스(Twin Motor Performance)로...,https://www.ebn.co.kr/news/articleView.html?idxno=1704155,pos
2026-04-01 15:12,,포스코인터내셔널,"포스코인터내셔널, 소외된 이웃에게 '이심점심' 점심시간 활용 봉사",지역사회와 기업이 함께 상생하는 문화 창출에 기여 인천시사회복지협의회(이하 협의회)는 새학기를 맞아 포스코인터내셔널과 함께 ‘이심점심(以心點心) 봉사활동을 통해 소외된 이웃에 따뜻한 마음을 전한다고 밝혔다....,https://www.kgnews.co.kr/news/article.html?no=889939,pos
2026-04-01 15:11,,포스코인터내셔널,천리포수목원서 '멸종위기종의 날' 기념식…사람과 자연의 상생 메시지...,"인정서를 받은 기업은 두산퓨얼셀, 애경케미칼, 포스코인터내셔널, 한섬, 현대이지웰, 효성, HS효성첨단소재 등 7곳으로, 이들은 저어새·황새 등 총 17종 보호 활동에 참여하고 있다. 또 국립생태원과 서울대공원은...",http://www.dynews.co.kr/news/articleView.html?idxno=844818,pos
2026-04-01 15:08,,포스코인터내셔널,"정부, 중동 리스크 긴급 점검해 선제 대응","이 날 회의에는 농식품부 송미령 장관이 주재한 가운데 한국스마트팜산업협회, 삼양식품, 한국농기계공업협동조합, 포스코인터내셔널, 식품산업협회, 한국비료협회, 남해화학, 한국사료협회 등 영향이 우려되는 분야의...",http://www.hortitimes.com/news/articleView.html?idxno=33816,neg
2026-04-01 15:08,,포스코인터내셔널,"""고장 나면 24시간 내 해결""... 이노인스트루먼트, 파격 서비스로 글로...",조립식 샌드위치 패널 전문 에스와이와 글로벌 자원 개발 전문 포스코인터내셔널이 상승 중이다. 공작기계 전문 서암기계공업과 글로벌 종합 사업사인 현대코퍼레이션도 상승 대열에 합류했다. 엔지니어링 전문 유신과...,https://www.pinpointnews.co.kr/news/articleView.html?idxno=441930,pos
2026-04-01 15:00,,미얀마 LNG,"아시아, 에너지 '물물교환' 시대…인니·인도, 日과 연료 맞교환 추진","인니, 일본에 LNG 추가 공급하고 LPG 받는 방안 협의 일본 인펙스, 인도와 LPG↔나프타·원유 바터 논의 중국... 시행했으며, 미얀마는 차량 격일 운행제를 도입했다. 동남아 최대 경제국인 인도네시아도 수일 내 절감 조치를...",https://www.asiatoday.co.kr/view.php?key=20260401010000305,pos
2026-04-01 14:54,,구동모터코어,"'가장 안전한 車' 볼보 EX90, 프리미엄 EV 기준 새로 쓴다",또 회사가 자체 개발한 첨단 시스템 '휴긴 코어'를 적용해 '탈수록 안전하고 똑똑한 차'를 만들 예정이다..... 파워트레인은 106kWh 니켈·코발트·망간(NCM) 배터리와 차세대 트윈 모터를 결합한 사륜구동(AWD) 기반 트윈...,https://www.m-i.kr/news/articleView.html?idxno=1360704,pos
2026-04-01 14:54,,구동모터코어,다시 ‘안전 철학’을 꺼내든 볼보…대전환기의 EX90은 ‘SDV로 주도하는...,"볼보자동차는 자체 개발한 핵심 소프트웨어 시스템을 ‘휴긴 코어(Hugin Core™)’라 불렀고, EX90은 휴긴... 트윈 모터를 결합한 사륜구동(AWD) 기반 트윈 모터(Twin Motor) 및 트윈 모터 퍼포먼스(Twin Motor Performance)로...",http://www.osen.co.kr/article/G1112771712,pos
2026-04-01 14:52,,구동모터코어,"볼보코리아, '역사상 가장 안전한 차' EX90 출시…""年 2천대 판매 목표""",EX90의 핵심은 볼보가 자체 개발한 통합 컴퓨팅 시스템 '휴긴 코어'다. 차량 내 모든 시스템을 소프트웨어... 사륜구동 트윈 모터와 트윈 모터 퍼포먼스 두 가지로 출시된다. 트윈 모터는 최고 출력 456마력으로...,http://www.fnnews.com/news/202604011425324231,pos
2026-04-01 14:52,,구동모터코어,볼보 ‘EX90’ 본격 데뷔 ‘프리미엄 풀사이즈 전기 플래그십’[손재철...,‘휴긴 코어’ 시스템이 내장된 모델이다. 자동차 주행 중 발생하는 모든 데이터 및 주요 하드웨어를... 트윈 모터를 결합한 사륜구동 기반 트윈 모델 및 트윈 퍼포먼스로 구분 출시된다. 이 중 트윈 모델은 최대...,https://sports.khan.co.kr/article/202604011450003?pt=nv,pos
2026-04-01 14:26,뉴스1,구동모터코어,"볼보, 전기 SUV EX90 출시 ""가격 경쟁력 바탕 年 2천대 판매""(종합)","볼보의 통합 소프트웨어 제어 시스템 '휴긴 코어'를 적용, 차량이 안전 주행 관련 사안을 스스로 학습할... 파워트레인은 106㎾h 니켈·코발트·망간(NCM) 삼원계 배터리와 차세대 트윈 모터를 결합한 사륜구동(AWD) 기반...",https://www.news1.kr/industry/auto-industry/6121769,pos
2026-04-01 14:24,,구동모터코어,플래그십 전기 SUV 볼보 EX90의 '소프트웨어 자동차' 전략,"전기 아키텍처와 코어 컴퓨터, 존 컨트롤러를 통합한 '휴긴 코어(Hugin Core)'가 차량의 중심 역할을 맡는다.... EX90은 106㎾h 니켈·코발트·망간(NCM) 배터리를 기반으로 한 트윈 모터 사륜구동 시스템을 사용한다. 최고출력...",http://www.newsprime.co.kr/news/article.html?no=728888,pos
2026-04-01 14:22,,구동모터코어,"볼보, 충돌 제로 안전성 극대화한 'EX90' 국내 출시",볼보가 자체 개발한 통합 제어 시스템 '휴긴 코어'는 차량 내 센서 데이터를 신속히 분석해 지능형... 파워트레인은 106kWh 니켈·코발트·망간(NCM) 배터리와 차세대 트윈 모터를 결합한 사륜구동 기반 트윈 모터 및...,https://biz.newdaily.co.kr/site/data/html/2026/04/01/2026040100261.html,pos
2026-04-01 14:22,,구동모터코어,"이윤모 볼보코리아 대표 ""프리미엄 전기차 연 3만대 판매·점유율 10% 목...","EX90에는 볼보가 자체 개발한 '휴긴 코어'가 적용됐다. 차량 내 전기 아키텍처와 코어 컴퓨터, 센서... 파워트레인은 106kWh 배터리와 트윈 모터 기반 사륜구동(AWD)으로 구성된다. 800V 시스템을 적용해 급속 충전 시 약...",https://zdnet.co.kr/view/?no=20260401141239,pos
2026-04-01 14:14,,구동모터코어,"볼보, 순수 전기 플래그십 SUV EX90 출시…""1회 충전시 625km 주행""","사륜구동 기반 트윈 모터 및 트윈 모터 퍼포먼스로 출시된다. 트윈 모터 퍼포먼스 모델은 최대출력... EX90에는 볼보자동차가 자체 개발한 첨단 시스템인 '휴긴 코어'가 적용된다. 전기 아키텍처, 코어 컴퓨터, 존...",https://www.sentv.co.kr/article/view/sentv202604010148,pos
2026-04-01 14:12,,포스코,"포스코엠텍, 10년째 이어진 ‘급여 1%’ 사랑⋯미래세대 장학금 1000만 원...",포스코엠텍이 지역사회 미래세대의 학업 중단을 막기 위해 10년째 변함없는 온정을 이어가고 있다. 포스코엠텍은 지난달 31일 초록우산 경북지역본부와 함께 포항 선린애육원을 방문해 ‘2026년 미래세대를 위한 장학금’...,https://www.kbmaeil.com/article/20260331500696,neg
2026-04-01 14:08,,구동모터코어,"볼보, 전기 SUV 'EX90' 국내 출시…""1회 충전 625km""","핵심 시스템인 ‘휴긴 코어(Hugin Core)’는 전기 아키텍처와 코어 컴퓨터, 존 컨트롤러, 소프트웨어를... 파워트레인은 106kWh 니켈·코발트·망간(NCM) 배터리 기반 사륜구동(AWD) 트윈 모터와 트윈 모터 퍼포먼스...",https://www.dailian.co.kr/news/view/1628286/?sc=Naver,pos
2026-04-01 14:07,,포스코모빌리티솔루션,"LG CNS, 'RX 이노베이션 랩' 출범…IT업계 로봇 전환 사업 박차","지난 1월에는 포스코모빌리티솔루션과 글로벌 3대 산업용 로봇 제조사인 일본의 야스카와전기와 3자 업무협약을 체결했다. 포스코DX는 기존 생산 설비와 시스템에 연동할 수 있는 로봇 배치, 로봇 자동화 시스템의...",https://www.mt.co.kr/tech/2026/04/02/2026040111000633098,pos
2026-04-01 14:07,,포스코모빌리티솔루션,"LG CNS, 'RX 이노베이션 랩' 출범…IT업계 로봇 전환 사업 박차","지난 1월에는 포스코모빌리티솔루션과 글로벌 3대 산업용 로봇 제조사인 일본의 야스카와전기와 3자 업무협약을 체결했다. 포스코DX는 기존 생산 설비와 시스템에 연동할 수 있는 로봇 배치, 로봇 자동화 시스템의...",https://www.mt.co.kr/tech/2026/04/01/2026040111000633098,pos
2026-04-01 14:01,,포스코,"[단독]포스코홀딩스, 美 '리튬직접추출' 투자 잠정중단",더트래커 박현승 HSpark@thetracker.co.kr 더트래커 = 포스코홀딩스가 미국 유타주에서 추진 예정이던 ‘리튬직접추출(DLE) 사업을 잠정 중단했다. 1일 업계에 따르면 포스코홀딩스는 유타주에서 DLE 기술 실증을 위한...,https://thetracker.co.kr/View.aspx?No=4025638,pos
2026-04-01 13:58,,구동모터코어,"""내연기관보다 싸다""···볼보, EX90 앞세워 억대 전기차 경쟁 포문","트윈 모터 기반 사륜구동 시스템을 탑재했다. 기본 트윈 모터 모델은 최고 456마력, 제로백(정지... 자체 개발한 '휴긴 코어'를 기반으로 차량 기능을 소프트웨어 중심으로 통합했으며, 15년 무선 업데이트(OTA)를...",https://www.sisajournal-e.com/news/articleView.html?idxno=420188,pos
2026-04-01 13:58,,포스코인터내셔널,"인천사회복지협의회, 포스코인터내셔널 임직원과 함께 '이심점심' 봉사...","기호일보, KIHOILBO 인천시사회복지협의회가 포스코인터내셔널과 함께 소외된 이웃을 위한 '이심점심(以心點心) 봉사활동을 진행했다. <인천사회복지협의회 제공> 인천시사회복지협의회가 포스코인터내셔널과 함께 소외된...",https://www.kihoilbo.co.kr/news/articleView.html?idxno=3018229,pos
2026-04-01 13:54,,구동모터코어,"볼보코리아, 전기 SUV 'EX90' 출시…“안전성과 가격 우위”","EX90에는 볼보가 자체 개발한 '휴긴 코어'가 전기 아키텍처, 코어 컴퓨터, 존(Zone) 컨트롤러를 통합... 파워트레인은 106㎾h 니켈·코발트·망간(NCM) 배터리와 차세대 트윈 모터를 결합한 사륜구동(AWD) 기반 트윈 모터 및...",https://www.etnews.com/20260401000299,pos
2026-04-01 13:52,더퍼블릭,구동모터코어,"볼보, 전기 플래그십 SUV 'EX90' 국내 출시… ""타면 탈수록 진화""","핵심은 자체 개발한 '휴긴 코어(Hugin Core™)'다. 전기 아키텍처와 중앙 컴퓨터, 존(Zone) 컨트롤러... 파워트레인은 106kWh 배터리를 기반으로 한 사륜구동(AWD) 트윈 모터 방식이다. 기본형은 456마력, 퍼포먼스 모델은...",https://www.thepublic.kr/news/articleView.html?idxno=299536,pos
2026-04-01 13:42,,포스코,"‘8전 8패’ 포스코, 불법파견 소송 언제까지…사내하청에 “빠른 결정...","사내하청 노동자들이 제기한 불법파견 소송에서 8전 8패를 기록한 포스코가 소송을 지속할지를 두고 “빠른... ■불법파견 3·4차 소송, 대법 판결 앞둔 포스코 “빠른 결정” 1일 업계에 따르면 포스코는 협력사 노사...",https://www.busan.com/view/busan/view.php?code=2026040113251920091,pos
2026-04-01 13:34,이투데이,구동모터코어,[종합] 볼보 ‘EX90’ 국내 출격…가격 낮추고 안전ㆍSDV 승부수,동력 성능은 트윈 모터 사륜구동(AWD) 기반으로 최대 680마력까지 구현된다. 정지 상태에서 시속 100km까지... 차량에는 자체 개발한 ‘휴긴 코어(Hugin Core)’ 기반 통합 컴퓨팅 시스템이 탑재됐다. 차량 전반 데이터를...,https://www.etoday.co.kr/news/view/2571668,pos
2026-04-01 13:29,디지털타임스,구동모터코어,볼보 ‘EX90’ 국내 출격…“연 3만대 브랜드로 성장”,"전기 아키텍처, 코어 컴퓨터, 존(Zone) 컨트롤러 및 소프트웨어로 구성된 볼보의 ‘휴긴 코어’(Hugin Core)... EX90은 106kWh 니켈·코발트·망간(NCM) 배터리와 차세대 트윈 모터를 결합한 사륜구동 기반 트윈 모터 및 트윈...",https://www.dt.co.kr/article/12055109?ref=naver,pos
2026-04-01 13:25,,구동모터코어,"볼보, 전기 플래그십 SUV 'EX90' 국내 출시...연간 2000대 목표",EX90에는 볼보자동차가 자체 개발한 핵심 시스템인 '휴긴 코어(Hugin Core™)'가 적용된다. 전기 아키텍처... 트윈 모터를 결합한 사륜구동(AWD) 기반 트윈 모터(Twin Motor)와 트윈 모터 퍼포먼스(Twin Motor Performance)로...,http://www.inews24.com/view/1955843,pos
2026-04-01 13:22,,포스코,"박희정 포항시장 예비후보, ""포스코 58주년, 탄소중립 전환은 '안전·상...","박희정 포항시장 예비후보는 오늘(1일) 포스코 창립 58주년을 맞아 ""포항은 대한민국 철강의 심장이자... 오늘의 포스코가 있다""며 ""지역사회와 함께 만든 성과인 만큼, 앞으로의 전환 역시 지역의 환경과 안전, 하청노동자...",https://news.bbsi.co.kr/news/articleView.html?idxno=4075465,pos
2026-04-01 12:38,이데일리,구동모터코어,"볼보 '바퀴달린 스마트폰' EX90 출시…""탈수록 안전해진다""",신 모델은 볼보가 자체 개발한 통합 컴퓨팅 시스템 ‘휴긴 코어’가 적용됐다. 이 시스템은 차량 내... 국내 출시 모델은 106kWh 니켈·코발트·망간(NCM) 배터리와 트윈 모터 기반 사륜구동 시스템으로 구성된다....,http://www.edaily.co.kr/news/newspath.asp?newsid=04651046645411856,pos
2026-04-01 12:33,연합뉴스,구동모터코어,"볼보코리아 ""'가장 안전한 차' EX90으로 10년 새 역사 쓸 것""(종합)","파워트레인은 106kWh(킬로와트시) 니켈·코발트·망간(NCM) 배터리와 차세대 트윈 모터를 결합한 사륜구동... EX90에는 볼보자동차가 자체 개발한 첨단 시스템 '휴긴 코어'가 적용된다. 전기 아키텍처, 코어 컴퓨터, 존...",https://www.yna.co.kr/view/AKR20260401047851003?input=1195m,pos
2026-04-01 12:02,,구동모터코어,"이윤모 볼보차코리아 대표, ""EX90 시작으로 연 3만대 목표 설정하겠다”","EX90의 핵심은 볼보가 자체 개발한 ‘휴긴 코어(Hugin Core)’다. 전기 아키텍처와 코어 컴퓨터, 존 컨트롤러... 파워트레인은 106kWh 니켈·코발트·망간(NCM) 배터리를 바탕으로 한 사륜구동 트윈 모터 시스템으로 구성된다....",https://www.g-enews.com/view.php?ud=20260401114948973178e43e3ead_1,pos
2026-04-01 12:02,,구동모터코어,"볼보, 전기 플래그십 SUV ‘EX90’ 국내 출시…“타면 탈수록 진화하는...","EX90의 핵심은 볼보가 자체 개발한 ‘휴긴 코어(Hugin Core)’다. 전기 아키텍처와 코어 컴퓨터, 존 컨트롤러... 파워트레인은 106kWh 니켈·코발트·망간(NCM) 배터리를 바탕으로 한 사륜구동 트윈 모터 시스템으로...",https://www.g-enews.com/view.php?ud=20260401114948973178e43e3ead_1,pos
2026-04-01 11:46,,구동모터코어,"볼보, 순수 전기 플래그십 SUV 'EX90' 출시 [포토오늘]",트윈 모터를 결합한 사륜구동(AWD) 기반 트윈 모터(Twin Motor) 및 트윈 모터 퍼포먼스(Twin Motor Performance)로... 시스템 '휴긴 코어(Hugin Core™)' 기반의 소프트웨어 정의 차량(SDV)… OTA 통해 지속적으로 진화하는...,http://www.sisaon.co.kr/news/articleView.html?idxno=181989,pos
2026-04-01 11:29,더팩트,구동모터코어,"볼보, 전기차 플래그십 SUV EX90 출시 [TF사진관]","이번에 새로 출시된 EX90은 볼보자동차가 개발한 핵심 시스템 '휴긴 코어'가 적용된다. 전기 아키텍처... 사륜 구동(AWD) 기반 트윈 모터(Twin Motor) 및 트윈 모터 퍼포먼스(Twin Motor Performance)로 출시되며, 1회 충전 시...",https://news.tf.co.kr/read/photomovie/2308529.htm,pos
2026-04-01 11:06,노컷뉴스,포스코,철강업종 탈탄소전환 '거북이'…포스코·현대제철 세계 최하위권,"국제환경단체 스틸워치(Steel Watch) 평가 결과 전 세계 11개국 주요 철강사 18곳 중 포스코 15위·현대제철... 국내 기업인 포스코는 21.9점을 받아 끝에서 4번째에 머물렀고, 현대제철은 21.2점으로 끝에서 3번째를...",https://www.nocutnews.co.kr/news/6494629?utm_source=naver&utm_medium=article&utm_campaign=20260401110527,pos
2026-04-01 11:03,,포스코,"박희정 포항시장 예비후보, “포스코 58주년…탄소중립 전환, 안전·상생...","예비후보가 포스코 창립 58주년을 맞아 철강산업의 탄소중립 전환 과정에서 ‘안전’과 ‘상생’을 핵심... 박희정 후보는 “포스코의 변화가 지역업체 참여 확대와 지역 인재 채용, 청년 일자리 창출 등으로 이어져야...",https://www.pressian.com/pages/articles/2026040110530805570?utm_source=naver&utm_medium=search,pos
2026-04-01 11:03,,포스코,박승원 광명시장 포스코이앤씨 사장 면담···“인근 시설물 재시공 수...,시공사인 포스코이앤씨로부터 사고 현장 인근 주요 시설물의 전면 보강과 신속한 피해 보상에 대한 확답을 받아냈다고 31일 밝혔다. 박 시장은 31일 오후 인천 송도 포스코이앤씨 본사를 방문해 송치영 사장과 면담을...,https://www.khan.co.kr/article/202604011103001,neg
2026-04-01 10:58,,포스코,"국제 환경단체 전 세계 철강사 탈탄소 이행 평가, 포스코·현대제철 나...","포스코와 현대제철이 국제 환경단체의 주요 글로벌 철강사 탈탄소 이행 평가에서 최하위권을 기록했다.... 이번 평가에는 일본제철, 포스코, 티센크루프, 클리블랜드 클리프스 등 주요 글로벌 철강사들이 모두 포함됐다....",https://www.businesspost.co.kr/BP?command=article_view&num=434660,pos
2026-04-01 10:58,스트레이트뉴스,포스코,"박희정 포항시장 예비후보 ""포스코 탄소중립 전환, '안전·상생'이 제1원...","01 [사진=박희정 예브후보] 더불어민주당 박희정 포항시장 예비후보가 1일 포스코 창립 58주년을 맞아 포항의... 박 예비후보는 이날 메시지를 통해 ""포스코의 성장은 현장 노동자와 기술자, 협력사 종사자들의 헌신 위에...",https://www.straightnews.co.kr/news/articleView.html?idxno=299056,pos
2026-04-01 10:50,,포스코,"포스코 영일만 매립 추진에 환경단체 반발…""전면 재검토해야""",포스코의 수소환원제철소 조성을 위한 포항 영일만 앞바다 매립 계획을 두고 지역 환경단체를 중심으로... 영일만 바다를 매립해 포스코의 수소환원제철소 조성을 위한 134만㎡ 규모의 용지를 신설하는 내용이다. 이에...,https://www.busan.com/view/busan/view.php?code=2026040110482468861,neg
2026-04-01 10:46,이투데이,구동모터코어,"볼보 ‘EX90’ 국내 출격, 1억620만원부터 시작…625km 주행·22분 급속충...",동력 성능은 트윈 모터 사륜구동(AWD) 기반으로 최대 456마력에서 680마력까지 구현된다. 정지 상태에서... 자체 개발한 ‘휴긴 코어(Hugin Core)’를 기반으로 차량 내 다양한 시스템을 통합 제어하며 무선 업데이트(OTA)...,https://www.etoday.co.kr/news/view/2571602,pos
2026-04-01 10:46,한국일보,포스코인터내셔널,"국립생태원·천리포수목원, '멸종위기종의 날' 기념식","두산퓨얼셀과 애경케미칼, 포스코인터내셔널, 한섬, 현대이지웰, 효성, HS효성첨단소재 등 7개 기업에는 멸종위기 야생생물 보전 후원 인정서를 수여한다. 멸종위기 야생생물 보전 후원 인정서는 멸종위기 야생생물...",https://weekly.hankooki.com/news/articleView.html?idxno=7157830,pos
2026-04-01 10:42,,구동모터코어,"볼보車, 韓서 전기SUV 'EX90' 출격 ""한세기 안전 헤리티지와 미래 모빌리...","EX90은 106kWh 니켈·코발트·망간(NCM) 배터리와 트윈 모터 사륜구동(AWD) 조합으로 출시된다. 트윈 모터... 볼보가 자체 개발한 '휴긴 코어'가 전기 아키텍처, 코어 컴퓨터, 존(Zone) 컨트롤러를 통합 제어한다....",https://www.newsis.com/view/NISX20260401_0003572970,pos
2026-04-01 10:40,,구동모터코어,"볼보자동차, '가장 안전한 모델' EX90으로 국내 전기차 시장 공략 선언","차량의 핵심 시스템인 '휴긴 코어(Hugin Core™)'는 전기 아키텍처, 코어 컴퓨터, 존 컨트롤러 등을 통합... 국내 출시 파워트레인은 106kWh NCM 배터리와 사륜구동(AWD) 시스템을 결합한 트윈 모터 및 트윈 모터...",https://www.starnewskorea.com/business-life/2026/04/01/2026040108083364496,pos
2026-04-01 10:36,,포스코인터내셔널,[58년 포스코의 기로] 해외서 신용등급 '털썩'…금융비용 뇌관되나,"국제 신용평가사 S&P글로벌은 지난달 중순, 포스코홀딩스[005490]·포스코·포스코인터내셔널[047050]의 신용등급을 하향 조정했다. 포스코홀딩스와 포스코의 등급은 'A-'에서 'BBB+'로 떨어졌다. 포스코인터는 'BBB'로...",https://news.einfomax.co.kr/news/articleView.html?idxno=4407123,pos
2026-04-01 10:28,아시아경제,구동모터코어,"브랜드 역사상 가장 안전한 모델…볼보, SUV 'EX90' 국내 출시","EX90, '휴긴 코어' 적용…'바퀴 달린 스마트폰'으로 진화 EX90에는 볼보자동차가 자체 개발한 핵심... EX90의 국내 출시 파워트레인은 106kWh 니켈·코발트·망간(NCM) 배터리와 차세대 트윈 모터를 결합한 사륜구동(AWD)...",https://view.asiae.co.kr/article/2026040110284513585,pos
2026-04-01 10:26,철강금속신문,포스코인터,페로타임즈 손바닥뉴스 4월 1일(수),"견인 포스코인터, 유가 상승에 에너지 수혜…희토류·LNG 성장 두각 한국특강, 주식병합·자사주 소각 동시 추진…유통주식수 축소 포스코인터, 250億 규모 CVC 펀드 조성…희토류 밸류체인 강화 메타프론트 글로벌...",http://www.ferrotimes.com/news/articleView.html?idxno=47197,pos
2026-04-01 10:20,,포스코인터내셔널,"국립생태원, 제6회 멸종위기종의 날 기념식 개최","그리고 ▲두산퓨얼셀, ▲애경케미칼(주), ▲(주)포스코인터내셔널, ▲(주)한섬, ▲(주)현대이지웰, ▲(주)효성, ▲HS효성첨단소재 총 7개 기업에게 멸종위기 야생생물 보전 후원 인정서를 수여한다. 멸종위기 야생생물 보전...",http://www.chungnamilbo.co.kr/news/articleView.html?idxno=881023,pos
2026-04-01 10:18,,구동모터코어,볼보 EX90 국내 출시..판매가 1억620만원부터,-SDV 개념 구현..OTA로 성능 지속 개선 -자체 개발 '휴긴 코어'..안전 기능 고도화 지원 볼보자동차코리아가... 파워트레인은 106㎾h 배터리와 듀얼 모터 기반 사륜구동 시스템으로 구성된다. 트윈 모터는 최고 456마력...,http://autotimes.co.kr/detail.php?number=687148&thread=27,pos
2026-04-01 10:18,,구동모터코어,볼보자동차 전기 플래그십 SUV ‘EX90’ 국내 출시…아이오닉9·EV9 '정조...,"자체 개발한 핵심 시스템인 ‘휴긴 코어(Hugin Core)’를 통해 차량의 기능이나 성능, 안전 기술 등이... 트윈 모터를 결합한 사륜구동(AWD) 기반 트윈 모터(Twin Motor) 및 트윈 모터 퍼포먼스(Twin Motor Performance)로...",https://www.asiatime.co.kr/article/20260401500086,pos
2026-04-01 10:17,,구동모터코어,"'안전의 대명사' 볼보, 가격까지 잡았다…1000만원 낮춘 신차 출시",EX90에는 볼보자동차가 자체 개발한 핵심 시스템인 ‘휴긴 코어’가 적용된다. 휴긴 코어는 전기 아키텍처... 트윈 모터를 결합한 사륜구동(AWD) 기반 트윈 모터 및 트윈 모터 퍼포먼스로 출시된다. 트윈 모터 모델은...,https://www.hankyung.com/article/202604010882g,pos
2026-04-01 10:06,,구동모터코어,"""680마력에 주행거리 625km 괴물 전기차가 나타난다""","트윈 모터 퍼포먼스 울트라 모델은 7인승 1억 2120만 원, 6인승 1억 2320만 원으로 책정됐다. 볼보 EX90 (사진=볼보자동차코리아) EX90의 핵심은 볼보가 자체 개발한 '휴긴 코어(Hugin Core)' 시스템이다. 차량의 전기...",https://www.gukjenews.com/news/articleView.html?idxno=3545711,pos
