날짜,매체명,검색키워드,기사제목,주요기사 요약,URL
2025-12-16 22:38,,포스코인터내셔널,"전남드래곤즈, 박동혁 신임 감독 선임...""전남과 함께 축구감독 인생을...","송 신임 대표이사는 1992년 포스코에 입사해 포스코 경영전략실 팀장, 포스코러시아 법인장, 포스코 홍보기획그룹장, 포스코인터내셔널 커뮤니케이션실장, 포스코홀딩스 정책지원실장 등 주요보직을 역임한...",http://www.koreareport.co.kr/news/articleView.html?idxno=42302
2025-12-16 21:44,,포스코,"포스코퓨처엠, LFP 양극재 공장 건립…전량 ESS용",포항 영일만 4산단에 위치한 포스코퓨처엠 포항 양극재 공장 전경.포스코퓨처엠이 급증하는 에너지저장장치(ESS) 시장에 대응하기 위해 포항 영일만4일반산업단지에 리튬·인산·철(LFP) 양극재 공장을 건설한다....,https://www.idaegu.co.kr/news/articleView.html?idxno=533117
2025-12-16 21:26,,포스코인터내셔널,산업부·한국생산성본부 '지속가능경영유공 시상식' 성황,"대통령표창은 KB금융지주, 케이티앤지 등 2곳, 국무총리표창은 포스코인터내셔널, 한국산업기술기획평가원 등 2곳이 각각 수상했다. 이와 함께 지속가능경영 유공 기업 및 기관 20곳이 산업통상부장관표창 및...",http://www.e2news.com/news/articleView.html?idxno=326089
2025-12-16 21:17,,포스코,"포스코퓨처엠 “ESS 시장 대응, LFP 양극재 공장 신설”",포스코퓨처엠이 급증하는 에너지저장장치(ESS) 시장에 대응하기 위해 리튬인산철(LFP) 양극재 공장을 새로 짓는다. 포스코퓨처엠은 지난 15일 이사회에서 포항 영일만 4일반산업단지에 LFP 양극재 전용 공장을...,https://www.khan.co.kr/article/202512162117015
2025-12-16 21:17,,포스코,"현대제철·포스코, 美 합작제철소 본격화… 투자 지분 확정","국내 철강 1·2위 기업 포스코와 현대제철이 미국 현지에서 신규 제철소 건설에 58억달러(약 8조5591억원)를 함께 투자하는 방안을 확정지었다. 현대제철을 비롯한 현대자동차그룹이 자기자본 중 80%를, 포스코가...",http://www.fnnews.com/news/202512162116205701
2025-12-16 21:07,,포스코,"""'사랑'이란 진한 양념으로 버무렸답니다""… 포스코 포항제철소, 지역 ...","포스코 포항제철소가 16일 연말을 맞아 지역사회에 온기를 전하는 '사랑의 김장 김치 나눔' 행사를... 7,000포기의 김장 김치를 전하는 이번 사업은 포스코 임직원들이 조성한 '1% 나눔 기금'으로 재원을 마련, 그 의미를...",https://www.polinews.co.kr/news/articleView.html?idxno=717057
2025-12-16 21:06,미디어펜,포스코,"현대제철·포스코, 미국 제철소에 58억달러 투자 확정",포스코도 지분투자에 나서면서 미국 현지 생산 기반 확대와 글로벌 철강 경쟁력 강화에 힘을 보탠다. 현대제철과 포스코는 16일 미국 루이지애나주 전기로 일관 제철소 지분투자를 위한 출자를 결정했다고 각각...,https://www.mediapen.com/news/view/1067053
2025-12-16 20:56,,포스코,"현대제철·포스코, 연산 270만t 美 합작제철소 건설 '본궤도'",현대제철과 포스코가 2029년 가동을 목표로 추진하는 미국 루이지애나주 제철소 건설 프로젝트에 속도를 낸다. 현대제철과 포스코는 16일 미국 루이지애나주 전기로 일관 제철소 지분 투자를 위한 출자를 단행한다고...,https://www.ngonews.kr/news/articleView.html?idxno=220722
2025-12-16 20:52,,포스코,"포스코퓨처엠, LFP 양극재 공장 짓는다…“ESS 수요 대응”",포스코퓨처엠이 급증하는 ESS 시장에 대응하기 위해 LFP(리튬·인산·철) 양극재 공장을 건설한다.포스코퓨처엠은 15일 이사회를 열고 포항 영일만4일반산업단지에 LFP 양극재 전용 공장을 짓는 안건을 승인했다....,https://www.ksmnews.co.kr/news/view.php?idx=581025
2025-12-16 20:52,,포스코,"포스코엠텍, 지역과 함께한 나눔 행보 결실","포스코엠텍이 12월 12일 안동 스탠포드호텔에서 열린 ‘2025 사회공헌활성화 시상식’에서 지역사회공헌... 포스코엠텍은 2015년부터 현재까지 지역사회를 위한 다양한 사회공헌 사업 및 활동을 수행해 왔으며, 민-관-공 협업...",https://www.ksmnews.co.kr/news/view.php?idx=581026
2025-12-16 20:48,KBS,포스코,"현대차·포스코, 8:2 비율로 미국 제철소 합작투자 확정","국내 철강 1·2위 기업 포스코와 현대제철이 미국 현지 신규 제철소 건설에 58억 달러, 약 8조 5천억여 원을 함께 투자합니다. 포스코는 20% 지분 투자를 결정했습니다. 현대제철과 포스코는 미국 루이지애나주 전기로...",https://news.kbs.co.kr/news/pc/view/view.do?ncd=8435026&ref=A
2025-12-16 20:46,,포스코,"포스코 포항제철소, 7천포기 김장김치 전달","포스코 포항제철소가 연말을 맞아 지역사회에 온기를 전하는 ‘사랑의 김장 김치’ 나눔 행사를 16일... 7,000포기의 김장 김치를 전하는 이번 사업은, 포스코 임직원들이 조성한 '1% 나눔 기금'으로 재원을 마련하여 그...",https://www.ksmnews.co.kr/news/view.php?idx=581097
2025-12-16 20:46,,포스코,"해빛청소년봉사단·포스코 해양환경지킴이봉사단, 공동 정화 활동 전개",포항시청소년재단(대표이사 최제민) 포항시청소년수련관은 지난 13일 해빛청소년봉사단과 포스코... 포스코 해양환경지킴이봉사단 관계자도 “많은 시민이 찾는 영일대에서 함께 구슬땀을 흘린 이번 활동이 지역 해양환경...,https://www.ksmnews.co.kr/news/view.php?idx=581094
2025-12-16 20:40,,포스코,"포스코퓨처엠, 영일만산단 LFP 양극재 공장 신설","포스코퓨처엠이 포항 영일만산업단지에 2027년 하반기 양산을 목표로 LFP, 리튬인산철 양극재 공장을... 삼원계 양극재를 주력으로 생산하고 있는 포스코퓨처엠은 이번 LFP 공장 투자로 양극재 제품군을 더욱 다양화해...",http://www.phmbc.co.kr/www/news/desk_news?idx=199005&mode=view
2025-12-16 20:40,,포스코,"포스코퓨처엠, 영일만산단 LFP 양극재 공장 신설..제품군 다양화","포스코퓨처엠이 포항 영일만산업단지에 2027년 하반기 양산을 목표로 LFP, 리튬인산철 양극재 공장을... 삼원계 양극재를 주력으로 생산하고 있는 포스코퓨처엠은 이번 LFP 공장 투자로 양극재 제품군을 더욱 다양화해...",http://www.phmbc.co.kr/www/news/desk_news?idx=199005&mode=view
2025-12-16 20:34,,포스코,"'K철강 동맹' 현대제철·포스코, 美 전기로 제철소 건설 속도","현대제철과 포스코가 미국 루이지애나주 전기로 일관 제철소 건설에 대한 지분 투자를 확정하며 공동... (14억6000만달러), 포스코 20%(5억8000만달러), 현대자동차 15%(4억4000만달러), 기아 15%(4억4000만달러)라고 밝혔다....",https://magazine.hankyung.com/business/article/202512167729b
2025-12-16 20:28,,포스코,"현대차그룹·포스코그룹 미국 루이지애나 제철소 공동 투자 결정, 지분...","이주태 포스코홀딩스 미래전략본부장 사장, 이성원 에너지소재투자실장, 이원철 철강사업관리실장, 조표훈 경영전략실 상무보가 4월 현대자동차그룹-포스코그룹 업무협약 체결식에서 기념 촬영을 하고 있다....",https://www.businesspost.co.kr/BP?command=article_view&num=423845
2025-12-16 20:28,,포스코,"현대차그룹·포스코그룹 미국 루이지애나 제철소 공동 투자, 지분율은 ...","이주태 포스코홀딩스 미래전략본부장 사장, 이성원 에너지소재투자실장, 이원철 철강사업관리실장, 조표훈 경영전략실 상무보가 4월 현대자동차그룹-포스코그룹 업무협약 체결식에서 기념 촬영을 하고 있다....",https://www.businesspost.co.kr/BP?command=article_view&num=423845
2025-12-16 20:24,,포스코,"현대제철·포스코, 연산 270만t 미국 합작제철소 건설 '본궤도'","포스코홀딩스·현대자동차그룹 CI. (각 그룹 제공, 연합뉴스) 현대제철과 포스코가 2029년 가동을 목표로 추진하는 미국 루이지애나주 제철소 건설 프로젝트에 속도를 낸다. 현대제철과 포스코는 16일 미국...",https://www.delighti.co.kr/news/articleView.html?idxno=107982
2025-12-16 20:18,,포스코,"현대제철·포스코, 미국 루이지애나 제철소 '맞손'…58억달러 투자 확정","현대자동차그룹-포스코그룹 '철강, 이차전지 협력 양해각서 체결식' 사진=포스코그룹 제공 매일일보 = 권선형 기자 | 현대제철과 포스코가 오는 2029년 상업 생산을 목표로 추진하는 미국 루이지애나주 전기로 일관...",http://www.m-i.kr/news/articleView.html?idxno=1315914
2025-12-16 20:11,,포스코,"포스코, 현대제철 美루이지애나 공장에 8600억 투자…지분 20% 확보한다","포스코홀딩스가 현대제철이 미국 루이지애나주에 건설하는 일관제철소 프로젝트에 5억8200만달러(약 8586억원)... ▶본지 4월 14일자 A1, 3면 참조 포스코홀딩스는 전기로 기반의 현지 생산 거점을 구축해 미주 지역 내...",https://www.hankyung.com/article/2025121676921
2025-12-16 20:10,,포스코인터내셔널,"[오피셜] 전남드래곤즈, '승격 출사표' 던졌다! 박동혁 감독 선임...""명...","송 신임 대표이사는 1992년 포스코에 입사해 포스코 경영전략실 팀장, 포스코러시아 법인장, 포스코 홍보기획그룹장, 포스코인터내셔널 커뮤니케이션실장, 포스코홀딩스 정책지원실장 등 주요보직을 역임한...",https://www.sportalkorea.com/news/articleView.html?idxno=2025052909552825920
2025-12-16 20:10,,포스코인터내셔널,"전남, 박동혁 감독 선임…K리그1 승격 재도전","16일부로 취임한 송종찬 신임 대표이사는 1992년 포스코에 입사해 포스코 경영전략실 팀장, 포스코러시아 법인장, 포스코 홍보기획그룹장, 포스코인터내셔널 커뮤니케이션실장, 포스코홀딩스 정책지원실장 등을 지낸...",http://www.kwangju.co.kr/article.php?aid=1765883280793395008
2025-12-16 20:08,,포스코,"현대제철·포스코, 美 루이지애나에 연 270만t 전기로 제철소…58억달러...",현대제철과 포스코가 미국 루이지애나주에 연간 270만t 규모 전기로 일관 제철소를 짓기 위한 지분 출자를 확정하며 북미 생산기지 구축에 속도를 내고 있다. 현대제철과 포스코는 16일 미국 루이지애나주 전기로 제철소...,https://www.topstarnews.net/news/articleView.html?idxno=15907953
2025-12-16 20:08,,포스코,미국 루이지애나주 합작 제철소 출자 규모 확정…현대차그룹·포스코 '...,현대자동차그룹과 포스코가 합작 투자하는 미국 루이지애나주 전기로 제철소 출자 비중이 확정됐다. 현대제철을 포함한 현대차그룹은 총 80%의 지분을 확보한다. 포스코는 5억8200만달러(8586억원)를 투자해 20...,https://www.ebn.co.kr/news/articleView.html?idxno=1691423
2025-12-16 20:00,,포스코,"현대제철·포스코, 美 루이지애나주 전기로 일관 제철소 프로젝트 '속도...",|중앙이코노미뉴스 송태원 기자|현대제철 미국 전기로 제철소 모형[사진=현대제철] 현대제철과 포스코가 미국 루이지애나주 제철소 건설 프로젝트에 속도를 낸다. 16일 현대제철과 포스코는 미국 루이지애나주...,https://www.joongangenews.com/news/articleView.html?idxno=476317
2025-12-16 19:58,데일리한국,포스코,현대차그룹·포스코 손잡고 '美 제철소' 공동 투자…2029년 가동 목표,사진= 연합뉴스 현대제철과 포스코가 미국 루이지애나주에 건설하는 전기로 일관 제철소 프로젝트를 본격... 연합뉴스에 따르면 현대제철과 포스코는 16일 미국 루이지애나주에 들어설 전기로 제철소에 대한 지분...,https://daily.hankooki.com/news/articleView.html?idxno=1310675
2025-12-16 19:58,,포스코,"포스코·현대제철, 미국 제철소 건설에 58억 달러 투자",국내 1·2위 철강기업 포스코와 현대제철이 미국 현지 제철소 건설에 58억달러를 투자한다. 16일 포스코와 현대제철은 미국 루이지애나주 전기로 일관 제철소 지분 투자를 위한 출자를 단행한다고 각각 공시했다....,http://www.inews24.com/view/1918317
2025-12-16 19:52,뉴스웨이,포스코,"포스코PHP봉사단, 광양 전통시장서 '착한 선(先)결제' 활동","포스코와 공급사 임직원들이 함께 지역사회 공헌에 앞장서는 '포스코PHP봉사단'이 지난 15일, 광양 지역상권 활성화를 위해 광양제철소 인근 중마 전통시장에서 '착한 선결제' 활동을 펼쳤다. 이날 행사에는 이승기...",https://www.newsway.co.kr/news/view?ud=2025121618352493855
2025-12-16 19:49,,포스코,"현대제철·포스코, 연산 270만t 미국 제철소 건설에 '속도'",현대제철과 포스코가 2029년 가동을 목표로 추진하는 미국 루이지애나주 제철소 건설 프로젝트에 속도를 냅니다. 현대제철과 포스코는 오늘(16일) 미국 루이지애나주 전기로 일관 제철소 지분 투자를 위한 출자를...,http://www.yonhapnewstv.co.kr/AKR20251216194907rjL
2025-12-16 19:48,,포스코,"포스코, 현대제철과 美 제철소 합작…20% 지분 투자",포스코그룹이 현대제철이 추진하고 있는 미국 루이지애나 전기로 제철소에 20% 지분 투자를 하기로 결정했다. 16일 포스코는 포스코 루이지애나(POS-Louisiana)를 설립하고 이를 통해 현대제철 루이지애나(Hyundai Steel...,https://www.etnews.com/20251216000462
2025-12-16 19:45,,포스코,"현대제철·포스코, 美 합작제철소 건설 속도...8대 2 투자","현대제철과 포스코가 미국 루이지애나주 제철소 건설 프로젝트를 본격화했다. 현대제철을 비롯해 현대자동차·기아 등 현대차그룹이 지분 80%를, 나머지 20%를 포스코가 확보하는 구조다. 현대제철과 포스코는 16일...",https://www.dailian.co.kr/news/view/1586944/?sc=Naver
