날짜,매체명,검색키워드,기사제목,주요기사 요약,URL,sentiment
2026-03-10 06:31,,포스코인터내셔널,"방산도 꺾였는데…방어주 된 ‘이 종목’, 기관도 580억 담았다 [코주부...","중동발 지정학적 불안으로 인해 유가가 가파르게 올라 증시를 짓누른 가운데, 포스코인터내셔널을 비롯한 종합상사 관련주가 오히려 강세를 보였다. 전쟁으로 인해 원자재 가격이 오르면서 수출 기대감이 높은...",https://www.sedaily.com/article/20017189?ref=naver,pos
2026-03-10 06:16,,포스코인터내셔널,"삼성전자·현대차 등 재계, 상법 개정안 시행 앞두고 집중투표제 도입·...","추형욱), 포스코인터내셔널(대표 이계인) 등 매출 상위 10대 기업이 이번 정기 주주총회에서 일제히 정관 변경 안건을 상정했다. 주요 변경 내용은 이사의 충실의무 대상 확대, 사외이사 명칭 변경, 집중투표제 배제 조항...",http://www.consumernews.co.kr/news/articleView.html?idxno=751482,pos
2026-03-10 04:14,코리아IT타임즈,구동모터코어,"MIPS-그린 힐스 소프트웨어, 안전 인증 개발용 RISC-V 마이크로컨트롤러...",양사는 이 조합이 -velOSity RTOS 상에서 구동되는 실시간 모터 제어와 전력 관리 애플리케이션 개발을... MIPS는 다수의 락스텝(lock-stepped) M8500 코어를 기반으로 한 자동차 등급 SoC 플랫폼이 엄격한 기능 안전...,https://www.koreaittimes.com/news/articleView.html?idxno=151627,pos
2026-03-10 01:00,,포스코인터,전기차 넘어… 로봇·드론·ESS 적용 배터리 신기술 총집결,"국내 최대 배터리 전시회인 ‘인터배터리 2026’이 오는 11일 막이 오른다. 이번 전시회에서는 기존 주력... 포스코퓨처엠은 자율주행 EV를 겨냥한 니켈 함량 95% 이상 울트라 하이니켈 양극재, 로봇 등 차세대 산업을...",https://www.kmib.co.kr/article/view.asp?arcid=1773044051&code=11151400&cp=nv,pos
2026-03-10 00:16,,포스코인터,"방위산업·전쟁·테러 관련주, '봄꽃만개' 디와이씨·한일단조·센서뷰...","고주파 RF 및 인터커넥트 전문기업 센서뷰는 과학기술정보통신부가 소관하는 양자 플래그십 과제의... 플랜트 기자재, 선박엔진 구조재, 구조물 구조재, 풍력 기자재를 생산해 포스코이앤씨, 두산에너빌리티...",http://www.finomy.com/news/articleView.html?idxno=251039,pos
2026-03-10 00:06,데일리한국,포스코,"포스코 포항제철소, 데이터·AI 기반 스마트 제철소 고도화",사진=포항제철소 제공 포스코 포항제철소가 설비 데이터를 기반으로 한 분석 체계를 구축하며 인공지능(AI)... 이번 고도화의 핵심은 포스코가 자체 개발한 예지정비 시스템 'PIMS(POSCO Intelligent Maintenance System)'이다. 이...,https://daily.hankooki.com/news/articleView.html?idxno=1344475,pos
2026-03-10 00:02,,포스코인터,로봇 올라탄 ‘게임 체인저’…전고체 배터리 빅매치,"오는 11~13일 서울 강남구 코엑스에서 열리는 국내 최대 배터리 전시회인 ‘인터배터리 2026’에서다. 배터리... 포스코퓨처엠은 자율주행 전기차를 겨냥한 울트라하이니켈 양극재, 로봇을 위한 전고체 배터리용 양극재...",https://www.joongang.co.kr/article/25410422,pos
2026-03-09 23:32,물류신문,포스코플로우,"노삼석 항만물류협회장, ""항만물류업 경영수지 개선 노력할 것""","또한 해양수산부, 포스코플로우와 함께 발주해 진행 중인 특수하역 이송요금 적정단가 산출 연구용역의 결과가 나오면 항만하역 요금 반영을 추진할 계획이다. 아울러 정부의 탈석탄 정책 추진으로 석탄 물동량 감소에...",https://www.klnews.co.kr/news/articleView.html?idxno=320279,pos
2026-03-09 23:02,,포스코,"""데이터로 설비를 읽는다""… 포스코 포항제철소, 데이터·AI 기반 인텔리...",포스코 포항제철소(소장 박남식)가 설비 데이터를 기반으로 한 설비상태 분석 체계를 구축하며 인텔리전트... 점에서 포스코형 스마트제철소 구현 사례로 평가된다. 이번 고도화의 중심에는 포스코가 개발한 '예지정비...,https://www.polinews.co.kr/news/articleView.html?idxno=724925,pos
2026-03-09 21:24,,포스코,"포스코 포항제철소, AI 기반 '인텔리전트 팩토리' 고도화 속도",포스코 포항제철소가 설비 데이터를 기반으로 한 예지정비 체계를 구축하며 인공지능(AI) 기반... 이 시스템의 중심에는 포스코가 자체 개발한 예지정비 시스템 PIMS(POSCO Intelligent Maintenance System)가 있다. PIMS는 제철...,https://www.idaegu.co.kr/news/articleView.html?idxno=541094,pos
2026-03-09 20:46,,포스코,"포스코 포항제철소, 현장 경험에 데이터를 더하다",포스코 포항제철소(소장 박남식)가 설비 데이터를 기반으로 한 설비 상태 분석 체계를 구축하며 인텔리전트... 점에서 포스코형 스마트제철소 구현 사례로 평가된다. 이번 고도화의 중심에는 포스코가 개발한...,https://www.ksmnews.co.kr/news/view.php?idx=593981,pos
2026-03-09 19:16,대경일보,포스코,"포스코 포항제철소, 데이터로 설비를 읽다",▲ 포스코 포항제철소 '예지정비' 중심 설비관리 기술 개발에 힘쓴 직원들이 파이팅을 외치고 있다. 포스코 포항제철소 제공 포스코 포항제철소가 설비 데이터를 기반으로 한 설비 상태 분석 체계를 구축하며...,https://www.dkilbo.com/news/articleView.html?idxno=536341,pos
2026-03-09 19:00,이데일리,미얀마 LNG,LNG이어 반도체용 헬륨까지 끊길 판…1·2차때와 차원 다른 '쇼크',"그러나 LNG 의존도가 크게 높아진 유럽·아시아 경제의 새로운 취약성이 고스란히 드러났다. 걸프만 석유의 약 80%를 수입하는 아시아 국가들이 직격탄을 맞고 있다. 미얀마는 차량 연료 배급제를 도입했고, 태국은...",http://www.edaily.co.kr/news/newspath.asp?newsid=05084006645381680,pos
2026-03-09 18:36,,포스코인터,"“캐즘 뚫을 인재 찾습니다”…K-배터리 3사, 잡페어서 채용 접점 넓힌...","이번 행사는 국내 최대 규모 이차전지 산업 전시회 ‘인터배터리 2026’과 연계해 열리는 배터리 산업 특화... 포스코퓨처엠과 에코프로, 엘앤에프 등 대표 소재 기업을 비롯해 롯데에너지머티리얼즈와 LS일렉트릭 등...",https://www.g-enews.com/view.php?ud=202603091310086212ea14faf6f5_1,pos
2026-03-09 18:31,뉴스1,포스코,"포항제철소, AI 접목한 '포스코형 스마트제철소' 구현 속도",포스코 포항제철소는 9일 인텔리전트 팩토리 고도화에 속도를 내고 있다고 밝혔다. 현장에서 축적된 정비 경험으로 센서 영상 데이터를 결합해 예지정비 중심 설비관리 체계로 전환한 '포스코형 스마트제철소'를 구현하는...,https://www.news1.kr/local/daegu-gyeongbuk/6095355,pos
2026-03-09 18:22,,포스코,"포스코 포항제철소, AI 예지정비로 스마트제철소로 진화한다",기자 포스코 포항제철소(소장 박남식)는 설비 데이터를 기반으로 한 설비 상태 분석 체계를 구축하며... 점에서 포스코형 스마트제철소 구현 사례로 평가된다. 이번 고도화의 핵심은 포스코가 자체 개발한 'PIMS(POSCO...,https://www.eroun.net/news/articleView.html?idxno=75075,pos
2026-03-09 18:15,,포스코인터내셔널,폭락장에서도 반사수혜 예상…종합상사 관련주 강세,"이날 포스코인터내셔널은 전장보다 4.50% 오른 7만6천600원에 거래를 마쳤다. 장중에는 한때 8만5천900원까지 올라 52주 신고가를 경신했다. LX인터내셔널도 5.19% 상승한 4만1천550원에 거래를 마쳤으며, GS글로벌도 0.20...",https://www.imaeil.com/page/view/2026030916052998789,pos
2026-03-09 18:14,중앙일보,POSCO INTERNATIONAL,Won hits 17-year low as fears of prolonged war and energy disruption grow,"SK Gas, a liquefied petroleum gas supplier, gained 5.4 percent to 244,000 won, while trading company Posco International rose 4.5 percent to 76,600 won as investors grew optimistic about the...",https://koreajoongangdaily.joins.com/news/2026-03-09/business/finance/Won-hits-17year-low-as-fears-of-prolonged-war-and-energy-disruption-grow/2540341,pos
2026-03-09 18:06,,구동모터코어,"전기차 관련주, '봄바람 살랑살랑' 액스비스·한일단조·KEC... '찬바람 쌩...",삼화전자는 페라이트 코어를 비롯한 전자기기 부품을 제조·판매하며 국내외 시장에서 활발히 사업을... 전기차용 구동모터 생산에도 나서고 있다. 또한 급발진 사고 예방을 위한 '페달 오조작 방지 장치' 기술을...,http://www.finomy.com/news/articleView.html?idxno=251031,pos
2026-03-09 18:04,,포스코인터내셔널,"코스피 6%·코스닥 4% 급락...환율 한때 1,498원까지 상승","거의 대부분 종목이 하락했고 HD현대중공업과 한화시스템, 삼성중공업과 포스코인터내셔널, S-Oil 등 일부 종목만 상승했습니다. 코스닥도 5% 내린 1,096으로 출발해 4.54% 내린 1,102로 마감했습니다. 장중에 하락폭이 7...",https://www.ytn.co.kr/_ln/0102_202603091804156701,neg
2026-03-09 17:58,,POSCO INTERNATIONAL,"포항시의회, 시와 소통간담회 개최…주요 현안 점검","▲ attracting the APEC AI Center, an international AI organization, to Pohang; and ▲ Pohang's pursuit of... They also requested strengthened cooperation with POSCO to revitalize the local economy. Furthermore, while...",http://www.breaknews.com/1190282,pos
2026-03-09 17:52,데일리한국,포스코,"포스코 광양제철소, 올해 첫 연합봉사 실시...500여명 참여","사진=광양제철소 제공 포스코 광양제철소가 전남 광양시 광영동에서 올해 첫 연합 봉사를 진행했다고 9일... 이날 권향엽 더불어민주당 국회의원, 정인화 광양시장, 고재윤 포스코 광양제철소장을 비롯해 40개의 재능봉사단...",https://daily.hankooki.com/news/articleView.html?idxno=1344434,pos
2026-03-09 17:48,,미얀마 LNG,고유가 반사익 … 에너지 개발株 불기둥,포스코인터내셔널은 미얀마 등지에서 대규모 액화천연가스(LNG) 가스전을 운영하고 있으며 인도네시아에서는 팜유 농장을 보유하고 있다. 특히 최근 가격이 안정적인 미국산 에너지를 구매처로 확보해둔 까닭에...,https://www.mk.co.kr/article/11983059,pos
2026-03-09 17:44,,포스코인터내셔널,"[특징주] 포스코인터내셔널, '원자재 판매가 인상' 수혜 기대…52주 신고...",포스코인터내셔널이 중동 지역의 지정학적 리스크 고조에 따른 원자재 판매 가격 인상 수혜 기대감에 힘입어 강세로 마감했다. ■ 52주 신고가 기록...시가총액 13조 원 돌파 9일 한국거래소에 따르면...,https://www.g-enews.com/view.php?ud=202603091734467553df2f5bc1bc_1,pos
2026-03-09 17:43,,포스코인터,"""최고의 인플레이션 방어주""…급락장 속 웃은 포스코인터",9일 한국거래소에 따르면 포스코인터내셔널 주가는 4.5% 오른 7만6600원에 장을 마감했다. 장중에는 8만5900원까지 뛰며 52주 최고가를 경신했다. LX인터내셔널도 5.19% 상승한 4만1550원에 거래를 마무리했다. GS글로벌도 0.20...,https://www.hankyung.com/article/2026030991771,pos
2026-03-09 17:40,세계일보,포스코인터내셔널,[단독] 한반도 메탄구름 엄습… 전국 배출량 조사한다,원창동은 한국중부발전과 포스코인터내셔널 등이 운영 중인 LNG 발전시설이 밀집된 곳이다. 이런 누출로 의심되는 비정상적인 메탄 배출은 현행 제도에선 사실상 확인할 방도가 없는 게 현실이다. LNG 발전시설은...,https://www.segye.com/newsView/20260309516712?OutUrl=naver,pos
2026-03-09 17:24,,포스코,"포스코 포항제철소, 현장 경험에 데이터 더해 '예측 중심 설비관리' 구...",포스코 포항제철소(소장 박남식)가 설비 데이터를 기반으로 한 설비 상태 분석 체계를 구축하며 인텔리전트... 점에서 포스코형 스마트제철소 구현 사례로 평가된다. 이번 고도화의 중심에는 포스코가 개발한 '예지정비...,https://www.pointe.co.kr/news/articleView.html?idxno=74357,pos
2026-03-09 17:08,,포스코,"포스코 포항제철소, 데이터·AI 기반 ‘예지정비’ 강화…인텔리전트 팩...",돌발 설비정지 감소·고위험 작업 줄여 안전 생산체계 강화 포스코 포항제철소 직원들이 ‘예지정비’ 기반 설비관리 시스템을 통해 설비 데이터를 모니터링하고 있다. (사진=포항제철소 제공) 포스코 포항제철소가...,https://www.cnbnews.com/news/article.html?no=782412,pos
2026-03-09 17:02,,포스코,"포스코 포항제철소, AI 예측으로 설비 사고 막는다",포스코 포항제철소가 실시간 센서와 영상 데이터를 활용한 설비 상태 분석 체계를 구축하며 스마트... 이번 혁신의 핵심은 포스코가 독자 개발한 예지정비 시스템 'PIMS(POSCO Intelligent Maintenance System)'다. 이 시스템은 공정...,https://www.getnews.co.kr/news/articleView.html?idxno=863745,pos
2026-03-09 17:01,,포스코인터내셔널,유가 110달러 쇼크에 코스피 또 급락… 'W자 증시' 저점 어디까지,"포스코인터내셔널(+4.50%), LX인터내셔널(+5.19%), 롯데정밀화학(+5.61%) 등 에너지·자원 관련주 일부만 빨간불을 켰다. 미국·이란 전쟁 여파에 국제 유가가 폭등하면서 위험자산 회피 심리가 강화된 영향이다. 8일...",https://www.hankookilbo.com/news/article/A2026030913190002016?did=NA,pos
2026-03-09 17:00,,포스코인터내셔널,고유가 유탄 맞은 코스피...개미만 4.6조 '줍줍',"또 글로벌 선박 발주와 친환경 선박 수요 확대로 HD현대중공업(+3.97%), 삼성중공업(+3.44%) 등 조선 업종이 상승했고, 포스코인터내셔널(+4.50%), LX인터내셔널(+5.19%) 등 종합상사 관련 종목이 LNG와 팜 등의 사업을...",https://www.ntoday.co.kr/news/articleView.html?idxno=125802,pos
2026-03-09 16:53,,포스코인터내셔널,[서울데이터랩]마감 직후 인기 검색 종목 20選,"이 밖에도 우리기술(032820) 0.41% 상승, 펄어비스(263750) 12.41% 상승, S-Oil(010950) 0.77% 하락, 삼성중공업(010140) 3.44% 상승, NAVER(035420) 1.80% 하락, 포스코인터내셔널(047050) 4.50% 상승...",https://www.seoul.co.kr/news/economy/securities/2026/03/09/20260309500243?wlog_tag3=naver,pos
2026-03-09 16:53,,포스코인터내셔널,[서울데이터랩]‘에이엔피’ 29.90% 상한가…금일 증시 상승률 1위로 마...,"9%, 롯데정밀화학(004000) 5.6%, 세아제강(306200) 5.4%, LX인터내셔널(001120) 5.2%, DN오토모티브(007340) 4.8%, 포스코인터내셔널(047050) 4.5%, KEC(092220) 4.4% 등을 기록하며 이날 증시를 상승으로 마감했다.",https://www.seoul.co.kr/news/economy/securities/2026/03/09/20260309500247?wlog_tag3=naver,pos
2026-03-09 16:52,,포스코,"포스코 포항제철소, 인텔리전트 팩토리 고도화 속도",포스코 포항제철소(소장 박남식)가 설비 데이터를 기반으로 한 설비 상태 분석 체계를 구축하며... 점에서 포스코형 스마트제철소 구현 사례로 평가된다. 고도화의 중심에는 포스코가 개발한 '예지정비' 시스템 'PIMS...,https://www.joongdo.co.kr/web/view.php?key=20260309010002712,pos
2026-03-09 16:46,,미얀마 LNG,중동발 에너지 가격 급등···SK이노·포스코인터 '가스전 투자' 재조명,"최용현 KB증권 연구원은 이날 포스코인터내셔널에 대해 ""업스트림과 발전 부문은 유가에 민감한 구조로 현재 수준의 유가가 유지될 경우 수익성 개선 가능성이 있다""며 ""미얀마 LNG 업스트림 부문은 가격 산정에...",https://www.sisajournal-e.com/news/articleView.html?idxno=419694,pos
2026-03-09 16:40,,포스코,"포스코 포항제철소, 데이터로 설비 읽다…AI 기반 인텔리전트 팩토리 고...",포스코 포항제철소가 설비 데이터를 기반으로 한 설비 상태 분석 체계를 구축하며 인텔리전트 팩토리... 점에서 포스코형 스마트제철소 구현 사례로 평가된다. 이번 고도화의 중심에는 포스코가 개발한 '예지정비...,https://www.newsworks.co.kr/news/articleView.html?idxno=833476,pos
2026-03-09 16:40,,포스코인터,"[유가 100달러 돌파] 장인화 회장 안목 포스코인터, 주가 9만원 노려",국제 에너지 가격 급등으로 인한 주식시장 대혼란 속에서 포스코인터내셔널[047050]이 존재감을 보였다. 장인화 포스코그룹 회장의 안목으로 에너지 부문을 키운 덕에 인플레이션 방어주로서 인식됐기 때문이다. 9일...,https://news.einfomax.co.kr/news/articleView.html?idxno=4402629,pos
