날짜,매체명,검색키워드,기사제목,주요기사 요약,URL
2025-12-11 17:10,,포스코플로우,"포항 영일만항 특별 세션… ""글로벌 물류 거점 도약""","또 영남대, 포스텍 등 국내외 대학과 연구기관, 포스코플로우, PICT, 포항영일항만운영㈜ 등 항만·해운 및 철강 관련 기업 관계자들도 대거 참석해 북극항로 변화와 북극권 도시 간 국제협력 확대, 영일만항의 북극항로...",https://www.joongdo.co.kr/web/view.php?key=20251211010004780
2025-12-11 17:06,,포스코,"포항 시민단체, ""K-스틸법은 매립 요구하지 않는다""…포스코 영일만 매...","관련 포스코의 영일만 매립계획 철회를 요구하고 나섰다. 포항환경운동연합을 비롯한 5개 시민사회단체는... 이들은 ""포스코가 수소환원제철소 건설을 위해 영일만 매립을 추진하는 것은 법 취지의 왜곡""이라고 지적했다....",https://www.eroun.net/news/articleView.html?idxno=68901
2025-12-11 16:58,,POSCO INTERNATIONAL,"경상북도, ‘제62회 무역의 날’ 대구·경북 기념행사 개최…수출의 탑...","the international competition. The event provided an opportunity to share the achievements of Gyeongbuk... , the Steel Tower Order of Industrial Service Merit to POSCO Co., Ltd., the Industrial Service Medal to Hanjung...",http://www.breaknews.com/1168479
2025-12-11 16:58,,포스코플로우,"포항 영일만항, 북극항로 거점 가능성 알렸다","또한 영남대, 포스텍 등 국내외 대학과 연구기관, 포스코플로우, PICT, 포항영일항만운영㈜ 등 항만·해운 및 철강 관련 기업 관계자들도 대거 참석해 북극항로 변화와 북극권 도시 간 국제협력 확대, 영일만항의 북극항로...",https://www.wikitree.co.kr/articles/1101616
2025-12-11 16:56,,포스코플로우,"북극협력주간 포항 특별 세션…'영일만항, 북극항로 거점' 전략 모색","또 포스텍·영남대 등 국내외 대학과 연구 기관, 포스코플로우·PICT·포항영일항만운영 등 항만·해운과 철강 관련 기업 관계자가 참석해 북극항로 변화와 북극권 도시 간 국제 협력 확대, 영일만항의 북극항로 거점...",https://www.newsis.com/view/NISX20251211_0003437805
2025-12-11 16:55,,포스코플로우,"경북도, 북극경제이사회와 양해각서…해상운송 등 협력","이어 김인현 고려대학교 법학전문대학교 명예교수를 좌장으로 이희용 영남대학교 교수, 김경태 포스텍 교수, 권래형 포스코플로우 리더 등이 참석해 북극도시 협력의 지속가능성과 포항영일만항의 전략에 관한 토론을...",https://www.newsis.com/view/NISX20251211_0003437790
2025-12-11 16:50,경북일보,포스코플로우,"경북도·포항시, 북극경제이사회와 MOU…영일만항 북극항로 전략 거점화...",이어진 종합토론에서는 김인현 고려대학교 명예교수를 좌장으로 영남대·포스텍·포스코플로우 전문가들이 참여해 북극도시 협력의 지속가능성과 영일만항의 장기 전략을 논의했다. 최영숙 경북도 환동해지역본부장은...,https://www.kyongbuk.co.kr/news/articleView.html?idxno=4059174
2025-12-11 16:42,,포스코인터내셔널,"포스코·한화, 한국과 호주 '에너지·핵심광물' 협력 선도",포스코인터내셔널과 한화에너지가 한국과 호주의 에너지·핵심광물 협력의 대표 주자로 나섰다. 두 기업은 현지 정부와 네트워킹을 통해 공급망 다변화와 탄소 중립이라는 흐름에 올라타려 한다. 11일...,http://www.seoulwire.com/news/articleView.html?idxno=685199
2025-12-11 16:30,대경일보,포스코플로우,"포항시, '2025 북극협력주간'서 영일만항 특별 세션 개최…북극항로 중...","영남대·포스텍 등 대학과 연구기관, 포스코플로우·PICT·포항영일항만운영㈜ 등 관련 기업들도 함께해 영일만항의 북극항로 거점 전략, 북극권 도시 간 협력 확대 등 다양한 의제를 논의했다. 행사에서는 영상으로...",https://www.dkilbo.com/news/articleView.html?idxno=526138
2025-12-11 16:16,,포스코,"박승원 시장, 신안산선 붕괴사고 포스코이앤씨에 강력 대응 예고","박승원 경기 광명시장이 신안산선 붕괴 사고 복구에 소극적 태도를 보이는 포스코이앤씨에 피해보상 소승 등 강력 대응을 예고했다. 박승원 시장은 지난 10일 오후 신안산선 사고 현장을 찾아 ""포스코이앤씨가...",https://www.thereport.co.kr/news/articleView.html?idxno=80445
2025-12-11 16:00,,포스코,"박승원 광명시장, 포스코이앤씨에 ‘소송 불사’ 경고",보이는 포스코이앤씨에 피해보상 소승 등 강력 대응을 예고했다. 박승원 광명시장이 10일 신안산선 사고 복구 현장을 찾아 포스코이앤씨 관계자들에게 책임있는 복구조치를 촉구했다. 사진 광명시 제공 박 시장은 10일 오후...,https://www.naeil.com/news/read/570748?ref=naver
2025-12-11 15:58,,포스코,"“지역민 위한 따뜻한 공간 재탄생”… 포스코 포항제철소, 나눔의집 리...",더해 포스코 포항제철소 임직원들과 관계자들이 지난 10일 해도동 소재의 포스코 나눔의집에서 포스코1%나눔재단의 ‘희망공간’ 사업 지원을 기념하는 현판식을 열고 기념사진을 촬여하고 있다. 포스코 포항제철소 제공...,http://www.segyebiz.com/newsView/20251211513841?OutUrl=naver
2025-12-11 15:50,,미얀마 LNG,"""세계는 넓고 할 일은 많다""…지독한 일벌레, 세계경영의 꿈을 심다","베트남에 이어 인도네시아와 미얀마, 필리핀 등에도 확산시키고 있다. 무럭무럭 성장하는 아세안을... 캐나다와 러시아와 미국이 모두 한화오션의 LNG 쇄빙선에 큰 기대를 걸고 있다. 북극의 빙하가 녹아 내리고 있기...",https://zdnet.co.kr/view/?no=20251211143213
2025-12-11 15:44,,포스코플로우,"경북도, 민간 중심 경제협의체 '북극경제이사회'와 양해각서 체결","아울러, 김인현 고려대학교 법학전문대학교 명예교수를 좌장으로 이희용 영남대학교 교수, 김경태 포스텍 교수, 권래형 포스코플로우 리더 등이 참석해 북극도시 협력의 지속가능성과 포항영일만항의 전략에 관한...",https://www.tournews21.com/news/articleView.html?idxno=123346
2025-12-11 15:40,연합뉴스,POSCO INTERNATIONAL,KOSPI 200 Closing Price List-1,"1,500 POSCO INTERNATIONAL 53,600 DN 400 LG Corp. 81,700 DN 800 SeAH Steel Holdings 138,800 0 KAL 22,100 DN 100 Daewoong 24,850 UP 500 TaekwangInd 806,000 UP 17,000 KG Mobility 3,430 DN 75 POSCO...",https://en.yna.co.kr/view/AEN20251211009400320?input=2106m
2025-12-11 15:38,,포스코플로우,"""북극항로 시대, 경북도 북극경제권 편입""","아울러, 김인현 고려대학교 법학전문대학교 명예교수를 좌장으로 이희용 영남대학교 교수, 김경태 포스텍 교수, 권래형 포스코플로우 리더 등이 참석해 북극도시 협력의 지속가능성과 포항영일만항의 전략에 관한...",http://www.hidomin.com/news/articleView.html?idxno=601674
2025-12-11 15:28,,포스코인터내셔널,장인화 포스코 회장 위기돌파 리더십...'원칙 뚝심에 혁신 도전',"안전문화 재건을 위해 안전전문 자회사인 포스코세이프티솔루션을 설립하고 포스코에 안전보건환경본부, 포스코인터내셔널에 안전기획실을 각각 신설하는 등 전사적 안전관리 체계를 강화했다. 특히 외부...",https://www.pinpointnews.co.kr/news/articleView.html?idxno=405195
2025-12-11 15:13,뉴스핌,포스코,"포스코이앤씨, AI로 '레미콘 품질 편차' 잡았다…전 과정 스마트 관리 구...",포스코이앤씨가 AI(인공지능) 기술로 레미콘 품질 편차 문제를 정면 돌파했다. 혼합 중인 반죽 상태를... 포스코이앤씨 'AI기반 콘크리트 품질예측 및 생산자동화' 기술 적용 모니터링 화면 [사진=포스코이앤씨] 11일...,https://www.newspim.com/news/view/20251211000796
2025-12-11 15:00,,POSCO INTERNATIONAL,"Posco, Dongwon weigh fresh bids as HMM sale resumes","Additional synergies could emerge by linking HMM’s operations with Posco International’s LNG terminal business. Moreover, Posco has also been seeking new growth engines amid sluggish steel...",https://www.koreaherald.com/article/10634671?ref=naver
2025-12-11 14:58,,포스코플로우,"경북도-북극경제이사회, 북극의 지속 가능한 발전 위한 양해각서 체결","아울러, 김인현 고려대학교 법학전문대학교 명예교수를 좌장으로 이희용 영남대학교 교수, 김경태 포스텍 교수, 권래형 포스코플로우 리더 등이 참석해 북극도시 협력의 지속가능성과 포항영일만항의 전략에 관한...",http://www.newsprime.co.kr/news/article.html?no=715903
2025-12-11 14:56,,포스코플로우,포항 영일만항 '북극 산업 교류 전략 거점 육성' 첫발,김인현 고려대 명예교수를 좌장으로 영남대·포스텍 교수진과 포스코플로우 전문가가 참여한 종합토론에서는 북극도시 협력의 지속가능성과 영일만항의 전략적 활용 방안이 집중 논의됐다. 전문가들은...,https://www.imaeil.com/page/view/2025121114233065306
2025-12-11 14:56,,포스코플로우,"경북도·포항시, 북극경제이사회와 MOU… 영일만항 '북극 협력 거점'로 ...",김인현 고려대 명예교수를 좌장으로 영남대·포스텍 교수진과 포스코플로우 전문가가 참여한 종합토론에서는 북극도시 협력의 지속가능성과 영일만항의 전략적 활용 방안이 집중 논의됐다. 전문가들은...,https://www.imaeil.com/page/view/2025121114233065306
2025-12-11 14:43,,포스코,"비에이치아이, 포스코이앤씨와 LNG HRSG 공급 계약 체결",비에이치아이는 포스코이앤씨와 약 500억원 규모의 액화천연가스(LNG) 복합화력발전 배열회수보일러(HRSG) 공급 계약을 체결했다고 11일 밝혔다. 이번 계약에 따라 비에이치아이는 600㎿(메가와트)급 HRSG 1기를 제철소...,https://www.hankyung.com/article/2025121178456
2025-12-11 14:42,,포스코플로우,"경북도·포항시, 북극경제이사회와 MOU···영일만항 ‘북극항로 전략...","김인현 고려대학교 법학전문대학원 명예교수가 좌장을 맡은 종합토론에는 이희용 영남대 교수, 김경태 포스텍 교수, 권래형 포스코플로우 리더가 참여해 북극도시 협력의 지속가능성과 영일만항 전략에 대해 논의했다....",https://www.kbmaeil.com/article/20251211500369
2025-12-11 14:32,,포스코,[포스코그룹 인사 줌인] 이주태 사장 유임 배경 '미래투자 일관성',이주태 포스코홀딩스 사장은 이번 정기 인사에서 유임됐다. 이 사장은 장인화 포스코그룹 회장이 임기를 시작하자 마자 낸 임원인사에서 포스코홀딩스 대표이사로 추대된 상징적인 인물이다. 장 회장과 마찬가지로 임기가...,https://www.bloter.net/news/articleView.html?idxno=649383
2025-12-11 14:26,,포스코,"포스코 포항제철소, 나눔의집 리모델링 기념 현판식 개최","포스코 포항제철소가 지난 10일 해도동 소재의 포스코 나눔의집에서 포스코1%나눔재단의 '희망공간' 사업 지원을 기념하는 현판식을 개최하고, 지역사회와 함께하는 따뜻한 나눔을 실천했다. 나눔의집은 포스코가 송도...",https://www.pointe.co.kr/news/articleView.html?idxno=64847
2025-12-11 14:05,,미얀마 LNG,북극–태평양 LNG 루트 열린다…포스코인터 역할 부상,"▲가스전 탐사·개발 ▲LNG 조달 ▲터미널 운영 ▲발전 및 트레이딩에 이르는 'LNG 풀밸류체인' 구축 전략을 추진 중이다. 먼저 미얀마 가스전 개발은 국내 민간기업 최대 규모 해외 자원개발 사업으로, 2000년 탐사 시작...",https://www.newsis.com/view/NISX20251211_0003437345
2025-12-11 13:52,,포스코인터내셔널,"HMM 인수전, '포스코·동원' 2파전으로?…'몸값 10조원' 등 변수만 한가...","또한 ""물류비 절감을 노린 인수 명분은 있지만, 직접적 사업 시너지는 제한적""이라며 ""포스코인터내셔널이 운영하는 LNG 터미널을 활용한 벙커링 확대 가능성도 거론되지만, HMM의 LNG 추진선은 현재 2척에 불과하다""고...",https://www.sisajournal.com/news/articleView.html?idxno=356110
2025-12-11 13:42,잡포스트,포스코,"포스코 포항제철소, 나눔의집 리모델링…지역민위한 따뜻한 공간 재탄생","포스코 포항제철소가 12월 10일, 해도동 소재의 포스코 나눔의집에서 포스코1%나눔재단의 '희망공간' 사업 지원을 기념하는 현판식을 개최했다./사진=포스코 포스코 포항제철소가 12월 10일, 해도동 소재의 포스코...",https://www.job-post.co.kr/news/articleView.html?idxno=195954
2025-12-11 13:10,잡포스트,포스코,"포스코퓨처엠 주가 12월 11일 장중 216,000원 2.04% 내림세","11일 오후 12시 12분 기준, 네이버페이 증권에 따르면 포스코퓨처엠은 지난 종가 대비 하락하며 216... 포스코퓨처엠의 하락률 2.04%는 동일 업종의 등락률 -1.40%보다 더 큰 폭의 하락을 나타냈다. 외국인...",https://www.job-post.co.kr/news/articleView.html?idxno=195940
