날짜,매체명,검색키워드,기사제목,주요기사 요약,URL,sentiment
2026-07-09 11:58,,포스코퓨처엠,"민형배 전남광주특별시장, 광양서 철강 대전환·K-배터리 육성 모색","민형배 시장은 이차전지 소재·원료생산 기업인 포스코퓨처엠, 포스코필바라리튬솔루션, 포스코리튬솔루션, 포스코HY클린메탈 등 포스코그룹 계열 4개 기업 대표와 간담회를 갖고, 이차전지 산업 현안과 애로사항을...",https://www.jeonmae.co.kr/news/articleView.html?idxno=1273109,pos
2026-07-09 11:58,뉴스워커,포스코인터내셔널,"한국에너지공단, '호주 해상풍력' 시장 공략 나섰다","이번 사절단에는 포스코인터내셔널과 해양정보기술, 삼일C&S, 현대스틸산업, 에드벡트, 은성O&C, 스펙엔지니어링와이엔피, 세아베스틸, KPF가 참여했고, 신재생에너지협회와 철강협회도 함께해 국내 해상풍력 기업의...",http://www.newsworker.co.kr/news/articleView.html?idxno=435540,pos
2026-07-09 11:44,미디어펜,포스코홀딩스,"이 대통령, 9일 오후 후렐수흐 몽골 대통령과 비즈니스 포럼 참석","한국에서는 핵심광물, 유통·소비재, 디지털 등 분야의 주요기업 대표인 LS홀딩스 구자은 회장, 포스코홀딩스 장인화 회장, SK 이형희 부회장, LG CNS 현신균 사장, GS리테일 허서홍 대표, 이마트 한채양 대표, BGF리테일...",https://www.mediapen.com/news/view/1109128,pos
2026-07-09 11:40,,포스코홀딩스,"회계사회, 지속가능성 정보 인증‧타 인증인 활용…오는 15일 포럼 개최",종합토론 좌장은 백태영 성균관대 명예교수(겸 ISSB/KSSB/삼정KPMG 자문위원)이며 ▲김훈태 포스코홀딩스 ESG사무국장 ▲선우희연 세종대학교 교수 ▲신상훈 한국투자자포럼 교수(청주대학교) ▲이웅희 한국회계기준원...,https://www.tfmedia.co.kr/news/article.html?no=205639,pos
2026-07-09 11:39,,포스코인터내셔널,"호주 해상풍력시장 공략…에너지公, 무역사절단 파견","포스코인터내셔널·해양정보기술·삼일C&S·현대스틸산업·에드벡트·은성O&C·스펙엔지니어링와이엔피·세아베스틸·KPF 등 국내 기업 9개사가 참여했으며, 한국신재생에너지협회와 한국철강협회도 함께했다. 사절단은...",https://www.newsis.com/view/NISX20260709_0003702440,pos
2026-07-09 11:38,,포스코홀딩스,"李대통령, 한-몽골 정상회담서 한반도·핵심광물 논의","포럼에는 LS홀딩스 구자은 회장, 포스코홀딩스 장인화 회장, SK 이형희 부회장, LG CNS 현신균 사장, GS리테일 허서홍 대표, 이마트 한채양 대표, BGF리테일 홍정국 부회장, 한화투자증권 장병호 대표, 카카오뱅크 윤호영 대표...",http://www.seouleconews.com/news/articleView.html?idxno=92302,pos
2026-07-09 11:38,,포스코인터내셔널,"한국에너지공단, '호주 재생에너지 무역사절단' 파견","이번 무역사절단에 참여한 국내기업은 △사업개발(포스코인터내셔널) △해양‧지질‧지반‧단지조사(해양정보기술) △해상풍력 하부구조물(삼일C&S, 현대스틸산업) △해상풍력 기초구조물(에드벡트, 은성O&C) △풍력 O...",https://www.gasnews.com/news/articleView.html?idxno=126008,pos
2026-07-09 11:35,,포스코인터내셔널,유연근무 도입 기업 3곳 중 1곳 ‘이용자 0’…육아휴직은 양극화 뚜렷,"종합 순위 1위는 포스코인터내셔널(82.3점)이었고, 국민은행·KT&G(공동 5위) 등은 2년 연속 상위권을 지켰다. 특히 상위 20개 기업엔 자산 규모 중위(롯데칠성음료·삼성SDS), 하위(콜마비앤에이치·한미글로벌) 기업도...",https://www.joongang.co.kr/article/25443708,pos
2026-07-09 11:30,,포스코,[포스코 트랜스포메이션] 리튬 영업익 '1.8조+α'…광산 투자 확대,포스코홀딩스가 2035년 리튬 사업 목표에 '플러스 알파(+α)'를 제시하며 추가 성장 가능성을 시사했다. 기존... 그룹 이익 구조 변화…리튬이 성장 견인 9일 포스코홀딩스에 따르면 현재 그룹 영업이익의 약 70%를...,https://www.bloter.net/news/articleView.html?idxno=667666,pos
2026-07-09 11:30,,포스코홀딩스,"이재명 대통령, 10일 한-몽골 정상회담… 비즈니스 포럼도 참석","포럼에는 LS홀딩스 구자은 회장, 포스코홀딩스 장인화 회장, SK 이형희 부회장, LG CNS 현신균 사장, GS리테일 허서홍 대표, 이마트 한채양 대표, BGF리테일 홍정국 부회장, 한화투자증권 장병호 대표, 카카오뱅크 윤호영 대표...",https://www.s-journal.co.kr/news/articleView.html?idxno=42277,pos
2026-07-09 11:22,,포스코,"IT서비스 상장기업 브랜드평판 7월, 현대오토에버 1위…삼성SDS·포스코...","2위는 삼성SDS, 3위는 포스코DX가 차지했다. 한국기업평판연구소는 6월 9일부터 7월 9일까지 IT서비스... 7월 IT서비스 상장기업 브랜드평판 순위는 1위 현대오토에버, 2위 삼성SDS, 3위 포스코DX, 4위...",https://www.cbci.co.kr/news/articleView.html?idxno=587822,pos
2026-07-09 11:22,,포스코 수소환원제철,"포항서 ‘2026 세계녹색성장포럼’ 개막··· 세계 석학들 “포항, 글로...","특히, 포스코의 수소환원제철과 연계해 경주 월성원전, 울진 한울원전, 영덕 천지원전 등 동해안 원전의 안정적인 전력을 활용한 청정수소 생산체계를 구축하고, 이를 미래 수소경제의 핵심 기반으로 육성한다는...",https://tk.newdaily.co.kr/site/data/html/2026/07/09/2026070900099.html,pos
2026-07-09 11:16,,포스코,포스코·삼성·LG...국내 대기업 주변 자연 어떻게 변했나,"사업장 내부 자연손실 규모는 포스코홀딩스가 1408.1ha로 가장 컸으며 삼성전자(1022.6ha), 현대자동차(734.5ha), HD한국조선해양(695.7ha), 기아(525.4ha)가 뒤를 이었다. 사업장 영향권역에서는 LG전자의 자연손실 규모가...",https://www.newspenguin.com/news/articleView.html?idxno=21842,neg
2026-07-09 11:06,연합뉴스,포스코인터내셔널,"유연근무제 있으면 뭐하나…""기업 35%는 이용 직원 한명도 없어""","종합 순위에서 최고점을 얻은 곳은 포스코인터내셔널(82.3점)이었다. 그다음으로 롯데칠성음료(81.3점), KB증권·롯데웰푸드(79.2점), 국민은행·KT&G·호텔롯데·신한카드(77.1점) 등이 뒤를 이었다. 상위권에는 자산 규모...",https://www.yna.co.kr/view/AKR20260709083400530?input=1195m,pos
2026-07-09 11:02,,포스코홀딩스,"李, '韓-몽골 비즈니스 포럼' 참석 … 국내 핵심 광물·유통 기업 총출동...","한국에서는 구자은 LS홀딩스 회장, 장인화 포스코홀딩스 회장, 이형희 SK 부회장, 현신균 LG CNS 사장, 허서홍 GS리테일 대표, 한채양 이마트 대표, 홍정국 BGF리테일 부회장, 장병호 한화투자증권 대표, 윤호영...",https://www.newdaily.co.kr/site/data/html/2026/07/09/2026070900073.html,pos
2026-07-09 11:00,,포스코홀딩스,"李대통령, 한·몽 비즈니스포럼 참석…핵심광물·유통·디지털 협력 확...","한국에서는 LS를 비롯해 포스코홀딩스, SK, LG CNS, GS리테일, 이마트, BGF리테일, 한화투자증권, 카카오뱅크 등 기업 관계자 180여 명이 참석한다. 몽골에서는 MCS그룹과 타반보그드그룹, MAK(Mongolyn Alt) 그룹, 스카이...",https://news.einfomax.co.kr/news/articleView.html?idxno=4424154,pos
2026-07-09 10:58,,포스코퓨처엠,"민형배 전남광주특별시장, 광양서 철강·배터리 산업 육성 전략 점검","민 시장은 이후 포스코퓨처엠, 포스코필바라리튬솔루션, 포스코리튬솔루션, 포스코HY클린메탈 등 포스코 계열 이차전지 관련 기업 대표들과 만나 소재 생산과 원료 공급, 재활용 산업의 경쟁력 강화 방안을 논의했으며...",https://www.mhns.co.kr/news/articleView.html?idxno=752806,pos
2026-07-09 10:53,,포스코홀딩스,"한국공인회계사회, 지속가능성인증포럼 개최…""정보 인증신뢰도 제고""","토론에는 김훈태 포스코홀딩스 ESG사무국장, 선우희연 세종대학교 교수, 신상훈 한국투자자포럼 교수, 이웅희 한국회계기준원 상임위원, 이정우 BSI Group Korea 심사원, 이종오 한국사회책임투자포럼 사무총장, 허규만...",https://www.sidae.com/article/2026070910334426964,pos
2026-07-09 10:52,,포스코홀딩스,"李 대통령, 한-몽골 비즈니스 포럼 참석…경제협력 확대 논의","한국 측 참석자는 LS홀딩스 구자은 회장, 포스코홀딩스 장인화 회장, SK 이형희 부회장, LG CNS 현신균 사장, GS리테일 허서홍 대표, 이마트 한채양 대표, BGF리테일 홍정국 부회장, 한화투자증권 장병호 대표, 카카오뱅크...",http://www.iminju.net/news/articleView.html?idxno=166427,pos
2026-07-09 10:48,,포스코퓨처엠,"감자 완료 후 거래 재개… 케이피엠테크, 고부가가치 PCB 시장 공략 박차","이와 함께 켐트로스, 아이로보틱스, 한국알콜, 쎄노텍, 포스코퓨처엠, 한농화성, 파미셀, 코스모신소재, 이화산업, 삼영, 태경케미컬도 상승하며 화학업종의 오름세에 힘을 보태고 있다. 중소형 소재주 역시 투자심리가...",https://www.pinpointnews.co.kr/news/articleView.html?idxno=466978,pos
2026-07-09 10:40,딜사이트TV,포스코퓨처엠,"민형배 시장, 광양서 철강·K-배터리 육성 행보…""미래산업 수도 도약""","이어 민 시장은 포스코퓨처엠, 포스코필바라리튬솔루션, 포스코리튬솔루션, 포스코HY클린메탈 등 포스코그룹 2차전지 계열사 대표들과 간담회를 갖고 산업 현안과 기업 애로사항을 청취했다. 또 포스코퓨처엠 양극재...",https://news.dealsitetv.com/articles/173062,pos
2026-07-09 10:34,,포스코인터내셔널,"[2026 상반기 리그테이블] ⑤KB증권, 회사채 6년 연속 '지존(至尊)'… NH...","롯데케미칼, 포스코인터내셔널, LG전자(이상 AA↑), 한진, 한솔테크닉스, 에이제이네트웍스, 동화기업(BBB↓) 등이다. ◆ NH투자증권, 6년 연속 '빅2' NH투자증권(대표이사 신재욱 배광수)은 공모금액...",http://www.thevaluenews.co.kr/news/view.php?idx=199826,pos
2026-07-09 10:32,,포스코홀딩스,"이 대통령, 오늘 한·몽 비즈니스 포럼 참석…상생협력 확대 당부할 듯","한국 측에서는 LS홀딩스 구자은 회장, 포스코홀딩스 장인화 회장, SK 이형희 부회장, LG CNS 현신균 사장, GS리테일 허서홍 대표, 이마트 한채양 대표, BGF리테일 홍정국 부회장, 한화투자증권 장병호 대표, 카카오뱅크...",https://www.newsis.com/view/NISX20260709_0003702204,pos
2026-07-09 10:31,,포스코홀딩스,"회계사회, 지속가능성 인증 포럼 개최…2030년 제3자 인증 의무화 대응",종합토론은 백태영 성균관대학교 명예교수(겸 ISSB/KSSB/삼정KPMG 자문위원)가 좌장을 맡으며 △김훈태 포스코홀딩스 ESG사무국장 △선우희연 세종대학교 교수 △신상훈 한국투자자포럼 교수(청주대학교) △이웅희...,http://www.joseilbo.com/news/news_read.php?uid=571578&class=10&grp=,pos
2026-07-09 10:29,,포스코홀딩스,"李대통령, 15년 만의 몽골 국빈방문…'한몽관계 황금시대' 공동선언 발...","국내에서는 LS홀딩스 구자은 회장, 포스코홀딩스 장인화 회장, SK 이형희 부회장, LG CNS 현신균 사장, GS리테일 허서홍 대표, 이마트 한채양 대표, BGF리테일 홍정국 부회장, 한화투자증권 장병호 대표, 카카오뱅크 윤호영...",https://www.imaeil.com/page/view/2026070910160776020,pos
2026-07-09 10:28,,포스코홀딩스,"한공회, 15일 지속가능성인증포럼 연다…'타 인증인 활용' 해법 모색",종합토론은 백태영 성균관대학교 명예교수(겸 ISSB/KSSB/삼정KPMG 자문위원)가 좌장을 맡으며 △김훈태 포스코홀딩스 ESG사무국장 △선우희연 세종대학교 교수 △신상훈 한국투자자포럼 교수(청주대학교) △이웅희...,https://www.sejungilbo.com/news/articleView.html?idxno=59177,pos
2026-07-09 10:28,,포스코홀딩스,"李대통령, 한몽 비즈니스포럼 나서…“광물·인프라 협력”","한국 측에선 구자은 LS홀딩스 회장, 장인화 포스코홀딩스 회장을 비롯해 이형희 SK 부회장, 현신균 LG CNS 사장, 허서홍 GS리테일 대표, 한채양 이마트 대표, 홍정국 BGF리테일 부회장, 장병호 한화투자증권 대표, 윤호영...",https://www.mk.co.kr/article/12094156,pos
2026-07-09 10:25,,포스코인터내셔널,유연근무제 있으면 뭐하나…기업 3곳 중 1곳 활용 안 해,"종합 순위 1위는 포스코인터내셔널(82.3점)이었고, 2위는 롯데칠성음료(81.3점), 3위는 KB증권과 롯데웰푸드(79.2점)였다. 국민은행·KB국민카드·케이티앤지는 2년 연속 상위권을 지켰다. 전년에도 평가 대상이었던 197개...",https://www.newsis.com/view/NISX20260709_0003702141,pos
2026-07-09 10:18,,포스코이앤씨,성수2·3지구 시공사 선정 레이스 돌입…경쟁입찰 성사 여부 '주목',"당시 참여 의사를 보였던 포스코이앤씨가 입찰에 불참했고, 유력 후보였던 DL이앤씨마저 참여하지 않으면서 경쟁 구도가 형성되지 못했다. 이후 올해 3월 새 집행부가 출범하면서 DL이앤씨와 IPARK현대산업개발이 다시...",https://www.pinpointnews.co.kr/news/articleView.html?idxno=466960,pos
2026-07-09 10:15,,포스코 노조,삼성SDS 이어 현대오토에버까지…SI 업계 노조 설립 물결,국내 시스템통합(SI) 업계의 노사 관계가 요동치고 있다. 삼성SDS에서는 지난 6일 창사 이래 첫 노조가 출범해 이틀째인 7일 조합원 과반을 넘었다. 앞서 포스코DX도 2021년 인사제도 개편 반발을 계기로 노조가 설립된 바 있다.,https://www.sidae.com/article/2026070909445199856,neg
2026-07-09 10:10,,포스코이앤씨,전담 버틀러·호텔 식사·의료 등 하이엔드 서비스 누리는 '소요한남 by...,"한편, '소요한남 by 파르나스'는 서울시 용산구 한남대로 730 일원에 들어서며, 지하 5층~지상 7층, 연면적 약 3만9,000㎡, 총 111실 규모로 조성된다. 시공은 포스코이앤씨가 맡았다.",https://www.rcast.co.kr/news/articleView.html?idxno=31225,pos
2026-07-09 10:06,,포스코인터내셔널 희토류,中 희토류 봉쇄 뚫는다…韓 자석공장에 濠 라이너스 베팅,"제이에스링크와 영구자석 사업 협력 업무협약을 맺은 포스코인터내셔널은 원료 조달망 다변화라는 우호적 재료를 얻었으나, 협력이 구속력 있는 공급계약으로 이어질지는 확정되지 않았다. 희토류 공급망 재편의...",https://www.g-enews.com/view.php?ud=202607072148062178fda4f5ab74_1,pos
2026-07-09 10:05,,포스코 직고용,안전혁신인가 연임 포석인가…포스코 장인화 회장 '7000명 직고용' 둘러...,"포스코는 직고용 발표 당시 이번 조치가 그룹 차원의 안전 원칙과 의지를 구체화한 사례이며, 지난해 발표한 다단계 하도급 구조 개선 방침을 실행하는 과정이라고 설명했다. 실제로 포스코그룹은 지난해 안전을 최우선...",https://www.upkoreanews.kr/news/articleView.html?idxno=99207,pos
2026-07-09 10:00,,포스코 전기로,"[전기로 혁신③] ""미국에 9조 투자""···현대제철, 공급망 재편 승부수","탄소 중립이란 목표를 향해 글로벌 산업의 시선이 모이는 가운데, 한국 철강업계가 전기로 전환을 핵심 생존... 막대한 비용이 들어가는 프로젝트인 만큼 현대자동차그룹은 가장 큰 경쟁사인 포스코와 손을 맞잡는 강수를...",https://www.seoulfn.com/news/articleView.html?idxno=632945,pos
2026-07-09 09:17,,포스코인터내셔널,'유연근무제' 있어도 못 쓴다…기업 3곳 중 1곳 '이용자 0명',육아휴직과 유연근무제를 가장 적극적으로 지원하는 기업은 '포스코인터내셔널'이었다. 은행·보험업도 출산·양육 지원에 앞장서 있었다. 인구 전문 싱크탱크 한반도미래인구연구원(한미연)은 9일 '2026 인구 위기...,https://www.mt.co.kr/policy/2026/07/09/2026070908382692611,pos
2026-07-09 09:06,,포스코퓨처엠,"R5극 3특, 대경권 성장 엔진 5개 제시","◀ SYNC ▶이찬우 포스코퓨처엠 생산기술섹션 리더 ""전체 제조 원가의 25%인 전기료 상승에 대해서 굉장히 압박을 많이 받고 있습니다. 정부의 실질적인 전기료 인하라든지 이제 생산 보조금 같은 실질적이고 효과적인...",http://andongmbc.co.kr/adboard/NewsView83544,pos
