날짜,매체명,검색키워드,기사제목,주요기사 요약,URL,sentiment
2026-02-12 10:58,,포스코인터내셔널,"석탄 가고 니켈 온다… LX인터내셔널, 인도네시아 광산 쥐고 '배터리 강...",포스코인터내셔널 역시 4%대 상승하며 해외 자원개발 및 트레이딩 역량이 투자 포인트로 작용한다. LG화학과 LG에너지솔루션도 동반 강세다. LG화학은 5%대 상승 흐름을 보이며 배터리 소재 사업 확장 기대가 반영된다....,https://www.pinpointnews.co.kr/news/articleView.html?idxno=428972,pos
2026-02-12 10:00,더페어뉴스,구동모터코어,"9년의 증명, LG전자 HVAC가 쓴 '신뢰의 연대기'",단순한 브랜드 파워보다 실제 구동 성능과 에너지 효율이 최우선 가치로 평가받기 때문이다. 이 냉정한... 기술력인 '코어테크(Core Tech)'에 있다. 냉동공조의 심장이라 불리는 컴프레서와 모터를 자체 개발하고 생산하는...,https://www.thefairnews.co.kr/news/articleView.html?idxno=69507,pos
2026-02-12 09:00,,포스코,"무보·포스코·기업은행, 철강산업 위기 극복 협력...‘수출공급망강화...",한국무역보험공사는 주식회사 포스코의 중소기업 협력사를 대상으로 철강산업 지원을 위한 ‘수출공급망강화보증’ 1호 보증서를 발급했다고 12일 밝혔다. 본 프로그램은 포스코와 기업은행이 200억 원을 무보에...,https://www.g-enews.com/view.php?ud=202602120815188630bb91c46fcd_1,pos
2026-02-12 08:58,연합뉴스,포스코,"무보, 포스코 협력사에 '철강산업 특화 무역보증 1호' 지원",한국무역보험공사(무보)는 포스코의 중소 협력사 티지에스파이프㈜에 철강 산업 지원을 위한 '수출 공급망 강화보증' 1호 보증서를 발급했다고 12일 밝혔다. 이번 지원은 포스코와 기업은행이 200억원을 무보에 출연하고...,https://www.yna.co.kr/view/AKR20260212032000003?input=1195m,pos
2026-02-12 08:48,아주경제,포스코,"무보, 포스코 협력 中企에 수출금융 지원...철강 수출 지원 본격화",무보는 포스코의 중소기업 협력사를 대상으로 한 '수출공급망강화보증' 1호 보증서를 발급했다고 12일 밝혔다. 이번 프로그램은 포스코와 IBK기업은행이 200억원을 무보에 출연하고 무보는 이를 재원으로 포스코의...,https://www.ajunews.com/view/20260212083811275,pos
2026-02-12 08:38,아시아경제,포스코,"무보, '수출공급망강화보증' 1호 발급…포스코 협력 中企에 수출금융 지...",한국무역보험공사가 포스코 협력 중소기업을 대상으로 한 철강 산업 지원에 본격 나섰다. 무보는 12일 포스코의 중소 협력사를 대상으로 철강 산업 지원을 위한 '수출공급망강화보증' 1호 보증서를 발급했다고 밝혔다....,https://view.asiae.co.kr/article/2026021208385495138,pos
2026-02-12 08:28,,포스코,"[위클리오늘] 공원식 포항시장 출마예정자, 송도-포스코 '교량.시가지 주...",송도-포스코 교량 및 시가지 주차난 해소 방안 정책을 발표하고 있다/황보용택 기자 공원식 포항시장 출마예정자는 11일 포항시청 브리핑룸에서 가진 기자회견에서 송도-포스코 교량 및 시가지 주차난 해소 방안 정책을...,http://www.weeklytoday.com/news/articleView.html?idxno=758861,pos
2026-02-12 08:26,,포스코인터,[하도급 결제 점검-포스코그룹] 포스코인터·퓨처엠 ‘지급기간 아쉬움...,반면 포스코인터내셔널과 포스코퓨처엠은 지난해 상반기 대비 현금 결제율 개선에도 불구하고 중장기 지급 비중이 상대적으로 높아 아쉬웠다는 평가다. 공정거래위원회 하도급법 공시에 따르면 포스코그룹 상장...,https://www.fetv.co.kr/news/article.html?no=212625,pos
2026-02-12 07:02,,포스코,[포스코 해외철강 점검] 美 루이지애나 제철소… '그린 철강' 시장 선도,③전기로서 탄소저감강판 180만t 생산 예정…수요 대응·기술 내재화 달성 전망 포스코가 '미국 루이지애나... 전기로를 통해 제품을 생산할 경우 향후 탄소저감 철강재에 프리미엄이 붙을 경우 포스코 입장에서는...,https://dealsite.co.kr/articles/156715,pos
2026-02-12 07:02,,포스코,"[더벨][Company Watch] 포스코이앤씨, '주택→해외·플랜트' 수주 체질 개...",포스코이앤씨가 수주 전략에 변화를 준 것으로 나타났다. 2024년 국내 주택 위주의 중형 프로젝트가 주를... 포스코이앤씨는 2025년 신규 수주 15조2000억원을 기록했다. 이는 전년 대비 4조1000억원 증가한 수치다....,https://www.thebell.co.kr/free/content/ArticleView.asp?key=202602091536121240109084,pos
2026-02-12 06:48,철강금속신문,포스코,"송치영 포스코이앤씨 사장, 동절기 현장 안전점검 '앞장'",송치영 포스코이앤씨 사장이 지난 9일 서울 구로구에 위치한 지식산업센터 신축 공사 현장에서 동절기 현장 안전점검을 진행하고 있다. 포스코이앤씨가 동절기 현장 안전점검과 함께 중대재해 예방을 위한 현장 안전문화...,http://www.ferrotimes.com/news/articleView.html?idxno=46319,pos
2026-02-12 06:46,철강금속신문,포스코,"포스코1%나눔재단-국가보훈부, 국가유공자 첨단보조기구 지원 맞손",국가보훈부와 포스코1%나눔재단이 11일 포스코센터에서 국가유공자 지원 및 보훈문화 확산 업무협약식을 맺고 기념사진을 촬영하고 있다 포스코1%나눔재단은 11일 서울 포스코센터에서 국가보훈부와 상이 국가유공자의...,http://www.ferrotimes.com/news/articleView.html?idxno=46350,pos
2026-02-12 04:27,동아일보,포스코,"포스코1%나눔재단, 국가유공자 ‘희망날개’ 단다…보훈부와 맞춤형 재...",임직원 급여 1%로 첨단 보조기구·재활 로봇 지원… 전국 5개 보훈병원 인프라 구축 전상·공상 유공자부터 현직 군인·소방관까지 확대… “일상 속 보훈 실천 모범사례” 포스코1%나눔재단(이사장 장인화 포스코그룹 회장)...,https://sports.donga.com/region/article/all/20260212/133346648/1,pos
2026-02-12 03:16,,포스코,"포스코1%나눔재단-국가보훈부, 유공자 사회복귀 지원 '공조'",포스코1%나눔재단이 국가보훈부와 상이 국가유공자의 신체 재활과 사회복귀 지원을 위한 업무 협약을 지난 11일 체결했다. 포스코그룹은 임직원들 급여의 1%를 기부로 운영하는 '포스코1%나눔재단'을 통해 국가를 위해...,http://www.newsbrite.net/news/articleView.html?idxno=196411,pos
2026-02-12 02:26,,포스코,"보훈부-포스코1%나눔재단, '상이 국가유공자 재활 지원' 3년 연장",몸이 불편한 국가유공자의 재활과 사회 복귀 지원을 강화하기 위해 국가보훈부와 포스코1%나눔재단이 다시 손을 맞잡았다. 양 기관은 11일 서울 포스코센터에서 권오을 국가보훈부 장관과 장인화 포스코1%나눔재단...,https://www.goodmorningcc.com/news/articleView.html?idxno=440998,pos
2026-02-12 00:52,,포스코,"포스코1%나눔재단-국가보훈부, 국가유공자 첨단 보조기구 지원 위한 MOU...",포스코1%나눔재단(이사장 장인화 포스코그룹 회장)이 11일 서울 포스코센터에서 국가보훈부와 상이 국가유공자의 신체 재활과 사회복귀 지원을 위한 업무협약(MOU)을 체결했다. 포스코그룹은 임직원들의 매월 급여의 1...,https://www.polinews.co.kr/news/articleView.html?idxno=722818,pos
2026-02-12 00:16,,구동모터코어,"수소차 관련주, '봄날의 햇살' 뉴인텍·현대차·한화솔루션·한온시스템...","하지만 삼보모터스, 코오롱인더, 일진다이아, 성창오토텍, 에스에너지, 비엠티, 일진하이솔루스... 타기구동장치 등 방산 장비의 국산화를 위한 연구개발에도 속도를 내고 있다. SOFC는 600~1,000℃의 고온에서 작동해...",http://www.finomy.com/news/articleView.html?idxno=249596,pos
2026-02-11 22:48,,포스코,[iN The Scene] 포스코퓨처엠 생산설비 살펴보는 이억원 금융위원장,인더뉴스 문승현 기자ㅣ이억원 금융위원장은 11~12일 1박2일 일정으로 진행되는 '국민성장펀드·지방우대금융 지역간담회' 일환으로 광주·전남지역을 찾아 이차전지소재기업 포스코퓨처엠을 방문했다. 포스코퓨처엠은...,https://www.inthenews.co.kr/news/article.html?no=83106,pos
2026-02-11 22:29,뉴스1,포스코,포스코퓨처엠 방문한 이억원 금융위원장,= 이억원 금융위원장이 11일 오후 전남 광양 이차전지소재 기업인 포스코퓨처엠에 방문해 이차전지 산업 동향 및 향후 사업 추진계획에 대해 청취하고 있다. (금융위원회 제공. 재판매 및 DB 금지) 2026.2.11/뉴스1,https://www.news1.kr/photos/7746786,pos
2026-02-11 20:48,,포스코,공원식 “송도-포스코 교량 건설·상권 주차 인프라 확충”,"공원식 포항시장 출마예정자는 11일 오전 11시 포항시청 브리핑룸에서 기자회견을 가지고 송도-포스코 교량... 첫째, 송도–포스코 직결 교량 건설 추진방안을 검토하겠다며, 해오름대교 개통 이후 시가지 교통은 일부...",https://www.ksmnews.co.kr/news/view.php?idx=590471,pos
2026-02-11 20:46,,포스코,국가 유공자 ‘재활·자립’ 지원…포스코1%나눔재단·보훈부 협력,포스코1%나눔재단(이사장: 장인화 포스코그룹 회장)이 11일 서울 포스코센터에서 국가보훈부와 상이 국가유공자의 신체 재활과 사회복귀 지원을 위한 업무협약(MOU)을 체결했다.포스코그룹은 임직원들의 매월 급여의 1...,https://www.ksmnews.co.kr/news/view.php?idx=590493,pos
2026-02-11 20:24,,포스코,'송도-포스코 교량 및 시가지 주차난 해소 방안 정책' 제안,"송도-포스코 교량 및 시가지 주차난 해소 방안 정책을 발표했다. 공원식 출마예정자는 ""지금 포항은 전례... 첫째, 송도–포스코 직결 교량 건설 추진방안을 검토하겠다며, 해오름대교 개통 이후 시가지 교통은 일부...",http://www.ttlnews.com/news/articleView.html?idxno=3079623,pos
2026-02-11 20:16,,포스코,"포스코1%나눔재단, 상이 국가유공자 재활 지원 앞장",국가보훈부와 포스코1%나눔재단이 11일 포스코센터에서 국가유공자 지원 및 보훈문화 확산 업무협약식을 맺고 기념사진을 촬영하고 있다. 사진=포스코 제공 포스코1%나눔재단이 11일 서울 포스코센터에서 국가보훈부와...,http://www.hidomin.com/news/articleView.html?idxno=608809,pos
2026-02-11 20:06,대경일보,포스코,"포스코1%나눔재단-국가보훈부, 국가유공자 첨단보조기구 지원해 보훈 문...",▲ 국가보훈부와 포스코1%나눔재단이 11일 포스코센터에서 국가유공자 지원 및 보훈문화 확산 업무협약식을 맺고 기념사진을 촬영하고 있다. 포스코1%나눔재단 제공 포스코1%나눔재단이 11일 서울 포스코센터에서...,https://www.dkilbo.com/news/articleView.html?idxno=533806,pos
2026-02-11 19:54,,포스코,"포스코1%나눔재단, 국가유공자 재활·사회복귀 지원 확대","포스코1%나눔재단이 국가보훈부와 손잡고 상이 국가유공자의 신체 재활과 사회 복귀 지원을 확대한다. 단순 보조기구 지원을 넘어, 일상 복귀까지 책임지는 장기적 재활 모델을 구축한다는 목표다. 포스코1%나눔재단은...",https://www.econovill.com/news/articleView.html?idxno=729517,pos
2026-02-11 19:06,잡포스트,포스코,"포스코이앤씨, '신안산선 사망 사고' 등 안전관련 줄줄이 지적…안전은...",따르면 포스코이앤씨는 2025년 국토부로부터 시공 중인 수도권 건설 현장 37곳에서 총 61건의 안전관련 지시사항을 통보받았다. 포스코이앤씨가 시공을 맡은 수도권 건설 현장에서 2025년 5건의 사망 사고가 발생했다. 이에...,https://www.job-post.co.kr/news/articleView.html?idxno=207198,neg
2026-02-11 18:56,,포스코,"엄기천 포스코퓨처엠 사장, 배터리협회장 취임···""소부장 강화 경쟁...",한국배터리산업협회 신임 협회장에 선임된 엄기천 포스코퓨처엠 사장이 취임사를 하고 있다. [한국배터리산업협회] 엄기천 포스코퓨처엠 사장이 11일 한국배터리산업협회 신임 협회장에 취임했다. 배터리산업협회는...,https://www.ziksir.com/news/articleView.html?idxno=123735,pos
2026-02-11 18:54,,포스코,포스코퓨처엠 방문한 이억원 금융위원장,이억원(가운데) 금융위원장이 11일 전남 광양시 포스코퓨처엠을 방문해 생산라인을 시찰하고 있다. (사진=금융위원회 제공) 2026.02.11. photo@newsis.com *재판매 및 DB 금지,https://www.newsis.com/view/NISI20260211_0021164143,pos
2026-02-11 18:54,,포스코,포스코퓨처엠 방문한 이억원 금융위원장,이억원(가운데) 금융위원장이 11일 전남 광양시 포스코퓨처엠에서 열린 국민성장펀드 및 지방우대금융 지역간담회에서 참석자들과 기념촬영 하고 있다. (사진=금융위원회 제공) 2026.02.11. photo@newsis.com...,https://www.newsis.com/view/NISI20260211_0021164144,pos
2026-02-11 18:32,경북일보,포스코,"포스코1%나눔재단-국가보훈부, 국가유공자 재활 지원 MOU 체결",포스코1%나눔재단(이사장 장인화 포스코그룹 회장)은 11일 서울 포스코센터에서 국가보훈부와 상이 국가유공자의 신체 재활과 사회복귀 지원을 위한 업무협약(MOU)을 체결했다. 이번 협약은 포스코1%나눔재단이 지난...,https://www.kyongbuk.co.kr/news/articleView.html?idxno=4064411,pos
2026-02-11 18:31,,포스코,"포스코1%나눔재단·보훈부, 국가유공자 재활 지원",포스코1%나눔재단은 11일 서울 강남구 포스코센터에서 국가보훈부와 상이 국가유공자의 신체 재활 및 사회복귀 지원을 위한 업무협약(MOU)을 체결했다고 밝혔다. 이번 협약은 국가를 위해 헌신한 유공자들의 일상 회복과...,http://www.fnnews.com/news/202602111830309680,pos
2026-02-11 18:24,경북일보,포스코,"공원식, 송도~포스코 직결교량·주차난 해소 종합 교통대책 제안","공원식 전 경북도 정무부지사는 11일 포항시청 브리핑룸에서 기자회견을 열고, 송도-포스코 교량 및 시가지... 그는 ""이 같은 문제 해소를 위해서는 송도에서 형산강을 건너 포스코로 이어지는 직결노선을 만드는 것""이라며...",https://www.kyongbuk.co.kr/news/articleView.html?idxno=4064400,neg
2026-02-11 18:17,연합뉴스,포스코,"이억원 금융위원장, 포스코퓨처엠 방문",이억원 금융위원장이 11일 전남 광양 이차전지소재 기업인 포스코퓨처엠을 방문해 참석자들과 기념 촬영하고 있다. 2026.2.11 [금융위원회 제공. 재판매 및 DB 금지],https://www.yna.co.kr/view/PYH20260211205200013?input=1196m,pos
2026-02-11 18:17,연합뉴스,포스코,"이억원 금융위원장, 포스코퓨처엠 방문",이억원 금융위원장이 11일 전남 광양 이차전지소재 기업인 포스코퓨처엠을 방문해 이차전지 산업 동향 및 향후 사업 추진계획에 대해 청취하고 있다. 2026.2.11 [금융위원회 제공. 재판매 및 DB 금지],https://www.yna.co.kr/view/PYH20260211205300013?input=1196m,pos
2026-02-11 18:17,연합뉴스,포스코,"이억원 금융위원장, 포스코퓨처엠 방문",이억원 금융위원장이 11일 전남 광양 이차전지소재 기업인 포스코퓨처엠을 방문해 이차전지 산업 동향 및 향후 사업 추진계획에 대해 청취하고 있다. 2026.2.11 [금융위원회 제공. 재판매 및 DB 금지],https://www.yna.co.kr/view/PYH20260211205100013?input=1196m,pos
2026-02-11 18:16,,구동모터코어,"자동차부품 관련주, '봄날의 햇살' 모베이스전자·화천기계·모베이스·...","현대자동차, HD현대인프라코어 등 글로벌 OEM 및 1차 제조사에 자동차 엔진 부품을 공급하며 주요 고객과... 해당 제품은 자동차 전장 부품, 무인화 방산 시스템, 지능형 로봇의 관절모터 및 구동 시스템 등에 적용되며...",http://www.finomy.com/news/articleView.html?idxno=249590,pos
