날짜,매체명,검색키워드,기사제목,주요기사 요약,URL,sentiment
2026-01-22 21:38,경인매일,포스코,"인천글로벌시티(IGCD), 포스코 소송 마무리... 3단계 사업 박차",인천글로벌시티(IGCD)에 대한 포스코이앤씨의 대규모 공사비 청구소송이 마무리 되었다. IGCD는 법원의 화해조정을 받아 들이고 오는 23일 합의금액을 최종 정산키로 했다. 그동안 IGCD는 포스코이앤씨의 요청금액을 놓고...,https://www.kmaeil.com/news/articleView.html?idxno=627169,pos
2026-01-22 20:33,뉴스핌,포스코인터내셔널,"탁구 에이스 vs 중2 루키…신유빈, 청명중 후배와 계급장 떼고 맞대결","여자부 단체전에서는 대한항공을 비롯해 주천희가 버티는 삼성생명, 양하은의 화성도시공사, 디펜딩 챔피언 한국마사회, 김나영의 포스코인터내셔널, 이다은이 이끄는 미래에셋증권이 우승 경쟁을 벌일 전망이다.",https://www.newspim.com/news/view/20260122001222,pos
2026-01-22 19:14,,포스코인터내셔널,"안방 좁다는 파마리서치, 'R&D 올인'으로 글로벌 바이오 신화 쓴다","조선·중공업·인프라 관련주인 HD현대, HD현대일렉트릭, HD현대인프라코어, 효성중공업, 두산밥캣, 한전기술, 한전KPS, 포스코인터내셔널, 포스코DX 등도 약세를 보였다. 이들 종목은 수주와 매출 성장에도 불구하고 자본...",https://www.pinpointnews.co.kr/news/articleView.html?idxno=420631,pos
2026-01-22 19:08,디지털타임스,포스코,"[단독] 엄기천 포스코퓨처엠 대표, 배터리협회장 내정…관행 깼다","엄기천 포스코퓨처엠 대표이사가 한국배터리산업협회 제9대 협회장으로 내정됐다. 그간 LG에너지솔루션과... 포스코 신사업관리실 PosLX사업추진반 사업화프로젝트팀장, 철강기획실장, 마케팅전략실장 등을 지냈다....",https://www.dt.co.kr/article/12042380?ref=naver,pos
2026-01-22 19:08,디지털타임스,포스코,"[단독] 엄기천 포스코퓨처엠 대표, 배터리협회장 내정…셀 3사 관행 ‘파...","엄기천 포스코퓨처엠 대표이사가 한국배터리산업협회 제 9대 협회장으로 내정됐다. 그간 협회장이 국내... 포스코 신사업관리실 PosLX사업추진반 사업화프로젝트팀장, 철강기획실장, 마케팅전략실장 등을 지냈다....",https://www.dt.co.kr/article/12042380?ref=naver,pos
2026-01-22 19:06,,포스코인터내셔널,"""3-0 완승 신고""…신유빈, 종합선수권 단체전 첫 경기서 에이스 입증","대한항공과 함께 삼성생명, 화성도시공사, 한국마사회, 포스코인터내셔널, 미래에셋증권이 우승 후보로 거론된다. 삼성생명은 주천희가 포진해 있고, 화성도시공사는 양하은이 버티고 있다. 작년 챔피언 한국마사회도...",https://www.topstarnews.net/news/articleView.html?idxno=15941755,pos
2026-01-22 18:52,연합뉴스,포스코인터내셔널,"탁구 간판 신유빈, 종합선수권 단체전 첫 출격…예선 승리","여자부 단체전에선 대한항공과 주천희가 포진한 삼성생명, 양하은이 버티는 화성도시공사, 작년 챔피언 한국마사회, 김나영이 나서는 포스코인터내셔널, 이다은을 앞세운 미래에셋증권이 우승을 다툴 전망이다. 한편...",https://www.yna.co.kr/view/AKR20260122152900007?input=1195m,pos
2026-01-22 18:46,,포스코,배당·자사주 기대에 애경케미칼 포스코퓨처엠 이녹스첨단소재 웃었다,"포스코퓨처엠과 LG화학, LG에너지솔루션 등 2차전지 관련 대형주들도 동반 상승했다. 이들 기업은 단기 실적 부담에도 불구하고 핵심 사업의 글로벌 경쟁력 ,그룹 차원의 자본 효율성 제고 가능성, 중장기 배당 정책 개선...",https://www.pinpointnews.co.kr/news/articleView.html?idxno=420630,pos
2026-01-22 18:40,대한경제,구동모터코어,"볼보, 중형 전기 SUV ‘EX60’ 공개…1회 충전 810㎞ [신차열전]","EX60은 차세대 전기차 아키텍처 SPA3를 기반으로 하며, 새로운 핵심 시스템 ‘휴긴코어(HuginCore)’로 구동된다. 셀-투-바디 기술, 차세대 자체 개발 전기모터, 메가 캐스팅 기술 등이 적용됐다. 파워트레인은 P12 AWD...",https://www.dnews.co.kr/uhtml/view.jsp?idxno=202601221835415850894,pos
2026-01-22 18:22,비즈월드뉴스,구동모터코어,"볼보자동차, 새로운 순수 전기 SUV 'Volvo EX60' 세계 최초 공개","시스템, '휴긴코어(HuginCore)'로 구동된다. 여기에는 셀-투-바디(Cell-to-Body) 기술과 차세대 자체 개발 전기 모터, 새로운 배터리 셀 설계, 메가 캐스팅(Mega casting) 기술 등 에너지 효율과 주행거리를 향상시킬 수 있는...",http://www.bizwnews.com/news/articleView.html?idxno=122434,pos
2026-01-22 17:50,,포스코인터내셔널,[그린란드 논란①] 트럼프판 새 북극 지도...K조선·에너지 기회,포스코인터내셔널이 최근 프로젝트 참여를 최종 확정한 것이다. 포스코인터내셔널은 알래스카산 LNG를 매년 100만톤씩 구매하는 동시에 자본 투자에도 나서며 개발 사업의 본격화를 위해 시동을 걸었다. 한·미 조선 협력...,https://www.insightkorea.co.kr/news/articleView.html?idxno=239707,pos
2026-01-22 17:50,,포스코인터내셔널,[그린란드 논란①] 트럼프판 북극 지도...韓 조선·에너지에 기회,포스코인터내셔널이 최근 프로젝트 참여를 최종 확정한 것이다. 포스코인터내셔널은 알래스카산 LNG를 매년 100만톤씩 구매하는 동시에 자본 투자에도 나서며 개발 사업의 본격화를 위해 시동을 걸었다. 한·미 조선 협력...,https://www.insightkorea.co.kr/news/articleView.html?idxno=239707,pos
2026-01-22 17:50,,포스코인터내셔널,[그린란드 논란①] 트럼프판 북극 지도...K조선·에너지에겐 기회,포스코인터내셔널이 최근 프로젝트 참여를 최종 확정한 것이다. 포스코인터내셔널은 알래스카산 LNG를 매년 100만톤씩 구매하는 동시에 자본 투자에도 나서며 개발 사업의 본격화를 위해 시동을 걸었다. 한·미 조선 협력...,https://www.insightkorea.co.kr/news/articleView.html?idxno=239707,pos
2026-01-22 17:36,,구동모터코어,"""새로운 게임체인저""… 볼보자동차, 전기 SUV 'EX60' 공개","시스템 '휴긴코어(HuginCore)'로 구동된다. 여기에는 셀-투-바디(Cell-to-Body) 기술, 차세대 자체 개발 전기모터, 새로운 배터리 셀 설계, 메가 캐스팅 기술 등 에너지 효율과 주행거리를 향상시킬 수 있는 기술들이 포함된다....",http://digitalchosun.dizzo.com/site/data/html_dir/2026/01/22/2026012280197.html,pos
2026-01-22 17:22,,구동모터코어,"볼보, 전기 SUV ‘EX60’ 최초 공개…“10분 충전에 340㎞ 주행”","EX60은 볼보의 새로운 핵심 시스템, ‘휴긴코어’로 구동된다. 여기에는 △셀-투-바디 기술 △차세대 자체 개발 전기 모터 △새로운 배터리 셀 설계 △메가 캐스팅 기술 등 에너지 효율과 주행거리를 향상시킬 수 있는...",https://www.mydaily.co.kr/page/view/2026012217201375020,pos
2026-01-22 17:20,,포스코인터내셔널,"정부, 1.7조 규모 ‘상생금융’ 공급...""대·중소기업 모두의 성장 구현...",포스코인터내셔널이 출연하는 150억원 규모의 협력사 상생 프로그램이 신설된다. 포스코와 기업은행이 참여하는 4000억원 규모의 ‘철강산업 수출공급망 우대 자금’도 내년 1월부터 공급될 예정이다. 정부는...,https://www.fetv.co.kr/news/article.html?no=210573,pos
2026-01-22 17:04,,포스코,"금속노조 포항지부, '포스코의 말뿐인 대책이 또 1명의 노동자 절단'","1월 20일 노동자 다리 절단 사고 포스코의 안일한 안전 인식, 관리 부실이 원인 이로운넷 = 이상호 기자 전국금속노동조합 포항지부는 22일 성명서를 통해 최근 포스코 포항제철소에서 노동자 1명이 안전사고로 중상을 입은...",https://www.eroun.net/news/articleView.html?idxno=71610,neg
2026-01-22 17:02,,포스코,"장인화號 포스코, '안전대책' 공염불···포항공장 또 중대재해","지난해 11월 중대재해 이후 근본적 안전 대책을 마련하겠다고 한 포스코 포항제철소에서 또 다시 중대재해가 발생했다. 22일 금속노조 포항지부와 포스코 노조 등에 따르면 지난 20일 오후 1시 40분경, 포항제철소 1열연 공정...",http://www.koreastocknews.com/news/articleView.html?idxno=116337,pos
2026-01-22 17:02,대한경제,포스코,"인천글로벌시티(IGCD), 포스코 소송 마무리하고 3단계 사업에 박차.",대한 포스코이앤씨의 대규모 공사비 청구소송이 마무리 되었다. IGCD는 법원의 화해조정을 받아 들이고 오는 23일 합의금액을 최종 정산키로 했다. 그동안 IGCD는 포스코이앤씨의 요청금액을 놓고 그 적정성에 대해...,https://www.dnews.co.kr/uhtml/view.jsp?idxno=202601221519201320831,pos
2026-01-22 16:52,,포스코,"포스코, 석달 만에 또 '산재' 계약직 끼임 사고...""안전관리 부실이 빚은...",경북 포항제철소(POSCO.포스코)에서 장비에 끼여 노동자의 다리가 절단되는 사고가 발생했다. 지난해 11월 2건의 유해물질 누출로 모두 3명이 숨지고 7명이 다친 사고가 발생한 지 3개월 만이다. 금속노조 포항지부와 포스코...,https://www.pn.or.kr/news/articleView.html?idxno=33141,neg
2026-01-22 16:44,,포스코,5000선 넘은 코스피… LG화학 포스코퓨처엠 POSCO홀딩스 더 내달릴까,"이와 함께 LG화학, 포스코퓨처엠, POSCO홀딩스 등 이차전지 소재와 밸류체인 전반에 걸친 종목들이 나란히... 이번 장에서는 LG에너지솔루션, 삼성SDI, LG화학, 포스코퓨처엠, POSCO홀딩스, 에코프로비엠, 에코프로 등으로...",https://www.pinpointnews.co.kr/news/articleView.html?idxno=420561,pos
2026-01-22 16:32,,구동모터코어,"볼보, 중형 전기 SUV 'EX60' 세계 최초 공개","구동 P6(최대 620km) 등으로 구성되며 모든 배터리에 10년 보증을 붙였다. 차체는 차세대 전기차 아키텍처 SPA3를 기반으로 '휴긴코어(HuginCore)'를 탑재했다. 메가 캐스팅, 셀-투-바디(Cell-to-Body), 자체 개발 전기모터...",https://www.pinpointnews.co.kr/news/articleView.html?idxno=420553,pos
2026-01-22 16:28,문화일보,구동모터코어,"볼보자동차, 첫 중형 전기SUV ‘EX60’ 세계 최초 공개","여기에다 메가 캐스팅, 셀-투-바디 기술, 차세대 전기 모터 등으로 에너지 효율을 개선하고, 탄소 배출을... 특히 EX60은 구글, 엔비디아, 퀄컴 등 협업으로 탄생한 휴긴코어로 구동돼 차가 스스로 사고하고, 처리하며...",https://www.munhwa.com/article/11563016?ref=naver,pos
2026-01-22 16:10,메가경제,포스코,"[메가 이슈토픽] 포스코퓨처엠, 배터리 혹한기 속 '미국 전진기지' 세워...",포스코그룹의 배터리 소재 핵심 계열사인 포스코퓨처엠이 미국 시장에 처음으로 공식 거점을 마련한다. 전기차 수요 둔화로 글로벌 배터리 산업 전반이 조정 국면에 접어든 가운데 최대 시장인 미국에서 고객 대응력과...,https://www.megaeconomy.co.kr/news/newsview.php?ncode=1065593984929595,pos
2026-01-22 16:10,,포스코,"인천글로벌시티, 포스코와 소송 종결로 3단계 사업 가속화",인천글로벌시티(IGCD)는 포스코이앤씨와의 공사비 청구소송을 마무리하고 3단계 사업 추진에 박차를... IGCD는 포스코이앤씨의 요청금액에 대해 외부 기관의 객관적 감정평가와 자체적인 설계 및 물량 검증...,https://www.viva100.com/article/20260122501237,pos
2026-01-22 16:04,,구동모터코어,"볼보, 글로벌 전기 SUV 시장서 기술력 선보여…EX60 세계 최초 공개","EX60은 차세대 전기차 아키텍처 SPA3를 기반으로 하며, 볼보자동차의 새로운 핵심 시스템 '휴긴코어'로 구동된다. 여기에는 ▲셀-투-바디 기술 ▲차세대 자체 개발 전기 모터 ▲새로운 배터리 셀 설계 ▲메가...",http://www.metroseoul.co.kr/article/20260122500478,pos
2026-01-22 15:58,,구동모터코어,"“한 번 충전에 810km”…볼보, 중형전기 SUV ‘EX60’[오늘, 이 종목]",EX60은 사륜구동(AWD) 모델 기준으로 한 번 충전 시 최대 810km(WLTP 기준)를 달릴 수 있다. 장거리 주행에 대한... EX60에는 볼보의 차세대 전기차 플랫폼 SPA3와 새로운 차량 운영 시스템 ‘휴긴코어(HuginCore)’가 처음...,https://www.mk.co.kr/article/11940312,pos
2026-01-22 15:55,뉴스1,삼척블루파워,"삼척블루파워, 발전소 전역 환경정화 캠페인…안전·환경 문화 확산",강원 삼척화력발전소 운영사인 삼척블루파워가 깨끗하고 안전한 사업장 조성을 위해 발전소 전역에서 환경정화 캠페인을 실시했다. 22일 사측에 따르면 이번 캠페인에는 강규봉 대표이사를 비롯한 임직원들이 자율적으로...,https://www.news1.kr/local/kangwon/6047915,pos
2026-01-22 15:40,연합뉴스,POSCO INTERNATIONAL,KOSPI 200 Closing Price List-1,"164,600 DN 7,500 TaekwangInd 760,000 UP 10,000 Daewoong 22,100 UP 250 SamyangFood 1,235,000 UP 35,000 POSCO INTERNATIONAL 62,700 UP 300 CJ CheilJedang 215,500 UP 2,500 KAL 24,100 UP 50 SeAH Steel...",https://en.yna.co.kr/view/AEN20260122007000320?input=2106m,pos
2026-01-22 15:30,,구동모터코어,"볼보, 중형 전기 SUV 판도 바꾼다…810km 주행거리 'EX60' 세계 최초 공개","시스템, '휴긴코어(HuginCore)'로 구동된다. 여기에는 ▲셀-투-바디(Cell-to-Body) 기술 ▲차세대 자체 개발 전기 모터 ▲새로운 배터리 셀 설계 ▲메가 캐스팅(Mega casting) 기술 등 에너지 효율과 주행거리를 향상시킬 수...",http://www.biztribune.co.kr/news/articleView.html?idxno=347716,pos
2026-01-22 15:23,,구동모터코어,볼보의 전기 SUV ‘Volvo EX60’ 글로벌 공개...유럽기준 최대 810km 주행,"‘휴긴코어(HuginCore)’로 구동된다. 여기에는 셀-투-바디(Cell-to-Body) 기술, 차세대 자체 개발 전기 모터, 새로운 배터리 셀 설계, 메가 캐스팅(Mega casting) 기술 등 에너지 효율과 주행거리를 향상시킬 수 있는...",http://www.osen.co.kr/article/G1112732474,pos
2026-01-22 15:16,,구동모터코어,"볼보, 차세대 중형 전기 SUV ‘EX60’ 세계 최초 공개",‘휴긴코어(HuginCore)’로 구동된다. 여기에는 △셀-투-바디(Cell-to-Body) 기술 △차세대 자체 개발 전기 모터 △새로운 배터리 셀 설계 △메가 캐스팅(Mega casting) 기술 등 에너지 효율과 주행거리를 향상시킬 수 있는...,https://www.g-enews.com/view.php?ud=2026012211251482133fe8821aee_1,pos
2026-01-22 14:55,,구동모터코어,제미나이 탑재·10분 충전 340km…볼보 전기차 EX60 첫선,"여기에 메가 캐스팅, 셀-투-바디 기술, 차세대 전기 모터 등으로 에너지 효율을 개선하고 탄소 배출을... 특히, 구글, 엔비디아, 퀄컴 등 협업으로 탄생한 휴긴코어로 구동돼 차가 스스로 사고하고, 처리하며, 반응할...",https://biz.sbs.co.kr/article_hub/20000286753?division=NAVER,pos
2026-01-22 14:52,,구동모터코어,"볼보, 810㎞ 달리는 전기차 'EX60' 선봬","전기모터, 신규 배터리 셀 설계, 메가 캐스팅(Mega Casting) 등을 적용해 에너지 효율과 주행거리를 높였다는 설명이다. 소프트웨어는 볼보의 신형 코어 시스템 '휴긴코어(HuginCore)'를 중심으로 작동한다....",https://it.chosun.com/news/articleView.html?idxno=2023092155412,pos
2026-01-22 14:50,,구동모터코어,"볼보자동차, 10분 충전 시 340km 주행할 수 있는 중형 전기 SUV 'Volvo EX60'...","시스템, '휴긴코어(HuginCore)'로 구동된다. 여기에는 ▲셀-투-바디(Cell-to-Body) 기술 ▲차세대 자체 개발 전기 모터 ▲새로운 배터리 셀 설계 ▲메가 캐스팅(Mega casting) 기술 등 에너지 효율과 주행거리를 향상할 수...",https://kr.aving.net/news/articleView.html?idxno=1808153,pos
2026-01-22 14:30,뉴스워커,포스코인터내셔널,알래스카 LNG 다시 꺼낸 트럼프에 관련주 급등…실적 뚜렷치 않아 철강...,"알래스카 가스라인 개발공사(AGDC) 측이 한국가스공사와 양해각서를 교환하고 잠재 파트너로 지목해 온 데 더해, 글렌파른과 포스코인터내셔널이 연 100만t의 LNG를 20년간 도입하는 장기 공급 계약을 맺었다. 포스코도...",http://www.newsworker.co.kr/news/articleView.html?idxno=411454,pos
2026-01-22 14:26,,포스코,"포스코미술관 광양, 개관 1주년 앞두고 미술체험·특강 프로그램 개최",전남 광양제철소가 ‘포스코미술관 광양’ 개장 1주년을 앞두고 지역사회에 새로운 활력을 불어넣기 위해... ‘포스아트(포스코 철강재를 활용한 고해상도 컬러강판)’를 기반으로 탁본과 프로타쥬 기법을 활용한...,http://www.shinailbo.co.kr/news/articleView.html?idxno=2181524,pos
2026-01-22 14:20,,구동모터코어,"볼보, 중형 전기 SUV 'EX60' 공개…휴긴코어로 “스스로 사고해 반응”",차세대 전기차 아키텍처 SPA3를 기반으로 볼보의 새 핵심 시스템 '휴긴코어(HuginCore)'로 구동된다. 휴긴코어는 △셀-투-바디(Cell-to-Body) 기술 △차세대 자체 개발 전기 모터 △새 배터리 셀 설계 △메가 캐스팅(Mega...,https://www.etnews.com/20260122000257,pos
2026-01-22 14:06,,구동모터코어,"볼보자동차, 순수 전기 SUV 'Volvo EX60' 공개...""1회 충전 주행거리 810k...","시스템, '휴긴코어(HuginCore)'로 구동된다. 여기에는 ▲셀-투-바디(Cell-to-Body) 기술 ▲차세대 자체 개발 전기 모터 ▲새로운 배터리 셀 설계 ▲메가 캐스팅(Mega casting) 기술 등 에너지 효율과 주행거리를 향상시킬 수...",https://www.joongangenews.com/news/articleView.html?idxno=488841,pos
2026-01-22 13:40,,구동모터코어,"볼보, 중형 전기 SUV 'EX60' 공개",사륜구동(AWD) 기준 1회 충전 주행 가능 거리는 최대 810km(WLTP 기준)로 볼보가 지금까지 공개한 전기차... 강화하는 '휴긴코어(HuginCore)'를 제시했다. 여기에는 ▲셀-투-바디 기술 ▲차세대 자체 개발 전기 모터 ▲새로운...,http://www.hansbiz.co.kr/news/articleView.html?idxno=810872,pos
2026-01-22 13:40,,구동모터코어,"볼보자동차, 중형 전기 SUV 'EX60' 세계 최초 공개","시스템, '휴긴코어(HuginCore)'로 구동된다. 여기에는 ▲셀-투-바디(Cell-to-Body) 기술 ▲차세대 자체 개발 전기 모터 ▲새로운 배터리 셀 설계 ▲메가 캐스팅(Mega casting) 기술 등 에너지 효율과 주행거리를 향상시킬...",https://www.epnc.co.kr/news/articleView.html?idxno=327686,pos
2026-01-22 13:34,,포스코,"포스코·대우·롯데, 새해부터 수주행진…정비사업으로 분위기 반전","건설 경기 침체 장기화와 원가 부담, 금융 환경 악화 등 복합적인 어려움 속에서도 대우건설·포스코이앤씨... 대우건설, 포스코이앤씨, 롯데건설이 대표적이다. 무리한 외형 확대보다는 사업성과 입지, 브랜드...",http://www.fntimes.com/html/view.php?ud=20260122111157462b372994c95_18,pos
2026-01-22 13:26,,구동모터코어,"달라지는 전기차 경쟁, 볼보자동차는 어디를 겨냥했나","셀-투-바디(Cell-to-Body), 메가 캐스팅(Mega Casting), 자체 개발 전기모터와 배터리 셀 설계가 결합되며, 생산 효율과 에너지 밀도를 동시에 끌어올렸다. 이 구조의 중심에는 볼보의 새로운 핵심 시스템 '휴긴코어(HuginCore)...",http://www.newsprime.co.kr/news/article.html?no=721262,pos
2026-01-22 13:19,,POSCO INTERNATIONAL,"블루포인트 투자 원자력 딥테크 3사, KAERI 코어기업 동시 선정","with POSCO Holdings to establish hydrogen startup Enphorus.... marketing international. RX possde des technologies cls pour l'ingnierie des centrales nuclaires de nouvelle gnration, notamment une plateforme de conception...",https://www.venturesquare.net/1034314/,pos
2026-01-22 12:40,,구동모터코어,"주유처럼 충전·최대 810㎞ 주행…볼보, ‘EX60’ 최초 공개","‘휴긴코어(HuginCore)’로 구동된다. 셀-투-바디(Cell-to-Body) 구조, 메가 캐스팅(Mega Casting), 차세대 전기 모터 및 배터리 셀 설계 등을 적용해 에너지 효율과 생산성을 동시에 높였다. 이를 통해 EX60은 볼보 전기차...",https://www.thedrive.co.kr/news/newsview.php?ncode=1065582011593576,pos
2026-01-22 12:02,,구동모터코어,"볼보자동차, 순수 전기 SUV 'EX60' 세계 최초 공개","시스템, '휴긴코어(HuginCore)'로 구동된다. 여기에는 ▲셀-투-바디(Cell-to-Body) 기술 ▲차세대 자체 개발 전기 모터 ▲새로운 배터리 셀 설계 ▲메가 캐스팅(Mega casting) 기술 등 에너지 효율과 주행거리를 향상시킬 수...",https://www.ebn.co.kr/news/articleView.html?idxno=1696301,pos
2026-01-22 11:58,,포스코인터내셔널,"""3명만 출전 확정""…장우진·신유빈, 탁구 아시안컵 남녀 단식 도전",19세 이하 U-19 선수 가운데 세계랭킹 100위 안에 들어 대한체육회 인정 국가대표 10명으로 자동 선발된 박가현 대한항공과 유예린 포스코인터내셔널에게도 출전 기회가 돌아갔다. 그러나 박가현과 유예린은 WTT 대회...,https://www.topstarnews.net/news/articleView.html?idxno=15941365,pos
2026-01-22 11:48,연합뉴스,포스코인터내셔널,탁구 아시안컵에 장우진·신유빈·김나영 3명만 출전,"22일 ATTU와 대한탁구협회에 따르면 우리나라는 남자 간판 장우진(세아)과 여자 에이스 신유빈(대한항공), 김나영(포스코인터내셔널)이 남녀 단식에 나선다. 아시안컵에는 국가별로 4명까지 출전할 수 있지만, 여러...",https://www.yna.co.kr/view/AKR20260122063500007?input=1195m,pos
2026-01-22 11:30,연합뉴스,구동모터코어,"볼보자동차, 첫 중형 전기SUV 'EX60' 세계 최초 공개","최대 주행가능거리 810㎞…휴긴코어 구동으로 안전 강화 볼보자동차는 스웨덴 스톡홀름에서 전기... 여기에다 메가 캐스팅, 셀-투-바디 기술, 차세대 전기 모터 등으로 에너지 효율을 개선하고, 탄소 배출을 낮췄다....",https://www.yna.co.kr/view/AKR20260122078600003?input=1195m,pos
2026-01-22 11:26,,포스코,"광양제철소, '포스코미술관 광양' 개관 1주년 기념 미술 세계 탐험",광양제철소가 '포스코미술관 광양' 개장 1주년을 앞두고 오는 24일부터 직원과... ‘포스아트(포스코 철강재를 활용한 고해상도 컬러강판)’를 기반으로 탁본과...,http://www.breaknews.com/1178669,pos
2026-01-22 11:20,잡포스트,포스코,"포스코퓨처엠 주가, 1월 22일 장중 214,500원 6.98% 상승","22일 오전 9시 40분 기준, 네이버페이 증권에 따르면 포스코퓨처엠의 주가가 지난 종가 대비 상승세를 보이고 있다. 현재 214,500원에 거래되며, 이는 지난 종가 200,500원보다 14,000원(6.98%) 오른 수치이다. 포스코...",https://www.job-post.co.kr/news/articleView.html?idxno=203287,pos
2026-01-22 11:14,,포스코인터,"美 최대 희토류 기업 에너지퓨얼스, 호주 ASM 인수…포스코인터 공급망...",에너지퓨얼스가 호주 ASM을 인수하면서 포스코인터내셔널의 공급망도 확대된다. 포스코인터내셔널은 지난해 3월 에너지퓨얼스와 네오디뮴-프라세오디뮴 산화물 납품 관련 전략적 업무협약을 체결했다. 양사는...,https://www.theguru.co.kr/news/article.html?no=97190,pos
2026-01-22 11:14,,구동모터코어,"810km 달리고 10분 충전… 볼보 'EX60', 전기 SUV 승부수","‘휴긴코어(HuginCore)’가 있다. 차량의 데이터 처리와 학습, 반응을 통합 관리하는 구조로 주행 성능과 에너지 효율, 안전 시스템을 동시에 끌어올린다. 셀-투-바디 기술과 메가 캐스팅 공법, 자체 개발 전기모터와...",http://www.shinailbo.co.kr/news/articleView.html?idxno=2181319,pos
2026-01-22 11:12,잡포스트,포스코,"포스코엠텍 주가, 1월 22일 장중 18,700원 2.13% 상승","22일 오전 10시 52분 기준, 네이버페이 증권에 따르면 포스코엠텍은 지난 종가 대비 상승세를 보이며... 포스코엠텍의 시가총액은 7,787억 원으로 코스닥 시장에서 127위에 위치하고 있다. 외국인 소진율은...",https://www.job-post.co.kr/news/articleView.html?idxno=203359,pos
2026-01-22 11:12,더팩트,구동모터코어,"볼보, 'EX60' 최초 공개…최대 810km 주행","파워트레인은 △최대 810km 주행이 가능한 P12 AWD Electric △최대 660km의 P10 AWD Electric △후륜구동 P6 Electric... 시스템 '휴긴코어'를 적용했다. 셀-투-보디, 메가 캐스팅, 자체 개발 전기 모터와 신규 배터리 셀 설계...",https://news.tf.co.kr/read/economy/2284873.htm,pos
