날짜,매체명,검색키워드,기사제목,주요기사 요약,URL
2025-12-07 09:18,,포스코인터내셔널,"포스코그룹 2026년 인사혁신, 안전경영 고도화와 젊은 리더십 배치","해외 투자 실행력을 높이기 위해 인도·미국 등 투자를 총괄하는 '전략투자본부'를 신설했고, 포스코인터내셔널은 LNG 전 밸류체인 시너지 강화를 위해 '에너지부문'을 새로 만들었다. 포스코이앤씨는 조직 운영 효율화를...",https://www.joongangenews.com/news/articleView.html?idxno=472853
2025-12-07 09:08,,포스코,"포스코이앤씨, AI 기반 레미콘 기술로 콘크리트 품질혁신 시대 열다",포스코이앤씨가 균일한 품질의 레미콘을 생산하는 'AI 기반 레미콘 품질예측 및 생산자동화 기술'을... 포스코이앤씨는 SHLab과 함께 인공지능(AI) 분석으로 품질 변화를 실시간으로 확인하고 자동으로 조정하는 기술을...,https://www.newswhoplus.com/news/articleView.html?idxno=48103
2025-12-07 08:42,딜사이트TV,포스코인터,[핀포인트] [LX인터내셔널] ROE 선두에서 꼴찌로…투자 매력 ‘뚝’,"⑤'25%' 군계일학서 '군학일계', 지위 하락…현대코퍼·포스코인터 대비 '열위' LX인터내셔널이 저조한 수익성으로 투자 매력도 하락을 겪고 있다. 대표적 수익성 지표인 ROE(자기자본이익률)가 상사 업계...",https://news.dealsitetv.com/articles/162460
2025-12-07 08:24,,포스코인터내셔널,"포스코그룹, 조직개편·임원인사 단행....'안전 최우선 경영체계 구축'","포스코그룹은 안전경영 체계 고도화를 위해 지난 9월 그룹 내 안전조직 강화·개편에 착수한 이래 안전전문 자회사인 ‘포스코세이프티솔루션’을 설립했고, 포스코의 ‘안전보건환경본부’, 포스코인터내셔널의...",https://www.kbsm.net/news/view.php?idx=500102
2025-12-07 05:39,,포스코인터내셔널,"'준우승 목표에 빨간불' 한국, 혼성단체 월드컵 4위로 4강행…중국과 결...","한국은 6일 중국 청두에서 열린 대회 2스테이지에서 남자팀의 장우진, 박강현(미래에셋증권), 안재현, 오준성(이상 한국거래소)과 여자팀의 이은혜(대한항공), 김나영(포스코인터내셔널), 최효주(한국마사회)를...",http://www.thesportstimes.co.kr/news/articleView.html?idxno=368964
2025-12-07 00:20,,구동모터코어,"수소차 관련주, '웃음꽃' 두산퓨얼셀·한온시스템·SJG세종·유일에너테...","삼보모터스, 평화산업, 지엠비코리아, 아진전자부품, 동아화성, 영화테크, 엔케이, 제이엔케이글로벌... 타기구동장치 등 방산 장비의 국산화를 위한 연구개발에도 속도를 내고 있다. 대창솔루션은 해양솔루션 부문...",http://www.finomy.com/news/articleView.html?idxno=244766
2025-12-06 23:26,포인트데일리,포스코인터내셔널,"탁구 혼성단체, 월드컵 4강 진출…중국과 격돌","남자부 장우진, 박강현(미래에셋증권), 안재현, 오준성(이상 한국거래소)과 여자부 이은혜(대한항공), 김나영(포스코인터내셔널), 최효주(한국마사회)로 구성된 한국 대표팀은 2스테이지에서 4승3패를 기록했다. 승점...",https://www.pointdaily.co.kr/news/articleView.html?idxno=283534
2025-12-06 22:40,,포스코,"포스코퓨처엠, 미국 팩토리얼과 전고체 배터리 기술개발 업무협약...벤...",포스코퓨처엠은 미국 전고체 배터리 기업 팩토리얼에너지(팩토리얼)와 전고체 배터리 기술개발을 위한 전략적 협력 업무협약(MOU)를 체결했다고 6일 밝혔다. 포스코퓨처엠에 따르면 협약은 지난달 25일 독일에서 열린 퓨처...,http://www.econonews.co.kr/news/articleView.html?idxno=417306
2025-12-06 22:18,,포스코인터내셔널,크로아 꺾었는데 4강 상대가 중국이네,"한국은 6일 중국 청두에서 열린 대회 2스테이지에서 남자팀의 장우진, 박강현(미래에셋증권), 안재현, 오준성(이상 한국거래소)과 여자팀의 이은혜(대한항공), 김나영(포스코인터내셔널), 최효주(한국마사회)를...",https://www.sedaily.com/NewsView/2H1MKC7B95
2025-12-06 22:13,,포스코인터내셔널,"한국 탁구, 크로아티아 꺾고 혼성단체 월드컵 4강 확정",첫 번째 혼합복식에 나선 박강현(미래에셋증권)-김나영(포스코인터내셔널) 조는 이보르 반-하나 아라포비치 조를 2-1(11-5 11-9 12-14)로 꺾었다. 2매치 여자단식에선 이은혜(대한항공)가 레아 라코바치에 1-2(9-11 8-11 11...,https://www.newsis.com/view/NISX20251206_0003431175
2025-12-06 21:48,연합뉴스,포스코인터내셔널,"한국 탁구, 혼성단체 월드컵 4위로 4강행…중국과 결승행 다툼(종합)","한국은 6일 중국 청두에서 열린 대회 2스테이지에서 남자팀의 장우진, 박강현(미래에셋증권), 안재현, 오준성(이상 한국거래소)과 여자팀의 이은혜(대한항공), 김나영(포스코인터내셔널), 최효주(한국마사회)를...",https://www.yna.co.kr/view/AKR20251206032101007?input=1195m
2025-12-06 21:46,,포스코인터내셔널,"포스코그룹, 2026년 정기 조직개편 및 임원인사 단행… '안전 최우선' 경...","포스코그룹은 안전경영 체계 고도화를 위해 지난 9월 그룹 내 안전조직 강화·개편에 착수한 이래 안전 전문 자회사인 '포스코세이프티솔루션'을 설립했고 포스코의 '안전보건환경본부', 포스코인터내셔널의...",https://www.polinews.co.kr/news/articleView.html?idxno=716066
2025-12-06 20:59,,포스코인터내셔널,"포스코그룹, 2026년 정기 조직개편 및 임원인사 단행","포스코그룹은 안전경영 체계 고도화를 위해 지난 9월 그룹 내 안전조직 강화·개편에 착수한 이래 안전전문 자회사인 '포스코세이프티솔루션'을 설립했고, 포스코의 '안전보건환경본부', 포스코인터내셔널의...",http://www.enewstoday.co.kr/news/articleView.html?idxno=2365540
2025-12-06 19:04,,포스코인터내셔널,"[탁구] 한국, 혼성단체 월드컵서 장우진 활약에도 독일에 7-8 석패","한국은 6일 중국 쓰촨성 청두에서 열린 대회 2스테이지 5차전에서 남자팀의 장우진, 박강현(미래에셋증권), 안재현(한국거래소)과 여자팀의 이은혜(대한항공), 김나영(포스코인터내셔널), 최효주(한국마사회)를...",https://www.newscj.com/news/articleView.html?idxno=3348828
2025-12-06 18:37,,포스코인터내셔널,"'中 우회 작전' 결국 불발…'신유빈 결장' 한국 탁구, 독일에 분패→2스...","한국은 6일 중국 쓰촨성 청두에서 열린 대회 2스테이지 5차전에서 남자팀의 장우진(세아), 박강현(미래에셋증권), 안재현(한국거래소)과 여자팀의 이은혜(대한항공), 김나영(포스코인터내셔널), 최효주(한국마사회)...",https://www.spotvnews.co.kr/news/articleView.html?idxno=786083
2025-12-06 17:46,,포스코인터내셔널,"포스코그룹, 조직개편·임원인사…승진자 14%가 여성","포스코 깃발/사진=연합뉴스 그룹 차원에서는 안전 경영 체계 고도화를 위해 안전 전문 자회사인 '포스코세이프티솔루션'을 설립하고, 포스코에 '안전보건환경본부', 포스코인터내셔널에 '안전기획실'을 각각 신설해 안전...",https://www.asiatime.co.kr/article/20251206500016
2025-12-06 17:00,,포스코인터내셔널,"한국 탁구, 혼성단체 월드컵서 독일에 석패…4위로 추락","한국은 6일 중국 쓰촨성 청두에서 열린 대회 2스테이지 5차전에서 남자팀의 장우진, 박강현(미래에셋증권), 안재현(한국거래소)과 여자팀의 이은혜(대한항공), 김나영(포스코인터내셔널), 최효주(한국마사회)를...",https://www.newsis.com/view/NISX20251206_0003431123
2025-12-06 16:42,연합뉴스,포스코인터내셔널,"한국 탁구, 혼성단체 월드컵서 장우진 활약에도 독일에 7-8 석패","한국은 6일 중국 쓰촨성 청두에서 열린 대회 2스테이지 5차전에서 남자팀의 장우진, 박강현(미래에셋증권), 안재현(한국거래소)과 여자팀의 이은혜(대한항공), 김나영(포스코인터내셔널), 최효주(한국마사회)를...",https://www.yna.co.kr/view/AKR20251206032100007?input=1195m
2025-12-06 16:16,,포스코인터내셔널,"포스코그룹, 2026년 조직·임원 개편… ‘안전·DX·글로벌 투자’ 속도...","포스코에는 '안전보건환경본부', 포스코인터내셔널에는 '안전기획실'을 각각 신설해 그룹 차원의 안전 혁신을 주도할 수 있는 조직 체계를 구축했다. 포스코는 글로벌 투자 실행력을 높이기 위해 인도, 미국 등 해외...",http://www.metroseoul.co.kr/article/20251206500182
2025-12-06 14:56,,포스코,"뉴로메카, 포스코 철강 품질 검사 작업 무인화...인적 오류 최소화한다","포스코 재질 시험(Material Testing) 공정 로봇 자동화 솔루션 시연 완료 작업자 개입 제로 목표, 단절 공정... 사측은 자사 포항지사에서 철강 제조 업체 포스코(POSCO) 관계자들이 참석한 가운데 이 같은 과정을 검증했다....",https://www.hellot.net/news/article.html?no=107926
2025-12-06 14:04,,포스코인터내셔널,"포스코그룹, 조직개편·임원인사 단행…""안전 최우선 경영""","이어 포스코 '안전보건환경본부', 포스코인터내셔널의 '안전기획실'을 각각 신설하는 등 전사차원으로 안전혁신을 주도할 수 있는 조직체계로 정비했다. 포스코는 글로벌 투자 실행력을 높이기 위해 인도, 미국 등 해외...",https://www.newspost.kr/news/articleView.html?idxno=219269
2025-12-06 13:20,,포스코인터내셔널,"가레소 기관, 삼성전자·현대차 3천억 넘게 사들였다","이수페타시스, 한올바이오파마, 포스코인터내셔널, 동원산업, 한미약품, 경동나비엔, 미래에셋증권, 코오롱도 순매도 명단에 포함되며 일부 경기방어 업종에도 비중 축소 흐름이 나타났다. 전문가들은 기관의 매수·매도...",https://www.pinpointnews.co.kr/news/articleView.html?idxno=403258
2025-12-06 12:56,컨슈머타임스,포스코인터내셔널,"포스코그룹, 정기 조직개편·임원인사 단행…안전·투자·DX 전환에 '방점...","그룹 차원에서는 안전경영 체계 고도화를 위해 안전전문 자회사 '포스코세이프티솔루션'을 설립했고, 포스코에 '안전보건환경본부', 포스코인터내셔널에 '안전기획실'을 각각 신설해 전사차원으로 안전혁신을 주도할 수...",https://www.cstimes.com/news/articleView.html?idxno=682270
2025-12-06 12:40,경북일보,포스코,[부고] 박남문(포스코 과장)씨 부친상,"▲박정길(향년 85)씨 별세, 박남실(자영업)·박남문(포스코 과장, 경북일보 시민기자)·박남기(자영업)·박미숙(자영업)씨 부친상, 강정희(자영업)·하수자(사회복지사)씨 시부상, 정현호(리엔지어링 과장)씨 장인상...",https://www.kyongbuk.co.kr/news/articleView.html?idxno=4058644
2025-12-06 12:36,,포스코,"동원 vs 포스코, HMM 인수전 2파전…10조 원 승부 시작됐다",이미 대규모 인수자문단을 꾸린 포스코에 이어 동원그룹도 전담 태스크포스(TF)를 구성하며 실사를 준비하는... 포스코가 이미 대규모 자문단을 구성하고 인수 검토를 진행 중인 상황에서 동원의 합류는 인수전 균형을...,https://www.pinpointnews.co.kr/news/articleView.html?idxno=403248
2025-12-06 10:24,,포스코인터내셔널,"""잠자던 북극의 거인 깨우다"" 포스코인터내셔널, 그리고 알래스카",미국 에너지부 청사에서 지난 1일(현지시간) 포스코인터내셔널과 글렌파른(Glenfarne) 알래스카 LNG의 전략적 파트너십 체결식이 열렸다. 반세기 가까이 가능성의 영역에만 머물러 있던 북미 최대의 에너지 프로젝트가...,https://www.econovill.com/news/articleView.html?idxno=721146
2025-12-06 09:00,에너지경제,포스코,"[10대그룹 넥스트 (下)] 포스코·롯데, 외형·수익성 다 후퇴…‘하위권...",[편집자주] 포스코와 롯데그룹은 국내 10대그룹 중 하위권을 차지했다. 최근 3~4년 동안 외형과 수익성... 하지만 포스코와 롯데는 이와 반대로 외부 환경의 충격이 실적에 그대로 반영되는 구조적 한계를 보였다. 당장의...,https://www.ekn.kr/web/view.php?key=20251205028404948
2025-12-06 08:25,연합뉴스,포스코인터내셔널,일본에 막힌 한국 탁구…혼성단체 월드컵 결승 진출 이뤄낼까,"혼합복식에선 왼손 박강현(미래에셋증권)과 김나영(포스코인터내셔널) 조합, 왼손 최효주와 오준성 조합을 번갈아 가동했다. 반면 일본은 '하리모토 오누이'인 도모카즈와 미와를 앞세워 쟁쟁한 실력을 자랑한다....",https://www.yna.co.kr/view/AKR20251206013200007?input=1195m
2025-12-06 08:08,,포스코인터내셔널,"포스코그룹, 조직개편·임원인사 단행…안전·투자·DX전환에 무게","포스코그룹은 우선 안전 경영 체계 고도화를 위해 안전 전문 자회사인 '포스코세이프티솔루션'을 설립하고, 포스코에 '안전보건환경본부', 포스코인터내셔널에 '안전기획실'을 각각 신설해 안전 기능을 강조했다....",https://www.imaeil.com/page/view/2025120522391614032
2025-12-06 07:44,,포스코인터내셔널,"포스코그룹, 임원 16% 줄였다…조기 조직개편·인사 단행 [AI 프리즘*신입...","또한 포스코에 ‘안전보건환경본부’를, 포스코인터내셔널에 ‘안전기획실’을 신설하는 등 안전 조직을 강화했고 글로벌 투자 실행력을 높이기 위해 ‘전략투자본부’를 개설하고 DX 역량 집중을 위해 관련...",https://www.sedaily.com/NewsView/2H1MHGR0UL
2025-12-06 07:00,,포스코인터내셔널,"포스코그룹, 안전경영과 디지털 전환에 초점 맞춘 조직개편 단행","포스코는 안전 전문 자회사인 '포스코세이프티솔루션'을 설립하고, 포스코와 포스코인터내셔널에 각각 '안전보건환경본부'와 '안전기획실'을 신설하여 안전 기능을 강화했다. 또한, 포스코는 인도와 미국 등 해외 투자...",http://www.newsroad.co.kr/news/articleView.html?idxno=50357
2025-12-06 07:00,이투데이,포스코인터내셔널,‘연매출 7조‘ 지켜라...대수술 들어간 포스코그룹,"이투데이=정진용 기자 | 포스코 ‘전략투자본부’, 포스코인터내셔널 ‘에너지부문’ 신설 포스코이앤씨, ‘플랜트사업본부’·‘인프라사업본부’ 통합 포스코퓨처엠 에너지소재사업본부...",https://www.etoday.co.kr/news/view/2533341
2025-12-06 07:00,이투데이,포스코인터내셔널,‘연매출 7조’ 지켜라...대수술 들어간 포스코그룹,"이투데이=정진용 기자 | 포스코 ‘전략투자본부’, 포스코인터내셔널 ‘에너지부문’ 신설 포스코이앤씨, ‘플랜트사업본부’·‘인프라사업본부’ 통합 포스코퓨처엠 에너지소재사업본부...",https://www.etoday.co.kr/news/view/2533341
2025-12-06 06:44,,포스코인터내셔널,"포스코그룹, 안전 최우선 경영체계 구축...정기 조직개편 및 임원인사","포스코그룹은 안전경영 체계 고도화를 위해 지난 9월 그룹 내 안전조직 강화·개편에 착수한 이래 안전전문 자회사인 ‘포스코세이프티솔루션’을 설립했고, 포스코의 ‘안전보건환경본부’, 포스코인터내셔널의...",https://www.wikitree.co.kr/articles/1100382
