날짜,매체명,검색키워드,기사제목,주요기사 요약,URL
2025-12-29 11:08,,포스코,'사고발 적자'…3대 신평사가 찍은 포스코이앤씨 위기 포인트,포스코이앤씨가 국내 3대 신용평가사로부터 동시에 '부정적' 전망을 부여받았다. 신용등급 (A+) 자체는... 29일 크레딧 업계에 따르면 포스코이앤씨의 신용등급(A+) 전망이 종전 '안정적'에서 '부정적'으로 조정됐다....,https://www.ebn.co.kr/news/articleView.html?idxno=1692911
2025-12-29 11:01,,포스코,"포스코, 고객 맞춤형 통합 플랫폼 'My POSCO' 오픈…디지털 혁신으로 고...",포스코가 고객사들을 위한 제품 주문 디지털 플랫폼을 개편했다. 최근 포스코는 기존 제품 홍보 페이지와 온라인 주문·출하 채널(e-Sales)을 하나로 통합한 ‘My POSCO’를 공식 오픈했다고 29일 밝혔다. 회사는 보다...,https://www.hankyung.com/article/202512299675O
2025-12-29 10:58,스마트투데이,포스코,내홍 딛고 다시 움직이는 성수2지구...삼성·DL·포스코 '물밑 수주전' ...,포스코이앤씨 역시 기존 '불참' 입장에서 '참여 검토'로 입장을 선회할 가능성이 거론되며 2차 입찰은 경쟁구도로 전개될 수 있다는 전망이 정비업계에서 나오고 있다. ◆ 삼성·DL “입찰 참여 검토 중”…포스코이앤씨도...,https://www.smarttoday.co.kr/ko-kr/articles/99925
2025-12-29 10:54,,포스코,안전관리 소홀로 노동자 추락사…포스코이앤씨 벌금 1천만원,관련해 포스코이앤씨와 하청 업체들이 안전관리 소홀로 벌금형을 선고받았다.인천지법 형사9단독 정제민 판사는 산업안전보건법 위반 혐의로 기소된 포스코이앤씨와 이 회사 소속 현장소장 A(60)씨에게 벌금 1000만원을...,https://www.kbsm.net/news/view.php?idx=502922
2025-12-29 10:48,,삼척블루파워,"포스코이앤씨, 9개월새 단기차입 3배 급증...""신용등급 강등 위기""",비주택부문에선 삼척블루파워(공기연장 중재) 및 폴란드 바르샤바 소각로(준공 지연) 등 일부 현장에서 운전자금 회수가 지연되고 있다. ▲포스코이앤씨의 주요 현금흐름 추이(나신평) 이처럼 영업을 해도 들어오는...,http://www.newsfc.co.kr/news/articleView.html?idxno=75850
2025-12-29 10:30,,포스코,"포스코dx, 12월 29일 장중 30,150원 7.29% 상승","따르면 포스코dx는 지난 종가 대비 상승하며 30,150원에 거래되고 있다. 주가는 27,750원으로 출발하여... 포스코dx의 시가총액은 4조 5,762억 원으로 코스피 시장에서 108위를 기록하고 있다. 주가수익비율(PER)은...",https://www.joongangenews.com/news/articleView.html?idxno=480754
2025-12-29 08:42,,포스코,안전관리 소홀로 작업자 숨져…포스코이앤씨 등 벌금형,"안전관리에 소홀해 타워크레인 작업자가 숨진 사고와 관련, 포스코이앤씨와 하청업체들이 벌금형을 선고받았다. 29일 법조계에 따르면 인천지법 형사9단독 정제민 판사는 산업안전보건법 위반 혐의로 기소된 포스코이...",https://www.kyeonggi.com/article/20251229580012
2025-12-29 08:18,뉴스1,포스코,'공사현장 노동자 추락사 안전조치 미흡' 포스코 벌금 1000만원,인천지법 형사9단독 정제민 판사는 산업안전보건법 위반 혐의로 기소된 포스코이앤씨에게 벌금 1000만 원을... 산업안전보건법 위반과 업무상과실치사 혐의로 기소된 포스코이앤씨 소속 현장 소장과 하청업체 소속...,https://www.news1.kr/local/incheon/6021859
2025-12-29 07:56,,포스코,안전관리 소홀로 노동자 추락사…포스코이앤씨 벌금 1000만원,포스코이앤씨와 하청 업체들이 지난 2021년 재개발 공사 현장에서 30대 노동자가 숨진 사고와 관련해... 인천지법 형사9단독 정제민 판사는 산업안전보건법 위반 혐의로 기소된 포스코이앤씨와 이 회사 소속 현장소장 A...,https://www.hankyung.com/article/2025122989827
2025-12-29 07:46,,포스코,"법원, 안전 장비 없어 노동자 추락사… 포스코이앤씨 벌금형 ""안전 확인...",관련해 포스코이앤씨와 하청 업체들이 안전관리 소홀 책임으로 벌금형을 선고받았다. 인천지법 형사9단독 정제민 판사는 29일 산업안전보건법 위반 혐의로 기소된 포스코이앤씨와 소속 현장소장 A(60)씨에게 각각 벌금...,https://www.newscj.com/news/articleView.html?idxno=3356764
2025-12-29 07:28,디지털타임스,포스코,"포스코이앤씨, 인천 부평 ‘노동자 추락사’ 벌금 1천만원…“안전관리...",포스코이앤씨와 하청 업체들이 2021년 재개발 공사 현장에서 30대 노동자가 숨진 사고와 관련해 안전관리 소홀로 벌금형을 선고받았다. 인천지법 형사9단독 정제민 판사는 산업안전보건법 위반 혐의로 기소된 포스코이...,https://www.dt.co.kr/article/12037574?ref=naver
2025-12-29 07:20,,포스코,4년 전 안전관리 소홀로 노동자 추락사…포스코이앤씨 벌금 1천만원,관련해 포스코이앤씨와 하청 업체들이 안전관리 소홀로 벌금형을 선고받았습니다. 인천지법 형사9단독 정제민 판사는 산업안전보건법 위반 혐의로 기소된 포스코이앤씨와 이 회사 소속 현장소장 A(60)씨에게 벌금...,https://biz.sbs.co.kr/article_hub/20000281214?division=NAVER
2025-12-29 07:18,철강금속신문,포스코,"포스코미술관, 특별전 '한지 스펙트럼' 개최…안치용 한지장 참여",포스코미술관은 지난 15일부터 내년 2월 1일까지 국내에 단 4명뿐인 국가무형유산 한지장 중 한 명인 안치용을... 특히 이번 전시는 포스코 철강제품을 활용해 전통문화의 맥을 이어가기 위한 실질적 해결책을 제시했다....,http://www.ferrotimes.com/news/articleView.html?idxno=45453
2025-12-29 07:18,철강금속신문,포스코,"포스코 광양제철소, 특수아동 치유지원 '희망의 징검다리' 사업 발대",포스코 광양제철소는 지난 24일 광양시 육아종합지원센터에서 '희망의 징검다리' 사업 발대식을 열고 지역... 이번 사업에는 포스코 임직원들의 급여 1%로 조성된 포스코1%나눔재단이 6천만원을 지원했다. 또...,http://www.ferrotimes.com/news/articleView.html?idxno=45452
2025-12-29 07:17,연합뉴스,포스코,안전관리 소홀로 노동자 추락사…포스코이앤씨 벌금 1천만원,관련해 포스코이앤씨와 하청 업체들이 안전관리 소홀로 벌금형을 선고받았다. 인천지법 형사9단독 정제민 판사는 산업안전보건법 위반 혐의로 기소된 포스코이앤씨와 이 회사 소속 현장소장 A(60)씨에게 벌금 1천만원을...,https://www.yna.co.kr/view/AKR20251226046000065?input=1195m
2025-12-29 07:00,코리아타임스,POSCO INTERNATIONAL,[Contribution] Kazakhstan and Korea: Deepening an enhanced strategic part...,"In May 2025, the Governor of the Astana International Financial Centre, Renat Bekturov, visited... and POSCO. These enterprises play a vital role in key sectors ranging from automotive...",https://www.koreatimes.co.kr/path/A2025122309440003605
2025-12-29 06:10,,포스코,"[아듀! 2025] 포스코-현대제철, 관세 장벽에 '루이지애나 동맹' 결성",이에 업계 라이벌인 포스코와 현대제철은 공동 대응에 나섰다. 16일 현대제철은 현대차그룹과 포스코그룹과 함께 미국 루이지애나주에 전기로(EAF) 제철소를 건설하기로 확정했다. 관세 장벽 우회를 위해 '적과의 동침'을...,https://www.moneys.co.kr/article/2025122610435718658
2025-12-29 05:42,디지털타임스,포스코,"포스코, 中 철강 덤핑 봉쇄 선봉장 나섰다","가운데, 포스코가 적극적인 제소를 통해 현지법인 제철소 살리기에 나서고 있다. 28일 철강업계에 따르면 튀르키예 정부는 전날 공식 관보 공고문을 통해 중국산 냉연 스테인리스 반덤핑관세를 확정했다. 포스코와...",https://www.dt.co.kr/article/12037545?ref=naver
2025-12-28 23:46,,포스코,"포스코퓨처엠, CNGR과 LFP 양극재 합작투자계약 체결...LFP 양극재 공장...",포스코퓨처엠은 급성장하는 에너지저장장치(ESS) 시장에 대응해 중저가용 배터리소재인 LFP 양극재 사업 추진에 속도를 낸다고 28일 밝혔다. 포스코퓨처엠은 중웨이신소재(CNGR) 및 CNGR의 한국 자회사인 피노(FINO)와...,http://www.econonews.co.kr/news/articleView.html?idxno=420485
2025-12-28 20:35,,포스코,"포스코 클린오션 봉사단, 호미곶 수중·연안 정화활동",[경상매일신문=신일권기자]영하의 기온과 거센 바닷바람이 몰아치는 매서운 겨울 날씨도 지역 사회를 향한 포스코 클린오션 봉사단원들의 뜨거운 열정을 막지는 못했다.포스코 클린오션 봉사단(단장 이춘선)은 지난 27일...,https://www.ksmnews.co.kr/news/view.php?idx=583243
2025-12-28 17:48,,포스코,포스코 컴퓨터봉사단 상대동에 PC 나눔 실천,포스코 설비기술부 '컴퓨터 봉사단'이 직접 조립한 컴퓨터를 상대동 지역아동센터에 전달한 후 기념 촬영을 하고 있다. 사진=포항남구청 제공 포항시 남구 상대동 행정복지센터 자매부서인 포스코 설비기술부 '컴퓨터...,http://www.hidomin.com/news/articleView.html?idxno=603491
2025-12-28 17:00,,포스코,"포스코이앤씨, 잇단 인명사고에 신용등급 전망 '부정적'",국내 주요 신용평가사들이 포스코이앤씨의 무보증사채 등급전망을 기존 '안정적'에서 '부정적'으로 일제히... 28일 신용평가 업계에 따르면 한국신용평가는 지난 26일 포스코이앤씨의 무보증사채 신용등급을 A+로 유지하는...,https://www.bloter.net/news/articleView.html?idxno=650486
2025-12-28 16:26,,포스코,[오피셜] '2부 전남서 1부 포항으로' 포스코 구단으로의 이적... 김예성...,2부리그(K리그2) 전남드래곤즈에서 실력을 검증한 뒤 또 다른 포스코 구단인 1부리그(K리그1) 포항스틸러스로 이적한 측면 수비수 김예성이 입단 소감을 전했다. 포항스틸러스는 보도자료를 통해 전남드래곤즈에서...,https://www.besteleven.com/news/articleView.html?idxno=303066
2025-12-28 16:24,경북일보,포스코,"포스코교육재단, 포항서 SW·AI 해커톤 캠프 개최",포스코교육재단과 포항제철중학교는 지난 27일 포항지역 중·고등학생을 대상으로 '2025 SW·AI 창의융합... 참가비와 식사비 전액을 포스코그룹이 지원했으며 포항지역 중·고생 약 120명이 참여했다. 캠프는 오전 9시부터...,https://www.kyongbuk.co.kr/news/articleView.html?idxno=4060461
2025-12-28 11:54,,포스코,"한경국립대&포스코 1% 나눔재단, 장애학생 장학금 전달식 개최",한경국립대학교(총장 직무대리 김태완)는 포스코 1% 나눔재단 장학금 전달식이 24일 평택 캠퍼스 미래관에서... 한경국립대학교는 2022년 국내 1호 자회사형 장애인 표준사업장인 포스코휴먼스와 '고등교육 기반 장애인...,https://www.joongdo.co.kr/web/view.php?key=20251228010010418
2025-12-28 11:29,연합뉴스,포스코,포스코 포항제철소 위로 솟는 태양,새해를 앞둔 28일 경북 포항의 포스코 포항제철소 위로 해가 솟아오르고 있다. 2025.12.28,https://www.yna.co.kr/view/PYH20251228023600053?input=1196m
2025-12-28 11:07,문화일보,포스코,"포스코미술관, ‘한지 스펙트럼’전 개최…안치용 한지장 참여",포스코미술관 ‘한지 스펙트럼’ 특별전 포스터. 포스코홀딩스 제공 포스코홀딩스는 서울 강남구 포스코센터 내 포스코미술관에서 내년 2월 1일까지 특별전 ‘한지 스펙트럼’이 열린다고 28일 밝혔다. 이번 특별전에는...,https://www.munhwa.com/article/11557025?ref=naver
2025-12-28 09:00,,포스코,'휴머노이드가 일하는 현장'…포스코·현대차·삼성·LG 본격화,"이러한 글로벌 흐름 속에서 포스코그룹, 현대차그룹, 삼성, LG 등 국내 주요 대기업들이 미국 휴머노이드... 포스코, 제철소 '위험 현장'에 휴머노이드 투입한다 포스코그룹은 최근 미국 산업용 휴머노이드 로봇 기업...",https://www.newsis.com/view/NISX20251224_0003454383
2025-12-28 08:56,,포스코인터내셔널,"韓, R&D 투자 131조 원 ‘세계 2위’ 등극… 韓·美·日 ‘에너지 혈맹’...",지난 9월 일본 JERA와 한국 포스코인터내셔널이 알래스카 LNG 사업에 대한 의향서 및 파트너십을 체결하며 협력을 구체화했다. 중동 석유 의존도와 홍해·남중국해 등 불안한 해로 문제를 해결하기 위해 미국 수출...,https://www.g-enews.com/view.php?ud=2025122808523444950c8c1c064d_1
2025-12-27 12:16,,포스코플로우,"[취준생을 위하여(276)] 포스코플로우, 글로벌 공급망 재편의 '대안'을 ...","포스코플로우, 글로벌 네트워크 확장과 AI혁신은 글로벌 공급망의 '대안'을 겨냥해 ‘고용절벽’ 시대의 효율적인 취업전략은 무엇일까요. 주요기업 인사담당자들은 한결같이 직무능력을 키우라고 조언합니다. 지원...",https://www.news2day.co.kr/article/20251226500185
2025-12-27 10:26,세계일보,포스코,"포스코이앤씨, 신안산선 인명사고 여파…신평사 3곳서 등급전망 ‘부정...",맡았던 포스코이앤씨의 송치영 사장이 현장을 찾아 사과하고 있다. 연합뉴스 신안산선 공사 현장에서 인명사고가 발생한 포스코이앤씨가 국내 주요 신용평가사 3곳으로부터 잇따라 신용등급 전망 하향 조정을 받았다....,https://www.segye.com/newsView/20251227502491?OutUrl=naver
2025-12-27 09:02,,포스코,‘철강·소재·탄소중립’ 편대 구축 포스코…미래 경쟁력 ‘탄탄대로’,"7% 달성, 철강 수익성 완연한 회복세 포스코퓨처엠 1분기 흑자전환 후 양극재 판매 호조…공급망 가치 증명 수소환원제철(HyREX) 예타 통과, 국가전략기술 지정…미래 동력 확보 장인화 포스코그룹 회장.(사진=포스코...",https://www.asiatime.co.kr/article/20251226500215
2025-12-27 02:16,,포스코,"""철이 지켜낸 한지의 맥""…포스코미술관, '한지 스펙트럼' 展 개최","©AP신문(AP뉴스)/이미지 제공 = 포스코홀딩스 ▲안치용 한지장 전시 전경 포스코미술관은 국내에 단 4명뿐인 국가무형유산 한지장(韓紙匠) 중 한 명인 안치용을 필두로, 현대적인 감각의 박송희·소동호 작가가 참여한...",https://www.apnews.kr/news/articleView.html?idxno=3044122
2025-12-27 00:40,뉴스워커,포스코,"전남녹색연합, 포스코 광양제철소 환경자원화그룹과 함께 '세풍습지 겨...",이번 세풍습지 겨울철새 조사에는 포스코 광양제철소 환경자원그룹 직원들과 함께 정기 조사를 실시할 예정이다. 구체적 조사 일정으로는 2025년 12월 22일 부터 2026년 2월 까지 5차례 조사를 시작으로 사계절 조사를...,http://www.newsworker.co.kr/news/articleView.html?idxno=408512
2025-12-27 00:02,,포스코,"포스코이앤씨, 인프라 조직 축소…SOC 확대 기조와 엇박자","최근 포스코이앤씨가 인프라(토목) 조직을 본부 단위에서 '실' 단위로 낮추는 방식으로 축소하면서, 정부가 추진 중인 사회간접자본(SOC) 확대 기조에도 난항이 예상되고 있다. ▲ 포스코이앤씨 사옥(사진=포스코이앤씨)...",https://www.greened.kr/news/articleView.html?idxno=334805
2025-12-26 22:02,G경제,포스코,"신안산선 참사 여파…포스코이앤씨, 신용등급 전망 ‘줄하향’",포스코이앤씨의 신용도에 직격탄이 됐다. 인명 피해를 동반한 중대 사고 이후 국내 3대 신용평가사가 잇따라 등급 전망을 하향 조정하며 경영 리스크를 공식화했다. 26일 신용평가업계에 따르면 나이스신용평가는 포스코...,https://www.geconomy.co.kr/news/article.html?no=312966
2025-12-26 21:34,,삼척블루파워,"삼척시종합사회복지관, ‘우리 동네 희망 산타’ 성탄 선물 나눔 행사 ...","본 행사는 한국가스기술공사 삼척기지 지사, 국방과학연구소 삼척 해양연구센터, 삼척 블루파워, 한전KPS 삼척사업소, 국민건강보험공단 삼척지사, 삼표시멘트 자원 봉사단 등 여러 기관과 개인의 도움으로 총 1,060만 원...",http://www.cfnews.kr/news.aspx/103932
2025-12-26 20:18,,포스코,"[비즈투데이] 포스코미술관, '한지 스펙트럼'전 개최",포스코미술관이 한지장의 장인정신이 깃든 전통 한지부터 젊은 작가들의 시선으로 재해석된 현대적 작품을... 관람은 무료이며 포스코미술관은 관람객들이 도록과 기념품을 구매해 모인 수익금을 대형 한지 제작에...,https://www.obsnews.co.kr/news/articleView.html?idxno=1508562
2025-12-26 19:32,딜라이트이슈,포스코,"'신안산선 사고' 포스코이앤씨, 신평3사 등급전망 줄줄이 하락",맡았던 포스코이앤씨의 송치영 사장이 현장을 찾아 사과하고 있다. (사진=연합뉴스) 붕괴 사고로 인명피해가 있었던 신안산선 시공사 포스코이앤씨가 국내 신용평가사 3곳에서 줄줄이 등급전망 하향 조정을 받았다....,https://www.delighti.co.kr/news/articleView.html?idxno=108572
2025-12-26 18:50,뉴스핌,포스코,"신안산선 사고 책임 논란…포스코이앤씨, 신용등급 하락 우려",발생한 포스코이앤씨가 신용평가사들로부터 동시에 경고 신호를 받았다. 지난 18일 작업자 매몰 사고가 일어난 여의도역 신안산선 공사현장. [사진=신수용 기자] 26일 신용평가업계에 따르면 포스코이앤씨는 국내...,https://www.newspim.com/news/view/20251226000732
2025-12-26 17:48,,포스코,"'잇단 붕괴 사망' 포스코이앤씨, 신용등급 전망 '줄하향'",포쓰저널 송신용 기자 2025년 12월 18일 포스코이앤씨가 시공 중인 서울 여의도역 신안산선 공사 현장 지하 약... /사진=서울소방재난본부 신안산선 공사 현장에서 발생한 붕괴 사고로 인명 피해가 난 이후 시공사인 포스코...,http://www.4th.kr/news/articleView.html?idxno=2103855
2025-12-26 17:23,연합뉴스,포스코,"'신안산선 사고' 포스코이앤씨, 신평3사 등급전망 줄줄이 하락(종합)","포스코이앤씨 ""안전 최우선 전사적 관리 강화 통해 성장기반 마련"" 붕괴 사고로 인명피해가 있었던 신안산선 시공사 포스코이앤씨가 국내 신용평가사 3곳에서 줄줄이 등급전망 하향 조정을 받았다. 지난 18일...",https://www.yna.co.kr/view/AKR20251226108651008?input=1195m
2025-12-26 17:23,,포스코,"신안산선 붕괴 사고…포스코이앤씨, 국내 3대 신평사서 등급전망 '부정...",붕괴 사고로 인명 피해가 발생한 신안산선 시공사 포스코이앤씨가 국내 주요 신용평가사 3곳으로부터 잇따라... 신용평가업계에 따르면 나이스신용평가는 포스코이앤씨의 장기신용등급 전망을 기존 '안정적'에서 '부정적...,https://biz.sbs.co.kr/article_hub/20000281012?division=NAVER
2025-12-26 17:12,,포스코,"'신안산선 사고' 포스코이앤씨, 신용평가사 등급전망 하락 잇따라",여의도 신안산선 공사 현장 붕괴 사고로 인명피해가 있었던 포스코이앤씨가 국내 신용평가사 3곳에서 잇따라 등급전망 하향 조정을 받았다. 나이스신용평가는 포스코이앤씨의 장기신용등급 등급 전망을 기존 '안정적...,https://www.hinews.co.kr/view.php?ud=202512261703009552841d93525b_48
2025-12-26 17:12,MBN,포스코,"'신안산선 사고' 포스코이앤씨, 신평3사 등급전망 줄줄이 하락",붕괴 사고로 인명피해가 있었던 신안산선 시공사 포스코이앤씨가 국내 신용평가사 3곳에서 줄줄이 등급전망 하향 조정을 받았습니다. 지난 18일 포스코이앤씨가 시공을 맡은 여의도역 신안산선 4-2공구에서 콘크리트...,http://mbnmoney.mbn.co.kr/news/view?news_no=MM1005733739
2025-12-26 17:09,뉴스핌,포스코인터,"'독자 AI' 정예팀 첫 발표 임박…NC AI, 산업 특화 전략 통할까","NC AI 정예팀에는 한국전자통신연구원(ETRI), 한국과학기술원(KAIST), 고려대, 서울대, 연세대, 에이아이웍스, 포스코DX, 롯데이노베이트, HL로보틱스, 인터엑스, 미디어젠, 문화방송, NHN 등 14개의 국내 산학연 기업 및...",https://www.newspim.com/news/view/20251226000661
2025-12-26 17:04,,포스코,"포스코이앤씨, '신안산선 사고 여파' 현실화…신용등급전망 일제히 부정...",포스코이앤씨가 신안산선 공사 현장 붕괴 사고 여파로 국내 주요 신용평가사 3곳에서 등급전망이 일제히... 나이스신용평가는 26일 포스코이앤씨의 장기신용등급 전망을 기존 '안정적'에서 '부정적'으로 낮췄다. 지난...,http://www.kdfnews.com/news/articleView.html?idxno=174323
2025-12-26 17:04,,포스코인터내셔널,"박경태 ""AI 반도체 핵심 공정도 희소금속에 의존하죠""","E씨는 오스템임플란트, F씨는 포스코인터내셔널, G씨는 일진다이아몬드로 이직했다. H씨는 어플라이드머티어리얼즈코리아에서 필드프로세서엔지니어로 장비 개량 연구를 하고 있다. 박 소장은 “희소금속은 고순도...",https://www.hankyung.com/article/2025122667871
2025-12-26 16:58,,포스코,전통 한지장-청년 작가들 뭉쳤다...포스코미술관 '한지 스펙트럼' 展,"포스코미술관이 국가무형유산 한지장 안치용과 박송희, 소동호 등 청년 작가가 협업한 특별전 '한지... 관람객의 도록과 기념품 판매 수익금은 포스코1%나눔재단에 기부돼 포스코 철강 기술로 '맞춤형 한지 건조기'를...",https://www.nc.press/news/articleView.html?idxno=602589
2025-12-26 16:56,연합뉴스,포스코,"'신안산선 사고' 포스코이앤씨, 신평3사 등급전망 줄줄이 하락","나신평·한신평·한기평, 포스코이앤씨 등급 일제히 하향조정 붕괴 사고로 인명피해가 있었던 신안산선 시공사 포스코이앤씨가 국내 신용평가사 3곳에서 줄줄이 등급전망 하향 조정을 받았다. 지난 18일 포스코이앤씨가...",https://www.yna.co.kr/view/AKR20251226108600008?input=1195m
2025-12-26 16:32,,포스코,"전통한지, 현대 예술 입다…포스코미술관 '한지 스펙트럼'전 개최",포스코미술관은 국내에 단 4명뿐인 국가무형유산 한지장 중 한명인 안치용을 필두로 현대적인 감각의 박송희... 특히 이번 전시는 포스코 철강제품을 활용해 전통문화의 맥을 이어가기 위한 실질적 해결책을 제시해 예술을...,http://www.shinailbo.co.kr/news/articleView.html?idxno=2169310
2025-12-26 16:25,이데일리,포스코,"[마켓인]포스코E&C, 신용등급 하향 임박…신용등급 전망 ‘부정적’ 조...","한국기업평가(034950)(한기평)와 한국신용평가(한신평), NICE신용평가(나신평) 등 국내 신용평가 3사가 일제히 포스코이앤씨의 신용등급 전망을 하향했다. 올해 사업장에서 발생한 다수의 사고가 포스코이앤씨의 대외...",http://www.edaily.co.kr/news/newspath.asp?newsid=03207846642402456
2025-12-26 16:14,,포스코,"포스코미술관, '한지 스펙트럼' 개최… '한지장' 안치용 필두","포스코미술관이 국내에 단 4명뿐인 국가무형유산 한지장 중 한 명인 안치용을 필두로, 현대적인 감각의... 특히 이번 전시는 포스코 철강제품을 활용해 전통문화의 맥을 이어가기 위한 실질적 해결책을 제시함으로써...",http://www.seoulwire.com/news/articleView.html?idxno=687659
2025-12-26 16:04,,포스코,"포스코, 'My POSCO' 개편…고객 가치 제고 위한 디지털 전환 가속",|중앙이코노미뉴스 이상민 기자|출처=포스코 포스코가 고객사들을 위한 제품 주문 디지털 플랫폼을 'My POSCO'로 개편하고 공식 오픈했다. 포스코는 기존 제품 홍보 페이지와 온라인 주문·출하 채널을 하나로 통합했으며...,https://www.joongangenews.com/news/articleView.html?idxno=480367
2025-12-26 15:56,시민일보,포스코,"한경국립대-포스코1%나눔재단, 장애학생 장학금 전달식 개최",-산학협력을 통해 장애학생의 꿈 응원- ▲ 포스코 장학금 한경국립대학교(총장직무대리 김태완)는 포스코1%나눔재단 장학금 전달식이 지난 24일 평택캠퍼스 미래관에서 열렸다고 밝혔다. 이번 장학금은 성적이 우수한...,https://www.siminilbo.co.kr/news/newsview.php?ncode=1160286096590496
2025-12-26 15:46,,포스코,"신평3사 포스코이앤씨 등급전망 하향조정, ""연간 영업손실 4천억 웃돌 것...",한국신용평가를 비롯한 신용평가사 3사가 일제히 포스코이앤씨 신용등급전망을 '부정적'으로 낮췄다. 한국신용평가는 수시평가를 통해 포스코이앤씨의 무보증사채 등급은 'A+'로 유지하고 전망은 '안정적'에서 '부정적...,https://www.businesspost.co.kr/BP?command=article_view&num=424969
