날짜,매체명,검색키워드,기사제목,주요기사 요약,URL
2025-12-30 12:18,문화일보,포스코,"검경, ‘신안산선 붕괴 사망사고’ 포스코이앤씨 압수수색","서울남부지검·서울경찰청·서울지방고용노동청은 30일 신안산선 시공사인 포스코이앤씨 본사와 공사 현장 하청업체 등 총 5곳을 압수수색했다. 이번 압수수색에는 경찰관과 근로감독관 등 약 50명이 투입됐으며, 사고...",https://www.munhwa.com/article/11557548?ref=naver
2025-12-30 12:08,KBS,포스코,"검경·노동청, ‘신안산선 사망사고’ 포스코이앤씨 압수수색","신안산선 시공사인 포스코이앤씨 본사 등이 대상인데, 당국은 포스코이앤씨가 붕괴를 예방하기 위한 안전조치를 취했는지를 살펴볼 예정입니다. 신현욱 기자의 보도입니다. [리포트] 서울 여의도 신안산선 공사 현장...",https://news.kbs.co.kr/news/pc/view/view.do?ncd=8446179&ref=A
2025-12-30 12:08,,포스코인터내셔널,"포스코인터내셔널-포스코A&C 어린이집, 인하대병원에 소아암 치료비 기...","인하대병원은 포스코인터내셔널과 포스코A&C 직장 내 어린이집 아동들이 249만 3천500원을 소아암 환우들의 치료비로 써달라며 기부해 왔다고 30일 밝혔다. 포스코타워꿈나무어린이집, 니트꿈나무어린이집 자선 바자회...",http://www.bosa.co.kr/news/articleView.html?idxno=2266804
2025-12-30 12:00,,포스코,"검경·노동청, '여의도 신안산선 사고' 포스코이앤씨 압수수색","신안산선 공사 현장에서 사망사고를 낸 포스코이앤씨에 대해 검찰과 경찰, 노동부가 함께 강제수사에... 시공사 포스코이앤씨와 하청업체에 대한 압수수색에 착수했다고 밝혔습니다. 경찰에 따르면 압수수색은 오늘(30일)...",http://www.yonhapnewstv.co.kr/MYH20251230115920YWf
2025-12-30 11:57,,포스코,"검찰, '신안산선 사망 사고' 포스코이앤씨 압수수색","서울남부지검과 서울경찰청, 서울지방고용노동청은 30일 신안산선 시공사인 포스코이앤씨 본사와 현장 사무실, 하청업체 사무실 등 5곳을 대상으로 압수수색을 실시했다. 수사기관은 이날 확보한 사건 관련 자료 등을...",https://www.sisajournal.com/news/articleView.html?idxno=357917
2025-12-30 11:43,,포스코,"""1초만 찡그리면 사람 살리죠"" 헌혈 300번 한 포스코퓨처엠 직원",포스코퓨처엠에서 헌혈 300회를 한 직원이 나왔다. 전남 광양 양극재 공장 사원 강병진(42)씨다. 30일 포스코퓨처엠에 따르면 강씨는 고등학교 2학년 때 처음 헌혈을 경험했다. 청소년적십자(RCY) 동아리 활동을 하며...,https://www.hankookilbo.com/News/Read/A2025123010230000329?did=NA
2025-12-30 11:36,딜라이트이슈,포스코,"검경·노동청, '신안산선 사망' 포스코이앤씨·하청업체 압수수색","서울남부지검과 서울경찰청, 서울지방고용노동청은 30일 신인산선 시공사인 포스코이앤씨와 하청업체를 대상으로 수사관과 근로감독관 약 50명을 투입해 압수수색을 실시하고 있다고 밝혔다. 검경과 노동청은 이번에...",https://www.delighti.co.kr/news/articleView.html?idxno=108713
2025-12-30 11:34,스마트경제,포스코,"포스코퓨처엠, 누적 헌혈 300회 임직원 배출","| 스마트에프엔 = 김종훈 기자 | 포스코퓨처엠은 광양양극재생산부 강병진 사원이 지난 13일 헌혈의집... 2021년 포스코퓨처엠 입사 이후에도 90회 이상 헌혈에 참여했고, 지난 7월에는 광양양극재공장 협력사 직원...",https://www.smartfn.co.kr/news/articleView.html?idxno=131040
2025-12-30 11:28,헤럴드경제,포스코,포스코퓨처엠 강병진 사원 25년간 300회 헌혈,강병진 포스코퓨처엠 광양양극재생산부 사원이 지난 13일 전남 순천시 헌혈의집 순천센터에서 300번째 헌혈에 동참하고 ‘최고명예대장’ 헌혈 유공장을 받고 있다. [포스코퓨처엠 제공] 포스코퓨처엠이 누적 300회...,https://biz.heraldcorp.com/article/10645916?ref=naver
2025-12-30 11:28,,포스코,"포스코이앤씨 '안전' 소홀하더니…검·경, 중대재해 관련 전격수사",이재명 대통령으로부터 산재 사망사고로 호된 질책을 받은 바 있는 포스코이앤씨가 최근 다시 중대재해를... 뿐더러 포스코그룹의 안전경영을 총괄하는 장인화 회장이 이번 사고를 포함해 그동안 끊임없이 발생한...,http://www.nongaek.com/news/articleView.html?idxno=93738
2025-12-30 11:24,,포스코,"검·경·노동청, '신안산선 사망 사고' 포스코이앤씨 등 5곳 압수수색",관련해 포스코이앤씨 본사와 공사 현장을 압수수색 하는 등 강제수사에 나섰다. 서울경찰청 형사기동대는 30일 오전 9시부터 지난 18일 신안산선 복선전철 공사 현장에서 노동자가 사망한 사고와 관련해 포스코이앤씨...,https://www.industrynews.co.kr/news/articleView.html?idxno=76277
2025-12-30 11:21,,포스코인터,"포스코인터·A&C 어린이집, 인하대병원에 소아암 치료비 기부",인하대병원은 포스코인터내셔널과 포스코A&C 직장 내 어린이집 아동들이 249만3500원을 소아암 환우들의 치료비로 써달라며 기부했다고 30일 밝혔다. 기부금은 이달 중순 송도국제도시 내 포스코타워에서...,https://www.dailian.co.kr/news/view/1592232/?sc=Naver
2025-12-30 11:16,,포스코,"검경·노동청, '신안산선 사망 사고' 포스코이앤씨 등 압수수색","30일 서울남부지검과 서울경찰청 형사기동대, 서울고용노동청은 오늘 오전부터 인천 송도 포스코이앤씨 본사와 현장 사무실, 하청업체 등 5곳에 수사관과 근로감독관 약 50명을 투입해 압수수색을 벌이고 있다고 밝혔다....",https://news.tvchosun.com/site/data/html_dir/2025/12/30/2025123090089.html
2025-12-30 11:13,,포스코,"검경·노동청, '신안산선 사망사고' 강제 수사...포스코이앤씨 압수수색","서울남부지검과 서울경찰청, 서울지방고용노동청은 30일 신인산선 시공사인 포스코이앤씨와 하청업체를... 법리 적용 등을 중심으로 지휘하고 있습니다. #신안산선 #포스코이앤씨 #압수수색 #노동청 #검찰 #경찰 #사건사고",https://www.ikbc.co.kr/article/view/kbc202512300027
2025-12-30 11:10,뉴스드림,포스코,'미국發 쇼크' LG엔솔·엘앤에프…다음은 포스코퓨처엠?,시장에선 이 같은 흐름이 포스코퓨처엠으로 향할 가능성에 주목하고 있다. 지난 29일 2차전지 양극재... 관련 업계에선 LG엔솔과 엘앤에프에 이어 포스코퓨처엠도 미국발(發) 쇼크에 조만간 직면할 공산이 있다는...,http://www.newsdream.kr/news/articleView.html?idxno=104297
2025-12-30 11:09,,포스코,"검경·노동청, '신안산선 사망' 포스코이앤씨·하청 압수수색","서울남부지검과 서울경찰청, 서울지방고용노동청은 30일 신인산선 시공사인 포스코이앤씨와 하청업체를 대상으로 수사관과 근로감독관 약 50명을 투입해 압수수색을 실시하고 있다고 밝혔다. 검경과 노동청은 이번에...",https://isplus.com/article/view/isp202512300050
2025-12-30 11:09,,포스코,"검경·노동청, ‘신안산선 노동자 사망사고’ 포스코이앤씨 압수수색","시공사인 포스코이앤씨에 대해 압수수색을 벌였다. 서울남부지검과 서울경찰청은 30일 서울지방고용노동청과 협력해 이날 오전 9시부터 포스코이앤씨 본사 및 현장 사무실, 공사 현장 등 총 5개소를 대상으로...",https://www.womennews.co.kr/news/articleView.html?idxno=271410
2025-12-30 11:08,,포스코인터내셔널,"포스코인터내셔널-포스코A&C 어린이집, 인하대병원에 소아암 치료비 기...",인하대병원은 포스코인터내셔널과 포스코A&C 직장 내 어린이집 아동들이 249만 3천500원을 소아암 환우들의 치료비로 써달라며 기부해 왔다고 30일 밝혔다. 기부금은 이달 중순 송도국제도시 내 포스코타워에서...,https://www.rapportian.com/news/articleView.html?idxno=230843
2025-12-30 11:06,CEO스코어데일리,포스코,"포스코퓨처엠, 전국 사업장에서 봉사활동 이어가 …1년간 5만 시간 돌파",포스코퓨처엠 임직원들의 따뜻한 발걸음이 올 한 해 5만 시간을 넘어섰다. 포스코퓨처엠은 30일 전국 사업장에서 다양한 사회공헌 활동을 펼치면서 누적 봉사시간이 5만830시간을 달성했다. 이는 1인당 평균 18.7시간에...,https://www.ceoscoredaily.com/page/view/2025123009564117718
2025-12-30 11:04,,포스코,"포스코퓨처엠, 25년간 300회 헌혈 영웅 탄생… “연말연시 따듯한 나눔...",[포항=위키트리]이창형 기자=포스코퓨처엠이 누적 300회 헌혈자를 배출하는 등 전국 사업장에서 다양한 봉사활동을 펼치며 연말연시 따듯한 나눔을 실천하고 있다. 포스코퓨처엠 광양양극재생산부 강병진 사원은 지난...,https://www.wikitree.co.kr/articles/1106151
2025-12-30 11:02,,포스코,"검경·노동청, 포스코이앤씨 압수수색…'여의도 신안산선 사고' 수사","서울남부지검과 서울경찰청, 서울지방고용노동청은 30일 신안산선 시공사인 포스코이앤씨 및 관련 하청업체를 대상으로 압수수색을 진행했다고 밝혔다. 검찰·경찰·노동청은 지난 22일 수사협의회를 열고...",http://www.shinailbo.co.kr/news/articleView.html?idxno=2170607
2025-12-30 11:02,,포스코,"포스코퓨처엠, 12월 30일 장중 187,600원 4.63% 하락","따르면 포스코퓨처엠은 현재 187,600원에 거래되며 지난 종가 196,700원 대비 9,100원 하락한 4.63%의 하락률을 기록하고 있다. 포스코퓨처엠의 시가는 193,800원으로 시작했으며, 주가는 고가 193,900원과 저가 187...",https://www.joongangenews.com/news/articleView.html?idxno=481348
2025-12-30 11:02,,포스코,"포스코홀딩스, 12월 30일 장중 304,000원 3.18% 하락","따르면 포스코홀딩스는 현재 304,000원에 거래되고 있으며, 이는 지난 종가인 314,000원 대비 10,000원... 코스피 시장에서 포스코홀딩스는 시가총액 순위 25위로, 총 시가총액은 24조 6,036억 원이다. 기업의...",https://www.joongangenews.com/news/articleView.html?idxno=481346
2025-12-30 11:02,,포스코인터내셔널,"포스코인터내셔널, 12월 30일 장중 49,550원 1.69% 하락","|중앙이코노미뉴스 이상민 기자|출처=네이버페이 증권 30일 오전 10시 49분 기준, 네이버페이 증권에 따르면 포스코인터내셔널 주가는 지난 종가 50,400원 대비 850원 하락한 49,550원을 기록하고 있다....",https://www.joongangenews.com/news/articleView.html?idxno=481357
2025-12-30 11:00,,포스코,"검경·노동청, '신안산선 사망사고' 포스코이앤씨 압수수색","서울남부지검과 서울경찰청, 서울지방고용노동청은 30일 신안산선 시공사인 포스코이앤씨와 하청업체를 대상으로 수사관과 근로감독관 약 50명을 투입해 압수수색을 실시하고 있다고 밝혔다. 검경과 노동청은 이번에...",http://www.m-i.kr/news/articleView.html?idxno=1320450
2025-12-30 10:58,,포스코,"검찰·경찰·노동청, 여의도 신안산선 사망사고 포스코이앤씨 압수수색...","관련 포스코이앤씨 압수수색에 착수했다. 30일 건설업계와 수사당국 등에 따르면 서울남부지방검찰청과 서울경찰청, 서울지방고용노동청은 포스코이앤씨와 신안산선 사고 현장 하청업체를 대상으로 압수수색을...",https://www.businesspost.co.kr/BP?command=article_view&num=425249
2025-12-30 10:58,,포스코,"검경·노동청, '신안산선 사망' 포스코이앤씨·하청업체 압수수색",▲포스코이앤씨 송도사옥. 포스코이앤씨 제공. 서울 여의도역 신안산선 공사 현장에서 발생한 노동자 사망사고와 관련해 공사를 맡았던 포스코이앤씨 등이 검경 등의 강제수사를 받고 있다. 서울남부지검과 서울경찰청...,http://www.newsfc.co.kr/news/articleView.html?idxno=75886
2025-12-30 10:57,,포스코,'신안산선 사망' 포스코이앤씨·하청 압수수색,"서울남부지방검찰청과 서울경찰청, 서울지방고용노동청은 오늘(30일) 신인산선 시공사인 포스코이앤씨와 하청업체를 대상으로 압수수색을 진행하고 있습니다. 검경과 노동청은 이번에 확보한 자료를 바탕으로 낙하물...",http://tbs.seoul.kr/news/newsView.do?typ_800=6&idx_800=3535346&seq_800=20528186
2025-12-30 10:56,,포스코,"포스코퓨처엠, 누적 봉사활동 5만830시간 달성",포스코퓨처엠 직원이 지난 7월 포항시 포스코 본사 대회의장에서 열린 '푸른꿈 환경캠프'에 멘토로 나서 어린이와 함께 드론을 만들고 있다. 사진=포스코퓨처엠 제공 포스코퓨처엠이 올 한해 전국 사업장에서 다양한...,http://www.hidomin.com/news/articleView.html?idxno=603723
2025-12-30 10:56,,포스코,포스코이앤씨 함양울산고속도로 건설 현장 사망사고… 현장소장 구속,"경남 의령군 일대에서 진행 중인 함양~울산고속도로 건설 공사 현장에서 사면 보강 작업을 하던 노동자가 숨진 사고와 관련해, 시공사 포스코이앤씨 현장소장이 구속됐다. 고용노동부는 지난 7월 28일 발생한 이 사고에...",https://www.viva100.com/article/20251230500410
2025-12-30 10:56,,포스코,"포스코퓨처엠, '헌혈 영웅' 탄생 등 연말연시 나눔 실천 앞장","포스코퓨처엠 광양양극재생산부 강병진 사원, 최고명예대장 헌혈 유공장 수상./ 포스코퓨처엠 | 한스경제=김창수 기자 | 포스코퓨처엠이 누적 300회 헌혈자를 배출하는 등 전국 사업장에서 다양한 봉사활동을 펼치며...",http://www.hansbiz.co.kr/news/articleView.html?idxno=804630
2025-12-30 10:47,,포스코,"검경·노동청, '신안산선 사망 사고' 포스코이앤씨 등 압수수색","서울남부지검과 서울경찰청 형사기동대, 서울고용노동청은 오늘 오전부터 인천 송도 포스코이앤씨 본사와... 시공사는 포스코이앤씨로 지난 1월 경남 김해와 4월 경기 광명·대구, 7월 경남 의령 등 올해 들어서만 사망...",https://imnews.imbc.com/news/2025/society/article/6789766_36718.html
2025-12-30 10:28,,포스코인터내셔널,"포스코 계열사 어린이집 아이들, 코 묻은 돈 모아 소아암 환우 치료비로...","포스코인터내셔널과 포스코A&C 직장 내 어린이집 아동들이 249만 3,500원을 모아 소아암 환우들의 치료비로 써달라며 인하대 병원에 기부했다. 30일 인하대병원에 따르면 포스코인터내셔널과 포스코A&C 임직원 자녀들이...",https://www.ngonews.kr/news/articleView.html?idxno=221530
2025-12-30 10:26,,포스코인터내셔널,"포스코인터내셔널-포스코A&C 어린이집, 인하대병원에 소아암 치료비 기...",인하대병원 포토 인하대병원은 포스코인터내셔널과 포스코A&C 직장 내 어린이집 아동들이 249만3500원을 소아암 환우들의 치료비로 써달라며 기부해 왔다고 30일 밝혔다. 기부금은 이달 중순 송도국제도시 내...,http://www.incheonnews.com/news/articleView.html?idxno=432854
2025-12-30 10:06,,포스코인터내셔널,[2025 결산-가스] 국내 천연가스 수요 전년보다 소폭 상회할 듯,"반면 포스코인터내셔널은 미국 글렌파른(Glenfarne)이 주도하는 알래스카 LNG 프로젝트에 참여해 연간 100만톤 규모의 장기 공급계약과 프로젝트 파이낸싱, 파이프라인용 강재 공급, 지분 투자까지 병행하며 주도적...",https://www.energy-news.co.kr/news/articleView.html?idxno=221441
2025-12-30 09:52,,포스코인터내셔널,"포스코인터·A&C 직장 어린이집, 인하대병원에 소아암 치료비 기부","사진=인하대병원포스코인터내셔널과 포스코A&C 직장 내 어린이집 아동들이 소아암 환우의 치료비로 써달라며 인하대병원에 249만3천500원을 기부했다. 30일 인하대병원 등에 따르면, 이번 기부금은 포스코인터내셔널과...",https://www.joongboo.com/news/articleView.html?idxno=363713086
2025-12-30 09:40,,포스코인터내셔널,"포스코 어린이집 아동, 소아암 치료비 249만원 기부",인하대병원은 포스코인터내셔널과 포스코A&C 어린이집 아동들이 249만3500원을 소아암 환자 치료비로 기부했다고 30일 밝혔다. 이번 기부금은 송도국제도시 포스코타워 내 직장 어린이집 아동들이 자선 바자회를 열어...,https://www.hinews.co.kr/view.php?ud=2025123009385088196aa9cc43d0_48
2025-12-30 09:00,물류신문,포스코플로우,"포스코플로우, 안전운행 지원 위해 화물기사 1,232명에 방한복 전달",△방한복 기증행사에 참석한 포스코플로우 포항출하섹션 장승호 그룹장(앞줄 오른쪽에서 네 번째)과 참석자들이 기념촬영을 하고 있다(사진제공=포스코플로우) 포스코플로우(사장 반돈호)는 지난 23일부터 이틀 간 광양과...,https://www.klnews.co.kr/news/articleView.html?idxno=319419
2025-12-30 09:00,아주경제,포스코,"포스코퓨처엠, 1인 평균 18.7시간 봉사...300번째 헌혈자도",com 포스코퓨처엠 광양양극재생산부 강병진 사원이 13일 헌혈의집 순천센터에서 300번째 헌혈에 동참하고 '최고명예대장' 헌혈 유공장을 받았다. [사진=포스코퓨처엠] 포스코퓨처엠이 누적 300회 헌혈자를 배출하는 등...,https://www.ajunews.com/view/20251230082204379
2025-12-30 08:56,뉴스락,포스코,"[함께가자 우리ESG] 포스코퓨처엠, 25년간 300회 헌혈 영웅 탄생...""연말...",포스코퓨처엠이 누적 300회 헌혈자를 배출하는 등 전국 사업장에서 다양한 봉사활동을 펼치며 연말연시 따듯한 나눔 실천에 앞장서고 있다. 강병진 포스코퓨처엠 광양양극재생산부 사원은 지난 13일 헌혈의집...,http://www.newslock.co.kr/news/articleView.html?idxno=122230
2025-12-30 08:54,,포스코,"포스코퓨처엠, 25년간 300회 헌혈 ‘최고명예대장’ 배출",포스코퓨처엠이 25년간 300회 헌혈을 실천한 임직원을 배출하는 등 연말연시 나눔 활동을 확대하고 있다. 포스코퓨처엠에 따르면 광양양극재생산부 강병진 사원은 지난 13일 헌혈의집 순천센터에서 300번째 헌혈에...,https://www.kbmaeil.com/article/20251230500035
2025-12-30 08:48,뉴스핌,포스코,"포스코퓨처엠, 헌혈 300회 '영웅' 탄생…나눔으로 빛난 연말",포스코퓨처엠이 누적 300회 헌혈자를 배출하는 등 전국 사업장에서 다양한 봉사활동을 펼치며 연말연시 따듯한 나눔을 실천하고 있다. 30일 포스코퓨처엠에 따르면 광양양극재생산부 강병진 사원은 지난 13일 헌혈의집...,https://www.newspim.com/news/view/20251230000167
2025-12-30 08:46,이투데이,포스코,"포스코퓨처엠, 헌혈 300회 영웅 탄생…나눔 실천 앞장",이투데이=손민지 기자 | 강병진 광양양극재생산부 사원 300번째 헌혈 ‘최고명예대장’ 유공장 받아 포스코퓨처엠이 누적 300회 헌혈자를 배출하는 등 전국 사업장에서 다양한 봉사활동을 펼치고 있다. 30일 포스코퓨처...,https://www.etoday.co.kr/news/view/2540691
2025-12-30 08:46,데일리한국,포스코,"포스코퓨처엠, '헌혈 300회' 직원 탄생…연말 나눔 확산",포스코퓨처엠 광양양극재생산부 강병진 사원이 지난 13일 헌혈의집 순천센터에서 300번째 헌혈에 동참하고 최고명예대장 헌혈 유공장을 받았다. 사진=포스코퓨처엠 제공 포스코퓨처엠은 연말을 맞아 전국 사업장에서...,https://daily.hankooki.com/news/articleView.html?idxno=1315846
2025-12-30 08:46,데일리한국,포스코,"포스코퓨처엠, '헌혈 300회' 직원 탄…연말 나눔 확산",포스코퓨처엠 광양양극재생산부 강병진 사원이 지난 13일 헌혈의집 순천센터에서 300번째 헌혈에 동참하고 최고명예대장 헌혈 유공장을 받았다. 사진=포스코퓨처엠 제공 포스코퓨처엠은 연말을 맞아 전국 사업장에서...,https://daily.hankooki.com/news/articleView.html?idxno=1315846
2025-12-30 08:44,,포스코,"포스코퓨처엠 임직원, 300회 헌혈…“연말연시 따듯한 나눔 실천”",포스코퓨처엠이 누적 300회 헌혈자를 배출해 전국 사업장에서 다양한 봉사활동을 펼치며 연말연시 따듯한 나눔을 실천하고 있다고 30일 밝혔다. 포스코퓨처엠 광양양극재생산부 강병진 사원은 지난 13일 헌혈의집...,https://www.fetv.co.kr/news/article.html?no=208848
2025-12-30 08:42,,포스코,"'1인당 18.7시간' 포스코퓨처엠, 봉사로 지역사회에 온기",포스코퓨처엠이 누적 300회 헌혈자를 배출하는 등 전국 사업장에서 다양한 봉사활동을 펼치며 연말연시 따뜻한 나눔을 실천하고 있다. 강병진 포스코퓨처엠 광양양극재생산부 사원은 지난 13일 헌혈의집 순천센터에서...,https://www.moneys.co.kr/article/2025123008245329791
2025-12-30 08:40,,포스코,"포스코퓨처엠, 25년간 300회 헌혈 영웅 탄생",포스코퓨처엠이 누적 300회 헌혈자를 배출하는 등 전국 사업장에서 다양한 봉사활동을 펼치며 연말연시 따듯한 나눔을 실천하고 있다. 30일 포스코퓨처엠에 따르면 강병진 광양양극재생산부 사원은 지난 13일 헌혈의집...,https://www.insightkorea.co.kr/news/articleView.html?idxno=238255
2025-12-30 08:40,,포스코,"포스코퓨처엠, 전국 각지서 봉사활동…300회 헌혈자도 배출",포스코퓨처엠이 누적 300회 헌혈자를 배출하는 등 전국 사업장에서 다양한 봉사활동을 펼치며 연말연시 따뜻한 나눔을 실천하고 있다. 강병진 포스코퓨처엠 광양양극재생산부 사원은 지난 13일 헌혈의집 순천센터에서...,https://zdnet.co.kr/view/?no=20251230083551
2025-12-30 08:39,,포스코,"포스코퓨처엠, 25년간 300회 헌혈 ‘영웅’ 탄생…""최고명예대장 수여""",포스코그룹의 이차전지 소재 계열사인 포스코퓨처엠 직원이 고등학생 때부터 25년간 헌혈을 300회 동참해 대한적십자사로부터 헌혈 유공장 '최고명예대장'을 받았다. 30일 포스코퓨처엠에 따르면 강병진...,http://www.fnnews.com/news/202512300820091873
2025-12-30 08:36,메디컬투데이,포스코,"30대 노동자 추락 사망…포스코이앤씨, 안전관리 소홀로 벌금 1000만원 선...",▲ 2021년 인천의 한 재개발 공사 현장에서 30대 노동자가 추락해 숨진 사고와 관련해 포스코이앤씨와 하청업체들이 안전관리 소홀 책임으로 벌금형을 선고받았다. (사진=포스코이앤씨) 지난 2021년 인천의 한 재개발 공사...,https://mdtoday.co.kr/news/view/1065597143371051
2025-12-30 08:34,헤럴드경제,포스코,"포스코퓨처엠, 25년간 300회 헌혈 ‘영웅’ 배출…“나눔 실천 앞장”",7시간 강병진 포스코퓨처엠 광양양극재생산부 사원이 지난 13일 전남 순천시 헌혈의집 순천센터에서 300번째 헌혈에 동참하고 ‘최고명예대장’ 헌혈 유공장을 받고 있다. [포스코퓨처엠 제공] [헤럴드경제=정경수 기자]...,https://biz.heraldcorp.com/article/10645614?ref=naver
2025-12-30 08:34,스마트투데이,포스코,"포스코퓨처엠, '25년간 300회' 헌혈 영웅 탄생",포스코퓨처엠 광양양극재생산부 강병진 사원이 13일 헌혈의집 순천센터에서 300번째 헌혈에 동참하고 '최고명예대장' 헌혈 유공장을 받았다. 포스코퓨처엠이 누적 300회 헌혈자를 배출하는 등 전국 사업장에서 다양한...,https://www.smarttoday.co.kr/ko-kr/articles/100029
2025-12-30 08:32,,포스코,"포스코퓨처엠, 25년간 300회 헌혈 영웅 탄생…나눔 실천 앞장",포스코퓨처엠이 누적 300회 헌혈자를 배출하는 등 전국 사업장에서 다양한 봉사활동을 펼치며 연말연시 따듯한 나눔을 실천하고 있다. 포스코퓨처엠 광양양극재생산부 강병진 사원은 지난 13일 헌혈의집 순천센터에서...,https://www.ebn.co.kr/news/articleView.html?idxno=1693069
2025-12-30 08:32,,포스코,"포스코퓨처엠, 누적 300회 헌혈자 탄생...'최고명예대장' 유공장 받아",|중앙이코노미뉴스 송태원 기자|포스코퓨처엠 광양양극재생산부 강병진 사원 최고명예대장 헌혈 유공장 수상[사진=포스코퓨처엠] 포스코퓨처엠이 누적 300회 헌혈자를 배출하는 등 전국 사업장에서 다양한 봉사활동을...,https://www.joongangenews.com/news/articleView.html?idxno=481150
