날짜,매체명,검색키워드,기사제목,주요기사 요약,URL
2025-12-30 08:30,연합뉴스,포스코,25년간 헌혈 300회… 포스코퓨처엠 강병진 사원 '최고명예대장',포스코그룹의 이차전지 소재 계열사인 포스코퓨처엠 직원이 고등학생 때부터 25년간 헌혈을 300회 해 대한적십자사로부터 헌혈 유공장 '최고명예대장'을 받았다. 30일 포스코퓨처엠에 따르면 광양양극재생산부 강병진...,https://www.yna.co.kr/view/AKR20251230020400003?input=1195m
2025-12-30 08:30,철강금속신문,포스코플로우,페로타임즈 손바닥뉴스 12월 30일(화),"신청 포스코플로우, 화물 기사 위한 방한복 전달…안전 '방점' KCC글라스, '희망 2026 나눔 캠페인' 동참...이웃사랑 성금 1억원 기탁 삼미금속, 두산에너빌리티와 원전용 터빈 블레이드 공급계약 KBI건설, 2026년 무재해...",http://www.ferrotimes.com/news/articleView.html?idxno=45484
2025-12-30 08:30,철강금속신문,포스코플로우,"포스코플로우, 화물 기사 위한 방한복 전달…안전 '방점'",포스코플로우는 지난 23일부터 24일까지 양일간 광양과 포항에서 화물 운송 기사들의 겨울철 안전 운행을 지원하기 위한 방한복을 전달했다고 29일 밝혔다. 이번 행사는 겨울철 야외 작업이 잦은 철강제품 운송 기사들의...,http://www.ferrotimes.com/news/articleView.html?idxno=45477
2025-12-30 08:28,,포스코,"포스코이앤씨, 'A+' 유지했지만…신용도 점검대 오른 이유는",포스코이앤씨 송도 사옥. (사진=포스코이앤씨) | 한스경제=한나연 기자 | 포스코이앤씨의 신용도에 대한 시장의 시선이 다시 한 번 모이고 있다. 한국신용평가는 최근 포스코이앤씨의 무보증사채 신용등급을 A+로...,http://www.hansbiz.co.kr/news/articleView.html?idxno=804319
2025-12-30 08:25,뉴스1,포스코,'의령 60대 노동자 끼임 사망' 포스코이앤씨 현장소장 구속,지난 7월 포스코이앤씨가 시공을 맡은 경남 의령군 함양울산고속도로 공사 현장에서 60대 노동자가... 경남경찰청과 고용노동부 창원지청은 최근 업무상과실치사 및 산업안전보건법 위반 혐의로 포스코이앤씨 현장소장 A...,https://www.news1.kr/local/busan-gyeongnam/6023188
2025-12-30 08:22,이데일리,포스코,"포스코퓨처엠, 올해 1인당 봉사활동 평균 18.7시간","포스코퓨처엠이 누적 300회 헌혈자를 배출하는 등 전국 사업장에서 다양한 봉사활동을 펼치고 있다. 올 한해 전국 사업장에서 다양한 봉사활동을 펼쳐 1인당 평균 18.7시간, 누적 5만 830시간을 달성했다. 포스코퓨처엠...",http://www.edaily.co.kr/news/newspath.asp?newsid=02601046642403768
2025-12-30 08:21,,포스코,'중대재해 사망' 관련 포스코이앤씨 의령 현장소장 구속,ⓒ 윤성효 지난 7월 28일 함양울산고속도로 의령나들목 공사 현장에서 발생한 노동자 사망 중대재해와 관련해 시공사 포스코이앤씨 현장소장이 산업안전보건법 등 위반 혐의로 구속되었다. 고용노동부 창원지청(지청장...,https://www.ohmynews.com/NWS_Web/View/at_pg.aspx?CNTN_CD=A0003194791&CMPT_CD=P0010&utm_source=naver&utm_medium=newsearch&utm_campaign=naver_news
2025-12-30 08:18,중소기업신문,포스코,"포스코퓨처엠 강병진 사원, 누적 헌혈 300회 '최고명예대장'",포스코퓨처엠 광양양극재생산부 강병진 사원은 지난 13일 헌혈의집 순천센터에서 300번째 헌혈에 동참하고... 사진/포스코퓨처엠 포스코퓨처엠이 누적 300회 헌혈자를 배출하는 등 전국 사업장에서 다양한 봉사활동을...,http://www.smedaily.co.kr/news/articleView.html?idxno=347970
2025-12-30 08:16,,포스코,'중대재해' 포스코이앤씨 함양울산고속도 현장소장 구속,경찰과 고용노동부가 포스코이앤씨가 시공하는 함양울산고속도로 의령나들목 공사 현장소장을 구속했다.... 올해 7월 28일 포스코이앤씨가 시공하는 함양울산고속도로 합천~창녕 10공구 공사현장에서 경사면 보강작업을...,https://www.idomin.com/news/articleView.html?idxno=953442
2025-12-30 07:48,,포스코,"[더벨][유동성 풍향계]포스코퓨처엠, 유증부터 회사채 발행까지…재무...",포스코퓨처엠이 올 하반기부터 재무 전략을 바꿨다. 지난해부터 시작된 예상치 못한 전기차 시장 캐즘... 포스코퓨처엠이 공격적인 재무 전략을 택하자 시장이 바라본 시선이다. 재무 개선에 이어 실적도 반등하면서...,https://www.thebell.co.kr/free/content/ArticleView.asp?key=202512261105113560108796
2025-12-30 07:00,,포스코인터내셔널,"[3대축 성장 포스코인터①] 팜·곡물 투트랙, '식량 가치망' 진화","포스코인터내셔널은 에너지, 소재, 식량 3대 핵심사업의 경쟁력 강화 전략을 지속적으로 추진하고 있다. 액화천연가스(LNG)·팜 밸류체인을 완성하고 구동모터코아 해외생산기지를 구축하는 등 포스코인터내셔널의...",http://www.seoulwire.com/news/articleView.html?idxno=687670
2025-12-30 07:00,연합뉴스,포스코인터,[우분투칼럼] 축구로 여는 아프리카 진출의 새로운 해법,FC 바르셀로나와 인터 밀란에서 활약했다. 유럽축구연맹(UEFA) 챔피언스리그 우승을 이끌며 아프리카 축구를... 포스코와 LG는 직접적인 경기후원은 하지 않았다. 대신 지역사회를 지원했다. 2025년 8월 말라위의 말라위...,https://www.yna.co.kr/view/AKR20251215087800898?input=1195m
2025-12-29 23:28,,포스코플로우,"포스코플로우, 겨울철 화물기사 안전운행 응원...방한복 전달",지난 23일 화물 기사 안전용품 기증식에 참여한 포스코플로우 직원들이 기념 촬영을 하고 있다./포스코플로우 | 한스경제=임준혁 기자 | 포스코플로우는 지난 23일부터 24일까지 양일간 광양과 포항에서 화물 운송 기사들의...,http://www.hansbiz.co.kr/news/articleView.html?idxno=804536
2025-12-29 18:54,,포스코,"中, 수소환원제철 '세계 첫 100만t' 상용화 vs 포스코 '30년 목표",국내 수소환원제철 상황은 지난 2024년 1월 26일 포스코 수소환원제철개발센터 개소식에서 참석자들이 기념사진을 촬영하고 있다. 사진=포스코 뉴스룸 한국은 2026~2030년 '한국형 수소환원제철 실증기술 개발사업...,https://www.esgeconomy.com/news/articleView.html?idxno=13952
2025-12-29 18:22,,포스코플로우,"포스코플로우, 화물기사 안전운행 지원 앞장",포스코플로우 관계자가 현장에서 일하는 화물 운송 기사들에게 안전용품(방한복)을 전달하며 기념촬영을 하고 있다. 사진=포스코플로우 제공 포스코플로우(사장 반돈호)가 지난 23~24일까지 양일간 광양과 포항에서 화물...,http://www.hidomin.com/news/articleView.html?idxno=603673
2025-12-29 18:06,,포스코,"[인천지법 판결]안전관리 소홀로 노동자 추락사…포스코이앤씨, '벌금 ...",관련해 포스코이앤씨와 하청 업체들에게 안전관리 소홀로 벌금형을 선고했다. 인천지법 형사9단독 (정제민 판사)는 산업안전보건법 위반 혐의로 기소된 포스코이앤씨와 이 회사 소속 현장소장 A(60)씨에게 벌금...,http://www.lawissue.co.kr/view.php?ud=202512291727154944b50722e900_12
2025-12-29 18:02,,포스코인터내셔널,일회성 기부 넘어 … 현장으로 더 가까이,"포스코인터내셔널은 인천 국가유공자 가정을 지원하고, 중국 다롄·항저우 일대 독립운동 사적지 안내판을 자사 컬러강판 '포스아트'로 교체했다. 포스코는 서호주 한국전 참전용사 추모비 주변 환경을 정비했고...",https://www.mk.co.kr/article/11916712
2025-12-29 18:02,,포스코인터내셔널,"포스코, 국가유공자·군인 위해 로봇의족·휠체어","포스코인터내셔널은 인천 지역 국가유공자 가정에 여름나기 물품 꾸러미를 전달하고, 중국 다롄·항저우 등 독립운동 사적지의 노후 안내판을 컬러강판 '포스아트'로 교체했다. 포스코는 서호주 한국전쟁 참전용사...",https://www.mk.co.kr/article/11916709
2025-12-29 17:52,,포스코플로우,"포스코플로우, 혹한기 대비 화물기사에 방한복 지원",광양·포항서 전달식…3억 투입해 현장 안전 강화 포스코플로우는 지난 23일부터 24일까지 이틀간 광양과 포항에서 철강제품 화물 운송 기사들의 겨울철 안전 운행을 지원하고자 방한복을 전달했다고 밝혔다....,https://www.ksg.co.kr/news/main_newsView.jsp?pNum=146222
2025-12-29 17:30,,포스코,"[AI건설시대 열린다] ⑨포스코이앤씨, 특화 AI 스마트기술로 품질 경쟁...",[편집자주] 포스코이앤씨가 건설업에 최적화된 혁신 AI 기술을 기반으로 품질을 높이고 현장 경쟁력을... 29일 포스코이앤씨에 따르면 현장에 AI를 도입해 공사 품질을 높이고 있다. 앞서 포스코이앤씨는 2018년 스마트건설...,https://www.goodkyung.com/news/articleView.html?idxno=279690
2025-12-29 17:28,뉴스락,포스코,"포스코이앤씨, 인천 재개발 현장 추락사고로 벌금형",포스코이앤씨와 협력업체들이 4년 전 인천 재개발 현장에서 발생한 노동자 추락 사망 사고와 관련해... 인천지법 형사9단독(정제민 판사)는 29일 산업안전보건법 위반 혐의로 기소된 포스코이앤씨 법인과 이 회사 소속...,http://www.newslock.co.kr/news/articleView.html?idxno=122215
2025-12-29 17:26,,포스코,'타워크레인 추락 사망' 포스코이앤씨 1심 벌금형,원청인 포스코이앤씨와 하청업체들에게 1심에서 벌금형이 선고됐습니다. 인천지방법원은 산업안전보건법 위반 등의 혐의로 재판에 넘겨진 포스코이앤씨 법인과 소속 직원인 현장소장에게 각각 벌금 1천만 원을...,https://www.ytn.co.kr/_ln/0103_202512291726377625
2025-12-29 17:24,,포스코인터내셔널,'삼성·LG·SK의 새판짜기 돕는다'…떠오르는 M&A 변호사는[시그널 선정...,△졸리비·엘리베이션PE의 컴포즈커피 지분 매각 △SK에코플랜트의 신주 발행 및 주식교환 △SKS PE의 SK에코플랜트 소유 미국 폐배터리 재활용기업인 어센드 엘리먼츠 주식 매수 △포스코인터내셔널과 엔이에이치 합병...,https://www.sedaily.com/NewsView/2H1WNIZGBM
2025-12-29 17:06,,포스코인터내셔널,"GS칼텍스 석화 구조조정 바람서 비켜 있어, 허세홍 신사업 확대 역할에...","지난 11월에는 포스코인터내셔널과 합작 투자한 인도네시아 팜유 정제시설을 준공하며 친환경 에너지 사업 확대 기반을 마련했다. 허 부회장은 준공식에서 ""이번 팜유 정제시설 준공은 GS칼텍스가 추진해온 '그린...",https://www.businesspost.co.kr/BP?command=article_view&num=425144
2025-12-29 17:06,,포스코인터내셔널,"GS칼텍스 석유화학 구조조정 무풍지대지만, 허세홍 신사업 확대 부담 커...","지난 11월에는 포스코인터내셔널과 합작 투자한 인도네시아 팜유 정제시설을 준공하며 친환경 에너지 사업 확대 기반을 마련했다. 허 부회장은 준공식에서 ""이번 팜유 정제시설 준공은 GS칼텍스가 추진해온 '그린...",https://www.businesspost.co.kr/BP?command=article_view&num=425144
2025-12-29 16:56,잡포스트,포스코,"포스코퓨처엠, CNGR·피노와 LFP 양극재 합작투자계약 체결",포스코퓨처엠이 중웨이신소재(CNGR)와 그 한국 자회사 피노(FINO)와 리튬인산철(LFP) 양극재 합작투자계약... 합작투자계약 체결 행사는 지난 23일 경기도 안양시 피노 사옥에서 윤태일 포스코퓨처엠...,https://www.job-post.co.kr/news/articleView.html?idxno=198999
2025-12-29 16:44,,포스코인터내셔널,[코스피 지수선물·옵션] 현대글로비·SK텔레콤·포스코DX까지...급등락...,"포스코 홀딩스, 포스코인터내셔널, 포스코퓨처, 포스코DX, S-Oil, LS, LS ELECTRI, LIG넥스원, 한화솔루션 등은 원자재 가격 변동과 수급 집중으로 급등락이 반복됐다. 포스코DX는 1750원 상승한 2만 9950원, LIG넥스원은...",https://www.pinpointnews.co.kr/news/articleView.html?idxno=411572
2025-12-29 16:42,,포스코,안전관리 소홀로 노동자 추락사… 포스코이앤씨 벌금 1000만 원 부과,대해 포스코이앤씨와 하청업체들이 벌금형을 선고받았다. 29일 법조계에 따르면 인천지법 형사9단독 정제민 판사는 산업안전보건법 위반 혐의로 기소된 포스코이앤씨와 이 회사 소속 현장소장 A(60)씨에게 벌금 1천만원을...,https://www.kgnews.co.kr/news/article.html?no=879654
2025-12-29 16:41,,포스코,"포스코미술관, 한지와 철강 기술 잇는 스펙트럼 특별전","포스코미술관이 국가무형유산 한지장 안치용을 필두로, 현대적인 감각의 박송희, 소동호 작가가 참여한 특별전 '한지 스펙트럼'을 내년 2월1일까지 선보인다. 29일 포스코에 따르면 이번 전시는 포스코 철강제품을 활용해...",https://www.newsis.com/view/NISX20251229_0003458325
2025-12-29 16:34,잡포스트,포스코,"포스코DX 주가 12월 29일 29,900원 6.41% 상승 마감","29일 KRX 마감 기준, 네이버페이 증권에 따르면 포스코DX는 지난 종가 28,100원 대비 1,800원 상승한 29... 출처 : 네이버페이 증권 현재 포스코DX의 PER은 61.52배로, 동일 업종 PER인 29.23배보다 높은 수준이다....",https://www.job-post.co.kr/news/articleView.html?idxno=198993
2025-12-29 16:28,,포스코,"사고·손실 겹친 포스코이앤씨, 신용등급 전망 '경고등'","직면한 포스코이앤씨가 금융시장에서도 신용등급 전망 하향이라는 부담을 안게 됐다. 반복된 안전사고와... 26일 국내 주요 신용평가사인 나이스신용평가, 한국신용평가, 한국기업평가는 일제히 포스코이앤씨의...",http://www.mhj21.com/171298
2025-12-29 16:06,,포스코플로우,"포스코플로우, 혹한기 안전 챙긴다…광양·포항 화물기사 방한복 지원",포스코그룹 물류 계열사 포스코플로우가 겨울철 혹한기에도 철강 물류 현장을 지키는 화물 운송 기사들의 안전 확보에 나섰다. 포스코플로우는 12월 23~24일 광양과 포항에서 화물기사를 대상으로 기능성 방한복을...,http://www.snmnews.com/news/articleView.html?idxno=563111
2025-12-29 15:57,이데일리,포스코,안전난간 없어…'노동자 추락사' 포스코이앤씨 벌금형,기소된 포스코이앤씨에 벌금 1000만원을 선고했다고 29일 밝혔다. 함께 기소된 하청 업체 2곳에는 각각 벌금 500만원과 700만원이 선고됐다. 업무상과실치사 등 혐의로 재판에 넘겨진 포스코이앤씨 소속 현장 소장과 하청...,http://www.edaily.co.kr/news/newspath.asp?newsid=03814646642403440
2025-12-29 15:48,한국일보,삼척블루파워,"포스코이앤씨, 3대 신평사 동시 하향…재무·평판 리스크 현실화","육성훈 나신평 책임연구원은 ""비주택 부문의 삼척블루파워(공기 연장 중재) 및 폴란드 바르샤바 소각로(준공 지연) 등 일부 현장에서 운전자금 회수가 지연되고 있다""며 ""2026년 이후 운전자금 회수를 통한 현금흐름 개선...",https://sports.hankooki.com/news/articleView.html?idxno=6920468
2025-12-29 15:40,연합뉴스,POSCO INTERNATIONAL,KOSPI 200 Closing Price List-1,"1,000 POSCO INTERNATIONAL 50,400 UP 300 SGBC 63,400 DN 1,300 SLCORP 42,750 DN 450 Yuhan 113,100 UP 400 SamsungElec 119,500 UP 2,500 DB INSURANCE 129,000 UP 400 NHIS 21,350 UP 250 HYUNDAI STEEL 31...",https://en.yna.co.kr/view/AEN20251229007600320?input=2106m
2025-12-29 15:32,,삼척블루파워,석탄 발전 줄이면 전기요금 오른다는 조선일보의 거짓말.,"삼척블루파워와 강릉에코파워, GS동해전력은 지난해 각각 2000억 원과 2400억 원, 510억 원의 미정산 적자를 냈다. 정부가 정산 조정계수를 높여주는 방식으로 손실을 보전해주면서 수명을 연장하고 있다. 재생...",https://slownews.kr/151646
2025-12-29 15:30,안전신문,포스코플로우,"포스코플로우, 화물기사 안전 운행 응원 방한복 전달",화물기사 안전용품 기증식에 참여한 직원들이 함께 모여 기념촬영을 하고 있다/포스코플로우 제공 포스코플로우(사장 반돈호)는 23일부터 24일까지 양일간 광양과 포항에서 화물 운송 기사들의 겨울철 안전 운행을...,https://www.safetynews.co.kr/news/articleView.html?idxno=244875
2025-12-29 15:28,뉴스핌,포스코,포스코이앤씨 재개발 공사 현장 노동자 추락사…안전관리 소홀 벌금 100...,포스코이앤씨가 시공을 맡은 인천의 재개발 공사 현장에서 30대 노동자가 숨진데 대해 법원이 안전관리... 인천지법 형사9단독 정제민 판사는 산업안전보건법 위반 혐의로 기소된 포스코이앤씨와 이 회사 소속 현장소장...,https://www.newspim.com/news/view/20251229000839
2025-12-29 15:18,,삼척블루파워,재무지표 악화에 사고까지…포스코이앤씨 신용등급 하락은?,인프라 부문에서는 삼척블루파워 사업이 공사기간 변경과 관련해 중재가 진행되고 있으며 폴란드 바르샤바 소각도로 준공 시기가 지연되며 자금 회수가 늦춰지고 있다. 각 현장의 미청구공사 금액은 각각 1019억원...,http://www.sisaon.co.kr/news/articleView.html?idxno=179004
2025-12-29 15:10,,포스코플로우,"포스코플로우, 운송 기사 1200여 명에 방한복 지원","화이트페이퍼, WHITEPAPER화물기사 안전용품 기증식에 참여한 포스코플로우 직원들이 함께 모여 기념촬영을 하고 있다 (사진=포스코플로우) 포스코플로우는 화물 운송 기사들의 겨울철 안전 운행을 지원하기 위해...",http://www.whitepaper.co.kr/news/articleView.html?idxno=256330
2025-12-29 14:48,,포스코인터,"포스코인터, 우즈베키스탄 핵심 광물 사업 투자…'자원 개발'로 중심축...",우즈벡 대표단 방한 계기 협의…광물 협력·MOU 체결 합의 면방 사업 비중 조정과 맞물려 포스코인터내셔널이 우즈베키스탄 정부와 손잡고 핵심 광물 사업 개발에 나선다. 기존 면방 중심 사업의 구조 조정과 맞물려 현지...,https://www.theguru.co.kr/news/article.html?no=96154
2025-12-29 14:47,,포스코,[신년사 점검] [포스코이앤씨] 중대재해로 흔들린 '100년 지속' 목표,신안산선 시공 현장 재차 붕괴…초유의 CEO 교체 이후 안전 쇄신 과제 포스코이앤씨에게 올해는 유독 험난한 한 해였다. 연초만 해도 지속 성장에 남다른 포부를 드러냈던 포스코이앤씨는 연중 내내 그치지 않는...,https://www.topdaily.kr/articles/107665
2025-12-29 14:40,,포스코,포스코DX 주가 6% 폴짝…2거래일 하락 딛고 반등,포스코DX(022100) 주가가 2거래일 하락을 딛고 29일장에서 반등하고 있다. 포스코DX는 29일 오후 2시 35분 현재 29950원에 거래되고 있다. 전일 종가보다 1850원(+6.58%) 오른 것이다. 포스코DX는 앞서 지난 24일과 26일...,https://www.cbci.co.kr/news/articleView.html?idxno=547473
2025-12-29 14:10,,포스코플로우,"포스코플로우, 겨울철 화물기사 안전운행 응원 위한 방한복 전달",포스코플로우가 23일부터 24일까지 양일간 광양과 포항에서 화물 운송 기사들의 겨울철 안전 운행을 지원하기 위한 방한복을 전달했다고 29일 밝혔다. 이번 행사는 겨울철 야외 작업이 잦은 철강제품 운송 기사들의 건강...,http://www.fnnews.com/news/202512291345206007
2025-12-29 14:08,,포스코플로우,"포스코플로우, 겨울철 화물기사 안전운행 응원 위한 방한복 전달",[사진=포스코플로우] 포스코플로우는 23일부터 24일까지 양일간 광양과 포항에서 화물 운송 기사들의 겨울철 안전 운행을 지원하기 위한 방한복을 전달했다고 29일 밝혔다. 이번 행사는 겨울철 야외 작업이 잦은 철강제품...,https://www.news2day.co.kr/article/20251229500171
2025-12-29 13:54,,포스코,"포스코이앤씨, 4년 전 인천 재개발 현장 추락사고로 벌금형","포스코이앤씨 사옥 전경 [사진=포스코이앤씨] 포스코이앤씨가 4년 전 한 재개발 공사 현장에서 발생한 노동자 추락 사고와 관련해 벌금형을 맞았다. 29일 업계에 따르면, 인천지법 형사9단독 정제민 판사는...",http://www.newsian.co.kr/news/articleView.html?idxno=84645
2025-12-29 13:40,,포스코,재개발 공사장서 노동자 추락사…포스코이앤씨 벌금형,인천지법 형사9단독 정제민 판사는 산업안전보건법 위반 혐의로 기소된 포스코이앤씨와 이 회사 소속 현장소장 A(60)씨에게 벌금 1000만원을 선고했다고 29일 밝혔다. 정 판사는 또 산업안전보건법 위반과...,https://www.seoul.co.kr/news/society/2025/12/29/20251229500109?wlog_tag3=naver
2025-12-29 13:24,,포스코,"포스코DX, 비전AI 조직 확대...휴머노이드 사업 잰걸음","포스코DX가 산업용 휴머노이드 로봇의 '시각적 인공지능(Vision AI, 이하 비전AI)' 역량을 강화하기 위해... 29일 IT업계에 따르면 포스코DX는 비전AI 분야의 개발자를 채용 중이다. 비전AI 프로그래밍을 넘어 로봇과 PLC...",https://www.thelec.kr/news/articleView.html?idxno=50300
2025-12-29 13:14,,포스코,"포스코이앤씨, 신평 3사 '부정적' 전망…'A+' 등급 방어","포스코홀딩스 자회사 포스코이앤씨가 실적 부진과 안전사고 여파로 국내 3대 신용평가사의 동시 경고 대상이 됐다. 한국기업평가, 한국신용평가, 나이스신용평가는 포스코이앤씨의 무보증사채 신용등급을 A+로 유지하되...",https://www.newstopkorea.com/news/articleView.html?idxno=42111
2025-12-29 13:04,,포스코,‘노동자 추락사’ 포스코이앤씨 벌금 1000만원,관련해 포스코이앤씨와 하청 업체들이 안전관리 소홀로 벌금형을 선고받았다. 인천지방법원 형사9단독 정제민 판사는 산업안전보건법 위반 혐의로 기소된 포스코이앤씨와 이 회사 소속 현장소장 A씨에게 벌금...,https://www.naeil.com/news/read/572603?ref=naver
2025-12-29 12:08,뉴스워커,포스코플로우,"포스코플로우, 겨울철 화물기사 안전운행 응원 위한 방한복 전달해",포스코플로우(사장 반돈호)가 지난 23일부터 24일까지 양일간 광양과 포항에서 화물 운송 기사들의 겨울철 안전 운행을 지원하기 위한 방한복을 전달했다. 이번 행사는 겨울철 야외 작업이 잦은 철강제품 운송 기사들의...,http://www.newsworker.co.kr/news/articleView.html?idxno=408606
2025-12-29 12:04,,포스코,안전난간 없어 30대 노동자 숨졌는데…포스코이앤씨 벌금형뿐,"기소된 포스코이앤씨와 하청업체에게 벌금형이 선고됐다. 인천지법 형사9단독 정제민 판사는 산업안전보건법 위반 혐의로 기소된 포스코이앤씨와 현장소장에게 벌금 1천만원을 선고하고, 산업안전보건법 위반과...",https://www.hani.co.kr/arti/area/capital/1236995.html
2025-12-29 11:50,메디컬투데이,포스코,"포스코이앤씨, 신용등급 빨간불...안전사고·재무 부담에 ‘부정적’ 전...","▲ (사진=포스코이앤씨) 포스코이앤씨의 장기 신용등급 전망이 국내 주요 신용평가사들에 의해 잇따라 ‘부정적’으로 변경됐다. 나이스신용평가, 한국신용평가, 한국기업평가는 최근 반복된 안전사고와 공정 지연, 해외...",https://mdtoday.co.kr/news/view/1065579725994121
2025-12-29 11:42,,포스코,2021년 인천 부평 노동자 사망사고에 포스코이앤씨 현장소장에 벌금 1천...,포스코이앤씨 현장 소장과 하청 업체가 2021년 노동자 사망사고와 관련 관리 소홀로 벌금형을 받았다. 29일 법조계에 따르면 인천지법 형사9단독 정제민 판사는 산업안전보건법 위반 혐의로 기소된 포스코이앤씨 소속...,https://www.businesspost.co.kr/BP?command=article_view&num=425117
2025-12-29 11:33,헤럴드경제,포스코플로우,"포스코플로우, 겨울철 화물기사 안전운행 응원 위한 방한복 전달",광양·포항의 화물 운송 기사 1232명에 방한복 지급 “현장 안전 최우선 경영 실천” “물류 파트너사와의 상생 협력 강화” 화물기사 안전용품 기증식에 참여한 포스코플로우 직원들이 함께 모여 기념촬영을 하고 있다....,https://biz.heraldcorp.com/article/10645169?ref=naver
2025-12-29 11:20,,포스코,"철강·이차전지 공정에 AI 이식...포스코DX, 실적 레벨업 시동",포스코DX 주가가 강세를 보이고 있다. 29일 한국거래소에 따르면 이날 오전 11시13분 현재 6.23% 상승 2만 9850원에 거래되고 있다. 주가는 이중 바닥에서 벗어나려 시도하고 있다. 포스코DX가 인공지능(AI)과 디지털트윈...,https://www.pinpointnews.co.kr/news/articleView.html?idxno=411373
