날짜,매체명,검색키워드,기사제목,주요기사 요약,URL,sentiment
2026-01-31 10:46,,포스코인터내셔널,팜 농장·호주 가스전 효과…포스코인터내셔널 실적 살아난다,"포스코인터내셔널이 다시 증익 구간에 진입했다는 평가가 나온다. 자원·에너지 사업을 축으로 한 사업 구조가 안정화 단계에 접어들면서, 외부 변수에도 흔들림이 줄어들고 있다는 분석이다. 하나증권은 최근...",https://www.pinpointnews.co.kr/news/articleView.html?idxno=423973,pos
2026-01-31 10:46,,포스코,"포스코 노사, 가치창출형 노사문화로 전환 선언…대한민국 ‘K-노사문화...",노사 공동연구 통해 K-노사문화 가이드라인 연내 수립 가치창출형 노사문화 공동연구 Kick-Off 단체사진 포스코... 포스코는지난 30일 포항 포스코노동조합 사무실에서 김성호 포스코노동조합 위원장과 김동희 포스코...,https://www.news2day.co.kr/article/20260131500014,pos
2026-01-31 10:00,,포스코인터,"포스코인터, 3년 연속 영업이익 1조 돌파···'종합자원기업' 완성","포스코인터내셔널이 에너지와 식량을 축으로 한 사업 구조 전환에 성과를 내며 창사 이래 최대 실적을 기록했다. 포스코에너지와의 합병 이후 3년 연속 영업이익 1조원대를 유지하면서, 단순 무역회사를 넘어...",https://www.seoulfn.com/news/articleView.html?idxno=619852,pos
2026-01-31 09:12,,포스코인터내셔널,"미래에셋증권, 1월 마지막주 SK하이닉스 등 19종목 매수 추천","포스코인터내셔널(047050) 멈추지 않는 성장 동력. 2025년 4분기 매출과 영업이익은 각각 7조8275억원(-1.4% YoY), 2655억원(83.6% YoY)으로 영업이익 기준 컨센서스 상회. 확대되는 자원 개발 프로젝트: 중장기...",https://www.bigtanews.co.kr/article/view/big202601300014,pos
2026-01-31 09:02,,포스코인터내셔널,"KB증권, 1월 마지막주 포스코퓨처엠 등 24종목 매수 추천",포스코인터내셔널(047050) 2025년 4분기 영업이익 2655억원으로 컨센서스 9.6% 상회. 2026년 영업이익은 1조3000억원으로 전년 대비 1500억원 개선될 것으로 추정. 목표주가를 7만3000원으로 5.7% 상향조정하고...,https://www.bigtanews.co.kr/article/view/big202601300011,pos
2026-01-31 09:00,,포스코,"포스코 노사, '사회적 책임' 다하는 K-노사문화 구축 위해 '맞손'","포스코 노사가 불확실성이 가중되고 있는 경영환경 속에서도 지속가능한 포스코형 노사문화 표준을 만들기 위해 손을 맞잡았다. 포스코는 30일, 포항 포스코노동조합 사무실에서 김성호 포스코노동조합 위원장, 김동희...",https://www.wikitree.co.kr/articles/1114448,pos
2026-01-31 09:00,,포스코,"장인화 포스코그룹 회장 ""압도적 실행력으로 수익성 중심 체질 전환""","포스코그룹이 올해 경영 키워드로 '압도적 실행력'과 '성과 창출'을 내걸고, 수익성 중심의 체질 전환에 본격적으로 나선다. 장인화 포스코그룹 회장은 복합 위기 속에서도 과감한 변화와 실행을 통해 미래 투자의 결실을...",https://www.ezyeconomy.com/news/articleView.html?idxno=231669,pos
2026-01-31 08:00,,포스코,[배터리 온에어] 리튬 가격 급등에 포스코퓨처엠·에코프로 '반색',포스코퓨처엠과 에코프로비엠 등 국내 배터리 소재 업계의 발목을 잡던 리튬 가격이 새해 들어 반등하기... 광물 가격이 오르면 배터리 3사에는 부담으로 작용할 수 있지만 포스코퓨처엠과 에코프로비엠 등 소재...,https://www.bloter.net/news/articleView.html?idxno=653166,pos
2026-01-31 07:18,,포스코,"재고 손실까지 겹쳤다… 포스코퓨처엠, 바닥 확인 국면","포스코퓨처엠이 지난해 4분기 예상보다 큰 폭의 적자를 기록하며 이차전지 소재 사업의 단기 회복이 쉽지... 한화투자증권은 최근 보고서에서, 포스코퓨처엠의 실적 부진이 일시적 수요 둔화를 넘어 구조적인 판매...",https://www.pinpointnews.co.kr/news/articleView.html?idxno=423909,neg
2026-01-31 07:14,,포스코,"철강·이차전지 동반 부진… 포스코홀딩스, 바닥 다지기 국면",한화투자증권은 최근 보고서에서 포스코홀딩스의 4분기 실적을 두고 예견된 진통의 결과라고 평가했다. 단기적인 실적 부진보다는 향후 정상화를 위한 체질 개선 과정에 초점을 맞출 필요가 있다는 분석이다. 포스코홀...,https://www.pinpointnews.co.kr/news/articleView.html?idxno=423908,neg
2026-01-31 06:02,,구동모터코어,클라우드·AI가 실적 갈랐다… SI 업계 다음 판은 '에이전틱·피지컬 AI',"피지컬 AI 분야에서는 야스카와, 포스코모빌리티솔루션과 협력해 전기차 구동모터코어 생산 공정에 로봇 자동화 시스템을 적용하고 미국 휴머노이드 로봇 전문기업 페르소나AI에 투자해 피지컬 AI 솔루션 공동...",https://it.chosun.com/news/articleView.html?idxno=2023092156068,pos
2026-01-31 00:45,,포스코인터내셔널,포스코 “고강도 비상경영 체제로”,실제로 지난해 매출과 영업이익 모두 사상 최대 실적을 낸 포스코인터내셔널은 전체 영업이익의 54%를 에너지 부문에서 올렸다. 장 회장은 LNG(액화천연가스) 생산 확대에 투자를 지속하겠다는 방침도 밝혔다....,https://www.chosun.com/economy/industry-company/2026/01/31/G44DRGNKCJFQXCQNGDVAZDBZTI/?utm_source=naver&utm_medium=referral&utm_campaign=naver-news,pos
2026-01-31 00:42,,포스코,포스코이앤씨 공사 현장 '오염물질 15배 초과 방류' 또 적발,포스코이앤씨가 시행한 광명~서울 고속도로 건설공사 현장에서 폐수처리시설을 부적정하게 운영한 행위가... 점검 결과 포스코이앤씨는 신고 폐수처리시설을 거치지 않고 오염수를 우회 유출하는 비정상 고압호스를...,https://www.thereport.co.kr/news/articleView.html?idxno=83295,neg
2026-01-31 00:40,,포스코,"[기업] 포스코 장인화 ""압도적 실행력으로 성과 창출해야""",장인화 포스코그룹 회장이 올해 사업에서 압도적 실행력으로 가시적 성과를 창출해야 한다고 강조했습니다.... 장 회장은 위기 속에서도 기회의 실마리를 찾아 도약하는 것이 포스코의 저력이라면서 그룹의 경쟁력을...,https://www.ytn.co.kr/_ln/0102_202601310040244591,pos
2026-01-31 00:02,,포스코,"포스코 노사, K-노사문화 구축 '맞손'","포스코가 30일 포항 포스코노동조합 사무실에서 김성호 포스코노동조합 위원장, 김동희 포스코 경영지원본부장, 연구 총괄을 맡은 채준호 전북대 교수 등이 참석한 가운데 '가치창출형 노사문화 수립을 위한 노사...",http://www.hansbiz.co.kr/news/articleView.html?idxno=813582,pos
2026-01-30 22:18,,포스코인터내셔널,"철강은 반등했지만…포스코홀딩스, 영업이익 전년比 16% 감소",인프라 부문에서는 포스코인터내셔널이 호주 세넥스에너지 LNG 증산과 인도네시아 팜 기업 인수 등 밸류체인 확장을 통해 견조한 이익을 유지했다. 반면 포스코이앤씨는 플랜트 등 수주 확대에도 공사 중단에 따른...,https://www.mhj21.com/news/articleView.html?idxno=250096,pos
2026-01-30 21:47,KBS,포스코,"광명시, ‘오염물질 15배 초과 방류’ 포스코이앤씨 공사 현장 또 적발",,https://news.kbs.co.kr/news/pc/view/view.do?ncd=8473781&ref=A,neg
2026-01-30 21:20,,포스코,[브리프]현대건설 대우건설 GS건설 포스코이앤씨 롯데건설 HDC현대산업개...,"■포스코이앤씨, 아파트 전기요금 절감 위해 '자동형 전력 수요관리' 서비스 확대 적용 출처=포스코이앤씨 포스코이앤씨가 공동주택을 중심으로 '자동형 전력 수요관리' 서비스를 확대 적용하며 공동주택 에너지...",http://www.biztribune.co.kr/news/articleView.html?idxno=348213,pos
2026-01-30 20:40,,포스코,"포스코 장인화 회장, ""압도적 실행력으로 체질 개선""","장인화 포스코그룹 회장은 올해 경영 키워드로 ‘압도적 실행력’과 ‘성과 창출’을 내세웠습니다. 장 회장은 수익성 중심의 경영을 통해 그룹 체질을 과감히 개선하고, 비상경영 체제 전환으로 시장의 신뢰를 되찾겠다는...",http://www.phmbc.co.kr/www/news/desk_news?idx=199661&mode=view,pos
2026-01-30 20:28,뉴스핌,포스코,"포스코퓨처엠 ""포드와 양극재 공급 협의 잠정 중단""",포스코퓨처엠은 미국 완성차 업체 포드와 대규모 양극재 공급 협의를 잠정 중단했다고 30일 공시했다. 포스코퓨처엠은 지난 2022년부터 포드와 수십조 원 규모 양극재 공급을 추진하고 있는 것으로 알려졌다....,https://www.newspim.com/news/view/20260130001316,neg
2026-01-30 19:32,,포스코,"포스코 노사, ‘사회적 책임’ 실천하는 K-노사문화 구축에 맞손",뉴데일리 박진호 기자 = 포스코 노사가 불확실성이 커지는 경영 환경 속에서도 지속가능한 상생과 사회적 책임을 담은 ‘포스코형 K-노사문화’ 구축을 위해 본격적인 공동 행보에 나섰다. 포스코는 30일 포항...,https://tk.newdaily.co.kr/site/data/html/2026/01/30/2026013000321.html,pos
2026-01-30 19:30,,포스코,"'포스코형 노사상생 모델' 만든다... ""K-노사문화 선도할 것""","포스코 노사가 불확실성이 가중되는 경영환경 속에서도 지속가능한 자체 노사문화 표준을 만들기 위해 손을 잡았다. 포스코는 30일 김성호 포스코노동조합 위원장, 김동희 포스코 경영지원본부장, 연구 총괄을 맡은 채준호...",http://www.newsbrite.net/news/articleView.html?idxno=196173,pos
2026-01-30 19:24,,포스코,"포스코퓨처엠, 포드와 양극재 공급 협의 잠정 중단",포스코퓨처엠이 미국 완성차업체 포드와 추진해 온 양극재 공급 협의를 잠정 중단했다고 30일 공시했다. 포스코그룹은 2022년 10월 당시 짐 팔리 포드 최고경영자(CEO)와 회동을 가진 후 양극재 공급 논의 및 관련...,https://www.mt.co.kr/industry/2026/01/30/2026013019040711917,neg
2026-01-30 19:06,,포스코,"포스코, 가치창출형 노사문화 수립을 위한 노사 공동연구 킥오프 행사 ...","노동조합의 사회적 책임 확대 및 안전혁신 TF 참여 등 실질적 활동 구체화 철강산업 위기 극복 위해 노사 경계 허물고 ‘지속가능한 상생 모델’ 도출 목표 포스코는 김성호 포스코노동조합 위원장, 김동희 포스코...",https://www.youthdaily.co.kr/news/article.html?no=211502,pos
2026-01-30 19:02,,포스코,"포스코그룹 장인화 회장 ""미래 성장 투자 결실 '수치'로 입증할 것""",""" 포스코그룹이 글로벌 복합 위기를 돌파하기 위해 강도 높은 비상경영 체제로 전환하고, 가시적인 경영 성과를 데이터로 증명하겠다는 강력한 의지를 피력했다. 포스코그룹은 지난 29일 장인화 회장 주재로 2026년 첫 그룹...",https://www.thedailypost.kr/news/articleView.html?idxno=112971,pos
2026-01-30 18:46,이투데이,포스코,"포스코퓨처엠 ""GM과 양극재 공급 협의, 시황 변동으로 잠정 중단""","이투데이=정진용 기자 | ""향후 여건에 따라 협의 재개"" 포스코퓨처엠이 미국 완성차 업체 포드(Ford)와 추진해 온 양극재 공급 협의를 잠정 중단했다고 30일 공시했다. 최정우 전 포스코그룹 회장은 지난 2022년 당시 짐 팔리...",https://www.etoday.co.kr/news/view/2551581,neg
2026-01-30 18:46,이투데이,포스코,"포스코퓨처엠 ""포드와 양극재 공급 협의, 시황 변동으로 잠정 중단""","이투데이=정진용 기자 | ""향후 여건에 따라 협의 재개"" 포스코퓨처엠이 미국 완성차 업체 포드(Ford)와 추진해 온 양극재 공급 협의를 잠정 중단했다고 30일 공시했다. 최정우 전 포스코그룹 회장은 지난 2022년 당시 짐 팔리...",https://www.etoday.co.kr/news/view/2551581,neg
2026-01-30 18:44,데일리한국,포스코,"포스코이앤씨, 공동주택 '자동형 전력 수요관리' 확대 적용",포스코이앤씨 본사 사옥. 사진=포스코 제공 포스코이앤씨가 아파트 전기요금 절감을 위해 공동주택 대상 '자동형 전력 수요관리' 서비스를 확대 적용하고 있다고 30일 밝혔다. 포스코이앤씨는 의정부 더샵 리듬시티를...,https://daily.hankooki.com/news/articleView.html?idxno=1329811,pos
2026-01-30 18:34,,포스코,"포스코퓨처엠, 포드와 양극재 공급 협의 잠정 중단",포스코퓨처엠[003670]이 미국 완성차 업체 포드(Ford)와 추진해 온 양극재 공급 협의를 잠정 중단했다고 30일 공시했다. 최정우 전 포스코그룹 회장은 지난 2022년 당시 짐 팔리 포드 최고경영자(CEO)와 비공개로...,https://news.einfomax.co.kr/news/articleView.html?idxno=4396521,neg
2026-01-30 18:28,,포스코,"포드 전기차 축소에 포스코퓨처엠도 유탄…""양극재 논의 중단""","국내 업체들이 포드의 전동화 전략 재편에 영향을 받는 가운데, 포스코퓨처엠도 공급 협의에 제동이 걸렸다. 포스코퓨처엠은 미국 자동차 기업 포드와 진행하던 양극재 공급 논의를 중단했다고 30일 공시했다. 지난...",https://zdnet.co.kr/view/?no=20260130180540,neg
2026-01-30 18:10,,포스코모빌리티솔루션,"‘대기업 IT사들 잘나가는데…’ 분기 적자 포스코DX, 로봇으로 반전 가...",글로벌 3대 산업용 로봇 제조사인 ‘야스카와 전기’와도 협력한 포스코DX는 포스코모빌리티솔루션이 생산한 모터코어 품질 등급별 분류 작업에 로봇을 투입한다. 앞서의 IT업계 한 관계자는 “로봇 파운데이션...,https://ilyo.co.kr/?ac=article_view&entry_id=507475,pos
2026-01-30 18:06,더퍼블릭,포스코,"포스코 노사, '사회적 책임' 다하는 K-노사문화 구축 위해 '맞손'","포스코 노사가 불확실성이 가중되고 있는 경영환경 속에서도 지속가능한 포스코형 노사문화 표준을 만들기 위해 손을 맞잡았다. 포스코는 30일, 포항 포스코노동조합 사무실에서 김성호 포스코노동조합 위원장, 김동희...",https://www.thepublic.kr/news/articleView.html?idxno=292764,pos
2026-01-30 18:00,,포스코,"포스코그룹 장인화, ‘압도적 실행력’으로 실적 반등 선언","장인화 포스코그룹 회장이 올해 그룹 경영 키워드로 ‘압도적 실행력’과 ‘성과 창출’을 제시하며, 복합 위기 속에서도 과감한 체질 개선을 통해 미래 투자 성과를 ‘수치’로 입증하겠다는 의지를 밝혔다. 포스코그룹...",https://www.seoultimes.news/news/article.html?no=2000090696,pos
2026-01-30 17:58,,포스코,"장인화 ""포스코그룹 수익성 중심 체질개선 최우선""","포스코그룹은 장인화 회장(사진)이 올해 첫 그룹 경영회의를 주재한 자리에서 “정체된 성장을 돌파하려면... 포스코아르헨티나의 리튬 상업 생산을 본격화하고, 호주 미네랄리소스의 리튬 광산 지분 인수도 마무리해...",https://www.hankyung.com/article/2026013044581,pos
2026-01-30 17:56,MTN,포스코,"포스코·현대제철 드디어 반등…""해외투자 본격화""",포스코와 현대제철이 지난해 영업이익 개선에 성공했습니다.올해도 연초부터 철강 제품 가격을 인상하며... [기사내용]철강업계가 실적 반등에 성공했습니다.포스코와 현대제철은 각각 지난해 영업이익 1조7800억원...,https://news.mtn.co.kr/news-detail/2026013016384566016,pos
2026-01-30 17:50,,포스코인터내셔널,"[특징주] POSCO홀딩스, 이차전지·철강 동반 반등 기대에 목표가 48만 원...",인프라 부문은 포스코이앤씨의 대규모 비용 반영 이후 발생하는 기저효과와 포스코인터내셔널의 호주 세넥스 에너지 증산에 따른 실적 기여가 이익 개선의 핵심 동력이 될 것으로 점쳐진다. ◆ 투자의견 및 목표주가...,http://www.newstnt.com/news/articleView.html?idxno=582185,pos
2026-01-30 17:46,,포스코,"포스코 장인화 회장 ""미래 성장 투자 성과, '수치'로 입증할 것""",포스코그룹 장인화 회장이 올해 그룹 경영 키워드로 '압도적 실행력'과 '성과 창출'을 제시했다. 복합 위기 속 과감한 체질 개선을 통해 미래 투자에 대한 가시적 결실을 '수치'로 입증하겠다는 의지다. 포스코그룹은...,http://www.koreastocknews.com/news/articleView.html?idxno=116514,pos
2026-01-30 17:35,,포스코,"철강 불황의 시험대…포스코 ‘신사업’ 발목, 현대제철 ‘본업 집중’",미국의 고율 관세와 중국산 저가 철강재 유입이라는 이중 압박 속에서 국내 철강업계 양대 축인 포스코와 현대제철의 실적 흐름이 뚜렷하게 갈렸다. 포스코는 철강 본업은 선방했지만 이차전지 소재 등 신사업 부문의...,https://www.mydaily.co.kr/page/view/2026013017103411815,pos
2026-01-30 17:34,,포스코,"포스코 노사, ‘투쟁 넘어 상생’ 새 노사문화 만든다",포스코 노사가 격변하는 경영 환경 속에서도 지속 가능한 노사 협력 모델을 만들기 위해 공동 연구에 나섰다. 포스코는 30일 포항 포스코노동조합 사무실에서 김성호 포스코노동조합 위원장과 김동희 경영지원본부장 등이...,https://www.dizzotv.com/site/data/html_dir/2026/01/30/2026013080186.html,pos
2026-01-30 17:34,,포스코인터내셔널,"초록우산 인천가정위탁지원센터, '포스코인터내셔널과 함께하는 2025 드...",초록우산 인천가정위탁지원센터 '포스코인터내셔널과 함께하는 2025 드림컨설팅'활동공유회 진행. ⓒ초록우산 아동복지전문기관 초록우산(회장 황영기) 인천가정위탁지원센터는 지난 29일 포스코타워(송도)에서...,https://www.ibabynews.com/news/articleView.html?idxno=147874,pos
2026-01-30 17:30,동아일보,포스코,"포스코그룹, 체질 바꾸고 속도 낸다… 키워드는 ‘실행력과 성과’","포스코그룹은 지난 29일 첫 그룹 경영회의를 열었다고 30일 밝혔다. 올해 경영 키워드로 ‘압도적 실행력’과... 포스코아르헨티나 리튬 상업 생산을 본격화하고, 호주 미네랄리소스사의 리튬 광산 지분 인수를 마무리해...",https://www.donga.com/news/Economy/article/all/20260130/133267823/1,pos
2026-01-30 17:28,,포스코,"포스코 노사, 사회적 책임 다하는 K-노사문화 구축 '맞손'","포스코 노사가 지속가능한 포스코형 노사문화 표준을 만들기 위해 손을 맞잡았다. 포스코는 30일 포항 포스코노동조합 사무실에서 김성호 포스코노동조합 위원장, 김동희 포스코 경영지원본부장, 연구 총괄을 맡은 채준호...",https://www.newsworks.co.kr/news/articleView.html?idxno=829406,pos
2026-01-30 17:22,,포스코,포스코이앤씨 '또 오염수 유출'…경기도특사경 적발,"포스코이앤씨가 기준치의 15배를 초과하는 부유물질을 비정상적으로 유출하다 경기도 특별사법경찰단에... 30일 광명시에 따르면 경기도 특별사법경찰단 등은 지난 29일 광명~서울고속도로 1공구를 점검, 포스코이앤씨가...",https://www.newsis.com/view/NISX20260130_0003497248,neg
2026-01-30 17:12,,포스코,올해는 '가시적 성과' 낸다… 장인화 포스코그룹 회장이 제시한 키워드...,시사위크=권정두 기자 장인화 포스코그룹 회장이 올해 그룹 경영 키워드로 '압도적 실행력'과 '성과 창출'을 제시하며 어려운 경영 환경 돌파 의지를 다졌다. 포스코그룹은 지난 29일 장인화 회장 주재로 올해 첫 그룹...,https://www.sisaweek.com/news/articleView.html?idxno=233268,pos
2026-01-30 17:12,,포스코,"포스코 장인화 ""수익성 중심으로 그룹 체질 과감히 전환, 성장정체 돌파...",장인화 포스코그룹 회장이 올해 첫 그룹 경영회의를 주재하고 있다. ⓒ포스코 포스코그룹은 장인화 회장이 지난 29일 그룹 경영 회의를 주재하고 올해 그룹 경영 키워드로 압도적 실행력과 성과 창출을 제시했다고 30일...,http://www.sisafocus.co.kr/news/articleView.html?idxno=354644,pos
2026-01-30 17:12,,포스코,"포스코 노사, '사회적 책임' 다하는 K-노사문화 구축 위해 '맞손'",가치창출형 노사문화 공동연구 Kick-Off 단체사진 [사진=포스코] 포스코 노사가 불확실성이 가중되고 있는 경영환경 속에서도 지속가능한 포스코형 노사문화 표준을 만들기 위해 손을 맞잡았다. 포스코는 30일 포항...,http://www.paxetv.com/news/articleView.html?idxno=260319,pos
2026-01-30 17:12,비즈월드뉴스,포스코,"광명시, 오염물질 기준 15배 초과 방류한 포스코이앤씨 현장 적발","포스코이앤씨 공사 현장 '오염물질 15배 초과 방류' 또 적발 사진=광명시 광명~서울 고속도로 건설 현장에서 시공사 포스코이앤씨의 환경법 위반 행위가 또다시 적발됐다. 단순 관리 소홀을 넘어, 불법을 인지하고도...",http://www.bizwnews.com/news/articleView.html?idxno=123565,neg
2026-01-30 17:08,딜라이트이슈,포스코,"포스코이앤씨 ""모든 신축에 자동형 전력 수요 관리 서비스""","(사진=포스코이앤씨) 포스코이앤씨는 '더샵', '오티에르' 등 자사 브랜드의 모든 신축 아파트에 자동형 전력 수요 관리 서비스를 적용한다고 30일 밝혔다. 서비스는 전력 수급 상황이 악화할 경우 포스코이앤씨의...",https://www.delighti.co.kr/news/articleView.html?idxno=110631,pos
2026-01-30 17:04,,포스코,"포스코 노사, ‘K-노사문화’ 만들기 공동 연구 착수",30일 포항 포스코노동조합 사무실에서 열린 '가치창출형 노사문화 수립을 위한 노사 공동연구' 출범 행사에서 참석자들이 손을 잡고 기념촬영을 하고 있다. 포스코 제공 포스코 노사가 기업과 노동조합의 관계를 넘어...,https://www.yeongnam.com/web/view.php?key=20260130025093772,pos
2026-01-30 17:00,,포스코,"장인화의 포스코그룹, 말보다 '숫자'... ""압도적 실행으로 성과 증명할...",기술 격차 확대 [시장경제=손유진 기자] 포스코그룹 장인화 회장이 지난해 3월 열린 그룹기술전략회의를 주재하고 있다. 사진=포스코홀딩스 장인화 포스코그룹 회장이 올해 경영 키워드로 '압도적 실행력'과 '성과 창출'을...,https://www.meconomynews.com/news/articleView.html?idxno=127000,pos
2026-01-30 16:56,,포스코,"포스코이앤씨, 전기 아끼는 '자동형 전력 수요관리' 서비스 확대","기자] 포스코이앤씨는 자동형 전력 수요관리 서비스를 더샵 전 단지로 확대 적용하고, 공동주택 내 전기차 충전기와도 연계해 에너지 절감 범위를 넓힐 계획이라고 30일 밝혔다. 포스코이앤씨의 '자동형 전력 수요관리'는...",https://www.meconomynews.com/news/articleView.html?idxno=127010,pos
2026-01-30 16:56,,포스코,"포스코 노사, '사회적 책임' 다하는 K-노사문화 구축 위해 '맞손'",현대경제신문 민성준 기자 | 포스코 노사가 불확실성이 가중되고 있는 경영환경 속에서도 지속가능한 포스코형 노사문화 표준을 만들기 위해 손을 맞잡았다. 포스코는 30일 포항 포스코노동조합 사무실에서 김성호...,http://www.finomy.com/news/articleView.html?idxno=248825,pos
2026-01-30 16:56,,포스코,[브리프] 포스코 HD현대 KGM LIG넥스원 한국앤컴퍼니 外,"■ 포스코 노사, '사회적 책임' 다하는 K-노사문화 구축 협력 가치창출형 노사문화 공동연구 Kick-Off 단체사진 ㅣ 포스코 포스코 노사가 불확실한 경영환경을 극복하고 지속가능한 노사문화 표준을 만들기 위해 30일...",http://www.biztribune.co.kr/news/articleView.html?idxno=348203,pos
2026-01-30 16:52,,포스코,"포스코, '사회적 책임' 다하는 노사문화 만든다","포스코 노사가 지속가능한 노사문화 표준을 만들기 위해 손을 맞잡았다고 30일 밝혔다. 포스코는 이날 경북 포항 포스코노동조합 사무실에서 김성호 포스코노동조합 위원장, 김동희 포스코 경영지원본부장, 채준호...",https://www.mt.co.kr/industry/2026/01/30/2026013016234894141,pos
2026-01-30 16:52,,포스코인터,"'적극 투자 이유 있었네'···포스코인터, 팜 사업 성적표 '눈길'",포스코인터내셔널이 오랜 기간 일군 '팜'(palm) 사업에서 두드러진 성과를 내며 주목받고 있다. 지난해 팜 사업의 실적 기여도가 높아지면서 새로운 수익 축으로 자리 잡았다는 평가다. 회사는 올해 팜 기업 인수 시너지...,https://www.sisajournal-e.com/news/articleView.html?idxno=418928,pos
