날짜,매체명,검색키워드,기사제목,주요기사 요약,URL,sentiment
2026-07-20 13:54,에너지경제,대미 투자 특별법,"중동 불안에 美 ‘강제노동’ 추가 관세…정부 “통상 리스크, 긴밀히 ...",정부는 한미전략투자 특별법과 한미전략투자공사 등 3500억 달러 규모 대미 투자 프로젝트의 상업적 합리성도 면밀히 검토해 후속 절차를 추진한다. 구 부총리는 “정상외교로 구축한 경제협력 기반을 적극 활용해 대외...,https://www.ekn.kr/web/view.php?key=20260720022273756,pos
2026-07-20 13:50,,대미 투자 특별법,"정부, 美 관세·301조에 국익 대응…3500억달러 투자 사업성 검토","지난해 관세 협상에서 합의한 3500억달러 규모의 대미 투자는 후보 프로젝트의 사업성을 검토하는 단계다. 정부는 지난 6월 한미전략투자 특별법 시행 이후 한미전략투자공사와 사업관리위원회, 운영위원회를...",https://www.ziksir.com/news/articleView.html?idxno=140516,pos
2026-07-20 13:45,,포스코이앤씨,"세종텔레콤, 폭염 대비 전국 사업장 특별점검…""안전·노무 관리 강화""","세종텔레콤은 현재 국가철도공단 장항선·태백선 신호설비 구축 사업을 비롯해 SK하이닉스 이천·청주 캠퍼스, 포스코이앤씨 주택재개발정비사업, 현대엔지니어링 울산 전기차 신공장 등 다양한 산업 현장에서 전기·통신...",https://www.mt.co.kr/tech/2026/07/20/2026072013145179582,pos
2026-07-20 13:30,,포스코이앤씨,인프라·교육여건 다 갖춘 올인원 단지 '더샵 트리센트' 7월 공급,이러한 가운데 포스코이앤씨가 오는 7월 부산시 남구 문현동 일원에 '더샵 트리센트'를 선보일 예정이라고 밝혔다. 단지는 대연동과 문현동의 경계 지점에 위치해 두 지역의 생활 인프라를 동시에 공유할 수 있는 입지적...,https://www.ksilbo.co.kr/news/articleView.html?idxno=1062508,pos
2026-07-20 13:28,,대미투자특별법,"산업장관 訪美, '마스가' 기반 속도…대미 투자 구체화하나",이를 위해 최근 대미투자특별법 시행에 맞춰 한미전략투자공사를 설립했다. 미국 측이 제안한 투자 대상 프로젝트들의 상업적 합리성을 면밀하게 검토 중이다. 더욱이 정부가 조만간 대미 투자 1호 사업에 대해 발표할...,https://www.widedaily.com/news/articleView.html?idxno=297835,pos
2026-07-20 13:27,,포스코인터내셔널,"래에셋·대한항공·삼성생명 연파…포스코인터내셔널, 5년 만에 대통령...",포스코인터내셔널이 강호들을 연이어 꺾는 저력을 앞세워 5년 만에 대통령기 전국탁구대회 여자일반부 단체전 정상에 복귀했다. 포스코인터내셔널은 지난 18일 경북 경주실내체육관에서 열린 제42회 대통령기...,http://www.osen.co.kr/article/G1112842989,pos
2026-07-20 13:16,컨슈머타임스,포스코이앤씨,"세종텔레콤, 여름철 폭염 대비 '전국 사업장 특별 안전 점검' 실시","현재 세종텔레콤은 국가철도공단의 장항선 및 태백선 신호설비 구축을 비롯해 SK하이닉스 이천·청주 캠퍼스, 포스코이앤씨의 주택재개발정비사업, 현대엔지니어링 울산 전기차 신공장 등 다양한 산업 현장에서 전기·통신...",https://www.cstimes.com/news/articleView.html?idxno=713941,pos
2026-07-20 13:08,,포스코인터내셔널,[데이터 뉴스룸] 유통상사 업체 50곳 중 임원 평균 연봉은 3억 3300만 원...,여기에는 ▲신세계(242억 원) ▲이마트(231억 원) ▲롯데쇼핑(231억 원) ▲현대백화점(156억 원) ▲GS리테일(119억 원) ▲포스코인터내셔널(100억 원)이 포함됐다. 이 중 포스코인터내셔널(-22.3%)을 비롯해 GS리테일...,https://www.greened.kr/news/articleView.html?idxno=345422,pos
2026-07-20 13:00,,포스코이앤씨,'큰장' 열린 도시정비 시장…10大 건설사 희비 교차,대우건설과 롯데건설은 서울 대형 사업지에서 시공권을 따내며 존재감을 키웠고 포스코이앤씨도 서울과 수도권 사업지를 꾸준히 확보하며 선방했다. 반면 IPARK현대산업개발은 경기권에서 올해 첫 수주를 올렸지만...,https://www.sisaon.co.kr/news/articleView.html?idxno=202736,pos
2026-07-20 12:36,,대미투자특별법,"김정관 산업장관, 방미 앞두고 '대미 투자 1호' 논의 주목",최근 대미투자특별법 시행에 맞춰 한미전략투자공사를 설립하고 미국 측이 제안한 사업의 상업적 합리성을 검토 중이다. 특히 정부가 조만간 대미 투자 1호 사업을 발표할 수 있다고 예고한 만큼 이번 방미 기간 관련...,http://www.iminju.net/news/articleView.html?idxno=166830,pos
2026-07-20 12:16,더페어뉴스,포스코이앤씨,"나주시, 직장인 마음건강 돌본다…정신건강 예방사업 확대","지난해 6개 기관에서 올해는 한국문화예술위원회, 포스코이앤씨, 한국농어촌공사, 한국콘텐츠진흥원, 한국농촌경제연구원, 한국인터넷진흥원, 한전KPS 등 7개 기관으로 참여 대상을 넓혔으며, 6월 말 기준 참여 인원은...",https://www.thefairnews.co.kr/news/articleView.html?idxno=82596,pos
2026-07-20 12:08,KPE,포스코,"지역과 함께하는 포스코노동조합, 광양시에 상생 기금 6500만원 전달","com [한국정경신문(광양)=최창윤 기자] 포스코노동조합(위원장 김성호)은 광양시장 상견례 및 상생 기금 6500만 원(초록우산 5000만 원, 사랑나눔복지재단 1500만 원)을 전달했다.20일 광양시에 따르면 지난 16일 포스코노동조...",https://kpenews.com/View.aspx?No=4154250,pos
2026-07-20 12:04,이데일리,포스코홀딩스,"""유럽 항공우주 심장부로 간다""…과기부, 佛 툴루즈서 AI·반도체 인재 ...","참가 기관은 한국연구재단과 국가과학기술연구회(NST) 등 유관기관을 비롯해 KAIST, GIST, 포항공대, KIST, ETRI, 한국생명공학연구원, 삼성전자(005930), HD한국조선해양(009540), 포스코홀딩스 등이다. 해외 연구자들은 연구...",https://www.edaily.co.kr/news/newspath.asp?newsid=02423926645516488,pos
2026-07-20 12:02,,포스코,"포스코 광양제철소, 하역설비에 AI 입혔다","포스코 광양제철소가 원료부두 하역기 설비의 점검 사각지대를 메우고 선제적인 이상징후 감지를 통해 조업... 광양제철소 내 EIC기술부와 제선부, 제선설비부 등 부서 간 유기적인 협업을 바탕으로 포스코 고유의 스마트...",https://www.namdonews.com/news/articleView.html?idxno=917370,pos
2026-07-20 12:00,아시아경제,포스코홀딩스,"과기정통부, 글로벌 인재유치 유럽으로 확대…온라인 플랫폼도 첫 선","행사에는 한국연구재단과 국가과학기술연구회(NST), KAIST·GIST·포항공과대학교(POSTECH), 한국과학기술연구원(KIST)·한국전자통신연구원(ETRI) 등 정부출연연구기관과 삼성전자, HD한국조선해양, 포스코홀딩스 등 국내 산...",https://view.asiae.co.kr/article/2026072010504059703,pos
2026-07-20 12:00,,포스코홀딩스,"정부, 유럽 한인 과학기술인 국내 유치 나서…프랑스서 채용 상담",KIST·ETRI·생명연 등 14개 정부출연연구기관과 삼성전자·HD한국조선해양·포스코홀딩스 등 6개 기업도 함께한다. 참가자들은 자신의 연구 분야와 경력 단계에 맞는 기관과의 매칭을 통해 담당자와 심층 상담을 진행한다....,https://www.newsis.com/view/NISX20260720_0003714907,pos
2026-07-20 12:00,디지털데일리,포스코홀딩스,"과기정통부, 유럽 과학기술인재 유치 확대…온라인 플랫폼도 운영","한국연구재단·국가과학기술연구회 등 5개 유관기관, KAIST·GIST·포항공대 등 3개 대학, KIST·ETRI·생명연 등 14개 정부출연연구기관, 삼성전자·HD한국조선해양·포스코홀딩스 등 6개 기업이 별도 상담 부스를 운영해...",https://www.ddaily.co.kr/page/view/2026072010051847907,pos
2026-07-20 12:00,뉴스1,포스코홀딩스,"과기정통부, 유럽서 과학기술 인재 유치…국내 28개 기관 참여","KAIST와 광주과학기술원(GIST), 포항공대 등 대학 3곳과 한국과학기술연구원(KIST), 한국전자통신연구원(ETRI) 등 출연연 14곳, 삼성전자와 HD한국조선해양, 포스코홀딩스 등 기업 6곳이 상담 부스를 운영한다. 참가자들은...",https://www.news1.kr/it-science/general-science/6232667,pos
2026-07-20 12:00,,포스코홀딩스,"과기정통부, 유럽 한인 과학기술인 유치 박차…프랑스서 홍보 행사",삼성전자·HD한국조선해양·포스코홀딩스 등 기업 6곳이 참여한다. 참여 기관들은 현지에 상담 부스를 마련하고 채용 계획과 연구자 지원제도를 소개한다. 참가자는 연구 분야와 경력 단계에 따라 기관 담당자와...,https://www.digitaltoday.co.kr/news/articleView.html?idxno=685196,pos
2026-07-20 11:58,KPE,포스코플로우,"여수광양항만공사, 'K-해양강국' 건설 박차..북극항로 민관공 MOU","20일 여수광양항만공사에 따르면 지난 16일 YGPA 사옥에서 포스코플로우, 전남광주통합특별시, 광양시와 함께 '북극항로 시대, 글로벌 에너지 물류 허브 항만 도약을 위한 민-관-공 협력 MOU'를 체결했다. 기후 변화로 인한...",https://kpenews.com/View.aspx?No=4154122,pos
2026-07-20 11:38,,포스코,광양 소방관 위한 시원한 응원…포스코광양제철소 파트너사협회 냉·난...,위해 포스코광양제철소 파트너사협회가 냉·난방기를 기부하며 따뜻한 나눔을 실천했다. 광양소방서는 포스코광양제철소 파트너사협회로부터 이동식 에어컨과 차고 난방기를 기부받아 소방대원들의 근무환경 개선에...,http://www.srtimes.kr/news/articleView.html?idxno=207754,pos
2026-07-20 11:37,,대미투자특별법,"산업장관 訪美, '마스가' 기반 속도…대미 투자 구체화하나",이를 위해 최근 대미투자특별법 시행에 맞춰 한미전략투자공사를 설립했다. 미국 측이 제안한 투자 대상 프로젝트들의 상업적 합리성을 면밀하게 검토 중이다. 더욱이 정부가 조만간 대미 투자 1호 사업에 대해 발표할...,https://www.newsis.com/view/NISX20260720_0003715055,pos
2026-07-20 11:37,헤럴드경제,대미 투자 특별법,"정부, ODA에 AI 심는다…‘K-AI 패키지’ 본격 추진",또 최근 시행된 한미전략투자 특별법과 한미전략투자공사 등 전략투자 추진체계를 바탕으로 대미 투자 프로젝트의 상업적 합리성을 면밀히 검토하면서 후속 절차를 추진하기로 했다. 정부는 WTO 개혁과 개발을 위한...,https://biz.heraldcorp.com/article/10813613?ref=naver,pos
2026-07-20 11:18,,포스코인터내셔널,"종합상사, 왜 에너지기업으로 전환하나",포스코인터내셔널(KRX: 047050)은 포스코그룹이 최근 발표한 트리플 코어(철강·리튬·에너지) 체제에서 에너지를 담당하는 핵심 계열사로 등극했다. 액화천연가스(LNG) 분야에서 미얀마 가스전 등 생산부터 운송-저장...,http://www.impacton.net/news/articleView.html?idxno=19648,pos
2026-07-20 11:10,,대미투자특별법,2년차 들어서는 구윤철 “하반기 경제 현안 산적…국민 체감 변화에 역...,1년 동안 미국 관세협상과 중동전쟁 등 대외적 여건이 여의치 않은 상황에서 대미투자특별법 통과와 석유최고가격제 등을 주도하면서 안정적인 경제시스템 관리를 꾀했다. 재임 중 기획재정부가 기획예산처와...,https://www.mk.co.kr/article/12102215,pos
2026-07-20 11:05,,대미 투자 특별법,"구윤철 ""국익 최우선으로 대미 통상 관리""…K-AI 패키지로 신흥시장 공...","지난해 한미 관세 협상 과정에서 약속한 3천500억달러 규모 대미 투자와 관련해서는 ""본격적인 이행을 위한... 정부는 지난달 한미전략투자 특별법 시행 이후 한미전략투자공사와 사업관리위원회, 운영위원회 등을...",https://www.imaeil.com/page/view/2026072011040372310,pos
2026-07-20 10:54,,포스코플로우,"여수광양항만공사, 북극항로 시대 에너지 물류허브 구축","공사는 지난 16일 사옥에서 포스코플로우, 전남광주통합특별시, 광양시와 '북극항로 시대 글로벌 에너지 물류 허브 항만 도약을 위한 민·관·공 협력 업무협약(MOU)'​을 체결했다. 이번 협약은 정부 국정과제인 '북극항로...",https://www.jeonmae.co.kr/news/articleView.html?idxno=1275735,pos
2026-07-20 10:49,,대미 투자 특별법,"구윤철 ""대미 통상관계 안정적 관리, 국익이 최우선""","지난해 관세 협상에 따른 총 3500억 달러 규모의 대미 투자 약속과 관련해선 ""본격 이행을 위해 추진 체계를... 정부는 지난 6월 한미전략투자 특별법 시행 이후 한미전략투자공사, 사업관리위원회, 운영위원회를 잇따라...",https://www.busan.com/view/busan/view.php?code=2026072010481200385,pos
2026-07-20 10:48,,포스코이앤씨,"롯데건설 '르엘', 하이엔드 아파트 관심도 1위...디에이치·호반써밋 뒤...","이어서 대우건설 푸르지오 써밋 2만3873건, SK에코플랜트 드파인 2만980건, 두산건설 위브더제니스 1만9744건, 포스코이앤씨 오티에르 1만5829건, 두산에너빌리티 트리마제 8561건, DK아시아 로열파크씨티 3971건 순이었다....",http://www.beyondpost.co.kr/view.php?ud=202607201040357940205868f676_30,pos
2026-07-20 10:44,,포스코,"포스코, 아르헨티나 Sal de Oro 2단계 플랜트 가동…리튬 생산체제 확장...",포스코가 아르헨티나 살라르 델 옴브레 무에르토 염호에서 진행 중인 살 데 오로 프로젝트의 2단계 공장 완공을 앞두고 리튬 공급망 확장에 속도를 내고 있다. 이번 2단계 설비 가동으로 포스코는 탄산리튬 생산능력을...,https://www.g-enews.com/view.php?ud=2026072010381819142bd56fbc3c_1,pos
2026-07-20 10:42,,대미 투자 특별법,"구윤철 ""대미 투자 프로젝트 상업적 합리성 검토 중""","그러면서 ""국익을 최우선으로 미측과 긴밀히 협의하여, 대미 통상관계를 안정적으로 관리해 나가겠다""고 강조했다. 정부는 지난 6월 한미전략투자 특별법 시행 이후 한미전략투자공사, 사업관리위원회, 운영위원회를...",http://www.wowtv.co.kr/NewsCenter/News/Read?articleId=A202607200081&t=NN,pos
2026-07-20 10:38,뉴스1,포스코홀딩스,"과기정통부, 유럽서 과학기술 인재 유치…국내 28개 기관 참여","KAIST와 광주과학기술원(GIST), 포항공대 등 대학 3곳과 한국과학기술연구원(KIST), 한국전자통신연구원(ETRI) 등 출연연 14곳, 삼성전자와 HD한국조선해양, 포스코홀딩스 등 기업 6곳이 상담 부스를 운영한다. 참가자들은...",https://www.news1.kr/it-science/general-science/6232575,pos
2026-07-20 10:36,,대미 투자 특별법,"구윤철 부총리 ""국익 최우선…대미 통상 안정적 관리""","지난해 한미 양국 간 통세 협상 결과로 도출된 총 3,500억 달러 규모의 대미 투자 약속 이행 상황에 대해서도... 앞서 정부는 지난 6월 한미전략투자 특별법이 본격 시행된 이후, 이를 뒷받침할 한미전략투자공사와...",https://www.fntoday.co.kr/news/articleView.html?idxno=388369,pos
2026-07-20 10:34,,대미 투자 특별법,"구윤철 ""국익 최우선으로 美와 긴밀히 협의... 통상관계 안정적 관리""",대미 투자 관련해서는 최근 시행된 한미전략투자 특별법과 한미전략투자공사 등 전략투자 추진체계를 바탕으로 프로젝트의 상업적 합리성 등을 면밀히 검토하며 후속 절차를 추진해 나가기로 했다. 이와 더불어 WTO...,http://www.efnews.co.kr/news/articleView.html?idxno=131050,pos
2026-07-20 10:30,,포스코이앤씨,"롯데건설 '르엘', 상반기 하이엔드 아파트 실수요자 관심도 1위…디에이...","조사 대상은 정보량 순으로 롯데건설 르엘, 현대건설 디에이치, 호반건설 호반써밋, 대우건설 푸르지오 써밋, SK에코플랜트 드파인, 두산건설 위브더제니스, 포스코이앤씨 오티에르, 두산에너빌리티 트리마제, DK아시아...",https://www.epnc.co.kr/news/articleView.html?idxno=404421,pos
2026-07-20 10:28,,대미 투자 특별법,"구윤철 ""대미 통상관계 안정적 관리...국익 최우선 협의""","지난해 한미 관세 협상 과정에서 약속한 총 3500억달러 규모의 대미 투자와 관련해서는 ""본격적인 이행을 위한... 정부는 지난 6월 한미전략투자 특별법 시행 이후 한미전략투자공사와 사업관리위원회, 운영위원회 등을...",https://www.joongangenews.com/news/articleView.html?idxno=533800,pos
2026-07-20 10:26,,포스코홀딩스,"정부, 유럽 한인 과학기술인 국내 유치 나서…프랑스서 채용 상담",KIST·ETRI·생명연 등 14개 정부출연연구기관과 삼성전자·HD한국조선해양·포스코홀딩스 등 6개 기업도 함께한다. 참가자들은 자신의 연구 분야와 경력 단계에 맞는 기관과의 매칭을 통해 담당자와 심층 상담을 진행한다....,https://www.newsis.com/view/NISX20260720_0003714844,pos
2026-07-20 10:12,,포스코,"부채관리의 진화…한국물 첫 삽 뜬 텐더오퍼, 포스코의 재무적 융통성","미국 달러[촬영 황광모] 포스코가 국내 기업 최초로 외화채를 공개매수(Debt Tender Offer) 방식으로 조기 상환했다. 채권 보유자 전원을 대상으로 과거 발행한 채권을 되사오는 형태로, 포스코는 이번 조치로 이자 비용...",https://news.einfomax.co.kr/news/articleView.html?idxno=4425764,pos
2026-07-20 10:09,세계일보,포스코,"포스코 광양제철소, 하역기 설비 ‘스마트 관리체계’ 구축… 조업 안정...","포스코 광양제철소 드론 전경사진. 광양제철소 제공 20일 광양제철소에 따르면 제철소내 EIC기술부, 제선부... 막는 포스코 고유의 첨단 진단 체계다. 광양제철소는 하역기의 핵심 점검 부위에 IoT 기반 무선 센서를...",https://www.segye.com/newsView/20260720507287?OutUrl=naver,pos
2026-07-20 10:08,,대미 투자 특별법,"구윤철 ""국익 최우선으로 미국과 긴밀 협력‥대미 투자 추진체계 구축""","지난해 관세 협상에 따른 3천500억 달러 규모 대미 투자 약속과 관련해선 ""추진 체계를 구축해 프로젝트의... 정부는 지난달 한미전략투자 특별법 시행 이후 한미전략투자공사, 사업관리위원회, 운영위원회를 잇달아...",https://imnews.imbc.com/news/2026/econo/article/6838569_36932.html,pos
2026-07-20 09:58,뉴스락,포스코이앤씨,"롯데건설 '르엘', 상반기 하이엔드 아파트 브랜드 관심도 1위","이번 조사는 롯데건설 '르엘', 현대건설 '디에이치', 호반건설 '호반써밋', 대우건설 '푸르지오 써밋', SK에코플랜트 '드파인', 두산건설 '위브더제니스', 포스코이앤씨 '오티에르', 두산에너빌리티 '트리마제', DK아시아...",http://www.newslock.co.kr/news/articleView.html?idxno=133122,pos
2026-07-20 09:57,동아일보,포스코인터내셔널,"삼성생명-포스코인터내셔널, 대통령기 男女 단체전 정상…개인전선 男...",삼성생명과 포스코인터내셔널이 제42회 대통령기 전국탁구대회서 각각 남자일반부와 여자일반부 단체전 정상에 올랐다. 삼성생명은 18일 경북 경주체육관서 열린 대회 마지막 날 한국거래소와 남자일반부...,https://sports.donga.com/sports/article/all/20260720/134326165/1,pos
2026-07-20 09:54,,대미 투자 특별법,"정부 ""대미 통상 안정 관리""···관세·중동 리스크 대응 총력","지난해 한미 관세 협상 과정에서 약속한 3500억달러 규모의 대미 투자 역시 추진 체계를 구축해 사업별... 이와 관련해 정부는 지난 6월 한미전략투자 특별법 시행 이후 한미전략투자공사와 사업관리위원회, 운영위원회...",https://www.smartbizn.com/news/articleView.html?idxno=148832,pos
2026-07-20 09:52,,대미 투자 특별법,"구윤철 ""대미 통상관계 안정적 관리…관세 조치 등 국익 최우선 대응""","지난해 관세 협상에 따른 3천500억 달러 규모의 대미 투자 약속과 관련해선 ""본격 이행을 위해 추진 체계를... 정부는 지난 6월 한미전략투자 특별법 시행 이후 한미전략투자공사, 사업관리위원회, 운영위원회를 잇따라...",https://news.sbs.co.kr/news/endPage.do?news_id=N1008664803&plink=ORI&cooper=NAVER,pos
2026-07-20 09:40,,포스코DX,"[52주] 신고가 4개, 신저가 136개.. 지수 하락","3% 25,950 ★★ 33 포스코DX 18,020 ▼3.3% 17,770 ★★★★★ 34 필에너지 10,340 ▼3.3% 10,210 ★★ 35 나노신소재 42,450 ▼3.2% 41,500 ★★★ 36 리가켐바이오 100,400 ▼3.2% 97,900 ★★★ 37...",https://www.itooza.com/common/iview.php?no=2026072009340103734,neg
2026-07-20 09:39,연합뉴스,대미 투자 특별법,"구윤철 ""국익 최우선으로 대미 통상관계 안정적 관리""","지난해 관세 협상에 따른 총 3천500억달러 규모의 대미 투자 약속과 관련해선 ""본격 이행을 위해 추진 체계를... 정부는 지난 6월 한미전략투자 특별법 시행 이후 한미전략투자공사, 사업관리위원회, 운영위원회를 잇따라...",https://www.yna.co.kr/view/AKR20260720041200002?input=1195m,pos
2026-07-20 09:34,,포스코이앤씨,"세종텔레콤, 폭염 대비 현장 안전·노무 특별점검","현재 세종텔레콤은 국가철도공단 장항선과 태백선 신호설비, SK하이닉스 이천 청주 캠퍼스, 포스코이앤씨 주택재개발정비사업, 현대엔지니어링 울산공장 전기차 신공장 등 다양한 산업 현장에서 전기·통신·소방 인프라...",https://zdnet.co.kr/view/?no=20260720093344,pos
2026-07-20 09:33,,대미 투자 특별법,구윤철 “美와 긴밀히 협의…대미 통상관계 안정적 관리”,대미 전략투자는 지난달 18일 시행된 한미전략투자 특별법과 같은 날 출범한 한미전략투자공사 등을 토대로 추진한다. 구 부총리는 “대미투자의 이행을 위한 추진체계를 구축해 프로젝트의 상업적 합리성 등을...,https://www.dailian.co.kr/news/view/1668561/?sc=Naver,pos
2026-07-20 09:30,,포스코인터내셔널,"[창간8주년 기획-AI 시대, 에너지가 경쟁력이다] ③재생에너지 변동성·...","포스코인터내셔널은 전남 신안 육상풍력과 해상풍력 사업, 울산 부유식 해상풍력 프로젝트 등을 추진하며 풍력 발전 포트폴리오를 확대하고 있다. 재생에너지 설비 규모도 현재보다 대폭 늘리는 작업을 진행 중이다....",https://www.smartbizn.com/news/articleView.html?idxno=148802,pos
2026-07-20 09:20,,포스코이앤씨,"롯데건설 '르엘', 상반기 하이엔드 아파트 관심도 '정상'...프리미엄 주...","포스코이앤씨 '오티에르'는 1만5829건, 두산에너빌리티 '트리마제'는 8561건, DK아시아 '로열파크씨티'는 3971건으로 조사됐다. 르엘은 공간 설계의 완성도와 차별화된 주거 품질을 앞세워 존재감을 키웠다. 온라인에서는...",https://www.seoultimes.news/news/article.html?no=2000097877,pos
2026-07-20 09:20,,포스코이앤씨,"롯데건설 '르엘', 상반기 하이엔드 아파트 관심도 1위…프리미엄 주거시...","포스코이앤씨 '오티에르'는 1만5829건, 두산에너빌리티 '트리마제'는 8561건, DK아시아 '로열파크씨티'는 3971건으로 조사됐다. 르엘은 공간 설계의 완성도와 차별화된 주거 품질을 앞세워 존재감을 키웠다. 온라인에서는...",https://www.seoultimes.news/news/article.html?no=2000097877,pos
2026-07-20 09:18,뉴스핌,대미 투자 특별법,"구윤철 ""정상외교 MOU 신속 이행…기업 수출·투자로 연결""",대미 투자와 관련해서는 최근 시행된 한미전략투자 특별법과 한미전략투자공사 등 전략투자 추진체계를 바탕으로 프로젝트의 상업적 합리성 등을 면밀히 검토하며 후속 절차를 추진하기로 했다. WTO 주요 통상...,https://www.newspim.com/news/view/20260720000145,pos
2026-07-20 09:08,,포스코이앤씨,상반기 하이엔드 아파트 관심도 1위는 '르엘' … 디에이치·호반써밋 뒤...,"조사 대상 브랜드는 롯데건설 르엘, 현대건설 디에이치, 호반건설 호반써밋, 대우건설 푸르지오 써밋, SK에코플랜트 드파인, 두산건설 위브더제니스, 포스코이앤씨 오티에르, 두산에너빌리티 트리마제, DK아시아...",http://www.worktoday.co.kr/news/articleView.html?idxno=86918,pos
2026-07-20 09:03,아시아경제,대미 투자 특별법,"중동 정세·美 통상 불안…구윤철 ""정상회담 MOU 신속 이행""",대미 투자 관련해서는 최근 시행된 한미전략투자 특별법과 한미전략투자공사 등 전략투자 추진체계를 바탕으로 프로젝트의 상업적 합리성 등을 면밀히 검토하며 후속 절차를 추진해 나가기로 했다. 이와 더불어...,https://view.asiae.co.kr/article/2026072009033843299,pos
