날짜,매체명,검색키워드,기사제목,주요기사 요약,URL
2025-12-15 14:23,아시아경제,포스코,노동부·경찰 '유해가스 사고' 포스코 본사 압수수색,노동 당국과 경찰이 지난달 경북 포항에 있는 포스코 사업장에서 청소 작업 중 발생한 유해 가스 중독 사고와 관련해 포스코 본사 등을 압수수색하고 있다. 대구지방고용노동청과 대구경찰청은 15일 근로감독관과 경찰 약...,https://view.asiae.co.kr/article/2025121514234540682
2025-12-15 14:10,,포스코,"포스코 포항제철소, 겨울 맞이 나눔 봉사로 지역에 온기 전해","연일 영하권 추위가 이어지는 가운데 포스코 포항제철소가 지역사회 곳곳에서 나눔 봉사활동을 이어가며 겨울을 녹이고 있다.포스코 포항제철소는 최근 클린오션 봉사단과 기술·재능 봉사단, 목공예 봉사단 등 다양한...",https://www.kbsm.net/news/view.php?idx=501219
2025-12-15 14:06,,포스코인터내셔널,"대양금속, 품질·생산 효율 동시에 잡은 스테인리스 노하우 공개",니켈 관련주 LX인터내셔널 포스코인터내셔널 현대비앤지스틸 포스코홀딩스 대양금속 다이나믹디자인 티플렉스 황금에스티 LG화학 제이스코홀딩스 LG에너지솔루션 STX LX인터내셔널 유에스티 이지트로닉스...,https://www.pinpointnews.co.kr/news/articleView.html?idxno=406471
2025-12-15 14:06,노컷뉴스,포스코,"노동부·경찰, '포스코 가스 중독 사고' 본사 압수수색",노동당국과 경찰은 15일 포스코 가스 중독 사고와 관련해 포스코 본사 등에 대한 압수수색에 나섰다. 노동부에 따르면 대구지방고용노동청과 대구경찰청은 이날 근로감독관과 경찰 약 40명이 투입해 압수수색을 진행...,https://www.nocutnews.co.kr/news/6443175?utm_source=naver&utm_medium=article&utm_campaign=20251215020541
2025-12-15 14:05,,포스코,"노동부·경찰, ‘가스 중독 사고’ 포스코 본사 등 압수수색",고용노동부·경찰이 근로자들이 가스에 중독된 사고와 관련해 경북 포항 포스코 본사 등을 15일 압수수색했다. 앞서 지난달 20일 포스코 사업장 내 집수정에서 슬러지 청소 작업 중이던 근로자 3명이 부생가스(전기로 가동...,https://biz.chosun.com/policy/policy_sub/2025/12/15/CCSE2LA7OFCZ7KQLCIHHSOGO3I/?utm_source=naver&utm_medium=original&utm_campaign=biz
2025-12-15 13:58,아주경제,포스코,"포항제철소 가스흡입 안전사고...노동부·경찰, 포스코 본사 압수수색",아주경제=최예지 기자 ruizhi@ajunews.com 포스코 포항제철소 스테인리스 4제강공장 [사진=포스코] 노동 당국이 지난달 포스코 포항제철소 STS 4 제강공장에서 발생한 근로자 가스 질식 사고와 관련해 강제 수사에 나섰다....,https://www.ajunews.com/view/20251215134316061
2025-12-15 13:56,,포스코,"포스코 포항제철소, 겨울 맞아 지역사회 온정 나눔 봉사활동 전개",포스코 포항제철소가 다가오는 겨울을 맞아 지역사회 이웃들을 위한 다양한 나눔... 지난 6일에는 포스코 클린오션 봉사단이 포항 북구 청하면 앞바다에서 약 6시간에...,http://www.breaknews.com/1169119
2025-12-15 13:54,,포스코,"노동부·경찰, '유해가스 3명 중상' 포스코 본사 압수수색","관련해 포스코 본사를 압수수색 중이다. 15일 노동부에 따르면, 대구지방고용노동청과 경상북도경찰청은 이날 근로감독관과 경찰 약 40명을 투입해 원청인 포스코 본사 등을 압수수색하고 있다. 앞서 지난달 20일...",https://www.newsis.com/view/NISX20251215_0003441272
2025-12-15 13:54,,포스코,"포스코 포항제철소, 겨울 맞이 나눔 활동 이어져",포스코 포항제철소가 다가오는 겨울을 맞아 지역 사회 이웃들을 위한 온정 나누기에 나서고 있다고 15일... 지난 6일에는 포스코 클린오션 봉사단이 포항 북구 청하면 앞바다에서 약 6시간에 걸쳐 환경정화 활동을...,http://www.shinailbo.co.kr/news/articleView.html?idxno=2162966
2025-12-15 13:52,,포스코,"[포스코그룹 인사 줌인] 이희근 포스코 사장, 제철소 안전 쇄신 '키맨'",이희근 포스코 사장이 임기를 이어가게 됐다. 장인화 포스코그룹 회장이 2026년 임원 인사에서 이 사장을 유임한데 따른 것이다. 제철소 안전 관련 문제가 여러 차례 지적되며 일부에서는 포스코 CEO 교체 가능성도...,https://www.bloter.net/news/articleView.html?idxno=649574
2025-12-15 13:40,,포스코,"[분석] ""그룹의 두뇌가 됐다""… 포스코DX, 2026 조직개편의 최대 수혜주...","포스코그룹의 2026년 정기 임원 인사에서 AI와 로봇 분야의 기술 리더십이 격상되며 그룹 DX(디지털 전환)의 핵심 축으로 부상하자, 포스코DX[022100] 주가가 장중 전일 대비 6% 가까이 급등하고 있다. 오늘 장 초반부터...",https://www.topstarnews.net/news/articleView.html?idxno=15906450
2025-12-15 13:36,,포스코,"포스코 포항제철소, 영하권 추위 속에서 겨울맞이 나눔 활동 이어져","포스코 포항제철소가 겨울을 맞아 지역 사회 이웃들을 위한 온정 나누기에 나서고 있다. 여러 봉사단이 참여한 가운데 환경정화, 물품 제작, 주거 환경 개선 등 다채로운 활동이 펼쳐지고 있다. ▲ 포스코 클린오션...",https://www.kpinews.kr/newsView/1065587646955524
2025-12-15 13:26,,포스코,"[분석] 영업익 전망치 159% 상회… 포스코퓨처엠, '깜짝 실적'에 쏠린 눈",역대급 어닝 서프라이즈와 재무구조 개선 효과가 맞물리며 포스코퓨처엠[003670] 주가가 장중 2% 넘게 강세를... ■ 주가: 22만 원 선 안착 시도하며 '우상향' 오늘 코스피 시장에서 포스코퓨처엠은 오후 1시 21분 현재 전일...,https://www.topstarnews.net/news/articleView.html?idxno=15906444
2025-12-15 13:18,,포스코,"포스코DX, 철강·배터리 산업 디지털 혁신 이끈다",포스코DX 주가가 강세를 보이고 있다. 15일 한국거래소에 따르면 이날 오후 1시13분 현재 6.14% 올라 2만 9400원에 거래되고 있다. 주가는 장기 박스권에서 벗어나 가속도를 내고 있다. 포스코DX가 산업 현장의 디지털...,https://www.pinpointnews.co.kr/news/articleView.html?idxno=406453
2025-12-15 13:06,뉴스워커,포스코,[진단_배터리업계 ③포스코퓨처엠] 전 밸류체인 전략의 그늘... 엄기천 ...,"포스코퓨처엠(대표이사 엄기천)은 포스코그룹의 이차전지 소재·산업기초소재를 담당하는 핵심 계열사로, 사업 구조는 이차전지용 양·음극재를 묶은 '에너지소재'와 내화물·라임·화성사업으로 구성된 '기초소재...",http://www.newsworker.co.kr/news/articleView.html?idxno=406893
2025-12-15 13:04,,포스코,"산업통상부·포스코그룹, 미활용 특허 293건 무상 개방","산업통상부와 포스코그룹이 대기업이 보유한 미활용 특허를 중소·중견기업에 무상 이전하는 기술나눔 사업을 본격 추진한다. 산업통상부는 12일 '2025년도 산업통상부-포스코 그룹 기술나눔' 사업을 공고하고, 총...",http://www.snmnews.com/news/articleView.html?idxno=562488
2025-12-15 12:48,,포스코,"포스코DX, 12월 15일 장중 30,300원 고가 형성하며 강세","15일 오후 12시 21분 기준, 네이버페이 증권에 따르면 포스코DX가 현재 29,550원에 거래되며 지난 종가... 포스코DX의 시가총액은 4조 4,774억 원으로 코스피 시장에서 110위를 차지하고 있다. 재무 지표를...",https://www.stardailynews.co.kr/news/articleView.html?idxno=514118
2025-12-15 12:29,,포스코,"포스코퓨처엠, 씨앤피신소재 착공 가시화…LFP 소재 기반 마련 [소부장...",포스코퓨처엠이 중국 CNGR과 합작한 배터리 소재 법인 '씨앤피신소재테크놀로지' 착공을 위한 절차를 밟는다. 올해 8월 맺은 협약(MOU)에 대한 마무리 작업에 돌입하면서다. 15일 업계에 따르면 포스코퓨처엠은 조만간...,https://www.ddaily.co.kr/page/view/2025121511011204224
2025-12-15 12:24,,포스코,"포스코 포항제철소, 겨울맞이 따뜻한 '나눔 봉사' 활발",포스코 클린오션 봉사단이 포항 청하면 바닷가에서 환경정화 활동을 하고 있다.ⓒ포항제철소 포스코 포항제철소가 겨울철을 맞아 지역사회를 위한 다양한 나눔 활동을 전개하고 있다. 영하권 추위에도 불구하고...,http://www.sisafocus.co.kr/news/articleView.html?idxno=351885
2025-12-15 11:56,,포스코,"포스코DX, 15일 장중 29,750원 7.40% 상승","| 이코노미사이언스 정상훈 기자 | 15일 오전 11시 30분 기준, 네이버페이 증권에 따르면 포스코DX는... 포스코DX의 거래량은 2,685,691주를 기록하며, 지난 거래일 750,171주 대비 큰 폭으로 증가했다....",https://www.e-science.co.kr/news/articleView.html?idxno=118705
2025-12-15 11:56,,포스코,"포스코퓨처엠, 15일 장중 229,000원 3.38% 상승","| 이코노미사이언스 정상훈 기자 | 15일 오전 11시 41분 기준, 네이버페이 증권에 따르면 포스코퓨처엠은 지난 종가 대비 3.38% 상승한 229,000원에 거래되고 있다. 지난 종가는 221,500원이었으며, 현재 포스코퓨...",https://www.e-science.co.kr/news/articleView.html?idxno=118712
2025-12-15 11:16,대경일보,포스코,"포스코 포항제철소, 겨울맞이 지역사회 온정 나눔 이어가",▲ 포스코 포항제철소 재능봉사단이 지난 12일 청림동을 찾아 나눔 활동을 진행했다. 포스코 제공 포스코 포항제철소가 다가오는 겨울을 맞아 지역사회 이웃들을 위한 온정 나눔 활동을 이어가고 있다. 다양한 봉사단이...,https://www.dkilbo.com/news/articleView.html?idxno=526457
2025-12-15 11:12,,포스코,"포스코DX, 전날 상승 이어 7% 급등…2만9000원선 재돌파",포스코DX가 급등 중이다. 포스코DX는 15일 코스닥 시장에서 오전 11시10분 현재 전 거래일보다 6.86%(1900원) 상승한 2만9600원에 거래되고 있다. 이 회사는 9일부터 11일까지 3거래일 연속 하락세를 보이다 12일...,http://www.econonews.co.kr/news/articleView.html?idxno=418596
2025-12-15 11:02,,포스코,"포스코 포항제철소, 겨울맞이 나눔 활동 이어져",[포항=위키트리]이창형 기자=포스코 포항제철소가 다가오는 겨울을 맞아 지역 사회 이웃들을 위한 온정... 지난 6일에는 포스코 클린오션 봉사단이 포항 북구 청하면 앞바다에서 약 6시간에 걸쳐 환경정화 활동을 실시했다....,https://www.wikitree.co.kr/articles/1102221
2025-12-15 10:52,,포스코,"포스코DX, 12월 15일 장중 29,200원 +5.41%","따르면 포스코DX는 12월 15일 장중 지난 종가 대비 상승세를 보이며 거래되고 있다. 현재 주가는 29,200원으로, 지난 종가 27,700원보다 1,500원, 약 5.41% 상승한 수치이다. 포스코DX는 27,350원에서 거래를...",https://www.joongangenews.com/news/articleView.html?idxno=475577
2025-12-15 10:51,,POSCO INTERNATIONAL,"슈퍼브에이아이, 140억 원 투자 유치 완료","This round was participated by Hanwha Asset Management Venture Fund and POSCO Technology Investment, bringing... and international industries. The company plans to build a foundation for long-term growth through joint...",https://www.venturesquare.net/1019683
2025-12-15 10:48,,포스코,"[더벨][AI 시대 제조업의 변신]포스코퓨처엠, AI·신공정 결합한 양극재...","포스코퓨처엠이 광양·포항 주요 양극재 생산거점에 AI 기반 품질·공정 자동화와 신공정 기술을 결합한... ◇생산성·품질 개선, AI–신공정 효과 가속 포스코퓨처엠은 광양·포항 공장을 중심으로 소성–분쇄–수세...",https://www.thebell.co.kr/free/content/ArticleView.asp?key=202512100926256360105791
2025-12-15 10:46,,포스코,"포스코퓨처엠, 12월 15일 장중 229,000원 3.39% 상승","따르면 포스코퓨처엠은 지난 종가 221,500원 대비 7,500원(3.39%) 상승한 229,000원에 거래되고 있다. 포스코퓨처엠은 시가 218,500원, 고가 235,000원, 저가 216,500원을 기록했다. 현재까지의 거래량은 265...",https://www.joongangenews.com/news/articleView.html?idxno=475569
2025-12-15 10:46,,포스코,"영하권 추위 속에도 마음의 온도는 따뜻하게···포스코 포항제철소, 겨...",포스코 포항제철소가 겨울철을 맞아 지역사회 이웃을 위한 다양한 나눔 활동을 이어가고 있다. 환경... 15일 포항제철소에 따르면 지난 6일 포스코 클린오션 봉사단은 포항 북구 청하면 앞바다에서 약 6시간 동안 해양 환경...,https://www.kbmaeil.com/article/20251215500121
2025-12-15 10:44,,포스코,"'추위 속에도 마음의 온도는 따뜻'…포스코 포항제철소, 나눔 활동 펼쳐...","포스코 포항제철소 클린오션·목공예 봉사단 등 참여 해양 정화, 주거 개선 등 으로 지역 곳곳 온기 더해 12일청림동 찾아 붕어 빵 나눔, 자전거 수리 등 다양한 분야의 재능봉사 진행 포스코 포항제철소가 다가오는 겨울을...",https://www.asiatoday.co.kr/view.php?key=20251215010007718
2025-12-15 10:31,,포스코,포스코 ‘수소환원제철’ 용지 조성 시급…K-철강 생존의 열쇠,포스코의 미래 경쟁력을 좌우할 ‘수소환원제철(HyREX)’ 사업이 용지 확보 단계에서 정체되고 있다. 기술... 포스코에 따르면 수소환원제철은 기존 고로(용광로) 방식과 달리 석탄 대신 수소를 환원제로 사용해 철을 생산해...,https://www.kmib.co.kr/article/view.asp?arcid=0029115065&code=61122022&cp=nv
