날짜,매체명,검색키워드,기사제목,주요기사 요약,URL
2025-11-23 20:39,,포스코플로우,"포항시, 북극항로 시대 영일만항 특화전략 제시",이에 따라 포항시는 ▲포항테크노파크 ▲한국로봇융합연구원(KIRO) ▲포스텍(POSTECH) 외에도 해양 R&D 센터 입주기업인 ▲동성조선 ▲포스코플로우 등 지역의 첨단 해양 과학의 미래를 열어나갈 핵심 연구기관 및 대학...,https://www.ksmnews.co.kr/news/view.php?idx=576416
2025-11-23 19:56,,포스코플로우,"포항시, '해양 모빌리티 안전 엑스포'서 북극항로 비전 제시",이에 따라 포항시는 △포항테크노파크 △한국로봇융합연구원(KIRO) △포스텍(POSTECH) 외에도 해양 R&D 센터 입주기업인 △동성조선 △포스코플로우 등 지역의 첨단 해양 과학의 미래를 열어나갈 핵심 연구기관 및 대학...,http://www.hidomin.com/news/articleView.html?idxno=599489
2025-11-23 19:00,,포스코플로우,"포항시, ‘2025 해양 모빌리티 안전 엑스포’서 북극항로 특화 전략 선보...",이번 행사에서 포항시와 함께 포항테크노파크·한국로봇융합연구원(KIRO)·포스텍(POSTECH)·동성조선·포스코플로우 등 지역 핵심 연구기관·대학·기업이 공동부스를 마련한다. 부스에서는 AI·위성·로봇 등 포항이...,https://www.yeongnam.com/web/view.php?key=20251123020489949
2025-11-23 18:00,,포스코플로우,"AI·위성·로봇 집결…포항 영일만항, 북극항로 특화항만 비전 선포","이를 위해 포항테크노파크와 한국로봇융합연구원(KIRO), 포스텍(POSTECH), 동성조선, 포스코플로우 등 지역 연구기관과 기업이 공동부스를 운영하며 첨단 해양 과학 역량을 선보인다. 엑스포 기간 중 포항시 북극 홍보관은...",https://www.eroun.net/news/articleView.html?idxno=67584
2025-11-23 17:46,,포스코플로우,"포항, 북극항로 특화항만 전략 첫 공식 발표","특히 △포항테크노파크 △한국로봇융합연구원(KIRO) △포스텍(POSTECH)△동성조선△포스코플로우 등 지역 연구기관·대학·기업과 공동 부스를 구성해, 북극항로 운항지원 기술과 해양 R&D 성과를 함께 선보인다. 시는...",https://www.kyongbuk.co.kr/news/articleView.html?idxno=4057506
2025-11-23 17:46,,포스코,"포스코, 잇단 인명사고에 포항제철소장 전격 해임",포스코가 11월 들어 잇따른 인명사고가 발생한 포항제철소장을 보직해임하는 한편 이희근 사장이 직접 사과문을 발표하는 극단적 조치를 취했다. 포스코는 지난 5일에 이어 20일 잇따라 유해가스 흡입사고가 발생하자 21일...,https://www.kyongbuk.co.kr/news/articleView.html?idxno=4057502
2025-11-23 17:04,,포스코,대통령 질타에도 말로만 안전… 포스코 장인화 책임론 부상,스카이데일리 김진강기자 = 장인화 회장 책임져야 한다는 비판여론 고조 ▲ 장인화 포스코그룹 회장. 연합뉴스 포항제철소에서 발생한 사망사고 여파가 장인화 포스코그룹 회장(사진)과 이희근 사장 책임론으로 확산되고...,https://m.skyedaily.com/news_view.html?ID=291304
2025-11-23 17:00,에너지경제,포스코,산재와 재발방지의 악순환…포스코 안전경영 ‘상하 불통’?,포스코가 그룹 차원의 산업안전 경영을 최우선으로 표방했음에도 최근 경북 포항제철소에서 안전사고가 잇따라 발생하면서 제철소장 경질이라는 초강수를 뒀다. 장인화 포스코그룹 회장의 거듭된 안전경영 강조에도...,https://www.ekn.kr/web/view.php?key=20251123026250317
2025-11-23 16:22,,포스코인터내셔널,"포스코, 석탄 대신 수소 활용 CO2 배출 축소",공급받아 2024년부터 한국에서 수산화리튬을 생산하고 있다. 셋째는 청정 에너지 생태계 조성이다. 포스코인터내셔널이 2022년 호주 행콕에너지와 함께 천연가스 개발·생산 회사인 세넥스에너지를 공동인수했다.,https://www.mk.co.kr/article/11474872
2025-11-23 16:14,,포스코,"[사설] 포스코 잇단 중대 사고, 안전 혁신대책 세워라",포스코 포항제철소에서 또다시 중대 산업재해가 발생했다. 몇 달 사이 세 건의 중대 사고가 이어졌다. 결국 포스코는 포항제철소장을 전격 보직 해임하고 회장 직속 '그룹안전특별진단TF'를 가동하는 등 초강수 인사 조치에...,https://www.kyongbuk.co.kr/news/articleView.html?idxno=4057447
2025-11-23 16:14,,포스코,"[사설] 포스코 잇단 인명 사고, 안전 혁신대책 세워라",포스코 포항제철소에서 또다시 중대 산업재해가 발생했다. 불과 몇 달 사이 세 건의 사망·중상 사고가 이어졌다. 결국 포스코는 포항제철소장을 전격 보직 해임하고 회장 직속 '그룹안전특별진단TF'를 가동하는 등 초강수...,https://www.kyongbuk.co.kr/news/articleView.html?idxno=4057447
2025-11-23 16:00,경인방송,포스코인터내셔널,[인천 시장·군수·구청장 일정 / 11월 24일(월)],"성금 전달식 (14:30 구청장실) (주)포스코인터내셔널, 서동이장학회 기부금 기탁식 (15:30 구청장실) 인천유소년서구축구단, 이웃돕기 성금 전달 (16:00 구청장실) (주)토성개발, 이웃돕기 물품 전달 (17:00 구청장실)",https://news.ifm.kr/news/articleView.html?idxno=458070
2025-11-23 15:58,스트레이트뉴스,포스코플로우,"이강덕 시장 ""북극항로 특화항만·북극 해운정보센터 유치 근거 제시할...","포항시는 포항테크노파크, 한국로봇융합연구원, 포스텍 외에도 해양 R&D 센터 입주기업인, 동성조선, 포스코플로우 등 지역의 첨단 해양 과학의 미래를 열어나갈 핵심 연구기관 및 대학, 기업이 함께 공동부스를...",https://www.straightnews.co.kr/news/articleView.html?idxno=287309
2025-11-23 15:56,,포스코플로우,'2025 해양 모빌리티 안전 엑스포'서 북극항로 특화 전략 선보인다,이에 따라 포항시는 △포항테크노파크 △한국로봇융합연구원(KIRO) △포스텍(POSTECH) 외에도 해양 R&D 센터 입주기업인 △동성조선 △포스코플로우 등 지역의 첨단 해양 과학의 미래를 열어나갈 핵심 연구기관 및 대학...,https://www.dkilbo.com/news/articleView.html?idxno=523327
2025-11-23 15:44,,포스코인터내셔널,"석화업계, 원료 다변화로 조달 리스크 분산…해외 생산기반 확대도 속도",GS칼텍스는 포스코인터내셔널과 함께 인도네시아 발릭파판에 약 2600억원을 투자한 팜유 정제시설을 완공해 가동 단계에 진입했다. 이 시설은 팜 원유(CPO)를 정제해 바이오디젤 원료와 식용유지 등을 생산할 예정으로...,http://www.metroseoul.co.kr/article/20251123500173
2025-11-23 15:22,,포스코,‘구조적 살인’ 규탄…포스코 ‘위험의 외주화’ 전면 개혁 촉구,스카이데일리 주경준기자 = ▲ 진보당과 건생지사가 포스코 하청노동자 사망사고와 관련 근본적인 지발방지 대책을 촉구했다. 사진=연합뉴스 포스코 포항제철소에서 또다시 하청 노동자들이 질식사고로 쓰러진 가운데...,https://m.skyedaily.com/news_view.html?ID=291303
2025-11-23 15:16,,포스코플로우,"포항시, 해양 모빌리티 안전 엑스포 참가…'북구항로 특화 전략 홍보'","시는 포항테크노파크, 한국로봇융합연구원(KIRO), 포스텍과 해양 연구 개발 센터 입주 기업인 동성조선·포스코플로우 등과 공동 부스를 운영한다. 이강덕 시장은 “이번 엑스포를 계기로 포항이 보유한 첨단 과학...",https://www.newsis.com/view/NISX20251123_0003413381
2025-11-23 15:02,,포스코플로우,"포항시, ‘2025 해양 모빌리티 안전 엑스포’서 북극항로 특화 전략 선보...",이에 따라 포항시는 ▲포항테크노파크 ▲한국로봇융합연구원(KIRO) ▲포스텍(POSTECH) 외에도 해양 R&D 센터 입주기업인 ▲동성조선 ▲포스코플로우 등 지역의 첨단 해양 과학의 미래를 열어나갈 핵심 연구기관 및 대학...,https://www.sentv.co.kr/article/view/sentv202511230026
2025-11-23 14:46,,포스코,"포스코, 포항제철소장 전격 해임…이희근 사장 직접 수습 지휘",포스코가 최근 포항제철소에서 잇따라 발생한 중대 안전사고에 대한 책임을 묻는 차원에서 이동렬... 철강업계에 따르면 포스코는 11월 21일부로 이동렬 포항제철소장을 보직 해임했다. 이번 인사는 포항제철소에서 올해...,http://www.snmnews.com/news/articleView.html?idxno=561354
2025-11-23 13:56,,포스코인터내셔널,"메리츠금융지주, 주가 상승 압력 제한적…대신증권 ""중립 의견 제시""",LG생활건강 포스코인터내셔널 ISC HD현대미포 HD한국조선해양 태광 HD현대일렉트릭 HD현대건설기계 HD현대중공업도 주목을 받고 있다. 외부 환경과 비유기적 성장 요인이 향후 주가 향방을 좌우할 핵심 변수로 떠오르는...,https://www.pinpointnews.co.kr/news/articleView.html?idxno=398472
2025-11-23 13:26,,포스코인터내셔널,"주천희, WTT 스타컨텐더 무스카트 여자 단식 결승서 일본 선수에 패해 준...","이번 대회 8강에서 이은혜(대한항공)를 3-0, 준결승에서 김나영(포스코인터내셔널)을 3-1로 각각 제압하고 결승에 오른 주천희는 21세의 신예 기하라를 어렵게 경기를 풀어갔다. 첫 게임을 내준 주천희는 2게임에서...",https://www.seoul.co.kr/news/sport/table-tennis/2025/11/23/20251123500031?wlog_tag3=naver
2025-11-23 13:24,에너지경제,포스코플로우,"[E-로컬뉴스] 경주시, 포항시,수성구 소식",이를 위해 포항시는 △포항테크노파크 △한국로봇융합연구원(KIRO) △포스텍(POSTECH) △동성조선 △포스코플로우 등 지역 첨단 해양·과학 연구기관 및 기업과 함께 공동 홍보부스를 구성해 협력 시너지를 극대화한다....,https://www.ekn.kr/web/view.php?key=20251123022430371
2025-11-23 12:03,아시아경제,포스코플로우,"""우리가 新 북극항로 허브""… 포항시, 러시아·북유럽 긴장시키는 '2025 ...",이에 따라 포항시는 ▲포항테크노파크 ▲한국로봇융합연구원(KIRO) ▲포스텍(POSTECH) 외에도 해양 R＆D 센터 입주기업인 ▲동성조선 ▲포스코플로우 등 지역의 첨단 해양 과학의 미래를 열어나갈 핵심 연구기관·대학...,https://view.asiae.co.kr/article/2025112312032701015
2025-11-23 11:44,,포스코플로우,"포항시, '2025 해양 모빌리티 안전 엑스포'서 영일만항 북극항로 가능성...","한국로봇융합연구원(KIRO), 포스텍(POSTECH) 외에도 해양 R&D 센터 입주기업인, 동성조선, 포스코플로우 등 지역의 첨단 해양 과학의 미래를 열어나갈 핵심 연구기관과 대학, 기업이 함께 공동부스를 운영한다. 이강덕...",https://www.asiatoday.co.kr/view.php?key=20251123010011765
2025-11-23 11:28,,포스코인터내셔널,"[탁구] 주천희, WTT 무스카트서 한일전 패배… 아쉬운 준우승","이번 대회 8강에서 이은혜(대한항공)를 3-0, 준결승에서 김나영(포스코인터내셔널)을 3-1로 각각 꺾고 결승에 오른 세계랭킹 21위 주천희는 21세의 신예 기하라(세계 23위)를 맞아 첫 게임을 내주며 불안하게...",https://www.newscj.com/news/articleView.html?idxno=3343258
2025-11-23 11:09,뉴스핌,포스코인터내셔널,"주천희, WTT 무스카트 한일전 패배로 준우승…오준성도 8강서 탈락","세계랭킹 21위인 주천희는 이번 대회 8강에서 이은혜(대한항공)를 3-0으로 제압하고, 준결승에서는 김나영(포스코인터내셔널)을 3-1로 꺾으며 결승에 올랐다. 주천희. [사진=WTT] 결승에선 21세 신예 기하라(23위)에게...",https://www.newspim.com/news/view/20251123000045
2025-11-23 10:42,,포스코인터내셔널,"탁구 임종훈-오준성, WTT 남자복식 우승",듀스 접전 끝에 이긴 뒤 2~3게임도 내리 잡아내며 마침표를 찍었다. 여자복식 결승에서는 주천희(삼성생명)-김나영(포스코인터내셔널) 짝이 일본의 오도 사쓰기-요코이 사쿠라 짝에 2-3(11-9 5-11 11-5 4-11 6-11)으로 졌다.,https://www.hani.co.kr/arti/sports/sports_general/1230688.html
2025-11-23 10:33,,포스코인터내셔널,"탁구 주천희, WTT 무스카트 여자단식서 아쉬운 준우승","이번 대회 8강에서 이은혜(대한항공)를 3-0, 준결승에서 김나영(포스코인터내셔널)을 3-1로 각각 꺾고 결승에 오른 세계랭킹 21위 주천희는 21세의 신예 기하라(세계 23위)를 맞아 첫 게임을 내주며 불안하게...",https://news.sbs.co.kr/news/endPage.do?news_id=N1008341535&plink=ORI&cooper=NAVER
2025-11-23 10:26,,포스코인터내셔널,"㈜포스코인터내셔널, 인천 중구 월디장학회에 장학금 기탁","인천 중구 월디장학회는 최근 ㈜포스코인터내셔널(누적 기탁금: 1억3,000만 원)로부터 1,000만 원의 장학금을 기탁받았다고 22일 밝혔다. ㈜포스코인터내셔널 이계인 대표는 ""중구의 미래를 이끌 인재들이 더 나은 환경에서...",https://www.jeonmae.co.kr/news/articleView.html?idxno=1204914
2025-11-23 09:00,,구동모터코어,"""PC의 심장, 공장으로 이식"" 'IQ-X'로 산업 자동화 '올인원' [스냅드래곤...","그러나 이번 시연은 두 개의 모터를 동시에 구동하는 실시간 공정 자동화와, YOLO v11 모델 기반의 AI 시각... IQ-X는 4나노 공정 기술 기반의 맞춤형 오라이온 CPU(8~12코어)를 탑재했으며, 특히 영하 40도에서 영상...",https://www.econovill.com/news/articleView.html?idxno=718882
2025-11-23 07:15,,포스코,"포스코, 잇단 산재사망 사고 …포항제철소장 경질",포스코는 잇따른 산업재해로 사망 사고가 잇따르자 포항제철소장을 해임했다. 23일 업계에 따르면 포스코는 지난 20일 포항제철소에서 발생한 안전사고와 관련해 이동렬 포항제철소장을 보직 해임했다. 포스코는 이희근...,http://www.kookje.co.kr/news2011/asp/newsbody.asp?code=0200&key=20251123.99099007289
2025-11-23 07:10,,포스코인터내셔널,"주천희, WTT 무스카트 결승서 일본 기하라에 1-4 석패…아쉬운 준우승","8강에서 이은혜(대한항공)를 3-0으로 완파했고, 준결승에서는 김나영(포스코인터내셔널)을 3-1로 꺾으며 정상 도전에 나섰다. 특히 준결승까지 한국 선수들과의 대결에서 흔들림 없는 경기력을 과시해 우승 기대감을...",https://www.dailysportshankook.co.kr/news/articleView.html?idxno=418874
2025-11-23 06:46,연합뉴스,포스코인터내셔널,"탁구 주천희, WTT 무스카트서 한일전 패배로 아쉬운 준우승","이번 대회 8강에서 이은혜(대한항공)를 3-0, 준결승에서 김나영(포스코인터내셔널)을 3-1로 각각 꺾고 결승에 오른 세계랭킹 21위 주천희는 21세의 신예 기하라(세계 23위)를 맞아 첫 게임을 내주며 불안하게...",https://www.yna.co.kr/view/AKR20251123006700007?input=1195m
2025-11-23 06:10,미디어펜,포스코인터내셔널,"주천희 WTT 스타 컨텐더 무스카트 여자단식도 준우승, 日 키아라에 패배","김나영(포스코인터내셔널)과 짝을 이뤄 나선 여자 복식도 결승전에서 일본의 사츠키 오도-사쿠라 요코이 조에 2-3(11-9, 5-11, 11-5, 4-11, 6-11)으로 역전패해 아쉽게 우승을 놓친 바 있다. 단식과 복식 모두 일본 선수에게...",https://www.mediapen.com/news/view/1060509
2025-11-23 05:46,,포스코인터내셔널,"캐나다 60조 잠수함 전쟁, 기술은 한화·정치는 독일… 승패 가를 '50%의...","한국 포스코인터내셔널의 미국 내 희토류 파트너십 경험을 바탕으로, 캐나다 기업과의 협력 가능성을 탐색할 수 있다. 수주 경쟁 당사자인 한화는 밥콕 캐나다와의 파트너십을 핵심 차별화 요소로 강화해야 한다....",https://www.g-enews.com/view.php?ud=202511221710223550fbbec65dfb_1
2025-11-22 23:26,,포스코인터내셔널,"임종훈-오준성 우승, 주천희 준우승 한국 탁구 간판들 무스카트에서 선...","주천희는 4강전에서 김나영(포스코인터내셔널)을 3대 1(11-7, 11-2, 5-11, 11-7), 4강전에서 이은혜(대한항공)를 3대 0(11-8, 11-8, 12-10)으로 꺾는 등 한국팀 동료들을 많이 만났다. 최근 두나무 프로탁구리그를 우승한...",http://www.thepingpong.co.kr/news/articleView.html?idxno=12297
2025-11-22 23:06,,포스코인터내셔널,"김정관 산업통상부 장관, UAE 첨단산업기술부 장관과 원전·스타게이트...","간담회에는 포스코인터내셔널, LIG넥스원, 한화시스템, 현대건설, 두산에너빌리티, 한국석유공사, 한국전력, 서부발전 및 코트라(KOTRA) 중동지역본부, 무역협회 지부 총 8개 지상사·현지법인 및 2개 유관기관 관계자들이...",http://www.econonews.co.kr/news/articleView.html?idxno=415007
2025-11-22 22:50,,포스코인터내셔널,주천희 아깝다! 생애 첫 WTT 우승 불발…한일전 1-4 석패→복식 이어 단...,주천희는 전날 김나영(포스코인터내셔널·세계 34위)과 합을 맞춰 이 대회 여자 복식 준우승을 거뒀다. 결승에서 일본의 오도 사쓰기-요코이 사쿠라 조에 풀게임 접전 끝에 2-3(11-9 5-11 11-5 4-11 6-11)으로 역전패해...,https://www.spotvnews.co.kr/news/articleView.html?idxno=783673
2025-11-22 22:46,,포스코인터내셔널,"GS·포스코, 인도네시아 바이오원료 공장 준공...""글로벌 바이오 시장 입...","GS칼텍스와 포스코인터내셔널이 합작 투자한 ARC 법인은 지난 19일 인도네시아 발릭파판에서 팜유 정제시설 준공식을 열었다고 22일 밝혔다. 두 회사는 2023년 인도네시아에 ARC를 설립하고, 2600억원을 투자해 30만...",http://www.econonews.co.kr/news/articleView.html?idxno=415011
2025-11-22 19:10,,포스코인터내셔널,"탁구 주천희, 파트너 김나영 꺾고 WTT 무스카트 여자단식 결승행",중국에서 귀화한 주천희(삼성생명)가 여자복식 파트너 김나영(포스코인터내셔널)을 꺾고 월드테이블테니스(WTT) 스타 컨텐더 무스카트 2025 결승에 올랐다. 주천희는 22일(한국 시간) 오만 무스카트에서 열린 대회...,https://www.newsis.com/view/NISX20251122_0003413027
2025-11-22 16:51,,포스코인터내셔널,"'삐약이 라이벌' 주천희, WTT 무스카트 우승 보인다!…20살 신예 김나영...",여자 단식 세계랭킹 21위인 주천희는 22일(한국시간) 오만 무스카트에서 열린 대회 여자 단식 준결승에서 한국의 김나영(포스코인터내셔널·34위)을 3-1(11-7 11-2 5-11 11-7)로 일축하고 결승행 티켓을 거머쥐었다. 전날...,https://www.spotvnews.co.kr/news/articleView.html?idxno=783646
2025-11-22 15:28,,포스코,"포스코, 잇단 사고에 이동렬 포항제철소장 해임...유인종 안전TF 팀장 임...",포스코가 잇단 안전사고로 근로자 인명 피해가 연이어 발생한 포항제철소 소장을 전격 경질했다. 아울러 포스코홀딩스의 안전 전문 자회사 대표를 회장 직속 그룹안전특별진단TF 팀장에 임명하고 현장 안전 관리 강화에...,https://www.asiatime.co.kr/article/20251122500014
2025-11-22 13:34,,포스코인터내셔널,"[탁구] 임종훈-오준성, WTT 대회 우승… 임종훈은 최고 '결혼 선물'","하지만 여자복식 결승에 올랐던 주천희(삼성생명)-김나영(포스코인터내셔널) 조는 일본의 오도 사쓰기-요코이 사쿠라 조에 2-3(11-9 5-11 11-5 4-11 6-11)으로 역전패, 아쉬운 준우승에 그쳤다. 주천희-김나영 조는 첫...",https://www.newscj.com/news/articleView.html?idxno=3343111
2025-11-22 12:00,,포스코인터내셔널,"임종훈·오준성, WTT 스타 컨텐더 무스카트 2025 남자복식 정상 탈환",한편 여자복식에서는 주천희(삼성생명)-김나영(포스코인터내셔널) 조가 결승에 올랐으나 일본의 오도 사쓰기·요코이 사쿠라 조에 2-3(11-9 5-11 11-5 4-11 6-11)로 역전패해 준우승에 머물렀다.,https://www.gukjenews.com/news/articleView.html?idxno=3435355
2025-11-22 11:21,이데일리,포스코인터내셔널,"탁구 임종훈·오준성, WTT 무스카트 우승",여자복식 결승에 올랐던 주천희(삼성생명)-김나영(포스코인터내셔널) 조는 일본의 오도 사쓰기-요코이 사쿠라 조에 2-3(11-9 5-11 11-5 4-11 6-11)으로 역전패해 준우승에 만족해야 했다. 여자 단식 8강에 나선 주천희는...,http://www.edaily.co.kr/news/newspath.asp?newsid=01856486642368344
2025-11-22 11:12,,포스코,"포스코 포항제철소 유해가스 사고…작업자 3명 중태, 이동렬 소장 보직...","포스코 포항제철소에서 유해가스 누출 사고가 발생해 작업자 3명이 중태에 빠진 가운데, 이동렬... 불구하고 포스코그룹의 '안전 경영' 약속이 제대로 이행되고 있는지에 대한 의문이 커지고 있다. 사고는 지난 20일 오후...",https://www.ppss.kr/news/articleView.html?idxno=275751
2025-11-22 11:08,,포스코,"포스코, 가스흡입 사고 공식 사과···""재발 방지 대책 마련할 것""","투데이코리아=김지훈 기자 | 포스코가 포항제철소에서 발생한 가스흡입 사고와 관련해 공식 사과하고 재발 방지 대책을 마련하겠다는 입장을 밝혔다. 이희근 포스코 사장은 지난 21일 입장문을 통해 ""임직원을 대표해...",http://www.todaykorea.co.kr/news/articleView.html?idxno=336917
2025-11-22 10:58,미디어펜,포스코인터내셔널,"임종훈-오준성, WTT 스타 컨텐더 무스카트 남자복식 우승…주천희-김나...",한편 여자복식 결승까지 올랐던 주천희(삼성생명)-김나영(포스코인터내셔널) 조는 일본의 오도 사쓰기-요코이 사쿠라 조와 접전 끝에 2-3(11-9 5-11 11-5 4-11 6-11)으로 역전패하며 아쉬운 준우승에 그쳤다.,https://www.mediapen.com/news/view/1060420
2025-11-22 10:51,,포스코인터내셔널,"탁구 임종훈-오준성, WTT 무스카트 남자복식 정상…결혼 앞둔 임종훈에...",여자복식 결승에 오른 주천희(삼성생명)-김나영(포스코인터내셔널) 조는 아쉽게 준우승에 머물렀다. 일본의 오도 사쓰키-요코이 사쿠라 조에 2-3(11-9 5-11 11-5 4-11 6-11)으로 역전패했다. 첫 게임을 따내며 좋은 출발을...,https://sports.khan.co.kr/article/202511221050003?pt=nv
2025-11-22 10:01,,포스코인터내셔널,"탁구 임종훈-오준성, WTT 대회 우승 합작","한편, 여자복식 결승에 올랐던 주천희(삼성생명)-김나영(포스코인터내셔널) 조는 일본의 오도 사쓰기-요코이 사쿠라 조에 게임스코어 2-3(11-9 5-11 11-5 4-11 6-11)으로 역전패하며 준우승에 머물렀다. 남자 단식에 나선...",https://www.dailian.co.kr/news/view/1576834/?sc=Naver
2025-11-22 09:56,,포스코인터내셔널,"임종훈-오준성 콤비, WTT 무스카트 남자복식 '정상 등극'","한편, 여자복식에서는 주천희(삼성생명)-김나영(포스코인터내셔널) 조가 아쉽게 준우승에 머물렀다. 주-김 조는 결승에서 일본의 오도 사쓰기-요코이 사쿠라 조를 상대로 분전했으나 2-3(11-9 5-11 11-5 4-11 6-11)으로...",https://www.dailysportshankook.co.kr/news/articleView.html?idxno=418841
2025-11-22 09:50,,포스코인터내셔널,"'WTT 무스카트 우승' 임종훈-오준성, 싱가포르 3-0 제압... 주천희-김나...",같은 날 열린 여자복식 결승에서는 주천희(삼성생명)-김나영(포스코인터내셔널) 조가 일본의 오도 사쓰기-요코이 사쿠라 조에 2-3(11-9 5-11 11-5 4-11 6-11)으로 역전패해 아쉬운 준우승에 머물렀다. 주천희-김나영...,https://www.starnewskorea.com/sports/2025/11/22/2025112209350853259
2025-11-22 09:48,,포스코인터내셔널,"임종훈-오준성, WTT 스타 컨텐더 무스카트 남자복식 우승",여자 복식 결승에 나섰선 주천희(삼성생명)-김나영(포스코인터내셔널) 조는 오도 사쓰기-요코이 사쿠라 조(일본)에 아쉽게 2-3(11-9 5-11 11-5 4-11 6-11)으로 패해 준우승을 차지했다.,https://www.moneys.co.kr/article/2025112209424181637
2025-11-22 09:36,,포스코인터내셔널,"""이 형이랑 하면 우승한다!"" '복식장인'임종훈,'막내온탑'오준성과 또 우...","한편 임-오조와 나란히 여자복식 결승에 올랐던 주천희(삼성생명)-김나영(포스코인터내셔널) 조는 일본의 오도 사쓰기-요코이 사쿠라 조에 2대3(11-9, 5-11, 11-5, 4-11, 6-11)으로 석패하며 준우승했다.",https://www.sportschosun.com/sports-news/2025-11-22/202511220100139270022735
2025-11-22 09:21,,포스코인터내셔널,"탁구 임종훈-오준성, WTT 무스카트 우승…주천희-김나영은 준우승",같은 날 열린 여자복식 결승에서는 주천희(삼성생명)-김나영(포스코인터내셔널) 조가 일본의 오도 사쓰기-요코이 사쿠라 조에 2-3(11-9 5-11 11-5 4-11 6-11)으로 역전패를 당해 준우승에 머물렀다. 주천희-김나영 조는 첫...,https://www.newsis.com/view/NISX20251122_0003412846
