날짜,매체명,검색키워드,기사제목,주요기사 요약,URL,sentiment
2026-03-12 17:04,CEO스코어데일리,포스코,"포스코·에코프로·엘앤에프, ‘국산화 밸류체인’ 경쟁…中 의존 탈피...","12일 업계에 따르면 포스코퓨처엠, 에코프로비엠, 엘앤에프 등 주요 배터리 소재 업체들은 공급망 다변화를... 먼저 포스코퓨처엠은 포스코그룹과의 시너지를 바탕으로 경쟁력 있는 공급망을 확충한다는 구상이다. 현재...",https://www.ceoscoredaily.com/page/view/2026031216115762166,pos
2026-03-12 17:04,,포스코,"호반건설, 포스코이앤씨와 '층간소음 통합기술 개발' 위해 머리 맞댄다",호반그룹이 공동주택 층간소음 문제를 해결하고자 포스코이앤씨와 손잡고 기술 개발에 나선다. 호반건설과 포스코이앤씨는 지난 11일 서울 서초구 본사에서 '공동주택 주거환경 개선을 위한 층간소음 통합기술 공동개발...,https://www.newspost.kr/news/articleView.html?idxno=221695,pos
2026-03-12 17:02,,포스코,"[카드] 포스코청암재단, 한국유학장학 증서수여·졸업 환송식","포스코청암재단은 12일 포스코센터에서 제22회 한국유학장학 증서수여식·졸업 환송식을 개최, 신규 선발된 장학생들에게 장학증서를 수여하고 학업을 마친 졸업 장학생들의 새로운 출발을 축하했다고 밝혔다.",http://www.newsprime.co.kr/news/article.html?no=726865,pos
2026-03-12 17:01,,포스코인터,'게임체인저' 소재 개발 선점 전략 밝힌 포스코퓨처엠,포스코퓨처엠은 12일 서울 강남구 코엑스에서 열리고 있는 ‘인터배터리 2026’에서 오픈 이노베이션 존을 통한 미래의 소재 기술 연구개발 현황을 소개했다. 미국의 전고체 배터리 기업인 팩토리얼과 협력하며 ‘캐즘...,https://economist.co.kr/article/view/ecn202603120067,pos
2026-03-12 16:56,,포스코,"호반건설-포스코이앤씨, '층간소음 통합기술 공동개발' 협약",포스코이앤씨는 지난 11일 서울 서초구 호반파크에서 '공동주택 주거환경 개선을 위한 층간소음 통합기술 공동개발' 업무협약(MOU)을 체결했다고 12일 밝혔다. 협약식에는 문갑 호반그룹 경영부문대표와 최종문 포스코이앤...,https://biz.newdaily.co.kr/site/data/html/2026/03/12/2026031200400.html,pos
2026-03-12 16:54,헤럴드경제,포스코,"포스코청암재단, 한국 유학 장학생 19명 신규 선발",22년간 562명에 230억원 지원 12일 서울시 강남구 포스코센터에서 포스코청암재단의 ‘제22회 한국유학장학 증서수여식 및 졸업 환송식’이 열리고 있다. [포스코청암재단 제공] 포스코청암재단이 해외 우수 인재의 국내...,https://biz.heraldcorp.com/article/10693108?ref=naver,pos
2026-03-12 16:48,중소기업신문,포스코,포스코청암재단 유학장학생 졸업과 신규 증서 수여,"2026 포스코한국유학장학 신입생 증서수여식 및 졸업생 환송식 단체사진. 사진/포스코그룹 포스코청암재단이 12일 포스코센터에서 제22회 한국유학장학 증서수여식과 졸업 환송식을 개최하고, 신규 선발된 장학생들에게...",http://www.smedaily.co.kr/news/articleView.html?idxno=353496,pos
2026-03-12 16:48,,포스코인터,'인터배터리' 개막 첫날 역대 최고 2만3000명 방문,▲11일 서울 삼성동 코엑스에서 열린 ‘인터배터리 2026’에 행사 첫날 약 2만3천 명의 관람객이 방문해 역대... 배터리 소재 기업들도 ESS와 차세대 배터리 시장 확대에 대응하는 기술을 선보였다.포스코퓨처엠은 고성능...,https://weeklytrade.co.kr/news/view.html?section=1&category=8&item=&no=98888,pos
2026-03-12 16:46,,포스코,"한화오션·포스코, 노란봉투법 1호 타겟 되나","법 개정으로 원청 기업과 하청 노동조합이 직접 교섭이 가능해지면서, 한화오션과 포스코 등 5개 기업은... 업계에 따르면 법 시행 첫날은 407개 하청 노조가 원청에 교섭을 요구했는데, 특히 한화오션과 포스코 등 5개...",https://www.goodkyung.com/news/articleView.html?idxno=284409,pos
2026-03-12 16:46,,포스코,"호반건설-포스코이앤씨 기술 개발 MOU...""층간소음 대응 체계 구축할 것...","포스코이앤씨가 지난 11일 서울 서초구 본사에서 '공동주택 주거환경 개선을 위한 층간소음 통합기술 공동개발' 업무협약(MOU)을 체결했다고 12일 밝혔다. 이날 협약식에는 문갑 호반그룹 경영부문대표, 최종문 포스코이앤...",http://www.popcornnews.net/news/articleView.html?idxno=114954,pos
2026-03-12 16:44,,포스코인터내셔널,경북 청년 무역전문가 72명 양성,"뿐만 아니라 포스코인터내셔널 등 국내 종합상사와 연계한 체험형 견학에 이어 취업박람회에 참여하는 등 연계프로그램을 지원한다. 한편, 2013년 시작한 청년 무역사관학교는 그동안 862명의 수료생을 배출했으며 누적...",https://www.seongjuro.co.kr/news/view.php?idx=59547,pos
2026-03-12 16:42,,포스코,"포스코이앤씨, AI 헬스케어 서비스 도입",송길호 = 포스코이앤씨가 1인 가구 증가와 초고령사회 진입에 발맞춰 단지 내 AI 헬스케어 서비스를 도입하며 미래형 주거 환경 구축에 나선다. 포스코이앤씨는 최근 헬스케어 전문기업 아크(ARK)와 업무협약을 체결했다고...,https://www.joongboo.com/news/articleView.html?idxno=363719549,pos
2026-03-12 16:42,,포스코인터,"[포토] 인터배터리 2026…포스코퓨처엠, 배터리 소재 기술 한자리에",[사진=뉴스투데이] 서울 코엑스에서 열린 ‘인터배터리 2026’ 포스코퓨처엠 부스에 배터리 소재 기술을 소개하는 전시 공간이 마련돼 있다. [사진=뉴스투데이] 서울 코엑스에서 열린 ‘인터배터리 2026’...,https://www.news2day.co.kr/article/20260312500266,pos
2026-03-12 16:42,,포스코,"포스코청암재단, 제22회 한국유학장학생 19명 신규 선발",12일 포스코센터에서 개최된 제22회 한국유학장학 증서수여식 및 졸업 환송식에 참석한 장학생과 졸업 장학생들이 기념 촬영 중이다. 사진=포스코청암재단 제공 매일일보 = 정경화 기자 | 포스코청암재단은 12일...,https://www.m-i.kr/news/articleView.html?idxno=1345913,pos
2026-03-12 16:42,,포스코,"관세청장, 포스코 포항제철소 방문…철강업계 수출입 애로 청취",관세청에 따르면 이 청장은 12일 경북 포항시 동촌동에 위치한 포스코 포항제철소를 방문해 철강 제품 생산... 이날 포스코 측은 중국·일본 철강 제품의 덤핑 공세에 대응해 관세청이 추진한 불공정 무역행위 단속과 우회...,https://www.newscammp.co.kr/news/articleView.html?idxno=5853,pos
2026-03-12 16:38,,포스코인터,[인터배터리 2026 개막] 'EV 넘어 AI·ESS로'…차세대 배터리 경쟁 본격화,국내 최대 배터리 산업 전시회 인터배터리 2026이 11일 서울 코엑스에서 개막한 가운데 배터리 소재 기업 포스코퓨처엠은 'BoT(Battery of Tomorrow) 시대'를 주제로 차세대 배터리 소재 기술을 선보였다. [사진=뉴시안]...,http://www.newsian.co.kr/news/articleView.html?idxno=87134,pos
2026-03-12 16:38,,포스코,"포스코청암재단, 유학장학생 19명 선발···학비·생활비 지원","포스코청암재단은 12일 포스코센터에서 제 22회 한국유학장학 증서수여식 및 졸업 환송식을 개최하고, 신규 선발된 장학생들에게 장학증서를 수여했다고 밝혔다. 재단은 올해 포스코한국유학장학생 19명을 신규...",https://magazine.hankyung.com/job-joy/article/202603127089d,pos
2026-03-12 16:36,,포스코인터,[포토] 인터배터리 2026 개막…첨단 배터리 기술에 코엑스에 관람객 '북...,"[사진=뉴스투데이] 서울 코엑스에서 열린 ‘인터배터리 2026’과 함께 배터리 산업 채용 행사 ‘Battery Job Fair(배터리 잡페어)’가 진행되고 있다. 포스코퓨처엠, 삼성SDI 등 기업이 참여해 취업 상담과 멘토링을...",https://www.news2day.co.kr/article/20260312500213,pos
2026-03-12 16:30,,포스코인터,인터배터리 2026 첫날 2만3000명 방문…전고체·AI 배터리 경쟁 본격화,"이끄는 포스코퓨처엠'을 주제로 전고체·LFP 등 차세대 배터리 기술 변화에 대응하는 양·음극 소재 포트폴리오 전략과 팩토리얼 에너지와의 공동 프로젝트를 공개했다. 인터배터리 사무국은 ""인터배터리가 글로벌...",http://www.metroseoul.co.kr/article/20260312500595,pos
2026-03-12 16:27,,포스코인터,"인터배터리 2026 첫날, '역대 최대' 2.3만명 방문..ESS·AI·로봇으로 수...",코엑스와 한국배터리산업협회는 인터배터리 2026 개막 첫날 약 2만3000여 명이 전시장을 방문해 역대 최고... 포스코퓨처엠은 고성능 양극재와 음극재 기술을 통해 고에너지밀도 배터리 구현 전략을 소개하며 차세대...,http://www.fnnews.com/news/202603121620069832,pos
2026-03-12 16:26,,포스코인터내셔널,"거래소 외국인, 삼성전자 팔고 삼성중공업 샀다",또 제약 기업 유한양행과 종합 무역 기업 포스코인터내셔널에서도 외국인 매도 물량이 출회됐다. 증권가에서는 이날 외국인 매매 흐름이 조선·방산·에너지 같은 실물 산업으로 투자 중심축이 이동하는 모습을...,https://www.pinpointnews.co.kr/news/articleView.html?idxno=436293,pos
2026-03-12 16:26,,포스코,"'노란봉투법' 이틀째, 하청노조 453개 교섭 요구…포스코 등 교섭 승낙","지난 10일 포스코, 한화오션, 쿠팡로지스틱스서비스(CLS), 경기 화성시, 부산교통공사가 교섭 요구 공고를 했으며, 11일에는 대방건설과 일신건영 등이 하청노조 교섭에 응하겠다는 의사를 밝혔다. 이와 관련, 포스코는...",http://www.ftoday.co.kr/news/articleView.html?idxno=356368,pos
2026-03-12 16:26,데일리한국,포스코,"포스코청암재단, 한국유학장학 증서수여식 개최","사진=포스코청암재단 제공 포스코청암재단은 포스코센터에서 제 22회 한국유학장학 증서수여식 및 졸업 환송식을 개최하고, 신규 선발된 장학생들에게 장학증서를 수여하는 한편 학업을 마친 졸업 장학생들의 새로운...",https://daily.hankooki.com/news/articleView.html?idxno=1346166,pos
2026-03-12 16:20,,포스코,"포스코청암재단, 한국유학장학생 19명 신규 선발",포스코청암재단은 3월12일 서울 포스코센터에서 '제22회 포스코한국유학장학 증서수여식 및 졸업 환송식'을 열고 신규 장학생들에게 장학증서를 수여했다. 동시에 학업을 마친 졸업 장학생들의 새로운 출발을 축하했다....,https://www.econovill.com/news/articleView.html?idxno=732929,pos
2026-03-12 16:17,,포스코,"포스코청암재단, '제22회 한국유학장학 증서수여식·졸업 환송식' 개최",포스코청암재단은 12일 서울 강남구 포스코센터에서 ‘제22회 포스코 한국유학장학 증서수여식 및 졸업 환송식’을 열고 신규 장학생들에게 장학증서를 수여했다고 밝혔다. 재단은 올해 포스코 한국유학장학생 19명을...,http://www.fnnews.com/news/202603121611526141,pos
2026-03-12 16:17,아시아경제,포스코,"포스코청암재단, 한국유학장학생 27개국·19명 선발…""학비·생활비 지원...","포스코청암재단이 2026년 한국 유학 장학생으로 27개국, 19명을 선발해 등록금과 생활비를 지원하는 등 인재 육성에 나선다. 포스코청암재단은 12일 서울 강남구 포스코센터에서 제22회 한국유학장학 증서수여식 및 졸업...",https://view.asiae.co.kr/article/2026031216175581302,pos
2026-03-12 16:15,,포스코인터,"[인터배터리 2026] 포스코vs에코프로, 전고체 핵심 '황화리튬' 다른 길로...","인터배터리 2026에서 포스코홀딩스의 황화리튬 생산 과정을 설명한 인포그래픽 (사진=김지윤 기자) 우선 포스코홀딩스는 리튬 원료 확보 능력과 제철 공정 기술을 기반으로 황화리튬 개발을 완료, 양산 단계에 진입했다....",https://www.greened.kr/news/articleView.html?idxno=337957,pos
2026-03-12 16:15,더팩트,포스코,"포스코청암재단, 제22회 한국유학장학 증서수여식 개최",제22회 포스코한국유학장학생 19명 신규 선발 22년간 562명에게 230억원 지원 포스코청암재단은 12일 포스코센터에서 제 22회 한국유학장학 증서수여식 및 졸업 환송식을 개최하고 신규 선발된 장학생들에게 장학증서를...,https://news.tf.co.kr/read/economy/2301643.htm,pos
2026-03-12 16:12,MTN,포스코인터,"포스코퓨처엠 ""전고체 양극재, 싸게 만드는 것이 핵심"" [인터배터리 202...","홍영준 포스코퓨처엠 부사장이 12일 '인터배터리 2026' 부대행사 '더배터리컨퍼런스'에서 발표를 하고 있다./사진=머니투데이방송""전고체 전지용 양극재는 안에 미드니켈이 들어가든, 하이니켈이 들어가든 결국 표면...",https://news.mtn.co.kr/news-detail/2026031215230090452,pos
2026-03-12 16:12,MTN,포스코인터,"포스코퓨처엠 ""전고체 양극재, 얼마나 싸게 만드냐가 핵심"" [인터배터리...","홍영준 포스코퓨처엠 부사장이 12일 '인터배터리 2026' 부대행사 '더배터리컨퍼런스'에서 발표를 하고 있다./사진=머니투데이방송""전고체 전지용 양극재는 안에 미드니켈이 들어가든, 하이니켈이 들어가든 결국 표면...",https://news.mtn.co.kr/news-detail/2026031215230090452,pos
2026-03-12 16:12,MTN,포스코인터,"포스코퓨처엠 ""전고체 양극재, 결국 가격이 핵심"" [인터배터리 2026]","홍영준 포스코퓨처엠 부사장이 12일 '인터배터리 2026' 부대행사 '더배터리컨퍼런스'에서 발표를 하고 있다./사진=머니투데이방송""전고체 전지용 양극재는 안에 미드니켈이 들어가든, 하이니켈이 들어가든 결국 표면...",https://news.mtn.co.kr/news-detail/2026031215230090452,pos
2026-03-12 16:11,,포스코인터,위기의 K배터리 소재…가격 경쟁력·미래기술 승부수 띄운다,"실제 포스코그룹은 올해 인터배터리에서 '지속가능 공급망' 존을 마련하고 비전을 소개했다. 현장에선 아르헨티나 리튬 염호, 호주 리튬 광산, 아프리카 흑연 광산 등 글로벌 우량 자원에 대한 투자 계획을 한눈에...",https://www.mt.co.kr/industry/2026/03/12/2026031211195210354,pos
2026-03-12 16:11,,포스코인터,위기의 K배터리 소재…가격 경쟁력·미래기술 승부수 띄운다,"실제 포스코그룹은 올해 인터배터리에서 '지속가능 공급망' 존을 마련하고 비전을 소개했다. 현장에선 아르헨티나 리튬 염호, 호주 리튬 광산, 아프리카 흑연 광산 등 글로벌 우량 자원에 대한 투자 계획을 한눈에...",https://www.mt.co.kr/industry/2026/03/13/2026031211195210354,pos
2026-03-12 16:10,,포스코,[건설 브리핑] 현대엔지니어링·포스코이앤씨·반도건설,"[사진 = 포스코이앤씨 제공] ◇ 포스코이앤씨, 공동주택 'AI 헬스케어 서비스' 도입 포스코이앤씨는 11일 헬스케어 기업 아크와 단지 내 전용 라운지에서 건강검사를 제공하는 업무협약(MOU)를 체결했다고 12일 밝혔다....",http://www.niceeconomy.co.kr/news/articleView.html?idxno=89409,pos
2026-03-12 16:08,,포스코인터내셔널,"거래소 기관, 한화시스템·LIG넥스원 부상… 방산주로 돈 몰렸다",자원개발과 무역 사업을 하는 포스코인터내셔널 역시 기관 매수 상위에 올랐다. 포스코인터내셔널은 에너지 자원 개발과 글로벌 트레이딩 사업을 통해 안정적인 현금 흐름을 확보하고 있다. 또 기관은 배터리 기업...,https://www.pinpointnews.co.kr/news/articleView.html?idxno=436287,pos
2026-03-12 16:08,스트레이트뉴스,포스코인터,EV 이후 전략 찾는 K배터리…인터배터리서 드러난 '다음 승부수'는,"고려아연과 포스코퓨처엠 등 주요 소재 기업들이 인터배터리 2026에서 존재감을 드러내는 전시를 선보였다. [사진=박응서 기자] 고려아연과 포스코퓨처엠, 에코프로, 엘앤에프 등 주요 소재 기업들은 원료 확보와...",https://www.straightnews.co.kr/news/articleView.html?idxno=297272,pos
2026-03-12 16:06,,포스코인터내셔널,[마켓뷰] 이란 전쟁·‘네마녀의 날’ 겹쳤지만… 개인 2조 순매수에 코...,"원유 관련주에서는 포스코인터내셔널(4.06%), GS(3.97%) 등이 강세를 보였다. 코스닥 지수는 전 거래일 대비 11.57포인트(1.02%) 오른 1148.4에 마감했다. 개인이 5074억원, 기관이 2524억원을 순매수하며 외국인의 6800억원...",https://biz.chosun.com/stock/stock_general/2026/03/12/DVPP4QFZC5AYLL3OHOFSYHCJAA/?utm_source=naver&utm_medium=original&utm_campaign=biz,pos
2026-03-12 16:00,,포스코플로우,"플로우케이, 광양항 배후단지 첨단 물류센터 준공","플로우케이는 포스코플로우와 대우로지스틱스가 합작해 설립한 물류기업으로, 이차전지와 석유화학 소재 등 다양한 산업군을 대상으로 맞춤형 물류 서비스를 제공하고 있다. 이날 준공식에는 플로우케이 경영진을 비롯해...",https://www.jeonmae.co.kr/news/articleView.html?idxno=1238165,pos
2026-03-12 15:56,,포스코플로우,"여수광양항만공사, 광양항 입주기업 플로우케이, 광양물류센터 준공","플로우케이는 포스코플로우와 대우로지스틱스의 합작으로 설립된 법인으로 이차전지, 석유화학 소재 등 포스코그룹을 포함한 고객사의 최적 물류 솔루션을 제공하는 물류기업이다. 준공식에는 플로우케이 경영진을...",http://www.newsmaker.or.kr/news/articleView.html?idxno=175155,pos
2026-03-12 15:44,,포스코인터,"양극재 공정 비용 24% 낮춘다…포스코퓨처엠, 소재‧공정 혁신 전략 공...",포스코퓨처엠이 차세대 배터리 소재와 공정 혁신을 통해 배터리 가격 경쟁력 확보에 나선다. 전기차 확산의... 홍영준 포스코퓨처엠 부사장은 12일 서울 코엑스에서 열린 ‘더배터리컨퍼런스 2026’에서 배터리 소재와 공정...,https://www.kukinews.com/article/view/kuk202603120116,pos
2026-03-12 15:40,연합뉴스,POSCO INTERNATIONAL,KOSPI 200 Closing Price List-4,"KOSPI 200 Closing Price List-4 MIWON SC 125,200 DN 2,200 POSCO INTERNATIONAL 79,500 UP 3,100 CJ CheilJedang 201,500 UP 2,400 SamyangFood 1,075,000 DN 45,000 HANILCMT 17,050 UP 350 HITEJINRO 17...",https://en.yna.co.kr/view/AEN20260312008100320?input=2106m,pos
2026-03-12 15:38,,포스코인터,"코리아비티에스, 나트륨배터리 적용한 ESS 개발해 첫 선","이번 신제품은 서울 코엑스에서 열리는 '인터배터리 2026' 전시회에서 대중에 첫 선을 보였다. 차세대... 현대로템, 포스코(POSCO) 등 국내외 700여개 기관 및 기업에 공급하며 기술력을 인정받아 왔다. 장중언...",https://www.electimes.com/news/articleView.html?idxno=365985,pos
2026-03-12 15:30,,포스코인터,[인터배터리 2026] '꿈의 배터리' 전고체 경쟁 점화…K배터리 3사 로드맵,"11일 서울 코엑스에서 개막한 '인터배터리 2026' 전시장에서는 차세대 기술로 꼽히는 전고체 배터리 전시존에... 포스코퓨처엠은 미국 전고체 배터리 기업 팩토리얼과 협력해 전고체 배터리 소재를 개발하고 있으며, 이번...",http://www.biztribune.co.kr/news/articleView.html?idxno=350336,pos
2026-03-12 15:28,아시아경제,포스코인터,인터배터리 첫날 2만3000명 몰려…전고체·AI 배터리 경쟁 본격화,"포스코퓨처엠과 전고체 배터리 기업 팩토리얼 에너지는 전고체 배터리 공동 개발 사례를 발표하고, 글로벌 석학들도 전고체 배터리 기술 과제와 연구 방향을 공유할 예정이다. 인터배터리 사무국 관계자는...",https://view.asiae.co.kr/article/2026031215285318892,pos
2026-03-12 15:26,뉴스드림,포스코인터,"[현장] 인터배터리 2026, '대박 조짐'…참여社·관람객 늘고, 이벤트 풍...","국내 주요 배터리기업, 각종 이벤트 마련…유명 유튜버도 방문해 눈길 인터배터리 2026에는 국내 주요 배터리사인 LG에너지솔루션·삼성SDI·SK온·포스코퓨처엠 등이 일제히 참여해 제품·기술 소개의 장과 더불어...",http://www.newsdream.kr/news/articleView.html?idxno=109276,pos
2026-03-12 15:25,디지털데일리,포스코인터,첫날 2만3000명 몰린 인터배터리 26… 전기차 넘어 'AI·로봇' 배터리 시...,올린 인터배터리 2026이 개막 첫날부터 약 2만3000여명의 관람객을 끌어모으며 역대 흥행 신기록을 썼다. 전년... 포스코퓨처엠과 에코프로는 고성능 양극재 음극재 기술을 통한 고에너지밀도 구현 전략을 소개하며 글로벌...,https://www.ddaily.co.kr/page/view/2026031215005464899,pos
2026-03-12 15:23,디지털데일리,구동모터코어,[르포] 'LG·포스코·에코프로·엘앤에프' 각자 양극재 공략 다르다…왜...,"자율주행 전기차 구역에서는 니켈 함량 95% 이상의 울트라니켈 양극재와 함께 포스코인터내셔널의 전기차 구동모터용 영구자석, 코어 등이 전시됐다. 또 전기차 배터리 팩 프레임에 적용할 수 있는 철강 복합소재도...",https://www.ddaily.co.kr/page/view/2026031215145394575,pos
2026-03-12 15:16,,포스코인터내셔널,中 독점 깨자..'희토류' 공급망 美로 이동,"포스코인터내셔널은 미국 기업 리엘리먼트테크놀로지스와 합작해 북미에 희토류 통합 생산단지를 구축하고 내년부터 희토류와 영구자석을 생산할 계획이다. 이 생산단지는 희토류 분리·정제부터 영구자석 생산, 폐자원...",http://www.4th.kr/news/articleView.html?idxno=2108962,pos
2026-03-12 15:16,,포스코인터,[인터배터리 '26] 개막 첫날 2만3000명 방문…EV 넘어 AI·ESS로 확장 등,"포스코퓨처엠 홍영준 부사장과 전고체 배터리 기업 팩토리얼 에너지의 시유 황 대표는 전고체 배터리 공동 개발 사례와 차세대 에너지 저장 전략을 발표할 예정이다. 인터배터리 사무국은 ""인터배터리는 글로벌...",https://www.ebn.co.kr/news/articleView.html?idxno=1702223,pos
2026-03-12 15:10,,포스코인터,"[인터배터리 2026] 전고체배터리의 미래...가격저항 적은 ""드론·로봇 등...",서울 코엑스에서 열린 '인터배터리 2026' 더배터리컨퍼런스에서는 세계 전고체 배터리 연구 관련 선두주자들이 나와 상용화 계획과 함께 향후 과제 등에 대한 의견을 제시했다. 먼저 포스코퓨처엠이 지분을 투자한 미국...,https://www.electimes.com/news/articleView.html?idxno=365975,pos
2026-03-12 15:08,중소기업신문,포스코,"호반건설·포스코이앤씨, 층간소음 저감 위해 협력",문갑 호반건설 경영부문대표(왼쪽)와 최종문 포스코이앤씨 R&D센터장이 지난 11일 서울 서초구 본사에서 '층간소음 통합기술 공동개발' 업무협약을 체결한 후 기념촬영을 하고 있다. 호반건설과 포스코이앤씨가 공동주택...,http://www.smedaily.co.kr/news/articleView.html?idxno=353470,pos
2026-03-12 14:58,,포스코인터,"포스코퓨처엠 ""차세대 소재와 공정 혁신으로 배터리 비용 낮춘다""","홍영준 포스코퓨처엠 기술연구소장이 12일 서울 강남구 코엑스에서 열린 '인터배터리 2026' 더배터리컨퍼런스에서 기조연설을 하고 있다. /원관희 기자 ◆포스코퓨처엠, 소재·공정 혁신으로 배터리 원가 절감 홍영준...",http://www.metroseoul.co.kr/article/20260312500412,pos
2026-03-12 14:56,뉴스핌,포스코인터,EV 넘어 ESS·AI까지…'인터배터리 2026' 차세대 기술 각축,서울 코엑스에서 개최된 '인터배터리 2026' 행사장의 모습. [사진=한국배터리산업협회] 배터리 소재 기업들도 ESS와 차세대 배터리 시장 확대에 대응하는 기술을 선보였다. 포스코퓨처엠은 고성능 양극재와 음극재...,https://www.newspim.com/news/view/20260312000890,pos
2026-03-12 14:56,헤럴드경제,포스코인터,"“배터리 팩, 100달러 아래로”…포스코퓨처엠, 비용 절감 열쇠 ‘차세...",‘인터배터리 2026’에 참가한 포스코퓨처엠 부스에서 관람객들이 다양한 양·음극재 제품을 살펴보고 있다. [포스코퓨처엠 제공] 음극재 분야에서는 인조흑연 생산 방식의 혁신을 추진한다. 기존 인조흑연 생산은...,https://biz.heraldcorp.com/article/10692958?ref=naver,pos
