날짜,매체명,검색키워드,기사제목,주요기사 요약,URL,sentiment
2026-07-19 15:30,,포스코 전기로,"[포스코 트랜스포메이션] 외화채 공개매수, 철강 투자 '사전정비'",아울러 미국 루이지애나주에서는 현대제철·현대차·기아와 함께 연산 270만톤 규모의 전기로 프로젝트를 추진하고 있다. 포스코그룹은 2026~2028년 3년간 총 29조1000억원을 투자할 계획이다. 이 가운데 철강 부문 투자만...,https://www.bloter.net/news/articleView.html?idxno=668298,pos
2026-07-19 15:28,,포스코인터내셔널,"한·베·호주 금융협력 확대…금융위, 디지털·에너지 분야 협력 강화 논...","박 상임위원은 포럼 일정 이후 호주에 진출한 국내 금융회사들과 간담회를 갖고 현지 사업 여건을 점검했으며, 삼성물산과 포스코인터내셔널 등 진출 기업을 방문해 사업 현황을 살펴보고 향후 협력 과제에 대한 현장의...",https://www.mediafine.co.kr/news/articleView.html?idxno=83950,pos
2026-07-19 14:56,대경일보,포스코퓨처엠,"포항대, 전국 최초 고교·대학 연계로 '이차전지 전문인재' 키운다",이번 특강은 에코프로머티리얼즈와 포스코퓨처엠의 현장 전문가를 초청해 '이차전지 산업의 현재와 미래 동향'을 주제로 진행됐다. 행사에는 포항대 이차전지계열과 협약형 특성화고인 포항흥해공고 재학생 등 150여...,https://www.dkilbo.com/news/articleView.html?idxno=548897,pos
2026-07-19 14:32,,포스코인터내셔널,"베트남엔 금융중심지, 호주엔 에너지 금융…금융위 실용외교 속도",박 위원은 삼성물산 시드니지점과 포스코인터내셔널 시드니지사를 찾아 호주 현지 사업 현황을 점검했다. 삼성물산은 배터리 에너지 저장장치와 송전망 등 호주의 에너지 전환에 필요한 인프라 프로젝트를 수행하고 있다....,https://www.newsworks.co.kr/news/articleView.html?idxno=847458,pos
2026-07-19 14:28,,포스코인터내셔널,[포토] 우승 #삼성생명 #제42회_대통령기_전국탁구대회 #남자일반부_단...,"포스코인터내셔널이 결승전에서 한국거래소와 벌인 풀매치 승부를 이겨내고 우승했다. 공동3위는 산청군청과 한국수자원공사. 한국거래소 2대 3 삼성생명 임종훈-오준성 3(11-6, 11-9, 11-5)0 조승민-오승환...",http://www.thepingpong.co.kr/news/articleView.html?idxno=12709,pos
2026-07-19 14:28,,대미투자특별법,중동전쟁만큼 시급한 대미투자… 올 8월 '트럼프 청구서' 날아오나,후속 절차로 우리 정부는 올해 6월 대미투자특별법 시행과 동시에 한미전략투자공사(KUIC)를 출범시켰다. 공사가 법정 자본금 2조 원을 온전히 확보하기 위해 재경부·기획예산처와 재원 분담 조율과 실탄 장전에 박차를...,https://www.mt.co.kr/economy/2026/07/19/2026071914134914140,pos
2026-07-19 14:28,,대미투자특별법,중동전쟁만큼 시급한 대미투자… 올 8월 '트럼프 청구서' 날아오나,후속 절차로 우리 정부는 올해 6월 대미투자특별법 시행과 동시에 한미전략투자공사(KUIC)를 출범시켰다. 공사가 법정 자본금 2조 원을 온전히 확보하기 위해 재경부·기획예산처와 재원 분담 조율과 실탄 장전에 박차를...,https://www.mt.co.kr/economy/2026/07/20/2026071914134914140,pos
2026-07-19 14:24,,포스코인터내셔널,[포토] 우승 #포스코 #제42회_대통령기_전국탁구대회 #여자일반부_단체...,포스코인터내셔널이 결승전에서 삼성생명과 벌인 풀매치 승부를 이겨내고 우승했다. 공동3위는 대한항공과 한국마사회. ■ 여자일반부 단체 결승전 경기 결과 삼성생명 2대 3 포스코인터내셔널 주천희...,http://www.thepingpong.co.kr/news/articleView.html?idxno=12708,pos
2026-07-19 14:18,,포스코인터내셔널,[포토] 우승 #주천희 #제42회_대통령기_전국탁구대회 #여자일반부_개인...,"주천희(삼성생명)가 결승전에서 포스코인터내셔널 에이스 김나영을 3대 1(11-5, 11-6, 6-11, 11-7)로 이기고 우승했다. 주천희는 개인복식과 더불어 개인전 2관왕이다. 개인단식 공동3위는 유시우(화성도시공사)아 유예린...",http://www.thepingpong.co.kr/news/articleView.html?idxno=12706,pos
2026-07-19 13:00,,대미 투자 특별법,"[기획]마스가 물꼬 트이나…K-조선, '1600조' 시장 빗장 연다",같은 날 대미 투자 이행을 위한 특별법도 시행되면서 마스가를 위한 국내 기반은 이미 충분히 다져져 있다는 관측이 나온다. 업계에서는 '반스-톨레프슨(Byrnes-Tollefson) 수정법'과 '존스법(Jones Act)' 등 대표적인 규제...,https://www.m-i.kr/news/articleView.html?idxno=1392374,pos
2026-07-19 12:54,,포스코인터내셔널,"포스코인터내셔널, 대통령기 여자단체전 정상! 팀워크 빛나",포스코인터내셔널이 제42회 대통령기 전국탁구대회 여자일반부 단체전 정상에 올랐다. 전통 강호들을 차례로 꺾으며 탄탄한 팀 전력을 입증했다. 포스코인터내셔널은 18일 경북 경주실내체육관에서 열린...,http://www.thepingpong.co.kr/news/articleView.html?idxno=12703,pos
2026-07-19 12:51,디지털데일리,포스코 직고용,"'58년 무파업' 흔들리는 포스코, 커지는 원하청 노조 리스크 [헤비급브...",하지만 직고용 방침은 새로운 갈등을 불러왔다. 포스코는 별도 '조업시너지(S) 직군'을 신설해 채용할 계획이지만 하청노조는 차별 정책이라고 반발했다. 포스코 정규직 직원들과 임금·복지 등에서 격차가 발생할 수...,https://www.ddaily.co.kr/page/view/2026071912503205293,neg
2026-07-19 12:51,,포스코홀딩스,"증시 흔들리자 목표가 '후퇴'...하향 리포트, 올해 처음 상향 앞질렀다","포스코홀딩스, JYP엔터, 미래에셋증권, 롯데관광개발 등도 각각 7건의 하향 리포트가 발간됐다. LG에너지솔루션, 호텔신라 등은 각각 6건으로 집계됐다. 같은 기간 목표주가 상향 보고서는 금융, 화장품 업종에...",http://www.fnnews.com/news/202607191128421199,pos
2026-07-19 12:50,,포스코인터내셔널,"삼성생명, 대통령기 남자단체전 정상! 라이벌 연파 최강팀 존재감","한편 같은 시간에 벌어진 여자단체 결승전에서는 포스코인터내셔널이 삼성생명 여자팀을 3대 2로 꺾고 우승했다. 삼성생명은 결국 남자팀 우승, 여자팀 준우승으로 단체전을 끝냈다. 단체전 결승을 끝으로 일반부...",http://www.thepingpong.co.kr/news/articleView.html?idxno=12702,pos
2026-07-19 12:39,,포스코인터내셔널,"""탁구명가 부활"" 이철승 감독의 삼성생명, 한국거래소 꺾고 11년만의 대...","한편 같은 시간 펼쳐진 여자단체 결승전에서는 포스코인터내셔널이 삼성생명을 풀매치 접전 끝에 3대2로 꺾고 우승했다. 채윤석 감독, 이상수 코치가 이끄는 삼성생명은 이번 대회 여자단식에서 에이스 주천희가...",https://www.sportschosun.com/sports-news/2026-07-19/202607190100113100007179,pos
2026-07-19 12:02,,포스코인터내셔널,"금융위, 베트남·호주서 협력 논의…금융 외교 박차","아울러 박 위원은 삼성물산과 포스코인터내셔널도 방문했다. 박 위원은 ""기업의 성장 무대 반경에 맞춰 금융 역시 해외 진출을 통해 경제 성장동력을 글로벌 시장에서 확보하는 것이 중요한 시기""라며 ""생산적 금융이 초...",https://news.einfomax.co.kr/news/articleView.html?idxno=4425669,pos
2026-07-19 12:02,이데일리,포스코인터내셔널,"금융위, 베트남·호주서 금융외교…금융협력·기업 지원 확대",아울러 삼성물산과 포스코인터내셔널의 현지 사업장을 방문해 에너지 인프라와 천연가스 개발 사업 현황을 점검했다. 기업들은 대규모 해외 프로젝트에는 장기 자금 공급과 안정적인 금융 지원이 필수적이라고...,https://www.edaily.co.kr/news/newspath.asp?newsid=01479286645516160,pos
2026-07-19 12:02,,포스코인터내셔널,"금융위원회, 베트남 및 호주와 금융외교 강화",[ 기업 방문 ] 박민우 위원은 호주의 재생에너지 인프라 사업에 참여중인 삼성물산과 천연가스 생산 사업을 진행중인 포스코인터내셔널을 방문했다. 먼저 7월 14일(화) 방문한 삼성물산 시드니지점은 배터리 에너지...,http://www.intn.co.kr/news/articleView.html?idxno=2052013,pos
2026-07-19 12:01,,포스코인터내셔널,"금융위, 베트남·호주와 금융외교 확대…금융협력·해외진출 지원 강화",박 상임위원은 삼성물산 시드니지점과 포스코인터내셔널 시드니지사를 방문해 에너지 인프라와 자원개발 사업 현황을 점검했다. 삼성물산은 호주에서 배터리 에너지 저장장치(BESS)와 송전망 등 에너지 전환 인프라...,https://www.dailian.co.kr/news/view/1668417/?sc=Naver,pos
2026-07-19 12:00,,포스코인터내셔널,"금융위, 베트남·호주 '금융외교' 강화…금융중심지·주택금융 등 논의",특히 호주의 재생에너지 인프라 사업에 참여 중인 삼성물산과 천연가스 생산 사업을 하는 포스코인터내셔널을 방문해 금융지원 의견을 들었다. 두 기업은 해외 에너지 생산과 인프라 구축 프로젝트에는 대규모 자금이...,https://www.newsis.com/view/NISX20260719_0003713990,pos
2026-07-19 12:00,이투데이,포스코인터내셔널,"금융위, 베트남·호주와 금융협력 확대…결제·해외진출 지원",삼성물산과 포스코인터내셔널 현지 사업장도 방문했다. 삼성물산은 호주에서 배터리 에너지 저장장치(BESS)와 송전망 등 에너지 전환 인프라 사업을 진행하고 있으며 포스코인터내셔널은 자회사 세넥스에너지를 통해...,https://www.etoday.co.kr/news/view/2604830,pos
2026-07-19 12:00,뉴스1,포스코인터내셔널,"금융위, 베트남·호주 금융 외교 전개…양국 협력과제에 머리 맞대",이밖에 박 위원은 호주에 진출한 한국계 금융회사 간담회 및 삼성물산과 포스코인터내셔널을 방문해 이들의 사업 현황을 점검하고 금융-실물 협력과제 발굴을 위한 의견을 청취했다.,https://www.news1.kr/finance/financial-policy/6231931,pos
2026-07-19 12:00,이투데이,포스코인터내셔널,"금융위, 베트남·호주와 금융협력 확대…금융외교 강화",삼성물산 시드니지점과 포스코인터내셔널 시드니지사도 방문해 재생에너지 인프라와 천연가스 생산 사업 현황을 점검했다. 금융위는 호주가 핵심 에너지·원자재 공급국이자 경제안보와 공급망 측면에서 전략적 중요성이...,https://www.etoday.co.kr/news/view/2604825,pos
2026-07-19 12:00,아시아경제,포스코인터내셔널,"금융당국, 베트남·호주와 금융협력 강화…고위급 소통, 금융·실물 동반...","이와 함께 박 상임위원은 호주에서 재생에너지 인프라 사업을 진행 중인 삼성물산과 천연가스 생산 사업을 진행중인 포스코인터내셔널을 방문해 현지 사업 현황을 살펴봤다. 박 상임위원은 ""우리 기업의 성장 무대 반경에...",https://view.asiae.co.kr/article/2026071811255747249,pos
2026-07-19 12:00,연합뉴스,포스코인터내셔널,"금융위, 베트남·호주와 금융협력포럼 등 금융외교 강화","등에서 금융과 실물 협력 확대 필요성을 공유했다. 박 위원은 이후 호주에 진출한 한국 금융회사 간담회와 삼성물산, 포스코인터내셔널 등 기업을 방문해 사업 현장을 점검하고 협력과제 발굴을 위한 의견을 청취했다.",https://www.yna.co.kr/view/AKR20260718034300002?input=1195m,pos
2026-07-19 11:54,철강금속신문,포스코인터내셔널,"포스코그룹, 5300개 협력사 상생 생태계 묶는다…3차 협력사까지 지원↑","이날 행사에는 주병기 공정거래위원장과 포스코홀딩스 이주태 사장을 비롯해 포스코, 포스코인터내셔널 등 그룹 주요 사업회사 대표, 1·2차 협력사 관계자 등 130여 명이 참석했다. 이번 협약은 기존 1차 협력사 중심의...",http://www.ferrotimes.com/news/articleView.html?idxno=49202,pos
2026-07-19 11:54,철강금속신문,포스코인터내셔널,"美, 한국산 도금강판 상계관세 최종판정…KG스틸 최대","이밖에 포스코, 포스코인터내셔널, 포스코스틸리온, 세아씨엠, 세아제강 등 개별 조사 대상에서 제외된 기업들은 2.88%의 재심 적용률을 부여받았다. 미 상무부는 이번 재심에서 한국 배출권거래제(K-ETS), 수출금융...",http://www.ferrotimes.com/news/articleView.html?idxno=49200,pos
2026-07-19 11:54,철강금속신문,포스코인터내셔널,"美 상무부, 韓 냉연 반덤핑 최종판정…현대 포스코 '덤핑제로'","최종 판정에서 현대제철은 0.00%, 포스코와 포스코인터내셔널은 0.00%의 가중평균 덤핑마진을 받았다. 지난 3월 발표된 예비판정 이후 이해관계자의 의견 제출이 없어 별도 수정 없이 최종 확정됐다. 이에 따라...",http://www.ferrotimes.com/news/articleView.html?idxno=49195,neg
2026-07-19 11:42,,대미투자특별법,"김정관 산업장관, 이번 주 방미… 대미투자 1호·쿠팡 갈등 조율 주목","일본보다 첫 투자 사업의 추진이 늦다는 지적에는 양국의 법·제도적 차이를 들었다. 김 실장은 ""일본은 법이 필요 없었고 우리는 대미투자특별법을 만들어야 했다""며 ""미국도 우리가 법을 만들고 대미투자공사를 설립하고...",https://www.newscj.com/news/articleView.html?idxno=3418048,pos
2026-07-19 11:18,,대미 투자 특별법,"김용범 ""대미투자 1호, 8~9월 현실화…美 제안 정밀 분석 중""","일본은 별도의 법률 제정 없이 관련 절차를 진행할 수 있었지만, 한국은 대미투자 특별법 제정과 전담 투자공사 설립, 인력 채용 등의 준비 과정이 필요했다는 것이다. 김 실장은 ""일본은 법이 필요하지 않았고 우리보다...",https://www.newsworks.co.kr/news/articleView.html?idxno=847548,pos
2026-07-19 11:00,,포스코이앤씨,"[정비사업탐방] 목동 대장주 14단지, 대형사 수주 쟁탈전 예고","포스코이앤씨 역시 목동에서 14단지를 포함한 참여 단지를 검토 중이다. 다만 주력 단지는 4·8·11·13단지로 향후 변동 가능성이 있으며, 최종 입찰 참여까지는 신중한 내부검토를 통해 확정하겠다는 설명이다. 이처럼...",https://www.m-i.kr/news/articleView.html?idxno=1392661,pos
2026-07-19 10:24,,대미투자특별법,김용범 “미국이 보낸 ‘대미투자 1호’ 대상 분석 중…김정관 곧 방미...,"김 실장은 ‘일본에 비해 대미투자 1호가 늦어지고 있다’는 사회자의 질문에 “일본은 법이 필요없었고, 우리는 대미투자특별법을 만들어야 했다”며 “미국도 우리가 법을 만들고, 대미투자공사를 설립하고, 사람을...",https://www.hani.co.kr/arti/politics/bluehouse/1268836.html,pos
2026-07-19 10:24,,대미투자특별법,김용범 “미국이 보낸 투자사업 분석 중… 김정관 곧 방미”,"김 실장은 ‘일본에 비해 대미투자 1호가 늦어지고 있다’는 사회자의 질문에 “일본은 법이 필요없었고, 우리는 대미투자특별법을 만들어야 했다”며 “미국도 우리가 법을 만들고, 대미투자공사를 설립하고, 사람을...",https://www.hani.co.kr/arti/politics/bluehouse/1268836.html,pos
2026-07-19 10:23,,포스코 전기로,경북 에너지 수도 그 이후 '전력의 땅에서 산업의 땅으로',울진 수소산단·경주 SMR산단·포항 AI데이터센터 등 '전기를 만드는 땅'에서 '전기로 먹고사는 땅'으로의... 수소에너지고속도로는 포스코에서 영덕을 거쳐 울진으로 이어지는 133km 길이의 수소배관망을 2026년부터...,https://www.imaeil.com/page/view/2026062909431955176,pos
2026-07-19 10:23,,포스코 전기로,[전기 메카 경북] 경북 에너지 수도 그 이후 '전력의 땅에서 산업의 땅...,울진 수소산단·경주 SMR산단·포항 AI데이터센터 등 '전기를 만드는 땅'에서 '전기로 먹고사는 땅'으로의... 수소에너지고속도로는 포스코에서 영덕을 거쳐 울진으로 이어지는 133km 길이의 수소배관망을 2026년부터...,https://www.imaeil.com/page/view/2026062909431955176,pos
2026-07-19 10:09,노컷뉴스,포스코인터내셔널,"女 실업 탁구 포스코인터내셔널, 대통령기까지 2주 연속 정상…남자부는...",제42회 대통령기 전국탁구대회에서 포스코인터내셔널이 여자 실업 최강을 확인했다. 전혜경 감독이 이끄는 포스코인터내셔널은 18일 경북 경주실내체육관에서 열린 대회 여자 일반부 단체전 결승에서 삼성생명을...,https://www.nocutnews.co.kr/news/6549807?utm_source=naver&utm_medium=article&utm_campaign=20260719100823,pos
2026-07-19 10:00,,포스코이앤씨,"LG전자, 현대건설과 압구정 7000세대에 가전 구독…건설 B2B 공략","LG전자는 이미 포스코이앤씨의 주거 브랜드 '더샵'에 씽큐 온을 공급하는 등 아파트 맞춤형 AI홈 사업을 확대하고 있다. 가전과 조명·냉난방 기기뿐 아니라 엘리베이터 호출과 공동현관 출입, 단지 시설 이용 등을...",http://www.4th.kr/news/articleView.html?idxno=2114910,pos
